"1012.0548","Vida Dujmovic","Vida Dujmovic and Stefan Langerman","A Center Transversal Theorem for Hyperplanes and Applications to Graph
  Drawing",,,,,"cs.CG","http://arxiv.org/licenses/nonexclusive-distrib/1.0/","  Motivated by an open problem from graph drawing, we study several
partitioning problems for line and hyperplane arrangements. We prove a
ham-sandwich cut theorem: given two sets of n lines in R^2, there is a line l
such that in both line sets, for both halfplanes delimited by l, there are
n^{1/2} lines which pairwise intersect in that halfplane, and this bound is
tight; a centerpoint theorem: for any set of n lines there is a point such that
for any halfplane containing that point there are (n/3)^{1/2} of the lines
which pairwise intersect in that halfplane. We generalize those results in
higher dimension and obtain a center transversal theorem, a same-type lemma,
and a positive portion Erdos-Szekeres theorem for hyperplane arrangements. This
is done by formulating a generalization of the center transversal theorem which
applies to set functions that are much more general than measures. Back to
Graph Drawing (and in the plane), we completely solve the open problem that
motivated our search: there is no set of n labelled lines that are universal
for all n-vertex labelled planar graphs. As a side note, we prove that every
set of n (unlabelled) lines is universal for all n-vertex (unlabelled) planar
graphs.
","[{""version"":""v1"",""created"":""Thu, 2 Dec 2010 19:36:51 GMT""},{""version"":""v2"",""created"":""Wed, 22 Aug 2012 18:06:03 GMT""}]","2015-03-17"
"1012.0549","Andrei Linde","Vittoria Demozzi, Andrei Linde and Viatcheslav Mukhanov","Supercurvaton","17 pages, 1 figure. Non-perturbative effects related to
  non-gaussianity in the curvaton scenario are discussed, some references are
  added. This is the version accepted in JCAP",,"10.1088/1475-7516/2011/04/013",,"hep-th astro-ph.CO gr-qc hep-ph","http://arxiv.org/licenses/nonexclusive-distrib/1.0/","  We discuss observational consequences of the curvaton scenario, which
naturally appears in the context of the simplest model of chaotic inflation in
supergravity. The non-gaussianity parameter f_NL in this scenario can take
values in the observationally interesting range from O(10) to O(100). These
values may be different in different parts of the universe. The regions where
f_NL is particularly large form a curvaton web resembling a net of thick domain
walls, strings, or global monopoles.
","[{""version"":""v1"",""created"":""Thu, 2 Dec 2010 19:38:13 GMT""},{""version"":""v2"",""created"":""Tue, 8 Mar 2011 04:38:14 GMT""},{""version"":""v3"",""created"":""Mon, 11 Apr 2011 00:33:47 GMT""}]","2015-05-20"
"1012.0550","Joseph A. Wolf","Gestur Olafsson, Joseph A. Wolf","Extension of Symmetric Spaces and Restriction of Weyl Groups and
  Invariant Polynomials","To appear in Contemporary Mathematics",,,,"math.RT","http://arxiv.org/licenses/nonexclusive-distrib/1.0/","  Polynomial invariants are fundamental objects in analysis on Lie groups and
symmetric spaces. Invariant differential operators on symmetric spaces are
described by Weyl group invariant polynomial. In this article we give a simple
criterion that ensure that the restriction of invariant polynomials to
subspaces is surjective. In another paper we will apply our criterion to
problems in Fourier analysis on projective/injective limits, specifically to
theorems of Paley--Wiener type.
","[{""version"":""v1"",""created"":""Thu, 2 Dec 2010 19:46:15 GMT""}]","2010-12-06"
"1012.0551","Bob Holdom","B. Holdom","From confinement to dark energy","12 pages, 3 figures","Phys.Lett.B697:351-356,2011","10.1016/j.physletb.2011.02.024",,"hep-ph astro-ph.CO hep-lat","http://arxiv.org/licenses/nonexclusive-distrib/1.0/","  The infrared divergence of the self-energy of a color charge is due to an
enhancement of the long wavelength modes of the color Coulomb potential field.
There are also long wavelength contributions to the QCD vacuum energy that are
similarly enhanced. Vacuum modes of Hubble scale wavelengths may be affected in
a cosmological setting and this can lead to a residual positive energy density
of the form $H^d\Lambda_{\rm QCD}^{4-d}$. Lattice studies constrain $d$. If the
dark energy takes this form then the universe is driven towards de Sitter
expansion, and we briefly study this cosmology when $d$ is just slightly above
unity.
","[{""version"":""v1"",""created"":""Thu, 2 Dec 2010 19:46:22 GMT""},{""version"":""v2"",""created"":""Tue, 8 Feb 2011 20:09:11 GMT""},{""version"":""v3"",""created"":""Thu, 24 Feb 2011 18:05:55 GMT""}]","2011-04-28"
"1012.0552","Andrew Larkoski","Andrew J. Larkoski, Michael E. Peskin","Top Quark Amplitudes with an Anomalous Magnetic Moment","24 pages, 3 figures","Phys.Rev.D83:034012,2011","10.1103/PhysRevD.83.034012","SLAC-PUB-14320","hep-ph hep-th","http://arxiv.org/licenses/nonexclusive-distrib/1.0/","  The anomalous magnetic moment of the top quark may be measured during the
first run of the LHC at 7 TeV. For these measurements, it will be useful to
have available tree amplitudes with ttbar and arbitrarily many photons and
gluons, including both QED and color anomalous magnetic moments. In this paper,
we present a method for computing these amplitudes using the
Britto-Cachazo-Feng-Witten (BCFW) recursion formula. Because we deal with an
effective theory with higher-dimension couplings, there are roadblocks to a
direct computation with the BCFW method. We evade these by using an auxiliary
scalar theory to compute a subset of the amplitudes.
","[{""version"":""v1"",""created"":""Thu, 2 Dec 2010 19:49:58 GMT""},{""version"":""v2"",""created"":""Wed, 5 Jan 2011 19:26:33 GMT""}]","2011-02-18"
"1012.0553","Stanley J. Brodsky","Stanley J. Brodsky","New Perspectives for QCD Physics at the LHC","Invited talk, presented at the 5th Workshop on High P_T Physics at
  the LHC held at the Instituto de Ciencias Nucleares of the Universidad
  National Automata de Mexico in Mexico City, September 27-October 1, 2010","AIP Conf.Proc.1348:11-34,2011","10.1063/1.3579428","SLAC-PUB-14302","hep-ph hep-th","http://arxiv.org/licenses/nonexclusive-distrib/1.0/","  I review a number of topics where conventional wisdom relevant to hadron
physics at the LHC has been challenged. For example, the initial-state and
final-state interactions of the quarks and gluons entering perturbative QCD
hard-scattering subprocesses lead to the breakdown of traditional concepts of
factorization and universality for transverse-momentum-dependent observables at
leading twist. These soft-gluon rescattering effect produce single-spin
asymmetries, the breakdown of the Lam-Tung relation in Drell-Yan reactions, as
well as diffractive deep inelastic scattering, The antishadowing of nuclear
structure functions is predicted to depend on the flavor quantum numbers of
each quark and antiquark. Isolated hadrons can be produced at large transverse
momentum directly within a hard higher-twist QCD subprocess, rather than from
jet fragmentation, even at the LHC. Such ""direct"" processes can explain the
observed deviations from pQCD predictions of the power-law fall-off of
inclusive hadron cross sections as well as the ""baryon anomaly"" seen in
high-centrality heavy-ion collisions at RHIC. The intrinsic charm contribution
to the proton structure function at high x can explain the large rate for high
p_T photon plus charm-jet events observed at the Tevatron and imply a large
production rate for charm and bottom jets at high p_T at the LHC, as well as a
novel mechanism for Higgs and Z^0 production at high x_F. The light-front
wavefunctions derived in AdS/QCD can be used to calculate jet hadronization at
the amplitude level. The elimination of the renormalization scale ambiguity for
the QCD coupling using the scheme-independent BLM method will increase the
sensitivity of searches for new physics at the LHC. The implications of
""in-hadron condensates"" for the QCD contribution to the cosmological constant
are also discussed.
","[{""version"":""v1"",""created"":""Thu, 2 Dec 2010 19:52:38 GMT""}]","2015-03-17"
"1012.0554","Scott Snyder","Scott Snyder (for the ATLAS Collaboration)","Electron and Photon Performance and Electron p_T Spectrum Measurement
  with ATLAS in pp Collisions at sqrt(s) = 7 TeV","4 pages, 6 figures. To be published in the proceedings of the 35th
  International Conference of High Energy Physics, July 22-28, 2010, Paris,
  France","PoS ICHEP2010:024,2010",,"ATL-PHYS-PROC-2010-133","hep-ex","http://arxiv.org/licenses/nonexclusive-distrib/1.0/","  We discuss the early performance of the reconstruction of electrons and
photons at ATLAS with a center-of-mass energy of 7 TeV. Using a data sample of
about 15 nb^-1, we present a measurement of the transverse momentum
distribution of inclusive electrons, as well as an observation of prompt
photons and a measurement of the purity of this sample. We also demonstrate the
reconstruction of J/psi mesons with a data sample of 78 nb^-1.
","[{""version"":""v1"",""created"":""Thu, 2 Dec 2010 20:00:49 GMT""}]","2019-08-13"
"1012.0555","Huichao Song","Huichao Song (LBNL & Ohio State), Steffen A. Bass (Duke U.) and Ulrich
  W. Heinz (Ohio State)","Viscous QCD matter in a hybrid hydrodynamic+Boltzmann approach","17 pages (incl. 15 figures), references updated, typos corrected. To
  appear in Physical Review C","Phys.Rev.C83:024912,2011","10.1103/PhysRevC.83.024912",,"nucl-th hep-ph","http://arxiv.org/licenses/nonexclusive-distrib/1.0/","  A hybrid transport approach for the bulk evolution of viscous QCD matter
produced in ultra-relativistic heavy-ion collisions is presented. The expansion
of the dense deconfined phase of the reaction is modeled with viscous
hydrodynamics while the dilute late hadron gas stage is described
microscopically by the Boltzmann equation. The advantages of such a hybrid
approach lie in the improved capability of handling large dissipative
corrections in the late dilute phase of the reaction, including a realistic
treatment of the non-equilibrium hadronic chemistry and kinetic freeze-out. By
varying the switching temperature at which the hydrodynamic output is converted
to particles for further propagation with the Boltzmann cascade we test the
ability of the macroscopic hydrodynamic approach to emulate the microscopic
evolution during the hadronic stage and extract the temperature dependence of
the effective shear viscosity of the hadron resonance gas produced in the
collision. We find that the extracted values depend on the prior hydrodynamic
history and hence do not represent fundamental transport properties of the
hadron resonance gas. We conclude that viscous fluid dynamics does not provide
a faithful description of hadron resonance gas dynamics with predictive power,
and that both components of the hybrid approach are needed for a quantitative
description of the fireball expansion and its freeze-out.
","[{""version"":""v1"",""created"":""Thu, 2 Dec 2010 20:00:53 GMT""},{""version"":""v2"",""created"":""Fri, 28 Jan 2011 19:56:42 GMT""}]","2015-03-17"
"1012.0556","Lane A. Hemaspaandra","Lane A. Hemaspaandra","A Note on Nonuniform versus Uniform ACC^k Circuits for NE",,,,"URCS-TR-2010-964","cs.CC","http://arxiv.org/licenses/nonexclusive-distrib/1.0/","  We note that for each k \in {0,1,2, ...} the following holds: NE has
(nonuniform) ACC^k circuits if and only if NE has P^{NE}-uniform ACC^k
circuits. And we mention how to get analogous results for other circuit and
complexity classes.
","[{""version"":""v1"",""created"":""Thu, 2 Dec 2010 20:01:54 GMT""},{""version"":""v2"",""created"":""Fri, 3 Dec 2010 07:21:21 GMT""}]","2010-12-06"
"1012.0557","Andrey Rumyantsev","Andrey Rumyantsev","Infinite computable version of Lovasz Local Lemma",,,,,"cs.DS cs.DM math.PR","http://arxiv.org/licenses/nonexclusive-distrib/1.0/","  Lov\'asz Local Lemma (LLL) is a probabilistic tool that allows us to prove
the existence of combinatorial objects in the cases when standard probabilistic
argument does not work (there are many partly independent conditions).
  LLL can be also used to prove the consistency of an infinite set of
conditions, using standard compactness argument (if an infinite set of
conditions is inconsistent, then some finite part of it is inconsistent, too,
which contradicts LLL). In this way we show that objects satisfying all the
conditions do exist (though the probability of this event equals~$0$). However,
if we are interested in finding a computable solution that satisfies all the
constraints, compactness arguments do not work anymore.
  Moser and Tardos recently gave a nice constructive proof of LLL. Lance
Fortnow asked whether one can apply Moser--Tardos technique to prove the
existence of a computable solution. We show that this is indeed possible (under
almost the same conditions as used in the non-constructive version).
","[{""version"":""v1"",""created"":""Thu, 2 Dec 2010 20:11:02 GMT""}]","2010-12-03"
"1012.0559","David Blaschke","S.A. Smolyansky, D.B. Blaschke, A.V. Chertilin, G. Roepke, A.V.
  Tarakanov","Role of vacuum polarization for the annihilation channel in a strong
  laser field","6 pages",,,,"physics.plasm-ph hep-ph","http://arxiv.org/licenses/nonexclusive-distrib/1.0/","  We consider vacuum polarization effects in the one-photon annihilation
channel within a kinetic description of the e+ e- plasma produced from the
vacuum in the focal spot of counter-propagating laser beams. This entails
essential changes in the structure of the photon kinetic equation. We
investigate the domain of large adiabaticity parameters gamma >> 1 where the
photon radiation turns out to be very small. A more thorough examination of the
domain gamma < 1 needs separate investigation. However, an exploratory study
has shown that the one-photon annihilation channel can lead for some domains of
laser field parameters (e.g., for the XFEL) to contributions accessible for
observation.
","[{""version"":""v1"",""created"":""Thu, 2 Dec 2010 20:33:28 GMT""}]","2010-12-03"
"1012.0560","Benjamin Balsam","Benjamin Balsam","Turaev-Viro invariants as an extended TQFT III","19 pages, many figures. Added explanation of equivalence of theories
  for extended 3-manifolds and added description of TV theory for manifolds
  with embedded ribbon graphs",,,,"math.QA","http://arxiv.org/licenses/nonexclusive-distrib/1.0/","  In the third paper in this series, we examine the Reshetikhin-Turaev and
Turaev-Viro TQFTs at the level of surfaces. In particular, we show that for a
closed surface $\Sigma$, $Z_{TV, \mathcal{C}}(\Sigma) \cong Z_{RT,
Z(\C)}(\Sigma)$, thus extending the equality of 3-manifold invariants proved in
an earlier paper to an equivalence of TQFTs. We also describe how to compute
Turaev-Viro state sums for 3-manifolds with embedded ribbon graphs.
","[{""version"":""v1"",""created"":""Thu, 2 Dec 2010 20:37:11 GMT""},{""version"":""v2"",""created"":""Tue, 30 Aug 2011 18:25:52 GMT""}]","2011-08-31"
"1012.0561","Jay Deep  Sau","Jay D. Sau, D. J. Clarke and S. Tewari","Controlling non-Abelian statistics of Majorana fermions on Majorana
  dimer lattices","Final version with 8 pages, 5 figures. A companion paper,
  arXiv:1012.0296, discusses Majorana exchange through a general junction of
  three wire segments","Phys. Rev. B 84, 094505 (2011)","10.1103/PhysRevB.84.094505",,"cond-mat.mes-hall cond-mat.supr-con","http://arxiv.org/licenses/nonexclusive-distrib/1.0/","  Under appropriate external conditions a semiconductor nanowire in proximity
to an s-wave superconductor can be in a topological superconducting (TS) phase.
This phase supports localized zero-energy Majorana fermions at the ends of the
wire. However, the non-Abelian exchange statistics of Majorana fermions is
difficult verify because of the one-dimensional topology of such wires. In this
paper we propose a scheme to transport Majorana fermions between the ends of
different wires using tunneling, which is shown to be controllable by gate
voltages. Such tunneling-generated hops of Majorana fermions can be used to
exchange the Majorana fermions. The exchange process thus obtained is described
by a non-Abelian braid operator that is uniquely determined by the
well-controlled microscopic tunneling parameters.
","[{""version"":""v1"",""created"":""Thu, 2 Dec 2010 20:41:37 GMT""},{""version"":""v2"",""created"":""Wed, 22 Dec 2010 14:58:15 GMT""},{""version"":""v3"",""created"":""Tue, 27 Sep 2011 20:11:23 GMT""}]","2011-09-29"
"1012.0562","Ronald Babich","Ronald Babich, Richard C. Brower, Michael A. Clark, George T. Fleming,
  James C. Osborn, Claudio Rebbi, David Schaich","Exploring strange nucleon form factors on the lattice","19 pages, 11 figures; v2 includes additional references; v3 as
  appears in PRD","Phys. Rev. D 85, 054510 (2012)","10.1103/PhysRevD.85.054510",,"hep-lat","http://arxiv.org/licenses/nonexclusive-distrib/1.0/","  We discuss techniques for evaluating sea quark contributions to hadronic form
factors on the lattice and apply these to an exploratory calculation of the
strange electromagnetic, axial, and scalar form factors of the nucleon. We
employ the Wilson gauge and fermion actions on an anisotropic 24^3 x 64
lattice, probing a range of momentum transfer with Q^2 < 1 GeV^2. The strange
electric and magnetic form factors, G_E^s(Q^2) and G_M^s(Q^2), are found to be
small and consistent with zero within the statistics of our calculation. The
lattice data favor a small negative value for the strange axial form factor
G_A^s(Q^2) and exhibit a strong signal for the bare strange scalar matrix
element <N|ss|N>_0. We discuss the unique systematic uncertainties affecting
the latter quantity relative to the continuum, as well as prospects for
improving future determinations with Wilson-like fermions.
","[{""version"":""v1"",""created"":""Thu, 2 Dec 2010 20:46:44 GMT""},{""version"":""v2"",""created"":""Wed, 4 May 2011 17:30:06 GMT""},{""version"":""v3"",""created"":""Tue, 22 May 2012 16:39:37 GMT""}]","2012-05-23"
"1012.0563","J. Y. Vaishnav","J. Y. Vaishnav, Justin Q. Anderson, Jamie D. Walls","Intravalley Multiple Scattering of Quasiparticles in Graphene",,"Phys. Rev. B 83, 165437 (2011)","10.1103/PhysRevB.83.165437",,"cond-mat.mes-hall quant-ph","http://arxiv.org/licenses/nonexclusive-distrib/1.0/","  We develop a theoretical description of intravalley scattering of
quasiparticles in graphene from multiple short-range scatterers of size much
greater than the carbon-carbon bond length. Our theory provides a method to
rapidly calculate the Green's function in graphene for arbitrary configurations
of scatterers. We demonstrate that non-collinear multiple scattering
trajectories generate pseudospin rotations that alter quasiparticle
interference, resulting in significant modifications to the shape, intensity,
and pattern of the interference fringes in the local density of states (LDOS).
We illustrate these effects via theoretical calculations of the LDOS for a
variety of scattering configurations in single layer graphene. A clear
understanding of impurity scattering in graphene is a step towards exploiting
graphene's unique properties to build future devices.
","[{""version"":""v1"",""created"":""Thu, 2 Dec 2010 20:47:51 GMT""},{""version"":""v2"",""created"":""Sat, 28 May 2011 22:31:59 GMT""}]","2015-03-17"
"1012.0564","Marc Vanderhaeghen","Julia Guttmann, Nikolai Kivel, Mehdi Meziane, Marc Vanderhaeghen","Determination of two-photon exchange amplitudes from elastic
  electron-proton scattering data","4 pages, 5 figures, updated error analysis",,"10.1140/epja/i2011-11077-4",,"hep-ph","http://arxiv.org/licenses/nonexclusive-distrib/1.0/","  Using the available cross section and polarization data for elastic
electron-proton scattering, we provide an extraction of the two-photon exchange
amplitudes at a common value of four-momentum transfer, around Q^2 = 2.5 GeV^2.
This analysis also predicts the e^+ p / e^- p elastic scattering cross section
ratio, which will be measured by forthcoming experiments.
","[{""version"":""v1"",""created"":""Thu, 2 Dec 2010 20:51:12 GMT""},{""version"":""v2"",""created"":""Sun, 27 Feb 2011 21:46:24 GMT""}]","2015-05-20"
"1012.0565","Mark Friesen","Yun-Pil Shim, Sangchul Oh, Xuedong Hu, and Mark Friesen","Controllable anisotropic exchange coupling between spin qubits in
  quantum dots","4 pages with 3 figures","Phys. Rev. Lett. 106, 180503 (2011)","10.1103/PhysRevLett.106.180503",,"cond-mat.mes-hall quant-ph","http://arxiv.org/licenses/nonexclusive-distrib/1.0/","  The exchange coupling between quantum dot spin qubits is isotropic, which
restricts the types of quantum gates that can be formed. Here, we propose a
method for controlling anisotropic interactions between spins arranged in a bus
geometry. The symmetry is broken by an external magnetic field, resulting in
XXZ-type interactions that can efficiently generate Greenberger-Horne-Zeilinger
(GHZ) states or universal gate sets for exchange-only quantum computing.
Analysis of the bus ground state provides a link between quantum critical
phenomena and the communication capacity.
","[{""version"":""v1"",""created"":""Thu, 2 Dec 2010 20:51:53 GMT""},{""version"":""v2"",""created"":""Mon, 14 Nov 2011 17:34:47 GMT""}]","2013-08-26"
"1012.0566","Ewan Cameron Dr","Ewan Cameron","On the Estimation of Confidence Intervals for Binomial Population
  Proportions in Astronomy: The Simplicity and Superiority of the Bayesian
  Approach","13 pages, 6 figures, accepted for publication in PASA",,"10.1071/AS10046",,"astro-ph.IM physics.data-an","http://arxiv.org/licenses/nonexclusive-distrib/1.0/","  I present a critical review of techniques for estimating confidence intervals
on binomial population proportions inferred from success counts in
small-to-intermediate samples. Population proportions arise frequently as
quantities of interest in astronomical research; for instance, in studies
aiming to constrain the bar fraction, AGN fraction, SMBH fraction, merger
fraction, or red sequence fraction from counts of galaxies exhibiting distinct
morphological features or stellar populations. However, two of the most
widely-used techniques for estimating binomial confidence intervals--the
'normal approximation' and the Clopper & Pearson approach--are liable to
misrepresent the degree of statistical uncertainty present under sampling
conditions routinely encountered in astronomical surveys, leading to an
ineffective use of the experimental data (and, worse, an inefficient use of the
resources expended in obtaining that data). Hence, I provide here an overview
of the fundamentals of binomial statistics with two principal aims: (i) to
reveal the ease with which (Bayesian) binomial confidence intervals with more
satisfactory behaviour may be estimated from the quantiles of the beta
distribution using modern mathematical software packages (e.g. R, matlab,
mathematica, IDL, python); and (ii) to demonstrate convincingly the major flaws
of both the 'normal approximation' and the Clopper & Pearson approach for error
estimation.
","[{""version"":""v1"",""created"":""Thu, 2 Dec 2010 21:00:01 GMT""},{""version"":""v2"",""created"":""Thu, 10 Feb 2011 16:03:40 GMT""},{""version"":""v3"",""created"":""Tue, 1 Mar 2011 22:46:38 GMT""}]","2015-05-20"
"1012.0567","Hagai B. Perets","Hagai B. Perets","Binary planetesimals and their role in planet formation","Accepted to ApJL",,"10.1088/2041-8205/727/1/L3",,"astro-ph.EP","http://arxiv.org/licenses/nonexclusive-distrib/1.0/","  One of the main evolutionary stages of planet formation is the dynamical
evolution of planetesimal disks. These disks are thought to evolve through
gravitational encounters and physical collisions between single planetesimals.
In recent years, many binary planetesimals have been observed in the Solar
system, indicating that the binarity of planetesimals is high. However, current
studies of planetesimal disks formation and evolution do not account for the
role of binaries. Here we point out that gravitational encounters of binary
planetesimals can have an important role in the evolution of planetesimal
disks. Binary planetesimals catalyze close encounters between planetesimals,
and can strongly enhance their collision rate. Binaries may also serve as
additional heating source of the planetesimal disk, through the exchange of the
binaries gravitational potential energy into the kinetic energy of
planetesimals in the disk.
","[{""version"":""v1"",""created"":""Thu, 2 Dec 2010 21:00:03 GMT""}]","2015-05-20"
"1012.0568","Yukinori Sasagawa","Kei-ichi Maeda, Nobuyoshi Ohta, Yukinori Sasagawa","AdS Black Hole Solution in Dilatonic Einstein-Gauss-Bonnet Gravity","14 pages, 9 figures, 7 tables","Phys.Rev.D83:044051,2011","10.1103/PhysRevD.83.044051","WU-AP/308/10, KU-TP 049","hep-th gr-qc","http://arxiv.org/licenses/nonexclusive-distrib/1.0/","  We find that AdS spacetime with a non-trivial linear dilaton field is an
exact solution in the effective action of string theory, which is described by
gravity with the Gauss-Bonnet curvature terms coupled to a dilaton field in the
string frame. The AdS radius is determined by the spacetime dimensions and the
coupling constants of curvature corrections. We also construct the
asymptotically AdS black hole solutions with a linear dilaton field
numerically. We discuss the thermodynamical properties of those solutions.
Extending the model to the case with the even-order higher Lovelock curvature
terms, we also find the exact AdS spacetime with non-trivial dilaton. We
further find a cosmological solution with a bounce of three space and a
solitonic solution with a non-trivial dilaton field, which is regular
everywhere and approaches an asymptotically AdS spacetime.
","[{""version"":""v1"",""created"":""Thu, 2 Dec 2010 21:00:04 GMT""},{""version"":""v2"",""created"":""Tue, 1 Mar 2011 21:27:30 GMT""}]","2015-03-17"
