"1012.0622","Keiji Saito","Keiji Saito and Abhishek Dhar","Generating Function Formula of Heat Transfer in Harmonic Networks","5 pages, 1 figure","Phys. Rev. E vol.83 041121 (2011)","10.1103/PhysRevE.83.041121",,"cond-mat.stat-mech","http://arxiv.org/licenses/nonexclusive-distrib/1.0/","  We consider heat transfer across an arbitrary harmonic network connected to
two heat baths at different temperatures. The network has $N$ positional
degrees of freedom, of which $N_L$ are connected to a bath at temperature $T_L$
and $N_R$ are connected to a bath at temperature $T_R$. We derive an exact
formula for the cumulant generating function for heat transfer between the two
baths. The formula is valid even for $N_L \ne N_R$ and satisfies the
Gallavotti-Cohen fluctuation symmetry. Since harmonic crystals in three
dimensions are known to exhibit different regimes of transport such as
ballistic, anomalous and diffusive, our result implies validity of the
fluctuation theorem in all regimes. Our exact formula provides a powerful tool
to study other properties of nonequilibrium current fluctuations.
","[{""version"":""v1"",""created"":""Fri, 3 Dec 2010 02:05:51 GMT""},{""version"":""v2"",""created"":""Wed, 15 Jun 2011 08:56:20 GMT""}]","2015-05-20"
"1012.0623","Venkat Chandrasekaran","Venkat Chandrasekaran, Pablo A. Parrilo, Alan S. Willsky","Convex Graph Invariants",,"SIAM Review, 54(3), pp. 513-541, 2012","10.1137/100816900",,"math.OC cs.DM math.CO","http://arxiv.org/licenses/nonexclusive-distrib/1.0/","  The structural properties of graphs are usually characterized in terms of
invariants, which are functions of graphs that do not depend on the labeling of
the nodes. In this paper we study convex graph invariants, which are graph
invariants that are convex functions of the adjacency matrix of a graph. Some
examples include functions of a graph such as the maximum degree, the MAXCUT
value (and its semidefinite relaxation), and spectral invariants such as the
sum of the $k$ largest eigenvalues. Such functions can be used to construct
convex sets that impose various structural constraints on graphs, and thus
provide a unified framework for solving a number of interesting graph problems
via convex optimization. We give a representation of all convex graph
invariants in terms of certain elementary invariants, and describe methods to
compute or approximate convex graph invariants tractably. We also compare
convex and non-convex invariants, and discuss connections to robust
optimization. Finally we use convex graph invariants to provide efficient
convex programming solutions to graph problems such as the deconvolution of the
composition of two graphs into the individual components, hypothesis testing
between graph families, and the generation of graphs with certain desired
structural properties.
","[{""version"":""v1"",""created"":""Fri, 3 Dec 2010 02:07:34 GMT""}]","2012-09-21"
"1012.0624","Chitta Ranjan Das","C.R. Das, L.V. Laperashvili and A. Tureanu","Superstring-Inspired E_6 Unification, Shadow Theta-Particles and
  Cosmology","7 pages","Phys.Part.Nucl.41:965-968,2010","10.1134/S1063779610060316","CFTP/10-015","hep-ph astro-ph.CO hep-th","http://arxiv.org/licenses/nonexclusive-distrib/1.0/","  We construct a new cosmological model considering the superstring-inspired
E_6 unification in the 4-dimensional space at the early stage of the Universe.
We develop a concept of parallel existence in Nature of the ordinary and shadow
worlds with different cosmological evolutions.
","[{""version"":""v1"",""created"":""Fri, 3 Dec 2010 02:08:59 GMT""}]","2011-09-21"
"1012.0625","Shuji Deguchi","S. Deguchi, K. Koike, N. Kuno, N. Matsunaga, J. Nakashima, and S.
  Takahashi","SiO Maser Spectra of V407 Cyg after the 2010 March Nova Outburst","1 table, 3 figures; PASJ 63 no.1 (2011 Feb. 25 issue) in press.
  Available online at http://www.nro.nao.ac.jp/~lib_pub/report/data/no677.pdf",,"10.1093/pasj/63.1.309","NRO report no. 677","astro-ph.SR","http://arxiv.org/licenses/nonexclusive-distrib/1.0/","  We report on the time variation of SiO maser emission from the symbiotic
stellar system V407 Cyg after the classical nova outburst on 2010 March 10.
Although both the SiO $J=1$--0 $v=1$ and 2 lines at 43.122 and 42.821 GHz were
found previously in the envelope of a mira in the binary system, only weak
emission of the $J=1$--0 $v=2$ line has continuously been detectable after the
nova outburst. The line profile exhibited a dramatic change several weeks after
the burst; the component on the higher-velocity side of the systemic velocity
disappeared two weeks after the burst, and a new persistent component appeared
on the lower-velocity side later. These observations indicate that the SiO
emitting regions are wiped out in a time scale of two weeks by the nova shock,
but a part of the masing region is quickly replenished by cool molecular gases
expelled by the mira pulsation.
","[{""version"":""v1"",""created"":""Fri, 3 Dec 2010 02:33:38 GMT""}]","2015-05-20"
"1012.0626","Yue-Liang Wu","Yong Tang, Yue-Liang Wu (KITPC, SKLTP, ITP-CAS)","Quantum Gravitational Contributions to Gauge Field Theories","17 pages, published version, emphasis on the proper treatment of
  quadratic divergence in the quantum gravitational computation, regularization
  dependence is clarified in comparison with other calculations, references
  added","Commun. Theor. Phys. 57, 629(2012)","10.1088/0253-6102/57/4/19",,"hep-ph hep-th","http://arxiv.org/licenses/nonexclusive-distrib/1.0/","  We revisit quantum gravitational contributions to quantum gauge field
theories in the gauge condition independent Vilkovisky-DeWitt formalism based
on the background field method. With the advantage of Landau-DeWitt gauge, we
explicitly obtain the gauge condition independent result for the quadratically
divergent gravitational corrections to gauge couplings. By employing, in a
general way, a scheme-independent regularization method that can preserve both
gauge invariance and original divergent behavior of integrals, we show that the
resulting gauge coupling is power-law running and asymptotically free. The
regularization scheme dependence is clarified by comparing with results
obtained by other methods. The loop regularization scheme is found to be
applicable for a consistent calculation.
","[{""version"":""v1"",""created"":""Fri, 3 Dec 2010 02:39:39 GMT""},{""version"":""v2"",""created"":""Thu, 23 Dec 2010 16:35:35 GMT""},{""version"":""v3"",""created"":""Fri, 3 Feb 2012 05:12:14 GMT""}]","2012-04-25"
"1012.0627","Sergey Porsev","S.G. Porsev, J.S.M. Ginges, and V.V. Flambaum","The atomic electric dipole moment induced by the nuclear electric dipole
  moment; the magnetic moment effect","8 pages 1) Some typos are corrected. 2) A comparison of contributions
  to the atomic EDM due to the nuclear EDM and the nuclear Schiff moment is
  added",,"10.1103/PhysRevA.83.042507",,"physics.atom-ph hep-ph nucl-th","http://arxiv.org/licenses/nonexclusive-distrib/1.0/","  We have considered a mechanism for inducing a time-reversal violating
electric dipole moment (EDM) in atoms through the interaction of a nuclear EDM
(d_N) with the hyperfine interaction, the ""magnetic moment effect"". We have
derived the operator for this interaction and presented analytical formulas for
the matrix elements between atomic states. Induced EDMs in the diamagnetic
atoms 129Xe, 171Yb, 199Hg, 211Rn, and 225Ra have been calculated numerically.
From the experimental limits on the atomic EDMs of 129Xe and 199Hg, we have
placed the following constraints on the nuclear EDMs, |d_N(129Xe)|< 1.1 *
10^{-21} |e|cm and |d_N(199Hg)|< 2.8 * 10^{-24} |e|cm.
","[{""version"":""v1"",""created"":""Fri, 3 Dec 2010 02:46:52 GMT""},{""version"":""v2"",""created"":""Wed, 2 Mar 2011 22:27:51 GMT""}]","2015-05-20"
"1012.0628","Bjorn Poonen","Bjorn Poonen","Smooth hypersurface sections containing a given subscheme over a finite
  field","7 pages. This paper appeared a few years ago. (I'm posting it in
  response to a request for the TeX file.)","Math. Research Letters, 15 (2008), no. 2, 265-271","10.4310/MRL.2008.v15.n2.a5",,"math.AG math.NT","http://arxiv.org/licenses/nonexclusive-distrib/1.0/","  We use the ""closed point sieve"" to prove a variant of a Bertini theorem over
finite fields. Specifically, given a smooth quasi-projective subscheme X of P^n
of dimension m over F_q, and a closed subscheme Z in P^n such that Z intersect
X is smooth of dimension l, we compute the fraction of homogeneous polynomials
vanishing on Z that cut out a smooth subvariety of X. The fraction is positive
if m>2l.
","[{""version"":""v1"",""created"":""Fri, 3 Dec 2010 03:20:13 GMT""}]","2017-04-03"
"1012.0629","Chun-Fu Ren","Xiao-Bing Zhang, Chun-Fu Ren and Yi Zhang","Bose-Einstein condensation in strong-coupling quark color superconductor
  near flavor SU(3) limit","15 pages, 5 figures; 2nd version","Commun.Theor.Phys.55:1065-1072,2011","10.1088/0253-6102/55/6/22",,"hep-ph","http://arxiv.org/licenses/nonexclusive-distrib/1.0/","  Near the flavor SU(3) limit, we propose an analytical description for
color-flavor-locked-type Bardeen-Cooper-Schrieffer (BCS) phase in the Nambu
Jona-Lasinio (NJL) model. The diquark behaviors in light-flavor and
strange-flavor-involved channels and Bose-Einstein condensation (BEC) of bound
diquark states are studied. When the attractive interaction between quarks is
strong enough, a BCS-BEC crossover is predicted in the environment with
color-flavor-locked pairing pattern. The resulting Bose-Einstein condensed
phase is found to be an intergrade phase before the emergence of the
previous-predicted BEC phase in two-flavor quark superconductor.
","[{""version"":""v1"",""created"":""Fri, 3 Dec 2010 03:33:18 GMT""},{""version"":""v2"",""created"":""Sun, 23 Jan 2011 03:13:10 GMT""}]","2015-03-17"
"1012.0630","Colin Teo","Colin Teo and Valerio Scarani","Lenses as an Atom-Photon Interface: A Semiclassical Model",,"Opt. Comm. 284 (2011), pp. 4485-4490","10.1016/j.optcom.2011.05.065",,"quant-ph physics.atom-ph","http://arxiv.org/licenses/nonexclusive-distrib/1.0/","  Strong interaction between the light field and an atom is often achieved with
cavities. Recent experiments have used a different configuration: a propagating
light field is strongly focused using a system of lenses, the atom being
supposed to sit at the focal position. In reality, this last condition holds
only up to some approximation; in particular, at any finite temperature, the
atom position fluctuates. We present a formalism that describes the focalized
field and the atom sitting at an arbitrary position. As a first application, we
show that thermal fluctuations do account for the extinction data reported in
M. K. Tey et al., Nature Physics 4, 924 (2008).
","[{""version"":""v1"",""created"":""Fri, 3 Dec 2010 03:42:39 GMT""}]","2011-08-11"
"1012.0631","Ki Seok Kim","Ki-Seok Kim (APCTP) and Shigeki Onoda (RIKEN)","Dissipationless mechanism of skyrmion Hall current in double-exchange
  ferromagnets",,,,,"cond-mat.mes-hall","http://arxiv.org/licenses/nonexclusive-distrib/1.0/","  We revisit a theory of skyrmion transport in ferromagnets. On a basis of an
effective U(1) gauge theory for spin-chirality fluctuations in double-exchange
ferromagnets, we derive an expression for the velocity of a skyrmion core
driven by the dc electric field. We find that mutual feedback effects between
conduction electrons and localized spins give rise to Chern-Simons terms,
suggesting a dissipationless mechanism for the skyrmion Hall current. A
conventional description of the current-induced skyrmion motion, appearing
through the spin transfer torque and scattering events, is reproduced in a
certain limit of our description, where the Chern-Simons terms are not fully
incorporated. Our theory is applicable to not only metallic but also insulating
systems, where the purely topological and dissipationless skyrmion Hall current
can be induced in the presence of an energy gap.
","[{""version"":""v1"",""created"":""Fri, 3 Dec 2010 03:50:09 GMT""},{""version"":""v2"",""created"":""Fri, 15 Apr 2011 05:11:22 GMT""},{""version"":""v3"",""created"":""Sat, 30 Apr 2011 03:28:34 GMT""}]","2011-05-03"
"1012.0632","Jian-Wei Xu","Jianwei Xu","Generalizations of Quantum Discord",,,"10.1088/1751-8113/44/44/445310",,"quant-ph","http://arxiv.org/licenses/nonexclusive-distrib/1.0/","  The original definition of quantum discord of bipartite states was defined
over projective measurements, in this paper we discuss some generalizations of
it. These generalizations are defined over general measurements, rank-one
general measurements or Neumark extension measurements. We investigate the
nonnegativity, zero-discord sets of all these quantum discords and some
properties about them.
","[{""version"":""v1"",""created"":""Fri, 3 Dec 2010 03:58:21 GMT""},{""version"":""v2"",""created"":""Wed, 1 Jun 2011 10:00:21 GMT""}]","2015-05-20"
"1012.0633","Lixing You","X Wang, L X You, X M Xie, X Y Yang, C T Lin and M H Jiang","Thin-film-like high temperature superconducting
  $\mathrm{Bi_2Sr_2CaCu_2O_{8+}}{_x}$ single crystal by mechanical exfoliation","8 pages, 4 figures",,,,"cond-mat.supr-con","http://arxiv.org/licenses/nonexclusive-distrib/1.0/","  Thin-film-like high temperature superconducting Bi2Sr2CaCu2O8+x single
crystals (TSB) with a typical thickness of 20-200 nm is produced by mechanical
exfoliation. The TSB, which shows excellent superconductivity, can adhere
firmly to the substrate by van der Waals force. The TSB may find important
applications in fabricating high temperature superconducting devices. Intrinsic
Josephson junctions made of the TSB are demonstrated. A very interesting
finding is that the TSB can follow exactly the topology of the substrate,
making it possible to fabricate superconducting devices with artificial
structures by using substrate template, for instance, step-edge Josephson
junctions.
","[{""version"":""v1"",""created"":""Fri, 3 Dec 2010 04:00:49 GMT""}]","2016-11-26"
"1012.0634","Radwa El Shawi","Radwa El Shawi, Joachim Gudmundsson, and Christos Levcopoulos","Quickest Path Queries on Transportation Network","16 pages, 7 figures",,,,"cs.CG","http://arxiv.org/licenses/nonexclusive-distrib/1.0/","  This paper considers the problem of finding a quickest path between two
points in the Euclidean plane in the presence of a transportation network. A
transportation network consists of a planar network where each road (edge) has
an individual speed. A traveller may enter and exit the network at any point on
the roads. Along any road the traveller moves with a fixed speed depending on
the road, and outside the network the traveller moves at unit speed in any
direction. We give an exact algorithm for the basic version of the problem:
given a transportation network of total complexity n in the Euclidean plane, a
source point s and a destination point t, and the quickest path between s and
t. We also show how the transportation network can be preprocessed in time
O(n^2 log n) into a data structure of size O(n^2) such that (1 +
\epsilon)-approximate cheapest path cost queries between any two points in the
plane can be answered in time O(1\epsilon^4 log n).
","[{""version"":""v1"",""created"":""Fri, 3 Dec 2010 04:03:46 GMT""},{""version"":""v2"",""created"":""Tue, 11 Jan 2011 10:40:59 GMT""},{""version"":""v3"",""created"":""Sun, 29 May 2011 15:13:53 GMT""}]","2015-03-17"
"1012.0635","Tetsuya Ito","Tetsuya Ito","A remark on Alexander polynomial criterion for bi-orderability of
  fibered 3-manifold groups","8 pages, no figure","Int. Math. Res. Not. IMRN (2013) 2013 (1), 156--169","10.1093/imrn/rnr264",,"math.GT math.GR","http://arxiv.org/licenses/nonexclusive-distrib/1.0/","  We observe that Clay-Rolfsen's obstruction of bi-orderability, which uses the
classical Alexander polynomial, is not strengthened by using the twisted
Alexander polynomials for finite representations unlike many known applications
of the Alexander polynomial. This is shown by studying the maximal ordered
abelian quotient of bi-ordered groups.
","[{""version"":""v1"",""created"":""Fri, 3 Dec 2010 04:06:54 GMT""}]","2015-01-30"
"1012.0636","HuaMing Wang","Wenming Hong, Huaming Wang","Intrinsic branching structure within random walk on $\mathbb{Z}$","26 pages; 7 figures; 1 table",,,,"math.PR","http://arxiv.org/licenses/nonexclusive-distrib/1.0/","  In this paper, we reveal the branching structure for a non-homogeneous random
walk with bounded jumps. The ladder time $T_1,$ the first hitting time of
$[1,\infty)$ by the walk starting from $0,$ could be expressed in terms of a
non-homogeneous multitype branching process. As an application of the branching
structure,
  we prove a law of large numbers of random walk in random environment with
bounded jumps and specify the explicit invariant density for the Markov chain
of ``the environment viewed from the particle"" .The invariant density and the
limit velocity could be expressed explicitly in terms of the environment.
","[{""version"":""v1"",""created"":""Fri, 3 Dec 2010 04:15:32 GMT""}]","2010-12-06"
"1012.0637","Giovanni Pistone","Luigi Malag\`o and Giovanni Pistone","A note on the border of an exponential family","13 pages",,,,"math.ST stat.TH","http://arxiv.org/licenses/nonexclusive-distrib/1.0/","  Limits of densities belonging to an exponential family appear in many
applications, {e.g.} Gibbs models in Statistical Physics, relaxed combinatorial
optimization, coding theory, critical likelihood computations, Bayes priors
with singular support, random generation of factorial designs. We discuss the
problem from the methodological point of view in the case of a finite state
space. We prove two characterizations of the limit distributions, both based on
a suitable description of the marginal polytope (convex hull of canonical
statistics' values). First, the set of limit densities is equal to the set of
conditional densities given a face of the marginal polytope. Second, in the
lattice case there exists a parametric presentation, in monomial form, of the
closure of the statistical model.
","[{""version"":""v1"",""created"":""Fri, 3 Dec 2010 04:22:42 GMT""}]","2010-12-06"
"1012.0638","Jin-Hong Park","Jin-Hong Park, Jung Hoon Han","Zero-temperature phases for chiral magnets in three dimensions","12 pages, 5 figures, 2 tables","Phys.Rev.B 83: 184406, 2011","10.1103/PhysRevB.83.184406",,"cond-mat.str-el","http://arxiv.org/licenses/nonexclusive-distrib/1.0/","  We calculate the energies of various multiple-spiral spin configurations for
the three-dimensional model of chiral magnets. The ground-state phase diagram
is obtained in the space of anisotropy, magnetic field, and interaction
parameters. Regimes with multiple-spiral, or spin crystal ground states of two-
and three-dimensional nature are identified. The Skyrmion number responsible
for anomalous Hall effect is examined for each spin crystal configuration. A
geometric interpretation is given for the three-dimensional spin crystal
lattice structures as the periodic arrangement of hedgehog and anti-hedgehog
singularities.
","[{""version"":""v1"",""created"":""Fri, 3 Dec 2010 04:43:57 GMT""}]","2015-05-20"
"1012.0639","Matthias Steinhauser","Alexey Pak, Matthias Steinhauser, Nikolai Zerf","Towards Higgs boson production in gluon fusion to NNLO in the MSSM","20 pages; v2: modification of discussion of numerical effect, version
  to appear in EPJC; v3: eq.(18) corrected, minor corrections","Eur.Phys.J.C71:1602,2011","10.1140/epjc/s10052-011-1602-9","SFB/CPP-10-111; TTP10-47","hep-ph","http://arxiv.org/licenses/nonexclusive-distrib/1.0/","  We consider the Higgs boson production in the gluon-fusion channel to
next-to-next-to-leading order within the Minimal Supersymmetric Standard Model.
In particular, we present analytical results for the matching coefficient of
the effective theory and study its influence on the total production cross
section in the limit where the masses of all MSSM particles coincide. For
supersymmetric masses below 500 GeV it is possible to find parameters leading
to a significant enhancement of the Standard Model cross section, the
$K$-factors, however, change only marginally.
","[{""version"":""v1"",""created"":""Fri, 3 Dec 2010 04:52:53 GMT""},{""version"":""v2"",""created"":""Wed, 23 Mar 2011 08:43:24 GMT""},{""version"":""v3"",""created"":""Thu, 28 Jun 2012 11:50:56 GMT""}]","2012-06-29"
"1012.0640","Emily Redelmeier","C. Emily I. Redelmeier","Representations of the Temperley-Lieb Algebra via a New Inner Product on
  Half-Diagrams","A slightly cleaned-up version of my master's project (Queen's
  University, 2006), unpublished",,,,"math.CO","http://arxiv.org/licenses/nonexclusive-distrib/1.0/","  We describe an inner product on the diagrams on which the Temperley-Lieb
algebra can be represented. We exhibit several constructions which are in
natural combinatorial bijection with these diagrams, which are generalizations
of various constructions counted by the Catalan numbers. We use a method
similar to the existing ones for orthogonalizing the Temperley-Lieb algebra to
construct an orthogonal basis for the vector space over these diagrams.
","[{""version"":""v1"",""created"":""Fri, 3 Dec 2010 05:08:28 GMT""},{""version"":""v2"",""created"":""Wed, 15 Dec 2010 22:02:52 GMT""}]","2015-03-17"
"1012.0641","Sachindra Naik","A. R. Rao (1), J. P. Malkar (1), M. K. Hingar (1), V. K. Agrawal
  (1,2), S. K. Chakrabarti (3,4), A. Nandi (2,4), D. Debnath (4), T. B. Kotoch
  (4), R. Sarkar (4), T. R. Chidambaram (5), P. Vinod (5), S. Sreekumar (5), Y.
  D. Kotov (6), A. S. Buslov (6), V. N. Yurov (6), V. G. Tyshkevich (6), A. I.
  Arkhangelskij (6), R. A. Zyatkov (6), Sachindra Naik (7)((1) Tata Institute
  of Fundamental Research, Mumbai - 400005, India, (2) Space Science Division,
  ISRO-HQ, New Bell Road, Bangalore - 560231, India, (3) S. N. Bose National
  Center for Basic Sciences, Salt Lake, Kolkata - 700098, India, (4) Indian
  Center for Space Physics, Garia, Kolkata - 700084, India, (5) Vikram Sarabhai
  Space Center, VRC, Thiruvananthapuram - 695022, India, (6) Moscow Engineering
  Physics Institute, Moscow - 115409, Russia, (7) Astronomy & Astrophysics
  Division, Physical Research Laboratory, Ahmedabad - 380009, India)","Detection of GRB 090618 with RT-2 Experiment Onboard the Coronas-Photon
  Satellite","12 pages, 6 figures, 3 tables, Accepted for publication in The
  Astrophysical Journal","2011, The Astrophysical Journal, 728, 42","10.1088/0004-637X/728/1/42",,"astro-ph.HE astro-ph.SR","http://arxiv.org/licenses/nonexclusive-distrib/1.0/","  We present the results of an analysis of the prompt gamma-ray emission from
GRB 090618 using the RT-2 Experiment onboard the Coronas-Photon satellite. GRB
090618 shows multiple peaks and a detailed study of the temporal structure as a
function of energy is carried out. As the GRB was incident at an angle of 77
degree to the detector axis, we have generated appropriate response functions
of the detectors to derive the spectrum of this GRB. We have augmented these
results using the publicly available data from the Swift BAT detector and show
that a combined spectral analysis can measure the spectral parameters quite
accurately. We also attempt a spectral and timing analysis of individual peaks
and find evidence for a systematic change in the pulse emission characteristics
for the successive pulses. In particular, we find that the peak energy of the
spectrum, E_p, is found to monotonically decrease with time, for the successive
pulses of this GRB.
","[{""version"":""v1"",""created"":""Fri, 3 Dec 2010 05:14:36 GMT""}]","2011-01-25"
"1012.0642","Levshakov","S. A. Levshakov, P. Molaro, M. G. Kozlov, A. V. Lapinov, C. Henkel, D.
  Reimers, T. Sakai, I. I. Agafonova","Searching for Chameleon-like Scalar Fields","12 pages, 1 figure. To appear in the proceedings of the JENAM 2010
  Symposium 1 ""From Varying Couplings to Fundamental Physics"" (Lisbon,
  Portugal)",,"10.1007/978-3-642-19397-2_11",,"astro-ph.CO gr-qc hep-ph hep-th nucl-th","http://arxiv.org/licenses/nonexclusive-distrib/1.0/","  Using the 32-m Medicina, 45-m Nobeyama, and 100-m Effelsberg telescopes we
found a statistically significant velocity offset Delta V = 27 +/- 3 m/s
(1sigma) between the inversion transition in NH3(1,1) and low-J rotational
transitions in N2H+(1-0) and HC3N(2-1) arising in cold and dense molecular
cores in the Milky Way. Systematic shifts of the line centers caused by
turbulent motions and velocity gradients, possible non-thermal hyperfine
structure populations, pressure and optical depth effects are shown to be lower
than or about 1 m/s and thus can be neglected in the total error budget. The
reproducibility of Delta V at the same facility (Effelsberg telescope) on a
year-to-year basis is found to be very good. Since the frequencies of the
inversion and rotational transitions have different sensitivities to variations
in mu = m_e/m_p, the revealed non-zero Delta V may imply that mu changes when
measured at high (terrestrial) and low (interstellar) matter densities as
predicted by chameleon-like scalar field models - candidates to the dark energy
carrier. Thus we are testing whether scalar field models have chameleon-type
interactions with ordinary matter. The measured velocity offset corresponds to
the ratio Delta mu/mu = (mu_space - mu_lab)/mu_lab of (26 +/- 3)x10^{-9}
(1sigma).
","[{""version"":""v1"",""created"":""Fri, 3 Dec 2010 05:22:33 GMT""}]","2016-02-03"
