"1012.0686","Thomas Kiesel","T. Kiesel, W. Vogel, B. Hage, R. Schnabel","Entangled Qubits in a non-Gaussian Quantum State","4 pages, 4 figures, published version","Phys. Rev. A 83, 062319 (2011)","10.1103/PhysRevA.83.062319",,"quant-ph","http://arxiv.org/licenses/nonexclusive-distrib/1.0/","  We experimentally generate and tomographically characterize a mixed,
genuinely non-Gaussian bipartite continuous-variable entangled state. By
testing entanglement in 2$\times$2-dimensional two-qubit subspaces, entangled
qubits are localized within the density matrix, which, firstly, proves the
distillability of the state and, secondly, is useful to estimate the efficiency
and test the applicability of distillation protocols. In our example, the
entangled qubits are arranged in the density matrix in an asymmetric way, i.e.
entanglement is found between diverse qubits composed of different photon
number states, although the entangled state is symmetric under exchanging the
modes.
","[{""version"":""v1"",""created"":""Fri, 3 Dec 2010 10:18:14 GMT""},{""version"":""v2"",""created"":""Wed, 15 Jun 2011 13:27:10 GMT""}]","2015-03-17"
"1012.0687","Philippe Laurencot","Georgy Kitavtsev (MPI-MIS), Philippe Laurencot (IMT), Barbara
  Niethammer","Weak solutions to lubrication equations in the presence of strong
  slippage",,,,,"math.AP","http://arxiv.org/licenses/nonexclusive-distrib/1.0/","  The existence of global weak solutions is proved for one-dimensional
lubrication models that describe the dewetting process of nanoscopic thin
polymer films on hydrophobyzed substrates and take account of large slippage at
the polymer-substrate interface. The convergence of these solutions as either
the Reynolds number or the capillarity goes to zero, as well as their limiting
behaviour as the slip length goes to zero or infinity are investigated.
","[{""version"":""v1"",""created"":""Fri, 3 Dec 2010 10:18:55 GMT""}]","2010-12-06"
"1012.0688","Guy Barles","Guy Barles (LMPT, FRDP), Hiroyoshi Mitake (LMPT)","A PDE approach to large-time asymptotics for boundary-value problems for
  nonconvex Hamilton-Jacobi Equations",,,,,"math.AP","http://arxiv.org/licenses/nonexclusive-distrib/1.0/","  We investigate the large-time behavior of three types of initial-boundary
value problems for Hamilton-Jacobi Equations with nonconvex Hamiltonians. We
consider the Neumann or oblique boundary condition, the state constraint
boundary condition and Dirichlet boundary condition. We establish general
convergence results for viscosity solutions to asymptotic solutions as time
goes to infinity via an approach based on PDE techniques. These results are
obtained not only under general conditions on the Hamiltonians but also under
weak conditions on the domain and the oblique direction of reflection in the
Neumann case.
","[{""version"":""v1"",""created"":""Fri, 3 Dec 2010 10:21:10 GMT""},{""version"":""v2"",""created"":""Fri, 10 Dec 2010 14:36:23 GMT""}]","2010-12-13"
"1012.0689","Jean-Philippe Anker","Jean-Philippe Anker (MAPMO), Vittoria Pierfelice (MAPMO), Maria
  Vallarino","The wave equation on Damek-Ricci spaces",,,,,"math.AP math.CA","http://arxiv.org/licenses/nonexclusive-distrib/1.0/","  We study the dispersive properties of the wave equation associated with the
shifted Laplace-Beltrami operator on Damek-Ricci spaces, and deduce Strichartz
estimates for a large family of admissible pairs. As an application, we obtain
global well-posedness results for the nonlinear wave equation.
","[{""version"":""v1"",""created"":""Fri, 3 Dec 2010 10:23:08 GMT""}]","2010-12-06"
"1012.0690","Jean-Marc Bardet","Jean-Marc Bardet (SAMM), Hatem Bibi (SAMM)","Adaptive semiparametric wavelet estimator and goodness-of-fit test for
  long memory linear processes",,,,,"math.ST stat.TH","http://arxiv.org/licenses/nonexclusive-distrib/1.0/","  This paper is first devoted to study an adaptive wavelet based estimator of
the long memory parameter for linear processes in a general semi-parametric
frame. This is an extension of Bardet {\it et al.} (2008) which only concerned
Gaussian processes. Moreover, the definition of the long memory parameter
estimator is modified and asymptotic results are improved even in the Gaussian
case. Finally an adaptive goodness-of-fit test is also built and easy to be
employed: it is a chi-square type test. Simulations confirm the interesting
properties of consistency and robustness of the adaptive estimator and test.
","[{""version"":""v1"",""created"":""Fri, 3 Dec 2010 10:23:58 GMT""}]","2010-12-08"
"1012.0691","Alexander Schnurr","Alexander Schnurr and Jeannette H.C. Woerner","Well-balanced Levy Driven Ornstein-Uhlenbeck Processes","16 pages, 2 figure","Statistics & Risk Modeling 28 (2011), 343-357",,,"math.PR","http://arxiv.org/licenses/nonexclusive-distrib/1.0/","  In this paper we introduce the well-balanced L\'{e}vy driven
Ornstein-Uhlenbeck process as a moving average process of the form $X_t=\int
\exp(-\lambda |t-u|)dL_u$. In contrast to L\'{e}vy driven Ornstein-Uhlenbeck
processes the well-balanced form possesses continuous sample paths and an
autocorrelation function which is decreasing not purely exponential but of the
order $\lambda |u|\exp(-\lambda |u|)$. Furthermore, depending on the size of
$\lambda$ it allows both for positive and negative correlation of increments.
We indicate how the well-balanced Ornstein-Uhlenbeck process might be used as
mean or volatility process in stochastic volatility models.
","[{""version"":""v1"",""created"":""Fri, 3 Dec 2010 10:24:32 GMT""},{""version"":""v2"",""created"":""Wed, 22 Jun 2011 08:47:11 GMT""}]","2013-01-08"
"1012.0692","Alexis Matter","Alexis Matter (MPIFR), Tristan Guillot (CASSIOPEE), Alessandro
  Morbidelli (CASSIOPEE)","Calculation of the enrichment of the giant planet envelopes during the
  ""late heavy bombardment""","6 pages","Planetary and Space Science 57 (2009) p. 816-821","10.1016/j.pss.2009.01.010",,"astro-ph.EP","http://arxiv.org/licenses/nonexclusive-distrib/1.0/","  The giant planets of our solar system possess envelopes consisting mainly of
hydrogen and helium but are also significantly enriched in heavier elements
relatively to our Sun. In order to better constrain how these heavy elements
have been delivered, we quantify the amount accreted during the so-called ""late
heavy bombardment"", at a time when planets were fully formed and planetesimals
could not sink deep into the planets. On the basis of the ""Nice model"", we
obtain accreted masses (in terrestrial units) equal to $0.15\pm0.04
\rm\,M_\oplus$ for Jupiter, and $0.08 \pm 0.01 \rm\,M_\oplus$ for Saturn. For
the two other giant planets, the results are found to depend mostly on whether
they switched position during the instability phase. For Uranus, the accreted
mass is $0.051 \pm 0.003 \rm\,M_\oplus$ with an inversion and $0.030 \pm 0.001
\rm\,M_\oplus$ without an inversion. Neptune accretes $0.048 \pm 0.015
\rm\,M_\oplus$ in models in which it is initially closer to the Sun than
Uranus, and $0.066 \pm 0.006 \rm\,M_\oplus$ otherwise. With well-mixed
envelopes, this corresponds to an increase in the enrichment over the solar
value of $0.033 \pm 0.001$ and $0.074 \pm 0.007$ for Jupiter and Saturn,
respectively. For the two other planets, we find the enrichments to be $2.1 \pm
1.4$ (w/ inversion) or $1.2 \pm 0.7$ (w/o inversion) for Uranus, and $2.0 \pm
1.2$ (w/ inversion) or $2.7 \pm 1.6$ (w/o inversion) for Neptune. This is
clearly insufficient to explain the inferred enrichments of $\sim 4$ for
Jupiter, $\sim 7$ for Saturn and $\sim 45$ for Uranus and Neptune.
","[{""version"":""v1"",""created"":""Fri, 3 Dec 2010 10:25:32 GMT""}]","2015-05-20"
"1012.0693","Thibaut Divoux","Thibaut Divoux, Catherine Barentin and S\'ebastien Manneville","From transient fluidization processes to Herschel-Bulkley behavior in
  simple yield stress fluids","12 pages, 9 figures, accepted for publication in Soft Matter","Soft Matter, 2011,7, 8409-8418","10.1039/C1SM05607G",,"cond-mat.soft cond-mat.mtrl-sci","http://arxiv.org/licenses/nonexclusive-distrib/1.0/","  Stress-induced fluidization of a simple yield stress fluid, namely a carbopol
microgel, is addressed through extensive rheological measurements coupled to
simultaneous temporally and spatially resolved velocimetry. These combined
measurements allow us to rule out any bulk fracture-like scenario during the
fluidization process such as that suggested in [Caton {\it et al., Rheol Acta},
2008, {\bf 47}, 601-607]. On the contrary, we observe that the transient regime
from solidlike to liquidlike behaviour under a constant shear stress $\sigma$
successively involves creep deformation, total wall slip, and shear banding
before a homogeneous steady state is reached. Interestingly, the total duration
$\tau_f$ of this fluidization process scales as $\tau_f \propto 1/(\sigma -
\sigma_c)^{\beta}$, where $\sigma_c$ stands for the yield stress of the
microgel, and $\beta$ is an exponent which only depends on the microgel
properties and not on the gap width or on the boundary conditions. Together
with recent experiments under imposed shear rate [Divoux {\it et al., Phys.
Rev. Lett.}, 2010, {\bf 104}, 208301], this scaling law suggests a route to
rationalize the phenomenological Herschel-Bulkley (HB) power-law classically
used to describe the steady-state rheology of simple yield stress fluids. In
particular, we show that the {\it steady-state} HB exponent appears as the
ratio of the two fluidization exponents extracted separately from the {\it
transient} fluidization processes respectively under controlled shear rate and
under controlled shear stress.
","[{""version"":""v1"",""created"":""Fri, 3 Dec 2010 10:29:21 GMT""},{""version"":""v2"",""created"":""Thu, 7 Apr 2011 09:35:49 GMT""},{""version"":""v3"",""created"":""Wed, 29 Jun 2011 09:17:15 GMT""}]","2015-03-17"
"1012.0694","Ilya Tsukerman","I. Tsukerman (for the ATLAS Collaboration)","SM Higgs boson searches in the early ATLAS data","6 pages, 2 figures, to appear in the Proceedings of IHEPLHC10
  Conference (Protvino, Russia, October 2010)",,,"ATL-PHYS-PROC-2010-130","hep-ex hep-ph","http://arxiv.org/licenses/nonexclusive-distrib/1.0/","  ATLAS exclusion and discovery potentials of Standard Model Higgs boson
searches at the LHC at 14 TeV, 10 TeV and 7 TeV center-of-mass energy are
reviewed. For a LHC center-of-mass energy of 7 TeV and integrated luminosity of
1 fb$^{-1}$, contributions from the important decay channels $\Hboson
\rightarrow \Wboson\Wboson^{(*)} \rightarrow \ell\nu\ell\nu$, $\Hboson
\rightarrow \Zboson\Zboson^{(*)} \rightarrow \ell\ell\ell\ell$ and $\Hboson
\rightarrow \gamma\gamma$ are considered, based on recent full Monte Carlo
simulations at 14 and 10 TeV and the cross-section rescaling for the 7 TeV
center-of-mass energy. First measurements of backgrounds to Standard Model
Higgs boson search are also presented.
","[{""version"":""v1"",""created"":""Fri, 3 Dec 2010 10:35:38 GMT""}]","2019-08-14"
"1012.0695","Miroslav  Sushko","M. Ya. Sushko","Critical opalescence in fluids: 1.5-Scattering effects and the
  Landau-Placzek ratio","4 pages; reported at PLMMP-2010 Conference","Journal of Molecular Liquids 163 (2011) 33-35","10.1016/j.molliq.2011.07.006",,"cond-mat.stat-mech physics.chem-ph physics.optics","http://arxiv.org/licenses/nonexclusive-distrib/1.0/","  We adduce new arguments for the significance of so-called 1.5- (or
sesquialteral) molecular light scattering in one-component fluids. For this
purpose, we analyze its effect on the Landau-Placzek ratio for the critical
opalescence spectrum. The results obtained are used to reveal experimental data
which can be interpreted as evidence for its existence and to evaluate both the
relative magnitude and the sign of the 1.5-scattering contribution.
","[{""version"":""v1"",""created"":""Fri, 3 Dec 2010 10:36:21 GMT""}]","2016-08-10"
"1012.0696","Terence Jegaraj","Terence Jegaraj","Small time asymptotics for stochastic evolution equations","This article is 32 pages long. It has been accepted for publication
  in Journal of Theoretical Probability",,,,"math.PR","http://arxiv.org/licenses/nonexclusive-distrib/1.0/","  We obtain a large deviation principle describing the small time asymptotics
of the solution of a stochastic evolution equation with multiplicative noise.
Our assumptions are a condition on the linear drift operator that is satisfied
by generators of analytic semigroups and Lipschitz continuity of the nonlinear
drift and dispersion coefficients. Methods originally used by Szymon Peszat for
the small noise asymptotics problem are adapted to solve the small time
asymptotics problem.
","[{""version"":""v1"",""created"":""Fri, 3 Dec 2010 10:40:32 GMT""}]","2010-12-06"
"1012.0697","Matej Batic","Mauro Augelli (1), Marcia Begalli (2), Mincheol Han (3), Steffen Hauf
  (4), Chan-Hyeung Kim (3), Markus Kuster (4), Maria Grazia Pia (5), Lina
  Quintieri (6), Paolo Saracco (5), Hee Seo (3), Manju Sudhakar (5), Georg
  Eidenspointner (7), Andreas Zoglauer (8) ((1) CNES, (2) State University Rio
  de Janeiro, (3) Hanyang University, (4) Technische Universit\""at Darmstadt,
  (5) INFN Sezione di Genova, (6) INFN Laboratori Nazionali di Frascati, (7)
  MPE and MPI Halbleiterlabor, (8) University of California at Berkeley)","Data libraries as a collaborative tool across Monte Carlo codes","4 pages, to appear in proceedings of the Joint International
  Conference on Supercomputing in Nuclear Applications and Monte Carlo 2010",,,,"physics.comp-ph","http://arxiv.org/licenses/nonexclusive-distrib/1.0/","  The role of data libraries in Monte Carlo simulation is discussed. A number
of data libraries currently in preparation are reviewed; their data are
critically examined with respect to the state-of-the-art in the respective
fields. Extensive tests with respect to experimental data have been performed
for the validation of their content.
","[{""version"":""v1"",""created"":""Fri, 3 Dec 2010 10:50:11 GMT""}]","2010-12-06"
"1012.0698","Patrick Cabau","Patrick Cabau","Limites projectives fortes d'alg\'ebro\""ides de Lie",,,,,"math.DG","http://arxiv.org/licenses/nonexclusive-distrib/1.0/","  We define the notion of strong projective limit of Banach Lie algebroids. We
study the associated structures of Fr\'{e}chet bundles and the compatibility
with the different morphisms. This kind of structure seems to be a convenient
framework for various situations.
","[{""version"":""v1"",""created"":""Fri, 3 Dec 2010 10:59:05 GMT""},{""version"":""v2"",""created"":""Fri, 4 Feb 2011 08:56:01 GMT""},{""version"":""v3"",""created"":""Mon, 20 Feb 2012 16:58:50 GMT""}]","2012-02-21"
"1012.0699","Jacobus Thom","J. D. Thom and F. G. Scholtz","Bound state energies and phase shifts of a non-commutative well","12 pages, 8 figures","J. Phys. A: Math. Theor. (42) 445301 (2009)","10.1088/1751-8113/42/44/445301",,"quant-ph hep-th","http://arxiv.org/licenses/nonexclusive-distrib/1.0/","  Non-commutative quantum mechanics can be viewed as a quantum system
represented in the space of Hilbert-Schmidt operators acting on non-commutative
configuration space. Within this framework an unambiguous definition can be
given for the non-commutative well. Using this approach we compute the bound
state energies, phase shifts and scattering cross sections of the non-
commutative well. As expected the results are very close to the commutative
results when the well is large or the non-commutative parameter is small.
However, the convergence is not uniform and phase shifts at certain energies
exhibit a much stronger then expected dependence on the non-commutative
parameter even at small values.
","[{""version"":""v1"",""created"":""Fri, 3 Dec 2010 11:02:00 GMT""}]","2010-12-06"
"1012.0700","Matteo Bonforte","Matteo Bonforte, Gabriele Grillo and Juan Luis Vazquez","Behaviour near extinction for the Fast Diffusion Equation on bounded
  domains",,,,,"math.AP","http://arxiv.org/licenses/nonexclusive-distrib/1.0/","  We consider the Fast Diffusion Equation $u_t=\Delta u^m$ posed in a bounded
smooth domain $\Omega\subset \RR^d$ with homogeneous Dirichlet conditions; the
exponent range is $m_s=(d-2)_+/(d+2)<m<1$. It is known that bounded positive
solutions $u(t,x)$ of such problem extinguish in a finite time $T$, and also
that such solutions approach a separate variable solution $u(t,x)\sim
(T-t)^{1/(1-m)}S(x)$, as $t\to T^-$. Here we are interested in describing the
behaviour of the solutions near the extinction time. We first show that the
convergence $u(t,x)\,(T-t)^{-1/(1-m)}$ to $S(x)$ takes place uniformly in the
relative error norm. Then, we study the question of rates of convergence of the
rescaled flow. For $m$ close to 1 we get such rates by means of entropy methods
and weighted Poincar\'e inequalities. The analysis of the latter point makes an
essential use of fine properties of the associated stationary elliptic problem
$-\Delta S^m= {\bf c} S$ in the limit $m\to 1$, and such a study has an
independent interest.
","[{""version"":""v1"",""created"":""Fri, 3 Dec 2010 11:02:06 GMT""}]","2015-03-17"
"1012.0701","Haomin Wang","Zhiqiang Luo, Ting Yu, Jingzhi Shang, Yingying Wang, Sanhua Lim, Lei
  Liu, Gagik G. Gurzadyan, Zexiang Shen, and Jianyi Lin","Large Scale Synthesis of Bi-layer Graphene in Strongly Coupled Stacking
  Order","20 pages, 8 Figures",,,,"cond-mat.mtrl-sci","http://arxiv.org/licenses/nonexclusive-distrib/1.0/","  Large scale synthesis of single layer graphene (SLG) by chemical vapor
deposition (CVD) has received a lot of attention recently. However, CVD
synthesis of AB stacked bi-layer graphene (BLG) is still a challenging work.
Here we report synthesis of BLG homogeneously in large area by thermal CVD. The
2D Raman band of CVD BLG splits into four components, suggesting splitting of
electronic bands due to strong interlayer coupling. The splitting of electronic
bands in CVD BLG is further evidenced by the study of near infrared (NIR)
absorption and carrier dynamics probed by transient absorption spectroscopy.
Ultraviolet photoelectron spectroscopy invesigation also indiates CVD BLG
possesses different electronic structures from those of CVD SLG. The growth
mechanism of BLG is found to be related to catalystic activity of copper
(Cu)surface, which is determined by purity of Cu foils employed in CVD process.
Our work showsthat strongly coupled or even AB stacked BLG can be grown on Cu
foils in large scale, which isof particular importance for device applications
based on their split electronic bands
","[{""version"":""v1"",""created"":""Fri, 3 Dec 2010 11:05:55 GMT""}]","2010-12-06"
"1012.0702","Martin Mosko","J. Feilhauer, M. Mosko","Conductance and persistent current in quasi-one-dimensional systems with
  grain boundaries: Effects of the strongly reflecting and columnar grains",,,"10.1103/PhysRevB.84.085454",,"cond-mat.mes-hall","http://arxiv.org/licenses/nonexclusive-distrib/1.0/","  We study mesoscopic transport in the Q1D wires and rings made of a 2D
conductor of width W and length L >> W. Our aim is to compare an impurity-free
conductor with grain boundaries with a grain-free conductor with impurity
disorder. A single grain boundary is modeled as a set of the
2D-$\delta$-function-like barriers positioned equidistantly on a straight line
and disorder is emulated by a large number of such straight lines, intersecting
the conductor with random orientation in random positions. The impurity
disorder is modeled by the 2D $\delta$-barriers with the randomly chosen
positions and signs. The electron transmission through the wires is calculated
by the scattering-matrix method, and the Landauer conductance is obtained. We
calculate the persistent current in the rings threaded by magnetic flux: We
incorporate into the scattering-matrix method the flux-dependent cyclic
boundary conditions and we introduce a trick allowing to study the persistent
currents in rings of almost realistic size. We mainly focus on the numerical
results for L much larger than the electron mean-free path, when the transport
is diffusive. If the grain boundaries are weakly reflecting, the systems with
grain boundaries show the same (mean) conductance and the same (typical)
persistent current as the systems with impurities, and the results also agree
with the single-particle theories treating disorder as a white-noise-like
potential. If the grain boundaries are strongly reflecting, the typical
persistent currents can be about three times larger than the results of the
white-noise-based theory, thus resembling the experimental results of Jariwala
et al. (PRL 2001). We extend our study to the 3D conductors with columnar
grains. We find that the persistent current exceeds the white-noise-based
result by another one order of magnitude, similarly as in the experiment of
Chandrasekhar et al. (PRL 1991).
","[{""version"":""v1"",""created"":""Fri, 3 Dec 2010 11:12:52 GMT""},{""version"":""v2"",""created"":""Thu, 16 Jun 2011 14:22:22 GMT""}]","2015-05-20"
"1012.0703","Bohdan Grzadkowski","Bohdan Grzadkowski, Per Osland","Natural Two-Higgs-Doublet Model","2 figures, submitted to Fortschritte der Physik, presented at the
  10th Hellenic School on Elementary Particle Physics and Gravity, Corfu 2010",,"10.1002/prop.201000098",,"hep-ph","http://arxiv.org/licenses/nonexclusive-distrib/1.0/","  We show that the Two-Higgs-Doublet Model (2HDM) constrained by the
two-loop-order requirement of cancellation of quadratic divergences is
consistent with the existing experimental constraints. The model allows to
ameliorate the little hierarchy problem by suppressing the quadratic
corrections to scalar masses and lifting the mass of the lightest Higgs boson.
A strong source of CP violation emerges from the scalar potential. The cutoff
originating from the naturality arguments is shifted from 0.6 TeV in the
Standard Model to >6 TeV in the 2HDM, depending on the mass of the lightest
scalar.
","[{""version"":""v1"",""created"":""Fri, 3 Dec 2010 11:15:02 GMT""},{""version"":""v2"",""created"":""Thu, 9 Dec 2010 11:44:41 GMT""}]","2015-05-20"
"1012.0704","Said Ilias","Said Ilias (LMPT), Makhoul Ola (LMPT)","A Generalization of a Levitin and Parnovski Universal Inequality for
  Eigenvalues","A para\^itre au J. Geom. Anal",,,,"math.SP","http://arxiv.org/licenses/nonexclusive-distrib/1.0/","  In this paper, we derive ""universal"" inequalities for the sums of eigenvalues
of the Hodge de Rham Laplacian on Euclidean closed Submanifolds and of
eigenvalues of the Kohn Laplacian on the Heisenberg group. These inequalities
generalize the Levitin-Parnovski inequality obtained for the sums of
eigenvalues of the Dirichlet Laplacian of a bounded Euclidean domain. New
Reilly and Asada inequalities are also obtained.
","[{""version"":""v1"",""created"":""Fri, 3 Dec 2010 11:23:50 GMT""}]","2010-12-06"
"1012.0705","Sylvain Golenia","Sylvain Golenia, Thierry Jecko (AGM)","Weighted Mourre's commutator theory, application to Schr\""odinger
  operators with oscillating potential","References concerning commutator expansions has been improved","Journal of Operator Theory (2013) J. Operator Theory 70 (2013),
  no. 1, 109-144",,,"math.SP math.AP math.FA","http://arxiv.org/licenses/nonexclusive-distrib/1.0/","  We present a variant of Mourre's commutator theory. We apply it to prove the
limiting absorption principle for Schr\""odinger operators with a perturbed
Wigner-Von Neumann potential at suitable energies. To our knowledge, this
result is new since we allow a long range pertubation of the Wigner-Von Neumann
potential. Furthermore, we can show that the usual Mourre theory, based on
differential inequalities and on the generator of dilations, cannot apply to
our Schr\""odinger operators.
","[{""version"":""v1"",""created"":""Fri, 3 Dec 2010 11:25:27 GMT""},{""version"":""v2"",""created"":""Tue, 18 Jan 2011 08:02:55 GMT""},{""version"":""v3"",""created"":""Fri, 1 Jun 2012 19:33:00 GMT""}]","2014-02-24"
"1012.0706","J\'er\'emy Blanc","J\'er\'emy Blanc","Symplectic birational transformations of the plane","14 pages","Osaka J. Math. Volume 50, Number 2 (2013), 573-590",,,"math.AG math.DG","http://arxiv.org/licenses/nonexclusive-distrib/1.0/","  We study the group of symplectic birational transformations of the plane. It
is proved that this group is generated by $\mathrm{SL}(2,\mathbb{Z})$, the
torus and a special map of order $5$, as it was conjectured by A. Usnich.
  Then we consider a special subgroup $H$, of finite type, defined over any
field which admits a surjective morphism to the Thompson group of piecewise
linear automorphisms of $\mathbb{Z}^2$. We prove that the presentation for this
group conjectured by Usnich is correct.
","[{""version"":""v1"",""created"":""Fri, 3 Dec 2010 11:33:13 GMT""}]","2013-08-26"
