"1012.2470","Polona Oblak","David Dol\v{z}an, Polona Oblak","The zero-divisor graphs of semirings","17 pages, Section 4 has been added to v1",,,,"math.RA","http://arxiv.org/licenses/nonexclusive-distrib/1.0/","  In this paper we study zero--divisor graphs of rings and semirings. We show
that all zero--divisor graphs of (possibly noncommutative) semirings are
connected and have diameter less than or equal to 3. We characterize all
acyclic zero-divisor graphs of semirings and prove that in the case
zero-divisor graphs are cyclic, their girths are less than or equal to 4. We
find all possible cyclic zero-divisor graphs over commutative semirings having
at most one 3-cycle, and characterize all complete $k$-partite and regular
zero-divisor graphs. Moreover, we characterize all additively cancellative
commutative semirings and all commutative rings such that their zero--divisor
graph has exactly one 3-cycle.
","[{""version"":""v1"",""created"":""Sat, 11 Dec 2010 16:04:32 GMT""},{""version"":""v2"",""created"":""Fri, 20 May 2011 10:21:04 GMT""}]","2011-05-23"
"1012.2471","Tohru Nagao","Tohru Nagao (1), Roberto Maiolino (2), Alessandro Marconi (3), Hideo
  Matsuhara (4) ((1) Ehime Univ., (2) Rome Observatory, (3) Florence Univ., (4)
  ISAS/JAXA)","Metallicity Diagnostics with Infrared Fine-Structure Lines","13 pages, 10 figures. Accepted for publication in A&A",,"10.1051/0004-6361/201015471",,"astro-ph.CO","http://arxiv.org/licenses/nonexclusive-distrib/1.0/","  Although measuring the gas metallicity in galaxies at various redshifts is
crucial to constrain galaxy evolutionary scenarios, only rest-frame optical
emission lines have been generally used to measure the metallicity. This has
prevented us to accurately measure the metallicity of dust-obscured galaxies,
and accordingly to understand the chemical evolution of dusty populations, such
as ultraluminous infrared galaxies. Here we propose diagnostics of the gas
metallicity based on infrared fine structure emission lines, which are nearly
unaffected by dust extinction even the most obscured systems. Specifically, we
focus on fine-structure lines arising mostly from HII regions, not in
photo-dissociation regions, to minimize the dependence and uncertainties of the
metallicity diagnostics from various physical parameters. Based on
photoionization models, we show that the emission-line flux ratio of
([OIII]51.80+[OIII]88.33)/[NIII]57.21 is an excellent tracer of the gas
metallicity. The individual line ratios [OIII]51.80/[NIII]57.21 or
[OIII]88.33/[NIII]57.21 can also be used as diagnostics of the metallicity, but
they suffer a stronger dependence on the gas density. The line ratios
[OIII]88.33/[OIII]51.80 and [NII]121.7/[NIII]57.21 can be used to measure and,
therefore, account for the dependences on the of the gas density and ionization
parameter, respectively. We show that these diagnostic fine-structure lines are
detectable with Herschel in luminous infrared galaxies out z=0.4. Metallicity
measurements with these fine-structure lines will be feasible at relatively
high redshift (z=1 or more) with SPICA, the future infrared space observatory.
","[{""version"":""v1"",""created"":""Sat, 11 Dec 2010 16:23:39 GMT""}]","2015-05-20"
"1012.2472","Miguel \'Angel Aloy Tor\'as","J. M. Ib\'a\~nez (1), M. A. Aloy (1), P. Mimica (1), L. Ant\'on (1),
  J. A. Miralles (2), J. M. Mart\'i (1) ((1) Department of Astronomy and
  Astrophysics, University of Valencia, (2) Department of Applied Physics,
  University of Alicante)","A Roe-type Riemann solver based on the spectral decomposition of the
  equations of Relativistic Magnetohydrodynamics","6 pages, Proceedings of the ASTRONUM-2010 meeting held at San Diego
  (USA). To by published in ASP Conf. Ser",,,,"astro-ph.HE math-ph math.MP","http://arxiv.org/licenses/nonexclusive-distrib/1.0/","  In a recent paper (Ant\'on et al. 2010) we have derived sets of right and
left eigenvectors of the Jacobians of the relativistic MHD equations, which are
regular and span a complete basis in any physical state including degenerate
ones. We present a summary of the main steps followed in the above derivation
and the numerical experiments carried out with the linearized (Roe-type)
Riemann solver we have developed, and some note on the (non-)convex character
of the relativistic MHD equations.
","[{""version"":""v1"",""created"":""Sat, 11 Dec 2010 17:06:21 GMT""}]","2010-12-14"
"1012.2473","Michael Puls","Michael Puls","Some results concerning the $p$-Royden and $p$-harmonic boundaries of a
  graph of bounded degree","Fixed minor typos. No other changes to paper",,,,"math.FA math.MG","http://arxiv.org/licenses/nonexclusive-distrib/1.0/","  Let $p$ be a real number greater than one and let $\Gamma$ be a connected
graph of bounded degree. We show that the $p$-Royden boundary of $\Gamma$ with
the $p$-harmonic boundary removed is a $F_{\sigma}$-set. We also characterize
the $p$-harmonic boundary of $\Gamma$ in terms of the intersection of the
extreme points of a certain subset of one-sided infinite paths in $\Gamma$.
","[{""version"":""v1"",""created"":""Sat, 11 Dec 2010 17:12:59 GMT""},{""version"":""v2"",""created"":""Wed, 10 Aug 2011 14:57:23 GMT""}]","2011-08-11"
"1012.2474","Miguel \'Angel Aloy Tor\'as","M. A. Aloy (1), P. Mimica (1) ((1) Department of Astronomy and
  Astrophysics, University of Valencia)","Dynamical efficiency of collisionless magnetized shocks in relativistic
  jets","8 pages, 2 figures (1 in color), Proceedings of the UAH WORKSHOP 2010
  on Partially Ionized Plasmas throughout the Cosmos, held in Nashville (USA)",,"10.1063/1.3625603",,"astro-ph.HE","http://arxiv.org/licenses/nonexclusive-distrib/1.0/","  The so-called internal shock model aims to explain the light-curves and
spectra produced by non-thermal processes originated in the flow of blazars and
gamma-ray bursts. A long standing question is whether the tenuous collisionless
shocks, driven inside a relativistic flow, are efficient enough to explain the
amount of energy observed as compared with the expected kinetic power of the
outflow. In this work we study the dynamic efficiency of conversion of
kinetic-to- thermal/magnetic energy of internal shocks in relativistic
magnetized outflows. We find that the collision between shells with a non-zero
relative velocity can yield either two oppositely moving shocks (in the frame
where the contact surface is at rest), or a reverse shock and a forward
rarefaction. For moderately magnetized shocks (magnetization {\sigma} ~ 0.1),
the dynamic efficiency in a single two-shell interaction can be as large as
40%. Hence, the dynamic efficiency of moderately magnetized shocks is larger
than in the corresponding unmagnetized two-shell interaction. We find that the
efficiency is only weakly dependent on the Lorentz factor of the shells and,
thus internal shocks in the magnetized flow of blazars and gamma-ray bursts are
approximately equally efficient.
","[{""version"":""v1"",""created"":""Sat, 11 Dec 2010 17:33:00 GMT""}]","2015-05-20"
"1012.2475","Jorge Escobedo","Jorge Escobedo, Nikolay Gromov, Amit Sever and Pedro Vieira","Tailoring Three-Point Functions and Integrability","52 pages, 6 figures. v2: Typos corrected, references added and
  updated","JHEP 1109:028,2011","10.1007/JHEP09(2011)028",,"hep-th","http://arxiv.org/licenses/nonexclusive-distrib/1.0/","  We use Integrability techniques to compute structure constants in N=4 SYM to
leading order. Three closed spin chains, which represent the single trace
gauge-invariant operators in N=4 SYM, are cut into six open chains which are
then sewed back together into some nice pants, the three-point function. The
algebraic and coordinate Bethe ansatz tools necessary for this task are
reviewed. Finally, we discuss the classical limit of our results, anticipating
some predictions for quasi-classical string correlators in terms of algebraic
curves.
","[{""version"":""v1"",""created"":""Sat, 11 Dec 2010 18:21:21 GMT""},{""version"":""v2"",""created"":""Sat, 30 Apr 2011 14:24:33 GMT""}]","2011-09-12"
"1012.2476","Fernando Rossi Torres","J. Barranco, O. G. Miranda, C. A. Moura, T. I. Rashba and F.
  Rossi-Torres","Confusing the extragalactic neutrino flux limit with a neutrino
  propagation limit","15 pages, 4 figures. Important changes implemented. Abstract
  modified. Conclusions remain. To be published in JCAP","JCAP10(2011)007","10.1088/1475-7516/2011/10/007",,"astro-ph.CO hep-ph","http://arxiv.org/licenses/nonexclusive-distrib/1.0/","  We study the possible suppression of the extragalactic neutrino flux due to a
nonstandard interaction during its propagation. In particular, we study
neutrino interaction with an ultra-light scalar field dark matter. It is shown
that the extragalactic neutrino flux may be suppressed by such an interaction,
leading to a new mechanism to reduce the ultra-high energy neutrino flux. We
study both the cases of non-self-conjugate as well as self-conjugate dark
matter. In the first case, the suppression is independent of the neutrino and
dark matter masses. We conclude that care must be taken when explaining limits
on the neutrino flux through source acceleration mechanisms only, since there
could be other mechanisms for the reduction of the neutrino flux.
","[{""version"":""v1"",""created"":""Sat, 11 Dec 2010 18:33:13 GMT""},{""version"":""v2"",""created"":""Fri, 23 Sep 2011 13:47:30 GMT""}]","2015-03-17"
"1012.2477","David Zywina","David Zywina","Abelian varieties over large algebraic fields with infinite torsion",,,,,"math.NT","http://arxiv.org/licenses/nonexclusive-distrib/1.0/","  Let A be an abelian variety of positive dimension defined over a number field
K and let Kbar be a fixed algebraic closure of K. For each element sigma of the
absolute Galois group Gal(Kbar/K), let Kbar(sigma) be the fixed field of sigma
in Kbar. We shall prove that the torsion subgroup of A(Kbar(sigma)) is infinite
for all sigma in Gal(Kbar/K) outside of some set of Haar measure zero. This
proves the number field case of a conjecture of Geyer and Jarden from 1978.
","[{""version"":""v1"",""created"":""Sat, 11 Dec 2010 18:46:45 GMT""}]","2010-12-14"
"1012.2478","Robert Bailey","Robert F. Bailey and Brett Stevens","Packing spanning trees and the $k$-tree protocol","This paper has been superseded by arXiv:1203.1014 ""On packing
  spanning trees in graphs and bases in matroids"" by Robert F. Bailey, Mike
  Newman and Brett Stevens",,,,"math.CO","http://arxiv.org/licenses/nonexclusive-distrib/1.0/","  We provide a structural description of, and invariants for, maximum spanning
tree-packable graphs, i.e. those graphs G for which the edge connectivity of G
is equal to the maximum number of edge-disjoint spanning trees in G. These
graphs are of interest for the k-tree protocol of Itai and Rodeh [Inform. and
Comput. 79 (1988), 43-59].
","[{""version"":""v1"",""created"":""Sat, 11 Dec 2010 18:48:34 GMT""},{""version"":""v2"",""created"":""Tue, 6 Mar 2012 07:08:35 GMT""}]","2012-03-07"
"1012.2479","John D'Angelo","John P. D'Angelo","Hermitian analogues of Hilbert's 17-th problem","to appear in Advances in Math",,,,"math.CV","http://arxiv.org/licenses/nonexclusive-distrib/1.0/","  We pose and discuss several Hermitian analogues of Hilbert's $17$-th problem.
We survey what is known, offer many explicit examples and some proofs, and give
applications to CR geometry. We prove one new algebraic theorem: a non-negative
Hermitian symmetric polynomial divides a nonzero squared norm if and only if it
is a quotient of squared norms. We also discuss a new example of
Putinar-Scheiderer.
","[{""version"":""v1"",""created"":""Sat, 11 Dec 2010 19:19:48 GMT""}]","2010-12-14"
"1012.2480","Simon Guest","Simon Guest","Further solvable analogues of the Baer-Suzuki theorem and generation of
  nonsolvable groups","30 pages",,,,"math.GR","http://arxiv.org/licenses/nonexclusive-distrib/1.0/","  Let $G$ be an almost simple group. We prove that if $x \in G$ has prime order
$p \ge 5$, then there exists an involution $y$ such that $<x,y>$ is not
solvable. Also, if $x$ is an involution then there exist three conjugates of
$x$ that generate a nonsolvable group, unless $x$ belongs to a short list of
exceptions, which are described explicitly. We also prove that if $x$ has order
$6$ or $9$, then there exists two conjugates that generate a nonsolvable group.
","[{""version"":""v1"",""created"":""Sat, 11 Dec 2010 19:23:43 GMT""},{""version"":""v2"",""created"":""Tue, 14 Dec 2010 17:32:55 GMT""}]","2010-12-15"
"1012.2481","Damien Megy","Damien M\'egy (IF)","Sections hyperplanes \`a singularit\'es simples et exemples de
  variations de structure de Hodge","24 pages, in french",,,,"math.AG","http://arxiv.org/licenses/nonexclusive-distrib/1.0/","  We construct smooth complex projective varieties of dimension 3 to 6 with
variations of Hodge structure, by generalizing an example of J. Carlson and C.
Simpson in dimension 2. Then, we study some of their properties, in particular
their cohomology groups.
","[{""version"":""v1"",""created"":""Sat, 11 Dec 2010 19:38:48 GMT""}]","2010-12-14"
"1012.2482","Athanase Papadopoulos","Daniele Alessandrini (MPI), Lixin Liu, Athanase Papadopoulos (IRMA),
  Weixu Su","On local comparison between various metrics on Teichm\""uller spaces",,"Geometriae Dedicata 157 (2012), n. 1, 91-110",,,"math.GT","http://arxiv.org/licenses/nonexclusive-distrib/1.0/","  There are several Teichm\""uller spaces associated to a surface of infinite
topological type, after the choice of a particular basepoint (a complex or a
hyperbolic structure on the surface). These spaces include the quasiconformal
Teichm\""uller space, the length spectrum Teichm\""uller space, the
Fenchel-Nielsen Teichm\""uller space, and there are others. In general, these
spaces are set-theoretically different. An important question is therefore to
understand relations between these spaces. Each of these spaces is equipped
with its own metric, and under some hypotheses, there are inclusions between
these spaces. In this paper, we obtain local metric comparison results on these
inclusions, namely, we show that the inclusions are locally bi-Lipschitz under
certain hypotheses. To obtain these results, we use some hyperbolic geometry
estimates that give new results also for surfaces of finite type. We recall
that in the case of a surface of finite type, all these Teichm\""uller spaces
coincide setwise. In the case of a surface of finite type with no boundary
components (and possibly with punctures), we show that the restriction of the
identity map to any thick part of Teichm\""uller space is globally bi-Lipschitz
with respect to the length spectrum metric and the classical Teichm\""uller
metric on the domain and on the range respectively. In the case of a surface of
finite type with punctures and boundary components, there is a metric on the
Teichm\""uller space which we call the arc metric, whose definition is analogous
to the length spectrum metric, but which uses lengths of geodesic arcs instead
of lengths of closed geodesics. We show that the restriction of the identity
map restricted to any ""relative thick"" part of Teichm\""uller space is globally
bi-Lipschitz, with respect to any of the three metrics: the length spectrum
metric, the Teichm\""uller metric and the arc metric on the domain and on the
range.
","[{""version"":""v1"",""created"":""Sat, 11 Dec 2010 19:40:34 GMT""}]","2018-09-25"
"1012.2483","Thierry Paul","Alessio Figalli, Marilena Ligabo, Thierry Paul
  (CMLS-EcolePolytechnique)","Semiclassical limit for mixed states with singular and rough potentials",,,,,"math.AP","http://arxiv.org/licenses/nonexclusive-distrib/1.0/","  We consider the semiclassical limit for the Heisenberg-von Neumann equation
with a potential which consists of the sum of a repulsive Coulomb potential,
plus a Lipschitz potential whose gradient belongs to $BV$; this assumption on
the potential guarantees the well posedness of the Liouville equation in the
space of bounded integrable solutions. We find sufficient conditions on the
initial data to ensure that the quantum dynamics converges to the classical
one. More precisely, we consider the Husimi functions of the solution of the
Heisenberg-von Neumann equation, and under suitable assumptions on the initial
data we prove that they converge, as $\e \to 0$, to the unique bounded solution
of the Liouville equation (locally uniformly in time).
","[{""version"":""v1"",""created"":""Sat, 11 Dec 2010 19:43:11 GMT""}]","2010-12-14"
"1012.2484","Francesco Russo","Cristina Di Girolami (LMM), Francesco Russo (ENSTA ParisTech, INRIA
  Rocquencourt)","Generalized covariation for Banach space valued processes, It\^o formula
  and applications",,,,,"math.PR","http://arxiv.org/licenses/nonexclusive-distrib/1.0/","  This paper discusses a new notion of quadratic variation and covariation for
Banach space valued processes (not necessarily semimartingales) and related
It\^o formula. If $\X$ and $\Y$ take respectively values in Banach spaces
$B_{1}$ and $B_{2}$ and $\chi$ is a suitable subspace of the dual of the
projective tensor product of $B_{1}$ and $B_{2}$ (denoted by
$(B_{1}\hat{\otimes}_{\pi}B_{2})^{\ast}$), we define the so-called
$\chi$-covariation of $\X$ and $\Y$. If $\X=\Y$, the $\chi$-covariation is
called $\chi$-quadratic variation. The notion of $\chi$-quadratic variation is
a natural generalization of the one introduced by M\'etivier-Pellaumail and
Dinculeanu which is too restrictive for many applications. In particular, if
$\chi$ is the whole space $(B_{1}\hat{\otimes}_{\pi}B_{1})^{\ast}$ then the
$\chi$-quadratic variation coincides with the quadratic variation of a
$B_{1}$-valued semimartingale. We evaluate the $\chi$-covariation of various
processes for several examples of $\chi$ with a particular attention to the
case $B_{1}=B_{2}=C([-\tau,0])$ for some $\tau>0$ and $\X$ and $\Y$ being
\textit{window processes}. If $X$ is a real valued process, we call window
process associated with $X$ the $C([-\tau,0])$-valued process $\X:=X(\cdot)$
defined by $X_t(y) = X_{t+y}$, where $y \in [-\tau,0]$. The It\^o formula
introduced here is an important instrument to establish a representation result
of Clark-Ocone type for a class of path dependent random variables of type
$h=H(X_{T}(\cdot))$, $H:C([-T,0])\longrightarrow\R$ for not-necessarily
semimartingales $X$ with finite quadratic variation. This representation will
be linked to a function $u:[0,T]\times C([-T,0])\longrightarrow \mathbb{R}$
solving an infinite dimensional partial differential equation.
","[{""version"":""v1"",""created"":""Sat, 11 Dec 2010 19:44:08 GMT""},{""version"":""v2"",""created"":""Fri, 23 Mar 2012 07:12:07 GMT""},{""version"":""v3"",""created"":""Wed, 27 Feb 2013 16:29:42 GMT""}]","2013-02-28"
"1012.2485","Sandro Palestini","Sandro Palestini (CERN)","Angular distribution and rotations of frame in vector meson decays into
  lepton pairs","7 pages, 3 figures","Phys.Rev.D83:031503,2011","10.1103/PhysRevD.83.031503","CERN-PH-EP-2010-080","hep-ph hep-ex","http://arxiv.org/licenses/nonexclusive-distrib/1.0/","  We discuss how the angular distribution of lepton pairs from decays of vector
mesons depends on the choice of reference frame, and provide a geometrical
description of the transformations of the coefficients of the angular
distribution. Invariant expressions involving all coefficients are discussed,
together with bounds and consistency relations.
","[{""version"":""v1"",""created"":""Sat, 11 Dec 2010 20:07:24 GMT""}]","2011-02-18"
"1012.2486","Boris E. Nadgorny","P. Kharel, P. Thapa, P. Lukashev, R. F. Sabirianov, E. Y. Tsymbal, D.
  J. Sellmyer, and B. Nadgorny","Transport Spin Polarization of High-Curie Temperature MnBi Films",,,"10.1103/PhysRevB.83.024415",,"cond-mat.mtrl-sci","http://arxiv.org/licenses/nonexclusive-distrib/1.0/","  We report on the study of the structural, magnetic and transport properties
of highly textured MnBi films with the Curie temperature of 628K. In addition
to detailed measurements of resistivity and magnetization, we measure transport
spin polarization of MnBi by Andreev reflection spectroscopy and perform fully
relativistic band structure calculations of MnBi. A spin polarization from
51\pm1 to 63\pm1% is observed, consistent with the calculations and with an
observation of a large magnetoresistance in MnBi contacts. The band structure
calculations indicate that, in spite of almost identical densities of states at
the Fermi energy, the large disparity in the Fermi velocities leads to high
transport spin polarization of MnBi. The correlation between the values of
magnetization and spin polarization is discussed.
","[{""version"":""v1"",""created"":""Sat, 11 Dec 2010 20:10:56 GMT""}]","2015-05-20"
"1012.2487","Jos\'e Herman Mu\~noz","J. H. Mu\~noz (University of Tolima, CBPF), N. Quintero (University of
  Tolima, CINVESTAV)","Useful ratios between two-body nonleptonic and semileptonic decays of B
  mesons","17 Pages, Version accepted for publication in Rev. Mex. Fis., The
  title was changed, in section 2 some equations were eliminated, one paragraph
  was added in section 3, section 5 and the appendix were re-written and
  section 6 was extended",,,,"hep-ph","http://arxiv.org/licenses/nonexclusive-distrib/1.0/","  We compute important ratios between decay widths of some exclusive two-body
nonleptonic and semileptonic B decays, which could be test of factorization hy-
pothesis. We also present a summary of the expressions of the decay widths and
differential decay rates of these decays, at tree level, including l = 0
(ground state), l = 1 (orbitally excited) and n = 2 (radially excited) mesons
in the fi- nal state. From a general point of view, we consider eight
transitions, namely H \rightarrow P, V, S, A, A, T, P (2S), V (2S). Our
analysis is carried out assuming factorization hypothesis and using the WSB,
ISGW and CLFA quark models.
","[{""version"":""v1"",""created"":""Sat, 11 Dec 2010 21:13:39 GMT""},{""version"":""v2"",""created"":""Mon, 16 May 2011 14:06:58 GMT""}]","2011-05-17"
"1012.2488","Taras Banakh","Taras Banakh and Volodymyr Gavrylkiv","Algebra in the superextensions of semilattices","10 pages","Algebra Discr. Math. 13:1 (2012) 26-42",,,"math.GR math.RA","http://arxiv.org/licenses/nonexclusive-distrib/1.0/","  Given a semilattice $X$ we study the algebraic properties of the semigroup
$\upsilon(X)$ of upfamilies on $X$. The semigroup $\upsilon(X)$ contains the
Stone-Cech extension $\beta(X)$, the superextension $\lambda(X)$, and the space
of filters $\phi(X)$ on $X$ as closed subsemigroups. We prove that
$\upsilon(X)$ is a semilattice iff $\lambda(X)$ is a semilattice iff $\phi(X)$
is a semilattice iff the semilattice $X$ is finite and linearly ordered. We
prove that the semigroup $\beta(X)$ is a band if and only if $X$ has no
infinite antichains, and the semigroup $\lambda(X)$ is commutative if and only
if $X$ is a bush with finite branches.
","[{""version"":""v1"",""created"":""Sat, 11 Dec 2010 21:13:56 GMT""},{""version"":""v2"",""created"":""Tue, 16 Aug 2011 19:33:21 GMT""}]","2012-12-19"
"1012.2489","Chazottes","J.-R. Chazottes, F. Redig, F. V\""ollering","Poincar\'e inequality for Markov random fields via disagreement
  percolation","21 pages, a few corrections made. To appear in Indagationes
  Mathematicae (special issue in the memory of F. Takens)",,,,"math.PR math-ph math.MP","http://arxiv.org/licenses/nonexclusive-distrib/1.0/","  We consider Markov random fields of discrete spins on the lattice $\Zd$. We
use a technique of coupling of conditional distributions. If under the coupling
the disagreement cluster is ""sufficiently"" subcritical, then we prove the
Poincar\'e inequality. In the whole subcritical regime, we have a weak
Poincar\'e inequality and corresponding polynomial upper bound for the
relaxation of the associated Glauber dynamics.
","[{""version"":""v1"",""created"":""Sat, 11 Dec 2010 21:29:52 GMT""},{""version"":""v2"",""created"":""Fri, 6 May 2011 15:07:36 GMT""},{""version"":""v3"",""created"":""Tue, 20 Sep 2011 12:39:36 GMT""}]","2011-09-21"
"1012.2490","Florin Diacu","Florin Diacu","Polygonal Homographic Orbits of the Curved n-Body Problem","24 pages, 2 figures","Trans. Amer. Math. Soc. 364, 5 (2012), 2783-2802",,,"math.DS math-ph math.MP","http://arxiv.org/licenses/nonexclusive-distrib/1.0/","  In the $2$-dimensional $n$-body problem, $n\ge 3$, in spaces of constant
curvature, $\kappa\ne 0$, we study polygonal homographic solutions. We first
provide necessary and sufficient conditions for the existence of these orbits
and then consider the case of regular polygons. We further use this criterion
to show that, for any $n\ge 3$, the regular $n$-gon is a polygonal homographic
orbit if and only if all masses are equal. Then we prove the existence of
relative equilibria of non-equal masses on the sphere of curvature $\kappa>0$
for $n=3$ in the case of scalene triangles. Such triangular relative equilibria
occur only along fixed geodesics and are generated from fixed points of the
sphere. Finally, through a classification of the isosceles case, we prove that
not any three masses can form a triangular relative equilibrium.
","[{""version"":""v1"",""created"":""Sat, 11 Dec 2010 21:41:58 GMT""},{""version"":""v2"",""created"":""Wed, 9 Feb 2011 19:06:34 GMT""}]","2012-02-21"
