"1012.2491","Vasileios Zografos","Vasileios Zografos and Bernard Buxton","Affine Invariant, Model-Based Object Recognition Using Robust Metrics
  and Bayesian Statistics",,"Image Analysis and Recognition Lecture Notes in Computer Science,
  2005, Volume 3656/2005, 407-414","10.1007/11559573_51",,"cs.CV","http://arxiv.org/licenses/nonexclusive-distrib/1.0/","  We revisit the problem of model-based object recognition for intensity images
and attempt to address some of the shortcomings of existing Bayesian methods,
such as unsuitable priors and the treatment of residuals with a non-robust
error norm. We do so by using a refor- mulation of the Huber metric and
carefully chosen prior distributions. Our proposed method is invariant to
2-dimensional affine transforma- tions and, because it is relatively easy to
train and use, it is suited for general object matching problems.
","[{""version"":""v1"",""created"":""Sat, 11 Dec 2010 21:48:51 GMT""}]","2010-12-14"
"1012.2492","Eytan Grosfeld","Eytan Grosfeld and Ady Stern","Observing Majorana bound states of Josephson vortices in topological
  superconductors","10 pages, 3 figures, published version (title modified)","PNAS 108, 11810 (2011)","10.1073/pnas.1101469108",,"cond-mat.supr-con cond-mat.mes-hall","http://arxiv.org/licenses/nonexclusive-distrib/1.0/","  In recent years there has been an intensive search for Majorana fermion
states in condensed matter systems. Predicted to be localized on cores of
vortices in certain non-conventional superconductors, their presence is known
to render the exchange statistics of bulk vortices non-Abelian. Here we study
the equations governing the dynamics of phase solitons (fluxons) in a long
Josephson junction in a topological superconductor. We show that the fluxon
will bind a localized zero energy Majorana mode and will consequently behave as
a non-Abelian anyon. The low mass of the fluxon, as well as its experimentally
observed quantum mechanical wave-like nature, will make it a suitable candidate
for vortex interferometry experiments demonstrating non-Abelian statistics. We
suggest two experiments that may reveal the presence of the zero mode carried
by the fluxon. Specific experimental realizations will be discussed as well.
","[{""version"":""v1"",""created"":""Sat, 11 Dec 2010 22:11:55 GMT""},{""version"":""v2"",""created"":""Thu, 18 Aug 2011 02:15:55 GMT""}]","2012-10-30"
"1012.2493","Alain Bellerive","Alain Bellerive","New Results on Solar Neutrinos","Prepared for 35th International Conference of High Energy Physics,
  Paris, France, July 22-28, 2010",,,,"hep-ex nucl-ex","http://arxiv.org/licenses/nonexclusive-distrib/1.0/","  This paper reviews the constraints on the solar neutrino mixing parameters
with data collected by the Homestake, SAGE, GALLEX, Kamiokande,
SuperKamiokande, Borexino and SNO experiments. An emphasis will be given to the
global solar neutrino analyses in terms of matter-enhanced oscillation of two
and three active flavors. The results to-date, including both solar model
dependent and independent measurements, indicate that electron neutrinos are
changing to other active types on route to the Earth from the Sun. The total
flux of solar neutrinos is found to be in very good agreement with solar model
calculations. Today, solar neutrino measurements focus on greater accuracy for
mixing parameters and on better sensitivity to low neutrino energies. This
article also summarizes near future prospects in the field of solar neutrino
physics.
","[{""version"":""v1"",""created"":""Sat, 11 Dec 2010 22:20:08 GMT""}]","2010-12-14"
"1012.2494","James Rossmanith","J.A. Rossmanith and D.C. Seal","A positivity-preserving high-order semi-Lagrangian discontinuous
  Galerkin scheme for the Vlasov-Poisson equations","48 pages, 13 figures",,"10.1016/j.jcp.2011.04.018",,"math.NA physics.plasm-ph","http://arxiv.org/licenses/nonexclusive-distrib/1.0/","  The Vlasov-Poisson equations describe the evolution of a collisionless
plasma, represented through a probability density function (PDF) that
self-interacts via an electrostatic force. One of the main difficulties in
numerically solving this system is the severe time-step restriction that arises
from parts of the PDF associated with moderate-to-large velocities. The
dominant approach in the plasma physics community for removing these time-step
restrictions is the so-called particle-in-cell (PIC) method, which discretizes
the distribution function into a set of macro-particles, while the electric
field is represented on a mesh. Several alternatives to this approach exist,
including fully Lagrangian, fully Eulerian, and so-called semi-Lagrangian
methods. The focus of this work is the semi-Lagrangian approach, which begins
with a grid-based Eulerian representation of both the PDF and the electric
field, then evolves the PDF via Lagrangian dynamics, and finally projects this
evolved field back onto the original Eulerian mesh. In particular, we develop
in this work a method that discretizes the 1+1 Vlasov-Poisson system via a
high-order discontinuous Galerkin (DG) method in phase space, and an operator
split, semi-Lagrangian method in time. Second-order accuracy in time is
relatively easy to achieve via Strang operator splitting. With additional work,
using higher-order splitting and a higher-order method of characteristics, we
also demonstrate how to push this scheme to fourth-order accuracy in time. We
show how to resolve all of the Lagrangian dynamics in such a way that mass is
exactly conserved, positivity is maintained, and high-order accuracy is
achieved. The Poisson equation is solved to high-order via the smallest stencil
local discontinuous Galerkin (LDG) approach. We test the proposed scheme on
several standard test cases.
","[{""version"":""v1"",""created"":""Sat, 11 Dec 2010 22:31:01 GMT""},{""version"":""v2"",""created"":""Sat, 26 Mar 2011 23:54:05 GMT""}]","2015-05-20"
"1012.2495","Marcos Menezes","Marcos G. Menezes, Rodrigo B. Capaz, Jorge L. B. Faria","Gap Opening by Asymmetric Doping in Graphene Bilayers","6 pages and 7 figures","Physical Review B 82, 245414 (2010)","10.1103/PhysRevB.82.245414",,"cond-mat.mes-hall","http://arxiv.org/licenses/nonexclusive-distrib/1.0/","  We study the energy gap opening in the electronic spectrum of graphene
bilayers caused by asym- metric doping. Both substitutional impurities (boron
acceptors and nitrogen donors) and adsorbed potassium donors are considered.
The gap evolution with dopant concentration is compared to the situation in
which the asymmetry between the layers is induced by an external electric
field. The effects of adsorbed potassium are similar to that of an electric
field, but substitutional impurities behave quite differently, showing smaller
band gaps and a large sensitivity to disorder and sublattice occupation.
","[{""version"":""v1"",""created"":""Sat, 11 Dec 2010 22:59:03 GMT""}]","2010-12-14"
"1012.2496","Salvador Abreu","Daniel Diaz, Salvador Abreu and Philippe Codognet","On the Implementation of GNU Prolog","30 pages, 3 figures, To appear in Theory and Practice of Logic
  Programming (TPLP); Keywords: Prolog, logic programming system, GNU, ISO,
  WAM, native code compilation, Finite Domain constraints",,,,"cs.PL cs.AI","http://arxiv.org/licenses/nonexclusive-distrib/1.0/","  GNU Prolog is a general-purpose implementation of the Prolog language, which
distinguishes itself from most other systems by being, above all else, a
native-code compiler which produces standalone executables which don't rely on
any byte-code emulator or meta-interpreter. Other aspects which stand out
include the explicit organization of the Prolog system as a multipass compiler,
where intermediate representations are materialized, in Unix compiler
tradition. GNU Prolog also includes an extensible and high-performance finite
domain constraint solver, integrated with the Prolog language but implemented
using independent lower-level mechanisms. This article discusses the main
issues involved in designing and implementing GNU Prolog: requirements, system
organization, performance and portability issues as well as its position with
respect to other Prolog system implementations and the ISO standardization
initiative.
","[{""version"":""v1"",""created"":""Sat, 11 Dec 2010 23:23:11 GMT""},{""version"":""v2"",""created"":""Wed, 15 Dec 2010 15:07:58 GMT""}]","2010-12-16"
"1012.2497","Serge Shpyrko","Eva Majern\'ikov\'a, Serge Shpyrko","Quantum phase crossover and chaos in generalized Jahn-Teller lattice
  model","19 pages, 7 figures, in progress in J.Phys.A","J. Phys. A: Math. Theor. 44 065101 (2011)","10.1088/1751-8113/44/6/065101",,"cond-mat.quant-gas","http://arxiv.org/licenses/nonexclusive-distrib/1.0/","  The generalized multispin Jahn-Teller model on a finite lattice or formally
equivalent Dicke model extended to two long-wavelength coherent bosons of
different frequencies is shown to exhibit a crossover between the
polaron-modified ""quasi-normal"" and the squeezed ""radiation"" domains. We
investigate effects of two kinds of interfering fluctuations on the phase
crossover and on statistical characteristics of boson complex spectra: (i)
Fluctuations in the electron subsystem- finite-size quantum fluctuations- are
responsible for the dephasing of the coherence in the radiation domain and for
the moderate occupation of the excited states in the normal domain. In the
quasiclassical limit, radiation phase implies existence of a coherent acoustic
super-radiant phase. (ii) Level-spacing fluctuations in excited boson level
subsystem with strong level repulsions. Related probability distributions are
shown to be non-universally spread between the limiting universal Wigner-Dyson
and Poisson distributions. We proved that the difference in boson frequencies
is responsible for reaching the most stochastic limit of the Wigner-Dyson
distribution. Instanton lattice as a sequence of tunneling events in the most
chaotic radiation domain exhibits maximal number of level-avoidings
(repulsions). The non-universality of the distributions is caused by boson
correlations which compete the level repulsions.
","[{""version"":""v1"",""created"":""Sat, 11 Dec 2010 23:39:06 GMT""}]","2016-08-14"
"1012.2498","Leszek Prochniak","S. G. Rohozinski, L. Prochniak, Ch. Droste and K. Starosta","Signatures of chirality in the core-particle-hole systems","9 pages, 7 figures. Presented at the 17th Nuclear Physics Conference
  ""Marie and Pierre Curie"" on ""Symmetry and Symmetry Breaking in Nuclear
  Physics"", Kazimierz Dolny, 22-26 September 2010, Poland. Accepted for
  publication in Int. Jour. of Mod. Physics E",,"10.1142/S0218301311017739",,"nucl-th","http://arxiv.org/licenses/nonexclusive-distrib/1.0/","  An odd-odd nucleus is treated as the core-particle-hole system. The core is
described by the Bohr Hamiltonian. Different collective potentials of the core
are investigated. The odd particle and hole are assumed to be in the symmetric
[proton h11/2]x[neutron hole h11/2] configuration. Signatures of chirality in
the odd-odd nucleus spectra are observed. The sufficient condition for the
appearance of signatures of chirality in the core-particle-hole system is the
alpha-symmetry of the core provided the particle-hole configuration of the odd
valence particles is symmetric.
","[{""version"":""v1"",""created"":""Sat, 11 Dec 2010 23:44:03 GMT""}]","2015-05-20"
"1012.2499","L.T. Handoko","Z. Akbar, I. Firmansyah, B. Hermanto, L.T. Handoko","openPC : a toolkit for public cluster with full ownership","8 pages","Int. J. Comput. Theor. Eng. 2 (2010) 978-985","10.7763/IJCTE.2010.V2.273","FISIKALIPI-10037","cs.DC","http://arxiv.org/licenses/nonexclusive-distrib/1.0/","  The openPC is a set of open source tools that realizes a parallel machine and
distributed computing environment divisible into several independent blocks of
nodes, and each of them is remotely but fully in any means accessible for users
with a full ownership policy. The openPC components address fundamental issues
relating to security, resource access, resource allocation, compatibilities
with heterogeneous middlewares, user-friendly and integrated web-based
interfaces, hardware control and monitoring systems. These components have been
deployed successfully to the LIPI Public Cluster which is open for public use.
In this paper, the unique characteristics of openPC due to its rare
requirements are introduced, its components and a brief performance analysis
are discussed.
","[{""version"":""v1"",""created"":""Sun, 12 Dec 2010 00:15:44 GMT""}]","2013-06-18"
"1012.2500","Stefan Sint","Bjorn Leder and Stefan Sint","Testing universality and automatic O(a) improvement in massless lattice
  QCD with Wilson quarks","7 pages, 10 figures, contribution to Lattice 2010, to appear in the
  proceedings",,,,"hep-lat","http://arxiv.org/licenses/nonexclusive-distrib/1.0/","  The chirally rotated Schroedinger functional provides a test bed for
universality and automatic O(a) improvement. We here report on extensive
quenched simulations of lattice QCD with Wilson quarks in the massless limit.
We demonstrate that, after proper tuning of a dimension 3 boundary counterterm,
the expected chirally rotated boundary conditions are indeed obtained. This
implies automatic O(a) improvement which we then verify in a few examples.
Universality of properly renormalized correlation functions is confirmed by
comparing to the standard set-up of the Schroedinger functional. As a
by-product of this study the non-singlet current renormalisation constants Z_A
and Z_V are obtained from ratios of 2-point functions.
","[{""version"":""v1"",""created"":""Sun, 12 Dec 2010 00:32:12 GMT""}]","2010-12-14"
"1012.2501","L.T. Handoko","A. Hartanto, F.P. Zen, J.S. Kosasih, L.T. Handoko","Dynamical symmetry breaking of SU(6) GUT in 5-dimensional spacetime with
  orbifold S1/Z2","4 pages","AIP Conf.Proc.1244:272-275,2010","10.1063/1.4757170","FISIKALIPI-09032","hep-ph","http://arxiv.org/licenses/nonexclusive-distrib/1.0/","  The symmetry breaking of 5-dimensional SU(6) GUT into 4-dimensional SU(3) x
SU(3) x U(1) with orbifold S1/Z2 through Scherk-Schwarz mechanism is
investigated. It is shown that the origin of Little Higgs can be generated to
further break SU(3) x SU(3) x U(1) down to the electroweak scale through Higgs
mechanism.
","[{""version"":""v1"",""created"":""Sun, 12 Dec 2010 00:35:14 GMT""}]","2015-05-20"
"1012.2502","Kiyoshi Kamimura","Roberto Casalbuoni, Joaquim Gomis and Kiyoshi Kamimura","SuperParticle realization of twisted N=2 SUSY algebra","12 pages, no figure","JHEP 1101:098,2011","10.1007/JHEP01(2011)098","ICCUB-10-174,UB-ECM-PF 10/42","hep-th","http://arxiv.org/licenses/nonexclusive-distrib/1.0/","  We construct a pseudoclassical particle model associated to the twisted N=2
SUSY algebra in four dimensions. The particle model has four kappa symmetries.
Three of them can be used to reduce the model to the vector supersymmetry
particle case. The quantization of the model gives rise to two copies of the 4d
Dirac equation. The kappa symmetries result to be associated to 4 TSUSY
invariant bilinear odd operators who are null operators when a particular
condition is satisfied. These operators are in correspondence one to one with
analogous operators existing in the case of the N=2 SUSY algebra, making both
cases 1/2 BPS.
","[{""version"":""v1"",""created"":""Sun, 12 Dec 2010 00:37:21 GMT""}]","2011-02-03"
"1012.2503","Dmitry Dolgopyat","Dmitry Dolgopyat and Ilya Goldsheid","Quenched limit theorems for nearest neighbour random walks in 1D random
  environment",,,,,"math.PR","http://arxiv.org/licenses/nonexclusive-distrib/1.0/","  It is well known that random walks in one dimensional random environment can
exhibit subdiffusive behavior due to presence of traps. In this paper we show
that the passage times of different traps are asymptotically independent
exponential random variables with parameters forming, asymptotically, a Poisson
process. This allows us to prove weak quenched limit theorems in the
subdiffusive regime where the contribution of traps plays the dominating role.
","[{""version"":""v1"",""created"":""Sun, 12 Dec 2010 00:52:22 GMT""}]","2010-12-14"
"1012.2504","Jiapu Zhang","Jiapu Zhang, Jie Sun, Changzhi Wu","Optimal atomic-resolution structures of prion AGAAAAGA amyloid fibrils","The paper corrects many errors of old versions","J of Theor. Biology 279 (1), 17-28 (2011)","10.1016/j.jtbi.2011.02.012","PMID 21420420","q-bio.BM physics.bio-ph","http://creativecommons.org/licenses/by-nc-sa/3.0/","  X-ray crystallography is a powerful tool to determine the protein 3D
structure. However, it is time-consuming and expensive, and not all proteins
can be successfully crystallized, particularly for membrane proteins. Although
nuclear magnetic resonance (NMR) spectroscopy is indeed a very powerful tool in
determining the 3D structures of membrane proteins, it is also time-consuming
and costly. To the best of the authors' knowledge, there is little structural
data available on the AGAAAAGA palindrome in the hydrophobic region (113-120)
of prion proteins due to the noncrystalline and insoluble nature of the amyloid
fibril, although many experimental studies have shown that this region has
amyloid fibril forming properties and plays an important role in prion
diseases. In view of this, the present study is devoted to address this problem
from computational approaches such as global energy optimization, simulated
annealing, and structural bioinformatics. The optimal atomic-resolution
structures of prion AGAAAAGA amyloid fibils reported in this paper have a value
to the scientific community in its drive to find treatments for prion diseases.
","[{""version"":""v1"",""created"":""Sun, 12 Dec 2010 01:01:50 GMT""},{""version"":""v2"",""created"":""Sun, 2 Jan 2011 19:01:55 GMT""},{""version"":""v3"",""created"":""Fri, 21 Jan 2011 06:43:18 GMT""},{""version"":""v4"",""created"":""Fri, 18 Feb 2011 06:26:14 GMT""},{""version"":""v5"",""created"":""Tue, 22 Mar 2011 02:22:56 GMT""},{""version"":""v6"",""created"":""Mon, 11 Apr 2011 08:23:30 GMT""}]","2013-12-10"
"1012.2505","Kazumi Suematsu","Kazumi Suematsu","Minor Amendment of the Local Free Energy","2 pages",,,,"cond-mat.soft physics.chem-ph","http://arxiv.org/licenses/nonexclusive-distrib/1.0/","  We make minor amendment for the theory of the local free energy which has
been frequently criticized so far by physicists as a fundamental deficiency of
the Flory theory.
","[{""version"":""v1"",""created"":""Sun, 12 Dec 2010 01:50:21 GMT""}]","2010-12-14"
"1012.2506","Qiang Li","Juan Zhou, Qing Jie, Lijun Wu, Ivo Dimitrov, Xun Shi, and Qiang Li","Nanostructures and Defects in Non-equilibrium Synthesized Filled
  Skutterudite CeFe4Sb12",,,"10.1557/jmr.2011.79",,"cond-mat.mtrl-sci","http://arxiv.org/licenses/nonexclusive-distrib/1.0/","  We studied nanoprecipitates and defects in p-type filled skutterudite
CeFe4Sb12 prepared by non-equilibrium melt-spinning plus spark plasma sintering
method using transmission electron microscopy. Nanoprecipitates with mostly
spherical shapes and different sizes (from several nm to several tens of nm)
have been observed. The most typically observed nanoprecipitates are shown to
be Sb-rich. Superlattices with a periodicity of about 3.576 nm were induced by
the ordering of excessive Sb atoms along the c direction. These
nanoprecipitates usually share coherent interfaces with the surrounding matrix
and induce anisotropic and strong strain fields in the surrounding matrix.
Nanoprecipitates with compositions close to CeSb2 are much larger in size (~ 30
nm) and have orthorhombic structures. Various defects were typically observed
on the interfaces between these nanoprecipitates and the matrix. The strain
fields induced by these nanoprecipitates are less distinct, possibly because
part of the strains has been released by the formation of defects.
","[{""version"":""v1"",""created"":""Sun, 12 Dec 2010 03:12:44 GMT""}]","2015-05-20"
"1012.2507","Ryoki Fukushima","Ryoki Fukushima and Naomasa Ueki","Moment asymptotics for the parabolic Anderson problem with a perturbed
  lattice potential","18 pages","Journal of Functional Analysis 2011, Volume 260, Issue 3, 724-744","10.1016/j.jfa.2010.10.016",,"math.PR math-ph math.MP","http://arxiv.org/licenses/nonexclusive-distrib/1.0/","  The parabolic Anderson problem with a random potential obtained by attaching
a long tailed potential around a randomly perturbed lattice is studied. The
moment asymptotics of the total mass of the solution is derived.The results
show that the total mass of the solution concentrates on a small set in the
space of configuration.
","[{""version"":""v1"",""created"":""Sun, 12 Dec 2010 04:38:53 GMT""}]","2010-12-14"
"1012.2508","Ryoki Fukushima","Ryoki Fukushima and Naomasa Ueki","Classical and quantum behavior of the integrated density of states for a
  randomly perturbed lattice","27 pages","Annales Henri Poincare 2010, Vol. 11, Issue 6, 1053-1083","10.1007/s00023-010-0051-6",,"math.PR math-ph math.MP","http://arxiv.org/licenses/nonexclusive-distrib/1.0/","  The asymptotic behavior of the integrated density of states for a randomly
perturbed lattice at the infimum of the spectrum is investigated. The leading
term is determined when the decay of the single site potential is slow. The
leading term depends only on the classical effect from the scalar potential. To
the contrary, the quantum effect appears when the decay of the single site
potential is fast. The corresponding leading term is estimated and the leading
order is determined. In the multidimensional cases, the leading order varies in
different ways from the known results in the Poisson case. The same problem is
considered for the negative potential. These estimates are applied to
investigate the long time asymptotics of Wiener integrals associated with the
random potentials.
","[{""version"":""v1"",""created"":""Sun, 12 Dec 2010 04:39:50 GMT""}]","2010-12-14"
"1012.2509","Arthur Asuncion","Arthur U. Asuncion and Michael T. Goodrich (Department of Computer
  Science, University of California, Irvine)","Nonadaptive Mastermind Algorithms for String and Vector Databases, with
  Case Studies",,,,,"cs.CR","http://arxiv.org/licenses/nonexclusive-distrib/1.0/","  In this paper, we study sparsity-exploiting Mastermind algorithms for
attacking the privacy of an entire database of character strings or vectors,
such as DNA strings, movie ratings, or social network friendship data. Based on
reductions to nonadaptive group testing, our methods are able to take advantage
of minimal amounts of privacy leakage, such as contained in a single bit that
indicates if two people in a medical database have any common genetic
mutations, or if two people have any common friends in an online social
network. We analyze our Mastermind attack algorithms using theoretical
characterizations that provide sublinear bounds on the number of queries needed
to clone the database, as well as experimental tests on genomic information,
collaborative filtering data, and online social networks. By taking advantage
of the generally sparse nature of these real-world databases and modulating a
parameter that controls query sparsity, we demonstrate that relatively few
nonadaptive queries are needed to recover a large majority of each database.
","[{""version"":""v1"",""created"":""Sun, 12 Dec 2010 04:43:19 GMT""}]","2010-12-14"
"1012.2510","Kamaljit  I Lakhtaria","Kamaljit I. Lakhtaria","Analyzing Zone Routing Protocol in MANET Applying Authentic Parameter","5 Pages, 5 Figures","Kamaljit I. Lakhtaria, ""Analyzing Zone Routing Protocol in MANET
  Applying Authentic Parameter"", in Global Journal of Computer Science &
  Technology, Online ISSN: 0975-4172 Print ISSN: 0975-4350, Vol. 10, Issue 4,
  Year 2010, Page no. 114-118",,"GJCST Journal, Volume No 10, Issue 4, Year 2010","cs.NI","http://arxiv.org/licenses/nonexclusive-distrib/1.0/","  Routing is the main part of wireless adhoc network conventionally there are
two approaches first one is Proactive and another one is Reactive. Both these
approaches have some substantial disadvantage and to overcome hybrid routing
protocols designed. ZRP (Zone Routing Protocol) is one of the hybrid routing
protocols, it takes advantage of proactive approach by providing reliability
within the scalable zone, and for beyond the scalable zone it looks for the
reactive approach. It (ZRP) uses the proactive and the reactive routing
according to the need of the application at that particular instance of time
depending upon the prevailing scenario. This work revolves around the
performance of ZRP against realistic parameters by varying various attributes
such as Zone Radius of ZRP in different node density. Results vary as we change
the node density on Qualnet 4.0 network simulator.
","[{""version"":""v1"",""created"":""Sun, 12 Dec 2010 06:33:17 GMT""}]","2010-12-14"
