"1012.2511","Hong Li","Hong Li, Jie Liu, Jun-Qing Xia and Yi-Fu Cai","Cold Dark Matter Isocurvature Perturbations: Cosmological Constraints
  and Applications","9 pages, 5 figures, 3 tables, references added","Phys.Rev.D83:123517,2011","10.1103/PhysRevD.83.123517",,"astro-ph.CO gr-qc hep-ph hep-th","http://arxiv.org/licenses/nonexclusive-distrib/1.0/","  In this paper we present the constraints on cold dark matter (CDM)
isocurvature contributions to the cosmological perturbations. By employing
Markov Chain Monte Carlo method (MCMC), we perform a global analysis for
cosmological parameters using the latest astronomical data, such as 7-year
Wilkinson Microwave Anisotropy Probe (WMAP7) observations, matter power
spectrum from the Sloan Digital Sky Survey (SDSS) luminous red galaxies (LRG),
and ""Union2"" type Ia Supernovae (SNIa) sample. We find that the correlated
mixture of adiabatic and isocurvature modes are mildly better fitting to the
current data than the pure adiabatic ones, with the minimal $\chi^2$ given by
the likelihood analysis being reduced by 3.5. We also obtain a tight limit on
the fraction of the CDM isocurvature contributions, which should be less than
14.6% at 95% confidence level. With the presence of the isocurvature modes, the
adiabatic spectral index becomes slightly bigger, n_s^{\rm
adi}=0.972\pm0.014~(1\,\sigma), and the tilt for isocurvature spectrum could be
large, namely, the best fit value is n_s^{\rm iso}=3.020. Finally, we discuss
the effect on WMAP normalization priors, shift parameter R, acoustic scale l_A
and z_{*}, from the CDM isocurvaure perturbation. By fitting the mixed initial
condition to the combined data, we find the mean values of R, l_A and z_{*} can
be changed about 2.9\sigma, 2.8\sigma and 1.5\sigma respectively, comparing
with those obtained in the pure adiabatic condition.
","[{""version"":""v1"",""created"":""Sun, 12 Dec 2010 06:41:33 GMT""},{""version"":""v2"",""created"":""Tue, 14 Dec 2010 09:43:54 GMT""}]","2011-07-04"
"1012.2512","Max Karoubi","Max Karoubi","Twisted bundles and twisted K-theory","41 pages",,,,"math.KT","http://arxiv.org/licenses/nonexclusive-distrib/1.0/","  We offer here a more direct approach to twisted K-theory, based on the notion
of twisted vector bundles (of finite or infinite dimension) and of twisted
principal bundles. This is closeely related to the classical notion ot torsors
and bundles of modules over an algebra bundle.
  Twisted K-theory is simply defined as the Grothendieck group of twisted
vector bundles (with a given twist). The usual operations on vector bundles
(exterior powers, Adams operations) are easily extended to this twisted
framework. Graded twisted K-theory, which is important for the definition and
proof of the Thom isomorphism in this framework, is defined with the same
formalism.
  We also define a twisted Chern character with target ""twisted cohomology"".
Although there are many definitions of this character in the literature, our
method is more elementary and is based on the classical definitions of the
Chern-Weil theory, via connections and curvatures. In this way, we get explicit
formulas very much in the spirit of Steenrod's coordinate bundles.
","[{""version"":""v1"",""created"":""Sun, 12 Dec 2010 06:54:00 GMT""}]","2010-12-14"
"1012.2513","Naohisa Ogawa","Akiko Fukuhara, Fumitoshi Kaneko, and Naohisa Ogawa","Simple model of photo acoustic system for greenhouse effect","18 pages, 10 figures","J. Eur. Phys. 33, 623-635 (2012)",,,"physics.pop-ph physics.ed-ph","http://arxiv.org/licenses/nonexclusive-distrib/1.0/","  The green house effect is caused by the gases which absorb infrared ray (IR)
emitted by the earth. It is worthwhile if we can adjudicate on which gas causes
the greenhouse effect in our class. For this purpose, one of our authors,
Kaneko has designed an educational tool for testing greenhouse effect
\cite{Kaneko}. This system (hereafter abbreviated PAS) is constructed based on
photo acoustic effect. Without difficulty and high cost, we can build PAS and
check the IR absorption of gas. In this paper we give the simple theoretical
basis for this PAS. The amplitude of sound observed in PAS depends on the
modulation frequency of IR pulse. Its dependence can be explained by this
simple model. Further we show the sound amplitude does not depend on the
thermal diffusion, which provides the accuracy of amplitude as the IR
absorption rate of the gas. According to this model, sound signal is not the
sinusoidal function and it has higher harmonics. The theory and experiment are
compared in the third harmonics by spectrum analysis. From this apparatus and
theory, students can study not only the greenhouse effect but also the basics
of physics.
","[{""version"":""v1"",""created"":""Sun, 12 Dec 2010 07:11:01 GMT""},{""version"":""v2"",""created"":""Thu, 15 Sep 2011 08:29:52 GMT""}]","2012-04-24"
"1012.2514","Jaydip Sen","Jaydip Sen, P. Balamuralidhar, M. Girish Chandra, Harihara S.G., and
  Harish Reddy","Context Aware End-to-End Connectivity Management","8 pages, 3 figures. Second International Conference on Embedded
  Systems, Mobile Communication and Computing (ICEMCC), pp. 85 - 95, Bangalore,
  August 2007, India",,"10.13140/RG.2.1.3436.8247","ISSN: 0973-208X","cs.LG cs.NI","http://arxiv.org/licenses/nonexclusive-distrib/1.0/","  In a dynamic heterogeneous environment, such as pervasive and ubiquitous
computing, context-aware adaptation is a key concept to meet the varying
requirements of different users. Connectivity is an important context source
that can be utilized for optimal management of diverse networking resources.
Application QoS (Quality of service) is another important issue that should be
taken into consideration for design of a context-aware system. This paper
presents connectivity from the view point of context awareness, identifies
various relevant raw connectivity contexts, and discusses how high-level
context information can be abstracted from the raw context information.
Further, rich context information is utilized in various policy representation
with respect to user profile and preference, application characteristics,
device capability, and network QoS conditions. Finally, a context-aware
end-to-end evaluation algorithm is presented for adaptive connectivity
management in a multi-access wireless network. Unlike the currently existing
algorithms, the proposed algorithm takes into account user QoS parameters, and
therefore, it is more practical.
","[{""version"":""v1"",""created"":""Sun, 12 Dec 2010 07:22:05 GMT""}]","2021-09-07"
"1012.2515","Sang-Jin Sin","Xian-Hui Ge, Kwanghyun Jo and Sang-Jin Sin","Hydrodynamics of RN AdS$_4$ black hole and Holographic Optics","18+1 pages, 6 figures","JHEP 1103:104,2011","10.1007/JHEP03(2011)104",,"hep-th cond-mat.mtrl-sci","http://arxiv.org/licenses/nonexclusive-distrib/1.0/","  We consider the AdS$_4$ RN black hole and work out the momentum dependent
hydrodynamic analysis for the vector modes. We also perform the spectral
function calculation of the dual field theory. As an application, we consider
the permittivity and permeability and find that for low frequency regime, the
index of refraction is found to be negative, supporting the claim made in
ref.\cite{amariti} for AdS$_5$. We also find that at static limit the medium
has the zero permeability, a character of the superconductivity .
","[{""version"":""v1"",""created"":""Sun, 12 Dec 2010 07:27:02 GMT""},{""version"":""v2"",""created"":""Thu, 23 Dec 2010 06:51:27 GMT""}]","2011-04-20"
"1012.2516","Jaydip Sen","Jaydip Sen","An Efficient Security Mechanism for High-Integrity Wireless Sensor
  Networks","9 pages, 1 figure. Proceedings of the International Conference on
  Advances in Information and Communication Technologies (ICICOT), Manipal,
  India, December 28-30, 2007, pp. 86 - 97",,"10.13140/RG.2.1.2978.0722","ISBN: 0230-63437-0","cs.CR","http://arxiv.org/licenses/nonexclusive-distrib/1.0/","  Wireless sensor networks (WSNs) have recently attracted a lot of interest in
the research community due their wide range of applications. Unfortunately,
these networks are vulnerable to numerous security threats that can adversely
affect their proper functioning. This problem is more critical if the network
is deployed for some mission-critical applications such as in a tactical
battlefield. Random failure of nodes and intentional compromise of nodes by an
insider attack in a WSN pose particularly difficult challenges to security
engineers as these attacks cannot be defended by traditional cryptography-based
mechanisms. In this paper, a security solution is proposed for detecting
compromised and faulty nodes in a WSN. The mechanism also isolates a
compromised node from the network so that it cannot participate in any network
activity. The proposed mechanism is based on misbehavior classification,
behaviour monitoring and trust management. It involves minimum computation and
communication overhead and is ideally suited for a resource-constrained,
high-integrity WSN.
","[{""version"":""v1"",""created"":""Sun, 12 Dec 2010 07:32:11 GMT""}]","2021-09-07"
"1012.2517","Yury Lyubarsky","Yuri Lyubarsky","Asymptotic theory of relativistic, magnetized jets","To appear in Phys.RevE",,"10.1103/PhysRevE.83.016302",,"astro-ph.HE","http://arxiv.org/licenses/nonexclusive-distrib/1.0/","  The structure of a relativistically hot, strongly magnetized jet is
investigated at large distances from the source. Asymptotic equations are
derived describing collimation and acceleration of the externally confined jet.
Conditions are found for the transformation of the thermal energy into the
fluid kinetic energy or into the Poynting flux. Simple scalings are presented
for the jet collimation angle and Lorentz factors.
","[{""version"":""v1"",""created"":""Sun, 12 Dec 2010 07:37:06 GMT""}]","2015-05-20"
"1012.2518","Jaydip Sen","Jaydip Sen and Shomik Bhattacharya","A Survey on Cross-Layer Design Frameworks for Multimedia Applications
  over Wireless Networks","16 pages, 9 figures","International Journal of Computer Science and Information
  Technology (IJCSIT), Vol: 1, No:1, pp. 29-42, June 2008",,,"cs.NI cs.MM","http://arxiv.org/licenses/nonexclusive-distrib/1.0/","  In the last few years, the Internet throughput, usage and reliability have
increased almost exponentially. The introduction of broadband wireless mobile
ad hoc networks (MANETs) and cellular networks together with increased
computational power have opened the door for a new breed of applications to be
created, namely real-time multimedia applications. Delivering real-time
multimedia traffic over a complex network like the Internet is a particularly
challenging task since these applications have strict quality -of-service (QoS)
requirements on bandwidth, delay, and delay jitter. Traditional IP-based best
effort service will not be able to meet these stringent requirements. The
time-varying nature of wireless channels and resource constrained wireless
devices make the problem even more difficult. To improve perceived media
quality by end users over wireless Internet, QoS supports can be addressed in
different layers, including application layer, transport layer and link layer.
Cross layer design is a well-known approach to achieve this adaptation. In
cross-layer design, the challenges from the physical wireless medium and the
QoS-demands from the applications are taken into account so that the rate,
power, and coding at the physical layer can adapted to meet the requirements of
the applications given the current channel and network conditions. A number of
propositions for cross-layer designs exist in the literature. In this paper, an
extensive review has been made on these cross-layer architectures that combine
the application-layer, transport layer and the link layer controls.
Particularly the issues like channel estimation techniques, adaptive controls
at the application and link layers for energy efficiency, priority based
scheduling, transmission rate control at the transport layer, and adaptive
automatic repeat request (ARQ) are discussed in detail.
","[{""version"":""v1"",""created"":""Sun, 12 Dec 2010 07:40:07 GMT""}]","2010-12-14"
"1012.2519","Jaydip Sen","Jaydip Sen","A Distributed Trust and Reputation Framework for Mobile Ad Hoc Networks","10 pages, 7 figures, 1 table. Proceedings of the First International
  Workshop on Trust Management in Peer-to-Peer Systems (IWTMP2PS), pp. 538-547,
  July, 2010, Chennai, India",,"10.1007/978-3-642-14478-3_54","Springer Communication and Information Control Systems (CCIS)
  Series, Vol. 89","cs.CR","http://arxiv.org/licenses/nonexclusive-distrib/1.0/","  In a multi-hop mobile ad hoc network (MANET), mobile nodes cooperate to form
a network without using any infrastructure such as access points or base
stations. The mobility of the nodes and the fundamentally limited capacity of
the wireless medium, together with wireless transmission effects such as
attenuation, multi-path propagation, and interference combine to create
sig-nificant challenges for security in MANETs. Traditional cryptographic
mecha-nisms such as authentication and encryption are not capable of handling
some kinds of attacks such as packet dropping by malicious nodes in MANETs.
This paper presents a mechanism for detecting malicious packet dropping attacks
in MANETs. The mechanism is depends on a trust module on each node, which is
based on the reputation value computed for that node by its neighbors. The
reputation value of a node is computed based on its packet forwarding behavior
in the network. The reputation information is gathered, stored and exchanged
between the nodes, and computed under different scenario. The proposed
pro-tocol has been simulated in a network simulator. The simulation results
show the efficiency of its performance.
","[{""version"":""v1"",""created"":""Sun, 12 Dec 2010 08:01:18 GMT""}]","2021-09-07"
"1012.2520","Jaydip Sen","Jaydip Sen","A Trust-Based Detection Algorithm of Selfish Packet Dropping Nodes in a
  Peer-to-Peer Wireless Mesh Network","10 pages, 6 pages, 3 tables. Proceedings of the First Workshop on
  Trust Management in Peer-to-Peer Systems (IWTMP2PS), pp. 528- 537, July 2010,
  Chennai, India",,"10.1007/978-3-642-14478-3_53","Springer Communication and Information Control Systems (CCIS)
  Series, Vol. 89","cs.CR cs.NI","http://arxiv.org/licenses/nonexclusive-distrib/1.0/","  Wireless mesh networks (WMNs) are evolving as a key technology for
next-generation wireless networks showing raid progress and numerous
applications. These networks have the potential to provide robust and
high-throughput data delivery to wireless users. In a WMN, high speed routers
equipped with advanced antennas, communicate with each other in a multi-hop
fashion over wireless channels and form a broadband backhaul. However, the
throughput of a WMN may be severely degraded due to presence of some selfish
routers that avoid forwarding packets for other nodes even as they send their
own traffic through the network. This paper presents an algorithm for detection
of selfish nodes in a WMN that uses statistical theory of inference for
reliable clustering of the nodes based on local observations. Simulation
results show that the algorithm has a high detection rate and a low false
positive rate.
","[{""version"":""v1"",""created"":""Sun, 12 Dec 2010 08:10:53 GMT""}]","2021-09-07"
"1012.2521","Valeria Berti","A. Berti, V. Berti, D. Grandi","Well posedness of an isothermal diffusive model for binary mixtures of
  incompressible fluids",,,"10.1088/0951-7715/24/11/008",,"math-ph math.MP","http://arxiv.org/licenses/nonexclusive-distrib/1.0/","  We consider a model describing the behavior of a mixture of two
incompressible fluids with the same density in isothermal conditions. The model
consists of three balance equations: continuity equation, Navier-Stokes
equation for the mean velocity of the mixture, and diffusion equation
(Cahn-Hilliard equation). We assume that the chemical potential depends upon
the velocity of the mixture in such a way that an increase of the velocity
improves the miscibility of the mixture. We examine the thermodynamic
consistence of the model which leads to the introduction of an additional
constitutive force in the motion equation. Then, we prove existence and
uniqueness of the solution of the resulting differential problem.
","[{""version"":""v1"",""created"":""Sun, 12 Dec 2010 08:17:20 GMT""}]","2015-05-20"
"1012.2522","Taras Banakh","Taras Banakh, Volodymyr Mykhaylyuk, Lyubomyr Zdomskyy","On meager function spaces, network character and meager convergence in
  topological spaces","6 pages","Comment. Math. Univ. Carolinae, 52 (2011) 273-281",,,"math.GN","http://arxiv.org/licenses/nonexclusive-distrib/1.0/","  For a non-isolated point $x$ of a topological space $X$ the network character
$nw_\chi(x)$ is the smallest cardinality of a family of infinite subsets of $X$
such that each neighborhood $O(x)$ of $x$ contains a set from the family. We
prove that (1) each infinite compact Hausdorff space $X$ contains a
non-isolated point $x$ with $nw_\chi(x)=\aleph_0$; (2) for each point $x\in X$
with countable character there is an injective sequence in $X$ that
$\F$-converges to $x$ for some meager filter $\F$ on $\omega$; (3) if a
functionally Hausdorff space $X$ contains an $\F$-convergent injective sequence
for some meager filter $\F$, then for every $T_1$-space $Y$ that contains two
non-empty open sets with disjoint closures, the function space $C_p(X,Y)$ is
meager. Also we investigate properties of filters $\F$ admitting an injective
$\F$-convergent sequence in $\beta\omega$.
","[{""version"":""v1"",""created"":""Sun, 12 Dec 2010 08:21:44 GMT""},{""version"":""v2"",""created"":""Mon, 21 Feb 2011 20:31:43 GMT""}]","2011-08-23"
"1012.2523","Jakob Scholbach","Andreas Holmstrom and Jakob Scholbach","Arakelov motivic cohomology I","final version, to appear in Journal of Algebraic Geometry",,"10.1090/jag/648",,"math.NT math.AG math.KT","http://arxiv.org/licenses/nonexclusive-distrib/1.0/","  This paper introduces a new cohomology theory for schemes of finite type over
an arithmetic ring. The main motivation for this Arakelov-theoretic version of
motivic cohomology is the conjecture on special values of $L$-functions and
zeta functions formulated by the second author. Taking advantage of the six
functors formalism in motivic stable homotopy theory, we establish a number of
formal properties, including pullbacks for arbitrary morphisms, pushforwards
for projective morphisms between regular schemes, localization sequences,
$h$-descent. We round off the picture with a purity result and a higher
arithmetic Riemann-Roch theorem.
","[{""version"":""v1"",""created"":""Sun, 12 Dec 2010 08:27:38 GMT""},{""version"":""v2"",""created"":""Wed, 31 Aug 2011 10:04:39 GMT""},{""version"":""v3"",""created"":""Sat, 19 Oct 2013 10:56:26 GMT""},{""version"":""v4"",""created"":""Fri, 8 May 2015 07:50:41 GMT""}]","2015-05-11"
"1012.2524","Jaydip Sen","Jaydip Sen, Munir Sayyad, and Basavaraj Hooli","Convergence and Next Generation Networks","67 pages, 11 figures, 4 tables. Bootk Chapter published in the book
  ""Future trends and Challenegs for ICT Standardization"", pp. 107 - 192","BooK: Future Trends and Challenges for ICT Standardization.
  Editor: Ramjee Prasad, River Publishers, Aalborg, Denmark, 2010","10.13140/RG.2.1.2986.2640",,"cs.NI","http://arxiv.org/licenses/nonexclusive-distrib/1.0/","  The communications sector is undergoing significant changes, with the
emergence of a number of platforms available to provide a different range of
services. Some of these platforms are complementary to each other, while others
are competitive, or can provide a valid substitute for some of the services
provided. Up till now, the most important communications platform in most of
the developing countries has been the public switched telecommunication network
(PSTN) which provides access to all households and buildings. This universality
in providing access has also meant that the network has generally been
designated as one for universal service.This chapter focuses on the area where
the most significant changes are taking place in the communication sector. The
objective of this chapter is neither to give an overview of all communication
platforms, nor is it aimed to assess the relative extent to which different
platforms complement or compete with each other. The central theme of this
chapter is to examine the developments in what is commonly refereed to as next
generation access networks and next generation core networks and their role in
convergence.
","[{""version"":""v1"",""created"":""Sun, 12 Dec 2010 08:28:25 GMT""}]","2021-09-07"
"1012.2525","Naomichi Suzuki","Naomichi Suzuki, Minoru Biyajima and Takuya Mizoguchi","Estimation of multi-particle correlation from multiplicity distribution
  observed in relativisitic heavy ion collisions","10pages, 2figures, VI Workshop on Particle Correlation and Fentscopy,
  BITP, Ukraine, September 13-18, 2010",,,,"hep-ph","http://arxiv.org/licenses/nonexclusive-distrib/1.0/","  Analytical formula for multiplicity distribution is derived in the QO
approach, where chaotic and coherent fields are contained. Observed charged
multiplicity distributions in Au+Au collisions at $\sqrt{s}=200$ AGeV and in pp
collisions at $\sqrt{s}=900$ GeV are analyzed by the formula. Chaoticity
parameters in the inclusive events estimated from the analysis of multiplicity
distributions are compared with those estimated from the analysis of observed
two-particle inclusive identical particle correlations.
","[{""version"":""v1"",""created"":""Sun, 12 Dec 2010 08:41:15 GMT""}]","2013-03-26"
"1012.2526","Jianwen Dong","Zi-Lan Deng, Jian-Wen Dong, and He-Zhou Wang","In-plane plasmonic modes in a quasicrystalline array of metal
  nanoparticles","20 pages, 4 figures","Plasmonics, 6, 507 (2011)",,,"physics.optics","http://arxiv.org/licenses/nonexclusive-distrib/1.0/","  We investigated the plasmonic modes in a two-dimensional quasicrystalline
array of metal nanoparticles. The polarization of the modes is in the array
plane. A simplified eigen-decomposition method is presented with the help of
rotational symmetry. Two kinds of anti-phase ring modes with radial and
tangential polarizations are of highest spatial localizations among all of
plasmonic modes. For the leaky characteristic of the anti-phase ring modes, the
highest fidelity mode is found to be tangential polarized mode in the
quasicrystal array, whereas normal-to-plane polarized mode in the solo ring.
The leaky characteristics and spatial localizations of other plasmonic modes
are also studied, for example, collective vortex mode that may be potentially
useful to form negative responses in plasmonic device, and collective radial
mode that may be used to generate light sources with radial polarizations.
","[{""version"":""v1"",""created"":""Sun, 12 Dec 2010 09:45:42 GMT""}]","2012-12-11"
"1012.2527","Nicolaos Matsakis","Nicolaos Matsakis","Solving the Rural Postman problem using the Adleman-Lipton model",,,,,"cs.CC","http://arxiv.org/licenses/nonexclusive-distrib/1.0/","  In this survey we investigate the application of the Adleman-Lipton model on
Rural Postman problem, which given an undirected graph $G=(V,E)$ with positive
integer lengths on each of its edges and a subset $E^{'}\subseteq E$, asks
whether there exists a hamiltonian circuit that includes each edge of $E^{'}$
and has total cost (sum of edge lengths) less or equal to a given integer B (we
are allowed to use any edges of the set $E-E^{'}$, but we must use all edges of
the set $E'$). The Rural Postman problem (RPP) is a very interesting
NP-complete problem used, especially, in network optimization. RPP is actually
a special case of the Route Inspection problem, where we need to traverse all
edges of an undirected graph at a minimum total cost. As all NP-complete
problems, it currently admits no efficient solution and if actually $P\neq NP$
as it is widely accepted to be, it cannot admit a polynomial time algorithm to
solve it. The application of the Adleman-Lipton model on this problem, provides
an efficient way to solve RPP, as it is the fact for many other hard problems
on which the Adleman-Lipton model has been applied. In this survey, we provide
a polynomial algorithm based on the Lipton-Adleman model, which solves the RPP
in $\mathcal{O}(n^{2})$ time, where n refers to the input of the problem.
","[{""version"":""v1"",""created"":""Sun, 12 Dec 2010 10:14:22 GMT""},{""version"":""v2"",""created"":""Wed, 15 Dec 2010 11:44:59 GMT""}]","2010-12-16"
