"1003.4004","Jan Arthur Christophersen","Jan Arthur Christophersen","Deformations of equivelar Stanley-Reisner abelian surfaces","Revised version. Small improvements. Added drawings",,,,"math.AG","http://arxiv.org/licenses/nonexclusive-distrib/1.0/","  The versal deformation of Stanley-Reisner schemes associated to equivelar
triangulations of the torus is studied. The deformation space is defined by
binomials and there is a toric smoothing component which I describe in terms of
cones and lattices. Connections to moduli of abelian surfaces are considered.
The case of the M\""obius torus is especially nice and leads to a projective
Calabi-Yau 3-fold with Euler number 6.
","[{""version"":""v1"",""created"":""Sun, 21 Mar 2010 16:23:07 GMT""},{""version"":""v2"",""created"":""Sun, 13 Feb 2011 19:30:08 GMT""}]","2011-02-15"
"1003.4005","Tommaso Roscilde","Tommaso Roscilde","Exploring the grand-canonical phase diagram of interacting bosons in
  optical lattices by trap squeezing","27 pages, 26 figures. v2: added references and further discussion of
  the local-density approximation.","Phys. Rev. A 82, 023601 (2010)","10.1103/PhysRevA.82.023601",,"cond-mat.quant-gas","http://arxiv.org/licenses/nonexclusive-distrib/1.0/","  In this paper we theoretically discuss how quantum simulators based on
trapped cold bosons in optical lattices can explore the grand-canonical phase
diagram of homogeneous lattice boson models, via control of the trapping
potential independently of all other experimental parameters (trap squeezing).
Based on quantum Monte Carlo, we establish the general scaling relation linking
the global chemical potential to the Hamiltonian parameters of the Bose-Hubbard
model in a parabolic trap, describing cold bosons in optical lattices; we find
that this scaling relation is well captured by a modified Thomas-Fermi scaling
behavior - corrected for quantum fluctuations - in the case of high enough
density and/or weak enough interactions, and by a mean-field Gutzwiller Ansatz
over a much larger parameter range. The above scaling relation allows to
control experimentally the chemical potential, independently of all other
Hamiltonian parameters, via trap squeezing; given that the global chemical
potential coincides with the local chemical potential in the trap center,
measurements of the central density as a function of the chemical potential
gives access to the information on the bulk compressibility of the Bose-Hubbard
model. Supplemented with time-of-flight measurements of the coherence
properties, the measurement of compressibility enables one to discern among the
various possible phases realized by bosons in an optical lattice with or
without external (periodic or random) potentials -- e.g. superfluid, Mott
insulator, band insulator, and Bose glass. We theoretically demonstrate the
trap-squeezing investigation of the above phases in the case of bosons in a
one-dimensional optical lattice, and in a one-dimensional incommensurate
superlattice.
","[{""version"":""v1"",""created"":""Sun, 21 Mar 2010 16:28:14 GMT""},{""version"":""v2"",""created"":""Wed, 31 Mar 2010 15:26:52 GMT""}]","2015-03-13"
"1003.4006","Christine Joblin","F. Useli-Bacchitta, A. Bonnamy, G. Mulas, G. Malloci, D. Toublanc, C.
  Joblin","Visible photodissociation spectroscopy of PAH cations and derivatives in
  the PIRENEA experiment",,"Chemical Physics 371 (2010) 16-23","10.1016/j.chemphys.2010.03.012",,"physics.chem-ph astro-ph.IM","http://arxiv.org/licenses/nonexclusive-distrib/1.0/","  The electronic spectra of gas-phase cationic polycyclic aromatic hydrocarbons
(PAHs), trapped in the Fourier Transform Ion Cyclotron Resonance cell of the
PIRENEA experiment, have been measured by multiphoton dissociation spectroscopy
in the 430-480 nm spectral range using the radiation of a mid-band optical
parametric oscillator laser. We present here the spectra recorded for different
species of increasing size, namely the pyrene cation (C16H10+), the
1-methylpyrene cation (CH3-C16H9+), the coronene cation (C24H12+), and its
dehydrogenated derivative C24H10+. The experimental results are interpreted
with the help of time-dependent density functional theory calculations and
analysed using spectral information on the same species obtained from matrix
isolation spectroscopy data. A kinetic Monte Carlo code has also been used, in
the case of pyrene and coronene cations, to estimate the absorption
cross-sections of the measured electronic transitions. Gas-phase spectra of
highly reactive species such as dehydrogenated PAH cations are reported for the
first time.
","[{""version"":""v1"",""created"":""Sun, 21 Mar 2010 16:36:46 GMT""},{""version"":""v2"",""created"":""Sun, 16 May 2010 14:31:22 GMT""}]","2015-03-13"
"1003.4007","Peter Newstead","H. Lange, V. Mercat and P. E. Newstead","On an example of Mukai","Final version for publication in Glasgow Math. J.; 1 added reference","Glasgow Math. J. 54 (2012), 261-271",,,"math.AG","http://arxiv.org/licenses/nonexclusive-distrib/1.0/","  In this note we use an example of Mukai to construct semistable bundles of
rank 3 with 6 independent sections on a curve of genus 9 or 11 with Clifford
index strictly less than the Clifford index of the curve. The example also
allows us to show the non-emptiness of some Brill-Noether loci with negative
expected dimension.
","[{""version"":""v1"",""created"":""Sun, 21 Mar 2010 16:50:52 GMT""},{""version"":""v2"",""created"":""Mon, 13 Sep 2010 18:16:14 GMT""},{""version"":""v3"",""created"":""Wed, 9 Feb 2011 17:23:00 GMT""},{""version"":""v4"",""created"":""Fri, 19 Aug 2011 11:01:29 GMT""}]","2014-01-31"
"1003.4008","Kohji Yanagawa","Ryota Okazaki, Kohji Yanagawa","Alexander duality and Stanley depth of multigraded modules","18 pages. We have removed Lemma 2.3 of the previous version, since
  the proof contained a gap. This deletion does not affect the main results,
  while we have revised argument a little (especially in Sections in 2 and 3)",,,,"math.AC","http://arxiv.org/licenses/nonexclusive-distrib/1.0/","  We apply Miller's theory on multigraded modules over a polynomial ring to the
study of the Stanley depth of these modules. Several tools for Stanley's
conjecture are developed, and a few partial answers are given. For example, we
show that taking the Alexander duality twice (but with different ""centers"") is
useful for this subject. Generalizing a result of Apel, we prove that Stanley's
conjecture holds for the quotient by a cogeneric monomial ideal.
","[{""version"":""v1"",""created"":""Sun, 21 Mar 2010 16:54:37 GMT""},{""version"":""v2"",""created"":""Mon, 29 Mar 2010 08:37:30 GMT""},{""version"":""v3"",""created"":""Tue, 1 Feb 2011 13:45:35 GMT""}]","2011-02-02"
"1003.4009","J\""urgen B\""ohm","J\""urgen B\""ohm","A new proof of the local criterion of flatness",,,,,"math.AC","http://arxiv.org/licenses/nonexclusive-distrib/1.0/","  Let (A,m_A) -> (B,m_B) be a local morphism of local noetherian rings and M a
finitely generated B-module. Then it follows from Tor^A_1(M,A/m_A) = 0 that M
is a flat A-module. This is usually called the ""local criterion of flatness"".
We give a proof that proceeds along different lines than the usual textbook
proofs, using completions and only elementary properties of flat modules and
the Tor-functor.
","[{""version"":""v1"",""created"":""Sun, 21 Mar 2010 18:02:26 GMT""}]","2010-03-23"
"1003.4010","Jesper Grodal","Jesper Grodal","The classification of p-compact groups and homotopical group theory","To appear in Proceedings of the ICM 2010.","Proceedings of the International Congress of Mathematicians 2010
  (Hyderabad, India) p. 973-1001",,"CPH-SYM-00","math.AT math.GR","http://arxiv.org/licenses/nonexclusive-distrib/1.0/","  We survey some recent advances in the homotopy theory of classifying spaces,
and homotopical group theory. We focus on the classification of p-compact
groups in terms of root data over the p-adic integers, and discuss some of its
consequences e.g. for finite loop spaces and polynomial cohomology rings.
","[{""version"":""v1"",""created"":""Sun, 21 Mar 2010 18:07:05 GMT""}]","2010-09-02"
"1003.4011","Pawel Danielewicz","P. Danielewicz (MSU-NSCL)","Symmetry energy in the structure and in reactions","14 pages, 8 figures; contribution to IWM2009, International Workshop
  on Multifragmentation and Related Topics, Catania, 2009",,,,"nucl-th","http://arxiv.org/licenses/nonexclusive-distrib/1.0/","  Efforts to extract information on magnitude and density dependence of the
nuclear symmetry energy are discussed. The utilized data include those on mass
dependence of the excitation energies to the isobaric analog states of ground
states, as well as data on the diffusion of isospin in heavy-ion reactions.
Results following from different observables are compared.
","[{""version"":""v1"",""created"":""Sun, 21 Mar 2010 18:37:08 GMT""}]","2010-03-23"
"1003.4012","Christoph Fretter","Christoph Fretter, Lachezar Krumov, Karsten Weihe, Matthias
  M\""uller-Hannemann, and Marc-Thorsten H\""utt","Phase Synchronization in Railway Timetables",,"European Physical Journal B, Volume 77, Number 2, 281-289 (2010)","10.1140/epjb/e2010-00234-y",,"cs.DS math.OC physics.soc-ph","http://arxiv.org/licenses/nonexclusive-distrib/1.0/","  Timetable construction belongs to the most important optimization problems in
public transport. Finding optimal or near-optimal timetables under the
subsidiary conditions of minimizing travel times and other criteria is a
targeted contribution to the functioning of public transport. In addition to
efficiency (given, e.g., by minimal average travel times), a significant
feature of a timetable is its robustness against delay propagation. Here we
study the balance of efficiency and robustness in long-distance railway
timetables (in particular the current long-distance railway timetable in
Germany) from the perspective of synchronization, exploiting the fact that a
major part of the trains run nearly periodically. We find that synchronization
is highest at intermediate-sized stations. We argue that this synchronization
perspective opens a new avenue towards an understanding of railway timetables
by representing them as spatio-temporal phase patterns. Robustness and
efficiency can then be viewed as properties of this phase pattern.
","[{""version"":""v1"",""created"":""Sun, 21 Mar 2010 19:00:06 GMT""}]","2010-11-03"
"1003.4013","Terence C. Tao","Assaf Naor, Terence Tao","Scale-oblivious metric fragmentation and the nonlinear Dvoretzky theorem","11 pages, no figures, submitted, Israel J. Math.",,,,"math.MG","http://arxiv.org/licenses/nonexclusive-distrib/1.0/","  We introduce a randomized iterative fragmentation procedure for finite metric
spaces, which is guaranteed to result in a polynomially large subset that is
$D$-equivalent to an ultrametric, where $D\in (2,\infty)$ is a prescribed
target distortion. Since this procedure works for $D$ arbitrarily close to the
nonlinear Dvoretzky phase transition at distortion 2, we thus obtain a much
simpler probabilistic proof of the main result of Bartel, Linial, Mendel, and
Naor, answering a question from Mendel and Naor, and yielding the best known
bounds in the nonlinear Dvoretzky theorem. Our method utilizes a sequence of
random scales at which a given metric space is fragmented. As in many previous
randomized arguments in embedding theory, these scales are chosen irrespective
of the geometry of the metric space in question. We show that our bounds are
sharp if one utilizes such a ""scale-oblivious"" fragmentation procedure.
","[{""version"":""v1"",""created"":""Sun, 21 Mar 2010 19:06:07 GMT""}]","2010-03-23"
"1003.4014","Natalia Bezvitnaya","Natalia I. Bezvitnaya","Holonomy algebras of pseudo-hyper-K\""ahlerian manifolds of index 4","16 pages","Differential Geometry and its Applications 31 (2013) no. 2,
  284--299",,,"math.DG","http://arxiv.org/licenses/nonexclusive-distrib/1.0/","  The holonomy algebra of a pseudo-hyper-K\""ahlerian manifold of signature
$(4,4n+4)$ is a subalgebra of $\sp(1,n+1)$. Possible holonomy algebras of these
manifolds are classified. Using this, a new proof of the classification of
simply connected pseudo-hyper-K\""ahlerian symmetric spaces of index 4 is
obtained.
","[{""version"":""v1"",""created"":""Sun, 21 Mar 2010 19:09:55 GMT""},{""version"":""v2"",""created"":""Sun, 3 Oct 2010 16:26:09 GMT""},{""version"":""v3"",""created"":""Tue, 9 Apr 2013 18:19:14 GMT""}]","2013-04-10"
"1003.4015","Marek Wolf","Marek Wolf","Continued fractions constructed from prime numbers","Considerably extended version of previous submission. We add the
  discussion of transcendentality of continued fractions constructed from prime
  numbers. 35 pages and 9 Figures",,,,"math.NT math.HO","http://arxiv.org/licenses/nonexclusive-distrib/1.0/","  We give 50 digits values of the simple continued fractions whose denominators
are formed from a) prime numbers, b) twin primes, c) generalized $d$-twins, d)
primes of the form $m^2+n^4$, e)primes of the form $m^2+1$, f) Mersenne primes
and g) primorial primes. All these continued fractions belong to the set of
measure zero of exceptions to the theorems of Khinchin and Levy. We claim that
all these continued fractions are transcendental numbers. Next we propose the
conjecture which indicates the way to deduce the transcendence of some
continued fractions from transcendence of another ones.
","[{""version"":""v1"",""created"":""Sun, 21 Mar 2010 19:22:51 GMT""},{""version"":""v2"",""created"":""Sun, 26 Sep 2010 15:15:22 GMT""}]","2010-09-28"
"1003.4016","Zolt\'an K\'asa","Antal Iv\'anyi","Reconstruction of complete interval tournaments",,"Acta Univ. Sapientiae, Informatica, 1, 1 (2009) 71-88",,,"cs.DM","http://arxiv.org/licenses/nonexclusive-distrib/1.0/","  Let $a, b$ and $n$ be nonnegative integers $(b \geq a, \ b > 0, \ n \geq 1)$,
$\mathcal{G}_n(a,b)$ be a multigraph on $n$ vertices in which any pair of
vertices is connected with at least $a$ and at most $b$ edges and \textbf{v =}
$(v_1, v_2, ..., v_n)$ be a vector containing $n$ nonnegative integers. We give
a necessary and sufficient condition for the existence of such orientation of
the edges of $\mathcal{G}_n(a,b)$, that the resulted out-degree vector equals
to \textbf{v}. We describe a reconstruction algorithm. In worst case checking
of \textbf{v} requires $\Theta(n)$ time and the reconstruction algorithm works
in $O(bn^3)$ time. Theorems of H. G. Landau (1953) and J. W. Moon (1963) on the
score sequences of tournaments are special cases $b = a = 1$ resp. $b = a \geq
1$ of our result.
","[{""version"":""v1"",""created"":""Sun, 21 Mar 2010 19:25:40 GMT""}]","2010-03-23"
"1003.4017","Lionel Levine","Wouter Kager and Lionel Levine","Rotor-router aggregation on the layered square lattice","11 pages, 3 figures.","Elect. J. Combin. 17(1) #R152 (2010)",,,"math.CO","http://arxiv.org/licenses/nonexclusive-distrib/1.0/","  In rotor-router aggregation on the square lattice Z^2, particles starting at
the origin perform deterministic analogues of random walks until reaching an
unoccupied site. The limiting shape of the cluster of occupied sites is a disk.
We consider a small change to the routing mechanism for sites on the x- and
y-axes, resulting in a limiting shape which is a diamond instead of a disk. We
show that for a certain choice of initial rotors, the occupied cluster grows as
a perfect diamond.
","[{""version"":""v1"",""created"":""Sun, 21 Mar 2010 19:58:47 GMT""}]","2011-09-28"
"1003.4018","Kevin Schawinski","Kevin Schawinski, Nathan Dowlin, Daniel Thomas, C. Megan Urry, Edward
  Edmondson","The Role of Mergers in Early-type Galaxy Evolution and Black Hole Growth","5 pages, 3 figures. ApJ Letters, in press.",,"10.1088/2041-8205/714/1/L108",,"astro-ph.CO","http://arxiv.org/licenses/nonexclusive-distrib/1.0/","  Models of galaxy formation invoke the major merger of gas-rich progenitor
galaxies as the trigger for significant phases of black hole growth and the
associated feedback that suppresses star formation to create red spheroidal
remnants. However, the observational evidence for the connection between
mergers and active galactic nucleus (AGN) phases is not clear. We analyze a
sample of low-mass early-type galaxies known to be in the process of migrating
from the blue cloud to the red sequence via an AGN phase in the green valley.
Using deeper imaging from SDSS Stripe 82, we show that the fraction of objects
with major morphological disturbances is high during the early starburst phase,
but declines rapidly to the background level seen in quiescent early-type
galaxies by the time of substantial AGN radiation several hundred Myr after the
starburst. This observation empirically links the AGN activity in low-redshift
early-type galaxies to a significant merger event in the recent past. The large
time delay between the merger-driven starburst and the peak of AGN activity
allows for the merger features to decay to the background and hence may explain
the weak link between merger features and AGN activity in the literature.
","[{""version"":""v1"",""created"":""Sun, 21 Mar 2010 20:02:52 GMT""}]","2015-05-18"
"1003.4019","Michael Mazilu","Michael Mazilu","Conserving optical currents: angular momentum and spin",,,,,"physics.optics","http://arxiv.org/licenses/nonexclusive-distrib/1.0/","  Within the first quantisation of Maxwell's equations, we introduce the
dynamic energy, linear momentum, angular momentum and optical spin of the
electromagnetic fields. We show that these different quantities are conserved
during the propagation of light in vacuum and are additive only for eigenmodes
of the electromagnetic field.
","[{""version"":""v1"",""created"":""Sun, 21 Mar 2010 20:04:34 GMT""}]","2010-03-23"
"1003.4020","Robert van den Hoogen","R.J. van den Hoogen","Averaging Spacetime: Where do we go from here?","10 pages; To appear in the Proceedings of the 12th Marcel Grossman
  Meeting; A new reference added and some small editorial changes made in V2.",,,,"gr-qc","http://arxiv.org/licenses/nonexclusive-distrib/1.0/","  The construction of an averaged theory of gravity based on Einstein's General
Relativity is very difficult due to the non-linear nature of the gravitational
field equations. This problem is further exacerbated by the difficulty in
defining a mathematically precise covariant averaging procedure for tensor
fields over differentiable manifolds. Together, these two ideas have been
called the averaging problem for General Relativity. In the first part of the
talk, an attempt to review some the various approaches to this problem will be
given, highlighting strengths, weaknesses, and commonalities between them. In
the second part of the talk, an argument will be made, that if one wishes to
develop a well-defined averaging procedure, one may choose to parallel
transport along geodesics with respect to the Levi-Cevita connection or, use
the Weitzenb\""ock connection and ensure the transportation is independent of
path. The talk concludes with some open questions to generate further
discussion.
","[{""version"":""v1"",""created"":""Sun, 21 Mar 2010 20:13:12 GMT""},{""version"":""v2"",""created"":""Thu, 15 Apr 2010 09:29:36 GMT""}]","2010-04-16"
"1003.4021","Vitaly Pimenov","Vitaly Pimenov","System-theoretic approach to image interest point detection","12 pages",,,,"cs.CV","http://arxiv.org/licenses/nonexclusive-distrib/1.0/","  Interest point detection is a common task in various computer vision
applications. Although a big variety of detector are developed so far
computational efficiency of interest point based image analysis remains to be
the problem. Current paper proposes a system-theoretic approach to interest
point detection. Starting from the analysis of interdependency between detector
and descriptor it is shown that given a descriptor it is possible to introduce
to notion of detector redundancy. Furthermore for each detector it is possible
to construct its irredundant and equivalent modification. Modified detector
possesses lower computational complexity and is preferable. It is also shown
that several known approaches to reduce computational complexity of image
registration can be generalized in terms of proposed theory.
","[{""version"":""v1"",""created"":""Sun, 21 Mar 2010 20:21:09 GMT""}]","2010-03-23"
"1003.4022","Robert Feger","Robert Feger (1), Verena Klose (2), Heiko Lacker (2), Thomas Lueck (2)
  and Thomas Mannel (1) ((1) Univ. Siegen, (2) HU Berlin)","Limit on a Right-Handed Admixture to the Weak $b \to c$ Current from
  Semileptonic Decays","7 pages, 3 figures, 2 tables","Phys.Rev.D82:073002,2010","10.1103/PhysRevD.82.073002","SI-HEP-2009-19","hep-ph","http://arxiv.org/licenses/nonexclusive-distrib/1.0/","  We determine an upper bound for a possible right-handed $b{\to}c$ quark
current admixture in semileptonic $\bar{B} \to X_{c} \ell^{-} \bar{\nu}$ decays
from a simulateous fit to moments of the lepton-enery and hadronic-mass
distribution measured as a function of the lower limit on the lepton energy,
using data measured by the \babar\ detector. The right-handed admixture is
parametrized by a new parameter $c_R$ as coefficient of computed moments with
right-handed quark current. For the standard model part we use the prediction
of the heavy-quark expansion (HQE) up to order $1/m_b^3$ and perturbative
corrections and for the right-handed contribution only up to order $1/m_b^2$
and perturbative corrections. We find $\cR=0.05\asympm{+0.33}{-0.50}$ in
agreement with the standard-model prediction of zero. Additionally, we give a
contraint on a possible right-handed admixture from exclusive decays, which is
with a value of $\cR =0.01{\pm}0.03$ more restrictive than our value from the
inclusive fit. The difference in \Vcb between the inclusive and exclusive
extraction is only slightly reduced when allowing for a right-handed admixture
in the range of $\cR=0.01 {\pm} 0.03$.
","[{""version"":""v1"",""created"":""Sun, 21 Mar 2010 20:23:07 GMT""}]","2014-11-20"
"1003.4023","Harry Lipkin J","Harry J. Lipkin","Simple quantum mechanics explains GSI Darmstadt oscillations Even with
  undetected neutrino; Momentum conservation requires Same interference
  producing oscillations in initial and final states","14pages, no figures. arXiv admin note: text overlap with
  arXiv:0805.0435 and arXiv:0801.1465",,,,"hep-ph","http://arxiv.org/licenses/nonexclusive-distrib/1.0/","  GSI experiment studying oscillations in K-capture decay of radioactive ion
investigates neutrino masses and mixing without detecting neutrino. Even when
neutrino is not detected quantum mechanics relates initial and final states.
The basic physics is very simple. Neutrinos emitted in beta decay are coherent
linear combinations of states with different masses, different momenta and same
energy. Since the weak interaction producing the neutrino conserves momentum,
the initial state before the transition must also contain a coherent linear
combination of states with the same momentum difference and a well defined
relative magnitude and phase. A one-particle state with a definite momentum
difference also has an easily calculated energy difference. In the time
interval between creation of the ion and its decay a linear combination of two
states with different energies oscillates in time. Measuring the oscillation
period gives a value for the difference between squared neutrino masses of the
two neutrino mass eigenstates. The value obtained from a crude approximation
with no free parameters for this ""two-slit"" or ""which path"" experiment in
momentum space differs by less than 10% from the result observed in the KAMLAND
experiment. Observing only ion disappearance without detecting neutrino avoids
signal suppression by low neutrino absorption cross section
","[{""version"":""v1"",""created"":""Sun, 21 Mar 2010 20:33:51 GMT""},{""version"":""v2"",""created"":""Mon, 23 Jan 2012 21:00:25 GMT""},{""version"":""v3"",""created"":""Mon, 13 Feb 2012 20:11:58 GMT""}]","2012-02-14"
"1003.4024","Vesko Valov","V. Gutev and V. Valov","Sections, Selections and Prohorov's Theorem",,"J. Math. Anal. Appl. 360 (2009), 377-379.",,,"math.GN","http://arxiv.org/licenses/nonexclusive-distrib/1.0/","  The famous Prohorov theorem for Radon probability measures is generalized in
terms of usco mappings. In the case of completely metrizable spaces this is
achieved by applying a classical Michael result on the existence of usco
selections for l.s.c. mappings. A similar approach works when sieve-complete
spaces are considered.
","[{""version"":""v1"",""created"":""Sun, 21 Mar 2010 20:41:01 GMT""}]","2010-03-23"
"1003.4025","Michael Anshelevich","Michael Anshelevich and Wojciech M{\l}otkowski","The free Meixner class for pairs of measures","This paper has been withdrawn by the authors. The article has been
  merged with arXiv:1001.1540v3",,,,"math.OA math.CO math.PR","http://arxiv.org/licenses/nonexclusive-distrib/1.0/","  We investigate in more detail the two-state free convolution semigroups of
pairs of measures whose Jacobi parameters are linear in the convolution
parameter $t$. These semigroups were constructed in arXiv:1001.1540, where we
also showed that measures with the analogous property for the usual and free
convolution are exactly the classical, resp. free Meixner classes. The class of
measures in this paper has not been considered explicitly before, but we show
that it also has Meixner-type properties. Specifically, it appears in limit
theorems, has a Laha-Lukacs-type characterization, and is related to the $q=0$
case of quadratic harnesses.
","[{""version"":""v1"",""created"":""Sun, 21 Mar 2010 20:44:38 GMT""},{""version"":""v2"",""created"":""Sat, 23 Jul 2011 21:00:18 GMT""}]","2011-07-26"
