"1003.4084","William Jackson","Hamdan.O.Alanazi, A.A.Zaidan, B.B.Zaidan, Hamid A.Jalab, Zaidoon Kh.
  AL-Ani","New Classification Methods for Hiding Information into Two Parts:
  Multimedia Files and Non Multimedia Files",,"Journal of Computing, Volume 2, Issue 3, March 2010",,,"cs.MM cs.CR","http://arxiv.org/licenses/nonexclusive-distrib/1.0/","  With the rapid development of various multimedia technologies, more and more
multimedia data are generated and transmitted in the medical, commercial, and
military fields, which may include some sensitive information which should not
be accessed by or can only be partially exposed to the general users.
Therefore, security and privacy has become an important, Another problem with
digital document and video is that undetectable modifications can be made with
very simple and widely available equipment, which put the digital material for
evidential purposes under question .With the large flood of information and the
development of the digital format Information hiding considers one of the
techniques which used to protect the important information. The main goals for
this paper, provides a general overview of the New Classification Methods for
Hiding Information into Two Parts: Multimedia Files and Non Multimedia Files.
","[{""version"":""v1"",""created"":""Mon, 22 Mar 2010 06:42:05 GMT""}]","2010-03-23"
"1003.4085","William Jackson","Hamdan.O.Alanazi, B.B.Zaidan, A.A.Zaidan, Hamid A.Jalab, M.Shabbir, Y.
  Al-Nabhani","New Comparative Study Between DES, 3DES and AES within Nine Factors",,"Journal of Computing, Volume 2, Issue 3, March 2010,
  https://sites.google.com/site/journalofcomputing/",,,"cs.CR","http://arxiv.org/licenses/nonexclusive-distrib/1.0/","  With the rapid development of various multimedia technologies, more and more
multimedia data are generated and transmitted in the medical, also the internet
allows for wide distribution of digital media data. It becomes much easier to
edit, modify and duplicate digital information. Besides that, digital documents
are also easy to copy and distribute, therefore it will be faced by many
threats. It is a big security and privacy issue, it become necessary to find
appropriate protection because of the significance, accuracy and sensitivity of
the information, which may include some sensitive information which should not
be accessed by or can only be partially exposed to the general users.
Therefore, security and privacy has become an important. Another problem with
digital document and video is that undetectable modifications can be made with
very simple and widely available equipment, which put the digital material for
evidential purposes under question. Cryptography considers one of the
techniques which used to protect the important information. In this paper a
three algorithm of multimedia encryption schemes have been proposed in the
literature and description. The New Comparative Study between DES, 3DES and AES
within Nine Factors achieving an efficiency, flexibility and security, which is
a challenge of researchers.
","[{""version"":""v1"",""created"":""Mon, 22 Mar 2010 06:44:14 GMT""}]","2010-03-23"
"1003.4086","William Jackson","Zaidoon Kh. AL-Ani, A.A.Zaidan, B.B.Zaidan, Hamdan.O.Alanazi","Overview: Main Fundamentals for Steganography",,"Journal of Computing, Volume 2, Issue 3, March 2010,
  https://sites.google.com/site/journalofcomputing/",,,"cs.CR cs.MM","http://arxiv.org/licenses/nonexclusive-distrib/1.0/","  The rapid development of multimedia and internet allows for wide distribution
of digital media data. It becomes much easier to edit, modify and duplicate
digital information .Besides that, digital documents are also easy to copy and
distribute, therefore it will be faced by many threats. It is a big security
and privacy issue, it become necessary to find appropriate protection because
of the significance, accuracy and sensitivity of the information. Steganography
considers one of the techniques which used to protect the important
information. The main goals for this paper, to recognize the researchers for
the main fundamentals of steganography. In this paper provides a general
overview of the following subject areas: Steganography types, General
Steganography system, Characterization of Steganography Systems and
Classification of Steganography Techniques.
","[{""version"":""v1"",""created"":""Mon, 22 Mar 2010 06:46:04 GMT""}]","2010-03-23"
"1003.4087","William Jackson","Ratika Pradhan, Mohan P. Pradhan, Ashish Bhusan, Ronak K. Pradhan, M.
  K. Ghose","Land-cover Classification and Mapping for Eastern Himalayan State Sikkim",,"Journal of Computing, Volume 2, Issue 3, March 2010,
  https://sites.google.com/site/journalofcomputing/",,,"cs.CV","http://arxiv.org/licenses/nonexclusive-distrib/1.0/","  Area of classifying satellite imagery has become a challenging task in
current era where there is tremendous growth in settlement i.e. construction of
buildings, roads, bridges, dam etc. This paper suggests an improvised k-means
and Artificial Neural Network (ANN) classifier for land-cover mapping of
Eastern Himalayan state Sikkim. The improvised k-means algorithm shows
satisfactory results compared to existing methods that includes k-Nearest
Neighbor and maximum likelihood classifier. The strength of the Artificial
Neural Network (ANN) classifier lies in the fact that they are fast and have
good recognition rate and it's capability of self-learning compared to other
classification algorithms has made it widely accepted. Classifier based on ANN
shows satisfactory and accurate result in comparison with the classical method.
","[{""version"":""v1"",""created"":""Mon, 22 Mar 2010 06:49:30 GMT""}]","2010-03-23"
"1003.4088","William Jackson","Richa Gupta, Sanjiv Tokekar","Proficient Pair of Replacement Algorithms on L1 and L2 Cache for Merge
  Sort",,"Journal of Computing, Volume 2, Issue 3, March 2010,
  https://sites.google.com/site/journalofcomputing/",,,"cs.OS","http://arxiv.org/licenses/nonexclusive-distrib/1.0/","  Memory hierarchy is used to compete the processors speed. Cache memory is the
fast memory which is used to conduit the speed difference of memory and
processor. The access patterns of Level 1 cache (L1) and Level 2 cache (L2) are
different, when CPU not gets the desired data in L1 then it accesses L2. Thus
the replacement algorithm which works efficiently on L1 may not be as efficient
on L2. Similarly various applications such as Matrix Multiplication, Web, Fast
Fourier Transform (FFT) etc will have varying access pattern. Thus same
replacement algorithm for all types of application may not be efficient. This
paper works for getting an efficient pair of replacement algorithm on L1 and L2
for the algorithm Merge Sort. With the memory reference string of Merge Sort,
we have analyzed the behavior of various existing replacement algorithms on L1.
The existing replacement algorithms which are taken into consideration are:
Least Recently Used (LRU), Least Frequently Used (LFU) and First In First Out
(FIFO). After Analyzing the memory reference pattern of Merge Sort, we have
proposed a Partition Based Replacement algorithm (PBR_L1)) on L1 Cache.
Furthermore we have analyzed various pairs of algorithms on L1 and L2
respectively, resulting in finding a suitable pair of replacement algorithms.
Simulation on L1 shows, among the considered existing replacement algorithms
FIFO is performing better than others. While the proposed replacement algorithm
PBR_L1 is working about 1.7% to 44 % better than FIFO for various cache sizes.
","[{""version"":""v1"",""created"":""Mon, 22 Mar 2010 06:52:12 GMT""}]","2010-03-23"
"1003.4089","Mohammad M. Sheikh-Jabbari","F. Loran and M.M. Sheikh-Jabbari","O-BTZ: Orientifolded BTZ Black Hole","RevTex file, 5 pages, 2 figures. v3: Minor improvements and
  correction","Phys.Lett.B693:184-187,2010","10.1016/j.physletb.2010.08.022","IPM/P-2010/009","hep-th","http://arxiv.org/licenses/nonexclusive-distrib/1.0/","  Banados-Teitelboim-Zanelli (BTZ) black holes are constructed by orbifolding
AdS3 geometry by boost transformations of its O(2,2) isometry group. Here we
construct a new class of solutions to AdS3 Einstein gravity, orientifolded BTZ
or O-BTZ for short, which in general, besides the usual BTZ orbifolding,
involve orbifolding (orientifolding) by a Z_2 part of O(2,2) isometry group.
This Z_2 is chosen such that it changes the orientation on AdS3 while keeping
the orientation on its 2D conformal boundary. O-BTZ solutions exhaust all
un-oriented AdS3 black hole solutions, as BTZ black holes constitute all
oriented AdS3 black holes. O-BTZ, similarly to BTZ black holes, are stationary,
axisymmetric asymptotically AdS3 geometries with two asymptotic charges, mass
and angular momentum..
","[{""version"":""v1"",""created"":""Mon, 22 Mar 2010 07:11:11 GMT""},{""version"":""v2"",""created"":""Wed, 21 Apr 2010 10:56:55 GMT""},{""version"":""v3"",""created"":""Wed, 28 Jul 2010 06:58:28 GMT""}]","2015-03-13"
"1003.4090","Rodrigo Machado","Rodrigo Machado (Universidade Federal do Rio Grande do Sul), Reiko
  Heckel (University of Leicester), Leila Ribeiro (Universidade Federal do Rio
  Grande do Sul)","Modeling and Reasoning over Distributed Systems using Aspect-Oriented
  Graph Grammars",,"EPTCS 21, 2010, pp. 39-50","10.4204/EPTCS.21.4",,"cs.LO cs.PL cs.SE","http://arxiv.org/licenses/nonexclusive-distrib/1.0/","  Aspect-orientation is a relatively new paradigm that introduces abstractions
to modularize the implementation of system-wide policies. It is based on a
composition operation, called aspect weaving, that implicitly modifies a base
system by performing related changes within the system modules. Aspect-oriented
graph grammars (AOGG) extend the classic graph grammar formalism by defining
aspects as sets of rule-based modifications over a base graph grammar. Despite
the advantages of aspect-oriented concepts regarding modularity, the implicit
nature of the aspect weaving operation may also introduce issues when reasoning
about the system behavior. Since in AOGGs aspect weaving is characterized by
means of rule-based rewriting, we can overcome these problems by using known
analysis techniques from the graph transformation literature to study aspect
composition. In this paper, we present a case study of a distributed
client-server system with global policies, modeled as an aspect-oriented graph
grammar, and discuss how to use the AGG tool to identify potential conflicts in
aspect weaving.
","[{""version"":""v1"",""created"":""Mon, 22 Mar 2010 07:18:30 GMT""}]","2010-04-01"
"1003.4091","Filippo Viviani","Damiano Fulghesu, Filippo Viviani","The Chow ring of the stack of cyclic covers of the projective line","20 pages; final version, to appear in Ann. Inst. Fourier","Annales de l'institut Fourier 61, no. 6 (2011), 2249--2275",,,"math.AG","http://arxiv.org/licenses/nonexclusive-distrib/1.0/","  In this paper we compute the integral Chow ring of the stack of smooth
uniform cyclic covers of the projective line and we give explicit generators.
","[{""version"":""v1"",""created"":""Mon, 22 Mar 2010 07:32:06 GMT""},{""version"":""v2"",""created"":""Mon, 4 Oct 2010 17:19:12 GMT""}]","2012-04-23"
"1003.4092","Pierre Portal","Jan Maas, Jan van Neerven, and Pierre Portal","Non-tangential maximal functions and conical square functions with
  respect to the Gaussian measure","21 pages, revised version with various arguments simplified and
  generalised",,,,"math.FA math.CA","http://arxiv.org/licenses/nonexclusive-distrib/1.0/","  We study, in $L^{1}(\R^n;\gamma)$ with respect to the gaussian measure,
non-tangential maximal functions and conical square functions associated with
the Ornstein-Uhlenbeck operator by developing a set of techniques which allow
us, to some extent, to compensate for the non-doubling character of the
gaussian measure. The main result asserts that conical square functions can be
controlled in $L^1$-norm by non-tangential maximal functions. Along the way we
prove a change of aperture result for the latter. This complements recent
results on gaussian Hardy spaces due to Mauceri and Meda.
","[{""version"":""v1"",""created"":""Mon, 22 Mar 2010 08:31:14 GMT""},{""version"":""v2"",""created"":""Thu, 25 Nov 2010 22:40:20 GMT""}]","2010-11-30"
"1003.4093","Andreas Berthold Thom","Andreas Thom","Convergent sequences in discrete groups","10 pages, no figures; in v2 some material on Jordan's Theorem and Chu
  duality added; v3 updated version, to appear in the Canadian Math. Bulletin","Can. Math. Bull. 56 (2013) 424-433","10.4153/CMB-2011-155-3",,"math.GR math.FA","http://arxiv.org/licenses/nonexclusive-distrib/1.0/","  We prove that a finitely generated group contains a sequence of non-trivial
elements which converge to the identity in every compact homomorphic image if
and only if the group is not virtually abelian.
","[{""version"":""v1"",""created"":""Mon, 22 Mar 2010 08:36:03 GMT""},{""version"":""v2"",""created"":""Mon, 12 Apr 2010 17:04:23 GMT""},{""version"":""v3"",""created"":""Fri, 3 Aug 2012 09:44:01 GMT""}]","2019-08-15"
"1003.4094","Anjan Ananda Sen","N. Chandrachani Devi and Anjan A Sen","Evolution of Spherical Overdensity in Thawing Dark energy Models","11 pages, mnras style, 8 EPS figures, 1 table, improved version,
  Accepted for publication in MNRAS","Mon.Not.Roy.Astron.Soc.413:2371-2379,2011","10.1111/j.1365-2966.2011.18310.x",,"astro-ph.CO gr-qc hep-ph","http://arxiv.org/licenses/nonexclusive-distrib/1.0/","  We study the general evolution of spherical over-densities for thawing class
of dark energy models. We model dark energy with scalar fields having canonical
as well as non-canonical kinetic energy. For non-canonical case, we consider
models where the kinetic energy is of the Born-Infeld Form. We study various
potentials like linear, inverse-square, exponential as well as PNGB-type. We
also consider the case when dark energy is homogeneous as well as the case when
it is inhomogeneous and virializes together with matter. Our study shows that
models with linear potential in particular with Born-Infeld type kinetic term
can have significant deviation from the $\Lambda$CDM model in terms of density
contrast at the time of virialization. Although our approach is a simplified
one to study the nonlinear evolution of matter overdensities inside the cluster
and is not applicable to actual physical situation, it gives some interesting
insights into the nonlinear clustering of matter in the presence of thawing
class of dark energy models.
","[{""version"":""v1"",""created"":""Mon, 22 Mar 2010 08:37:23 GMT""},{""version"":""v2"",""created"":""Sun, 9 Jan 2011 16:35:15 GMT""}]","2015-03-13"
"1003.4095","Chlo\'e Perin","Chlo\'e Perin and Rizos Sklinos","Homogeneity in the free group","26 pages","Duke Math. J. 161, no. 13 (2012), 2635-2668","10.1215/00127094-1813068",,"math.GR math.LO","http://arxiv.org/licenses/nonexclusive-distrib/1.0/","  We show that any non abelian free group $\F$ is strongly
$\aleph_0$-homogeneous, i.e. that finite tuples of elements which satisfy the
same first-order properties are in the same orbit under $\Aut(\F)$. We give a
characterization of elements in finitely generated groups which have the same
first-order properties as a primitive element of the free group. We deduce as a
consequence that most hyperbolic surface groups are not $\aleph_0$-homogeneous.
","[{""version"":""v1"",""created"":""Mon, 22 Mar 2010 08:41:13 GMT""}]","2019-12-19"
"1003.4096","Mike Zhitomirsky","M. E. Zhitomirsky and Hirokazu Tsunetsugu","Magnon pairing in quantum spin nematic","5 pages, final version","Europhys. Lett. 92 (2010) 37001","10.1209/0295-5075/92/37001",,"cond-mat.str-el cond-mat.mtrl-sci cond-mat.quant-gas","http://arxiv.org/licenses/nonexclusive-distrib/1.0/","  Competing ferro- and antiferromagnetic exchange interactions may lead to the
formation of bound magnon pairs in the high-field phase of a frustrated quantum
magnet. With decreasing field, magnon pairs undergo a Bose-condensation prior
to the onset of a conventional one-magnon instability. We develop an analytical
approach to study the zero-temperature properties of the magnon-pair
condensate, which is a bosonic analog of the BCS superconductors.
Representation of the condensate wave-function in terms of the coherent bosonic
states reveals the spin-nematic symmetry of the ground-state and allows one to
calculate various static properties. Sharp quasiparticle excitations are found
in the nematic state with a small finite gap. We also predict the existence of
a long-range ordered spin-nematic phase in the frustrated chain material
LiCuVO4 at high fields.
","[{""version"":""v1"",""created"":""Mon, 22 Mar 2010 08:45:33 GMT""},{""version"":""v2"",""created"":""Thu, 24 Jun 2010 14:50:42 GMT""},{""version"":""v3"",""created"":""Fri, 12 Nov 2010 07:13:51 GMT""}]","2012-05-29"
"1003.4097","Suntra  Giridhar","Sunetra Giridhar, R. Molina, A. Arellano Ferro and G. Selvakumar","Chemical composition of A--F type post-AGB candidates","Accepted in MNRAS, 18 pages, 12 figures",,"10.1111/j.1365-2966.2010.16696.x",,"astro-ph.SR","http://arxiv.org/licenses/nonexclusive-distrib/1.0/","  An abundance analysis has been conducted for a sample of nine post-AGB
candidate stars; eight of them have not been explored before. We find four very
promising objects like HD 105262, HD 53300 and CpD$-62^o5428$ among them. We
find strong evidence of dust-gas separation through selective depletion of
refractive elements in HD 105262. The same effect is also observed in HD 53300,
CpD$-62^o5428$ and HD 114855 although abundance peculiarities are relatively
smaller for the last two stars. We find strong enrichment of nitrogen for HD
725, HD 842, HD 1457, HD 9233 and HD 61227 but no further evidence to support
their post-AGB nature. We have compared the observed [N/C] ratios of these
stars with the predictions of evolutionary models which include the rotation
induced mixing.
","[{""version"":""v1"",""created"":""Mon, 22 Mar 2010 09:00:41 GMT""}]","2015-05-18"
"1003.4098","Muhammad Farooq Dr.","M. Umar Farooq, Muneer A. Rashid and Mubasher Jamil","Interacting entropy-corrected new agegraphic tachyon, K-essence and
  dilaton scalar field models of dark energy in non-flat universe","11 pages, typos fixed","Int.J.Theor.Phys.49:2278-2287,2010","10.1007/s10773-010-0415-1",,"gr-qc hep-th math-ph math.MP","http://arxiv.org/licenses/nonexclusive-distrib/1.0/","  We present the new agegraphic dark energy model by introducing the quantum
corrections to the entropy-area relation in the setup of loop quantum gravity.
Employing this new form of dark energy, we investigate the model of interacting
dark energy and derive its equation of state. We study the correspondence
between the tachyon, K-essence and dilaton scalar field models with the
interacting entropy-corrected new agegraphic dark energy model in the non-flat
FRW universe. Moreover, we reconstruct the corresponding scalar potentials
which describe the dynamics of the scalar field models.
","[{""version"":""v1"",""created"":""Mon, 22 Mar 2010 09:03:12 GMT""},{""version"":""v2"",""created"":""Tue, 6 Apr 2010 07:48:46 GMT""}]","2014-11-20"
"1003.4099","Yafeng He","Yafeng He and Baoquan Ai","Enhancement of the longitudinal transport by a weakly transversal drive",,"Phys. Rev. E 81, 021110 (2010)","10.1103/PhysRevE.81.021110",,"cond-mat.stat-mech","http://creativecommons.org/licenses/by-nc-sa/3.0/","  Transport of Brownian particles in a two-dimensional asymmetric tube is
investigated by applying a polarized field. From the Brownian dynamics
simulations we find that the longitudinal current can be enhanced remarkably by
applying a weakly transversal drive. Multiple current reversals can be realized
by altering the driving frequency of the polarized field. By coupling the
longitudinal and transversal forces together, one can control the particle
transport flexibly.
","[{""version"":""v1"",""created"":""Mon, 22 Mar 2010 09:05:08 GMT""}]","2010-03-23"
"1003.4100","Wen Zhi Jia","W. Z. Jia, L. F. Wei","Gain without inversion in quantum systems with broken parities","12 pages, 4 figures",,"10.1103/PhysRevA.82.013808",,"quant-ph","http://arxiv.org/licenses/nonexclusive-distrib/1.0/","  For a quantum system with broken parity symmetry, selection rules can not
hold and cyclic transition structures are generated. With these
loop-transitions we discuss how to achieve inversionless gain of the probe
field by properly setting the control and auxiliary fields. Possible
implementations of our generic proposal with specific physical objects with
broken parities, e.g., superconducting circuits and chiral molecules, are also
discussed.
","[{""version"":""v1"",""created"":""Mon, 22 Mar 2010 09:06:19 GMT""},{""version"":""v2"",""created"":""Fri, 2 Apr 2010 00:35:00 GMT""},{""version"":""v3"",""created"":""Tue, 13 Jul 2010 03:15:14 GMT""}]","2015-05-18"
"1003.4101","Sait Umar","A. S. Umar, V. E. Oberacker, J. A. Maruhn, and P.-G. Reinhard","Microscopic Description of Nuclear Fission Dynamics",,"J. Phys. G: Nucl. Part. Phys. 37 (2010) 064037","10.1088/0954-3899/37/6/064037",,"nucl-th","http://arxiv.org/licenses/nonexclusive-distrib/1.0/","  We discuss possible avenues to study fission dynamics starting from a
time-dependent mean-field approach. Previous attempts to study fission dynamics
using the time-dependent Hartree-Fock (TDHF) theory are analyzed. We argue that
different initial conditions may be needed to describe fission dynamics
depending on the specifics of the fission phenomenon and propose various
approaches towards this goal. In particular, we provide preliminary
calculations for studying fission following a heavy-ion reaction using TDHF
with a density contraint. Regarding prompt muon-induced fission, we also
suggest a new approach for combining the time-evolution of the muonic wave
function with a microscopic treatment of fission dynamics via TDHF.
","[{""version"":""v1"",""created"":""Mon, 22 Mar 2010 09:28:03 GMT""}]","2015-05-18"
"1003.4102","Lucius Schoenbaum","Lucius T. Schoenbaum","On the Syntax of Logic and Set Theory","34 pages, accepted, to appear in the Review of Symbolic Logic",,,,"math.LO","http://arxiv.org/licenses/nonexclusive-distrib/1.0/","  We introduce an extension of the propositional calculus to include abstracts
of predicates and quantifiers, employing a single rule along with a novel
comprehension schema and a principle of extensionality, which are substituted
for the Bernays postulates for quantifiers and the comprehension schemata of ZF
and other set theories. We prove that it is consistent in any finite Boolean
subset lattice. We investigate the antinomies of Russell, Cantor, Burali-Forti,
and others, and discuss the relationship of the system to other set theoretic
systems ZF, NBG, and NF. We discuss two methods of axiomatizing higher order
quantification and abstraction, and then very briefly discuss the application
of one of these methods to areas of mathematics outside of logic.
","[{""version"":""v1"",""created"":""Mon, 22 Mar 2010 09:29:19 GMT""}]","2010-03-23"
"1003.4103","Lucia Kleint","L. Kleint, S. V. Berdyugina, A. I. Shapiro and M. Bianda","Turbulent magnetic fields in the quiet Sun: A search for cyclic
  variations","6 pages, 4 figures, in press for the proceedings of ""SOHO-23:
  Understanding a Peculiar Solar Minimum."", ASP Conference Series, 2010",,,,"astro-ph.SR","http://arxiv.org/licenses/nonexclusive-distrib/1.0/","  Turbulent magnetic fields fill most of the volume of the solar atmosphere.
However, their spatial and temporal variations are still unknown. Since 2007,
during the current solar minimum, we are periodically monitoring several
wavelength regions in the solar spectrum to search for variations of the
turbulent magnetic field in the quiet Sun. These fields, which are below the
resolution limit, can be detected via the Hanle effect which influences the
scattering polarization signatures (Q/I) in the presence of magnetic fields. We
present a description of our program and first results showing that such a
synoptic program is complementary to the daily SOHO magnetograms for monitoring
small-scale magnetic fields.
","[{""version"":""v1"",""created"":""Mon, 22 Mar 2010 09:36:54 GMT""}]","2010-03-23"
"1003.4104","Julius Ranninger","Julius Ranninger, Alfonso Romano","The ingap state spectral properties in the cuprates' pseudogap phase","5 figures",,,,"cond-mat.supr-con","http://arxiv.org/licenses/nonexclusive-distrib/1.0/","  The single-particle excitations, which initiate the pseudogap in the cuprate
superconductors at some temperature T^*, relate to specific local spectral
features of resonant pairing, where charge carriers get momentarily trapped on
dynamically deformable molecular Cu-O-Cu clusters. We show how those local
excitations evolve into dispersive branches with a characteristic ""S""-like
shape for three-peak structured ingap excitations in the cuprates' pseudogap
phase, when we consider a lattice of such clusters. This feature should be
detectable in ""momentum distribution curve"" ARPES analysis.
","[{""version"":""v1"",""created"":""Mon, 22 Mar 2010 09:37:36 GMT""}]","2010-03-23"
