"1003.4146","Michael Bommarito II","Michael J. Bommarito II, Daniel Martin Katz","A Mathematical Approach to the Study of the United States Code","5 pages, 6 figures, 2 tables.",,"10.1016/j.physa.2010.05.057",,"cs.IR cs.CY cs.DL physics.soc-ph","http://arxiv.org/licenses/nonexclusive-distrib/1.0/","  The United States Code (Code) is a document containing over 22 million words
that represents a large and important source of Federal statutory law. Scholars
and policy advocates often discuss the direction and magnitude of changes in
various aspects of the Code. However, few have mathematically formalized the
notions behind these discussions or directly measured the resulting
representations. This paper addresses the current state of the literature in
two ways. First, we formalize a representation of the United States Code as the
union of a hierarchical network and a citation network over vertices containing
the language of the Code. This representation reflects the fact that the Code
is a hierarchically organized document containing language and explicit
citations between provisions. Second, we use this formalization to measure
aspects of the Code as codified in October 2008, November 2009, and March 2010.
These measurements allow for a characterization of the actual changes in the
Code over time. Our findings indicate that in the recent past, the Code has
grown in its amount of structure, interdependence, and language.
","[{""version"":""v1"",""created"":""Mon, 22 Mar 2010 12:41:01 GMT""}]","2015-05-18"
"1003.4147","Mehdi Fhima","Pierre R Bertrand (INRIA Saclay - Ile de France), Mehdi Fhima","Filtered derivative with p-value method for multiple change-points
  detection",,"International Workshop in Sequential Methodologies, Troyes :
  France (2009)",,,"math.ST stat.TH","http://arxiv.org/licenses/nonexclusive-distrib/1.0/","  This paper deals with off-line detection of change points for time series of
independent observations, when the number of change points is unknown. We
propose a sequential analysis like method with linear time and memory
complexity. Our method is based at first step, on Filtered Derivative method
which detects the right change points but also false ones. We improve Filtered
Derivative method by adding a second step in which we compute the p-values
associated to each potential change points. Then we eliminate as false alarms
the points which have p-value smaller than a given critical level. Next, our
method is compared with the Penalized Least Square Criterion procedure on
simulated data sets. Eventually, we apply Filtered Derivative with p-Value
method to segmentation of heartbeat time series.
","[{""version"":""v1"",""created"":""Mon, 22 Mar 2010 12:56:23 GMT""}]","2015-03-13"
"1003.4148","Mehdi Fhima","Pierre R. Bertrand (INRIA Saclay - Ile de France), Mehdi Fhima, Arnaud
  Guillin","Off-line detection of multiple change points with the Filtered
  Derivative with p-Value method",,"Sequential Analysis (2010) 26",,,"math.ST stat.TH","http://arxiv.org/licenses/nonexclusive-distrib/1.0/","  This paper deals with off-line detection of change points for time series of
independent observations, when the number of change points is unknown. We
propose a sequential analysis like method with linear time and memory
complexity. Our method is based at first step, on Filtered Derivative method
which detects the right change points but also false ones. We improve Filtered
Derivative method by adding a second step in which we compute the p-values
associated to each potential change points. Then we eliminate as false alarms
the points which have p-value smaller than a given critical level. Next, our
method is compared with the Penalized Least Square Criterion procedure on
simulated data sets. Eventually, we apply Filtered Derivative with p-Value
method to segmentation of heartbeat time series, and detection of change points
in the average daily volume of financial time series.
","[{""version"":""v1"",""created"":""Mon, 22 Mar 2010 13:01:30 GMT""},{""version"":""v2"",""created"":""Mon, 14 Feb 2011 13:25:17 GMT""}]","2015-03-13"
"1003.4149","Claude Martineau","Claude Martineau (IGM-LabInfo), Elsa Tolone (IGM-LabInfo), Stavroula
  Voyatzi (IGM-LabInfo)","Les Entit\'es Nomm\'ees : usage et degr\'es de pr\'ecision et de
  d\'esambigu\""isation",,"26\`eme Colloque international sur le Lexique et la Grammaire
  (LGC'07), Bonifacio : France (2007)",,,"cs.CL","http://arxiv.org/licenses/nonexclusive-distrib/1.0/","  The recognition and classification of Named Entities (NER) are regarded as an
important component for many Natural Language Processing (NLP) applications.
The classification is usually made by taking into account the immediate context
in which the NE appears. In some cases, this immediate context does not allow
getting the right classification. We show in this paper that the use of an
extended syntactic context and large-scale resources could be very useful in
the NER task.
","[{""version"":""v1"",""created"":""Mon, 22 Mar 2010 13:09:57 GMT""}]","2010-04-01"
"1003.4150","Cacciatori Sergio","F. Belgiorno, S.L. Cacciatori, G. Ortenzi, L. Rizzi, V. Gorini, D.
  Faccio","Dielectric black holes induced by a refractive index perturbation and
  the Hawking effect","Several improvements, also including dispersion, have been considered","Phys.Rev.D83:024015,2011","10.1103/PhysRevD.83.024015",,"quant-ph gr-qc physics.optics","http://arxiv.org/licenses/nonexclusive-distrib/1.0/","  We consider a 4D model for photon production induced by a %superluminal
refractive index perturbation in a dielectric medium. We show that, in this
model, we can infer the presence of a Hawking type effect. This prediction
shows up both in the analogue Hawking framework, which is implemented in the
pulse frame and relies on the peculiar properties of the effective geometry in
which quantum fields propagate, as well as in the laboratory frame, through
standard quantum field theory calculations. Effects of optical dispersion are
also taken into account, and are shown to provide a limited energy bandwidth
for the emission of Hawking radiation.
","[{""version"":""v1"",""created"":""Mon, 22 Mar 2010 13:16:15 GMT""},{""version"":""v2"",""created"":""Tue, 23 Nov 2010 17:26:27 GMT""}]","2011-02-02"
"1003.4151","Chris Brunt","Christopher M. Brunt, Christoph Federrath, Daniel J. Price","A method for reconstructing the PDF of a 3D turbulent density field from
  2D observations","5 pages, 2 figures, accepted for publication in MNRAS Letters",,"10.1111/j.1745-3933.2010.00858.x",,"astro-ph.GA","http://arxiv.org/licenses/nonexclusive-distrib/1.0/","  We introduce a method for calculating the probability density function (PDF)
of a turbulent density field in three dimensions using only information
contained in the projected two-dimensional column density field. We test the
method by applying it to numerical simulations of hydrodynamic and
magnetohydrodynamic turbulence in molecular clouds. To a good approximation,
the PDF of log(normalised column density) is a compressed, shifted version of
the PDF of log(normalised density). The degree of compression can be determined
observationally from the column density power spectrum, under the assumption of
statistical isotropy of the turbulence.
","[{""version"":""v1"",""created"":""Mon, 22 Mar 2010 13:20:15 GMT""}]","2015-05-18"
"1003.4152","Enzo Granato","Enzo Granato and S.C. Ying","Non-monotonic velocity dependence of atomic friction","4 pages, 4 figures, to appear in Tribol. Lett.","Tribol. Lett. 39, 229 (2010)","10.1007/s11249-010-9595-3",,"cond-mat.mes-hall cond-mat.mtrl-sci","http://arxiv.org/licenses/nonexclusive-distrib/1.0/","  We study the velocity dependence of the frictional force of the tip of an
atomic force microscope as it is dragged across a surface, taking into account
memory effects and thermal fluctuations. Memory effects are described by a
coupling of the tip to low frequency excitation modes of the surface in
addition to the coupling to the periodic corrugation potential. We find that
when the excitation mode frequency is comparable to the characteristic
frequency corresponding to the motion of the tip across the surface, the
velocity dependence of the frictional force is non monotonic, displaying a
velocity range where the frictional force can decrease with increasing
velocity. These results provide theoretical support for the interpretation of
recent experiments which find a frictional force that decreases with velocity
on surfaces covered with a monolayer.
","[{""version"":""v1"",""created"":""Mon, 22 Mar 2010 13:24:27 GMT""}]","2010-08-31"
"1003.4153","Detlev Gotta","Th. Strauch, F. D. Amaro, D. F. Anagnostopoulos, P. B\""uhler, D. S.
  Covita, H. Gorke, D. Gotta, A. Gruber, A. Hirtl, P. Indelicato, E.-O.
  LeBigot, M. Nekipelov, J. M. F. dos Santos, S. Schlesser, Ph. Schmid, L. M.
  Simons, M. Trassinelli, J.F.C.A. Veloso, and J. Zmeskal","Precision determination of the dpi -> NN transition strength at
  threshold","4 pages, 2 figures, 1 table","Phys.Rev.Lett.104:142503,2010","10.1103/PhysRevLett.104.142503",,"nucl-ex","http://arxiv.org/licenses/nonexclusive-distrib/1.0/","  An unusual but effective way to determine at threshold the dpi -> NN
transition strength is to exploit the hadronic ground-state broadening in
pionic deuterium, accessible by x-ray spectroscopy. The broadening is dominated
by the true absorption channel dpi- -> nn, which is related to s-wave pion
production pp -> dpi+ by charge symmetry and detailed balance. Using the exotic
atom circumvents the problem of Coulomb corrections to the cross section as
necessary in the production experiments. Our dedicated measurement finds
(1171+23/-49) meV for the broadening yielding (252+5/-11) \mub.
","[{""version"":""v1"",""created"":""Mon, 22 Mar 2010 13:29:24 GMT""}]","2010-04-14"
"1003.4154","Krzysztof Gawedzki","Krzysztof Gawedzki, Rafal R. Suszek, Konrad Waldorf","Global gauge anomalies in two-dimensional bosonic sigma models","50 pages, 1 figure","Commun. Math. Phys. 302 (2), 513-580 (2011)","10.1007/s00220-010-1162-0","ZMP-HH/10-7; HBM 365","hep-th math-ph math.MP","http://arxiv.org/licenses/nonexclusive-distrib/1.0/","  We revisit the gauging of rigid symmetries in two-dimensional bosonic sigma
models with a Wess-Zumino term in the action. Such a term is related to a
background closed 3-form H on the target space. More exactly, the sigma-model
Feynman amplitudes of classical fields are associated to a bundle gerbe with
connection of curvature H over the target space. Under conditions that were
unraveled more than twenty years ago, the classical amplitudes may be coupled
to the topologically trivial gauge fields of the symmetry group in a way which
assures infinitesimal gauge invariance. We show that the resulting gauged
Wess-Zumino amplitudes may, nevertheless, exhibit global gauge anomalies that
we fully classify. The general results are illustrated on the example of the
WZW and the coset models of conformal field theory. The latter are shown to be
inconsistent in the presence of global anomalies. We introduce a notion of
equivariant gerbes that allow an anomaly-free coupling of the Wess-Zumino
amplitudes to all gauge fields, including the ones in non-trivial principal
bundles. The obstructions to the existence of equivariant gerbes and their
classification are discussed. The choice of different equivariant structures on
the same bundle gerbe gives rise to a new type of discrete-torsion ambiguities
in the gauged amplitudes. An explicit construction of gerbes equivariant with
respect to the adjoint symmetries over compact simply connected simple Lie
groups is given.
","[{""version"":""v1"",""created"":""Mon, 22 Mar 2010 13:42:27 GMT""}]","2011-03-30"
"1003.4155","Florent Berthelin","Florent Berthelin (JAD), Julien Vovelle (ICJ)","A BGK approximation to scalar conservation laws with discontinuous flux",,,,,"math.AP","http://arxiv.org/licenses/nonexclusive-distrib/1.0/","  We study the BGK approximation to first-order scalar conservation laws with a
flux which is discontinuous in the space variable. We show that the Cauchy
Problem for the BGK approximation is well-posed and that, as the relaxation
parameter tends to 0, it converges to the (entropy) solution of the limit
problem.
","[{""version"":""v1"",""created"":""Mon, 22 Mar 2010 13:43:38 GMT""}]","2010-04-01"
"1003.4156","Jean-Baptiste Aubin","Jean-Baptiste Aubin, Samuela Leoni-Aubin","A longest run test for heteroscedasticity in univariate regression model",,,,,"stat.ME math.ST stat.TH","http://arxiv.org/licenses/nonexclusive-distrib/1.0/","  The scope of this paper is the presentation of a test that enables to detect
heteroscedasticity in univariate regression model. The test is simple to
compute and very general since no hypothesis is made on the regularity of the
response function or on the normality of errors. Simulations show that our test
fairs well with respect to other less general nonparametric tests.
","[{""version"":""v1"",""created"":""Mon, 22 Mar 2010 13:44:42 GMT""}]","2010-03-23"
"1003.4157","Jean-R\'egis Angilella","J. R. Angilella","Asymptotic analysis of chaotic particle sedimentation and trapping in
  the vicinity of a vertical upward streamline","10 figures","J.R. Angilella. Asymptotic analysis of chaotic particle
  sedimentation and trapping in the vicinity of a vertical upward streamline.
  Physics of Fluids 19 (7) 073302 (2007).","10.1063/1.2751387",,"physics.flu-dyn","http://arxiv.org/licenses/nonexclusive-distrib/1.0/","  The sedimentation of a heavy Stokes particle in a laminar plane or
axisymmetric flow is investigated by means of asymptotic methods. We focus on
the occurrence of Stommel's retention zones, and on the splitting of their
separatrices. The goal of this paper is to analyze under which conditions these
retention zones can form, and under which conditions they can break and induce
chaotic particle settling. The terminal velocity of the particle in still fluid
is of the order of the typical velocity of the flow, and the particle response
time is much smaller than the typical flow time-scale. It is observed that if
the flow is steady and has an upward streamline where the vertical velocity has
a strict local maximum, then inertialess particle trajectories can take locally
the form of elliptic Stommel cells, provided the particle terminal velocity is
close enough to the local peak flow velocity. These structures only depend on
the local flow topology and do not require the flow to have closed streamlines
or stagnation points. If, in addition, the flow is submitted to a weak
time-periodic perturbation, classical expansions enable one to write the
particle dynamics as a hamiltonian system with one degree of freedom, plus a
perturbation containing both the dissipative terms of the particle motion
equation and the flow unsteadiness. Melnikov's method therefore provides
accurate criteria to predict the splitting of the separatrices of the elliptic
cell mentioned above, leading to chaotic particle trapping and chaotic
settling. The effect of particle inertia and flow unsteadiness on the
occurrence of simple zeros in Melnikov's function is discussed. Particle motion
in a plane cellular flow and in a vertical pipe is then investigated to
illustrate these results.
","[{""version"":""v1"",""created"":""Mon, 22 Mar 2010 13:44:44 GMT""}]","2010-03-23"
"1003.4158","Yury Eroshenko","V.I. Dokuchaev, Yu.N. Eroshenko, S.G. Rubin","Gravitational Wave Bursts from Collisions of Primordial Black Holes in
  Clusters","10 pages, 2 figures","Astronomy Letters, 2009, Vol. 35, No. 3, pp. 143-149.","10.1134/S1063773709030013",,"astro-ph.CO","http://arxiv.org/licenses/nonexclusive-distrib/1.0/","  The rate of gravitational wave bursts from the mergers of massive primordial
black holes in clusters is calculated. Such clusters of black holes can be
formed through phase transitions in the early Universe. The central black holes
in clusters can serve as the seeds of supermassive black holes in galactic
nuclei. The expected burst detection rate by the LISA gravitational wave
detector is estimated.
","[{""version"":""v1"",""created"":""Mon, 22 Mar 2010 13:46:26 GMT""}]","2010-03-23"
"1003.4159","Petr Hajicek","Petr Hajicek","Cluster separability, indispensability of detectors and quantum
  measurement problem","8 Pages, no figures",,,,"quant-ph","http://arxiv.org/licenses/nonexclusive-distrib/1.0/","  Careful analysis of cluster separability opens a way to a completely new
understanding of preparation and registration procedures for microsystems: they
are changes of separation status. An important observation is that quantum
mechanics does not specify what happens to systems when they change their
separation status. New rules that close this gap can therefore be added without
disturbing the logic of quantum mechanics. Another important observation is
that registration apparatuses for microsystems must contain detectors and that
their readings are signals from detectors. This leads to further restrictions
on measurability of observables, especially for macroscopic quantum systems.
Beltrametti-Cassinelli-Lahti model is used to show how this approach leads to
solution of the measurement problem.
","[{""version"":""v1"",""created"":""Mon, 22 Mar 2010 13:49:27 GMT""}]","2010-03-23"
"1003.4160","Pierre Cardaliaguet","Pierre Cardaliaguet (LM), James Nolen, Panagiotis E. Souganidis","Homogenization and enhancement for the G-equation",,"Archive for Rational Mechanics and Analysis 199, 2 (2010) 527-567","10.1007/s00205-010-0332-8",,"math.AP","http://arxiv.org/licenses/nonexclusive-distrib/1.0/","  We consider the so-called G-equation, a level set Hamilton-Jacobi equation,
used as a sharp interface model for flame propagation, perturbed by an
oscillatory advection in a spatio-temporal periodic environment. Assuming that
the advection has suitably small spatial divergence, we prove that, as the size
of the oscillations diminishes, the solutions homogenize (average out) and
converge to the solution of an effective anisotropic first-order
(spatio-temporal homogeneous) level set equation. Moreover we obtain a rate of
convergence and show that, under certain conditions, the averaging enhances the
velocity of the underlying front. We also prove that, at scale one, the level
sets of the solutions of the oscillatory problem converge, at long times, to
the Wulff shape associated with the effective Hamiltonian. Finally we also
consider advection depending on position at the integral scale.
","[{""version"":""v1"",""created"":""Mon, 22 Mar 2010 13:51:58 GMT""}]","2011-02-16"
"1003.4161","Tobias Baier","Tobias Baier, Clarissa Steffes and Steffen Hardt","Thermocapillary Flow on Superhydrophobic Surfaces","4 pages, 4 figures","Phys. Rev. E 82, 037301 (2010)","10.1103/PhysRevE.82.037301",,"physics.flu-dyn","http://arxiv.org/licenses/nonexclusive-distrib/1.0/","  A liquid in Cassie-Baxter state above a structured superhydrophobic surface
is ideally suited for surface driven transport due to its large free surface
fraction in close contact to a solid. We investigate thermal Marangoni flow
over a superhydrophobic array of fins oriented parallel or perpendicular to an
applied temperature gradient. In the Stokes limit we derive an analytical
expression for the bulk flow velocity above the surface and compare it with
numerical solutions of the Navier-Stokes equation. Even for moderate
temperature gradients comparatively large flow velocities are induced,
suggesting to utilize this principle for microfluidic pumping.
","[{""version"":""v1"",""created"":""Mon, 22 Mar 2010 13:53:09 GMT""}]","2010-09-08"
"1003.4162","Oksana Yakimova","Willem A. de Graaf, Oksana S. Yakimova","Good index behaviour of $\theta$-representations, I",,,,,"math.RT","http://arxiv.org/licenses/nonexclusive-distrib/1.0/","  Let $Q$ be an algebraic group with $q=\Lie Q$ and $V$ a $Q$-module. The index
of $V$ is the minimal codimension of the $Q$-orbits in the dual space $V^*$.
There is a general inequality, due to Vinberg, relating the index of $V$ and
the index of a $Q_v$-module $V/q.v$ for $v\in V$. A pair $(Q,V)$ is said to
have GIB if Vinberg's inequality turns into an equality for all $v\in V$. In
this article, we are interested in the GIB property of
$\theta$-representations, where $\theta$ is a finite order automorphism of a
simple Lie algebra $g$. An automorphism of order $m$ defines a $Z/mZ$-grading
$g=g_0+g_1+...+g_{m-1}$. If $G_0$ is the identity component of $G^\theta$, then
it acts on $\gt g_1$ and this action is called a $\theta$-representation. We
classify inner automorphisms of $gl_n$ and all finite order autmorphisms of the
exceptional Lie algebras such that $(G_0,g_1)$ has GIB and $g_1$ contains a
semisimple element.
","[{""version"":""v1"",""created"":""Mon, 22 Mar 2010 13:58:16 GMT""}]","2010-03-23"
"1003.4163","Thomas Gasenzer","Thomas Gasenzer, Stefan Kessler, and Jan M. Pawlowski","Far-from-equilibrium quantum many-body dynamics","20 pp., 6 figs; submitted version with added references and typos
  corrected.","Eur.Phys.J.C70:423-443,2010","10.1140/epjc/s10052-010-1430-3","HD-THEP-10-02","cond-mat.quant-gas hep-ph hep-th","http://arxiv.org/licenses/nonexclusive-distrib/1.0/","  The theory of real-time quantum many-body dynamics as put forward in Ref.
[arXiv:0710.4627] is evaluated in detail. The formulation is based on a
generating functional of correlation functions where the Keldysh contour is
closed at a given time. Extending the Keldysh contour from this time to a later
time leads to a dynamic flow of the generating functional. This flow describes
the dynamics of the system and has an explicit causal structure. In the present
work it is evaluated within a vertex expansion of the effective action leading
to time evolution equations for Green functions. These equations are applicable
for strongly interacting systems as well as for studying the late-time
behaviour of nonequilibrium time evolution. For the specific case of a bosonic
N-component phi^4 theory with contact interactions an s-channel truncation is
identified to yield equations identical to those derived from the 2PI effective
action in next-to-leading order of a 1/N expansion. The presented approach
allows to directly obtain non-perturbative dynamic equations beyond the widely
used 2PI approximations.
","[{""version"":""v1"",""created"":""Mon, 22 Mar 2010 14:03:40 GMT""},{""version"":""v2"",""created"":""Sat, 10 Apr 2010 21:17:26 GMT""}]","2011-02-09"
"1003.4164","Giovanni Jona-Lasinio","Giovanni Jona-Lasinio","From fluctuations in hydrodynamics to nonequilibrium thermodynamics","based on a talk given in Kyoto at the Workshop ""Nonequilibrium
  Statistical Mechanics"", July-August 2009. To appear in Progress of
  Theoretical Physics Supplement",,"10.1143/PTPS.184.262",,"cond-mat.stat-mech","http://arxiv.org/licenses/nonexclusive-distrib/1.0/","  This paper reports on a macroscopic fluctuation theory developed over the
last ten years in collaboration with L. Bertini, A. De Sole, D. Gabrielli and
C. Landim. This theory has been inspired by and tested on stochastic models of
interacting particles (stochastic lattice gases). It is the basis for a new
approach to the study of stationary non equilibrium states applicable to a
large class of systems. This overview emphasizes general ideas and for the
details I refer to the published papers.
","[{""version"":""v1"",""created"":""Mon, 22 Mar 2010 14:08:37 GMT""}]","2015-05-18"
"1003.4165","Lucio Centrone","Lucio Centrone","Ordinary and Z/2Z-graded Cocharacters of UT_2(E)","13 pages, 0 figures","Comm. Algebra 39,7, 2011, 2554-2572",,,"math.RA","http://arxiv.org/licenses/nonexclusive-distrib/1.0/","  Let E be the infinite dimensional Grassmann algebra over a field F of
characteristic 0. In this paper we compute the ordinary and the Z/2Z-graded
cocharacters of the algebra of 2x2 upper triangular matrices with coefficients
in E, using the tool of proper Hilbert series.
","[{""version"":""v1"",""created"":""Mon, 22 Mar 2010 14:10:17 GMT""}]","2012-11-29"
"1003.4166","Zahra-Sadat Yamani","Z. Yamani, W.J.L. Buyers, R.A. Cowley, and D. Prabhakaran","Magnetic excitations of spin and orbital moments in cobalt oxide","Accepted for publication in Canadian Journal of Physics",,"10.1139/P10-021",,"cond-mat.str-el","http://arxiv.org/licenses/nonexclusive-distrib/1.0/","  Magnetic and phonon excitations in the antiferromagnet CoO with an unquenched
orbital angular momentum are studied by neutron scattering. Results of energy
scans in several Brillouin zones in the (HHL) plane for energy transfers up to
16 THz are presented. The measurements were performed in the antiferromagnetic
ordered state at 6 K (well below TN~290 K) as well as in the paramagnetic state
at 450 K. Several magnetic excitation modes are identified from the dependence
of their intensity on wavevector and temperature. Within a Hund's rule model
the excitations correspond to fluctuations of coupled orbital and spin degrees
of freedom whose bandwidth is controlled by interionic superexchange. The
different <111> ordering domains give rise to several magnetic peaks at each
wavevector transfer.
","[{""version"":""v1"",""created"":""Mon, 22 Mar 2010 14:10:19 GMT""}]","2015-05-18"
