"1003.5481","Wang-Q Lim","P. Kittipoom, G. Kutyniok, W. Lim","Construction of Compactly Supported Shearlet Frames",,,,,"math.FA","http://arxiv.org/licenses/nonexclusive-distrib/1.0/","  Shearlet tight frames have been extensively studied during the last years due
to their optimal approximation properties of cartoon-like images and their
unified treatment of the continuum and digital setting. However, these studies
only concerned shearlet tight frames generated by a band-limited shearlet,
whereas for practical purposes compact support in spatial domain is crucial. In
this paper, we focus on cone-adapted shearlet systems which -- accounting for
stability questions -- are associated with a general irregular set of
parameters. We first derive sufficient conditions for such cone-adapted
irregular shearlet systems to form a frame and provide explicit estimates for
their frame bounds. Secondly, exploring these results and using specifically
designed wavelet scaling functions and filters, we construct a family of
cone-adapted shearlet frames consisting of compactly supported shearlets. For
this family, we derive estimates for the ratio of their frame bounds and prove
that they provide optimally sparse approximations of cartoon-like images.
","[{""version"":""v1"",""created"":""Mon, 29 Mar 2010 09:55:04 GMT""},{""version"":""v2"",""created"":""Fri, 2 Apr 2010 16:47:22 GMT""}]","2015-03-13"
"1003.5482","Dmitrey Vlasov Vas","D.V. Vlasov, L.A. Apresian, V.I. Krystob, T.V. Vlasova","On the mechanisms of switching between two steady states of
  electroconductivity in plasticized transparent PVC films","4page, 1 fig, experiment",,,,"cond-mat.soft","http://arxiv.org/licenses/nonexclusive-distrib/1.0/","  The results of experimental researches of electroconductivity of PVC films,
plasticized by patented modifier, at fields below the breakdown level are
described. A possibility of management of the repeated transitions between two
states with high and relatively low conductivity with conservation of
reversibility is found out. A simple qualitative model of abnormal conductivity
based on representation of polymer film as a sequence p-n of transitions is
offered. For samples of plasticized PVC films with thickness 30-50 microns
specific volume resistance of steady states was of an order of 10E4 Om*m \times
10E6 Om*m, accordingly. A simple qualitative model describing abnormal
character of conductivity of polymeric films is offered. The model considers
the presence of known non-uniform plasticized polymer structure with discrete
domains in which quasi-free moving of charges can occur. At imposing of an
external field semi-condictive domains form sequence of p-n transitions which
provides presence of two states of conductivity, in analogy with dinistors.
","[{""version"":""v1"",""created"":""Mon, 29 Mar 2010 10:02:31 GMT""}]","2010-03-30"
"1003.5483","Sabir Ramazanov Ramazanovich","Sergey Mironov, Mikhail Osipov, Sabir Ramazanov","Standard Model in adS slice with UV-localized Higgs field","20 pages, 3 figures, Journal version","Int.J.Mod.Phys.A25:3641-3660,2010","10.1142/S0217751X10049797",,"hep-ph","http://arxiv.org/licenses/nonexclusive-distrib/1.0/","  We discuss five-dimensional Standard Model in a slice of adS space-time with
the Higgs field residing near or on the UV brane. Allowing fermion fields to
propagate in the bulk, we obtain the hierarchy of their masses and quark
mixings without introducing large or small Yukawa couplings. However, the
interaction of fermions with the Higgs and gauge boson KK excitations gives
rise to FCNC with no built-in suppression mechanism. This strongly constrains
the scale of KK masses. We also discuss neutrino mass generation via KK
excitations of the Higgs field. We find that this mechanism is subdominant in
the scenarios of spontaneous symmetry breaking we consider.
","[{""version"":""v1"",""created"":""Mon, 29 Mar 2010 10:05:31 GMT""},{""version"":""v2"",""created"":""Tue, 23 Nov 2010 18:36:23 GMT""}]","2010-11-24"
"1003.5484","Tomasz Klimsiak","Tomasz Klimsiak","On time-dependent functionals of diffusions corresponding to divergence
  form operators",,"J. Theor. Probab. (2013) 26, 437-473",,,"math.PR math.AP","http://arxiv.org/licenses/nonexclusive-distrib/1.0/","  We consider additive functionals as a time and space-dependent function of a
diffusion corresponding to nonhomogeneous uniformly elliptic divergence form
operator. We show that if the function belongs to natural domain of strong
solutions of PDEs then there is a version of this function such that additive
functional is a continuous Dirichlet process for almost every starting points
of diffusion and we describe the martingale and the zero-quadratic variation
parts of its decomposition. We show also that under slightly stronger condition
on the function this property holds for every starting point. Finally, we prove
an extension of the It\^o formula.
","[{""version"":""v1"",""created"":""Mon, 29 Mar 2010 10:06:26 GMT""},{""version"":""v2"",""created"":""Thu, 9 Sep 2010 14:02:35 GMT""},{""version"":""v3"",""created"":""Wed, 20 Apr 2011 11:13:26 GMT""}]","2015-03-24"
"1003.5485","James Lutsko","James F. Lutsko, Vasileios Basios, Gregoire Nicolis, Tom P. Caremans,
  Alexander Aerts, Johan A. Martens, Christine E. A. Kirschhock and Titus S.
  van Erp","Kinetics of intermediate-mediated self-assembly in nano-sized materials:
  a generic model","To appear in J. Chem. Phys.","J. Chem. Phys. 132, 164701 (2010)","10.1063/1.3389502",,"cond-mat.mes-hall cond-mat.mtrl-sci physics.bio-ph","http://arxiv.org/licenses/nonexclusive-distrib/1.0/","  We propose in this paper a generic model of a non-standard aggregation
mechanism for self-assembly processes of a class of materials involving the
mediation of intermediates consisting of a polydisperse population of
nano-sized particles. The model accounts for a long induction period in the
process. The proposed mechanism also gives insight on future experiments aiming
at a more comprehensive picture of the role of self-organization in
self-assembly processes.
","[{""version"":""v1"",""created"":""Mon, 29 Mar 2010 10:12:09 GMT""}]","2015-05-18"
"1003.5486","Massimo Blasone Dr","M. Blasone, F. Dell'Anno, S. De Siena and F. Illuminati","On entanglement in neutrino mixing and oscillations","14 pages, 2 figures. Presented at ""Symmetries in Science Symposium -
  Bregenz 2009"".","J.Phys.Conf.Ser.237:012007,2010","10.1088/1742-6596/237/1/012007",,"quant-ph hep-ph hep-th","http://arxiv.org/licenses/nonexclusive-distrib/1.0/","  We report on recent results about entanglement in the context of particle
mixing and oscillations. We study in detail single-particle entanglement
arising in two-flavor neutrino mixing. The analysis is performed first in the
context of Quantum Mechanics, and then for the case of Quantum Field Theory.
","[{""version"":""v1"",""created"":""Mon, 29 Mar 2010 10:13:38 GMT""}]","2010-12-20"
"1003.5487","Indrakshi Raychowdhury","Manu Mathur, Indrakshi Raychowdhury and Ramesh Anishetty","SU(N) Irreducible Schwinger Bosons","27 pages, 5 figures, revtex4","J.Math.Phys.51:093504,2010","10.1063/1.3464267",,"math-ph math.MP","http://arxiv.org/licenses/nonexclusive-distrib/1.0/","  We construct SU(N) irreducible Schwinger bosons satisfying certain U(N-1)
constraints which implement the symmetries of SU(N) Young tableaues. As a
result all SU(N) irreducible representations are simple monomials of $(N-1)$
types of SU(N) irreducible Schwinger bosons. Further, we show that these
representations are free of multiplicity problems. Thus all SU(N)
representations are made as simple as SU(2).
","[{""version"":""v1"",""created"":""Mon, 29 Mar 2010 10:23:01 GMT""}]","2015-03-13"
"1003.5488","G\""oran Johansson","L. Tornberg and G\""oran Johansson","High fidelity feed-back assisted parity measurement in circuit QED",,,"10.1103/PhysRevA.82.012329",,"cond-mat.mes-hall quant-ph","http://arxiv.org/licenses/nonexclusive-distrib/1.0/","  We analyze a two qubit parity measurement based on dispersive read-out in
circuit quantum electrodynamics. The back-action on the qubits has two
qualitatively different contributions. One is an unavoidable dephasing in one
of the parity subspaces, arising during the transient time of switching on the
measurement. The other part is a stochastic rotation of the phase in the same
subspace, which persists during the whole measurement. The latter can be
determined from the full measurement record, using the method of state
estimation. Our main result is that the outcome of this phase determination
process is {\em independent} of the initial state in the state estimation
procedure. The procedure can thus be used in a measurement situation, where the
initial state is unknown. We discuss how this feed-back method can be used to
achieve a high fidelity parity measurement for realistic values of the
cavity-qubit coupling strength. Finally, we discuss the robustness of the
feed-back procedure towards errors in the measurement record.
","[{""version"":""v1"",""created"":""Mon, 29 Mar 2010 10:30:20 GMT""}]","2015-05-18"
"1003.5489","Antonio Marin-Franch","Antonio Marin-Franch, Santi Cassisi, Antonio Aparicio and Adriano
  Pietrinferni","The impact of enhanced He and CNONa abundances on globular cluster
  relative age-dating methods","26 pages, 8 figures, accepted for publication in ApJ.",,"10.1088/0004-637X/714/2/1072",,"astro-ph.GA","http://arxiv.org/licenses/nonexclusive-distrib/1.0/","  The impact that unrecognised differences in the chemical patterns of Galactic
globular clusters have on their relative age determinations is studied. The two
most widely used relative age-dating methods, horizontal and vertical, together
with the more recent relative MS-fitting method, were carefully analyzed on a
purely theoretical basis. The BaSTI library was adopted to perform the present
analysis. We find that relative ages derived using the horizontal and vertical
methods are largely dependent on the initial He content and heavy element
distribution. Unrecognized cluster-to-cluster chemical abundance differences
can lead to an error in the derived relative ages as large as ~0.5 (or ~6 Gyr
if an age of 12.8 Gyr is adopted for normalization), and even larger for some
extreme cases. It is shown that the relative MS-fitting method is by far the
age-dating technique for which undetected cluster-to-cluster differences in the
He abundance have less impact. Present results are used in order to pose
constraints on the maximum possible spread in the He and CNONa elements
abundances on the basis of the estimates - taken from the literature - of the
Galactic globular clusters relative age dispersion obtained with the various
relative age-dating techniques. Finally, it is shown that the age-metallicity
relation found for young Galactic globular clusters by the GC Treasury program
is a real age sequence and cannot be produced by variations in the He and/or
heavy element distribution.
","[{""version"":""v1"",""created"":""Mon, 29 Mar 2010 10:36:39 GMT""}]","2015-05-18"
"1003.5490","Sanjeev Dhurandhar","S. Dhurandhar, H. Mukhopadhyay, H. Tagoshi and N. Kanda","Coherent versus coincidence detection of gravitational wave signals from
  compact inspiraling binaries","Based on the presentation at the 1st Galileo Xu Guangqi conference,
  Shanghai.","Int.J.Mod.Phys.D20:2051-2056,2011","10.1142/S0218271811020160",,"gr-qc","http://arxiv.org/licenses/nonexclusive-distrib/1.0/","  We compare two multi-detector detection strategies, namely, the coincidence
and the coherent, for the detection of spinless inspiraling compact binary
gravitational wave signals. The coincident strategy treats the detectors as if
they are isolated - compares individual detector statistics with their
respective thresholds while the coherent strategy combines the detector network
data {\it phase coherently} to obtain a single detection statistic which is
then compared with a single threshold. In the case of geographically separated
detectors, we also consider an {\it enhanced} coincidence strategy because the
usual (naive) coincidence strategy yields poor results for misaligned
detectors. For simplicity, we consider detector pairs having the same power
spectral density of noise, as that of initial LIGO and also assume the noise to
be stationary and Gaussian. We compare the performances of the methods by
plotting the \emph{receiver operating characteristic} (ROC) for the two
strategies. A single astrophysical source as well as a distribution of sources
is considered. We find that the coherent strategy performs better than the two
coincident strategies under the assumptions of stationary Gaussian detector
noise.
","[{""version"":""v1"",""created"":""Mon, 29 Mar 2010 10:44:19 GMT""}]","2011-09-30"
"1003.5491","Yves Felix","Yves Felix","Rational formality of mapping spaces",,,,,"math.AT","http://arxiv.org/licenses/nonexclusive-distrib/1.0/","  Let X and Y be finite nilpotent CW complexes with dimension of X less than
the connectivity of Y. Generalizing results of Vigu\'e-Poirrier and Yamaguchi,
we prove that the mapping space Map(X,Y) is rationally formal if and only if Y
has the rational homotopy type of a finite product of odd dimensional spheres.
","[{""version"":""v1"",""created"":""Mon, 29 Mar 2010 10:45:12 GMT""}]","2010-03-30"
"1003.5492","Ivan  Yudin","Ana Paula Santana and Ivan Yudin","Perfect category-graded algebras","A sufficient condition is replaced by a criterion. Several references
  added. 17 pages","Communications in Algebra, Volume 40, Issue 1, 2012","10.1080/00927872.2010.526160",,"math.CT math.RA math.RT","http://arxiv.org/licenses/nonexclusive-distrib/1.0/","  In a perfect category every object has a minimal projective resolution. We
give a criterion for the category of modules over a categorygraded algebra to
be perfect.
","[{""version"":""v1"",""created"":""Mon, 29 Mar 2010 10:46:56 GMT""},{""version"":""v2"",""created"":""Mon, 26 Jul 2010 16:35:02 GMT""}]","2016-02-09"
"1003.5493","Teresa Paula Azevedo Perdicoulis PhD","P. Lopes dos Santos, T-P Azevedo Perdico\'ulis, J.A. Ramos, G. Jank
  and J.L. Martins de Carvalho","Derivation of a transfer function model for a high pressure pipeline","report with 41 pages, 8 figures, that contains all the proofs of a
  paper submitted to the CDC2010.",,,,"math.DS math.OC","http://arxiv.org/licenses/nonexclusive-distrib/1.0/","  In this report a lumped transfer function model for High Pressure Natural Gas
Pipelines is derived. Starting with a partial nonlinear differential equation
(PDE) model a high order continuous state space (SS) linear model is obtained
using a finite difference method. Next, from the SS representation an infinite
order transfer function (TF) model is calculated. In the end, this TF is
approximated by a compact non-rational function.
","[{""version"":""v1"",""created"":""Mon, 29 Mar 2010 10:49:47 GMT""}]","2010-03-30"
"1003.5494","Kang Xian-Wei","Xian-Wei Kang, Hai-Bo Li, Gong-Ru Lu and Alakabha Datta","Study of CP violation in $\Lambda_c^+$ decay","7 pages, 2 tables. Journal reference is added","Int.J.Mod.Phys.A26:2523-2535,2011","10.1142/S0217751X11053432",,"hep-ph hep-ex","http://arxiv.org/licenses/nonexclusive-distrib/1.0/","  In this paper, we study CP violation in $\Lambda_c^+\to BP$ and
$\Lambda_c^+\to BV$ decays, where $B,P$ and $V$ denote a light spin-1/2 baryon,
pseudoscalar and a vector meson respectively. In these processes the $T$ odd CP
violating triple-product (TP) correlations are examined. The genuine CP
violating observables which are composed of the helicity amplitudes occurring
in the angular distribution are constructed. Experimentally, by performing a
full angular analysis it is shown how one may extract the helicity amplitudes
and then obtain the TP asymmetries. We estimate the TP asymmetries in $\lam$
decays to be negligible in the standard model making these processes an
excellent place to look for new physics. Taking a two Higgs doublet model, as
an example of new physics, we show that large TP asymmetries are possible in
these decays. Finally, we discuss how BES-III and Super $\tau$-Charm
experiments will be sensitive to these CP violating signals in $\Lambda_c^+$
decays.
","[{""version"":""v1"",""created"":""Mon, 29 Mar 2010 10:53:13 GMT""},{""version"":""v2"",""created"":""Fri, 14 May 2010 03:00:25 GMT""},{""version"":""v3"",""created"":""Fri, 8 Oct 2010 07:07:43 GMT""},{""version"":""v4"",""created"":""Tue, 19 Apr 2011 05:19:01 GMT""},{""version"":""v5"",""created"":""Wed, 8 Jun 2011 06:58:31 GMT""}]","2011-06-16"
"1003.5495","Mario Leo","M. Leo, R.A. Leo and P. Tempesta","Thermostatistics in the neighborhood of the $\pi$-mode solution for the
  Fermi-Pasta-Ulam $\beta$ system: from weak to strong chaos","15 pages, 5 figures",,"10.1088/1742-5468/2010/04/P04021",,"nlin.CD","http://arxiv.org/licenses/nonexclusive-distrib/1.0/","  We consider a $\pi$-mode solution of the Fermi-Pasta-Ulam $\beta$ system. By
perturbing it, we study the system as a function of the energy density from a
regime where the solution is stable to a regime, where is unstable, first
weakly and then strongly chaotic. We introduce, as indicator of stochasticity,
the ratio $\rho$ (when is defined) between the second and the first moment of a
given probability distribution. We will show numerically that the transition
between weak and strong chaos can be interpreted as the symmetry breaking of a
set of suitable dynamical variables. Moreover, we show that in the region of
weak chaos there is numerical evidence that the thermostatistic is governed by
the Tsallis distribution.
","[{""version"":""v1"",""created"":""Mon, 29 Mar 2010 10:56:08 GMT""}]","2015-05-18"
"1003.5496","Erik Bedos","Erik B\'edos, Tron Omland","Primitivity of some full group C$^*$-algebras","18 pages. Preliminary version. Comments are wellcome.",,,,"math.OA math.GR","http://arxiv.org/licenses/nonexclusive-distrib/1.0/","  We show that the full group C$^*$-algebra of the free product of two
nontrivial countable amenable discrete groups, where at least one of them has
more than two elements, is primitive. We also show that in many cases, this
C$^*$-algebra is antiliminary and has an uncountable family of pairwise
inequivalent, faithful irreducible representations.
","[{""version"":""v1"",""created"":""Mon, 29 Mar 2010 10:56:25 GMT""}]","2010-03-30"
"1003.5497","Justin Lovegrove","Justin Lovegrove, Rudolph E. Schild and Darryl Leiter","Discovery of Universal Elliptical Outflow Structures in Radio-Quiet
  Quasars","10 Pages, 4 figures and 1 table. Submitted to MNRAS",,,,"astro-ph.CO","http://arxiv.org/licenses/nonexclusive-distrib/1.0/","  Fifty-nine quasars in the background of the Magellanic Clouds had brightness
records monitored by the MACHO project during the years 1992 - 99. Because the
circumpolar fields of these quasars had no seasonal sampling defects, their
observation produced data sets well suited to further careful analysis.
Following a preliminary report wherein we showed the existence of reverberation
in the data for one of the radio-quiet quasars in this group, we now show that
similar reverberations have been seen in all of the 55 radio-quiet quasars with
adequate data, making possible the determination of the quasar inclination to
the observer's line of sight. The reverberation signatures indicate the
presence of large-scale elliptical outflow structures similar to that predicted
by the Elvis (2000) and ""dusty torus"" models of quasars, whose characteristic
sizes vary within a surprisingly narrow range of scales. More importantly the
observed opening angle relative to the polar axis of the universal elliptical
outflow structure present was consistently found to be on the order of 78
degrees.
","[{""version"":""v1"",""created"":""Mon, 29 Mar 2010 11:00:02 GMT""}]","2010-03-30"
"1003.5498","Stephen King","S. Antusch, S. Boudjemaa and S. F. King","Neutrino Mixing Angles in Sequential Dominance to NLO and NNLO","27 pages, 2 figures, version to appear in JHEP","JHEP 1009:096,2010","10.1007/JHEP09(2010)096",,"hep-ph","http://arxiv.org/licenses/nonexclusive-distrib/1.0/","  Neutrinos with hierarchical masses and two large mixing angles may naturally
originate from sequential dominance (SD). Within this framework we present
analytic expressions for the neutrino mixing angles including the
next-to-leading order (NLO) and next-to-next-to-leading order (NNLO)
corrections arising from the second lightest and lightest neutrino masses. The
analytic results for neutrino mixing angles in SD presented here, including the
NLO and NNLO corrections, are applicable to a wide class of models and may
provide useful insights when confronting the models with data from high
precision neutrino experiments. We also point out that for special cases of SD
corresponding to form dominance (FD) the NLO and NNLO corrections both vanish.
For example we study tri-bimaximal (TB) mixing via constrained sequential
dominance (CSD) which involves only a NNLO correction and tri-bimaximal-reactor
(TBR) mixing via partially constrained sequential dominance (PCSD) which
involves a NLO correction suppressed by the small reactor angle and show that
the analytic results have good agreement with the numerical results for these
cases.
","[{""version"":""v1"",""created"":""Mon, 29 Mar 2010 11:03:14 GMT""},{""version"":""v2"",""created"":""Mon, 26 Apr 2010 09:57:57 GMT""},{""version"":""v3"",""created"":""Thu, 16 Sep 2010 06:24:24 GMT""}]","2014-11-20"
"1003.5499","Keijo Kajantie","J. Alanen, K. Kajantie, K. Tuominen","Thermodynamics of Quasi Conformal Theories From Gauge/Gravity Duality","17 pages, 13 figures.","Phys.Rev.D82:055024,2010","10.1103/PhysRevD.82.055024","CP3-Origins-2010-14","hep-ph hep-lat hep-th","http://arxiv.org/licenses/nonexclusive-distrib/1.0/","  We use gauge/gravity duality to study the thermodynamics of a generic almost
conformal theory, specified by its beta function. Three different phases are
identified, a high temperature phase of massless partons, an intermediate
quasi-conformal phase and a low temperature confining phase. The limit of a
theory with infrared fixed point, in which the coupling does not run to
infinity, is also studied. The transitions between the phases are of first
order or continuous, depending on the parameters of the beta function. The
results presented follow from gauge/gravity duality; no specific boundary
theory is assumed, only its beta function.
","[{""version"":""v1"",""created"":""Mon, 29 Mar 2010 11:05:08 GMT""}]","2014-11-20"
"1003.5500","Arianto","S. Feranie, Arianto, Freddy P. Zen","Kaluza-Klein two-brane-worlds cosmology at low energy","11 pages, minor typos corrected, published version","Phys.Rev.D81:084058,2010","10.1103/PhysRevD.81.084058",,"hep-th gr-qc","http://arxiv.org/licenses/nonexclusive-distrib/1.0/","  We study two $(4+n)$-dimensional branes embedded in $(5+n)$-dimensional
spacetime. Using the gradient expansion approximation, we find that the
effective theory is described by $(4+n)$-dimensional scalar-tensor gravity with
a specific coupling function. Based on this theory we investigate the
Kaluza-Klein two-brane-worlds cosmology at low energy, in both the static and
the nonstatic internal dimensions. In the case of the static internal
dimensions, the effective gravitational constant in the induced Friedmann
equation depends on the equations of state of the brane matter, and the dark
radiation term naturally appears. In the nonstatic case we take a relation
between the external and internal scale factors of the form $b(t)=a^\gamma(t)$
in which the brane world evolves with two scale factors. In this case, the
induced Friedmann equation on the brane is modified in the effective
gravitational constant and the term proportional to $a^{-4\beta}$. For dark
radiation, we find $\gamma=-2/(1+n)$. Finally, we discuss the issue of
conformal frames which naturally arises with scalar-tensor theories. We find
that the static internal dimensions in the Jordan frame may become nonstatic in
the Einstein frame.
","[{""version"":""v1"",""created"":""Mon, 29 Mar 2010 11:13:37 GMT""},{""version"":""v2"",""created"":""Wed, 5 May 2010 04:27:43 GMT""}]","2014-11-20"
"1003.5501","Allal Ghanmi","Allal Ghanmi","On $L^2$-eigenfunctions of Twisted Laplacian on curved surfaces and
  suggested orthogonal polynomials","This will appear in the Proceeding of ICOAA08 that will be published
  by the Journal of Operators and Matrices.","Oper. Matrices 4 (2010), no. 4, 533--540",,,"math.SP","http://arxiv.org/licenses/nonexclusive-distrib/1.0/","  We show in a unified manner that the factorization method describes
completely the $L^2$-eigenspaces associated to the discrete part of the
spectrum of the twisted Laplacian on constant curvature Riemann surfaces.
Subclasses of two variable orthogonal polynomials are then derived and arise by
successive derivations of elementary complex valued functions depending on the
geometry of the surface.
","[{""version"":""v1"",""created"":""Mon, 29 Mar 2010 11:18:40 GMT""}]","2011-10-04"
