"1003.5375","Evelyne Miot","Evelyne Miot","Damped wave dynamics for a complex Ginzburg-Landau equation with low
  dissipation","29 pages",,,,"math.AP","http://arxiv.org/licenses/nonexclusive-distrib/1.0/","  We consider a complex Ginzburg-Landau equation, corresponding to a
Gross-Pitaevskii equation with a small dissipation term. We study an asymptotic
regime for long-wave perturbations of constant maps of modulus one. We show
that such solutions never vanish and we derive a damped wave dynamics for the
perturbation.
","[{""version"":""v1"",""created"":""Sun, 28 Mar 2010 16:00:23 GMT""}]","2010-03-30"
"1003.5376","Florence Rullier-Albenque","F. Rullier-Albenque, D. Colson, A. Forget, P. Thuery and S. Poissonnet","Hole and Electron Contributions to the Transport Properties of
  Ba(Fe_(1-x)Ru_x)_2As_2 Single Crystals","new version with minor corrections","Phys. Rev. B 81, 224503 (2010)","10.1103/PhysRevB.81.224503",,"cond-mat.supr-con","http://arxiv.org/licenses/nonexclusive-distrib/1.0/","  We report a systematic study of structural and transport properties in single
crystals of Ba(Fe_(1-x)Ru_x)_2As_2 for x ranging from 0 to 0.5. The isovalent
substitution of Fe by Ru leads to an increase of the a parameter and a decrease
of the c parameter, resulting in a strong increase of the AsFeAs angle and a
decrease of the As height above the Fe planes. Upon Ru substitution, the
magnetic order is progressively suppressed and superconductivity emerges for x
> 0.15, with an optimal Tc ~ 20K at x = 0.35 and coexistence of magnetism and
superconductivity between these two Ru contents. Moreover, the Hall coefficient
RH which is always negative and decreases with temperature in BaFe2As2, is
found to increase here with decreasing T and even change sign for x > 0.15. For
x_Ru = 0.35, photo-emission studies have shown that the number of holes and
electrons are similar with n_e = n_h ~ 0.11, that is twice larger than found in
BaFe2As2 [1]. Using this estimate, we find that the transport properties of
Ba(Fe_0.65Ru_0.35)_2As_2 can be accounted for by the conventional multiband
description for a compensated semi-metal. In particular, our results show that
the mobility of holes is strongly enhanced upon Ru addition and overcomes that
of electrons at low temperature when x_Ru > 0.15.
","[{""version"":""v1"",""created"":""Sun, 28 Mar 2010 16:02:39 GMT""},{""version"":""v2"",""created"":""Fri, 4 Jun 2010 13:00:52 GMT""}]","2010-06-07"
"1003.5377","Alexander Ravsky","Alex Ravsky","On H-closed paratopological groups","7 pages","Visnyk Lviv Univ., Ser. Mekh.-Mat. 61 (2003), 172--179.",,,"math.GR","http://arxiv.org/licenses/nonexclusive-distrib/1.0/","  A Hausdorff paratopological group G is H-closed if G is closed in each
Hausdorff paratopological group containing G. We obtain criteria of
H-closedness for some classes of abelian paratopological groups. In particular,
for topological groups.
","[{""version"":""v1"",""created"":""Sun, 28 Mar 2010 16:13:29 GMT""}]","2010-03-30"
"1003.5378","Yaroslav Filinchuk","Yaroslav Filinchuk, Dmitry Chernyshov, Vladimir Dmitriev","Crystal chemistry of light metal borohydrides","16 pages, 9 figures. To be published as the chapter 6 in the book
  ""Boron hydrides, high potential hydrogen storage materials"", edited by U.B.
  Demirci and P. Miele, 2010:
  https://www.novapublishers.com/catalog/product_info.php?products_id=13010",,,,"cond-mat.mtrl-sci","http://arxiv.org/licenses/nonexclusive-distrib/1.0/","  Crystal chemistry of M(BH4)n, where M is a 2nd-4th period element, is
reviewed. It is shown that except certain cases, the BH4 group has a nearly
ideal tetrahedral geometry. Corrections of the experimentally determined
H-positions, accounting for the displacement of the electron cloud relative to
an average nuclear position and for a libration of the BH4 group, are
considered. Recent studies of structural evolution with temperature and
pressure are reviewed. Some borohydrides involving less electropositive metals
(e.g. Mg and Zn) reveal porous structures and dense interpenetrated frameworks,
thus resembling metal-organic frameworks (MOFs). Analysis of phase transitions,
and the related changes of the coordination geometries for M atoms and BH4
groups, suggests that the directional BH4...M interaction is at the origin of
the structural complexity of borohydrides. The ways to influence their
stability by chemical modification are discussed.
","[{""version"":""v1"",""created"":""Sun, 28 Mar 2010 16:19:12 GMT""}]","2010-03-30"
"1003.5379","Peter B. Gilkey","Miguel Brozos-Vazquez and Peter Gilkey","Complex Osserman Kaehler Manifolds",,,,,"math.DG","http://arxiv.org/licenses/nonexclusive-distrib/1.0/","  Let H be a 4 dimensional almost Hermitian manifold which satisfies the
Kaehler identity. Then H is complex Osserman if and only if H has constant
holomorphic sectional curvature. We also classify in arbitrary dimensions all
the complex Osserman Kaehler manifolds which do not have 3 eigenvalues.
","[{""version"":""v1"",""created"":""Sun, 28 Mar 2010 16:41:29 GMT""}]","2010-03-30"
"1003.5380","Kavita Jain","Kavita Jain, Joachim Krug and Su-Chan Park","Evolutionary advantage of small populations on complex fitness
  landscapes","Version to appear in Evolution","Evolution 65-7, 1945-1955",,,"q-bio.PE cond-mat.stat-mech","http://arxiv.org/licenses/nonexclusive-distrib/1.0/","  Background: Recent experimental and theoretical studies have shown that small
asexual populations evolving on complex fitness landscapes may achieve a higher
fitness than large ones due to the increased heterogeneity of adaptive
trajectories. Here we introduce a class of haploid three-locus fitness
landscapes that allows to investigate this scenario in a precise and
quantitative way.
  Results: Our main result derived analytically shows how the probability of
choosing the path of largest initial fitness increase grows with the population
size. This makes large populations more likely to get trapped at local fitness
peaks and implies an advantage of small populations at intermediate time
scales. The range of population sizes where this effect is operative coincides
with the onset of clonal interference. Additional studies using ensembles of
random fitness landscapes show that the results achieved for a particular
choice of three-locus landscape parameters are robust and also persist as the
number of loci increases.
  Conclusions: Our study indicates that an advantage for small populations is
likely whenever the fitness landscape contains local maxima. The advantage
appears at intermediate time scales, which are long enough for trapping at
local fitness maxima to have occurred but too short for peak escape by the
creation of multiple mutants.
","[{""version"":""v1"",""created"":""Sun, 28 Mar 2010 17:07:24 GMT""},{""version"":""v2"",""created"":""Wed, 23 Feb 2011 04:45:10 GMT""}]","2011-07-12"
"1003.5381","Stefan Rotter","Andreas B\""arnthaler, Stefan Rotter, Florian Libisch, Joachim
  Burgd\""orfer, Stefan Gehler, Ulrich Kuhl, and Hans-J\""urgen St\""ockmann","Probing decoherence through Fano resonances","6 pages, 4 figures (including newly added discussion on quantum
  transport data and supplementary material section), final version as accepted
  at PRL","Phys. Rev. Lett. 105, 056801 (2010)","10.1103/PhysRevLett.105.056801",,"cond-mat.mes-hall quant-ph","http://arxiv.org/licenses/nonexclusive-distrib/1.0/","  We investigate the effect of decoherence on Fano resonances in wave
transmission through resonant scattering structures. We show that the Fano
asymmetry parameter q follows, as a function of the strength of decoherence,
trajectories in the complex plane that reveal detailed information on the
underlying decoherence process. Dissipation and unitary dephasing give rise to
manifestly different trajectories. Our predictions are successfully tested
against microwave experiments using metal cavities with different absorption
coefficients and against previously published data on transport through quantum
dots. These results open up new possibilities for studying the effect of
decoherence in a wide array of physical systems where Fano resonances are
present.
","[{""version"":""v1"",""created"":""Sun, 28 Mar 2010 17:21:16 GMT""},{""version"":""v2"",""created"":""Mon, 19 Jul 2010 16:43:54 GMT""}]","2010-07-27"
"1003.5382","Stephen D. H. Hsu","Stephen D.H. Hsu","The black hole information paradox and macroscopic superpositions","10 pages, 4 figures, contribution to proceedings of the 1st
  Mediterranean Conference on Classical and Quantum Gravity.","J.Phys.Conf.Ser.222:012037,2010","10.1088/1742-6596/222/1/012037",,"gr-qc hep-th","http://arxiv.org/licenses/nonexclusive-distrib/1.0/","  We investigate the experimental capabilities required to test whether black
holes destroy information. We show that an experiment capable of illuminating
the information puzzle must necessarily be able to detect or manipulate
macroscopic superpositions (i.e., Everett branches). Hence, it could also
address the fundamental question of decoherence versus wavefunction collapse.
","[{""version"":""v1"",""created"":""Sun, 28 Mar 2010 17:30:31 GMT""}]","2014-11-20"
"1003.5383","Sreekanth Malladi","Sreekanth Malladi, Bezawada Bruhadeshwar, Kishore Kothapalli","Automatic analysis of distance bounding protocols","22 pages, Appeared in Foundations of Computer Security, (Affiliated
  workshop of LICS 2009, Los Angeles, CA).",,,"FCS09","cs.CR cs.NI","http://arxiv.org/licenses/nonexclusive-distrib/1.0/","  Distance bounding protocols are used by nodes in wireless networks to
calculate upper bounds on their distances to other nodes. However, dishonest
nodes in the network can turn the calculations both illegitimate and inaccurate
when they participate in protocol executions. It is important to analyze
protocols for the possibility of such violations. Past efforts to analyze
distance bounding protocols have only been manual. However, automated
approaches are important since they are quite likely to find flaws that manual
approaches cannot, as witnessed in literature for analysis pertaining to key
establishment protocols. In this paper, we use the constraint solver tool to
automatically analyze distance bounding protocols. We first formulate a new
trace property called Secure Distance Bounding (SDB) that protocol executions
must satisfy. We then classify the scenarios in which these protocols can
operate considering the (dis)honesty of nodes and location of the attacker in
the network. Finally, we extend the constraint solver so that it can be used to
test protocols for violations of SDB in these scenarios and illustrate our
technique on some published protocols.
","[{""version"":""v1"",""created"":""Sun, 28 Mar 2010 18:00:30 GMT""}]","2010-03-30"
"1003.5384","Sreekanth Malladi","Sreekanth Malladi","Protocol indepedence through disjoint encryption under Exclusive-OR","22 pages, In Proceedings, Foundations of Security and Privacy
  (FCS-PrivMod 2010).",,,"DSU-BIS-IA-Mallb2010","cs.CR cs.SC","http://arxiv.org/licenses/nonexclusive-distrib/1.0/","  Multi-protocol attacks due to protocol interaction has been a notorious
problem for security. Gutman-Thayer proved that they can be prevented by
ensuring that encrypted messages are distinguishable across protocols, under a
free algebra. In this paper, we prove that a similar suggestion prevents these
attacks under commonly used operators such as Exclusive-OR, that induce
equational theories, breaking the free algebra assumption.
","[{""version"":""v1"",""created"":""Sun, 28 Mar 2010 18:01:04 GMT""},{""version"":""v2"",""created"":""Sun, 9 May 2010 19:05:41 GMT""}]","2010-05-11"
"1003.5385","Sreekanth Malladi","Sreekanth Malladi, Pascal Lafourcade","How to prevent type-flaw attacks on security protocols under algebraic
  properties","16 pages, Appeared in proceedings of Security with Rewriting
  Techniques (SecRet09), Affiliated to CSF Symposium 2009, Port Jefferson, NY.",,,"ML09","cs.CR","http://arxiv.org/licenses/nonexclusive-distrib/1.0/","  Type-flaw attacks upon security protocols wherein agents are led to
misinterpret message types have been reported frequently in the literature.
Preventing them is crucial for protocol security and verification. Heather et
al. proved that tagging every message field with it's type prevents all
type-flaw attacks under a free message algebra and perfect encryption system.
In this paper, we prove that type-flaw attacks can be prevented with the same
technique even under the ACUN algebraic properties of XOR which is commonly
used in ""real-world"" protocols such as SSL 3.0. Our proof method is general and
can be easily extended to other monoidal operators that possess properties such
as Inverse and Idempotence as well. We also discuss how tagging could be used
to prevent type-flaw attacks under other properties such as associativity of
pairing, commutative encryption, prefix property and homomorphic encryption.
","[{""version"":""v1"",""created"":""Sun, 28 Mar 2010 18:06:53 GMT""}]","2010-03-30"
"1003.5386","Cristina Giannotti Dr.","Cristina Giannotti and Andrea Spiro","Steepest descent curves of convex functions on surfaces of constant
  curvature","23 pages, 3 figures; this is a revised version, with minor changes in
  definitions and adjustments in the proofs of Lemma 3.3 and Theorem 5.1;
  accepted for publication in Israel Journal of Mathematics",,,,"math.CA math.DG","http://arxiv.org/licenses/nonexclusive-distrib/1.0/","  Let S be a complete surface of constant curvature K = + 1 or -1, i.e. the
sphere S^2 or the Lobachevskij plane L^2, and D a bounded convex subset of S.
If S = S^2, assume also diameter (D) < pi/2. It is proved that the length of
any steepest descent curve of a quasi-convex function in D is less than or
equal to the perimeter of D. This upper bound is actually proved for the class
of G-curves, a family of curves that naturally includes all steepest descent
curves. In case S = S^2, it is also proved the existence of G-curves, whose
length is equal to the perimeter of their convex hull, showing that the above
estimate is indeed optimal. The results generalize theorems by Manselli and
Pucci on steepest descent curves in the Euclidean plane.
","[{""version"":""v1"",""created"":""Sun, 28 Mar 2010 18:18:48 GMT""},{""version"":""v2"",""created"":""Wed, 17 Nov 2010 17:00:18 GMT""},{""version"":""v3"",""created"":""Tue, 21 Dec 2010 08:43:01 GMT""}]","2015-03-13"
"1003.5387","Takis Kontos","C. Feuillet-Palma, T. Delattre, P. Morfin, J.-M. Berroir, G. F\`eve,
  D.C. Glattli, B. Placais, A. Cottet and T. Kontos","Conserved spin and orbital phase along carbon nanotubes connected with
  multiple ferromagnetic contacts","8 pages - minor differences with published version","Phys. Rev. B 81, 115414 (2010)","10.1103/PhysRevB.81.115414",,"cond-mat.mes-hall","http://arxiv.org/licenses/nonexclusive-distrib/1.0/","  We report on spin dependent transport measurements in carbon nanotubes based
multi-terminal circuits. We observe a gate-controlled spin signal in non-local
voltages and an anomalous conductance spin signal, which reveal that both the
spin and the orbital phase can be conserved along carbon nanotubes with
multiple ferromagnetic contacts. This paves the way for spintronics devices
exploiting both these quantum mechanical degrees of freedom on the same
footing.
","[{""version"":""v1"",""created"":""Sun, 28 Mar 2010 18:31:35 GMT""}]","2015-05-18"
"1003.5388","Michael Coons","Michael Coons","On the multiplicative Erd\H{o}s discrepancy problem","10 pages, newest version contains references",,,,"math.NT","http://arxiv.org/licenses/nonexclusive-distrib/1.0/","  As early as the 1930s, P\'al Erd\H{o}s conjectured that: {\em for any
multiplicative function $f:\mathbb{N}\to\{-1,1\}$, the partial sums
$\sum_{n\leq x}f(n)$ are unbounded.} Considering this conjecture, in this paper
we consider multiplicative functions $f$ satisfying $$\sum_{p\leq
x}f(p)=c\cdot\frac{x}{\log x}(1+o(1)).$$ We prove that if $c>0$ then the
partial sums of $f$ are unbounded, and if $c<0$ then the partial sums of $\mu
f$ are unbounded. Extensions of this result are also discussed.
","[{""version"":""v1"",""created"":""Sun, 28 Mar 2010 18:36:19 GMT""},{""version"":""v2"",""created"":""Tue, 30 Mar 2010 01:43:27 GMT""},{""version"":""v3"",""created"":""Mon, 22 Aug 2011 12:57:57 GMT""},{""version"":""v4"",""created"":""Thu, 25 Aug 2011 15:49:54 GMT""}]","2011-08-26"
"1003.5389","Janusz Jacak","W. Jacak, J. Krasnyj, J. Jacak, A. Chepok, L. Jacak, W. Donderowicz,
  D. Z. Hu, and D. M. Schaadt","Undamped energy transport by collective surface plasmon oscillations
  along metallic nanosphere chain",,,"10.1063/1.3493263",,"cond-mat.mes-hall","http://arxiv.org/licenses/nonexclusive-distrib/1.0/","  The random-phase-approximation semiclassical scheme for description of
plasmon excitations in large metallic nanospheres (with radius 10--100 nm) is
developed for a case of presence of dynamical electric field. The spectrum of
plasmons in metallic nanosphere is determined including both surface and volume
type excitations and their mutual connections. It is demonstrated that only
surface plasmons of dipole type can be excited by a homogeneous dynamical
electric field. The Lorentz friction due to irradiation of e-m energy by
plasmon oscillations is analysed with respect to the sphere dimension. The
resulting shift of resonance frequency due to plasmon damping is compared with
experimental data for various sphere radii. Collective of wave-type
oscillations of surface plasmons in long chains of metallic spheres are
described. The undamped region of propagation of plasmon waves along the chain
is found in agreement with some previous numerical simulations.
","[{""version"":""v1"",""created"":""Sun, 28 Mar 2010 18:38:15 GMT""}]","2015-05-18"
"1003.5390","Vibeke Libby Dr.","Vibeke Libby","A Fast Algorithm for Determining the Existence and Value of Integer
  Roots of N","12 pages, 8 figures",,,,"math.NT cs.DM cs.DS","http://arxiv.org/licenses/nonexclusive-distrib/1.0/","  We show that all perfect odd integer squares not divisible by 3, can be
usefully written as sqrt(N) = a + 18p, where the constant a is determined by
the basic properties of N. The equation can be solved deterministically by an
efficient four step algorithm that is solely based on integer arithmetic. There
is no required multiplication or division by multiple digit integers, nor does
the algorithm need a seed value. It finds the integer p when N is a perfect
square, and certifies N as a non-square when the algorithm terminates without a
solution. The number of iterations scales approximately as log(sqrt(N)/2) for
square roots. The paper also outlines how one of the methods discussed for
squares can be extended to finding an arbitrary root of N. Finally, we present
a rule that distinguishes products of twin primes from squares.
","[{""version"":""v1"",""created"":""Sun, 28 Mar 2010 18:38:39 GMT""}]","2010-03-30"
"1003.5391","Pierre Jammes","Pierre Jammes","Sur la multiplicit\'e des valeurs propres du laplacien de Witten","29 pages, in french. arXiv admin note: substantial text overlap with
  arXiv:0804.0104","Trans. Amer. Math. Soc. 364 (6), 2012, p. 2825-2845",,,"math.DG math.SP","http://arxiv.org/licenses/nonexclusive-distrib/1.0/","  On any compact manifold of dimension greater than 4, we prescribe the volume
and any finite part of the spectrum of the Witten Laplacian acting on $p$-form
for $0<p<n$. In particular, we prescribe the multiplicity of the first
eigenvalues. On 3-dimensional manifolds, we give examples of multiple first
eigenvalue for 1-forms, whose multiplicity depends on the maximal genus of
embedded surfaces all of whose 1-cohomology is induced by the cohomology of the
manifold. In particular, this multiplicity is at least 3.
","[{""version"":""v1"",""created"":""Sun, 28 Mar 2010 18:45:40 GMT""},{""version"":""v2"",""created"":""Tue, 24 Apr 2012 13:13:42 GMT""}]","2012-04-25"
"1003.5392","Tetsuya Abe","Tetsuya Abe","The Rasmussen invariant of a homogeneous knot","12pages, 6 figures",,,,"math.GT","http://arxiv.org/licenses/nonexclusive-distrib/1.0/","  A homogeneous knot is a generalization of alternating knots and positive
knots. We determine the Rasmussen invariant of a homogeneous knot. This is a
new class of knots such that the Rasmussen invariant is explicitly described in
terms of its diagrams. As a corollary, we obtain some characterizations of a
positive knot. In particular, we recover Baader's theorem which states that a
knot is positive if and only if it is homogeneous and strongly quasipositive.
","[{""version"":""v1"",""created"":""Sun, 28 Mar 2010 18:46:00 GMT""}]","2010-03-30"
"1003.5393","Anatoly Zakharov","V.V. Eremenko, V.G. Manzhely, V.N. Varyukhin, A.D. Alekseev, V.A.
  Beloshenko, A. Voronel, V.V Pustovalov, V.Ya. Maleev, S.A. Gredeskul, L.P.
  Mezhov-Deglin, A.Yu. Zakharov, N.Ya. Fogel, I.I. Vishnevsky, V.M. Tsukernik,
  V.N. Vasyukov, E.P. Feldman, A.V. Leont'eva, Yu.A. Mamaluy, G.G. Levchenko,
  Yu.V. Medvedev, A.D. Prokhorov, V.M. Yurchenko, B.G. Alapin, V.G.
  Ksenofontov, A.M. Bykov, E. Lakin, T.L. Pyatigorskaya, S.V. Lysak, A.I.
  Erenburg, S. Kovalenko, G.E. Shatalova, E.O. Tsybul'sky, A.Yu. Prokhorov,
  I.V. Zhikharev","Selected aspects of the condensed matter physics. Work and life of
  Professor B.Ya. Sukharevsky","16 pages, 53 references",,,,"cond-mat.mtrl-sci cond-mat.soft","http://arxiv.org/licenses/nonexclusive-distrib/1.0/","  The paper contains a short description of the scientific papers of Professor
Boris Ya. Sukharevsky on condensed matter physics. His basic scientific
activity was related to following directions: structural vacancies concept;
influence of point defects on statics and kinetics of phase transitions; DNA
crystallization and low-dimensional systems properties; phase transitions in
Jahn-Teller crystals; Thermophysics of superconductors e.a. The list of most
essential papers of Prof. B.Ya. Sukharevsky is included.
","[{""version"":""v1"",""created"":""Sun, 28 Mar 2010 19:06:37 GMT""}]","2010-03-30"
"1003.5394","Salvatore Capozziello","S. Capozziello, P. Martin-Moruno, C. Rubano","Physical non-equivalence of the Jordan and Einstein frames","7 pages, 3 figures","Phys.Lett.B689:117-121,2010","10.1016/j.physletb.2010.04.058",,"gr-qc astro-ph.CO hep-th","http://arxiv.org/licenses/nonexclusive-distrib/1.0/","  We show, considering a specific f(R)-gravity model, that the Jordan frame and
the Einstein frame are physically non-equivalent, although they are connected
by a conformal transformation which yields a mathematical equivalence. Since
all the calculations are performed analytically, this non-equivalence is shown
in an unambiguous way.
","[{""version"":""v1"",""created"":""Sun, 28 Mar 2010 19:39:37 GMT""},{""version"":""v2"",""created"":""Tue, 27 Apr 2010 14:37:43 GMT""}]","2010-05-25"
"1003.5395","Sung Chao","Sung-Po Chao, Guillaume Palacios","Non-equilibrium Transport in the Anderson model of a biased Quantum Dot:
  Scattering Bethe Ansatz Phenomenology","20 pages, 20 figures, published version","Phys Rev B83: 195314,2011","10.1103/PhysRevB.83.195314",,"cond-mat.str-el cond-mat.mes-hall","http://arxiv.org/licenses/nonexclusive-distrib/1.0/","  We derive the transport properties of a quantum dot subject to a source-drain
bias voltage at zero temperature and magnetic field. Using the Scattering Bethe
Anstaz, a generalization of the traditional Thermodynamic Bethe Ansatz to open
systems out of equilibrium, we derive exact results for the quantum dot
occupation out of equilibrium and, by introducing phenomenological spin- and
charge-fluctuation distribution functions in the computation of the current,
obtain the differential conductance for large U/\Gamma. The Hamiltonian to
describe the quantum dot system is the Anderson impurity Hamiltonian and the
current and dot occupation as a function of voltage are obtained numerically.
We also vary the gate voltage and study the transition from the mixed valence
to the Kondo regime in the presence of a non-equilibrium current. We conclude
with the difficulty we encounter in this model and possible way to solve them
without resorting to a phenomenological method.
","[{""version"":""v1"",""created"":""Sun, 28 Mar 2010 20:36:25 GMT""},{""version"":""v2"",""created"":""Tue, 13 Apr 2010 20:47:53 GMT""},{""version"":""v3"",""created"":""Wed, 18 May 2011 00:06:31 GMT""}]","2015-03-13"
"1003.5396","Carlos Alfonso Martin Ballon Bayona","C. A. Ballon Bayona, Cristine N. Ferreira, V. J. Vasquez Otoya","A conical deficit in the AdS4/CFT3 correspondence","v3, 14 pages. We reinterpret our results for the Green's functions in
  the cone","Class.Quant.Grav.28:015011,2011","10.1088/0264-9381/28/1/015011",,"hep-th gr-qc","http://arxiv.org/licenses/nonexclusive-distrib/1.0/","  Inspired by the AdS/CFT correspondence we propose a new duality that allow
the study of strongly coupled field theories living in a 2+1 conical
space-time. Solving the 4-d Einstein equations in the presence of an infinite
static string and negative cosmological constant we obtain a conical AdS4
space-time whose boundary is identified with the 2+1 cone found by Deser,
Jackiw and 't Hooft. Using the AdS4/CFT3 correspondence we calculate retarded
Green's functions of scalar operators living in the cone.
","[{""version"":""v1"",""created"":""Sun, 28 Mar 2010 21:36:38 GMT""},{""version"":""v2"",""created"":""Sun, 1 Aug 2010 21:52:22 GMT""},{""version"":""v3"",""created"":""Thu, 19 Aug 2010 00:51:14 GMT""}]","2010-12-15"
