"1003.5544","Christian P. Robert","Christian P. Robert","An attempt at reading Keynes' Treatise on Probability","Revised version, 18 pages, five pictures of Keynes",,,,"math.ST math.HO stat.TH","http://arxiv.org/licenses/nonexclusive-distrib/1.0/","  The book A Treatise on Probability was published by John Maynard Keynes in
1921. It contains a critical assessment of the foundations of probability and
of the current statistical methodology. As a modern reader, we review here the
aspects that are most related with statistics, avoiding a neophyte's
perspective on the philosophical issues. In particular, the book is quite
critical of the Bayesian approach and we examine the arguments provided by
Keynes, as well as the alternative he proposes. This review does not subsume
the scholarly study of Aldrich (2008a) relating Keynes with the statistics
community of the time.
","[{""version"":""v1"",""created"":""Mon, 29 Mar 2010 14:08:11 GMT""},{""version"":""v2"",""created"":""Tue, 6 Apr 2010 08:38:19 GMT""},{""version"":""v3"",""created"":""Sun, 17 Oct 2010 11:25:14 GMT""}]","2010-10-19"
"1003.5545","Shi-Jian Gu","Li-Gang Wang, Shi-Jian Gu, and Hai-Qing Lin","An optical example for classical Zeno effect","2 pages, 2 figures",,,,"quant-ph physics.optics","http://arxiv.org/licenses/nonexclusive-distrib/1.0/","  In this brief report, we present a proposal to observe the classical zeno
effect via the frequent measurement in optics.
","[{""version"":""v1"",""created"":""Mon, 29 Mar 2010 14:09:14 GMT""}]","2010-03-30"
"1003.5547","Donovan Young","Abhishek Agarwal, Donovan Young","SU(2|2) for Theories with Sixteen Supercharges at Weak and Strong
  Coupling","37 pages, 1 figure. v2 some minor improvements to the text, version
  to appear in Phys.Rev.D","Phys.Rev.D82:045024,2010","10.1103/PhysRevD.82.045024","HU-EP-10/15","hep-th","http://arxiv.org/licenses/nonexclusive-distrib/1.0/","  We consider the dimensional reductions of N=4 Supersymmetric Yang-Mills
theory on R x S^3 to the three-dimensional theory on R x S^2, the orbifolded
theory on R x S^3/Z_k, and the plane-wave matrix model. With explicit emphasis
on the three-dimensional theory, we demonstrate the realization of the SU(2|3)
algebra in a radial Hamiltonian framework. Using this structure we constrain
the form of the spin chains, their S-matrices, and the corresponding one- and
two-loop Hamiltonian of the three dimensional theory and find putative signs of
integrability up to the two-loop order. The string duals of these theories
admit the IIA plane-wave geometry as their Penrose limit. Using known results
for strings quantized on this background, we explicitly construct the
strong-coupling dual extended SU(2|2) algebra and discuss its implications for
the gauge theories.
","[{""version"":""v1"",""created"":""Mon, 29 Mar 2010 14:14:16 GMT""},{""version"":""v2"",""created"":""Wed, 28 Jul 2010 11:56:47 GMT""}]","2015-03-13"
"1003.5548","Emory F. Bunn","Haoxuan Zheng and Emory F. Bunn","Cosmic microwave background constraints on cosmological models with
  large-scale isotropy breaking","Accepted for publication in Phys. Rev. D","Phys.Rev.D82:063533,2010","10.1103/PhysRevD.82.063533",,"astro-ph.CO","http://arxiv.org/licenses/nonexclusive-distrib/1.0/","  Several anomalies appear to be present in the large-angle cosmic microwave
background (CMB) anisotropy maps of WMAP, including the alignment of
large-scale multipoles. Models in which isotropy is spontaneously broken (e.g.,
by a scalar field) have been proposed as explanations for these anomalies, as
have models in which a preferred direction is imposed during inflation. We
examine models inspired by these, in which isotropy is broken by a
multiplicative factor with dipole and/or quadrupole terms. We evaluate the
evidence provided by the multipole alignment using a Bayesian framework,
finding that the evidence in favor of the model is generally weak. We also
compute approximate changes in estimated cosmological parameters in the
broken-isotropy models. Only the overall normalization of the power spectrum is
modified significantly.
","[{""version"":""v1"",""created"":""Mon, 29 Mar 2010 14:15:28 GMT""},{""version"":""v2"",""created"":""Thu, 2 Sep 2010 21:36:45 GMT""}]","2015-03-13"
"1003.5549","Philip C. Gregory","Philip C. Gregory and Debra A. Fischer","A Bayesian Periodogram Finds Evidence for Three Planets in 47 Ursae
  Majoris",,"Mon. Not. R. Astron. Soc. 403, 731, 2010, The definitive version
  is available at www.blackwell-synergy.com","10.1111/j.1365-2966.2009.16233.x",,"astro-ph.EP","http://arxiv.org/licenses/nonexclusive-distrib/1.0/","  A Bayesian analysis of 47 Ursae Majoris (47 UMa) radial velocity data
confirms and refines the properties of two previously reported planets with
periods of 1079 and 2325 days and finds evidence for an additional long period
planet with a period of approximately 10000 days. The three planet model is
found to be 10^5 times more probable than the next most probable model which is
a two planet model. The nonlinear model fitting is accomplished with a new
hybrid Markov chain Monte Carlo (HMCMC) algorithm which incorporates parallel
tempering, simulated annealing and genetic crossover operations. Each of these
features facilitate the detection of a global minimum in chi-squared. By
combining all three, the HMCMC greatly increases the probability of realizing
this goal. When applied to the Kepler problem it acts as a powerful
multi-planet Kepler periodogram. The measured periods are 1078 \pm 2,
2391{+100}{-87}, and 14002{+4018}{-5095}d, and the corresponding eccentricities
are 0.032 \pm 0.014, 0.098{+.047}{-.096}, and 0.16{+.09}{-.16}. The results
favor low eccentricity orbits for all three. Assuming the three signals (each
one consistent with a Keplerian orbit) are caused by planets, the corresponding
limits on planetary mass (M sin i) and semi-major axis are (2.53{+.07}{-.06}MJ,
2.10\pm0.02au), (0.54\pm0.07MJ, 3.6\pm0.1au), and (1.6{+0.3}{-0.5}MJ,
11.6{+2.1}{-2.9}au), respectively. We have also characterized a noise induced
eccentricity bias and designed a correction filter that can be used as an
alternate prior for eccentricity, to enhance the detection of planetary orbits
of low or moderate eccentricity.
","[{""version"":""v1"",""created"":""Mon, 29 Mar 2010 14:15:44 GMT""}]","2015-05-18"
"1003.5550","Konstantine Zelator","Konstantine Zelator","Implementing the Law of Sines to solve SAS triangles","9 pages",,,,"math.GM","http://creativecommons.org/licenses/by/3.0/","  By ""solving a triangle"", one refers to determining the three sidelengths and
the three angles, based on given information.Depending on the specific
information, one or more triangles may satisfy the requirements of the given
information.In the SAS case, two of sidelengths are given, as well as the angle
contained by the two sides.According to Euclidean Geometry, such a triangle
must be unique. In reference [1], and pretty much in standard trigonometry and
precalculus texts,the Law of Cosines is employed in solving a SAS triangle. In
this work we use an alternative approach by using the Law of Cosines.In Section
2, we list some basic trigonometric identities and in Section 3 we prove a
lemma which is used in Section4. In Section4, we demonstrate the use of the Law
of Sines in solving an SAS triangle. In Section 5 we offer three examples in
detail; the last one being more general in nature.
","[{""version"":""v1"",""created"":""Mon, 29 Mar 2010 14:20:08 GMT""}]","2010-03-30"
"1003.5551","Conny Aerts","C. Aerts, K. Lefever, A. Baglin, P. Degroote, R. Oreiro, M. Vuckovic,
  K. Smolders, B. Acke, T. Verhoelst, M. Desmet, M. Godart, A. Noels, M.-A.
  Dupret, M. Auvergne, F. Baudin, C. Catala, E. Michel, R. Samadi","Periodic mass loss episodes due to an oscillation mode with variable
  amplitude in the hot supergiant HD50064","4 pages, accepted for publication in Astronomy & Astrophysics Letters",,"10.1051/0004-6361/201014124",,"astro-ph.SR","http://arxiv.org/licenses/nonexclusive-distrib/1.0/","  We aim to interpret the photometric and spectroscopic variability of the
luminous blue variable supergiant HD\,50064 ($V=8.21$).CoRoT space photometry
and follow-up high-resolution spectroscopy, with a time base of 137\,d and
169\,d, respectively, was gathered, analysed and interpreted using standard
time series analysis and light curve modelling methods as well as spectral line
diagnostics.The space photometry reveals one period of 37\,d, which undergoes a
sudden amplitude change with a factor 1.6. The pulsation period is confirmed in
the spectroscopy, which additionally reveals metal line radial velocity values
differing by $\sim 30\,$km\,s$^{-1}$ depending on the spectral line and on the
epoch. We estimate \teff$\sim$13\,500\,K, \logg$\sim$1.5 from the equivalent
width of Si lines. The Balmer lines reveal that the star undergoes episodes of
changing mass loss on a time scale similar to the changes in the photometric
and spectroscopic variability, with an average value of $\log\dot{\rm
M}\simeq-5$ (in M$_\odot$\,yr$^{-1}$). We tentatively interpret the 37\,d
period as due to a strange mode oscillation.
","[{""version"":""v1"",""created"":""Mon, 29 Mar 2010 14:21:35 GMT""},{""version"":""v2"",""created"":""Thu, 1 Apr 2010 19:24:18 GMT""}]","2015-05-18"
"1003.5552","Claudio Pisani","Claudio Pisani","A logic for categories","24 pages",,,,"math.CT","http://arxiv.org/licenses/nonexclusive-distrib/1.0/","  We present a doctrinal approach to category theory, obtained by abstracting
from the indexed inclusions (via discrete fibrations and opfibrations) of the
left and of the right actions of X in Cat in categories over X. Namely, a ""weak
temporal doctrine"" consists essentially of two indexed functors with the same
codomain, such that the induced functors have both left and right adjoints
satisfying some exactness conditions, in the spirit of categorical logic. The
derived logical rules include some adjunction-like laws, involving the
truth-values-enriched hom and tensor functors, which display a nice symmetry
and condense several basic categorical properties. The symmetry becomes more
apparent in the slightly stronger context of ""temporal doctrines"", which we
initially treat and which include as an instance the inclusion of lower and
upper sets in the parts of a poset, as well as the inclusion of left and right
actions of a graph in the graphs over it.
","[{""version"":""v1"",""created"":""Mon, 29 Mar 2010 14:27:11 GMT""}]","2010-03-30"
"1003.5553","Pau Amaro-Seoane","Pau Amaro-Seoane, Bernard Schutz, Nicolas Yunes","Gravitational Waves Notes, Issue #2 : ""A probe of spacetime and
  astrophysics: EMRIs""","118 pages",,,,"astro-ph.CO gr-qc","http://creativecommons.org/licenses/by/3.0/","  GW Notes was born from the need for a journal where the distinct communities
involved in gravitation wave research might gather. While these three
communities - Astrophysics, General Relativity and Data Analysis - have made
significant collaborative progress over recent years, we believe that it is
indispensable to future advancement that they draw closer, and that they speak
a common idiom. For this GW Notes issue we have approached Nicol\'as Yunes
(Princeton University) to extend in high detail his recent work on EMRI
waveforms for our highlight article.
","[{""version"":""v1"",""created"":""Mon, 29 Mar 2010 14:31:22 GMT""}]","2010-03-30"
"1003.5554","Osamu Yasuda","Haruna Oki and Osamu Yasuda","Sensitivity of T2KK to the non-standard interaction in propagation","29 pages, 25 figures, uses revtex4-1. Several places including typos
  revised. New references added","Phys.Rev.D82:073009,2010","10.1103/PhysRevD.82.073009",,"hep-ph","http://arxiv.org/licenses/nonexclusive-distrib/1.0/","  Assuming only the non-zero electron and tau neutrino components
$\epsilon_{ee}$, $\epsilon_{e\tau}$, $\epsilon_{\tau\tau}$ of the non-standard
matter effect and postulating the atmospheric neutrino constraint
$\epsilon_{\tau\tau}=|\epsilon_{e\tau}|^2/(1+\epsilon_{ee})$, we study the
sensitivity to the non-standard interaction in neutrino propagation of the T2KK
neutrino long-baseline experiment. It is shown that T2KK can constrain the
parameters $|\epsilon_{ee}|\lesssim 1$, $|\epsilon_{e\tau}|\lesssim 0.2$. It is
also shown that if $|\epsilon_{e\tau}|$ and $\theta_{13}$ are large, then T2KK
can determine the Dirac phase and the phase of $\epsilon_{e\tau}$ separately,
due to the information at the two baselines. We also provide an argument that
the components $|\epsilon_{\alpha\mu}|$ $(\alpha=e,\mu,\tau)$ must be small for
the disappearance oscillation probability to be consistent with high-energy
atmospheric neutrino data, which justifies our premise that these quantities
are negligible.
","[{""version"":""v1"",""created"":""Mon, 29 Mar 2010 14:43:16 GMT""},{""version"":""v2"",""created"":""Tue, 14 Sep 2010 20:11:43 GMT""}]","2015-03-13"
"1003.5555","Maxime Viallet","Maxime Viallet, Isabelle Baraffe, Cedric Mulet-Marquis, Emmanuel
  Leveque, Rolf Walder, Bernd Freytag, Christophe Winisdoerffer","Implicit hydrodynamic simulations of stellar interiors","To appear in the Proceedings of Astronum 2009, 4th Int. Conf. on
  Numerical Modeling of Space Plasma Flows (refereed paper)",,,,"astro-ph.SR astro-ph.IM","http://arxiv.org/licenses/nonexclusive-distrib/1.0/","  We report on the development of an implicit multi-D hydrodynamic code for
stellar evolution. We present two test-cases relevant for the first scientific
goal of the code: the simulation of convection in pulsating stars. First
results on a realistic stellar model are also presented.
","[{""version"":""v1"",""created"":""Mon, 29 Mar 2010 14:49:36 GMT""}]","2010-03-30"
"1003.5556","J. M. Speight","J.M. Speight","The volume of the space of holomorphic maps from S^2 to CP^k","11 pages","J.Geom.Phys.61:77-84,2011","10.1016/j.geomphys.2010.09.005",,"math-ph hep-th math.DG math.MP","http://arxiv.org/licenses/nonexclusive-distrib/1.0/","  Let $\Sigma$ be a compact Riemann surface and $\h_{d,k}(\Sigma)$ denote the
space of degree $d\geq 1$ holomorphic maps $\Sigma\ra \CP^k$. In theoretical
physics this arises as the moduli space of charge $d$ lumps (or instantons) in
the $\CP^k$ model on $\Sigma$. There is a natural Riemannian metric on this
moduli space, called the $L^2$ metric, whose geometry is conjectured to control
the low energy dynamics of $\CP^k$ lumps. In this paper an explicit formula for
the $L^2$ metric on of $\h_{d,k}(\Sigma)$ in the special case $d=1$ and
$\Sigma=S^2$ is computed. Essential use is made of the k\""ahler property of the
$L^2$ metric, and its invariance under a natural action of $G=U(k+1)\times
U(2)$. It is shown that {\em all} $G$-invariant k\""ahler metrics on
$\h_{1,k}(S^2)$ have finite volume for $k\geq 2$. The volume of $\h_{1,k}(S^2)$
with respect to the $L^2$ metric is computed explicitly and is shown to agree
with a general formula for $\h_{d,k}(\Sigma)$ recently conjectured by Baptista.
The area of a family of twice punctured spheres in $\h_{d,k}(\Sigma)$ is
computed exactly, and a formal argument is presented in support of Baptista's
formula for $\h_{d,k}(S^2)$ for all $d$, $k$, and $\h_{2,1}(T^2)$.
","[{""version"":""v1"",""created"":""Mon, 29 Mar 2010 14:50:17 GMT""}]","2010-11-23"
"1003.5557","Tobias Reichenbach","Tobias Reichenbach, A. J. Hudspeth","A ratchet mechanism for amplification in low-frequency mammalian hearing","6 pages, 4 figures, plus Supplementary Information. Animation
  available on the PNAS website (http://dx.doi.org/10.1073/pnas.0914345107).","Proc. Natl. Acad. Sci. U.S.A. 107, 4973-4978 (2010)","10.1073/pnas.0914345107",,"q-bio.NC physics.bio-ph","http://arxiv.org/licenses/nonexclusive-distrib/1.0/","  The sensitivity and frequency selectivity of hearing result from tuned
amplification by an active process in the mechanoreceptive hair cells. In most
vertebrates the active process stems from the active motility of hair bundles.
The mammalian cochlea exhibits an additional form of mechanical activity termed
electromotility: its outer hair cells (OHCs) change length upon electrical
stimulation. The relative contributions of these two mechanisms to the active
process in the mammalian inner ear is the subject of intense current debate.
Here we show that active hair-bundle motility and electromotility can together
implement an efficient mechanism for amplification that functions like a
ratchet: sound-evoked forces acting on the basilar membrane are transmitted to
the hair bundles whereas electromotility decouples active hair-bundle forces
from the basilar membrane. This unidirectional coupling can extend the hearing
range well below the resonant frequency of the basilar membrane. It thereby
provides a concept for low-frequency hearing that accounts for a variety of
unexplained experimental observations from the cochlear apex, including the
shape and phase behavior of apical tuning curves, their lack of significant
nonlinearities, and the shape changes of threshold tuning curves of auditory
nerve fibers along the cochlea. The ratchet mechanism constitutes a general
design principle for implementing mechanical amplification in engineering
applications.
","[{""version"":""v1"",""created"":""Mon, 29 Mar 2010 14:51:39 GMT""}]","2010-03-30"
"1003.5558","J.M.D. Coey","J.M.D. Coey, P. Stamenov, R. D. Gunning, M. Venkatesan, K. Paul","Ferromagnetism in defect-ridden oxides and related materials","22 pages, 6 figures","New Journal of Physics, Vol.12 (2010)","10.1088/1367-2630/12/5/053025",,"cond-mat.mtrl-sci cond-mat.other","http://arxiv.org/licenses/nonexclusive-distrib/1.0/","  The existence of high-temperature ferromagnetism in thin films and
nanoparticles of oxides containing small quantities of magnetic dopants remains
controversial. Some regard these materials as dilute magnetic semiconductors,
while others think they are ferromagnetic only because the magnetic dopants
form secondary ferromagnetic impurity phases such as cobalt metal or magnetite.
There are also reports in d0 systems and other defective oxides that contain no
magnetic ions. Here, we investigate TiO2 (rutile) containing 1 - 5% of iron
cations and find that the room-temperature ferromagnetism of films prepared by
pulsed-laser deposition is not due to magnetic ordering of the iron. The films
are neither dilute magnetic semiconductors nor hosts to an iron-based
ferromagnetic impurity phase. A new model is developed for defect-related
ferromagnetism which involves a spin-split defect band populated by charge
transfer from a proximate charge reservoir in the present case a mixture Fe2+
and Fe3+ ions in the oxide lattice. The phase diagram for the model shows how
inhomogeneous Stoner ferromagnetism depends on the total number of electrons
Ntot, the Stoner exchange integral I and the defect bandwidth W; the band
occupancy is governed by the d-d Coulomb interaction U. There are regions of
ferromagnetic metal, half-metal and insulator as well as nonmagnetic metal and
insulator. A characteristic feature of the high-temperature Stoner magnetism is
an an anhysteretic magnetization curve which is practically temperature
independent below room temperature. This is related to a wandering
ferromagnetic axis which is determined by local dipole fields. The
magnetization is limited by the defect concentration, not by the 3d doping.
Only 1-2 % of the volume of the films is magnetically ordered.
","[{""version"":""v1"",""created"":""Mon, 29 Mar 2010 14:52:52 GMT""}]","2015-05-18"
"1003.5559","Luc Fruchter","L. Fruchter, V. Jovanovic, H. Raffy, Sid Labdi, F. Bouquet and Z.Z. Li","Penetration depth of electron-doped-infinite-layer
  Sr$_{0.88}$La$_{0.12}$CuO$_{2+x}$ thin films",,"Phys. Rev. B 82, 144529 (2010)","10.1103/PhysRevB.82.144529",,"cond-mat.supr-con","http://arxiv.org/licenses/nonexclusive-distrib/1.0/","  The in-plane penetration depth of Sr$_{0.88}$La$_{0.12}$CuO$_{2+x}$ thin
films at various doping obtained from oxygen reduction has been measured, using
AC susceptibility measurements. For the higher doping samples, the superfluid
density deviates strongly from the s-wave behavior, suggesting, in analogy with
other electron-doped cuprates, a contribution from a nodal hole pocket, or a
small gap on the Fermi surface such as an anisotropic s-wave order parameter.
The low value of the superfluid densities, likely due to a strong
doping-induced disorder, places the superconducting transition of our samples
in the phase-fluctuation regime.
","[{""version"":""v1"",""created"":""Mon, 29 Mar 2010 15:00:27 GMT""},{""version"":""v2"",""created"":""Fri, 4 Jun 2010 08:25:01 GMT""},{""version"":""v3"",""created"":""Fri, 24 Sep 2010 13:53:54 GMT""}]","2011-02-04"
"1003.5560","Ewa L. Lokas","Ewa L. Lokas, Stelios Kazantzidis, Jaroslaw Klimentowski and Lucio
  Mayer","Biases in mass estimates of dSph galaxies","5 pages, 3 figures, contribution to the proceedings of ""Hunting for
  the Dark: The Hidden Side of Galaxy Formation"", Malta, 19-23 Oct. 2009, eds.
  V.P. Debattista & C.C. Popescu, AIP Conference Series, in press","AIP Conference Proceedings, Volume 1240, pp. 363-366 (2010)","10.1063/1.3458535",,"astro-ph.CO","http://arxiv.org/licenses/nonexclusive-distrib/1.0/","  Using a high resolution N-body simulation of a two-component dwarf galaxy
orbiting in the potential of the Milky Way, we study two effects that lead to
significant biases in mass estimates of dwarf spheroidal galaxies. Both are due
to the strong tidal interaction of initially disky dwarfs with their host. The
tidal stripping of dwarf stars leads to the formation of strong tidal tails
that are typically aligned with the line of sight of an observer positioned
close to the host center. The stars from the tails contaminate the kinematic
samples leading to a velocity dispersion profile increasing with the projected
radius and resulting in an overestimate of mass. The tidal stirring of the
dwarf leads to the morphological transformation of the initial stellar disk
into a bar and then a spheroid. The distribution of stars in the dwarf remains
non-spherical for a long time leading to an overestimate of its mass if it is
observed along the major axis and an underestimate if it seen in the
perpendicular direction.
","[{""version"":""v1"",""created"":""Mon, 29 Mar 2010 15:00:27 GMT""}]","2015-05-18"
"1003.5561","Aaron Abrams","Aaron Abrams, Eric Babson, Henry Landau, Zeph Landau, and James
  Pommersheim","Distributions of order patterns of interval maps","20 pages, 3 figures",,,,"math.CO math.DS","http://arxiv.org/licenses/nonexclusive-distrib/1.0/","  A permutation $\sigma$ describing the relative orders of the first $n$
iterates of a point $x$ under a self-map $f$ of the interval $I=[0,1]$ is
called an \emph{order pattern}. For fixed $f$ and $n$, measuring the points
$x\in I$ (according to Lebesgue measure) that generate the order pattern
$\sigma$ gives a probability distribution $\mu_n(f)$ on the set of length $n$
permutations. We study the distributions that arise this way for various
classes of functions $f$.
  Our main results treat the class of measure preserving functions. We obtain
an exact description of the set of realizable distributions in this case: for
each $n$ this set is a union of open faces of the polytope of flows on a
certain digraph, and a simple combinatorial criterion determines which faces
are included. We also show that for general $f$, apart from an obvious
compatibility condition, there is no restriction on the sequence $\{\mu_n(f)\}$
for $n=1,2,...$.
  In addition, we give a necessary condition for $f$ to have \emph{finite
exclusion type}, i.e., for there to be finitely many order patterns that
generate all order patterns not realized by $f$. Using entropy we show that if
$f$ is piecewise continuous, piecewise monotone, and either ergodic or with
points of arbitrarily high period, then $f$ cannot have finite exclusion type.
This generalizes results of S. Elizalde.
","[{""version"":""v1"",""created"":""Mon, 29 Mar 2010 15:01:53 GMT""}]","2010-03-30"
"1003.5562","Peter Christian Schneider","P. C. Schneider and J. H. M. M. Schmitt","X-raying the AU Microscopii debris disk","11 pages, 10 figures, accepted for publication in A&A",,"10.1051/0004-6361/201014038",,"astro-ph.SR","http://arxiv.org/licenses/nonexclusive-distrib/1.0/","  AU Mic is a young, nearby X-ray active M-dwarf with an edge-on debris disk.
Debris disk are the successors of the gaseous disks usually surrounding
pre-main sequence stars which form after the first few Myrs of their host
stars' lifetime, when - presumably - also the planet formation takes place.
Since X-ray transmission spectroscopy is sensitive to the chemical composition
of the absorber, features in the stellar spectrum of AU Mic caused by its
debris disk can in principle be detected. The upper limits we derive from our
high resolution Chandra LETGS X-ray spectroscopy are on the same order as those
from UV absorption measurements, consistent with the idea that AU Mic's debris
disk possesses an inner hole with only a very low density of sub-micron sized
grains or gas.
","[{""version"":""v1"",""created"":""Mon, 29 Mar 2010 15:04:58 GMT""}]","2015-05-18"
