"1003.5421","Zouhair Mouayn","Zouhair Mouayn","Coherent state transforms attached to generalized Bargmann spaces on the
  complex plane","Submitted, 7 pages",,,,"math-ph math.MP","http://arxiv.org/licenses/nonexclusive-distrib/1.0/","  We construct a family of coherent states transforms attached to generalized
Bargmann spaces [C.R. Acad.Sci.Paris, t.325,1997] in the complex plane. This
constitutes another way of obtaining the kernel of an isometric operator
linking the space of square integrable functions on the real line with the
true-poly-Fock spaces [Oper.Theory. Adv.Appl.,v.117,2000].
","[{""version"":""v1"",""created"":""Mon, 29 Mar 2010 04:45:17 GMT""}]","2010-03-30"
"1003.5422","Fredrick Michael","Fredrick Michael","Nonlinear Bloch-Torrey Equation","7 pages, no figures",,,,"cond-mat.stat-mech","http://arxiv.org/licenses/nonexclusive-distrib/1.0/","  Recently, there has been an examination of the nonexponential relaxation
profiles of the NMR signal. The exponential relaxation from Bloch-Torrey
equations with constant diffusion coefficients are known to be an
approximation, and research has been in areas that would reproduce
non-exponential relaxation. These would be from statistical models,
phenomenological models, and microscopic models including a recent fractional
derivative approach. In this letter we derive a nonlinear Bloch-Torrey partial
differential equation that has equivalently a non-constant diffusion
coefficient and a linear probability and for which the solution is of a
q-parametrized power-law distribution of the nonextensive Tsallis statistics.
","[{""version"":""v1"",""created"":""Mon, 29 Mar 2010 04:51:05 GMT""}]","2010-03-30"
"1003.5423","Robert Brout","Robert Brout","Of Inflation and the Inflaton","14 pages",,,,"gr-qc hep-th","http://arxiv.org/licenses/nonexclusive-distrib/1.0/","  Due to intra-field gravitational interactions, field configurations have a
strong negative component to their energy density at the planckian and
transplanckian scales, conceivably resulting in a sequestration of the
transplanckian field degrees of freedom. Quantum fluctuations then allow these
to tunnel into cisplanckian configurations to seed inflation and conventional
observed physics: propagating modes of QFT in a geometry which responds to the
existence of these new modes through the energy constraint of general
relativity, H^2 = \rho/3. That this tunnelling results in geometries and field
configurations that are homogeneous allows for an estimate of the mass of the
inflaton, m=O(10^{-6}), and the amplitude of the inflaton condensate,
\phiav=O(10), both consistent with phenomenology.
","[{""version"":""v1"",""created"":""Mon, 29 Mar 2010 05:12:19 GMT""}]","2010-03-30"
"1003.5424","Hal Tasaki","Hal Tasaki","The approach to thermal equilibrium and ""thermodynamic normality"" --- An
  observation based on the works by Goldstein, Lebowitz, Mastrodonato, Tumulka,
  and Zanghi in 2009, and by von Neumann in 1929","27 pages, 2 figures. The version 3 is a major revision (even the
  title has been changed). A new example has been added. We now call the main
  notion ""thermodynamic normality"", and some discussions have been added. Minor
  changes in v.4.",,,,"quant-ph cond-mat.stat-mech math-ph math.MP","http://arxiv.org/licenses/nonexclusive-distrib/1.0/","  We treat the problem of the approach to thermal equilibrium by only resorting
to quantum dynamics of an isolated macroscopic system. Inspired by the two
important works in 2009 and in 1929, we have noted that a condition we call
""thermodynamic normality"" for a macroscopic observable guarantees the approach
to equilibrium (in the sense that a measurement of the observable at time $t$
almost certainly yields a result close to the corresponding microcanonical
average for a sufficiently long and typical $t$). A crucial point is that we
make no assumptions on the initial state of the system, except that its energy
is distributed close to a certain macroscopic value. We also present three
(rather artificial) models in which the thermodynamic normality can be
established, thus providing concrete examples in which the approach to
equilibrium is rigorously justified. Note that this kind of results which hold
for ANY initial state are never possible in classical systems. We are thus
dealing with a mechanism which is peculiar to quantum systems. The present note
is written in a self-contained (and hopefully readable) manner. It only
requires basic knowledge in quantum physics and equilibrium statistical
mechanics.
","[{""version"":""v1"",""created"":""Mon, 29 Mar 2010 05:16:25 GMT""},{""version"":""v2"",""created"":""Tue, 30 Mar 2010 02:42:28 GMT""},{""version"":""v3"",""created"":""Sun, 2 May 2010 08:53:16 GMT""},{""version"":""v4"",""created"":""Sat, 8 May 2010 09:22:38 GMT""}]","2015-03-13"
"1003.5425","Yan-Mei Chen","Yan-Mei Chen, Christy A. Tremonti, Timothy M. Heckman, Guinevere
  Kauffmann, Benjamin J. Weiner, Jarle Brinchmann, Jing Wang","Absorption-line probes of the prevalence and properties of outflows in
  present-day star-forming galaxies","18 pages, 18 figures, accepted by AJ","The Astronomical Journal 140 (2010) 445-461","10.1088/0004-6256/140/2/445",,"astro-ph.GA","http://arxiv.org/licenses/nonexclusive-distrib/1.0/","  We analyze star forming galaxies drawn from SDSS DR7 to show how the
interstellar medium (ISM) Na I 5890, 5896 (Na D) absorption lines depend on
galaxy physical properties, and to look for evidence of galactic winds. We
combine the spectra of galaxies with similar geometry/physical parameters to
create composite spectra with signal-to-noise ~300. The stellar continuum is
modeled using stellar population synthesis models, and the continuum-normalized
spectrum is fit with two Na I absorption components. We find that: (1) ISM Na D
absorption lines with equivalent widths EW > 0.8A are only prevalent in disk
galaxies with specific properties -- large extinction (Av), high star formation
rates (SFR), high star formation rate per unit area ($\Sigma_{\rm SFR}$), or
high stellar mass (M*). (2) the ISM Na D absorption lines can be separated into
two components: a quiescent disk-like component at the galaxy systemic velocity
and an outflow component; (3) the disk-like component is much stronger in the
edge-on systems, and the outflow component covers a wide angle but is stronger
within 60deg of the disk rotation axis; (4) the EW and covering factor of the
disk component correlate strongly with dust attenuation, highlighting the
importance that dust shielding may play the survival of Na I. (5) The EW of the
outflow component depends primarily on $\Sigma_{\rm SFR}$ and secondarily on
Av; (6) the outflow velocity varies from ~120 to 160km/s but shows little hint
of a correlation with galaxy physical properties over the modest dynamic range
that our sample probes (1.2 dex in log$\Sigma_{\rm SFR}$ and 1 dex in log M*).
","[{""version"":""v1"",""created"":""Mon, 29 Mar 2010 05:50:54 GMT""},{""version"":""v2"",""created"":""Sat, 26 Jun 2010 12:57:16 GMT""}]","2015-05-18"
"1003.5426","Louis H. Kauffman","Louis H. Kauffman and Samuel J. Lomonaco Jr","Quantum Algorithms for the Jones Polynomial","11 pages, 4 figures, LaTeX document",,"10.1117/12.849753",,"math.GT","http://arxiv.org/licenses/nonexclusive-distrib/1.0/","  This paper gives a generalization of the AJL algorithm and unitary braid
group representation for quantum computation of the Jones polynomial to
continuous ranges of values on the unit circle of the Jones parameter. We show
that our 3-strand algorithm for the Jones polynomial is a special case of this
generalization of the AJL algorithm. The present paper uses diagrammatic
techniques to prove these results. The techniques of this paper have been used
and will be used in the future in work with R. Marx, A. Fahmy, L. H. Kauffman,
S. J. Lomonaco Jr.,A. Sporl, N. Pomplun, T. Schulte Herbruggen, J. M. Meyers,
and S. J. Glaser on NMR quantum computation of the Jones polynomial.
","[{""version"":""v1"",""created"":""Mon, 29 Mar 2010 05:51:59 GMT""}]","2015-05-18"
"1003.5427","Jan Harloff-Puhr","Jan Harloff","In-situ quantitative measurement of electric fields in zinc oxide thin
  films using electrostatic force microscopy","90 pages, 47 figures, master's thesis, University of Pennsylvania,
  School of Engineering and Applied Science, 1995",,,,"cond-mat.mtrl-sci","http://arxiv.org/licenses/nonexclusive-distrib/1.0/","  Zinc oxide (ZnO) is the most important material for the fabrication of modern
varistors (variable resistors). It is known that the highly nonlinear
current-voltage relationship of ZnO varistors is due to effects taking place at
the grain boundaries. For an accurate investigation of the mechanism of this
process, techniques are required that allow a direct observation of local
electric fields in varistor samples. The objective of this study is to show
that an atomic force microscope in a set-up as an electrostatic force
microscope is capable of the in-situ observation and measurement of an applied
electric field in samples of ZnO thin films. The technique of Surface Potential
Imaging was used to investigate laterally applied electric fields in this type
of sample for the first time. The local change of the electric field across the
samples was monitored and quantified. It was observed here that the morphology
of the surface is convoluted into the surface potential images and the
magnitude of this effect was quantified by taking surface potential images
without an applied electric field. For the given measurement conditions, a
height difference of 80 nm in the topography image resulted in a voltage
difference of roughly 66 mV in the surface potential image. A simple model was
provided that attributes this observation to the surroundings of the surface
atom closest to the imaging tip.
","[{""version"":""v1"",""created"":""Mon, 29 Mar 2010 06:06:01 GMT""}]","2010-03-30"
"1003.5428","Kyuwook Ihm","Kyuwook Ihm, Kyung-jae Lee, Jong Tae Lim, Jae Wook Kwon, Tai-Hee Kang,
  Sukmin Chung, Sukang Bae, Jin Ho Kim, Byung Hee Hong, Geun Young Yeom","High Open-circuit Voltage of Graphene-Based Photovoltaic Cells Modulated
  by Layer-by-Layer Transfer",,,,,"cond-mat.mtrl-sci","http://arxiv.org/licenses/nonexclusive-distrib/1.0/","  Graphene has shown great application opportunities in future nanoelectronic
devices due to its outstanding electronic properties. Moreover, its impressive
optical properties have been attracting the interest of researchers, and,
recently, the photovoltaic effects of a heterojunction structure embedded with
few layer graphene (FLG) have been demonstrated. Here, we report the
photovoltaic response of graphene-semiconductor junctions and the controlled
open-circuit voltage (Voc) with varying numbers of graphene layers. After
unavoidably adsorbed contaminants were removed from the FLGs, by means of in
situ annealing, prepared by layer-by-layer transfer of the chemically grown
graphene layer, the work functions of FLGs showed a sequential increase as the
graphene layers increase, despite of random interlayer-stacking, resulting in
the modulation of photovoltaic behaviors of FLGs/Si interfaces. The surface
photovoltaic effects observed here show an electronic realignment in the depth
direction in the FLG heterojunction systems, indicating future potential toward
solar devices utilizing the excellent transparency and flexibility of FLG.
","[{""version"":""v1"",""created"":""Mon, 29 Mar 2010 06:12:17 GMT""}]","2010-03-30"
"1003.5429","Secretary Aircc Journal","Andreea Ancuta Onofrei (1), Yacine Rebahi (1) and Thomas Magedanz (1),
  (1) Fokus Fraunhofer Institute, Germany","Preventing Distributed Denial-of-Service Attacks on the IMS Emergency
  Services Support through Adaptive Firewall Pinholing","17 Pages, IJNGN Journal","International Journal of Next-Generation Networks 2.1 (2010) 1-17","10.5121/ijngn.2010.2101",,"cs.NI cs.CR","http://creativecommons.org/licenses/by-nc-sa/3.0/","  Emergency services are vital services that Next Generation Networks (NGNs)
have to provide. As the IP Multimedia Subsystem (IMS) is in the heart of NGNs,
3GPP has carried the burden of specifying a standardized IMS-based emergency
services framework. Unfortunately, like any other IP-based standards, the
IMS-based emergency service framework is prone to Distributed Denial of Service
(DDoS) attacks. We propose in this work, a simple but efficient solution that
can prevent certain types of such attacks by creating firewall pinholes that
regular clients will surely be able to pass in contrast to the attackers
clients. Our solution was implemented, tested in an appropriate testbed, and
its efficiency was proven.
","[{""version"":""v1"",""created"":""Mon, 29 Mar 2010 06:21:49 GMT""}]","2010-07-15"
"1003.5430","Giuseppe Carlo Tettamanzi Dr","G. C. Tettamanzi, C. I. Pakes, A. Potenza, S. Rubanov, C. H. Marrows,
  S. Prawer","Superconducting transition in Nb nanowires fabricated using focused ion
  beam","13 pages, 3 images, 1 table","Nanotechnology 20 (2009) 465302","10.1088/0957-4484/20/46/465302",,"cond-mat.mes-hall","http://arxiv.org/licenses/nonexclusive-distrib/1.0/","  Making use of focused Ga-ion beam (FIB) fabrication technology, the evolution
with device dimension of the low-temperature electrical properties of Nb
nanowires has been examined in a regime where crossover from Josephson-like to
insulating behaviour is evident. Resistance-temperature data for devices with a
physical width of order 100 nm demonstrate suppression of superconductivity,
leading to dissipative behaviour that is shown to be consistent with the
activation of phase-slip below Tc. This study suggests that by exploiting the
Ga-impurity poisoning introduced by the FIB into the periphery of the nanowire,
a central superconducting phase-slip nanowire with sub-10 nm dimensions may be
engineered within the core of the nanowire.
","[{""version"":""v1"",""created"":""Mon, 29 Mar 2010 06:22:23 GMT""}]","2010-03-30"
"1003.5431","Secretary Aircc Journal","Siva Rama Krishnan Somayaji (1), Ch.A.S Murty (2), ((1)VIT University,
  India, (2)C-DAC, Hyderabad, India)","Securing Internet Protocol (IP) Storage: A Case Study","10 Pages, IJNGN Journal","International Journal of Next-Generation Networks 2.1 (2010) 19-28","10.5121/ijngn.2010.2102",,"cs.NI","http://creativecommons.org/licenses/by-nc-sa/3.0/","  Storage networking technology has enjoyed strong growth in recent years, but
security concerns and threats facing networked data have grown equally fast.
Today, there are many potential threats that are targeted at storage networks,
including data modification, destruction and theft, DoS attacks, malware,
hardware theft and unauthorized access, among others. In order for a Storage
Area Network (SAN) to be secure, each of these threats must be individually
addressed. In this paper, we present a comparative study by implementing
different security methods in IP Storage network.
","[{""version"":""v1"",""created"":""Mon, 29 Mar 2010 06:29:21 GMT""}]","2010-07-15"
"1003.5432","Secretary Aircc Journal","Sanjay Kumar Pal (1) and Samar Sen Sarma (2), ((1)NSHM College of
  Management & Technology, India, (2) University of Calcutta, India)","Computer Network Topology Design in Limelight of Pascal Graph Property","6 Pages, IJNGN Journal","International Journal of Next-Generation Networks 2.1 (2010) 30-35","10.5121/ijngn.2010.2103",,"cs.NI","http://creativecommons.org/licenses/by-nc-sa/3.0/","  Constantly growing demands of high productivity and security of computer
systems and computer networks call the interest of specialists in the
environment of construction of optimum topologies of computer mediums. In
earliest phases of design, the study of the topological influence of the
processes that happen in computer systems and computer networks allows to
obtain useful information which possesses a significant value in the subsequent
design. It has always been tried to represent the different computer network
topologies using appropriate graph models. Graphs have huge contributions
towards the performance improvement factor of a network. Some major
contributors are de-Bruijn, Hypercube, Mesh and Pascal. They had been studied a
lot and different new features were always a part of research outcome. As per
the definition of interconnection network it is equivalent that a suitable
graph can represent the physical and logical layout very efficiently. In this
present study Pascal graph is researched again and a new characteristics has
been discovered. From the perspective of network topologies Pascal graph and
its properties were first studied more than two decades back. Since then, a
numerous graph models have emerged with potentials to be used as network
topologies. This new property is guaranteed to make an everlasting mark towards
the reliability of this graph to be used as a substantial contributor as a
computer network topology. This shows its credentials over so many other
topologies. This study reviews the characteristics of the Pascal graph and the
new property is established using appropriate algorithm and the results.
","[{""version"":""v1"",""created"":""Mon, 29 Mar 2010 06:32:17 GMT""}]","2010-07-15"
"1003.5433","D. B. Gutman","D. B. Gutman, Yuval Gefen, and A. D. Mirlin","Full counting statistics of Luttinger liquid conductor","5 pages, 2 figures","Phys. Rev. Lett. 105, 256802 (2010)","10.1103/PhysRevLett.105.256802",,"cond-mat.str-el","http://arxiv.org/licenses/nonexclusive-distrib/1.0/","  Non-equilibrium bosonization technique is used to study current fluctuations
of interacting electrons in a single-channel quantum wire representing a
Luttinger liquid (LL) conductor. An exact expression for the full counting
statistics of the transmitted charge is derived. It is given by Fredholm
determinant of the counting operator with a time dependent scattering phase.
The result has a form of counting statistics of non-interacting particles with
fractional charges, induced by scattering off the boundaries between the LL
wire and the non-interacting leads.
","[{""version"":""v1"",""created"":""Mon, 29 Mar 2010 06:46:36 GMT""}]","2010-12-14"
"1003.5434","Giuseppe Carlo Tettamanzi Dr","G. C. Tettamanzi and A. Potenza and S. Rubanov and C. H. Marrows and
  S. Prawer","Reply on the comment on the paper ""Superconducting transition in Nb
  nanowires fabricated using focused ion beam""","3 pages, 1 figure, accepted by Nanotechnology",,"10.1088/0957-4484/21/16/168002",,"cond-mat.mes-hall","http://arxiv.org/licenses/nonexclusive-distrib/1.0/","  In this communication we present our response to the recent comment of A.
Engel regarding our paper on FIB- fabricated Nb nanowires (see Vol. 20 (2009)
Pag. 465302). After further analysis and additional experimental evidence, we
conclude that our interpretation of the experimental results in light of QPS
theory is still valid when compared with the alternative proximity-based model
as proposed by A. Engel.
","[{""version"":""v1"",""created"":""Mon, 29 Mar 2010 06:46:40 GMT""}]","2015-05-18"
"1003.5435","Secretary Aircc Journal","Kilari Veera Swamy (1), B.Chandra Mohan (2), Y.V.Bhaskar Reddy (3) and
  S.Srinivas Kumar (4) ((1) QISCET, Ongole, India, (2) BEC, Bapatla, India, (3)
  QISCET, Ongole, India and (4) JNTU, Kakinada, India)","Image Compression and Watermarking scheme using Scalar Quantization","11 Pages, IJNGN Journal 2010","International Journal of Next-Generation Networks 2.1 (2010) 37-47","10.5121/ijngn.2010.2104",,"cs.CV cs.MM","http://creativecommons.org/licenses/by-nc-sa/3.0/","  This paper presents a new compression technique and image watermarking
algorithm based on Contourlet Transform (CT). For image compression, an energy
based quantization is used. Scalar quantization is explored for image
watermarking. Double filter bank structure is used in CT. The Laplacian Pyramid
(LP) is used to capture the point discontinuities, and then followed by a
Directional Filter Bank (DFB) to link point discontinuities. The coefficients
of down sampled low pass version of LP decomposed image are re-ordered in a
pre-determined manner and prediction algorithm is used to reduce entropy
(bits/pixel). In addition, the coefficients of CT are quantized based on the
energy in the particular band. The superiority of proposed algorithm to JPEG is
observed in terms of reduced blocking artifacts. The results are also compared
with wavelet transform (WT). Superiority of CT to WT is observed when the image
contains more contours. The watermark image is embedded in the low pass image
of contourlet decomposition. The watermark can be extracted with minimum error.
In terms of PSNR, the visual quality of the watermarked image is exceptional.
The proposed algorithm is robust to many image attacks and suitable for
copyright protection applications.
","[{""version"":""v1"",""created"":""Mon, 29 Mar 2010 06:51:17 GMT""}]","2010-07-15"
"1003.5436","Giuseppe Carlo Tettamanzi Dr","Giuseppe C. Tettamanzi and Christopher I. Pakes and Simon K. H. Lam
  and Steven Prawer","Flux noise in ion-implanted nanoSQUIDs","16 pages, 6 figures, 1 table","Supercond. Sci. Technol. 22 (2009) 064006","10.1088/0953-2048/22/6/064006",,"cond-mat.supr-con","http://arxiv.org/licenses/nonexclusive-distrib/1.0/","  Focused ion beam (FIB) technology has been used to fabricate miniature Nb DC
SQUIDs which incorporate resistively-shunted microbridge junctions and a
central loop with a hole diameter ranging from 1058 nm to 50 nm. The smallest
device, with a 50 nm hole diameter, has a white flux noise level of 2.6
microphy_{0}/Hz^{0.5} at 10^{4} Hz. The scaling of the flux noise properties
and focusing effect of the SQUID with the hole size were examined. The observed
low-frequency flux noise of different devices were compared with the
contribution due to the spin fluctuation of defects during FIB processing and
the thermally activated flux hopping in the SQUID washer.
","[{""version"":""v1"",""created"":""Mon, 29 Mar 2010 06:55:26 GMT""}]","2010-03-30"
"1003.5437","Secretary Aircc Journal","K.Prasanth (1), Dr.K.Duraiswamy (2), K.Jayasudha (3) and
  Dr.C.Chandrasekar (4), ((1) K.S.Rangasamy College of Technology, India, (2)
  K.S.Rangasamy College of Technology, India, (3) K.S.R College of Engineering,
  India, (4) Periyar University, India)","Improved Packet Forwarding Approach in Vehicular Ad Hoc Networks Using
  RDGR Algorithm","14 Pages, IJNGN Journal","International Journal of Next-Generation Networks 2.1 (2010) 64-77","10.5121/ijngn.2010.2106",,"cs.NI","http://creativecommons.org/licenses/by-nc-sa/3.0/","  VANETs (Vehicular Ad hoc Networks) are highly mobile wireless ad hoc networks
and will play an important role in public safety communications and commercial
applications. Routing of data in VANETs is a challenging task due to rapidly
changing topology and high speed mobility of vehicles. Position based routing
protocols are becoming popular due to advancement and availability of GPS
devices. One of the critical issues of VANETs are frequent path disruptions
caused by high speed mobility of vehicle that leads to broken links which
results in low throughput and high overhead . This paper argues the use of
information on vehicles' movement information (e.g., position, direction, speed
of vehicles) to predict a possible link-breakage event prior to its occurrence.
So in this paper we propose a Reliable Directional Greedy routing (RDGR), a
reliable position based routing approach which obtains position, speed and
direction of its neighboring nodes from GPS. This approach incorporates
potential score based strategy, which calculates link stability between
neighbor nodes in distributed fashion for reliable forwarding of data packet.
","[{""version"":""v1"",""created"":""Mon, 29 Mar 2010 06:55:33 GMT""}]","2010-07-15"
"1003.5438","Secretary Aircc Journal","Ye Ouyang and M. Hosein Fallah, (Stevens Institute of Technology, USA)","A Performance Analysis for UMTS Packet Switched Network Based on
  Multivariate KPIS","15 Pages, IJNGN Journal","International Journal of Next-Generation Networks 2.1 (2010) 79-92","10.5121/ijngn.2010.2107",,"cs.NI","http://creativecommons.org/licenses/by-nc-sa/3.0/","  Mobile data services are penetrating mobile markets rapidly. The mobile
industry relies heavily on data service to replace the traditional voice
services with the evolution of the wireless technology and market. A reliable
packet service network is critical to the mobile operators to maintain their
core competence in data service market. Furthermore, mobile operators need to
develop effective operational models to manage the varying mix of voice, data
and video traffic on a single network. Application of statistical models could
prove to be an effective approach. This paper first introduces the architecture
of Universal Mobile Telecommunications System (UMTS) packet switched (PS)
network and then applies multivariate statistical analysis to Key Performance
Indicators (KPI) monitored from network entities in UMTS PS network to guide
the long term capacity planning for the network. The approach proposed in this
paper could be helpful to mobile operators in operating and maintaining their
3G packet switched networks for the long run.
","[{""version"":""v1"",""created"":""Mon, 29 Mar 2010 06:59:40 GMT""}]","2010-07-15"
