"1011.5567","Eran Omri","Amos Beimel, Eran Omri, and Ilan Orlov","Secure Multiparty Computation with Partial Fairness",,,,,"cs.CR","http://arxiv.org/licenses/nonexclusive-distrib/1.0/","  A protocol for computing a functionality is secure if an adversary in this
protocol cannot cause more harm than in an ideal computation where parties give
their inputs to a trusted party which returns the output of the functionality
to all parties. In particular, in the ideal model such computation is fair --
all parties get the output. Cleve (STOC 1986) proved that, in general, fairness
is not possible without an honest majority. To overcome this impossibility,
Gordon and Katz (Eurocrypt 2010) suggested a relaxed definition -- 1/p-secure
computation -- which guarantees partial fairness. For two parties, they
construct 1/p-secure protocols for functionalities for which the size of either
their domain or their range is polynomial (in the security parameter). Gordon
and Katz ask whether their results can be extended to multiparty protocols.
  We study 1/p-secure protocols in the multiparty setting for general
functionalities. Our main result is constructions of 1/p-secure protocols when
the number of parties is constant provided that less than 2/3 of the parties
are corrupt. Our protocols require that either (1) the functionality is
deterministic and the size of the domain is polynomial (in the security
parameter), or (2) the functionality can be randomized and the size of the
range is polynomial. If the size of the domain is constant and the
functionality is deterministic, then our protocol is efficient even when the
number of parties is O(log log n) (where n is the security parameter). On the
negative side, we show that when the number of parties is super-constant,
1/p-secure protocols are not possible when the size of the domain is
polynomial.
","[{""version"":""v1"",""created"":""Thu, 25 Nov 2010 08:37:52 GMT""}]","2010-11-29"
"1011.5568","Eric Heien","Eric M. Heien (INRIA Rh\^one-Alpes / LIG laboratoire d'Informatique de
  Grenoble), Derrick Kondo (INRIA Rh\^one-Alpes / LIG laboratoire
  d'Informatique de Grenoble), Anderson David (SSL)","Correlated Resource Models of Internet End Hosts",,,,,"cs.DC","http://arxiv.org/licenses/nonexclusive-distrib/1.0/","  Understanding and modelling resources of Internet end hosts is essential for
the design of desktop software and Internet-distributed applications. In this
paper we develop a correlated resource model of Internet end hosts based on
real trace data taken from the SETI@home project. This data covers a 5-year
period with statistics for 2.7 million hosts. The resource model is based on
statistical analysis of host computational power, memory, and storage as well
as how these resources change over time and the correlations between them. We
find that resources with few discrete values (core count, memory) are well
modeled by exponential laws governing the change of relative resource
quantities over time. Resources with a continuous range of values are well
modeled with either correlated normal distributions (processor speed for
integer operations and floating point operations) or log-normal distributions
(available disk space). We validate and show the utility of the models by
applying them to a resource allocation problem for Internet-distributed
applications, and demonstrate their value over other models. We also make our
trace data and tool for automatically generating realistic Internet end hosts
publicly available.
","[{""version"":""v1"",""created"":""Thu, 25 Nov 2010 08:41:38 GMT""}]","2010-11-29"
"1011.5569","Thierry Paul","Thierry Paul (CMLS-EcolePolytechnique)","Indeterminisme Quantique et Impredictibilite Classique","to appear in ""Noesis""",,,,"quant-ph","http://arxiv.org/licenses/nonexclusive-distrib/1.0/","  We present in an informal way some recent results concerning a possible
overlapping between classical unpredictability and quantum indeterminism.
","[{""version"":""v1"",""created"":""Thu, 25 Nov 2010 08:49:39 GMT""}]","2010-11-29"
"1011.5570","Keijo Kajantie","K. Kajantie, M. Vepsalainen","Spatial scalar correlator in strongly coupled hot N=4 Yang-Mills theory","15 pages, 11 figures, reference added, equation corrected, numerical
  constant analytically evaluated","Phys.Rev.D83:066003,2011","10.1103/PhysRevD.83.066003","HIP-2010-32/TH","hep-th hep-ph","http://arxiv.org/licenses/nonexclusive-distrib/1.0/","  We use AdS/CFT duality to compute in N=4 Yang-Mills theory the finite
temperature spatial correlator G(r) of the scalar operator F^2, integrated over
imaginary time. The computation is carried out both at zero frequency and
integrating the spectral function over frequencies. The result is compared with
a perturbative computation in finite T SU(N_c) Yang-Mills theory.
","[{""version"":""v1"",""created"":""Thu, 25 Nov 2010 09:03:43 GMT""},{""version"":""v2"",""created"":""Wed, 15 Dec 2010 11:45:47 GMT""}]","2011-03-21"
"1011.5571","Artem Galaktionov","A.V. Galaktionov and A.D. Zaikin","Current noise and Coulomb effects in superconducting contacts","8 pages, 1 figure","J. Phys.: Conf. Ser. 248, 012029 (2010)","10.1088/1742-6596/248/1/012029",,"cond-mat.supr-con","http://arxiv.org/licenses/nonexclusive-distrib/1.0/","  We derive an effective action for contacts between superconducting terminals
with arbitrary transmission distribution of conducting channels. In the case of
normal-superconducting (NS) contacts we evaluate interaction correction to
Andreev conductance and demonstrate a close relation between Coulomb effects
and shot noise in these systems. In the case of superconducting (SS) contacts
we derive the electron-electron interaction correction to the Josephson
current. At $T=0$ both corrections are found to vanish for fully transparent NS
and SS contacts indicating the absence of Coulomb effects in this limit.
","[{""version"":""v1"",""created"":""Thu, 25 Nov 2010 09:03:59 GMT""}]","2015-05-20"
"1011.5572","Sinya Aoki","Sinya Aoki","Recent progress on nuclear potentials from lattice QCD","4 pages, 2 figures(4 ps files). A talk presented at 35th
  International Conference of High Energy Physics - ICHEP2010, July 22-28,
  2010, Paris France","PoS ICHEP2010:362,2010",,"UTHEP-618","hep-lat nucl-th","http://arxiv.org/licenses/nonexclusive-distrib/1.0/","  A new method for nuclear potentials is reviewed. The strategy to extract the
potential from the Nambu-Bethe-Salpeter wave function in lattice QCD is
explained and the first result based on the method is presented in quenched
QCD. The recent progress of the method is summarized.
","[{""version"":""v1"",""created"":""Thu, 25 Nov 2010 09:12:01 GMT""}]","2011-08-04"
"1011.5573","Gianfranco Minati","Gianfranco Minati and Ignazio Licata","Meta-Structural properties in Collective phenomena","accepted for publication in ""The International Journal of General
  Systems""",,,,"nlin.AO","http://arxiv.org/licenses/nonexclusive-distrib/1.0/","  In this contribution we consider Collective Behaviours as coherent sequences
of spatial configurations adopted by interacting agents through corresponding
different structures over time. Multiple structures over time and their
sequences are considered as Meta-Structures establishing sequences of spatial
configurations. They are intended as coherent when acquiring emergent
properties. This coherence is considered here as being represented by the
values adopted by suitable mesoscopic variables and their properties, i.e.,
meta-structural properties, allowing the researcher to a) Recognise a
phenomenon as emergent; b) Induce emergence of collective behaviour in
populations of agents collectively interacting; c) Act on collective emergent
phenomena with the purpose to change, regulate and maintain acquired properties
and d) Merge different collective emergent phenomena. We introduce a formal
tool, i.e., the mesoscopic general vector to represent the adoption, over time,
of mesoscopic properties by collectively interacting elements. We mention
future experimental lines of activities, future lines of research and possible
applications. Keywords: coherence, emergence, ergodicity, mesoscopic,
meta-structures.
","[{""version"":""v1"",""created"":""Thu, 25 Nov 2010 09:13:17 GMT""},{""version"":""v2"",""created"":""Wed, 12 Jan 2011 08:43:30 GMT""},{""version"":""v3"",""created"":""Mon, 24 Jan 2011 11:03:32 GMT""},{""version"":""v4"",""created"":""Fri, 23 Dec 2011 14:53:54 GMT""}]","2011-12-26"
"1011.5574","Stephen Coughlan","Tsz On Mario Chan, Stephen Coughlan","Kulikov surfaces form a connected component of the moduli space","24 pages, to appear in Nagoya Math. J","Nagoya Math. J. 210 (2013), 1-27","10.1215/00277630-2076999",,"math.AG","http://arxiv.org/licenses/nonexclusive-distrib/1.0/","  We show that the Kulikov surfaces form a connected component of the moduli
space of surfaces of general type with p_g=0 and K^2=6. We also give a new
description for the surfaces, extending ideas of Inoue. Finally we calculate
the bicanonical degree of a Kulikov surface, and prove that they verify the
Bloch conjecture.
","[{""version"":""v1"",""created"":""Thu, 25 Nov 2010 09:17:49 GMT""},{""version"":""v2"",""created"":""Tue, 7 Feb 2012 22:13:42 GMT""}]","2015-01-14"
"1011.5575","Dmytro Volyanskyy","Dmytro Volyanskyy (for the CMS Collaboration)","Forward Physics with the CMS Experiment at the Large Hadron Collider","7 pages, 6 pictures",,,,"hep-ex","http://arxiv.org/licenses/nonexclusive-distrib/1.0/","  The forward physics program of the CMS experiment at the LHC spans a broad
range of diverse physics topics including studies of low-x QCD and diffractive
scattering, multi-parton interactions and underlying event structure,
gamma-mediated processes and luminosity determination, Monte Carlo tuning and
even MSSM Higgs discovery in central exclusive production. In this article, the
forward detector instrumentation around the CMS interaction point is described
and the prospects for diffractive and forward physics using the CMS forward
detectors are summarized. In addition, first observation of forward jets as
well as early measurements of the forward energy flow in the pseudorapidity
range 3.15<|\eta|<4.9 at \sqrt{s}=0.9 TeV, 2.36 TeV and 7 TeV are presented.
","[{""version"":""v1"",""created"":""Thu, 25 Nov 2010 09:19:41 GMT""}]","2019-08-13"
"1011.5576","Ai Yamakage","Ai Yamakage, Kentaro Nomura, Ken-Ichiro Imura, and Yoshio Kuramoto","Disorder-Induced Multiple Transition involving Z2 Topological Insulator","5 pages, 5 figures","J. Phys. Soc. Jpn. 80 (2011) 053703","10.1143/JPSJ.80.053703",,"cond-mat.mes-hall cond-mat.dis-nn","http://arxiv.org/licenses/nonexclusive-distrib/1.0/","  Effects of disorder on two-dimensional Z2 topological insulator are studied
numerically by the transfer matrix method. Based on the scaling analysis, the
phase diagram is derived for a model of HgTe quantum well as a function of
disorder strength and magnitude of the energy gap. In the presence of sz
non-conserving spin-orbit coupling, a finite metallic region is found that
partitions the two topologically distinct insulating phases. As disorder
increases, a narrow-gap topologically trivial insulator undergoes a series of
transitions; first to metal, second to topological insulator, third to metal,
and finally back to trivial insulator. We show that this multiple transition is
a consequence of two disorder effects; renormalization of the band gap, and
Anderson localization. The metallic region found in the scaling analysis
corresponds roughly to the region of finite density of states at the Fermi
level evaluated in the self-consistent Born approximation.
","[{""version"":""v1"",""created"":""Thu, 25 Nov 2010 09:53:42 GMT""},{""version"":""v2"",""created"":""Wed, 23 Feb 2011 07:51:39 GMT""}]","2011-05-10"
"1011.5577","Franck Lascaux","Franck Lascaux (1), Elena Masciadri (1) and Susanna Hagelin (1,2) ((1)
  INAF/Osservatorio Astrofisico di Arcetri (Italy) (2) Uppsala University
  (Sweden))","A dedicated tool for a full 3D Cn2 investigation","7 pages, 5 figures, SPIE 2010 conference","Proceedings of the SPIE, Volume 7733, pp. 77334E-77334E-8 (2010)","10.1117/12.856900",,"astro-ph.IM physics.ao-ph","http://arxiv.org/licenses/nonexclusive-distrib/1.0/","  We present in this study a mapping of the optical turbulence (OT) above
different astronomical sites. The mesoscale model Meso-NH was used together
with the Astro-Meso-Nh package and a set of diagnostic tools allowing for a
full 3D investigation of the Cn2. The diagnostics implemented in the
Astro-Meso-Nh, allowing for a full 3D investigation of the OT structure in a
volumetric space above different sites, are presented. To illustrate the
different diagnostics and their potentialities, we investigated one night and
looked at instantaneous fields of meteorologic and astroclimatic parameters. To
show the potentialities of this tool for applications in an Observatory we ran
the model above sites with very different OT distributions: the antarctic
plateau (Dome C, Dome A, South Pole) and a mid-latitude site (Mt. Graham,
Arizona). We put particular emphasis on the 2D maps of integrated astroclimatic
parameters (seeing, isoplanatic angles) calculated in different slices at
different heights in the troposhere. This is an useful tool of prediction and
investigation of the turbulence structure. It can support the optimization of
the AO, GLAO and MCAO systems running at the focus of the ground-based
telescopes.From this studies it emerges that the astronomical sites clearly
present different OT behaviors. Besides, our tool allowed us for discriminating
these sites.
","[{""version"":""v1"",""created"":""Thu, 25 Nov 2010 10:15:27 GMT""}]","2010-11-29"
"1011.5578","Hiroki Saito","Kazuki Sasaki, Naoya Suzuki, Hiroki Saito","Dynamics of bubbles in a two-component Bose-Einstein condensate","6 pages, 7 figures","Phys. Rev. A 83, 033602 (2011)","10.1103/PhysRevA.83.033602",,"cond-mat.quant-gas","http://arxiv.org/licenses/nonexclusive-distrib/1.0/","  The dynamics of a phase-separated two-component Bose-Einstein condensate are
investigated, in which a bubble of one component moves through the other
component. Numerical simulations of the Gross--Pitaevskii equation reveal a
variety of dynamics associated with the creation of quantized vortices. In two
dimensions, a circular bubble deforms into an ellipse and splits into fragments
with vortices, which undergo the Magnus effect. The B\'enard--von K\'arm\'an
vortex street is also generated. In three dimensions, a spherical bubble
deforms into toruses with vortex rings. When two rings are formed, they exhibit
leapfrogging dynamics.
","[{""version"":""v1"",""created"":""Thu, 25 Nov 2010 10:16:50 GMT""}]","2015-05-20"
"1011.5579","Xavier Dumusque","X. Dumusque, N. C. Santos, S. Udry, C. Lovis, X. Bonfils","Stellar noise and planet detection. I. Oscillations, granulation and
  sun-like spots","2 pages, 2 figures, to appear in the proceedings of the 276th IAU
  Symposium ""The Astrophysics of Planetary Systems""",,"10.1017/S1743921311021089",,"astro-ph.EP","http://arxiv.org/licenses/nonexclusive-distrib/1.0/","  Spectrographs like HARPS can now reach a sub-m/s precision in radial-velocity
(RV) (Pepe & Lovis 2008). At this level of accuracy, we start to be confronted
with stellar noise produced by 3 different physical phenomena: oscillations,
granulation phenomena (granulation, meso- and super-granulation) and activity.
On solar type stars, these 3 types of perturbation can induce m/s RV variation,
but on different time scales: 3 to 15 minutes for oscillations, 15 minutes to
1.5 days for granulation phenomena and 10 to 50 days for activity. The high
precision observational strategy used on HARPS, 1 measure per night of 15
minutes, on 10 consecutive days each month, is optimized, due to a long
exposure time, to average out the noise coming from oscillations (Dumusque et
al. 2010) but not to reduce the noise coming from granulation and activity. The
smallest planets found with this strategy (Mayor et al. 2009) seems to be at
the limit of the actual observational strategy and not at the limit of the
instrumental precision. To be able to find Earth mass planets in the habitable
zone of solar-type stars (200 days for a K0 dwarf), new observational
strategies, averaging out simultaneously all type of stellar noise, are
required.
","[{""version"":""v1"",""created"":""Thu, 25 Nov 2010 10:18:50 GMT""}]","2015-05-20"
"1011.5580","Alla Badalian","A. M. Badalian (ITEP, Moscow)","Radial Regge trajectories for higher $\psi(nS)$ and $\psi(nD)$ states","LaTeX, 15 pages.References and short comments added. Invited paper to
  the special issue of Yadernaya Fizika, dedicated to the centennial
  anniversary of the birthday of A.B.Migdal","Phys.Atom.Nucl.74:1375-1381,2011","10.1134/S106377881109002X",,"hep-ph hep-ex","http://arxiv.org/licenses/nonexclusive-distrib/1.0/","  The masses of $\psi((n+1) {}^3S_1)$ and $\psi(n {}^3D_1)$ are calculated
using the relativistic string Hamiltonian with ""linear+gluon-exchange""
potential. They occur in the range 4.5-5.8 GeV, in particular, $M(3D)=4.54$
GeV, $M(5S)=4.79$ GeV, $M(4D)=4.85$ GeV are calculated with accuracy $\sim 50$
MeV. Linear Regge trajectories: $M^2(nS)=M^2(\psi(4.42))+ 2.91$ GeV$^2 (n-4)$
$(n\geq 4) $ and $M^2(nD)=(4.54^2+ 2.88 (n-3))$ GeV$^2$ ($n\geq 3$) are
obtained only for higher charmonium excitations. They have slopes two times
larger than those of light mesons and give good description of calculated
masses. These masses are compared with enhancements in some recent $e^+e^-$
experiments.
","[{""version"":""v1"",""created"":""Thu, 25 Nov 2010 10:19:26 GMT""},{""version"":""v2"",""created"":""Wed, 8 Dec 2010 14:41:21 GMT""}]","2011-09-20"
"1011.5581","Xavier Dumusque","X. Dumusque, C. Lovis, S. Udry, N. C. Santos","Stellar noise and planet detection. II. Radial-velocity noise induced by
  magnetic cycles","2 pages, 2 figures, to appear in the proceedings of the 276th IAU
  Symposium ""The Astrophysics of Planetary Systems""",,"10.1017/S1743921311021090",,"astro-ph.EP","http://arxiv.org/licenses/nonexclusive-distrib/1.0/","  For the 451 stars of the HARPS high precision program, we study correlations
between the radial-velocity (RV) variation and other parameters of the Cross
Correlated Function (CCF). After a careful target selection, we found a very
good correlation between the slope of the RV-activity index (log(R'HK)
correlation and the Teff for dwarf stars. This correlation allow us to correct
RV from magnetic cycles given the activity index and the Teff.
","[{""version"":""v1"",""created"":""Thu, 25 Nov 2010 10:26:21 GMT""}]","2015-05-20"
"1011.5582","Tobias Ambjornsson","Michael A Lomholt, Ludvig Lizana and Tobias Ambjornsson","Dissimilar bouncy walkers","11 pages, to appear in Journal of Chemical Physics",,"10.1063/1.3526941",,"cond-mat.soft","http://arxiv.org/licenses/nonexclusive-distrib/1.0/","  We consider the dynamics of a one-dimensional system consisting of dissimilar
hardcore interacting (bouncy) random walkers. The walkers' (diffusing
particles') friction constants xi_n, where n labels different bouncy walkers,
are drawn from a distribution rho(xi_n). We provide an approximate analytic
solution to this recent single-file problem by combining harmonization and
effective medium techniques. Two classes of systems are identified: when
rho(xi_n) is heavy-tailed, rho(xi_n)=A xi_n^(-1-\alpha) (0<alpha<1) for large
xi_n, we identify a new universality class in which density relaxations,
characterized by the dynamic structure factor S(Q,t), follows a Mittag-Leffler
relaxation, and the the mean square displacement of a tracer particle (MSD)
grows as t^delta with time t, where delta=alpha/(1+\alpha). If instead rho is
light-tailedsuch that the mean friction constant exist, S(Q,t) decays
exponentially and the MSD scales as t^(1/2). We also derive tracer particle
force response relations. All results are corroborated by simulations and
explained in a simplified model.
","[{""version"":""v1"",""created"":""Thu, 25 Nov 2010 10:28:39 GMT""}]","2015-05-20"
"1011.5583","Elena Masciadri Dr.","E. Masciadri (1), J. Stoesz (1), S. Hagelin, S. (1), F. Lascaux (1)
  (1) INAF - Osservatorio Astrofisico di Arcetri","Mt. Graham: Optical turbulence vertical distribution at standard and
  high vertical resolution","12 pages, 6 figures, Proc. SPIE Conference ""Ground-based and Airborne
  Telescopes III"", 27 June 2010, San Diego, California, USA","Proc. SPIE, Vol. 77331P-77331P-12, 2010","10.1117/12.856904",,"astro-ph.IM physics.ao-ph","http://arxiv.org/licenses/nonexclusive-distrib/1.0/","  A characterization of the optical turbulence vertical distribution and all
the main integrated astroclimatic parameters derived from the CN2 and the wind
speed profiles above Mt. Graham is presented. The statistic includes
measurements related to 43 nights done with a Generalized Scidar (GS) used in
standard configuration with a vertical resolution of ~1 km on the whole 20-22
km and with the new technique (HVR-GS) in the first kilometer. The latter
achieves a resolution of ~ 20-30 m in this region of the atmosphere.
Measurements done in different periods of the year permit us to provide a
seasonal variation analysis of the CN2. A discretized distribution of the
typical CN2 profiles useful for the Ground Layer Adaptive Optics (GLAO)
simulations is provided and a specific analysis for the LBT Laser Guide Star
system ARGOS case is done including the calculation of the 'gray zones' for J,
H and K bands. Mt. Graham confirms to be an excellent site with median values
of the seeing without dome contribution equal to 0.72"", the isoplanatic angle
equal to 2.5"" and the wavefront coherence time equal to 4.8 msec. We provide a
cumulative distribution of the percentage of turbulence developed below H*
where H* is included in the (0,1 km) range. We find that 50% of the whole
turbulence develops in the first 80 m from the ground. The turbulence
decreasing rate is very similar to what has been observed above Mauna Kea.
","[{""version"":""v1"",""created"":""Thu, 25 Nov 2010 10:28:56 GMT""}]","2010-11-29"
"1011.5584","Pedro Pina Avelino","P.P. Avelino, F. Moraes, J.C.R.E. Oliveira, B. F. de Oliveira","Electric field induced inversion of the sign of half-integer
  disclinations in 2D nematic liquid crystals","5 pages, 6 figures",,,,"cond-mat.soft cond-mat.mtrl-sci","http://arxiv.org/licenses/nonexclusive-distrib/1.0/","  We study the effect of the rotation of an external electric field on the
dynamics of half-integer disclination networks in two dimensional nematic
liquid crystals with a negative dielectric anisotropy using LICRA, a LIquid
CRystal Algorithm developed by the authors. We show that a rotation of $\pi$ of
the electric field around an axis of the liquid crystal plane continuously
transforms all half-integer disclinations of the network into disclinations of
opposite sign via twist disclinations. We also determine the evolution of the
characteristic length scale, thus quantifying the impact of the external
electric field on the coarsening of the defect network.
","[{""version"":""v1"",""created"":""Thu, 25 Nov 2010 10:32:02 GMT""}]","2010-11-29"
"1011.5585","Tom H. Koornwinder","Tom H. Koornwinder","On the Limit from q-Racah Polynomials to Big q-Jacobi Polynomials","dedicated to Willard Miller on the occasion of his retirement; the
  unnumbered formula after (2.5) is corrected","SIGMA 7 (2011), 040, 8 pages","10.3842/SIGMA.2011.040",,"math.CA","http://creativecommons.org/licenses/by-nc-sa/3.0/","  A limit formula from q-Racah polynomials to big q-Jacobi polynomials is given
which can be considered as a limit formula for orthogonal polynomials. This is
extended to a multi-parameter limit with 3 parameters, also involving (q-)Hahn
polynomials, little q-Jacobi polynomials and Jacobi polynomials. Also the
limits from Askey-Wilson to Wilson polynomials and from q-Racah to Racah
polynomials are given in a more conceptual way.
","[{""version"":""v1"",""created"":""Thu, 25 Nov 2010 10:36:32 GMT""},{""version"":""v2"",""created"":""Tue, 1 Mar 2011 09:45:03 GMT""},{""version"":""v3"",""created"":""Thu, 21 Apr 2011 04:44:19 GMT""},{""version"":""v4"",""created"":""Fri, 4 Nov 2011 14:03:18 GMT""}]","2015-03-17"
"1011.5586","Anders Kock","Anders Kock","Theory of characteristics for first order partial differential equations",,,,,"math.AP","http://arxiv.org/licenses/nonexclusive-distrib/1.0/","  We use the method of synthetic differential geometry to revisit the geometric
reasoning employed by Lie, Klein and others in their study of partial
differential equations.
","[{""version"":""v1"",""created"":""Thu, 25 Nov 2010 10:45:19 GMT""}]","2010-11-29"
