"1011.5406","Michael Gabler","Michael Gabler, Pablo Cerd\'a-Dur\'an, Jos\'e A. Font, Ewald M\""uller
  and Nikolaos Stergioulas","Magneto-elastic torsional oscillations of magnetars","6 pages, 1 figure, 1 table, Proceedings of NEB14, to appear in J.
  Phys.: Conf. Ser","J.Phys.Conf.Ser.283:012013,2011","10.1088/1742-6596/283/1/012013",,"astro-ph.SR astro-ph.HE gr-qc","http://arxiv.org/licenses/nonexclusive-distrib/1.0/","  We extend a general-relativistic ideal magneto-hydrodynamical code to include
the effects of elasticity. Using this numerical tool we analyse the
magneto-elastic oscillations of highly magnetised neutron stars (magnetars). In
simulations without magnetic field we are able to recover the purely crustal
shear oscillations within an accuracy of about a few per cent. For dipole
magnetic fields between 5 x 10^13 and 10^15 G the Alfv\'en oscillations become
modified substantially by the presence of the crust. Those quasi-periodic
oscillations (QPOs) split into three families: Lower QPOs near the equator,
Edge QPOs related to the last open field line and Upper QPOs at larger distance
from the equator. Edge QPOs are called so because they are related to an edge
in the corresponding Alfv\'en continuum. The Upper QPOs are of the same kind,
while the Lower QPOs are turning-point QPOs, related to a turning point in the
continuous spectrum.
","[{""version"":""v1"",""created"":""Wed, 24 Nov 2010 16:00:22 GMT""}]","2011-03-28"
"1011.5407","Alexander Volya","Alexander Volya","Porter-Thomas distribution in unstable many-body systems","5 pages, 4 figures","Phys.Rev.C83:044312,2011","10.1103/PhysRevC.83.044312",,"nucl-th","http://arxiv.org/licenses/nonexclusive-distrib/1.0/","  We use the continuum shell model approach to explore the resonance width
distribution in unstable many-body systems. The single-particle nature of a
decay, the few-body character of the interaction Hamiltonian, and collectivity
that emerges in non-stationary systems due to the coupling to the continuum of
reaction states are discussed. Correlations between structures of the parent
and daughter nuclear systems in the common Fock space are found to result in
deviations of decay width statistics from the Porter-Thomas distribution.
","[{""version"":""v1"",""created"":""Wed, 24 Nov 2010 16:00:50 GMT""}]","2011-05-05"
"1011.5408","Yuqiang Ma","Xia-qing Shi and Yu-qiang Ma","Deterministic endless collective evolvement in active nematics","5 pages, 3 figures",,,,"cond-mat.stat-mech cond-mat.soft","http://creativecommons.org/licenses/by/3.0/","  We propose a simple deterministic dynamic equation and reveal the mechanism
of large-scale endless evolvement of spatial density inhomogeneity in active
nematic. We determine the phase regions analytically. The interplay of density,
magnitude of nematic order, and nematic director is crucial for the
long-wave-length instability and the emergence of seemingly fluctuated
collective motions. Ordered nematic domains can absorb particles, grow and
divide endlessly. The present finding extends our understanding of the
large-scale and seemingly fluctuated organization in active fluids.
","[{""version"":""v1"",""created"":""Wed, 24 Nov 2010 16:02:40 GMT""}]","2010-11-25"
"1011.5409","Axel Maas","Axel Maas","Gauges, propagators, and physics","3 pages, 3 figures; invited talk presented at the conference ""Quark
  Confinement and the Hadron Spectrum IX"", Madrid, Spain, 30th of August-3rd of
  September 2010; submitted to the proceedings","AIP Conf. Proc. 1343:182-184,2011","10.1063/1.3574970",,"hep-ph","http://arxiv.org/licenses/nonexclusive-distrib/1.0/","  When a theory shall be described at all scales, it is necessary to start from
its elementary degrees of freedom. Herein, one possible chain of steps for this
purpose will be briefly outlined for the example of a gauge theory, like QCD.
Starting with the elementary constituents, gluons and quarks, step by step the
final observables, physical states, will be built up. This process is based on
the elementary correlation functions, and uses a combination of both numerical
lattice calculations and functional continuum methods. While the process uses a
fixed gauge at each intermediate step, the final observables are
gauge-invariant.
","[{""version"":""v1"",""created"":""Wed, 24 Nov 2010 16:10:06 GMT""}]","2011-07-22"
"1011.5410","Duck Hee Kwon Dr.","Duck-Hee Kwon and Daniel Wolf Savin","Fe$^{\bf{15+}}$ dielectronic recombination and the effects of
  configuration interaction between resonances with different captured electron
  principal quantum number",,,"10.1103/PhysRevA.83.012701",,"physics.atom-ph","http://arxiv.org/licenses/nonexclusive-distrib/1.0/","  Dielectronic recombination (DR) of Na-like Fe$^{15+}$ forming Mg-like
Fe$^{14+}$ via excitation of a $2l$ core electron has been investigated. We
find that configuration interaction (CI) between DR resonances with different
captured electron principal quantum numbers $n$ can lead to a significant
reduction in resonance strengths for $n \geq 5$. Previous theoretical work for
this system has not considered this form of CI. Including it accounts for most
of the discrepancy between previous theoretical and experimental results.
","[{""version"":""v1"",""created"":""Wed, 24 Nov 2010 16:11:25 GMT""}]","2015-05-20"
"1011.5411","Yu Ye","Yan-Hong Yang, Yuan Yao and Yu Ye","(Quasi-)Poisson enveloping algebras","17 pages",,,,"math.RA math.CT","http://arxiv.org/licenses/nonexclusive-distrib/1.0/","  We introduce the quasi-Poisson enveloping algebra and Poisson enveloping
algebra for a non-commutative Poisson algebra. We prove that for a
non-commutative Poisson algebra, the category of quasi-Poisson modules is
equivalent to the category of left modules over its quasi-Poisson enveloping
algebra, and the category of Poisson modules is equivalent to the category of
left modules over its Poisson enveloping algebra.
","[{""version"":""v1"",""created"":""Wed, 24 Nov 2010 16:13:44 GMT""},{""version"":""v2"",""created"":""Mon, 13 Dec 2010 15:40:51 GMT""}]","2010-12-14"
"1011.5412","Natalie Arkus","Natalie Arkus, Vinothan N. Manoharan and Michael P. Brenner","Deriving Finite Sphere Packings","The updates that have been made to version II are as follows: (i)
  some updates to the main text have been made, primarily correcting the number
  of packings reported in PRL, 103, 118303 and in version I of this paper for n
  = 9,10. (ii) The supplemental information for the paper has been included","SIAM Journal on Discrete Mathematics, 25(4), 1860 (2011)","10.1137/100784424",,"cond-mat.soft math.AG","http://arxiv.org/licenses/nonexclusive-distrib/1.0/","  Sphere packing problems have a rich history in both mathematics and physics;
yet, relatively few analytical analyses of sphere packings exist, and answers
to seemingly simple questions are unknown. Here, we present an analytical
method for deriving all packings of n spheres in R^3 satisfying minimal
rigidity constraints (>= 3 contacts per sphere and >= 3n-6 total contacts). We
derive such packings for n <= 10, and provide a preliminary set of maximal
contact packings for 10 < n <= 20. The resultant set of packings has some
striking features, among them: (i) all minimally rigid packings for n <= 9 have
3n-6 contacts, (ii) non-rigid packings satisfying minimal rigidity constraints
arise for n >= 9, (iii) the number of ground states (i.e. packings with the
maximal number of contacts) oscillates with respect to n, (iv) for 10 <= n <=
20 there are only a small number of packings with the maximal number of
contacts, and for 10 <= n < 13 these are all commensurate with the HCP lattice.
The general method presented here may have applications to other related
problems in mathematics, such as the Erdos repeated distance problem and
Euclidean distance matrix completion problems.
","[{""version"":""v1"",""created"":""Wed, 24 Nov 2010 16:15:06 GMT""},{""version"":""v2"",""created"":""Sun, 13 Nov 2011 23:38:34 GMT""}]","2013-10-17"
"1011.5413","Giona Veronelli","Stefano Pigola and Giona Veronelli","Remarks on $L^{p}$-vanishing results in geometric analysis","18 pages. Some oversights corrected. Accepted for publication in
  International Journal of Mathematics",,,,"math.DG","http://arxiv.org/licenses/nonexclusive-distrib/1.0/","  We survey some $L^{p}$-vanishing results for solutions of Bochner or Simons
type equations with refined Kato inequalities, under spectral assumptions on
the relevant Schr\""{o}dinger operators. New aspects are included in the
picture. In particular, an abstract version of a structure theorem for stable
minimal hypersurfaces of finite total curvature is observed. Further geometric
applications are discussed.
","[{""version"":""v1"",""created"":""Wed, 24 Nov 2010 16:16:59 GMT""},{""version"":""v2"",""created"":""Mon, 6 Jun 2011 13:06:09 GMT""}]","2011-06-07"
"1011.5414","Arumugam Thamizhavel","Pranab Kumar Das, Neeraj Kumar, R. Kulkarni and A. Thamizhavel","Magnetic properties of the heavy fermion antiferromagnet CeMg$_3$","6 pages, 8 figures. Accepted in Phys. Rev. B","Phys. Rev. B 83, 134416 (2011)","10.1103/PhysRevB.83.134416",,"cond-mat.str-el cond-mat.mtrl-sci","http://arxiv.org/licenses/nonexclusive-distrib/1.0/","  We have grown the single crystals of CeMg$_3$ and its non-magnetic analogue
LaMg$_3$, which crystallize in the cubic crystal structure with the space group
\textit{Fm\rm{\={3}}m}, and studied their magnetic properties on well oriented
single crystals by measuring the magnetic susceptibility, magnetization and
heat capacity. CeMg$_3$ orders antiferromagnetically with a N\'{e}el
temperature $T_{\rm N}$ of 2.6 K. The specific heat capacity at low temperature
exhibits an enhanced Sommerfeld coefficient of 370 mJ/K$^2$$...$ mol indicating
the heavy fermion nature of CeMg$_3$. An estimation of Kondo temperature
$T_{\rm K}$ was made and found that it is of similar magnitude as that of
$T_{\rm N}$. The reduced value of the magnetization below the ordering
temperature, together with the reduced entropy at the magnetic ordering
temperature and the enhanced low temperature heat capacity indicates that Kondo
effect plays a significant role in this compound. We have performed the
crystalline electric field (CEF) analysis on the magnetic susceptibility and
the heat capacity data and found that the ground state is a $\Gamma_7$ doublet
with an overall splitting of 191 K.
","[{""version"":""v1"",""created"":""Wed, 24 Nov 2010 16:18:49 GMT""},{""version"":""v2"",""created"":""Fri, 8 Apr 2011 16:23:28 GMT""}]","2012-07-18"
"1011.5415","Luca Gironi","C.Arnaboldi, C.Brofferio, O.Cremonesi, L.Gironi, M.Pavan, G.Pessina,
  S.Pirro, E.Previtali","A novel technique of particle identification with bolometric detectors","10 pages, 8 figures",,"10.1016/j.astropartphys.2011.02.006",,"nucl-ex","http://arxiv.org/licenses/nonexclusive-distrib/1.0/","  We report in this paper the proofs that the pulse shape analysis can be used
in some bolometers to identify the nature of the interacting particle. Indeed,
while detailed analyses of the signal time development in purely thermal
detectors have not produced so far interesting results, similar analyses on
bolometers built with scintillating crystals seem to show that it is possible
to distinguish between an electron or gamma-ray and an alpha particle
interaction. This information can be used to eliminate background events from
the recorded data in many rare process studies, especially Neutrinoless Double
Beta decay search. Results of pulse shape analysis of signals from a number of
bolometers with absorbers of different composition (CaMoO4, ZnMoO4, MgMoO4 and
ZnSe) are presented and the pulse shape discrimination capability of such
detectors is discussed.
","[{""version"":""v1"",""created"":""Wed, 24 Nov 2010 16:23:08 GMT""},{""version"":""v2"",""created"":""Fri, 3 Dec 2010 11:23:24 GMT""},{""version"":""v3"",""created"":""Thu, 18 Aug 2011 08:45:01 GMT""}]","2015-05-20"
"1011.5416","Timo Richarz","Timo Richarz","Schubert varieties in twisted affine flag varieties and local models","25 pages",,,,"math.AG","http://arxiv.org/licenses/nonexclusive-distrib/1.0/","  Our concern in this paper is the dimension and inclusion relations of
Schubert varieties in twisted partial affine flag varieties. In the end we
apply our results to some local models of certain Schubert varieties.
","[{""version"":""v1"",""created"":""Wed, 24 Nov 2010 16:24:04 GMT""}]","2010-11-25"
"1011.5417","Futoshi Yagi","Giulio Bonelli, Kazunobu Maruyoshi, Alessandro Tanzini, Futoshi Yagi","Generalized matrix models and AGT correspondence at all genera","19 pages; v2: version to appear in JHEP","JHEP 1107:055,2011","10.1007/JHEP07(2011)055","SISSA 82/2010/EP-FM","hep-th","http://arxiv.org/licenses/nonexclusive-distrib/1.0/","  We study generalized matrix models corresponding to n-point Virasoro
conformal blocks on Riemann surfaces with arbitrary genus g. Upon AGT
correspondence, these describe four dimensional N=2 SU(2)^{n+3g-3} gauge
theories with generalized quiver diagrams. We obtain the generalized matrix
models from the perturbative evaluation of the Liouville correlation functions
and verify the consistency of the description with respect to degenerations of
the Riemann surface. Moreover, we derive the Seiberg-Witten curve for the N=2
gauge theory as the spectral curve of the generalized matrix model, thus
providing a check of AGT correspondence at all genera.
","[{""version"":""v1"",""created"":""Wed, 24 Nov 2010 16:26:10 GMT""},{""version"":""v2"",""created"":""Mon, 11 Jul 2011 12:11:50 GMT""}]","2011-07-22"
"1011.5419","Ana Lopez-Sepulcre","A. L\'opez-Sepulcre, C.M. Walmsley, R. Cesaroni, C. Codella, F.
  Schuller, L. Bronfman, S.J. Carey, K. M. Menten, S. Molinari, A.
  Noriega-Crespo","SiO outflows in high-mass star forming regions: A potential chemical
  clock?","12 pages, 10 figures",,"10.1051/0004-6361/201015827",,"astro-ph.GA","http://arxiv.org/licenses/nonexclusive-distrib/1.0/","  Some theoretical models propose that O-B stars form via accretion, in a
similar fashion to low-mass stars. Jet-driven molecular outflows play an
important role in this scenario, and their study can help to understand the
process of high-mass star formation and the different evolutionary phases
involved. Observations towards low-mass protostars so far favour an
evolutionary picture in which jets are always associated with Class 0 objects
while more evolved Class I/II objects show less evidence of powerful jets. The
present study aims at checking whether an analogous picture can be found in the
high-mass case. The IRAM 30-m telescope (Spain) has been used to perform
single-pointing SiO(2-1) and (3-2) observations towards a sample of 57
high-mass molecular clumps in different evolutionary stages. Continuum data at
different wavelengths, from mid-IR to 1.2 mm, have been gathered to build the
spectral energy distributions of all the clumps and estimate their bolometric
luminosities. SiO emission at high velocities, characteristic of molecular
jets, is detected in 88% of our sources, a very high detection rate indicating
that there is ongoing star formation activity in most of the sources of our
sample. The SiO(2-1) luminosity drops with L/M, which suggests that jet
activity declines as time evolves. This represents the first clear evidence of
a decrease of SiO outflow luminosity with time in a homogeneous sample of
high-mass molecular clumps in different evolutionary stages. The SiO(3-2) to
SiO(2-1) integrated intensity ratio shows only minor changes with evolutionary
state.
","[{""version"":""v1"",""created"":""Wed, 24 Nov 2010 16:30:48 GMT""}]","2015-05-20"
"1011.5420","Pieter Vingerhoets","P. Vingerhoets, K.T. Flanagan, M. Avgoulea, J. Billowes, M.L. Bissell,
  K. Blaum, B.A. Brown, B. Cheal, M. De Rydt, D.H. Forest, Ch. Geppert, M.
  Honma, M. Kowalska, J. Kramer, A. Krieger, E. Mane, R. Neugart, G. Neyens, W.
  Nortershauser, T. Otsuka, M. Schug, H.H. Stroke, G. Tungate, D.T. Yordanov","Nuclear spins, magnetic moments and quadrupole moments of Cu isotopes
  from N = 28 to N = 46: probes for core polarization effects","13 pagers, 19 figures, accepted by Physical Review C","Phys.Rev.C82:064311,2010","10.1103/PhysRevC.82.064311",,"nucl-ex","http://arxiv.org/licenses/nonexclusive-distrib/1.0/","  Measurements of the ground-state nuclear spins, magnetic and quadrupole
moments of the copper isotopes from 61Cu up to 75Cu are reported. The
experiments were performed at the ISOLDE facility, using the technique of
collinear laser spectroscopy. The trend in the magnetic moments between the
N=28 and N=50 shell closures is reasonably reproduced by large-scale
shell-model calculations starting from a 56Ni core. The quadrupole moments
reveal a strong polarization of the underlying Ni core when the neutron shell
is opened, which is however strongly reduced at N=40 due to the parity change
between the $pf$ and $g$ orbits. No enhanced core polarization is seen beyond
N=40. Deviations between measured and calculated moments are attributed to the
softness of the 56Ni core and weakening of the Z=28 and N=28 shell gaps.
","[{""version"":""v1"",""created"":""Wed, 24 Nov 2010 16:33:33 GMT""}]","2010-12-28"
"1011.5421","Sebastian Schmidt","K. Van Houcke, Y. Alhassid, S. Schmidt, and S. M. A. Rombouts","The competition between superconductivity and ferromagnetism in small
  metallic grains: thermodynamic properties","9 pages, 9 figures",,,,"cond-mat.mes-hall cond-mat.supr-con nucl-th","http://arxiv.org/licenses/nonexclusive-distrib/1.0/","  We study the thermodynamic properties of a small superconducting metallic
grain using a quantum Monte Carlo method. The grain is described by the
universal Hamiltonian, containing pairing and ferromagnetic exchange
correlations. In particular, we study how the thermodynamic signatures of
pairing correlations are affected by the spin exchange interaction. We find the
exchange interaction effects to be qualitatively different in the BCS and
fluctuation-dominated regimes of pairing correlations.
","[{""version"":""v1"",""created"":""Wed, 24 Nov 2010 16:34:29 GMT""}]","2010-11-25"
"1011.5422","Francesca Giordano","Francesca Giordano and Rebecca Lamb","Flavor-dependent azimuthal modulations in unpolarized SIDIS cross
  section at HERMES",,"J.Phys.Conf.Ser.295:012092,2011","10.1088/1742-6596/295/1/012092",,"hep-ex","http://arxiv.org/licenses/nonexclusive-distrib/1.0/","  The $\cos\phi_h$ and $\cos2\phi_h$ azimuthal modulations of the unpolarized
hadron Semi-Inclusive Deep Inelastic Scattering cross section are sensitive to
the quark intrinsic transverse momentum and transverse spin. These modulations
have been measured at HERMES in a fully differential way by means of a
4-dimensional unfolding procedure to correct for instrumental effects. Results
have been extracted for hydrogen and deuterium targets and separately for
positively and negatively charged pions and kaons, to access flavor-dependent
information about the nucleon internal transverse degrees of freedom.
","[{""version"":""v1"",""created"":""Wed, 24 Nov 2010 16:37:57 GMT""}]","2011-07-21"
"1011.5423","Mohammadmehdi Ettefaghi","M.M. Ettefaghi and T. Shakouri","Neutrino-electron scattering in noncommutative space","12 pages, 2 figures","JHEP 1011:131,2010","10.1007/JHEP11(2010)131","0151799","hep-ph","http://arxiv.org/licenses/nonexclusive-distrib/1.0/","  Neutral particles can couple with the $U(1)$ gauge field in the adjoint
representation at the tree level if the space-time coordinates are
noncommutative (NC). Considering neutrino-photon coupling in the NC QED
framework, we obtain the differential cross section of neutrino-electron
scattering. Similar to the magnetic moment effect, one of the NC terms is
proportional to $\frac 1 T$, where $T$ is the electron recoil energy.
Therefore, this scattering provides a chance to achieve a stringent bound on
the NC scale in low energy by improving the sensitivity to the smaller electron
recoil energy.
","[{""version"":""v1"",""created"":""Wed, 24 Nov 2010 16:38:02 GMT""}]","2011-07-22"
"1011.5424","Tetyana Galatyuk","Tetyana Galatyuk (for the HADES collaboration)","Probing resonance matter with virtual photons","10 pages, 3 figures, proceedings of the International Nuclear Physics
  Conference - INPC 2010, Vancouver, Canada, July 4 - 9 2010","J.Phys.Conf.Ser.312:012008,2011","10.1088/1742-6596/312/1/012008",,"nucl-ex","http://arxiv.org/licenses/nonexclusive-distrib/1.0/","  In the energy domain of 1-2 GeV per nucleon, HADES has measured rare
penetrating probes (e+e-) in C+C, Ar+KCl, d+p, p+p and p+Nb collisions. For the
first time the electron pairs were reconstructed from quasi-free n+p
sub-reactions by detecting the proton spectator from the deuteron breakup. An
experimentally constrained NN reference spectrum was established. Our results
demonstrate that the gross features of di-electron spectra in C+C collisions
can be explained as a superposition of independent NN collisions. On the other
hand, a direct comparison of the NN reference spectrum with the e+e- invariant
mass distribution measured in the heavier system Ar+KCl at 1.76 GeV/u shows an
excess yield above the reference, which we attribute to radiation from
resonance matter. Moreover, the combined measurement of di-electrons and
strangeness in Ar+KCl collisions has provided further intriguing results which
are also discussed.
","[{""version"":""v1"",""created"":""Wed, 24 Nov 2010 16:45:44 GMT""},{""version"":""v2"",""created"":""Fri, 26 Nov 2010 10:52:26 GMT""}]","2019-08-13"
"1011.5425","Sebastiano Vigna","Paolo Boldi, Marco Rosa, Massimo Santini, Sebastiano Vigna","Layered Label Propagation: A MultiResolution Coordinate-Free Ordering
  for Compressing Social Networks",,,,,"cs.DS cs.SI physics.soc-ph","http://arxiv.org/licenses/nonexclusive-distrib/1.0/","  We continue the line of research on graph compression started with WebGraph,
but we move our focus to the compression of social networks in a proper sense
(e.g., LiveJournal): the approaches that have been used for a long time to
compress web graphs rely on a specific ordering of the nodes (lexicographical
URL ordering) whose extension to general social networks is not trivial. In
this paper, we propose a solution that mixes clusterings and orders, and devise
a new algorithm, called Layered Label Propagation, that builds on previous work
on scalable clustering and can be used to reorder very large graphs (billions
of nodes). Our implementation uses overdecomposition to perform aggressively on
multi-core architecture, making it possible to reorder graphs of more than 600
millions nodes in a few hours. Experiments performed on a wide array of web
graphs and social networks show that combining the order produced by the
proposed algorithm with the WebGraph compression framework provides a major
increase in compression with respect to all currently known techniques, both on
web graphs and on social networks. These improvements make it possible to
analyse in main memory significantly larger graphs.
","[{""version"":""v1"",""created"":""Wed, 24 Nov 2010 16:49:34 GMT""},{""version"":""v2"",""created"":""Fri, 14 Oct 2011 07:59:18 GMT""}]","2011-10-17"
"1011.5426","Martin Shotter","Martin Shotter","Large photon number extraction from individual atoms trapped in an
  optical lattice",,,"10.1103/PhysRevA.83.033420",,"cond-mat.quant-gas quant-ph","http://arxiv.org/licenses/nonexclusive-distrib/1.0/","  The atom-by-atom characterization of quantum gases requires the development
of novel measurement techniques. One particularly promising new technique
demonstrated in recent experiments uses strong fluorescent laser scattering
from neutral atoms confined in a short-period optical lattice to measure the
position of individual atoms in the sample. A crucial condition for the
measurements is that atomic hopping between lattice sites must be strongly
suppressed despite substantial photon recoil heating. This article models
three-dimensional polarization gradient cooling of atoms trapped within a
far-detuned optical lattice. The atomic dynamics are simulated using a hybrid
Monte Carlo and master equation analysis in order to predict the frequency of
processes which give rise to degradation or loss of the fluorescent signal
during measurements. It is shown, consistent with the experimental results,
that there exists a wide parameter range in which the lifetime of
strongly-fluorescing isolated lattice-trapped atoms is limited by background
gas collisions rather than radiative processes. In these cases the total number
of scattered photons can be as large as 10^8 per atom. The performance of the
technique is related to relevant experimental parameters.
","[{""version"":""v1"",""created"":""Wed, 24 Nov 2010 16:52:27 GMT""},{""version"":""v2"",""created"":""Mon, 29 Nov 2010 12:21:41 GMT""},{""version"":""v3"",""created"":""Tue, 22 Mar 2011 18:33:57 GMT""}]","2013-05-29"
