"1011.5469","Hao Zhang","Hao Zhang, Minghua Chen, Abhay Parekh and Kannan Ramchandran","An Adaptive Multi-channel P2P Video-on-Demand System using Plug-and-Play
  Helpers",,,,,"cs.NI","http://arxiv.org/licenses/nonexclusive-distrib/1.0/","  We present a multi-channel P2P Video-on-Demand (VoD) system using
""plug-and-play"" helpers. Helpers are heterogenous ""micro-servers"" with limited
storage, bandwidth and number of users they can serve simultaneously. Our
proposed system has the following salient features: (1) it minimizes the server
load; (2) it is distributed, and requires little or no maintenance overhead and
which can easily adapt to system dynamics; and (3) it is adaptable to varying
supply and demand patterns across multiple video channels irrespective of video
popularity. Our proposed solution jointly optimizes over helper-user topology,
video storage allocation and bandwidth allocation. The combinatorial nature of
the problem and the system demand for distributed algorithms makes the problem
uniquely challenging. By utilizing Lagrangian decomposition and Markov chain
approximation based arguments, we address this challenge by designing two
distributed algorithms running in tandem: a primal-dual storage and bandwidth
allocation algorithm and a ""soft-worst-neighbor-choking"" topology-building
algorithm. Our scheme provably converges to a near-optimal solution, and is
easy to implement in practice. Simulation results validate that the proposed
scheme achieves minimum sever load under highly heterogeneous combinations of
supply and demand patterns, and is robust to system dynamics of user/helper
churn, user/helper asynchrony, and random delays in the network.
","[{""version"":""v1"",""created"":""Wed, 24 Nov 2010 19:56:18 GMT""}]","2010-11-25"
"1011.5470","Fabian Kuhn","Fabian Kuhn and Thomas Moscibroda and Roger Wattenhofer","Local Computation: Lower and Upper Bounds","53 pages, preliminary version in ACM PODC 2004 and ACM-SIAM SODA 2006",,,,"cs.DC","http://arxiv.org/licenses/nonexclusive-distrib/1.0/","  The question of what can be computed, and how efficiently, are at the core of
computer science. Not surprisingly, in distributed systems and networking
research, an equally fundamental question is what can be computed in a
\emph{distributed} fashion. More precisely, if nodes of a network must base
their decision on information in their local neighborhood only, how well can
they compute or approximate a global (optimization) problem? In this paper we
give the first poly-logarithmic lower bound on such local computation for
(optimization) problems including minimum vertex cover, minimum (connected)
dominating set, maximum matching, maximal independent set, and maximal
matching. In addition we present a new distributed algorithm for solving
general covering and packing linear programs. For some problems this algorithm
is tight with the lower bounds, for others it is a distributed approximation
scheme. Together, our lower and upper bounds establish the local computability
and approximability of a large class of problems, characterizing how much local
information is required to solve these tasks.
","[{""version"":""v1"",""created"":""Wed, 24 Nov 2010 19:56:31 GMT""},{""version"":""v2"",""created"":""Thu, 31 Mar 2016 09:39:37 GMT""}]","2016-04-01"
"1011.5471","Abed Bounemoura","Abed Bounemoura (WMI)","Effective stability for Gevrey and finitely differentiable prevalent
  Hamiltonians",,,"10.1007/s00220-011-1306-x",,"math.DS","http://arxiv.org/licenses/nonexclusive-distrib/1.0/","  For perturbations of integrable Hamiltonians systems, the Nekhoroshev theorem
shows that all solutions are stable for an exponentially long interval of time,
provided the integrable part satisfies a steepness condition and the system is
analytic. This fundamental result has been extended in two distinct directions.
The first one is due to Niederman, who showed that under the analyticity
assumption, the result holds true for a prevalent class of integrable systems
which is much wider than the steep systems. The second one is due to
Marco-Sauzin but it is limited to quasi-convex integrable systems, for which
they showed exponential stability if the system is assumed to be only Gevrey
regular. If the system is finitely differentiable, the author showed polynomial
stability, still in the quasi-convex case. The goal of this work is to
generalize all these results in a unified way, by proving exponential or
polynomial stability for Gevrey or finitely differentiable perturbations of
prevalent integrable Hamiltonian systems.
","[{""version"":""v1"",""created"":""Wed, 24 Nov 2010 19:56:41 GMT""}]","2015-05-20"
"1011.5472","Sebastien Gouezel","Artur Avila (IMJ), Sebastien Gouezel (IRMAR)","Small eigenvalues of the Laplacian for algebraic measures in moduli
  space, and mixing properties of the Teichm\""uller flow","42 pages",,,,"math.DS math.DG","http://arxiv.org/licenses/nonexclusive-distrib/1.0/","  We consider the $SL(2,R)$ action on moduli spaces of quadratic differentials.
If $\mu$ is an $SL(2,R)$-invariant probability measure, crucial information
about the associated representation on $L^2(\mu)$ (and in particular, fine
asymptotics for decay of correlations of the diagonal action, the Teichm\""uller
flow) is encoded in the part of the spectrum of the corresponding foliated
hyperbolic Laplacian that lies in $(0,1/4)$ (which controls the contribution of
the complementary series). Here we prove that the essential spectrum of an
invariant algebraic measure is contained in $[1/4,\infty)$, i.e., for every
$\delta>0$, there are only finitely many eigenvalues (counted with
multiplicity) in $(0,1/4-\delta)$. In particular, all algebraic invariant
measures have a spectral gap.
","[{""version"":""v1"",""created"":""Wed, 24 Nov 2010 19:57:50 GMT""}]","2010-11-25"
"1011.5473","Peter Haissinsky","Peter Haissinsky (LATP), Kevin M. Pilgrim","Quasisymmetrically inequivalent hyperbolic Julia sets",,"Revista Matem\'atica Iberoamericana 28, 4 (2012) 1025 -- 1034",,,"math.DS","http://arxiv.org/licenses/nonexclusive-distrib/1.0/","  We give explicit examples of pairs of Julia sets of hyperbolic rational maps
which are homeomorphic but not quasisymmetrically homeomorphic.
","[{""version"":""v1"",""created"":""Wed, 24 Nov 2010 19:58:17 GMT""}]","2013-02-11"
"1011.5474","Francois Mauger","Francois Mauger (CPT), Adam Kamor, Cristel Chandre (CPT), Turgay Uzer","Delayed double ionization as a signature of Hamiltonian chaos",,"Physical Review E 85, 6 (2012) 066205","10.1103/PhysRevE.85.066205",,"physics.atom-ph","http://arxiv.org/licenses/nonexclusive-distrib/1.0/","  We analyze the dynamical processes behind delayed double ionization of atoms
subjected to strong laser pulses. Using reduced models, we show that these
processes are a signature of Hamiltonian chaos which results from the
competition between the laser field and the Coulomb attraction to the nucleus.
In particular, we exhibit the paramount role of the unstable manifold of
selected periodic orbits which lead to a delay in these double ionizations.
Among delayed double ionizations, we consider the case of ""Recollision
Excitation with Subsequent Ionization"" (RESI) and, as a hallmark of this
mechanism, we predict oscillations in the ratio of RESI to double ionization
yields versus laser intensity. We discuss the significance of the
dimensionality of the reduced models for the analysis of the dynamical
processes behind delayed double ionization.
","[{""version"":""v1"",""created"":""Wed, 24 Nov 2010 19:59:15 GMT""},{""version"":""v2"",""created"":""Wed, 15 Feb 2012 14:12:57 GMT""}]","2012-06-19"
"1011.5475","Reiner Birkl","Reiner Birkl, Nikolaos Stergioulas, Ewald M\""uller","Stationary, Axisymmetric Neutron Stars with Meridional Circulation in
  General Relativity",,"Phys.Rev.D84:023003,2011","10.1103/PhysRevD.84.023003",,"gr-qc astro-ph.HE astro-ph.SR","http://arxiv.org/licenses/nonexclusive-distrib/1.0/","  We present the first stationary, axisymmetric neutron star models with
meridional circulation in general relativity. For that purpose, we developed
GRNS, a new code based on a fixed point iteration. We find a two-dimensional
set of meridional circulation modes, which differ by the number of vortices in
the stream lines of the neutron star fluid. For expected maximal meridional
circulation velocities of about 1000 km/s, the vortices cause surface
deformations of about a percent. The deformations depend on the shape of the
vortices close to the surface and increase with the meridional circulation
velocity. We also computed models of rotating neutron stars with meridional
circulation, where neither the surface rotates nor does the rotation velocity
exceed the circulation velocity.
","[{""version"":""v1"",""created"":""Wed, 24 Nov 2010 20:00:22 GMT""}]","2011-08-04"
"1011.5476","Olivier Dudas","Olivier Dudas (MI)","Coxeter orbits and Brauer trees","v2: minor corrections (including the Brauer tree of 2G2)","Advances in Mathematics 229, 6 (2012) 3398--3435","10.1016/j.aim.2012.02.011",,"math.RT math.GR","http://arxiv.org/licenses/nonexclusive-distrib/1.0/","  We study the cohomology with modular coefficients of Deligne-Lusztig
varieties associated to Coxeter elements. Under some torsion-free assumption on
the cohomology we derive several results on the principal l-block of a finite
reductive group G(F_q) when the order of q modulo l is assumed to be the
Coxeter number. These results include the determination of the planar embedded
Brauer tree of the block (as conjectured by Hiss, L\""ubeck and Malle) and the
derived equivalence predicted by the geometric version of Brou\'e's conjecture.
","[{""version"":""v1"",""created"":""Wed, 24 Nov 2010 20:03:02 GMT""},{""version"":""v2"",""created"":""Fri, 13 Jan 2012 07:56:51 GMT""}]","2012-04-11"
"1011.5477","Riccardo Cenci","The BABAR Collaboration, P. del Amo Sanchez, et al","Search for CP Violation in the Decay D+/- -> Ks pi+/-","7 pages, 3 figures, submitted to Phys. Rev. Lett","Phys.Rev.D83:071103,2011","10.1103/PhysRevD.83.071103",,"hep-ex","http://arxiv.org/licenses/nonexclusive-distrib/1.0/","  We report on a search for CP violation in the decay $ D^\pm \to
K^0_{\scriptscriptstyle S} \pi^\pm $ using a data set corresponding to an
integrated luminosity of $ 469\,\,fb^{-1} $ collected with the \slshape
B\kern-0.1em{\smaller A}\kern-0.1em B\kern-0.1em{\smaller A\kern-0.2em R}
detector at the PEP-II asymmetric energy $e^+e^-$ storage rings. The
CPviolating decay rate asymmetry $A_{CP}$ is determined to be $(-0.44 \pm 0.13
\mathrm{(stat)} \pm 0.10 \mathrm{(syst)})%$, consistent with zero at 2.7
$\sigma$ and with the standard model prediction of $(-0.332 \pm 0.006)%$. This
is currently the most precise measurement of this parameter.
","[{""version"":""v1"",""created"":""Wed, 24 Nov 2010 20:03:51 GMT""},{""version"":""v2"",""created"":""Mon, 29 Nov 2010 16:45:09 GMT""},{""version"":""v3"",""created"":""Wed, 9 Feb 2011 20:39:34 GMT""},{""version"":""v4"",""created"":""Fri, 25 Mar 2011 10:50:34 GMT""}]","2011-06-07"
"1011.5478","Olivier Dudas","Olivier Dudas (MI)","Coxeter orbits and Brauer trees II",,,,,"math.RT math.GR","http://arxiv.org/licenses/nonexclusive-distrib/1.0/","  The purpose of this paper is to discuss the validity of the assumptions (W)
and (S) stated in a previous work, about the torsion in the modular l-adic
cohomology of Deligne-Lusztig varieties associated to Coxeter elements. We
prove that both (W) and (S) hold except for groups of type E_7 or E_8.
","[{""version"":""v1"",""created"":""Wed, 24 Nov 2010 20:05:16 GMT""},{""version"":""v2"",""created"":""Wed, 20 Mar 2013 07:50:53 GMT""}]","2013-03-21"
"1011.5479","Sandrine Grellier","Patrick G\'erard (LM-Orsay), Sandrine Grellier (MAPMO)","Invariant tori for the cubic Szeg\""o equation",,,,,"math.CV math.AP","http://arxiv.org/licenses/nonexclusive-distrib/1.0/","  We continue the study of the following Hamiltonian equation on the Hardy
space of the circle, $$i\partial _tu=\Pi(|u|^2u)\ ,$$ where $\Pi $ denotes the
Szeg\""o projector. This equation can be seen as a toy model for totally non
dispersive evolution equations. In a previous work, we proved that this
equation admits a Lax pair, and that it is completely integrable. In this
paper, we construct the action-angle variables, which reduces the explicit
resolution of the equation to a diagonalisation problem. As a consequence, we
solve an inverse spectral problem for Hankel operators. Moreover, we establish
the stability of the corresponding invariant tori. Furthermore, from the
explicit formulae, we deduce the classification of orbitally stable and
unstable traveling waves.
","[{""version"":""v1"",""created"":""Wed, 24 Nov 2010 20:06:20 GMT""}]","2010-11-25"
"1011.5480","Gabriel Synnaeve","Gabriel Synnaeve (LIG), Pierre Bessiere (LPPA)","Bayesian Modeling of a Human MMORPG Player","30th international workshop on Bayesian Inference and Maximum
  Entropy, Chamonix : France (2010)",,"10.1063/1.3573658",,"cs.AI","http://arxiv.org/licenses/nonexclusive-distrib/1.0/","  This paper describes an application of Bayesian programming to the control of
an autonomous avatar in a multiplayer role-playing game (the example is based
on World of Warcraft). We model a particular task, which consists of choosing
what to do and to select which target in a situation where allies and foes are
present. We explain the model in Bayesian programming and show how we could
learn the conditional probabilities from data gathered during human-played
sessions.
","[{""version"":""v1"",""created"":""Wed, 24 Nov 2010 20:07:49 GMT""}]","2015-05-20"
"1011.5481","Zyed Bouzarkouna","Zyed Bouzarkouna (IFP, INRIA Saclay - Ile de France), Didier Yu Ding
  (IFP), Anne Auger (INRIA Saclay - Ile de France)","Using Evolution Strategy with Meta-models for Well Placement
  Optimization","ECMOR XII - 12 th European Conference on the Mathematics of Oil
  Recovery, Oxford : Royaume-Uni (2010)",,,,"cs.CE","http://arxiv.org/licenses/nonexclusive-distrib/1.0/","  Optimum implementation of non-conventional wells allows us to increase
considerably hydrocarbon recovery. By considering the high drilling cost and
the potential improvement in well productivity, well placement decision is an
important issue in field development. Considering complex reservoir geology and
high reservoir heterogeneities, stochastic optimization methods are the most
suitable approaches for optimum well placement. This paper proposes an
optimization methodology to determine optimal well location and trajectory
based upon the Covariance Matrix Adaptation - Evolution Strategy (CMA-ES) which
is a variant of Evolution Strategies recognized as one of the most powerful
derivative-free optimizers for continuous optimization. To improve the
optimization procedure, two new techniques are investigated: (1). Adaptive
penalization with rejection is developed to handle well placement constraints.
(2). A meta-model, based on locally weighted regression, is incorporated into
CMA-ES using an approximate ranking procedure. Therefore, we can reduce the
number of reservoir simulations, which are computationally expensive. Several
examples are presented. Our new approach is compared with a Genetic Algorithm
incorporating the Genocop III technique. It is shown that our approach
outperforms the genetic algorithm: it leads in general to both a higher NPV and
a significant reduction of the number of reservoir simulations.
","[{""version"":""v1"",""created"":""Wed, 24 Nov 2010 20:08:30 GMT""}]","2010-11-25"
"1011.5482","Pasquale Calabrese","Pasquale Calabrese, John Cardy, and Erik Tonni","Entanglement entropy of two disjoint intervals in conformal field theory
  II","31 pages, 4 figures","J.Stat.Mech.1101:P01021,2011","10.1088/1742-5468/2011/01/P01021","NSF-KITP-10-152, MIT-CTP 4194","hep-th cond-mat.stat-mech quant-ph","http://arxiv.org/licenses/nonexclusive-distrib/1.0/","  We continue the study of the entanglement entropy of two disjoint intervals
in conformal field theories that we started in J. Stat. Mech. (2009) P11001. We
compute Tr\rho_A^n for any integer n for the Ising universality class and the
final result is expressed as a sum of Riemann-Siegel theta functions. These
predictions are checked against existing numerical data. We provide a
systematic method that gives the full asymptotic expansion of the scaling
function for small four-point ratio (i.e. short intervals). These formulas are
compared with the direct expansion of the full results for free compactified
boson and Ising model. We finally provide the analytic continuation of the
first term in this expansion in a completely analytic form.
","[{""version"":""v1"",""created"":""Wed, 24 Nov 2010 20:08:33 GMT""}]","2011-07-21"
"1011.5483","Sebastian W\""uster","S. W\""uster, C. Ates, A. Eisfeld and J. M. Rost","Excitation transport through Rydberg dressing","22 pages + 6 pages appendices, 8 figures, replaced with revised
  version, added journal reference","New J. Phys. 13 (2011) 073044","10.1088/1367-2630/13/7/073044",,"physics.atom-ph","http://arxiv.org/licenses/nonexclusive-distrib/1.0/","  We show how to create long range interactions between alkali-atoms in
different hyper-fine ground states, allowing coherent electronic quantum state
migration. The scheme uses off resonant dressing with atomic Rydberg states,
exploiting the dipole-dipole excitation transfer that is possible between
those. Actual population in the Rydberg state is kept small. Dressing offers
large advantages over the direct use of Rydberg levels: It reduces ionisation
probabilities and provides an additional tuning parameter for life-times and
interaction-strengths. We present an effective Hamiltonian for the ground-state
manifold and show that it correctly describes the full multi-state dynamics for
up to 5 atoms.
","[{""version"":""v1"",""created"":""Wed, 24 Nov 2010 20:10:32 GMT""},{""version"":""v2"",""created"":""Thu, 25 Nov 2010 12:29:20 GMT""},{""version"":""v3"",""created"":""Mon, 22 Aug 2011 19:46:17 GMT""}]","2011-08-23"
"1011.5484","Jack Hall","Jack Hall and David Rydh","The Hilbert Stack","29 pages; major revision; no longer uses derived algebraic geometry;
  introduced Generalized Stein factorization; greatly simplified d\'evissage
  argument; two new appendices on coherent cohomology on formal schemes and
  henselian pairs","Adv. Math. 253, 2014, p. 194-233","10.1016/j.aim.2013.12.002",,"math.AG","http://arxiv.org/licenses/nonexclusive-distrib/1.0/","  Let \pi : X -> S be a morphism of algebraic stacks that is locally of finite
presentation with affine stabilizers. We prove that there is an algebraic
S-stack, the Hilbert stack, parameterizing proper algebraic stacks mapping
quasi-finitely to X. This was previously unknown, even for a morphism of
schemes.
","[{""version"":""v1"",""created"":""Wed, 24 Nov 2010 20:10:47 GMT""},{""version"":""v2"",""created"":""Thu, 20 Jun 2013 06:59:38 GMT""}]","2015-03-17"
"1011.5485","Benjamin Steinhust","Benjamin Steinhurst and Alexander Teplyaev","Existence of a Meromorphic Extension of Spectral Zeta Functions on
  Fractals",,"Lett. Math. Phys. 103 (2013), no. 12, 1377-1388","10.1007/s11005-013-0649-y",,"math.FA math-ph math.CV math.MP math.SP","http://arxiv.org/licenses/nonexclusive-distrib/1.0/","  We investigate the existence of the meromorphic extension of the spectral
zeta function of the Laplacian on self-similar fractals using the classical
results of Kigami and Lapidus (based on the renewal theory) and new results of
Hambly and Kajino based on the heat kernel estimates and other probabilistic
techniques. We also formulate conjectures which hold true in the examples that
have been analyzed in the existing literature.
","[{""version"":""v1"",""created"":""Wed, 24 Nov 2010 20:13:16 GMT""},{""version"":""v2"",""created"":""Fri, 26 Nov 2010 02:24:34 GMT""},{""version"":""v3"",""created"":""Thu, 19 May 2011 15:39:45 GMT""},{""version"":""v4"",""created"":""Sun, 8 Apr 2012 16:35:04 GMT""},{""version"":""v5"",""created"":""Mon, 5 Aug 2013 15:00:49 GMT""}]","2018-06-29"
"1011.5486","Matthew Young","K. Soundararajan and Matthew P. Young","The Prime Geodesic Theorem","13 pages","J. Reine Angew. Math. 676 (2013), 105-120","10.1515/crelle.2012.002",,"math.NT","http://arxiv.org/licenses/nonexclusive-distrib/1.0/","  We study the distribution of closed geodesics for the modular surface. We
improve the error term in the prime geodesic theorem, and obtain results on
prime geodesics in very short intervals conditionally on the generalized
Riemann Hypothesis for Dirichlet L-functions. We emphasize a connection between
the closed geodesics and certain Dirichlet L-functions.
","[{""version"":""v1"",""created"":""Wed, 24 Nov 2010 20:19:38 GMT""}]","2014-05-22"
"1011.5487","Silviu Pufu","Christopher P. Herzog, Igor R. Klebanov, Silviu S. Pufu, and Tiberiu
  Tesileanu","Multi-Matrix Models and Tri-Sasaki Einstein Spaces","36 pages, 8 figures; v2 improved section 4, refs added; v3 minor
  improvements, ref added, PRD version","Phys.Rev.D83:046001,2011","10.1103/PhysRevD.83.046001","PUPT-2359","hep-th","http://arxiv.org/licenses/nonexclusive-distrib/1.0/","  Localization methods reduce the path integrals in {\cal N} >= 2
supersymmetric Chern-Simons gauge theories on S^3 to multi-matrix integrals. A
recent evaluation of such a two-matrix integral for the {\cal N}=6
superconformal U(N) x U(N) ABJM theory produced detailed agreement with the
AdS/CFT correspondence, explaining, in particular the N^{3/2} scaling of the
free energy. We study a class of p-matrix integrals describing {\cal N}=3
superconformal U(N)^p Chern-Simons gauge theories. We present a simple method
that allows us to evaluate the eigenvalue densities and the free energies in
the large N limit keeping the Chern-Simons levels k_i fixed. The dual M-theory
backgrounds are AdS_4 x Y, where Y are seven-dimensional tri-Sasaki Einstein
spaces specified by the k_i. The gravitational free energy scales inversely
with the square root of the volume of Y. We find a general formula for the
p-matrix free energies that agrees with the available results for volumes of
the tri-Sasaki Einstein spaces Y, thus providing a thorough test of the
corresponding AdS_4/CFT_3 dualities. This formula is consistent with the
Seiberg duality conjectured for Chern-Simons gauge theories.
","[{""version"":""v1"",""created"":""Wed, 24 Nov 2010 20:20:34 GMT""},{""version"":""v2"",""created"":""Fri, 17 Dec 2010 00:27:51 GMT""},{""version"":""v3"",""created"":""Sat, 19 Mar 2011 21:19:23 GMT""}]","2015-03-17"
"1011.5488","Grzegorz Wilk","Grzegorz Wilk, Zbigniew Wlodarczyk and Wojciech Wolak","Power-law ensembles: fluctuations of volume or temperature ?","Presented at The 40th (XL) edition of the International Symposium on
  Multiparticle Dynamics, 21-25 September 2010, Antwerp (Belgium)",,,,"hep-ph nucl-th","http://arxiv.org/licenses/nonexclusive-distrib/1.0/","  We present two issues here: (i) that in situation when total energy is kept
constant recently proposed fluctuations of volume ensemble is equivalent to the
approach using Tsallis statistics with fluctuating temperature and (ii) that
the later (in which fluctuations are described by the nonextensivity parameter
q) leads to the observed experimentally sum rule connecting fluctuations of
different physical observables.
","[{""version"":""v1"",""created"":""Wed, 24 Nov 2010 20:26:37 GMT""},{""version"":""v2"",""created"":""Thu, 25 Nov 2010 09:42:24 GMT""}]","2010-11-29"
"1011.5489","Sebastian W\""uster","S. W\""uster, A. Eisfeld, and J. M. Rost","Conical intersections in an ultracold gas","4 pages, 4 figures, replacement to add archive reference",,"10.1103/PhysRevLett.106.153002",,"physics.atom-ph","http://arxiv.org/licenses/nonexclusive-distrib/1.0/","  We find that energy surfaces of more than two atoms or molecules interacting
via dipole-dipole po- tentials generically possess conical intersections (CIs).
Typically only few atoms participate strongly in such an intersection. For the
fundamental case, a circular trimer, we show how the CI affects adiabatic
excitation transport via electronic decoherence or geometric phase
interference. These phe- nomena may be experimentally accessible if the trimer
is realized by light alkali atoms in a ring trap, whose dipole-dipole
interactions are induced by off-resonant dressing with Rydberg states. Such a
setup promises a direct probe of the full many-body density dynamics near a
conical intersection.
","[{""version"":""v1"",""created"":""Wed, 24 Nov 2010 20:27:57 GMT""},{""version"":""v2"",""created"":""Thu, 25 Nov 2010 11:03:42 GMT""}]","2013-05-29"
"1011.5490","Jo\~ao Moreira","J. Moreira, B. Hiller, A. A. Osipov, and A. H. Blin","The Polyakov-Nambu-Jona-Lasinio model with six and eight quark
  interactions","3 pages, 6 figures, to appear in the conference proceedings for Quark
  Confinement and the Hadron Spectrum IX, August 30- September 3 2010, Madrid
  (Spain)",,"10.1063/1.3575028",,"hep-ph","http://arxiv.org/licenses/nonexclusive-distrib/1.0/","  The extension of the Nambu-Jona-Lasino Model with six and eight quark
interactions to include the Polyakov loop is analysed. Several interesting
features are determined to be an effect of the choice of the regularization
procedure. The use of a Pauli-Villars covariant regularization enables a
coherent and correct description of several quantities.
","[{""version"":""v1"",""created"":""Wed, 24 Nov 2010 20:28:50 GMT""},{""version"":""v2"",""created"":""Sat, 27 Nov 2010 16:43:51 GMT""}]","2015-05-20"
