"1011.5528","Serge Duarte Pinto","Serge Duarte Pinto, Matteo Alfonsi, Ian Brock, Gabriele Croci, Eric
  David, Rui de Oliveira, Leszek Ropelewski, Miranda van Stenis, Hans Taureg,
  Marco Villa","First results of spherical GEMs","Submitted to the IEEE Nuclear Science Symposium 2010 Conference
  Record. This paper won the third place Student Paper Award at the Nuclear
  Science Symposium","IEEE Nuclear Science Symposium 2010 Conference Record","10.1109/NSSMIC.2010.5874100",,"physics.ins-det","http://arxiv.org/licenses/nonexclusive-distrib/1.0/","  We developed a method to make GEM foils with a spherical geometry. Tests of
this procedure and with the resulting spherical GEMs are presented. Together
with a spherical drift electrode, a spherical conversion gap can be formed.
This eliminates the parallax error for detection of x-rays, neutrons or UV
photons when a gaseous converter is used. This parallax error limits the
spatial resolution at wide scattering angles.
  Besides spherical GEMs, we have developed curved spacers to maintain accurate
spacing, and a conical field cage to prevent edge distortion of the radial
drift field up to the limit of the angular acceptance of the detector. With
these components first tests are done in a setup with a spherical entrance
window but a planar readout structure; results will be presented and discussed.
  A flat readout structure poses difficulties, however. Therefore we will show
advanced plans to make a prototype of an entirely spherical double-GEM
detector, including a spherical 2D readout structure. This detector will have a
superior position resolution, also at wide angles, and a high rate capability.
","[{""version"":""v1"",""created"":""Wed, 24 Nov 2010 22:41:30 GMT""}]","2012-08-31"
"1011.5529","Serge Duarte Pinto","Serge Duarte Pinto (on behalf of the collaboration)","Micropattern gas detector technologies and applications, the work of the
  RD51 collaboration","Submitted to the IEEE Nuclear Science Symposium 2010 Conference
  Record","IEEE Nuclear Science Symposium 2010 Conference Record","10.1109/NSSMIC.2010.5873870",,"physics.ins-det","http://arxiv.org/licenses/nonexclusive-distrib/1.0/","  The RD51 collaboration was founded in April 2008 to coordinate and facilitate
efforts for development of micropattern gaseous detectors (MPGDs). The 75
institutes from 25 countries bundle their effort, experience and resources to
develop these emerging micropattern technologies.
  MPGDs are already employed in several nuclear and high-energy physics
experiments, medical imaging instruments and photodetection applications; many
more applications are foreseen. They outperform traditional wire chambers in
terms of rate capability, time and position resolution, granularity, stability
and radiation hardness. RD51 supports efforts to make MPGDs also suitable for
large areas, increase cost-efficiency, develop portable detectors and improve
ease-of-use.
  The collaboration is organized in working groups which develop detectors with
new geometries, study and simulate their properties, and design optimized
electronics. Among the common supported projects are creation of test
infrastructure such as beam test and irradiation facilities, and the production
workshop.
","[{""version"":""v1"",""created"":""Wed, 24 Nov 2010 22:56:31 GMT""}]","2019-08-13"
"1011.5530","Gennadiy Averkov","Gennadiy Averkov and Barbara Langfeld","On the reconstruction of planar lattice-convex sets from the covariogram","accepted in Discrete and Computational Geometry",,"10.1007/s00454-012-9416-6",,"math.MG","http://arxiv.org/licenses/nonexclusive-distrib/1.0/","  A finite subset $K$ of $\mathbb{Z}^d$ is said to be lattice-convex if $K$ is
the intersection of $\mathbb{Z}^d$ with a convex set. The covariogram $g_K$ of
$K\subseteq \mathbb{Z}^d$ is the function associating to each $u \in
\integer^d$ the cardinality of $K\cap (K+u)$. Daurat, G\'erard, and Nivat and
independently Gardner, Gronchi, and Zong raised the problem on the
reconstruction of lattice-convex sets $K$ from $g_K$. We provide a partial
positive answer to this problem by showing that for $d=2$ and under mild extra
assumptions, $g_K$ determines $K$ up to translations and reflections. As a
complement to the theorem on reconstruction we also extend the known
counterexamples (i.e., planar lattice-convex sets which are not
reconstructible, up to translations and reflections) to an infinite family of
counterexamples.
","[{""version"":""v1"",""created"":""Wed, 24 Nov 2010 23:15:49 GMT""},{""version"":""v2"",""created"":""Wed, 15 Feb 2012 07:38:47 GMT""},{""version"":""v3"",""created"":""Mon, 12 Mar 2012 15:09:20 GMT""}]","2012-03-13"
"1011.5531","Cms Collaboration","CMS Collaboration","Charged particle multiplicities in pp interactions at sqrt(s) = 0.9,
  2.36, and 7 TeV",,"JHEP 1101:079,2011","10.1007/JHEP01(2011)079","CMS-QCD-10-004, CERN-PH-EP-2010-048","hep-ex","http://arxiv.org/licenses/nonexclusive-distrib/1.0/","  Measurements of primary charged hadron multiplicity distributions are
presented for non-single-diffractive events in proton-proton collisions at
centre-of-mass energies of sqrt(s) = 0.9, 2.36, and 7 TeV, in five
pseudorapidity ranges from |eta|<0.5 to |eta|<2.4. The data were collected with
the minimum-bias trigger of the CMS experiment during the LHC commissioning
runs in 2009 and the 7 TeV run in 2010. The multiplicity distribution at
sqrt(s) = 0.9 TeV is in agreement with previous measurements. At higher
energies the increase of the mean multiplicity with sqrt(s) is underestimated
by most event generators. The average transverse momentum as a function of the
multiplicity is also presented. The measurement of higher-order moments of the
multiplicity distribution confirms the violation of Koba-Nielsen-Olesen scaling
that has been observed at lower energies.
","[{""version"":""v1"",""created"":""Wed, 24 Nov 2010 23:28:55 GMT""}]","2012-08-27"
"1011.5532","Mario I. Molina","Mario I. Molina","Boundary-induced Anderson localization in photonic lattices","three double-column pages, six figures, submitted",,"10.1016/j.physleta.2011.03.055",,"physics.optics","http://arxiv.org/licenses/nonexclusive-distrib/1.0/","  We analyze numerically localization of light in linear square waveguide
arrays restricted in one dimension (``ribbons''), whose boundaries are
disordered in propagation constant and/or coupling. We find that the disordered
boundary induces a localization tendency in the bulk even for relatively wide
ribbons.
","[{""version"":""v1"",""created"":""Wed, 24 Nov 2010 23:51:40 GMT""}]","2015-05-20"
"1011.5533","Stefan Schmeja","S. Schmeja","Identifying star clusters in a field: A comparison of different
  algorithms","13 pages, 7 tables, 6 figures; accepted by Astronomische Nachrichten","Astron. Nachr. 332 (2011), 172","10.1002/asna.201011484",,"astro-ph.GA","http://arxiv.org/licenses/nonexclusive-distrib/1.0/","  Star clusters are often hard to find, as they may lie in a dense field of
background objects or, because in the case of embedded clusters, they are
surrounded by a more dispersed population of young stars. This paper discusses
four algorithms that have been developed to identify clusters as stellar
density enhancements in a field, namely stellar density maps from star counts,
the neareast neighbour method and the Voronoi tessellation, and the separation
of minimum spanning trees. These methods are tested and compared to each other
by applying them to artificial clusters of different sizes and morphologies.
While distinct centrally concentrated clusters are detected by all methods,
clusters with low overdensity or highly hierarchical structure are only
reliably detected by methods with inherent smoothing (star counts and nearest
neighbour method). Furthermore, the algorithms differ strongly in computation
time and additional parameters they provide. Therefore, the method to choose
primarily depends on the size and character of the investigated area and the
purpose of the study.
","[{""version"":""v1"",""created"":""Wed, 24 Nov 2010 23:56:13 GMT""}]","2011-02-16"
"1011.5534","Dhananjoy Dey","Dhananjoy Dey, Prasanna Raghaw Mishra1, Indranath Sengupta","GB-hash : Hash Functions Using Groebner Basis","The paper has been withdrawn. The authors have found some weaknesses
  in this design",,,,"cs.CR math.AC","http://creativecommons.org/licenses/by/3.0/","  In this paper we present an improved version of HF-hash, viz., GB-hash : Hash
Functions Using Groebner Basis. In case of HF-hash, the compression function
consists of 32 polynomials with 64 variables which were taken from the first 32
polynomials of hidden field equations challenge-1 by forcing last 16 variables
as 0. In GB-hash we have designed the compression function in such way that
these 32 polynomials with 64 variables form a minimal Groebner basis of the
ideal generated by them with respect to graded lexicographical (grlex) ordering
as well as with respect to graded reverse lexicographical (grevlex) ordering.
In this paper we will prove that GB-hash is more secure than HF-hash as well as
more secure than SHA-256. We have also compared the efficiency of our GB-hash
with SHA-256 and HF-hash.
","[{""version"":""v1"",""created"":""Thu, 25 Nov 2010 00:14:19 GMT""},{""version"":""v2"",""created"":""Tue, 30 Aug 2011 05:04:51 GMT""}]","2011-08-31"
"1011.5535","Mark Wilde","Mark M. Wilde, Monireh Houshmand, and Saied Hosseini-Khayat","Examples of minimal-memory, non-catastrophic quantum convolutional
  encoders","5 pages, 2 figures, Accepted for the International Symposium on
  Information Theory 2011 (ISIT 2011), St. Petersburg, Russia; v2 has minor
  changes","Proceedings of the International Symposium on Information Theory
  2011 (ISIT 2011), pp. 450--454, St. Petersburg, Russia","10.1109/ISIT.2011.6034166",,"quant-ph cs.IT math.IT","http://arxiv.org/licenses/nonexclusive-distrib/1.0/","  One of the most important open questions in the theory of quantum
convolutional coding is to determine a minimal-memory, non-catastrophic,
polynomial-depth convolutional encoder for an arbitrary quantum convolutional
code. Here, we present a technique that finds quantum convolutional encoders
with such desirable properties for several example quantum convolutional codes
(an exposition of our technique in full generality will appear elsewhere). We
first show how to encode the well-studied Forney-Grassl-Guha (FGG) code with an
encoder that exploits just one memory qubit (the former Grassl-Roetteler
encoder requires 15 memory qubits). We then show how our technique can find an
online decoder corresponding to this encoder, and we also detail the operation
of our technique on a different example of a quantum convolutional code.
Finally, the reduction in memory for the FGG encoder makes it feasible to
simulate the performance of a quantum turbo code employing it, and we present
the results of such simulations.
","[{""version"":""v1"",""created"":""Thu, 25 Nov 2010 00:16:27 GMT""},{""version"":""v2"",""created"":""Sat, 21 May 2011 19:44:47 GMT""}]","2015-03-17"
"1011.5536","Chihhui Wu","Chihhui Wu, Alexander B. Khanikaev, and Gennady Shvets","Broadband Slow Light Metamaterial Based on a Double-Continuum Fano
  Resonance","5 pages, 4 figures. Submitted to PRL",,"10.1103/PhysRevLett.106.107403",,"physics.optics","http://arxiv.org/licenses/nonexclusive-distrib/1.0/","  We propose a concept of a low-symmetry three-dimensional metamaterial
exhibiting a Double- Continuum Fano (DCF) optical resonance. Such metamaterial
is described as a birefringent medium supporting a discrete ""dark""
electromagnetic state weakly coupled to the continua of two nondegen- erate
""bright"" bands of orthogonal polarizations. It is demonstrated that light
propagation through such DCF metamaterial can be slowed down over a broad
frequency range when the medium param- eters (e.g. frequency of the ""dark""
mode) are adiabatically changed along the optical path. Using a specific
metamaterial implementation, we demonstrate that the DCF approach to slow light
(SL) is superior to that of the EIT because it enables spectrally uniform group
velocity and transmission coefficient.
","[{""version"":""v1"",""created"":""Thu, 25 Nov 2010 00:16:43 GMT""}]","2015-05-20"
"1011.5537","Sachin Adlakha","Sachin Adlakha, Ramesh Johari and Gabriel Y. Weintraub","Equilibria of Dynamic Games with Many Players: Existence, Approximation,
  and Market Structure","61 pages",,,,"cs.GT","http://arxiv.org/licenses/nonexclusive-distrib/1.0/","  In this paper we study stochastic dynamic games with many players; these are
a fundamental model for a wide range of economic applications. The standard
solution concept for such games is Markov perfect equilibrium (MPE), but it is
well known that MPE computation becomes intractable as the number of players
increases. We instead consider the notion of stationary equilibrium (SE), where
players optimize assuming the empirical distribution of others' states remains
constant at its long run average. We make two main contributions. First, we
provide a rigorous justification for using SE. In particular, we provide a
parsimonious collection of exogenous conditions over model primitives that
guarantee existence of SE, and ensure that an appropriate approximation
property to MPE holds, in a general model with possibly unbounded state spaces.
Second, we draw a significant connection between the validity of SE, and market
structure: under the same conditions that imply SE exist and approximates MPE
well, the market becomes fragmented in the limit of many firms. To illustrate
this connection, we study in detail a series of dynamic oligopoly examples.
These examples show that our conditions enforce a form of ""decreasing returns
to larger states""; this yields fragmented industries in the limit. By contrast,
violation of these conditions suggests ""increasing returns to larger states""
and potential market concentration. In that sense, our work uses a fully
dynamic framework to also contribute to a longstanding issue in industrial
organization: understanding the determinants of market structure in different
industries.
","[{""version"":""v1"",""created"":""Thu, 25 Nov 2010 00:28:19 GMT""},{""version"":""v2"",""created"":""Mon, 20 Dec 2010 02:42:29 GMT""},{""version"":""v3"",""created"":""Thu, 7 Apr 2011 21:09:34 GMT""},{""version"":""v4"",""created"":""Tue, 12 Apr 2011 02:06:23 GMT""},{""version"":""v5"",""created"":""Tue, 6 Dec 2011 04:10:32 GMT""}]","2015-03-17"
"1011.5538","Matthew McGovern","Matthew McGovern, Andrew Hilliard, Tzahi Gr\""unzweig and Mikkel F.
  Andersen","Counting atoms in a deep optical microtrap",,"Optics Letters, Vol. 36, Issue 7, pp. 1041-1043 (2011)","10.1364/OL.36.001041",,"physics.optics","http://arxiv.org/licenses/nonexclusive-distrib/1.0/","  We demonstrate a method to count small numbers of atoms held in a deep,
microscopic optical dipole trap by collecting fluorescence from atoms exposed
to a standing wave of light that is blue detuned from resonance. While
scattering photons, the atoms are also cooled by a Sisyphus mechanism that
results from the spatial variation in light intensity. The use of a small blue
detuning limits the losses due to light assisted collisions, thereby making the
method suitable for counting several atoms in a microscopic volume.
","[{""version"":""v1"",""created"":""Thu, 25 Nov 2010 00:49:35 GMT""},{""version"":""v2"",""created"":""Mon, 17 Jan 2011 04:39:16 GMT""}]","2011-09-13"
"1011.5539","Mike Steel Prof.","Arne Mooers, Olivier Gascuel, Tanja Stadler, Heyang Li, Mike Steel","Branch lengths on Yule trees and the expected loss of phylogenetic
  diversity","3 figures",,,,"q-bio.PE","http://arxiv.org/licenses/nonexclusive-distrib/1.0/","  Diversification is nested, and early models suggested this could lead to a
great deal of evolutionary redundancy in the Tree of Life. This result is based
on a particular set of branch lengths produced by the common coalescent, where
pendant branches leading to tips can be very short compared to branches deeper
in the tree. Here, we analyze alternative and more realistic Yule and
birth-death models. We show how censoring at the present both makes average
branches one half what we might expect and makes pendant and interior branches
roughly equal in length. Although dependent on whether we condition on the size
of the tree, its age, or both, these results hold both for the Yule model and
for birth-death models with moderate extinction. Importantly, the rough
equivalency in interior and exterior branch lengths means the loss of
evolutionary history with loss of species can be roughly linear. Under these
models, the Tree of Life may offer limited redundancy in the face of ongoing
species loss.
","[{""version"":""v1"",""created"":""Thu, 25 Nov 2010 01:03:37 GMT""},{""version"":""v2"",""created"":""Sat, 30 Jul 2011 03:28:21 GMT""}]","2011-08-02"
"1011.5540","Bo Gu","B. Gu, I. Sugai, T. Ziman, G. Y. Guo, N. Nagaosa, T. Seki, K.
  Takanashi, and S. Maekawa","Surface-assisted Spin Hall Effect in Au Films with Pt Impurities","4 pages, 2 figures","Phys. Rev. Lett. 105, 216401 (2010)","10.1103/PhysRevLett.105.216401",,"cond-mat.mtrl-sci","http://arxiv.org/licenses/nonexclusive-distrib/1.0/","  We show, both experimentally and theoretically, a novel route to obtain giant
room temperature spin Hall effect due to surface-assisted skew scattering. In
the experiment, we report the spin Hall effect in Pt-doped Au films with
different thicknesses $t_N$. The giant spin Hall angle $\gamma_S$ = $0.12 \pm
0.04$ is obtained for $t_N$ = 10 nm at room temperature, while it is much
smaller for $t_N$ = 20 nm sample. Combined ab initio and quantum Monte Carlo
calculations for the skew scattering due to a Pt impurity show $\gamma_S$
$\cong$ 0.1 on the Au (111) surface, while it is small in bulk Au. The quantum
Monte Carlo results show that the spin-orbit interaction of the Pt impurity on
the Au (111) surface is enhanced, because the Pt 5d levels are lifted to the
Fermi level due to the valence fluctuation. In addition, there are two
spin-orbit interaction channels on the Au (111) surface, while only one in bulk
Au.
","[{""version"":""v1"",""created"":""Thu, 25 Nov 2010 01:15:13 GMT""}]","2015-05-20"
"1011.5541","Sergei Ipatov","Sergei I. Ipatov and Michael F. A'Hearn","Deep Impact ejection from Comet 9P/Tempel 1 as a triggered outburst","4 pages (including 2 figures) Proceedings of the International
  Astronomical Union, IAU Symposium, IAU vol. 5, Symposium S263, ""Icy bodies in
  the Solar System"" (Rio de Janeiro, Brazil, 3-7 August, 2009), ed. by J.A.
  Fernandez, D. Lazzaro, D. Prialnik, R. Schulz, Cambridge University Press,
  pp. 317-321. (2010)",,"10.1017/S1743921310002000",,"astro-ph.EP","http://arxiv.org/licenses/nonexclusive-distrib/1.0/","  Ejection of material after the Deep Impact collision with Comet Tempel 1 was
studied based on analysis of the images made by the Deep Impact cameras during
the first 13 minutes after impact. Analysis of the images shows that there was
a local maximum of the rate of ejection at time of ejection ~10 s with typical
velocities ~100 m/s. At the same time, a considerable excessive ejection in a
few directions began, the direction to the brightest pixel changed by ~50 deg,
and there was a local increase of brightness of the brightest pixel. The
ejection can be considered as a superposition of the normal ejection and the
longer triggered outburst.
","[{""version"":""v1"",""created"":""Thu, 25 Nov 2010 01:55:38 GMT""}]","2010-11-29"
"1011.5542","Minglei Kang","Minglei Kang, Yuanrong Lu, Zhi Wang, Kun Zhu, Xueqing Yan, Shuli Gao,
  Shixiang Peng, Zhiyu Guo, Jiaxun Fang, Jiaer Chen","Beam optimization of RFQ and SFRFQ combined accelerator at Peking
  University","7 pages,9 figures",,,,"physics.acc-ph","http://arxiv.org/licenses/nonexclusive-distrib/1.0/","  The Peking University Integral Split Ring Radio Frequency Quadrupole(ISR RFQ)
accelerator was constructed in 1999 with a high duty factor 16.7% and
repetition frequency 166Hz, and it was able to accelerate N+, O+,O-, C+ and He+
from 1.6kev/u to 65keV/u. It was later upgraded as an injector of the Separated
Function RFQ (SFRFQ). The experiments indicated that the maximum accelerated O+
beam current could exceed 3.2mA with energy 1.03MeV and an energy spread (FWHM)
3.1%. Then the beam transports through a 1m-long magnetic triplet to the
entrance of SFRFQ and is finally accelerated to 1.64MeV. The beam conditioning
of RFQ were carefully optimized to satisfy the requirements of the SFRFQ. The
combined accelerator eventually can deliver 0.53mA O+ beam with energy 1.65MeV,
which has sufficiently demonstrated the feasibility of the SFRFQ structure.
","[{""version"":""v1"",""created"":""Thu, 25 Nov 2010 01:56:03 GMT""}]","2010-11-29"
"1011.5543","Gang Wang","Gang Wang (for the STAR Collaboration)","Non-photonic electron-hadron correlations and non-photonic electron
  $v_2$ at STAR/RHIC","4 pages, 5 figures, proceedings for Hard Probe 2010","Nucl.Phys.A855:319-322,2011","10.1016/j.nuclphysa.2011.02.069",,"nucl-ex","http://arxiv.org/licenses/nonexclusive-distrib/1.0/","  Non-photonic electrons (when $p_T >$ 3 GeV/$c$) represent the directions of
the parent heavy quarks, and their angular correlations with charged hadrons
provide a unique tool to study the relative contributions from $D$ and B meson
decays in p+p collisions, as well as the flavor-dependence of the energy loss
mechanism in A+A collisions. We review the disentanglement of charm and bottom
contributions to non-photonic electrons in p+p collisions at $\sqrt{s} = 200$
GeV at RHIC. B decay contribution is approximately 50$ at the electron
transverse momentum of $p_{T} > 5$ GeV/$c$ from STAR results. Incorporating the
energy loss information of non-photonic electrons, the result indicates a B
meson suppression at high $p_T$ in heavy ion collisions. We also present
non-photonic electron-hadron correlations in d+Au collisions as a baseline
reference for the investigation of the heavy quark energy loss in A+A
collisions. Heavy quark energy loss and heavy quark evolution in the QCD medium
can lead to a finite ""elliptic flow"" parameter ($v_2$) of $D$ and $B$ mesons
which can be studied through $v_2$ of non-photonic electrons. Preliminary $v_2$
measurements for non-photonic electrons are shown to be lower than $v_2$ of
charged hadrons (or $K_S^0$, $\Lambda$) for 200 GeV Au+Au collisions.
","[{""version"":""v1"",""created"":""Thu, 25 Nov 2010 02:56:10 GMT""},{""version"":""v2"",""created"":""Mon, 20 Dec 2010 20:13:36 GMT""}]","2011-08-04"
"1011.5544","Sergei Ipatov","Sergei I. Ipatov","Angular momentum of two collided rarefied preplanetesimals and formation
  of binaries","4 pages. Proceedings of the International Astronomical Union, IAU
  Symposium, IAU vol. 5, Symposium S263, ""Icy bodies in the Solar System"" (Rio
  de Janeiro, Brazil, 3-7 August, 2009), ed. by J.A. Fernandez, D. Lazzaro, D.
  Prialnik, R. Schulz, Cambridge University Press, pp. 37-40 (2010)",,"10.1017/S1743921310001468",,"astro-ph.EP","http://arxiv.org/licenses/nonexclusive-distrib/1.0/","  The mean angular momentum associated with the collision of two celestial
objects moving in almost circular heliocentric orbits was studied. The results
of these studies were used to develop models of the formation of binaries at
the stage of rarefied preplanetesimals. The models can explain a greater
fraction of binaries formed at greater distances from the Sun. Sometimes there
could be two centers of contraction inside the rotating preplanetesimal formed
as the result of a collision between two rarefied preplanetesimals. Such
formation of binaries could result in binaries with almost the same masses of
components separated by a large distance. Formation of a disk around the
primary could result because the angular momentum that was obtained by a
rarefied preplanetesimal formed by collision was greater than the critical
angular momentum for a solid body. One or several satellites of the primary
could be formed from the disk.
","[{""version"":""v1"",""created"":""Thu, 25 Nov 2010 02:59:13 GMT""}]","2010-11-29"
"1011.5545","Xiao-Shan Gao","Shangwei Zhao, Ruyong Feng and Xiao-Shan Gao","On Functional Decomposition of Multivariate Polynomials with
  Differentiation and Homogenization",,,,,"cs.CR cs.SC","http://arxiv.org/licenses/nonexclusive-distrib/1.0/","  In this paper, we give a theoretical analysis for the algorithms to compute
functional decomposition for multivariate polynomials based on differentiation
and homogenization which are proposed by Ye, Dai, Lam (1999) and Faug$\mu$ere,
Perret (2006, 2008, 2009). We show that a degree proper functional
decomposition for a set of randomly decomposable quartic homogenous polynomials
can be computed using the algorithm with high probability. This solves a
conjecture proposed by Ye, Dai, and Lam (1999). We also propose a conjecture
such that the decomposition for a set of polynomials can be computed from that
of its homogenization with high probability. Finally, we prove that the right
decomposition factors for a set of polynomials can be computed from its right
decomposition factor space. Combining these results together, we prove that the
algorithm can compute a degree proper decomposition for a set of randomly
decomposable quartic polynomials with probability one when the base field is of
characteristic zero, and with probability close to one when the base field is a
finite field with sufficiently large number under the assumption that the
conjeture is correct.
","[{""version"":""v1"",""created"":""Thu, 25 Nov 2010 03:11:19 GMT""}]","2010-11-29"
