"1009.3685","Angiola Orlando","A. Orlando, R.W Aikin, M. Amiri, J.J. Bock, J.A. Bonetti, J.A. Brevik,
  B. Burger, G. Chattopadthyay, P.K. Day, J.P. Filippini, S.R. Golwala, M.
  Halpern, M. Hasselfield, G.C. Hilton, K.D. Irwin, M. Kenyon, J.M. Kovac, C.L.
  Kuo, A.E. Lange, H.G. LeDuc, N. Llombart, H.T. Nguyen, R.W. Ogburn, C.D.
  Reintsema, M.C. Runyan, Z. Staniszewski, R. Sudiwala, G. Teply, A.R.
  Trangsrud, A.D. Turner, P. Wilson","Antenna-coupled TES Bolometer Arrays for BICEP2/Keck and SPIDER","10 pages, 7 figures; SPIE proceedings for Millimeter, Submillimeter
  and Far-Infrared Detectors and Instrumentation for Astronomy V (Conference
  7741, June 2010, San Diego, CA, USA)",,"10.1117/12.857914",,"astro-ph.IM astro-ph.CO","http://arxiv.org/licenses/nonexclusive-distrib/1.0/","  BICEP2/Keck and SPIDER are cosmic microwave background (CMB) polarimeters
targeting the B-mode polarization induced by primordial gravitational waves
from inflation. They will be using planar arrays of polarization sensitive
antenna-coupled TES bolometers, operating at frequencies between 90 GHz and 220
GHz. At 150 GHz each array consists of 64 polarimeters and four of these arrays
are assembled together to make a focal plane, for a total of 256
dual-polarization elements (512 TES sensors). The detector arrays are
integrated with a time-domain SQUID multiplexer developed at NIST and read out
using the multi-channels electronics (MCE) developed at the University of
British Columbia. Following our progress in improving detector parameters
uniformity across the arrays and fabrication yield, our main effort has focused
on improving detector arrays optical and noise performances, in order to
produce science grade focal planes achieving target sensitivities. We report on
changes in detector design implemented to optimize such performances and
following focal plane arrays characterization. BICEP2 has deployed a first 150
GHz science grade focal plane to the South Pole in December 2009.
","[{""version"":""v1"",""created"":""Mon, 20 Sep 2010 03:24:02 GMT""}]","2015-05-20"
"1009.3686","Austin Fowler","David S. Wang, Austin G. Fowler, Lloyd C. L. Hollenberg","Quantum computing with nearest neighbor interactions and error rates
  over 1%","4 pages, 8 figures","Phys. Rev. A 83, 020302(R) (2011)","10.1103/PhysRevA.83.020302",,"quant-ph","http://arxiv.org/licenses/nonexclusive-distrib/1.0/","  Large-scale quantum computation will only be achieved if experimentally
implementable quantum error correction procedures are devised that can tolerate
experimentally achievable error rates. We describe a quantum error correction
procedure that requires only a 2-D square lattice of qubits that can interact
with their nearest neighbors, yet can tolerate quantum gate error rates over
1%. The precise maximum tolerable error rate depends on the error model, and we
calculate values in the range 1.1--1.4% for various physically reasonable
models. Even the lowest value represents the highest threshold error rate
calculated to date in a geometrically constrained setting, and a 50%
improvement over the previous record.
","[{""version"":""v1"",""created"":""Mon, 20 Sep 2010 03:40:10 GMT""}]","2011-02-22"
"1009.3687","Xiao Wen Han","Xiaowen Han, David Zhu, Cuifeng Zhou","3-SAT Polynomial Solution of Knowledge Recognition Algorithm",,,,,"cs.CC","http://arxiv.org/licenses/nonexclusive-distrib/1.0/","  This paper introduces a knowledge recognition algorithm (KRA) for solving the
3SAT problem in polynomial time. KRA learns member-class relations and
retrieves information through deductive and reductive iterative reasoning. It
applies the principle of Chinese COVA* (equivalent to a set of eight 3-variable
conjunctive clauses) and eliminates the ""OR"" operation to solve 3-SAT problem.
That is, KRA does not search the assignment directly. It recognizes the
complements as rejections at each level of the set through iterative set
relation recognition. KRA recognizes which conjunctive 3-variable-clause is not
satisfiable. If all the eight clauses of any set of 3-variable clauses are
rejected, then there is not an assignment for the formula. If there is at least
one clause in each set that remains, then there is at least one assignment that
is the union of clauses of each set. If there is more than one clause in each
set that remains, then there are multiple assignments that are the unions of
the clauses of each set respectively.
","[{""version"":""v1"",""created"":""Mon, 20 Sep 2010 03:55:13 GMT""},{""version"":""v10"",""created"":""Thu, 25 Nov 2010 03:05:19 GMT""},{""version"":""v11"",""created"":""Mon, 6 Dec 2010 01:07:34 GMT""},{""version"":""v12"",""created"":""Thu, 9 Dec 2010 23:42:06 GMT""},{""version"":""v2"",""created"":""Mon, 4 Oct 2010 01:03:53 GMT""},{""version"":""v3"",""created"":""Sat, 9 Oct 2010 17:33:55 GMT""},{""version"":""v4"",""created"":""Wed, 20 Oct 2010 21:09:49 GMT""},{""version"":""v5"",""created"":""Mon, 1 Nov 2010 16:28:19 GMT""},{""version"":""v6"",""created"":""Tue, 2 Nov 2010 17:06:34 GMT""},{""version"":""v7"",""created"":""Thu, 4 Nov 2010 16:48:41 GMT""},{""version"":""v8"",""created"":""Mon, 8 Nov 2010 03:02:21 GMT""},{""version"":""v9"",""created"":""Mon, 22 Nov 2010 02:17:19 GMT""}]","2010-12-13"
"1009.3688","Masato Nozawa","Masato Nozawa and Kei-ichi Maeda","Cosmological rotating black holes in five-dimensional fake supergravity","24 pages, 2 figures; v2: references added, to appear in PRD","Phys.Rev.D83:024018,2011","10.1103/PhysRevD.83.024018",,"hep-th astro-ph.CO gr-qc","http://arxiv.org/licenses/nonexclusive-distrib/1.0/","  In recent series of papers, we found an arbitrary dimensional, time-evolving
and spatially-inhomogeneous solutions in Einstein-Maxwell-dilaton gravity with
particular couplings. Similar to the supersymmetric case the solution can be
arbitrarily superposed in spite of non-trivial time-dependence, since the
metric is specified by a set of harmonic functions. When each harmonic has a
single point source at the center, the solution describes a spherically
symmetric black hole with regular Killing horizons and the spacetime approaches
asymptotically to the Friedmann-Lema\^itre-Robertson-Walker (FLRW) cosmology.
We discuss in this paper that in 5-dimensions this equilibrium condition traces
back to the 1st-order ""Killing spinor"" equation in ""fake supergravity"" coupled
to arbitrary U(1) gauge fields and scalars. We present a 5-dimensional,
asymptotically FLRW, rotating black-hole solution admitting a nontrivial
""Killing spinor,"" which is a spinning generalization of our previous solution.
We argue that the solution admits nondegenerate and rotating Killing horizons
in contrast with the supersymmetric solutions. It is shown that the present
pseudo-supersymmetric solution admits closed timelike curves around the central
singularities. When only one harmonic is time-dependent, the solution oxidizes
to 11-dimensions and realizes the dynamically intersecting M2/M2/M2-branes in a
rotating Kasner universe. The Kaluza-Klein type black holes are also discussed.
","[{""version"":""v1"",""created"":""Mon, 20 Sep 2010 03:57:56 GMT""},{""version"":""v2"",""created"":""Tue, 28 Dec 2010 01:20:37 GMT""}]","2011-02-02"
"1009.3689","J. H.  Gao","Jin-Hua Gao, Jie Yuan, Wei-Qiang Chen, Yi Zhou, Fu-Chun Zhang","Giant mesoscopic spin Hall effect on surface of topological insulator","5 pages, 3 figures","Phys. Rev. Lett. 106, 057205 (2011)","10.1103/PhysRevLett.106.057205",,"cond-mat.mes-hall","http://arxiv.org/licenses/nonexclusive-distrib/1.0/","  We study mesoscopic spin Hall effect on the surface of topological insulator
with a step-function potential. The giant spin polarization induced by a
transverse electric current is derived analytically by using McMillan method in
the ballistic transport limit, which oscillates across the potential boundary
with no confinement from the potential barrier due to the Klein paradox, and
should be observable in spin resolved scanning tunneling microscope.
","[{""version"":""v1"",""created"":""Mon, 20 Sep 2010 04:01:48 GMT""}]","2011-05-05"
"1009.3690","Graciela B. Gelmini","Graciela Gelmini and Paolo Gondolo","DM production mechanisms","27 pages, 8 figures","From 'Particle Dark Matter: Observations, Models and Searches',
  edited by G. Bertone (Cambridge U. Press, Cambridge 2010) Chap.7, p.121-141",,,"astro-ph.CO hep-ph","http://arxiv.org/licenses/nonexclusive-distrib/1.0/","  We review the mechanism of production of dark matter particles in the early
Universe, both in standard and non-standard pre-Big Bang Nucleosynthesis
cosmologies. We concentrate mostly on the production of WIMPs.
","[{""version"":""v1"",""created"":""Mon, 20 Sep 2010 04:11:15 GMT""}]","2010-09-21"
"1009.3691","Changqing Jin","J. L. Zhang, S. J. Zhang, H. M. Weng, W. Zhang, L. X. Yang, Q. Q. Liu,
  S. M. Feng, X. C. Wang, R. C. Yu, L. Z. Cao, L. Wang, W. G. Yang, H. Z. Liu,
  W. Y. Zhao, S. C. Zhang, X. Dai, Z. Fang, C. Q. Jin","Pressure induced Superconductivity in Topological Compound Bi2Te3","Published ahead of print December 20, 2010,
  doi:10.1073/pnas.1014085108","Proceedings Nat Aca Sci USA (PNAS) 108(1), 24 ~28(2011)","10.1073/pnas.1014085108",,"cond-mat.supr-con cond-mat.mtrl-sci quant-ph","http://arxiv.org/licenses/nonexclusive-distrib/1.0/","  Bi2Te3 compound has been theoretically predicted (1) to be a topological
insulator, and its topologically non-trivial surface state with a single Dirac
cone has been observed in photoemission experiments (2). Here we report that
superconductivity (Tc^~3K) can be induced in Bi2Te3 as-grown single crystal
(with hole-carriers) via pressure. The first-principles calculations show that
the electronic structure under pressure remains to be topologically nontrivial,
and the Dirac-type surface states can be well distinguished from bulk states at
corresponding Fermi level. The proximity effect between superconducting bulk
states and Dirac-type surface state could generate Majorana fermions on the
surface. We also discuss the possibility that the bulk state could be a
topological superconductor.
","[{""version"":""v1"",""created"":""Mon, 20 Sep 2010 04:20:12 GMT""},{""version"":""v2"",""created"":""Sat, 8 Jan 2011 16:38:23 GMT""}]","2011-01-11"
"1009.3692","Fabricio Augusto Barone Rangel","F. A. Barone, F. E. Barone, J. A. Helayel-Neto","Charged branes interactions via Kalb-Ramond field","12 latex pages, more general results","Phys. Rev. D 84, 065026 (2011)","10.1103/PhysRevD.84.065026",,"hep-th","http://arxiv.org/licenses/nonexclusive-distrib/1.0/","  Because of its versatility, the 2-form field has been employed to describe a
multitude of scenarios that range from high energy to condensed matter physics.
Pushing forward in this endeavor we study the interaction energy, intermediated
by this kind of field, between branes in a variety of configurations. Also, the
so-called Cremmer-Scherk-Kalb-Ramond model, which consists of the
electromagnetic field coupled to the Kalb-Ramond gauge potential, is
considered. It turns out that these models exhibit a much richer class of
sources than usually thought, able to intermediate novel forms of interactions
in different scenarios.
","[{""version"":""v1"",""created"":""Mon, 20 Sep 2010 04:38:34 GMT""},{""version"":""v2"",""created"":""Sat, 18 Feb 2012 03:23:14 GMT""}]","2022-05-17"
"1009.3693","Julian Berengut","J. C. Berengut and V. V. Flambaum","Astronomical and laboratory searches for space-time variation of
  fundamental constants","Invited review talk (Flambaum) at ICAP 2010, Cairns, Australia","J.Phys.Conf.Ser.264:012010,2011","10.1088/1742-6596/264/1/012010",,"physics.atom-ph astro-ph.CO","http://arxiv.org/licenses/nonexclusive-distrib/1.0/","  We review recent activity searching for variations in the fundamental
constants of nature in quasar absorption spectra and in the laboratory. While
research in this direction has been ongoing for many decades, the topic has
recently been stimulated by astronomical evidence for spatial variation in the
fine-structure constant, alpha. This result could be confirmed using different
quasar data and atomic clock measurements, but there are significant challenges
to obtain the required accuracy. We review existing measurements and discuss
some of the most promising systems where any variations would be strongly
enhanced.
","[{""version"":""v1"",""created"":""Mon, 20 Sep 2010 04:56:43 GMT""}]","2011-02-02"
"1009.3694","Christoph Marx","C. A. Marx","Continuity of spectral averaging",,"Proc. Math. Soc., posted on August 20, 2010, PII S
  0002-9939(2010)10629-9",,,"math-ph math.MP","http://arxiv.org/licenses/nonexclusive-distrib/1.0/","  We consider averages $\kappa$ of spectral measures of rank one perturbations
with respect to a $\sigma$-finite measure $\nu$. It is examined how various
degrees of continuity of $\nu$ with respect to $\alpha$-dimensional Hausdorff
measures ($0 \leq \alpha \leq 1$) are inherited by $\kappa$. This extends
Kotani's trick where $\nu$ is simply the Lebesgue measure.
","[{""version"":""v1"",""created"":""Mon, 20 Sep 2010 05:00:19 GMT""}]","2010-09-21"
"1009.3695","Shahar Hod","Shahar Hod","Universal charge-mass relation: From black holes to atomic nuclei","5 pages","Phys.Lett.B693:339-342,2010","10.1016/j.physletb.2010.08.044",,"hep-th astro-ph.HE gr-qc hep-ph nucl-th","http://arxiv.org/licenses/nonexclusive-distrib/1.0/","  The cosmic censorship hypothesis, introduced by Penrose forty years ago, is
one of the corner stones of general relativity. This conjecture asserts that
spacetime singularities that arise in gravitational collapse are always hidden
inside of black holes. The elimination of a black-hole horizon is ruled out by
this principle because that would expose naked singularities to distant
observers. We test the consistency of this prediction in a gedanken experiment
in which a charged object is swallowed by a charged black hole. We find that
the validity of the cosmic censorship conjecture requires the existence of a
charge-mass bound of the form $q\leq\mu^{2/3}E^{-1/3}_c$, where $q$ and $\mu$
are the charge and mass of the physical system respectively, and $E_c$ is the
critical electric field for pair-production. Applying this bound to charged
atomic nuclei, one finds an upper limit on the number $Z$ of protons in a
nucleus of given mass number $A$: $Z\leq Z^*={\alpha}^{-1/3}A^{2/3}$, where
$\alpha=e^2/\hbar$ is the fine structure constant. We test the validity of this
novel bound against the $(Z,A)$-relation of atomic nuclei as deduced from the
Weizs\""acker semi-empirical mass formula.
","[{""version"":""v1"",""created"":""Mon, 20 Sep 2010 05:01:47 GMT""}]","2011-03-28"
"1009.3696","Ian McArthur","I.N. McArthur","Nonlinear realizations of symmetries and unphysical Goldstone bosons","24 pages; references added","JHEP 1011:140,2010","10.1007/JHEP11(2010)140",,"hep-th","http://arxiv.org/licenses/nonexclusive-distrib/1.0/","  The embedding of a $p$-brane into higher dimensional spacetime breaks not
only translational symmetries transverse to the worldvolume, but also Lorentz
symmetries. There exist formulations for $p$-brane actions which associate
Goldstone bosons with the generators of the broken Lorentz symmetries. These
Goldstone bosons are unphysical, in that they can be eliminated in favour of
other Goldstone bosons either via their equations of motion or via the
imposition of an inverse Higgs constraint. In this paper, we examine the
inter-relationship between the coset parameterization necessary to implement
the inverse Higgs constraint, the equivalence of the inverse Higgs constraint
to equations of motion, and the ability to find versions of the action with no
explicit dependence on the unphysical Goldstone bosons. This is evidence that
the unphysical Goldstone bosons are gauge degrees of freedom associated with an
enlarged isotropy group. In addition to $p$-brane actions, a number of other
cases, including conformally invariant dilaton actions, are shown to exhibit
the same structure.
","[{""version"":""v1"",""created"":""Mon, 20 Sep 2010 05:49:17 GMT""},{""version"":""v2"",""created"":""Tue, 5 Oct 2010 06:58:18 GMT""}]","2010-12-06"
"1009.3697","Changbong Hyeon","Changbong Hyeon","Exploring the energy landscape of biopolymers using single molecule
  force spectroscopy and molecular simulations","32 pages, 4 figures, Book Chapter in ""Simulations in
  Nanobiotechnology""",,,,"q-bio.BM","http://arxiv.org/licenses/nonexclusive-distrib/1.0/","  In recent years, single molecule force techniques have opened a new avenue to
decipher the folding landscapes of biopolymers by allowing us to watch and
manipulate the dynamics of individual proteins and nucleic acids. In single
molecule force experiments, quantitative analyses of measurements employing
sound theoretical models and molecular simulations play central role more than
any other field. With a brief description of basic theories for force mechanics
and molecular simulation technique using self-organized polymer (SOP) model,
this chapter will discuss various issues in single molecule force spectroscopy
(SMFS) experiments, which include pulling speed dependent unfolding pathway,
measurement of energy landscape roughness, the in uence of molecular handles in
optical tweezers on measurement and molecular motion, and folding dynamics of
biopolymers under force quench condition.
","[{""version"":""v1"",""created"":""Mon, 20 Sep 2010 05:50:06 GMT""}]","2016-11-25"
"1009.3698","Sebastien Lambert Dr","O. Titov, S. B. Lambert, and A.-M. Gontier","VLBI measurement of the secular aberration drift",,"Titov, O., Lambert, S.B., & Gontier, A.-M. 2011, VLBI measurement
  of the secular aberration drift, Astron. Astrophys., 529, A91","10.1051/0004-6361/201015718",,"astro-ph.CO astro-ph.IM","http://arxiv.org/licenses/nonexclusive-distrib/1.0/","  While analyzing decades of very long baseline interferometry (VLBI) data, we
detected the secular aberration drift of the extragalatic radio source proper
motions caused by the rotation of the Solar System barycenter around the
Galactic center. Our results agree with the predicted estimate to be 4-6 micro
arcseconds per year ({\mu}as/yr) towards {\alpha} = 266\circ and {\delta} =
-29\circ. In addition, we tried to detect the quadrupole systematics of the
velocity field. The analysis method consisted of three steps. First, we
analyzed geodetic and astrometric VLBI data to produce radio source coordinate
time series. Second, we fitted proper motions of 555 sources with long
observational histories over the period 1990-2010 to their respective
coordinate time series. Finally, we fitted vector spherical harmonic components
of degrees 1 and 2 to the proper motion field. Within the error bars, the
magnitude and the direction of the dipole component agree with predictions. The
dipole vector has an amplitude of 6.4 \pm 1.5 {\mu}as/yr and is directed
towards equatorial coordinates {\alpha} = 263\circ and {\delta} = -20\circ. The
quadrupole component has not been detected. The primordial gravitational wave
density, integrated over a range of frequencies less than 10-9 Hz, has a limit
of 0.0042 h-2 where h is the normalized Hubble constant is H0/(100 km s-1).
","[{""version"":""v1"",""created"":""Mon, 20 Sep 2010 05:52:43 GMT""},{""version"":""v2"",""created"":""Tue, 15 Mar 2011 20:08:01 GMT""},{""version"":""v3"",""created"":""Fri, 8 Apr 2011 21:27:11 GMT""},{""version"":""v4"",""created"":""Tue, 12 Apr 2011 06:09:58 GMT""}]","2011-04-13"
"1009.3699","Zhenyu Li","Shuanglin Hu, Zhenyu Li, Qiaohong Liu, Xudong Xiao, J. G. Hou, and
  Jinlong Yang","Nearly Free Electron States in Graphene Nanoribbon Superlattices",,,,,"cond-mat.mtrl-sci cond-mat.mes-hall","http://arxiv.org/licenses/nonexclusive-distrib/1.0/","  Nearly free electron (NFE) state is an important kind of unoccupied state in
low dimensional systems. Although it is intensively studied, a clear picture on
its physical origin and its response behavior to external perturbations is
still not available. Our systematic first-principles study based on graphene
nanoribbon superlattices suggests that there are actually two kinds of NFE
states, which can be understood by a simple Kronig-Penney potential model. An
atom-scattering-free NFE transport channel can be obtained via electron doping,
which may be used as a conceptually new field effect transistor.
","[{""version"":""v1"",""created"":""Mon, 20 Sep 2010 05:55:50 GMT""}]","2010-09-21"
"1009.3700","C.N.R. Rao Prof","H S S Ramakrishna Matte, K S Subrahmanyam, K Venkata Rao, Subi J
  George and C. N. R. Rao","Quenching of fluorescence of aromatic molecules by graphene due to
  electron transfer","18 pages, 6 figures",,,,"cond-mat.mtrl-sci","http://arxiv.org/licenses/nonexclusive-distrib/1.0/","  Investigations on the fluorescence quenching of graphene have been carried
out with two organic donor molecules, pyrene butanaoic acid succinimidyl ester
(PyBS, I) and oligo(p-phenylenevinylene) methyl ester (OPV-ester, II).
Absorption and photoluminescence spectra of I and II recorded in mixture with
increasing the concentrations of graphene showed no change in the former, but
remarkable quenching of fluorescence. The property of graphene to quench
fluorescence of these aromatic molecules is shown to be associated with
photo-induced electron transfer, on the basis of fluorescence decay and
time-resolved transient absorption spectroscopic measurements.
","[{""version"":""v1"",""created"":""Mon, 20 Sep 2010 06:18:00 GMT""}]","2010-09-21"
"1009.3701","Nikolai Marchuk","Nikolay Marchuk","Mass generation mechanism for spin 1/2 fermions in Dirac--Yang--Mills
  model equations with a symplectic gauge symmetry","10 pages","Nuovo Cim.B125:1249-1256,2011","10.1393/ncb/i2010-10921-4",,"math-ph hep-th math.MP","http://arxiv.org/licenses/nonexclusive-distrib/1.0/","  In the Standard Model of electroweak interactions the fundamental fermions
acquire masses by the Yukawa interaction with the (spin 0) Higgs field. In our
model spin 1/2 fermions acquire masses by an interaction with (spin 1) gauge
field with symplectic symmetry.
","[{""version"":""v1"",""created"":""Mon, 20 Sep 2010 06:23:41 GMT""}]","2011-04-12"
"1009.3702","Chunhua Shen","Zhihui Hao, Chunhua Shen, Nick Barnes, and Bo Wang","Totally Corrective Multiclass Boosting with Binary Weak Learners","11 pages",,,,"cs.LG","http://arxiv.org/licenses/nonexclusive-distrib/1.0/","  In this work, we propose a new optimization framework for multiclass boosting
learning. In the literature, AdaBoost.MO and AdaBoost.ECC are the two
successful multiclass boosting algorithms, which can use binary weak learners.
We explicitly derive these two algorithms' Lagrange dual problems based on
their regularized loss functions. We show that the Lagrange dual formulations
enable us to design totally-corrective multiclass algorithms by using the
primal-dual optimization technique. Experiments on benchmark data sets suggest
that our multiclass boosting can achieve a comparable generalization capability
with state-of-the-art, but the convergence speed is much faster than stage-wise
gradient descent boosting. In other words, the new totally corrective
algorithms can maximize the margin more aggressively.
","[{""version"":""v1"",""created"":""Mon, 20 Sep 2010 06:35:11 GMT""}]","2010-09-21"
"1009.3703","Ankur Verma","Chandra S. Sharma, Ankur Verma, Manish M. Kulkarni, Devendra K.
  Upadhyay and Ashutosh Sharma","Micro-fabrication of Carbon Structures by Pattern Miniaturization in
  Resorcinol-Formaldehyde Gel","16 pages, 5 figures","C. S. Sharma, A. Verma, M. M. Kulkarni, D. K. Upadhyay and A.
  Sharma, ACS Applied Materials and Interfaces 2010, 2, 2193-2197","10.1021/am100512c",,"cond-mat.soft","http://arxiv.org/licenses/nonexclusive-distrib/1.0/","  A simple and novel method to fabricate and miniaturize surface and
sub-surface micro-structures and micro-patterns in glassy carbon is proposed
and demonstrated. An aqueous resorcinol-formaldehyde (RF) sol is employed for
micro-molding of the master-pattern to be replicated, followed by controlled
drying and pyrolysis of the gel to reproduce an isotropically shrunk replica in
carbon. The miniaturized version of the master-pattern thus replicated in
carbon is about one order of magnitude smaller than original master by
repeating three times the above cycle of molding and drying. The
micro-fabrication method proposed will greatly enhance the toolbox for a facile
fabrication of a variety of Carbon-MEMS and C-microfluidic devices.
","[{""version"":""v1"",""created"":""Mon, 20 Sep 2010 06:36:39 GMT""}]","2010-09-21"
