"1009.3810","Dorje C. Brody Dr","Dorje C. Brody and Yan Tai Law","Asset pricing with random information flow","19 pages, 8 figures",,,,"q-fin.PR","http://arxiv.org/licenses/nonexclusive-distrib/1.0/","  In the information-based approach to asset pricing the market filtration is
modelled explicitly as a superposition of signals concerning relevant market
factors and independent noise. The rate at which the signal is revealed to the
market then determines the overall magnitude of asset volatility. By letting
this information flow rate random, we obtain an elementary stochastic
volatility model within the information-based approach. Such an extension is
economically justified on account of the fact that in real markets information
flow rates are rarely measurable. Effects of having a random information flow
rate is investigated in detail in the context of a simple model setup.
Specifically, the price process of the asset is derived, and its characteristic
behaviours are revealed via simulation studies. The price of a European-style
option is worked out, showing that the model has a sufficient flexibility to
fit volatility surface. As an extension of the random information flow model,
price manipulation is considered. A simple model is used to show how the
skewness of the manipulated and unmanipulated price processes take opposite
signature.
","[{""version"":""v1"",""created"":""Mon, 20 Sep 2010 13:21:37 GMT""}]","2010-09-21"
"1009.3811","Gianluca Occhetta","Gianluca Occhetta and Valentina Paterno","Rationally cubic connected manifolds II","25 pages, 5 figures",,,,"math.AG","http://arxiv.org/licenses/nonexclusive-distrib/1.0/","  We study smooth complex projective polarized varieties $(X,H)$ of dimension $
n \ge 2$ which admit a dominating family $V$ of rational curves of $H$-degree
$3$, such that two general points of $X$ may be joined by a curve parametrized
by $V$ and which do not admit a covering family of lines (i.e. rational curves
of $H$-degree one). We prove that such manifolds are obtained from RCC
manifolds of Picard number one by blow-ups along smooth centers.
  If we further assume that $X$ is a Fano manifold, we obtain a stronger
result, classifying all Fano RCC manifolds of Picard number $\rho_X \ge 3$
","[{""version"":""v1"",""created"":""Mon, 20 Sep 2010 13:22:00 GMT""}]","2010-09-21"
"1009.3812","Tobias Stauber","T. Stauber and G. G\'omez-Santos","Dynamical current-current correlation of the hexagonal lattice and
  graphene","7 pages, 3 figures","Phys. Rev. B 82, 155412 (2010)","10.1103/PhysRevB.82.155412",,"cond-mat.mes-hall","http://arxiv.org/licenses/nonexclusive-distrib/1.0/","  We discuss the dynamical current-current correlation function of the
hexagonal lattice using a local current operator defined on a continuum-replica
model of the original lattice model. In the Dirac approximation, the
correlation function can be decomposed into a parallel and perpendicular
contribution. We show that this is not possible for the hexagonal lattice even
in the Dirac regime. A comparison between the analytical isotropic solution and
the numerical results for the honeycomb lattice is given.
","[{""version"":""v1"",""created"":""Mon, 20 Sep 2010 13:29:01 GMT""},{""version"":""v2"",""created"":""Sat, 23 Oct 2010 08:41:15 GMT""}]","2010-10-26"
"1009.3813","Alfredo Poves","E. Caurier, F. Nowacki, A. Poves and K. Sieja","Collectivity in the light Xenon isotopes: A shell model study","7 pages, 10 figures","Phys.Rev.C82:064304,2010","10.1103/PhysRevC.82.064304",,"nucl-th nucl-ex","http://arxiv.org/licenses/nonexclusive-distrib/1.0/","  The lightest Xenon isotopes are studied in the framework of the Interacting
Shell Model (ISM). The valence space comprises all the orbits lying between the
magic closures N=Z=50 and N=Z=82. The calculations produce collective deformed
structures of triaxial nature that encompass nicely the known experimental
data. Predictions are made for the (still unknown) N=Z nucleus 108-Xe. The
results are interpreted in terms of the competition between the quadrupole
correlations enhanced by the pseudo-SU(3) structure of the positive parity
orbits and the pairing correlations brought in by the 0h11/2 orbit. We have
studied as well the effect of the excitations from the 100-Sn core on our
predictions.
  We show that the backbending in this region is due to the alignment of two
particles in the 0h11/2 orbit. In the N=Z case, one neutron and one proton
align to J=11 and T=0. In 110-Xe and 112-Xe the alignment begins in the J=10
T=1 channel and it is dominantly of neutron neutron type. Approaching the band
termination the alignment of a neutron and a proton to J=11 and T=0 takes over.
In a more academic mood, we have explored the role of the isovector and
isoscalar pairing correlations on the structure on the yrast bands of 108-Xe
and 110-Xe and examined the role of the isovector and isoscalar pairing
condensates in these N~Z nuclei.
","[{""version"":""v1"",""created"":""Mon, 20 Sep 2010 13:34:59 GMT""}]","2010-12-24"
"1009.3814","Luca D'Alessio","L. D'Alessio, P. L. Krapivsky","A Light impurity in an Equilibrium Gas","version 2, 22 pages, 9 figures","Physical Review E 83, 011107 (2011)","10.1103/PhysRevE.83.011107",,"cond-mat.stat-mech","http://arxiv.org/licenses/nonexclusive-distrib/1.0/","  We investigate the evolution of a light impurity particle in a Lorentz gas
where the background atoms are in thermal equilibrium. As in the standard
Lorentz gas, we assume that the particle is negligibly light in comparison with
the background atoms. The thermal motion of atoms causes the average particle
speed to grow. In the case of the hard-sphere particle-atom interaction, the
temporal growth is ballistic, while generally it is sub-linear. For the
particle-atom potential that diverges as r^{-\lambda} in the small separation
limit, the average particle speed grows as t^{\lambda /(2(d-1)+ \lambda)} in d
dimensions. The particle displacement exhibits a universal growth, linear in
time and the average (thermal) speed of the atoms. Surprisingly, the asymptotic
growth is independent on the gas density and the particle-atom interaction. The
velocity and position distributions approach universal scaling forms which are
non-Gaussian. We determine the velocity distribution in arbitrary dimension and
for arbitrary interaction exponent \lambda. For the hard-sphere particle-atom
interaction, we compute the position distribution and the joint
velocity-position distribution.
","[{""version"":""v1"",""created"":""Mon, 20 Sep 2010 13:36:53 GMT""},{""version"":""v2"",""created"":""Thu, 7 Oct 2010 17:06:09 GMT""}]","2013-05-29"
"1009.3815","Achim G\""utlein","A. G\""utlein, W. Potzel, C. Ciemniak, F. von Feilitzsch, N. Haag, M.
  Hofmann, C. Isaila, T. Lachenmaier, J.-C. Lanfranchi, L. Oberauer, S.
  Pfister, S. Roth, M. von Sivers, R. Strau{\ss}, and A. Z\""oller","Solar and Atmospheric Neutrinos: Limitations for Direct Dark Matter
  Searches","Version 2: Correction of a typing error",,,,"hep-ph astro-ph.CO","http://arxiv.org/licenses/nonexclusive-distrib/1.0/","  In experiments for direct dark matter searches, neutrinos coherently
scattering off nuclei can produce similar events as Weakly Interacting Massive
Particles (WIMPs). To reach sensitivities better than about 10^-10 pb for the
elastic WIMP nucleon spin-independent cross section in the zero-background
limit, energy thresholds for nuclear recoils should be >2.05 keV for CaWO_4,
>4.91 keV for Ge, >2.89 keV for Xe, >8.62 keV for Ar and >15.93 keV for Ne as
target material. Atmospheric neutrinos limit the achievable sensitivity for the
background-free direct dark matter search to >10^-12 pb.
","[{""version"":""v1"",""created"":""Mon, 20 Sep 2010 13:42:15 GMT""},{""version"":""v2"",""created"":""Thu, 23 Sep 2010 09:06:59 GMT""}]","2010-09-24"
"1009.3816","Nicolas Chamel","J. M. Pearson, N. Chamel, S. Goriely","Breathing-mode measurements in Sn isotopes and isospin dependence of
  nuclear incompressibility","6 pages, 1 figure","Phys.Rev.C82:037301,2010","10.1103/PhysRevC.82.037301",,"nucl-th","http://arxiv.org/licenses/nonexclusive-distrib/1.0/","  T. Li {\it et al.}[Phys. Rev. C {\bf 81}, 034309 (2010)] have analyzed their
measured breathing-mode energies of some tin isotopes in terms of a first-order
leptodermous expansion, and find for the symmetry-incompressibility coefficient
$K_{\tau}$ the value of -550 $\pm$ 100 MeV. Removing an approximation that they
made, we find that the first-order estimate of $K_{\tau}$ shifts to -661 $\pm$
144 MeV. However, taking into account higher-order terms in the leptodermous
expansion shows that the data are compatible with the significantly lower
magnitudes indicated by both another experiment and some theoretical estimates.
","[{""version"":""v1"",""created"":""Mon, 20 Sep 2010 13:45:34 GMT""}]","2010-09-21"
"1009.3817","Jorge Pullin","Rodolfo Gambini, Luis Pedro Garcia-Pintos, Jorge Pullin","Undecidability as solution to the problem of measurement: fundamental
  criterion for the production of events","10 pages, contributed to the Castagnino Festschrift","Int.J.Mod.Phys.D20:909-918,2011","10.1142/S0218271811019104","LSU-REL-092010","quant-ph gr-qc hep-th","http://arxiv.org/licenses/nonexclusive-distrib/1.0/","  In recent papers we put forth a new interpretation of quantum mechanics,
colloquially known as ``the Montevideo interpretation''. This interpretation is
based on taking into account fundamental limits that gravity imposes on the
measurement process. As a consequence one has that situations develop where a
reduction process is undecidable from an evolution operator. When such a
situation is achieved, an event has taken place. In this paper we sharpen the
definition of when and how events occur, more precisely we give sufficient
conditions for the occurrence of events. We probe the new definition in an
example. In particular we show that the concept of undecidability used is not
``FAPP'' (for all practical purposes), but fundamental.
","[{""version"":""v1"",""created"":""Mon, 20 Sep 2010 13:51:06 GMT""}]","2011-05-25"
"1009.3818","Danilo Babusci","D. Babusci, G. Dattoli, E. Sabia","Operational methods and Lorentz-type equations of motion","29 pages, 10 figures, eq. (41) has been modified",,,"LNF - 10 / 19(P)","math-ph math.MP","http://arxiv.org/licenses/nonexclusive-distrib/1.0/","  We propose an operational method for the solution of differential equations
involving vector products. The technique we propose is based on the use of the
evolution operator, defined in such a way that the wealth of techniques
developed within the context of quantum mechanics can also be exploited for
classical problems. We discuss the application of the method to the solution of
the Lorentz-type equations.
","[{""version"":""v1"",""created"":""Mon, 20 Sep 2010 13:52:26 GMT""},{""version"":""v2"",""created"":""Mon, 27 Sep 2010 12:46:03 GMT""}]","2010-09-28"
"1009.3819","Md. Saiful Islam","Md. Saiful Islam, Muhammad Mahbubur Rahman, Zerina Begum, Mohd.
  Zulfiquar Hafiz","Fault Tolerant Variable Block Carry Skip Logic (VBCSL) using Parity
  Preserving Reversible Gates","9 pages, 16 figures, 2 tables, Accepted for publication in IJCEE,
  IACSIT, Singapore","International Journal of Computer and Electrical Engineering vol.
  3, no. 1, pp. 1-7, 2011",,,"cs.AR","http://arxiv.org/licenses/nonexclusive-distrib/1.0/","  Reversible logic design has become one of the promising research directions
in low power dissipating circuit design in the past few years and has found its
application in low power CMOS design, digital signal processing and
nanotechnology. This paper presents the efficient design approaches of fault
tolerant carry skip adders (FTCSAs) and compares those designs with the
existing ones. Variable block carry skip logic (VBCSL) using the fault tolerant
full adders (FTFAs) has also been developed. The designs are minimized in terms
of hardware complexity, gate count, constant inputs and garbage outputs.
Besides of it, technology independent evaluation of the proposed designs
clearly demonstrates its superiority with the existing counterparts.
","[{""version"":""v1"",""created"":""Mon, 20 Sep 2010 13:53:39 GMT""}]","2012-05-04"
"1009.3820","Sang-hyun Kim","Sang-hyun Kim and Sang-il Oum","Hyperbolic surface subgroups of one-ended doubles of free groups","30 pages, 8 figures. This version has been accepted for publication
  by the Journal of Topology","J. Topology 7(December 2014)(4), pp. 927-947, 2014","10.1112/jtopol/jtu004",,"math.GR math.CO","http://arxiv.org/licenses/nonexclusive-distrib/1.0/","  Gromov asked whether every one-ended word-hyperbolic group contains a
hyperbolic surface group. We prove that every one-ended double of a free group
has a hyperbolic surface subgroup if (1) the free group has rank two, or (2)
every generator is used the same number of times in the amalgamating words. To
prove this, we formulate a stronger statement on Whitehead graphs and prove its
specialization by combinatorial induction for (1) and the characterization of
perfect matching polytopes by Edmonds for (2).
","[{""version"":""v1"",""created"":""Mon, 20 Sep 2010 13:59:44 GMT""},{""version"":""v2"",""created"":""Thu, 7 Oct 2010 04:10:24 GMT""},{""version"":""v3"",""created"":""Sat, 31 Dec 2011 09:25:18 GMT""},{""version"":""v4"",""created"":""Thu, 14 Nov 2013 05:23:48 GMT""}]","2015-01-05"
"1009.3821","Pawel Glowacki","Pawel Glowacki","Convergence of semigroups of measures on a Lie group","6 pages, http://www.math.uni.wroc.pl/~glowacki",,,,"math.FA math.PR","http://arxiv.org/licenses/nonexclusive-distrib/1.0/","  A theorem of Siebert asserts that if a sequence of semigroups of probability
measures on a Lie group G is weakly convergent to a semigroup of the same type,
then the corresponding generating functionals are convergent in the weak
operator topology in every unitary representation of the group.The aim of this
note is to give a simple proof of the theorem and propose some improvements. In
particular, we completely avoid employing unitary representations by showing
simply that under the same hypothesis the generating functionals are convergent
pointwise on C^2(G). As a corollary,the above thesis of Siebert is extended to
strongly continuous representations of G on Banach spaces.
","[{""version"":""v1"",""created"":""Mon, 20 Sep 2010 14:01:20 GMT""}]","2010-09-21"
"1009.3822","Sergio Giro","Sergio Giro","An algorithmic approximation of the infimum reachability probability for
  Probabilistic Finite Automata","7 pages, 2 figures",,,,"cs.LO cs.FL","http://arxiv.org/licenses/nonexclusive-distrib/1.0/","  Given a Probabilistic Finite Automata (PFA), a set of states S, and an error
threshold e > 0, our algorithm approximates the infimum probability
(quantifying over all infinite words) that the automata reaches S. Our result
contrasts with the known result that the approximation problem is undecidable
if we consider the supremum instead of the infimum. Since we study the
probability of reaching a set of states, instead of the probability of ending
in an accepting state, our work is more related to model checking than to
formal languages.
","[{""version"":""v1"",""created"":""Mon, 20 Sep 2010 14:02:21 GMT""}]","2010-09-21"
"1009.3823","Adam Gilbertson","A. M. Gilbertson, M. Fearn, A. Korm\'anyos, D. E. Read, C. J. Lambert,
  M. T. Emeny, T. Ashley, S. A. Solin and L. F. Cohen","Ballistic transport and boundary scattering in InSb/InxAl1-xSb
  mesoscopic devices","10 pages, 7 figures",,,,"cond-mat.mes-hall","http://arxiv.org/licenses/nonexclusive-distrib/1.0/","  We describe the influence of hard wall confinement and lateral dimension on
the low temperature transport properties of long diffusive channels and
ballistic crosses fabricated in an InSb/InxAl1-xSb heterostructure. Partially
diffuse boundary scattering is found to play a crucial role in the electron
dynamics of ballistic crosses and substantially enhance the negative bend
resistance. Experimental observations are supported by simulations using a
classical billiard ball model for which good agreement is found when diffuse
boundary scattering is included.
","[{""version"":""v1"",""created"":""Mon, 20 Sep 2010 14:04:25 GMT""}]","2010-09-21"
"1009.3824","Tamas Linder","Serdar Y\""uksel and Tam\'as Linder","Optimization and Convergence of Observation Channels in Stochastic
  Control","24 pages, to appear in the SIAM Journal on Control and Optimization",,,,"math.OC cs.IT math.IT","http://arxiv.org/licenses/nonexclusive-distrib/1.0/","  This paper studies the optimization of observation channels (stochastic
kernels) in partially observed stochastic control problems. In particular,
existence and continuity properties are investigated mostly (but not
exclusively) concentrating on the single-stage case. Continuity properties of
the optimal cost in channels are explored under total variation, setwise
convergence, and weak convergence. Sufficient conditions for compactness of a
class of channels under total variation and setwise convergence are presented
and applications to quantization are explored.
","[{""version"":""v1"",""created"":""Mon, 20 Sep 2010 14:05:30 GMT""},{""version"":""v2"",""created"":""Tue, 7 Feb 2012 22:38:52 GMT""}]","2012-02-09"
"1009.3825","Balazs Szegedy","Omar Antolin Camarena, Balazs Szegedy","Nilspaces, nilmanifolds and their morphisms",,,,,"math.DS math.CO","http://arxiv.org/licenses/nonexclusive-distrib/1.0/","  Recent developments in ergodic theory, additive combinatorics, higher order
Fourier analysis and number theory give a central role to a class of algebraic
structures called nilmanifolds. In the present paper we continue a program
started by Host and Kra. We introduce nilspaces as structures satisfying a
variant of the Host-Kra axiom system for parallelepiped structures. We give a
detailed structural analysis of abstract and compact topological nilspaces.
Among various results it will be proved that compact nilspaces are inverse
limits of finite dimensional ones. Then we show that finite dimensional compact
connected nilspaces are nilmanifolds. The theory of compact nilspaces is a
generalization of the theory of compact abelian groups. This paper is the main
algebraic tool in the second authors approach to Gowers's uniformity norms and
higher order Fourier analysis.
","[{""version"":""v1"",""created"":""Mon, 20 Sep 2010 14:05:59 GMT""},{""version"":""v2"",""created"":""Thu, 20 Oct 2011 14:38:22 GMT""},{""version"":""v3"",""created"":""Sun, 10 Jun 2012 18:16:13 GMT""}]","2012-06-12"
"1009.3826","Armen Sedrakian","Armen Sedrakian","Cold quark matter in astrophysics of compact stars","8 pages, 2 figures, contribution to the proceedings of QCD@Work, June
  20-23rd, 2010, Martina Franca, Italy",,"10.1063/1.3536588",,"astro-ph.HE hep-ph nucl-th","http://arxiv.org/licenses/nonexclusive-distrib/1.0/","  The appearance of quark matter in the centers of compact stars has a number
of astrophysical implications. In this contribution I discuss the structure and
stability of compact stars, gravitational radiation from non-axisymmetric
deformations, and nucleation and dynamics of vortices (flux tubes) in the color
superconducting phases.
","[{""version"":""v1"",""created"":""Mon, 20 Sep 2010 14:07:38 GMT""}]","2015-05-20"
"1009.3827","Oleg Derzhko","O. Derzhko, M. Maksymenko, J. Richter, A. Honecker, R. Moessner","Magnetic properties of the Hubbard model on kagome stripes","The paper was presented at the 14th Czech and Slovak Conference on
  Magnetism CSMAG'10 (6.-9. July 2010, Ko\v{s}ice, Slovakia)","Acta Physica Polonica A118 (2010) 736-737",,,"cond-mat.str-el","http://arxiv.org/licenses/nonexclusive-distrib/1.0/","  We consider the one-orbital $N$-site repulsive Hubbard model on two
kagome-like chains, both of which yield a completely dispersionless (flat)
one-electron band. Using exact many-electron ground states in the subspaces
with $n\le n_{\max}$ ($n_{\max}\propto N$) electrons, we calculate the square
of the total spin in the ground state to discuss magnetic properties of the
models. We have found that although for $n<n_{\max}$ the ground states contain
fully polarized states, there is no finite region of electron densities
$n/{\cal{N}} <1$ (${\cal{N}}=N/3$ or ${\cal{N}}=N/5$) where ground-state
ferromagnetism survives for ${\cal{N}}\to\infty$.
","[{""version"":""v1"",""created"":""Mon, 20 Sep 2010 14:08:00 GMT""}]","2010-12-13"
"1009.3828","Oleg Derzhko","Oleg Derzhko, Taras Krokhmalskii, Johannes Richter","Emergent Ising degrees of freedom in frustrated two-leg ladder and
  bilayer $s=1/2$ Heisenberg antiferromagnets","17 pages, 8 figures","Phys. Rev. B 82, 214412 (2010) [14 pages]","10.1103/PhysRevB.82.214412",,"cond-mat.str-el","http://arxiv.org/licenses/nonexclusive-distrib/1.0/","  Based on exact diagonalization data for finite quantum Heisenberg
antiferromagnets on two frustrated lattices (two-leg ladder and bilayer) and
analytical arguments we map low-energy degrees of freedom of the spin models in
a magnetic field on classical lattice-gas models. Further we use
transfer-matrix calculations and classical Monte Carlo simulations to give a
quantitative description of low-temperature thermodynamics of the quantum spin
models. The classical lattice-gas model yields an excellent description of the
quantum spin models up to quite large temperatures. The main peculiarity of the
considered frustrated bilayer is a phase transition which occurs at low
temperatures for a wide range of magnetic fields below the saturation magnetic
field and belongs to the two-dimensional Ising model universality class.
","[{""version"":""v1"",""created"":""Mon, 20 Sep 2010 14:18:41 GMT""}]","2010-12-22"
"1009.3829","Roni Waldman","Roni Waldman, Daniel Sauer, Eli Livne, Hagai Perets, Ami Glasner,
  Paolo Mazzali, James W. Truran, Avishay Gal-Yam","Helium Shell Detonations on Low Mass White Dwarfs as a Possible
  Explanation for SN 2005E","15 pages, 8 figures",,"10.1088/0004-637X/738/1/21",,"astro-ph.SR","http://arxiv.org/licenses/nonexclusive-distrib/1.0/","  Recently several type Ib supernovae (SNe; with the prototypical SN 2005E)
have been shown to have atypical properties. These SNe are faint (absolute peak
magnitude of ~ -15) and fast SNe that show unique composition. They are
inferred to have low ejecta mass (a few tenths of a solar mass) and to be
highly enriched in calcium, but poor in silicon elements and nickel. These SNe
were therefore suggested to belong to a new class of calcium-rich faint SNe
explosions. Their properties were proposed to be the result of helium
detonations that may occur on helium accreting white dwarfs. In this paper we
theoretically study the scenario of helium detonations, and focus on the
results of detonations in accreted helium layers on low mass carbon-oxygen (CO)
cores. We present new results from one dimensional simulations of such
explosions, including their light curves and spectra. We find that when the
density of the helium layer is low enough the helium detonation produces large
amounts of intermediate elements, such as calcium and titanium, together with a
large amount of unburnt helium. Our results suggest that the properties of
calcium-rich faint SNe could indeed be consistent with the helium-detonation
scenario on small CO cores. Above a certain density (larger CO cores) the
detonation leaves mainly 56Ni and unburnt helium, and the predicted spectrum
will unlikely fit the unique features of this class of SNe. Finally, none of
our studied models reproduces the bright, fast evolving light curves of another
type of peculiar SNe suggested to originate in helium detonations (SNe 1885A,
1939B and 2002bj).
","[{""version"":""v1"",""created"":""Mon, 20 Sep 2010 14:24:38 GMT""}]","2015-05-20"
"1009.3830","Marcos Curty","Marcos Curty, Xiongfeng Ma, Hoi-Kwong Lo, Norbert L\""utkenhaus","Passive sources for the Bennett-Brassard 1984 quantum key distribution
  protocol with practical signals","14 pages, 11 figures","Phys. Rev. A 82, 052325 (2010)","10.1103/PhysRevA.82.052325",,"quant-ph","http://arxiv.org/licenses/nonexclusive-distrib/1.0/","  Most experimental realizations of quantum key distribution are based on the
Bennett-Brassard 1984 (so-called BB84) protocol. In a typical optical
implementation of this scheme, the sender uses an active source to produce the
required BB84 signal states. While active state preparation of BB84 signals is
a simple and elegant solution in principle, in practice passive state
preparation might be desirable in some scenarios, for instance, in those
experimental setups operating at high transmission rates. Passive schemes might
also be more robust against side-channel attacks than active sources. Typical
passive devices involve parametric down-conversion. In this paper, we show that
both coherent light and practical single photon sources are also suitable for
passive generation of BB84 signal states. Our method does not require any
external-driven element, but only linear optical components and photodetectors.
In the case of coherent light, the resulting key rate is similar to the one
delivered by an active source. When the sender uses practical single photon
sources, however, the distance covered by a passive transmitter might be longer
than the one of an active configuration.
","[{""version"":""v1"",""created"":""Mon, 20 Sep 2010 14:31:11 GMT""}]","2011-02-17"
