"1009.3747","Janne Juntunen","Janne Juntunen and Otto Pulkkinen and Juha Merikoski","Finite-size effects in dynamics of zero-range processes","http://pre.aps.org/abstract/PRE/v82/i3/e031119","Phys. Rev. E 82 031119, (2010)","10.1103/PhysRevE.82.031119",,"cond-mat.stat-mech","http://arxiv.org/licenses/nonexclusive-distrib/1.0/","  The finite-size effects prominent in zero-range processes exhibiting a
condensation transition are studied by using continuous-time Monte Carlo
simulations. We observe that, well above the thermodynamic critical point, both
static and dynamic properties display fluid-like behavior up to a density
{\rho}c (L), which is the finite-size counterpart of the critical density
{\rho}c = {\rho}c (L \rightarrow \infty). We determine this density from the
cross-over behavior of the average size of the largest cluster. We then show
that several dynamical characteristics undergo a qualitative change at this
density. In particular, the size distribution of the largest cluster at the
moment of relocation, the persistence properties of the largest cluster and
correlations in its motion are studied.
","[{""version"":""v1"",""created"":""Mon, 20 Sep 2010 09:41:49 GMT""}]","2010-09-21"
"1009.3748","Michael Carley","Michael Carley","The radiating part of circular sources","Submitted to Journal of the Acoustical Society of America",,"10.1121/1.3531925",,"math-ph math.MP physics.class-ph physics.flu-dyn","http://arxiv.org/licenses/nonexclusive-distrib/1.0/","  An analysis is developed linking the form of the sound field from a circular
source to the radial structure of the source, without recourse to far-field or
other approximations. It is found that the information radiated into the field
is limited, with the limit fixed by the wavenumber of source multiplied by the
source radius (Helmholtz number). The acoustic field is found in terms of the
elementary fields generated by a set of line sources whose form is given by
Chebyshev polynomials of the second kind, and whose amplitude is found to be
given by weighted integrals of the radial source term. The analysis is
developed for tonal sources, such as rotors, and, for Helmholtz number less
than two, for random disk sources. In this case, the analysis yields the
cross-spectrum between two points in the acoustic field. The analysis is
applied to the problems of tonal radiation, random source radiation as a model
problem for jet noise, and to noise cancellation, as in active control of noise
from rotors. It is found that the approach gives an accurate model for the
radiation problem and explicitly identifies those parts of a source which
radiate.
","[{""version"":""v1"",""created"":""Mon, 20 Sep 2010 09:47:52 GMT""}]","2015-05-20"
"1009.3749","Azad Akhter Siddiqui Professor","M. Akbar and Azad A. Siddiqui","Charged Rotating BTZ Black Hole and Thermodynamic Behavior of Field
  Equations at its Horizon","12 pages, 3 figures","Phys.Lett.B656:217-220,2007","10.1016/j.physletb.2007.09.053",,"gr-qc","http://arxiv.org/licenses/nonexclusive-distrib/1.0/","  In this paper, we study different cases of the charged rotating BTZ black
hole with reference to their horizons. For the existence of these cases
conditions on mass, charge and angular momentum of the black hole are obtained.
It is also shown that the Einstein field equations for the charged rotating BTZ
black hole at the horizon can be expressed as first law of thermodynamics,
$dE=TdS+\Omega dJ+\Phi dq+P_{r}dA$.
","[{""version"":""v1"",""created"":""Mon, 20 Sep 2010 09:50:31 GMT""}]","2014-11-21"
"1009.3750","Sergio Simon-Diaz","S. Sim\'on-D\'iaz, M. Garcia, N. Castro, and A. Herrero","The IACOB spectroscopic database of Galactic OB stars","2 pages. Poster contribution to the proceedings of the IAU272 ""Active
  OB stars: structure, evolution, mass loss and critical limits""",,"10.1017/S1743921311010714",,"astro-ph.SR","http://arxiv.org/licenses/nonexclusive-distrib/1.0/","  We present the IACOB spectroscopic database, the largest homogeneous database
of high-resolution, high signal-to-noise ratio spectra of Northern Galactic
OB-type stars compiled up to date. The spectra were obtained with the FIES
spectrograph attached to the Nordic Optical Telescope. We briefly summarize the
main characeristics and present status of the IACOB, first scientific results,
and some future plans for its extension and scientific exploitation.
","[{""version"":""v1"",""created"":""Mon, 20 Sep 2010 09:55:40 GMT""}]","2015-05-20"
"1009.3751","Georg B\""ocherer","Georg B\""ocherer, Rudolf Mathar","Matching Dyadic Distributions to Channels","to be presented at DCC 2011",,,,"cs.IT math.IT math.PR","http://arxiv.org/licenses/nonexclusive-distrib/1.0/","  Many communication channels with discrete input have non-uniform capacity
achieving probability mass functions (PMF). By parsing a stream of independent
and equiprobable bits according to a full prefix-free code, a modu-lator can
generate dyadic PMFs at the channel input. In this work, we show that for
discrete memoryless channels and for memoryless discrete noiseless channels,
searching for good dyadic input PMFs is equivalent to minimizing the
Kullback-Leibler distance between a dyadic PMF and a weighted version of the
capacity achieving PMF. We define a new algorithm called Geometric Huffman
Coding (GHC) and prove that GHC finds the optimal dyadic PMF in O(m \log m)
steps where m is the number of input symbols of the considered channel.
Furthermore, we prove that by generating dyadic PMFs of blocks of consecutive
input symbols, GHC achieves capacity when the block length goes to infinity.
","[{""version"":""v1"",""created"":""Mon, 20 Sep 2010 09:58:38 GMT""},{""version"":""v2"",""created"":""Wed, 13 Oct 2010 13:11:45 GMT""},{""version"":""v3"",""created"":""Mon, 8 Nov 2010 09:01:51 GMT""},{""version"":""v4"",""created"":""Fri, 31 Dec 2010 09:21:59 GMT""}]","2011-01-04"
"1009.3752","Sergio Simon-Diaz","S. Sim\'on-D\'iaz, A. Herrero, K. Uytterhoeven, N. Castro, C. Aerts,
  and J. Puls","Is macroturbulence in OB Sgs related to pulsations?","2 pages, 1 figure. Poster contribution to the proceedings of the
  IAU272 ""Active OB stars: structure, evolution, mass loss and critical limits""",,"10.1017/S1743921311011410",,"astro-ph.SR","http://arxiv.org/licenses/nonexclusive-distrib/1.0/","  As part of a long term observational project, we are investigating the
macroturbulent broadening in O and B supergiants (Sgs) and its possible
connection with spectroscopic variability phenomena and stellar oscillations.
We present the first results of our project, namely firm observational evidence
for a strong correlation between the extra broadening and photospheric
line-profile variations in a sample of 13 Sgs with spectral types ranging from
O9.5 to B8.
","[{""version"":""v1"",""created"":""Mon, 20 Sep 2010 10:00:04 GMT""}]","2015-05-20"
"1009.3753","Matus Medo","Yu Feng, Matus Medo, Liang Zhang, Yi-Cheng Zhang","Transaction fees and optimal rebalancing in the growth-optimal portfolio","17 pages, 7 figures","Physica A 390, 1635-1645 (2011)","10.1016/j.physa.2010.12.031",,"q-fin.PM","http://arxiv.org/licenses/nonexclusive-distrib/1.0/","  The growth-optimal portfolio optimization strategy pioneered by Kelly is
based on constant portfolio rebalancing which makes it sensitive to transaction
fees. We examine the effect of fees on an example of a risky asset with a
binary return distribution and show that the fees may give rise to an optimal
period of portfolio rebalancing. The optimal period is found analytically in
the case of lognormal returns. This result is consequently generalized and
numerically verified for broad return distributions and returns generated by a
GARCH process. Finally we study the case when investment is rebalanced only
partially and show that this strategy can improve the investment long-term
growth rate more than optimization of the rebalancing period.
","[{""version"":""v1"",""created"":""Mon, 20 Sep 2010 10:00:49 GMT""},{""version"":""v2"",""created"":""Thu, 6 Jan 2011 09:35:26 GMT""}]","2011-04-08"
"1009.3754","Tomas Kaiser","Tom\'a\v{s} Kaiser and Petr Vr\'ana","Hamilton cycles in 5-connected line graphs",,,,,"math.CO","http://arxiv.org/licenses/nonexclusive-distrib/1.0/","  A conjecture of Carsten Thomassen states that every 4-connected line graph is
hamiltonian. It is known that the conjecture is true for 7-connected line
graphs. We improve this by showing that any 5-connected line graph of minimum
degree at least 6 is hamiltonian. The result extends to claw-free graphs and to
Hamilton-connectedness.
","[{""version"":""v1"",""created"":""Mon, 20 Sep 2010 10:06:23 GMT""},{""version"":""v2"",""created"":""Thu, 31 Mar 2011 19:48:35 GMT""}]","2011-04-01"
"1009.3755","Sergio Simon-Diaz","A. Herrero, M. Garcia, K. Uytterhoeven, F. Najarro, D.J. Lennon, S.
  Sim\'on-D\'iaz, N. Castro, J. Puls, J.S. Vink, M.A. Urbaneja, and A. de Koter","Are the Stellar Winds in IC1613 stronger than expected?","2 pages. Poster contribution to the proceedings of the IAU272 ""Active
  OB Stars: structure, evolution, mass loss and critical limits""",,"10.1017/S1743921311010623",,"astro-ph.SR","http://arxiv.org/licenses/nonexclusive-distrib/1.0/","  In this poster we present the results of our analyses of three early massive
stars in IC 1613, whose spectra have been observed with VIMOS and analyzed with
CMFGEN and FASTWIND. One of the targets resulted a possible LBV and the other
two are Of stars with unexpectedly strong winds. The Of stars seem to be
strongly contaminated by CNO products. Our preliminary results may represent a
challenge for the theory of stellar atmospheres, but they still have to be
confirmed by the analysis of more objects and a more complete coverage of the
parameter space.
","[{""version"":""v1"",""created"":""Mon, 20 Sep 2010 10:07:09 GMT""}]","2015-05-20"
"1009.3756","Imad Agha","Imad H. Agha, Christina Giarmatzi, Gaetan Messin, and Philippe
  Grangier","Time-resolved detection of relative intensity squeezed nanosecond pulses
  in a 87Rb vapor","This paper has been withdrawn by the authors. Major changes to
  theoretical section and authorship order change. Will be resubmitted after
  required changes are implemented to the manuscript",,,,"physics.optics physics.atom-ph quant-ph","http://arxiv.org/licenses/nonexclusive-distrib/1.0/","  We present experimental studies on the generation and detection of pulsed,
relative-intensity squeezed light in a warm rubidium vapor. The noise
correlations between a pulsed probe beam and its conjugate -generated through
nearly-degenerate four-wave mixing in a double-lambda system- are studied via
time-resolved balanced detection. We observe -0.96 dB of time-resolved relative
intensity squeezing with 50 nanosecond pulses at 1 MHz repetition rate. (-1.34
dB corrected for loss).
","[{""version"":""v1"",""created"":""Mon, 20 Sep 2010 10:08:34 GMT""},{""version"":""v2"",""created"":""Wed, 29 Sep 2010 18:28:50 GMT""}]","2010-09-30"
"1009.3757","Adriano Di  Giacomo","Adriano Di Giacomo","QCD Monopoles on the Lattice and Gauge Invariance","Presented at the Conference QCD10 Montpellier 28 June - 2 July 2010","Nucl.Phys.Proc.Suppl.207-208:337-340,2010","10.1016/j.nuclphysbps.2010.10.083","IFUP-TH 2010/32","hep-lat hep-ph hep-th","http://arxiv.org/licenses/nonexclusive-distrib/1.0/","  The long standing problem is solved why the number and the location of
monopoles observed in Lattice configurations depend on the choice of the gauge
used to detect them, in contrast to the obvious requirement that monopoles, as
physical objects, must have a gauge-invariant status.
  It is proved, by use of non-abelian Bianchi identities, that monopoles are
indeed gauge-invariant: the technique used to detect them has instead an
efficiency which depends on the choice of the abelian projection, in a known
and controllable way.
","[{""version"":""v1"",""created"":""Mon, 20 Sep 2010 10:09:08 GMT""}]","2011-02-15"
"1009.3758","Lars Zeidlewicz","Florian Burger, Ernst-Michael Ilgenfritz, Malik Kirchner, Maria Paola
  Lombardo, Michael M\""uller-Preussker, Owe Philipsen, Carsten Urbach, Lars
  Zeidlewicz","Thermal transition temperature from twisted mass QCD","7 pages, 5 figures. To appear in the Proceedings of the 28th
  International Symposium on Lattice Field Theory (Lattice 2010), Villasimius,
  Sardinia, Italy, June 14-19, 2010","PoS Lattice2010:220,2010",,"BI-TP-2010/28, HU-EP-10/50","hep-lat","http://arxiv.org/licenses/nonexclusive-distrib/1.0/","  We present the current status of lattice simulations with N_f=2 maximally
twisted mass Wilson fermions at finite temperature. In particular, the
determination of the thermal transition temperature is discussed.
","[{""version"":""v1"",""created"":""Mon, 20 Sep 2010 10:12:13 GMT""}]","2011-01-27"
"1009.3759","Rasul Gazizulin","R.R. Gazizulin, A.V. Klochkov, V.V. Kuzmin, K.R. Safiullin, M.S.
  Tagirov, A.N. Yudin, V.G. Izotov, L.M. Sitdikova","NMR of liquid 3He in clay pores at 1.5 K","9 pages, 5 figures","Applied Magnetic Resonance, Volume 38, Number 3, 271-278 (2010)","10.1007/s00723-010-0118-z",,"cond-mat.other cond-mat.mtrl-sci","http://arxiv.org/licenses/nonexclusive-distrib/1.0/","  In the present work a new method for studying porous media by nuclear
magnetic resonance of liquid 3He has been proposed. This method has been
demonstrated in an example of a clay mineral sample. For the first time the
integral porosity of clay sample has been measured. For investigated samples
the value of integral porosity is in the range of 10-30%. Inverse Laplace
transform of 3He longitudinal magnetization recovery curve has been carried
out, thus distribution of relaxation times T1 has been obtained.
","[{""version"":""v1"",""created"":""Mon, 20 Sep 2010 10:13:34 GMT""}]","2010-09-23"
"1009.3760","Damiano  Brigo","Damiano Brigo, Claudio Nordio","Liquidity-adjusted Market Risk Measures with Stochastic Holding Period",,,,,"q-fin.RM","http://arxiv.org/licenses/nonexclusive-distrib/1.0/","  Within the context of risk integration, we introduce in risk measurement
stochastic holding period (SHP) models. This is done in order to obtain a
`liquidity-adjusted risk measure' characterized by the absence of a fixed time
horizon. The underlying assumption is that - due to changes on market liquidity
conditions - one operates along an `operational time' to which the P&L process
of liquidating a market portfolio is referred. This framework leads to a
mixture of distributions for the portfolio returns, potentially allowing for
skewness, heavy tails and extreme scenarios. We analyze the impact of possible
distributional choices for the SHP. In a multivariate setting, we hint at the
possible introduction of dependent SHP processes, which potentially lead to non
linear dependence among the P&L processes and therefore to tail dependence
across assets in the portfolio, although this may require drastic choices on
the SHP distributions. We also find that increasing dependence as measured by
Kendall's tau through common SHP's appears to be unfeasible. We finally discuss
potential developments following future availability of market data.
","[{""version"":""v1"",""created"":""Mon, 20 Sep 2010 10:15:07 GMT""},{""version"":""v2"",""created"":""Wed, 20 Oct 2010 18:32:39 GMT""}]","2010-10-21"
"1009.3761","Paramita Kar Choudhury","Paramita Kar Choudhury, S. Banerjee, S. Ramaprabhu, K. P. Ramesh, and
  Reghu Menon","Variations in magnetic properties of nanostructured nickel","Accepted (J. Nanosci. Nanotechnol.)",,,,"cond-mat.mes-hall","http://arxiv.org/licenses/nonexclusive-distrib/1.0/","  The magnetic properties of carbon nanotube encapsulated nickel nanowires
(C.E. nanowires of diameter ~ 10 nm), and its comparison to other forms of Ni
are carried out in this work. The saturation magnetization (M_s) and coercivity
(H_c) for C.E. nanowires are 1.0 emu/g and 230 Oe. The temperature dependence
of coercivity follows T^0.77 dependence indicating a superparamagnetic
behavior. The field-cooled and zero-field-cooled plots indicate that the
blocking temperature (T_B) ~ 300 K. These altered magnetic properties of C.E.
nanowires are mainly due to the nanoscale confinement effect from carbon
nanotube encapsulation. The shape and magnetic environment enhance the total
magnetic anisotropy of C.E. nanowires by a factor of four.
","[{""version"":""v1"",""created"":""Mon, 20 Sep 2010 10:18:15 GMT""}]","2010-09-21"
"1009.3762","Jens Mueller","Jens A. Mueller, Christian S. Fischer, and Dominik Nickel","Quark spectral properties above Tc from Dyson-Schwinger equations",,"Eur.Phys.J.C70:1037-1049,2010","10.1140/epjc/s10052-010-1499-8","INT-PUB-10-043","hep-ph hep-lat nucl-th","http://arxiv.org/licenses/nonexclusive-distrib/1.0/","  We report on an analysis of the quark spectral representation at finite
temperatures based on the quark propagator determined from its Dyson-Schwinger
equation in Landau gauge. In Euclidean space we achieve nice agreement with
recent results from quenched lattice QCD. We find different analytical
properties of the quark propagator below and above the deconfinement
transition. Using a variety of ansaetze for the spectral function we then
analyze the possible quasiparticle spectrum, in particular its quark mass and
momentum dependence in the high temperature phase. This analysis is completed
by an application of the Maximum Entropy Method, in principle allowing for any
positive semi-definite spectral function. Our results motivate a more direct
determination of the spectral function in the framework of Dyson-Schwinger
equations.
","[{""version"":""v1"",""created"":""Mon, 20 Sep 2010 10:20:23 GMT""}]","2010-12-15"
"1009.3763","Siegfried Bethke","Siegfried Bethke","Data Preservation in High Energy Physics - why, how and when?","5 pages, 3 figures; presentation given at the QCD10, Montpellier,
  France, June 2010","Nucl.Phys.Proc.Suppl.207-208:156-159,2010","10.1016/j.nuclphysbps.2010.10.040",,"hep-ex cs.DL physics.data-an","http://arxiv.org/licenses/nonexclusive-distrib/1.0/","  Long-term preservation of data and software of large experiments and
detectors in high energy physics is of utmost importance to secure the heritage
of (mostly unique) data and to allow advanced physics (re-)analyses at later
times. Summarising the work of an international study group, motivation, use
cases and technical details are given for an organised effort to secure and
enable future use of past, present and future experimental data. As a practical
use case and motivation, the revival of JADE data and the corresponding latest
results on measuring $\alpha_s$ in NNLO QCD are reviewed.
","[{""version"":""v1"",""created"":""Mon, 20 Sep 2010 10:25:22 GMT""}]","2011-02-15"
"1009.3764","D. R. Heath-Brown","D.R. Heath-Brown","A Note on the Chevalley--Warning Theorems",,"Uspekhi Mat. Nauk 66 (2011), no. 2(398), 223--232; translation in
  Russian Math. Surveys 66 (2011), no. 2, 427--436","10.1070/RM2011v066n02ABEH004744",,"math.NT math.AG","http://arxiv.org/licenses/nonexclusive-distrib/1.0/","  Let $f_1,\...,f_r$ be polynomials in $n$ variables over a finite field $F$ of
cardinality $q$ and characteristic $p$. Let $f_i$ have total degree $d_i$ and
define $d=d_1+\...+d_r$. Write $Z$ for the set of common zeros of the $f_i$,
over the field $F$. Warning showed that $#(Z\cap H_1)\equiv#(Z\cap H_2)\mod{p}$
for any two parallel affine hyperplanes $H_1,H_2$ in $F^n$. We prove that the
same congruence holds to modulus $q$. Warning also proved that $# Z\ge q^{n-d}$
providing that $Z$ is non-empty. We sharpen this inequality in various ways,
assuming that $Z$ is not a linear subspace of $F^n$.
","[{""version"":""v1"",""created"":""Mon, 20 Sep 2010 10:41:28 GMT""},{""version"":""v2"",""created"":""Fri, 23 Sep 2016 16:21:29 GMT""}]","2016-09-26"
"1009.3765","Germ\'an Vidal","Peter Biener, Fran\c{c}ois Degrave, Wim Vanhoof","A Test Automation Framework for Mercury","Online proceedings of the Joint Workshop on Implementation of
  Constraint Logic Programming Systems and Logic-based Methods in Programming
  Environments (CICLOPS-WLPE 2010), Edinburgh, Scotland, U.K., July 15, 2010","Proceedings of CICLOPS-WLPE 2010",,,"cs.LO","http://arxiv.org/licenses/nonexclusive-distrib/1.0/","  This paper presents a test automation framework for Mercury programs. We
developed a method that generates runnable Mercury code from a formalized test
suite, and which code provides a report on execution about the success of test
cases. We also developed a coverage tool for the framework, which identifies
and provide a visualization of the reached parts of the program when executing
a given test suite.
","[{""version"":""v1"",""created"":""Mon, 20 Sep 2010 10:43:19 GMT""}]","2010-09-21"
"1009.3766","Willi Mohring","Willi Mohring","A well posed acoustic analogy based on a moving acoustic medium","14 pages, 2 figures Presented at the Aeroacoustic workshop SWING,
  Dresden 1999",,,,"physics.flu-dyn","http://arxiv.org/licenses/nonexclusive-distrib/1.0/","  For flows of a lossless gas, the stagnation enthalpy obeys a linear convected
wave equation with coefficients which depend on the flow variables. This
equation is self-adjoint and one has a reciprocity relation between source and
observer. It fulfills for subsonic flow a quadratic conservation equation
implying stability. It is taken as basis for an acoustic analogy and is applied
to the sound generation by the collision of a convected vortex and a rigid
cylinder.
","[{""version"":""v1"",""created"":""Mon, 20 Sep 2010 10:44:48 GMT""}]","2010-09-21"
"1009.3767","Kristian Debrabant","Kristian Debrabant and Giovanni Samaey","A micro/macro algorithm to accelerate Monte Carlo simulation of
  stochastic differential equations",,,,,"math.NA","http://arxiv.org/licenses/nonexclusive-distrib/1.0/","  We present and analyze a micro/macro acceleration technique for the Monte
Carlo simulation of stochastic differential equations (SDEs) in which there is
a separation between the (fast) time-scale on which individual trajectories of
the SDE need to be simulated and the (slow) time-scale on which we want to
observe the (macroscopic) function of interest. The method performs short
bursts of microscopic simulation using an ensemble of SDE realizations, after
which the ensemble is restricted to a number of macroscopic state variables.
The resulting macroscopic state is then extrapolated forward in time and the
ensemble is projected onto the extrapolated macroscopic state. We provide a
first analysis of its convergence in terms of extrapolation time step and
number of macroscopic state variables. The effects of the different
approximations on the resulting error are illustrated via numerical
experiments.
","[{""version"":""v1"",""created"":""Mon, 20 Sep 2010 10:45:51 GMT""},{""version"":""v2"",""created"":""Sat, 5 Nov 2011 10:09:21 GMT""}]","2011-11-08"
"1009.3768","Paramita Kar Choudhury","Paramita Kar Choudhury, Debjani Bagchi, C. S. Suchand Sangeeth, and
  Reghu Menon","Modified conformation and physical properties in conducting polymers due
  to varying conjugation and solvent interactions","Accepted in J. Mater. Chem",,,,"cond-mat.soft","http://arxiv.org/licenses/nonexclusive-distrib/1.0/","  Small angle X-ray scattering (SAXS) studies in
poly[2-methoxy-5-(2'-ethyl-hexyloxy)-1,4-phenylene vinylene] (MEH-PPV) with
varying conjugation, and polyethylene dioxythiophene complexed with polystyrene
sulfonate (PEDOT-PSS) in different solvents have shown the important role of
pi-electron conjugation and solvent-chain interactions in controlling the chain
conformation and assembly. In MEH-PPV, by increasing the extent of conjugation
from 30 to 100 %, the persistence length (l_p) increases from 20 to 66
Angstrom. Moreover, a pronounced second peak in the pair distribution function
has been observed in fully conjugated chain, at larger length scales. This
feature indicates that the chain segments tend to self-assemble as the
conjugation along the chain increases. In case of PEDOT-PSS, the chains undergo
solvent induced expansion and enhanced chain organization. The clusters formed
by chains are better correlated in dimethyl sulfoxide (DMSO) solution than
water, as observed in the scattered intensity profiles. The values of radius of
gyration and the exponent (water: 2.6, DMSO: 2.31) of power-law decay, obtained
from the unified scattering function (Beaucage) analysis, give evidence for
chain expansion from compact (in water) to extended coil in DMSO solutions,
which is consistent with the Kratky plot analysis. The mechanism of this
transition and the increase in dc conductivity of PEDOT-PSS in DMSO solution
are discussed. The onset frequency for the increase in ac conduction as well as
its temperature dependence probes the extent of connectivity in PEDOT-PSS
system. The enhanced charge transport in PEDOT-PSS in DMSO is attributed to the
extended chain conformation as observed in SAXS results.
","[{""version"":""v1"",""created"":""Mon, 20 Sep 2010 10:47:29 GMT""},{""version"":""v2"",""created"":""Wed, 10 Nov 2010 19:52:17 GMT""}]","2010-11-11"
