"1009.3928","Jianfeng Wu","Jianfeng Wu, W. N. Brandt, M. L. Comins, Robert R. Gibson, Ohad
  Shemmer, Gordon P. Garmire, Donald P. Schneider","The X-Ray Properties of the Optically Brightest Mini-BAL Quasars from
  the Sloan Digital Sky Survey","ApJ accepted; 21 pages, 11 figures, and 9 tables","2010ApJ...724..762W","10.1088/0004-637X/724/1/762",,"astro-ph.CO astro-ph.HE","http://arxiv.org/licenses/nonexclusive-distrib/1.0/","  We have compiled a sample of 14 of the optically brightest radio-quiet
quasars ($m_{i}$~$\le$~17.5 and $z$~$\ge$~1.9) in the Sloan Digital Sky Survey
Data Release 5 quasar catalog that have C IV mini-BALs present in their
spectra. X-ray data for 12 of the objects were obtained via a Chandra snapshot
survey using ACIS-S, while data for the other two quasars were obtained from
archival XMM-Newton observations. Joint X-ray spectral analysis shows the
mini-BAL quasars have a similar average power-law photon index
($\Gamma\approx1.9$) and level of intrinsic absorption ($N_H \lesssim 8\times
10^{21} \ {\rm cm}^{-2}$) as non-BMB (neither BAL nor mini-BAL) quasars.
Mini-BAL quasars are more similar to non-BMB quasars than to BAL quasars in
their distribution of relative X-ray brightness (assessed with
$\Delta\alpha_{\rm ox}$). Relative colors indicate mild dust reddening in the
optical spectra of mini-BAL quasars. Significant correlations between
$\Delta\alpha_{\rm ox}$ and UV absorption properties are confirmed for a sample
of 56 sources combining mini-BAL and BAL quasars with high signal-to-noise
ratio rest-frame UV spectra, which generally supports models in which X-ray
absorption is important in enabling driving of the UV absorption-line wind. We
also propose alternative parametrizations of the UV absorption properties of
mini-BAL and BAL quasars, which may better describe the broad absorption
troughs in some respects.
","[{""version"":""v1"",""created"":""Mon, 20 Sep 2010 20:00:01 GMT""}]","2015-03-31"
"1009.3929","Markos Maniatis","B. A. Kniehl, M. Maniatis, M. M. Weber","Supersymmetric QCD corrections to $e^+e^-\to t\bar{b}H^-$ and the
  Bernstein-Tkachov method of loop integration","14 pages, 6 figures, accepted for publication in Phys. Rev. D","Phys.Rev.D83:015011,2011","10.1103/PhysRevD.83.015011","DESY 10-153, HD-THEP-10-17, MPP-2010-126","hep-ph","http://arxiv.org/licenses/nonexclusive-distrib/1.0/","  The discovery of charged Higgs bosons is of particular importance, since
their existence is predicted by supersymmetry and they are absent in the
Standard Model (SM). If the charged Higgs bosons are too heavy to be produced
in pairs at future linear colliders, single production associated with a top
and a bottom quark is enhanced in parts of the parameter space. We present the
next-to-leading-order calculation in supersymmetric QCD within the minimal
supersymmetric SM (MSSM), completing a previous calculation of the SM-QCD
corrections. In addition to the usual approach to perform the loop integration
analytically, we apply a numerical approach based on the Bernstein-Tkachov
theorem. In this framework, we avoid some of the generic problems connected
with the analytical method.
","[{""version"":""v1"",""created"":""Mon, 20 Sep 2010 20:00:02 GMT""},{""version"":""v2"",""created"":""Tue, 11 Jan 2011 14:25:48 GMT""}]","2011-02-25"
"1009.3930","Michael Lerchster","M. Lerchster, S. Seitz, F. Brimioulle, R. Fassbender, M. Rovilos, H.
  B\""ohringer, D. Pierini, M. Kilbinger, A. Finoguenov, H. Quintana and R.
  Bender","The Massive Galaxy Cluster XMMU J1230.3+1339 at z ~ 1: Colour-magnitude
  relation, Butcher-Oemler effect, X-ray and weak lensing mass estimates","29 pages, 34 figures, 6 tables, full resolution pdf-file available at
  http://www.usm.uni-muenchen.de/people/mike/XMMUJ1230_MNRAS.pdf, submitted to
  MNRAS, shortened abstract",,"10.1111/j.1365-2966.2010.17874.x",,"astro-ph.CO","http://arxiv.org/licenses/nonexclusive-distrib/1.0/","  We present results from the multi-wavelength study of XMMU J1230.3+1339 at z
~ 1. We analyze deep multi-band wide-field images from the Large Binocular
Telescope, multi-object spectroscopy observations from VLT, as well as
space-based serendipitous observations, from the GALEX and Chandra X-ray
observatories. We apply a Bayesian photometric redshift code to derive the
redshifts using the FUV, NUV and the deep U, B, V, r, i, z data. We achieve an
accuracy of $\triangle z/(1+z)$ = 0.07 (0.04) and the fraction of catastrophic
outliers is $\eta$ = 13 (0)%, when using all (secure) spectroscopic data,
respectively. The i - z against z colour-magnitude relation of the photo-z
members shows a tight red-sequence with a zero point of 0.935 mag, and slope
equal to -0.027. We observe evidence for a truncation at the faint end of the
red-cluster-sequence and the Butcher-Oemler effect, finding a fraction of blue
galaxies $f_b \approx$ 0.5. Further we conduct a weak lensing analysis of the
deep 26' $\times$ 26' r-band LBC image. The observed shear is fitted with a
Single-Isothermal-Sphere and a Navarro-Frenk-White model to obtain the velocity
dispersion and the model parameters, respectively. Our best fit values are, for
the velocity dispersion $\sigma_{SIS}$ = 1308 $\pm$ 284, concentration
parameter c = 4.0$^{+14}_{-2}$ and scale radius r$_{s}$ = 345$^{+50}_{-57}$
kpc. Combining our mass estimates from the kinematic, X-ray and weak lensing
analyses we obtain a total cluster mass of $M^{tot}_{200}$ = (4.56 $\pm$ 2.3)
$\times$ 10$^{14}$ M$_{\sun}$. This study demonstrates the feasibility of
ground based weak lensing measurements of galaxy clusters up to z ~ 1.
","[{""version"":""v1"",""created"":""Mon, 20 Sep 2010 20:00:03 GMT""}]","2015-05-20"
"1009.3931","Susha Parameswaran","Susha L. Parameswaran, Saul Ramos-Sanchez and Ivonne Zavala","On Moduli Stabilisation and de Sitter Vacua in MSSM Heterotic Orbifolds","55 pages, 2 figures, v2: added link to mathematica files, other minor
  revisions, matches JHEP version","JHEP 1101:071,2011","10.1007/JHEP01(2011)071","DESY 10-148, UUITP-33/10","hep-th hep-ph","http://arxiv.org/licenses/nonexclusive-distrib/1.0/","  We study the problem of moduli stabilisation in explicit heterotic orbifold
compactifications, whose spectra contain the MSSM plus some vector-like exotics
that can be decoupled. Considering all the bulk moduli, we obtain the 4D low
energy effective action for the compactification, which has contributions from
various, computable, perturbative and non-perturbative effects. Hidden sector
gaugino condensation and string worldsheet instantons result in a combination
of racetrack, KKLT and cusp-form contributions to the superpotential, which
lift all the bulk moduli directions. We point out the properties observed in
our concrete models, which tend to be missed when only ""generic"" features of a
model are assumed. We search for interesting vacua and find several de Sitter
solutions, but -- so far -- they all turn out to be unstable.
","[{""version"":""v1"",""created"":""Mon, 20 Sep 2010 20:00:05 GMT""},{""version"":""v2"",""created"":""Thu, 9 Dec 2010 12:48:39 GMT""}]","2011-01-28"
"1009.3932","Rishi Khatri","Rishi Khatri and Rashid A. Sunyaev","Time of primordial Be-7 conversion into Li-7, energy release and doublet
  of narrow cosmological neutrino lines","Minor typos corrected","Astronomy Letters 37, 367 (2011)","10.1134/S1063773711060041",,"astro-ph.CO nucl-th","http://arxiv.org/licenses/nonexclusive-distrib/1.0/","  One of the important light elements created during the big bang
nucleosynthesis is Be-7 which then decays to Li-7 by electron capture when
recombination becomes effective but well before the Saha equilibrium
recombination is reached. This means that Be-7 should wait until its
recombination epoch even though the half-life of the hydrogenic beryllium atom
is only 106.4 days. We calculate when the conversion from primordial Be-7 to
Li-7 occurs taking into account the population of the hyperfine structure
sublevels and solving the kinetic equations for recombination, photoionization
and conversion rate. We also calculate the energies and the spectrum of narrow
neutrino doublet lines resulting from Be-7 decay.
","[{""version"":""v1"",""created"":""Mon, 20 Sep 2010 20:00:05 GMT""},{""version"":""v2"",""created"":""Tue, 31 May 2011 15:13:14 GMT""}]","2011-06-15"
"1009.3933","Frantz Martinache","Frantz Martinache","Kernel-Phase in Fizeau Inteferometry","7 pages, 5 figures, accepted for publication in ApJ",,"10.1088/0004-637X/724/1/464",,"astro-ph.IM","http://creativecommons.org/licenses/by/3.0/","  The detection of high contrast companions at small angular separation appears
feasible in conventional direct images using the self-calibration properties of
interferometric observable quantities. The friendly notion of closure-phase,
which is key to the recent observational successes of non-redundant aperture
masking interferometry used with Adaptive Optics, appears to be one example of
a wide family of observable quantities that are not contaminated by
phase-noise. In the high-Strehl regime, soon to be available thanks to the
coming generation of extreme Adaptive Optics systems on ground based
telescopes, and already available from space, closure-phase like information
can be extracted from any direct image, even taken with a redundant aperture.
These new phase-noise immune observable quantities, called kernel-phases, are
determined a-priori from the knowledge of the geometry of the pupil only.
Re-analysis of archive data acquired with the Hubble Space Telescope NICMOS
instrument, using this new kernel-phase algorithm demonstrates the power of the
method as it clearly detects and locates with milli-arcsecond precision a known
companion to a star at angular separation less than the diffraction limit.
","[{""version"":""v1"",""created"":""Mon, 20 Sep 2010 20:00:07 GMT""}]","2015-05-20"
"1009.3934","David Sanford","Jonathan L. Feng and David Sanford","Heart of Darkness: The Significance of the Zeptobarn Scale for
  Neutralino Direct Detection","35 pages, 11 figures; v2: references added, figures extended to 2 TeV
  neutralino masses, XENON100 results included, published version","JCAP 1105:018,2011","10.1088/1475-7516/2011/05/018","UCI-TR-2010-16","hep-ph astro-ph.CO","http://arxiv.org/licenses/nonexclusive-distrib/1.0/","  The direct detection of dark matter through its elastic scattering off
nucleons is among the most promising methods for establishing the particle
identity of dark matter. The current bound on the spin-independent scattering
cross section is sigma^SI < 10 zb for dark matter masses m_chi ~ 100 GeV, with
improved sensitivities expected soon. We examine the implications of this
progress for neutralino dark matter. We work in a supersymmetric framework
well-suited to dark matter studies that is simple and transparent, with models
defined in terms of four weak-scale parameters. We first show that robust
constraints on electric dipole moments motivate large sfermion masses mtilde >
1 TeV, effectively decoupling squarks and sleptons from neutralino dark matter
phenomenology. In this case, we find characteristic cross sections in the
narrow range 1 zb < sigma^SI < 40 zb for m_chi > 70 GeV. As sfermion masses are
lowered to near their experimental limit mtilde ~ 400 GeV, the upper and lower
limits of this range are extended, but only by factors of around two, and the
lower limit is not significantly altered by relaxing many particle physics
assumptions, varying the strange quark content of the nucleon, including the
effects of galactic small-scale structure, or assuming other components of dark
matter. Experiments are therefore rapidly entering the heart of dark
matter-favored supersymmetry parameter space. If no signal is seen,
supersymmetric models must contain some level of fine-tuning, and we identify
and analyze several possibilities. Barring large cancellations, however, in a
large and generic class of models, if thermal relic neutralinos are a
significant component of dark matter, experiments will discover them as they
probe down to the zeptobarn scale.
","[{""version"":""v1"",""created"":""Mon, 20 Sep 2010 20:00:08 GMT""},{""version"":""v2"",""created"":""Thu, 12 May 2011 15:39:57 GMT""}]","2011-05-25"
"1009.3935","Andrew Pontzen","Andrew Pontzen and Anthony Challinor","Linearization of homogeneous, nearly-isotropic cosmological models","31 pages, 2 figures. Submitted to CQG","Class.Quant.Grav.28:185007,2011","10.1088/0264-9381/28/18/185007",,"gr-qc astro-ph.CO","http://arxiv.org/licenses/nonexclusive-distrib/1.0/","  Homogeneous, nearly-isotropic Bianchi cosmological models are considered.
Their time evolution is expressed as a complete set of non-interacting linear
modes on top of a Friedmann-Robertson-Walker background model. This connects
the extensive literature on Bianchi models with the more commonly-adopted
perturbation approach to general relativistic cosmological evolution.
Expressions for the relevant metric perturbations in familiar coordinate
systems can be extracted straightforwardly. Amongst other possibilities, this
allows for future analysis of anisotropic matter sources in a more general
geometry than usually attempted.
  We discuss the geometric mechanisms by which maximal symmetry is broken in
the context of these models, shedding light on the origin of different Bianchi
types. When all relevant length-scales are super-horizon, the simplest Bianchi
I models emerge (in which anisotropic quantities appear parallel transported).
  Finally we highlight the existence of arbitrarily long near-isotropic epochs
in models of general Bianchi type (including those without an exact isotropic
limit).
","[{""version"":""v1"",""created"":""Mon, 20 Sep 2010 20:01:01 GMT""}]","2011-09-08"
"1009.3936","Adi Zitrin","Adi Zitrin, Tom Broadhurst, Dan Coe, Jori Liesenborgs, Narciso
  Benitez, Yoel Rephaeli, Holland Ford, Keiichi Umetsu","Strong-Lensing Analysis of MS 1358.4+6245: New Multiple Images and
  Implications for the Well-Resolved z=4.92 Galaxy","11 pages, 1 table, 9 figures; submitted to MNRAS",,"10.1111/j.1365-2966.2011.18252.x",,"astro-ph.CO","http://arxiv.org/licenses/nonexclusive-distrib/1.0/","  We present a strong-lensing analysis of the galaxy cluster MS 1358.4+6245
($z=0.33$), in deep 6-band ACS/HST imaging. In addition to the well-studied
system at $z=4.92$, our modelling method uncovers 19 new multiply-lensed images
so that a total of 23 images and their redshifts are used to accurately
constrain the inner mass distribution. We derive a relatively shallow inner
mass profile, $d\log \Sigma/d\log r\simeq -0.33 \pm0.05$ ($r<200$ kpc), with a
much higher magnification than estimated previously by models constrained only
by the $z=4.92$ system. Using these many new images we can apply a
non-parametric adaptive-grid method, which also yields a shallow mass profile
without prior assumptions, strengthening our conclusions. The total
magnification of the $z_s=4.92$ galaxy is high, about a $\sim100\times$ over
its four images, so that the inferred source size, luminosity and
star-formation rate are about $\sim5\times$ smaller than previous estimates,
corresponding to a dwarf-sized galaxy of radius $\simeq1$ kpc. A detailed image
of the interior morphology of the source is generated with a high effective
resolution of only $\simeq$50 pc, thanks to the high magnification and to the
declining angular diameter distance above $z\sim1.5$ for the standard
cosmology, so that this image apparently represents the best resolved object
known at high redshift.
","[{""version"":""v1"",""created"":""Mon, 20 Sep 2010 20:01:16 GMT""}]","2013-07-09"
"1009.3937","Selma de Mink","S. E. de Mink, N. Langer, R. G. Izzard","Fast rotating stars resulting from binary evolution will often appear to
  be single","2 pages, 1 figure, to be published in the proceedings of IAU 272
  ""Active OB stars: structure, evolution, mass loss and critical limit"", Paris
  19-23 July 2010",,"10.1017/S174392131101132X",,"astro-ph.SR","http://arxiv.org/licenses/nonexclusive-distrib/1.0/","  Rapidly rotating stars are readily produced in binary systems. An accreting
star in a binary system can be spun up by mass accretion and quickly approach
the break-up limit. Mergers between two stars in a binary are expected to
result in massive, fast rotating stars. These rapid rotators may appear as Be
or Oe stars or at low metallicity they may be progenitors of long gamma-ray
bursts.
  Given the high frequency of massive stars in close binaries it seems likely
that a large fraction of rapidly rotating stars result from binary interaction.
It is not straightforward to distinguish a a fast rotator that was born as a
rapidly rotating single star from a fast rotator that resulted from some kind
of binary interaction. Rapidly rotating stars resulting from binary interaction
will often appear to be single because the companion tends to be a low mass,
low luminosity star in a wide orbit. Alternatively, they became single stars
after a merger or disruption of the binary system during the supernova
explosion of the primary.
  The absence of evidence for a companion does not guarantee that the system
did not experience binary interaction in the past. If binary interaction is one
of the main causes of high stellar rotation rates, the binary fraction is
expected to be smaller among fast rotators. How this prediction depend on
uncertainties in the physics of the binary interactions requires further
investigation.
","[{""version"":""v1"",""created"":""Mon, 20 Sep 2010 20:01:35 GMT""}]","2015-05-20"
"1009.3938","Jan Kotanski","J. Bartels, J. Kotanski, V. Schomerus","Excited Hexagon Wilson Loops for Strongly Coupled N=4 SYM","25 pages, 5 figures; published version -- added deeper interpretation
  of the results","JHEP 1101:096,2011","10.1007/JHEP01(2011)096","DESY--10--157","hep-th","http://arxiv.org/licenses/nonexclusive-distrib/1.0/","  This work is devoted to the six-gluon scattering amplitude in strongly
coupled N=4 supersymmetric Yang-Mills theory. At weak coupling, an appropriate
high energy limit of the so-called remainder function, i.e. of the deviation
from the BDS formula, may be understood in terms of the lowest eigenvalue of
the BFKL hamiltonian. According to Alday et al., amplitudes in the strongly
coupled theory can be constructed through an auxiliary 1-dimensional quantum
system. We argue that certain excitations of this quantum system determine the
Regge limit of the remainder function at strong coupling and we compute its
precise value.
","[{""version"":""v1"",""created"":""Mon, 20 Sep 2010 20:02:52 GMT""},{""version"":""v2"",""created"":""Mon, 11 Oct 2010 13:10:34 GMT""},{""version"":""v3"",""created"":""Fri, 14 Jan 2011 13:48:24 GMT""}]","2011-02-01"
"1009.3939","Valentina Forini","Valentina Forini","Quark-antiquark potential in AdS at one loop","16 pages. Typos corrected, minor changes","JHEP 1011:079,2010","10.1007/JHEP11(2010)079","AEI-2010-150","hep-th","http://arxiv.org/licenses/nonexclusive-distrib/1.0/","  We derive an exact analytical expression for the one-loop partition function
of a string in AdS_5xS^5 background with world-surface ending on two
anti-parallel lines. All quantum fluctuations are shown to be governed by
integrable, single-gap Lame' operators. The first strong coupling correction to
the quark-antiquark potential, as defined in N=4 SYM, is derived as the sum of
known mathematical constants and a one-dimensional integral representation. Its
full numerical value can be given with arbitrary precision and confirms a
previous result.
","[{""version"":""v1"",""created"":""Mon, 20 Sep 2010 20:03:00 GMT""},{""version"":""v2"",""created"":""Mon, 4 Oct 2010 13:47:22 GMT""}]","2011-06-21"
"1009.3940","Nicholas McConnell","Nicholas J. McConnell, Anne M. Medling, Linda E. Strubbe, Pimol Moth,
  Ryan M. Montgomery, Lynne M. Raschke, Lisa Hunter, and Barbara Goza","A College-Level Inquiry-Based Laboratory Activity on Transiting Planets","10 pages, 1 figure, 1 table","ASP Conference Series, 2010, Vol. 436: Learning from Inquiry in
  Practice, pg. 97-107",,,"astro-ph.EP physics.ed-ph","http://arxiv.org/licenses/nonexclusive-distrib/1.0/","  We have designed an inquiry-based laboratory activity on transiting
extrasolar planets for an introductory college-level astronomy class. The
activity was designed with the intent of simultaneously teaching science
process skills and factual content about transits and light curves. In the
activity, groups of two to four students each formulate a specific science
question and design and carry out an investigation using a table-top model of a
star and orbiting planet. Each group then presents their findings to other
students in their class. In a final presentation, the instructors integrate
students' findings with a summary of how measured light curves indicate
properties of planetary systems. The activity debuted at Hartnell College in
November 2009 and has also been adapted for a lecture-based astronomy course at
U.C. Santa Cruz. We present the results of student surveys before and after the
astronomy course at Hartnell and discuss how well our activity promotes
students' confidence and identity as scientists, relative to traditional lab
activities.
","[{""version"":""v1"",""created"":""Mon, 20 Sep 2010 20:07:08 GMT""},{""version"":""v2"",""created"":""Wed, 13 Jun 2012 18:03:17 GMT""}]","2012-06-14"
"1009.3941","James Day","J. S. Bobowski, J. C. Baglo, James Day, P. Dosanjh, Rinat Ofer, B. J.
  Ramshaw, Ruixing Liang, D. A. Bonn, W. N. Hardy, Huiqian Luo, Zhao-Sheng
  Wang, Lei Fang, Hai-Hu Wen","Precision Microwave Electrodynamic Measurements of K- and Co-doped
  BaFe$_2$As$_2$","11 pages, 11 figures, to be published in Phys. Rev. B","Phys. Rev. B 82, 094520 (2010)","10.1103/PhysRevB.82.094520",,"cond-mat.supr-con","http://arxiv.org/licenses/nonexclusive-distrib/1.0/","  We have studied the microwave electrodynamics of single crystal iron-based
superconductors Ba$_{0.72}$K$_{0.28}$Fe$_2$As$_2$ (hole-doped, $T_\mathrm{c}$
$\approx $30 K) and Ba(Fe$_{0.95}$Co$_{0.05}$)$_2$As$_2$ (electron-doped,
$T_\mathrm{c}$ $\approx$20 K), by cavity perturbation and broadband
spectroscopy. SQUID magnetometry was used to confirm the quality and
homogeneity of the samples under study. Through cavity perturbation techniques,
the temperature dependence of the in-plane London penetration depth
$\Delta\lambda(T)$, and therefore the superfluid phase stiffness
$\lambda^2(0)/\lambda^2(T)$ was measured. Down to 0.4 K, the data do not show
the exponential saturation at low temperatures expected from a singly-,
fully-gapped superconductor. Rather, both the electron- and the hole-doped
systems seem to be best described by a power law behavior, with
$\lambda^2(0)/\lambda^2(T)$ $\sim$ $T^n$ and \emph{n} $\approx$ 2.5. In the
three samples we studied, a weak feature near the sensitivity limit of our
measurements appears near $T/T_\mathrm{c}$ =~0.04, hinting at a corresponding
low energy feature in the superconducting density of states. The data can also
be relatively well-described by a simple two-gap s-wave model of the order
parameter, but this yields parameters which seem unrealistic and dependent on
the fit range. Broadband surface resistance measurements reveal a sample
dependent residual loss whose origin is unclear. The data from the \FeAs
samples can be made to scale as $\omega^2$ if the extrinsic loss is treated as
an additive component, indicating large scattering rates. Finally, the
temperature dependence of the surface resistance at 13 GHz obeys a power law
very similar to those observed for $\Delta\lambda(T)$.
","[{""version"":""v1"",""created"":""Mon, 20 Sep 2010 20:08:06 GMT""},{""version"":""v2"",""created"":""Wed, 22 Sep 2010 04:05:43 GMT""}]","2020-08-13"
"1009.3942","Ahsan Nazir","Dara P. S. McCutcheon and Ahsan Nazir","Coherent and incoherent dynamics in excitonic energy transfer:
  correlated fluctuations and off-resonance effects","14 pages, 7 figures, builds upon PRL 103, 146404 (2009)
  (arXiv:0906.0592). Comments welcome. V2 - Section IV shortened to improve
  presentation, references updated, new Imperial College affiliation added for
  A. Nazir. Published version","Phys. Rev. B 83, 165101 (2011)","10.1103/PhysRevB.83.165101",,"quant-ph cond-mat.mes-hall","http://arxiv.org/licenses/nonexclusive-distrib/1.0/","  We study the nature of the energy transfer process within a pair of coupled
two-level systems (donor and acceptor) subject to interactions with the
surrounding environment. Going beyond a standard weak-coupling approach, we
derive a master equation within the polaron representation that allows for
investigation of both weak and strong system-bath couplings, as well as
reliable interpolation between these two limits. With this theory, we are then
able to explore both coherent and incoherent regimes of energy transfer within
the donor-acceptor pair. We elucidate how the degree of correlation in the
donor and acceptor fluctuations, the donor-acceptor energy mismatch, and the
range of the environment frequency distribution impact upon the energy transfer
dynamics. In the resonant case (no energy mismatch) we describe in detail how a
crossover from coherent to incoherent transfer dynamics occurs with increasing
temperature [A. Nazir, Phys. Rev. Lett. 103, 146404 (2009)], and we also
explore how fluctuation correlations are able to protect coherence in the
energy transfer process. We show that a strict crossover criterion is harder to
define when off-resonance, though we find qualitatively similar population
dynamics to the resonant case with increasing temperature, while the amplitude
of coherent population oscillations also becomes suppressed with growing site
energy mismatch.
","[{""version"":""v1"",""created"":""Mon, 20 Sep 2010 20:14:49 GMT""},{""version"":""v2"",""created"":""Mon, 4 Apr 2011 11:11:26 GMT""}]","2011-04-05"
