"1009.3977","Marlene Marchena","Marlene Silva Marchena","Measuring and implementing the bullwhip effect under a generalized
  demand process","24 pages and 3 figures",,,,"stat.AP","http://arxiv.org/licenses/nonexclusive-distrib/1.0/","  The measure of the bullwhip effect, a phenomenon in which demand variability
increases as one moves up the supply chain, is a major issue in Supply Chain
Management. Although it is simply defined (it is the ratio of the unconditional
variance of the order process to that of the demand process), explicit formulas
are difficult to obtain. In this paper we investigate the theoretical and
practical issues of Zhang [Manufacturing and Services Operations Management 6-2
(2004b) 195] with the purpose of quantifying the bullwhip effect. Considering a
two-stage supply chain, the bullwhip effect is measured for an ARMA(p,q) demand
process admitting an infinite moving average representation. As particular
cases of this time series model, the AR(p), MA(q), ARMA(1,1), AR(1) and AR(2)
are discussed. For some of them, explicit formulas are obtained. We show that
for certain types of demand processes, the use of the optimal forecasting
procedure that minimizes the mean squared forecasting error leads to
significant reduction in the safety stock level. This highlights the potential
economic benefits resulting from the use of this time series analysis. Finally,
an R function called SCperf is programmed to calculate the bullwhip effect and
other supply chain performance variables. It leads to a simple but powerful
tool which could benefit both managers and researchers.
","[{""version"":""v1"",""created"":""Tue, 21 Sep 2010 01:05:33 GMT""},{""version"":""v2"",""created"":""Tue, 28 Sep 2010 12:28:03 GMT""},{""version"":""v3"",""created"":""Tue, 19 Oct 2010 17:29:52 GMT""}]","2010-10-20"
"1009.3978","Ronghua Pan","Feimin Huang, Ronghua Pan, Tianyi Wang, Yong Wang and Xiaoyun Zhai","Vanishing Viscosity Limit for Isentropic Navier-Stokes Equations with
  Density-dependent Viscosity",,,,,"math.AP","http://arxiv.org/licenses/nonexclusive-distrib/1.0/","  In this paper, we study the vanishing viscosity limit of one-dimensional
isentropic compressible Navier-Stokes equations with density-dependent
viscosity, to the isentropic compressible Euler equations. Based on several new
uniform estimates to the viscous systems, in addition to the framework recently
established by G. Chen and M. Perepelitsa, we justify that the finite energy
solution of the isentropic compressible Euler equations for a large class of
initial data can be obtained as the inviscid limit of the compressible
Navier-Stokes equations even when the viscosity depends on the density.
","[{""version"":""v1"",""created"":""Tue, 21 Sep 2010 01:06:19 GMT""}]","2010-09-22"
"1009.3979","Miguel Socolovsky","M. Socolovsky","Locally inertial coordinates with totally antisymmetric torsion","7 pages",,,,"gr-qc math-ph math.MP","http://arxiv.org/licenses/nonexclusive-distrib/1.0/","  We show that the necessary and sufficient condition for erecting locally
inertial coordinates at a point $p$ of a $U^4$-space, and therefore assuring
the validity of the equivalence principle at that point, is the vanishing at
$p$ of the symmetric part of the contortion tensor. This fact does not demand a
vanishing torsion, but only a totally antisymmetric one. As an application, we
derive the geodesic deviation equation; and prove the compatibility with the
Newtonian limit.
","[{""version"":""v1"",""created"":""Tue, 21 Sep 2010 01:18:16 GMT""},{""version"":""v2"",""created"":""Mon, 25 Apr 2011 22:21:26 GMT""}]","2011-04-27"
"1009.3980","Eiko Yoneki","Mervyn P. Freeman, Nicholas W. Watkins, Eiko Yoneki, Jon Crowcroft","Rhythm and Randomness in Human Contact",,"International Conference on Advances in Social Networks Analysis
  and Mining, 2010","10.1109/ASONAM.2010.57",,"physics.data-an physics.bio-ph physics.soc-ph","http://arxiv.org/licenses/nonexclusive-distrib/1.0/","  There is substantial interest in the effect of human mobility patterns on
opportunistic communications. Inspired by recent work revisiting some of the
early evidence for a L\'evy flight foraging strategy in animals, we analyse
datasets on human contact from real world traces. By analysing the distribution
of inter-contact times on different time scales and using different graphical
forms, we find not only the highly skewed distributions of waiting times
highlighted in previous studies but also clear circadian rhythm. The relative
visibility of these two components depends strongly on which graphical form is
adopted and the range of time scales. We use a simple model to reconstruct the
observed behaviour and discuss the implications of this for forwarding
efficiency.
","[{""version"":""v1"",""created"":""Tue, 21 Sep 2010 01:20:07 GMT""}]","2010-10-01"
"1009.3981","Taro Yamashita","Taro Yamashita, Shigehito Miki, Wei Qiu, Mikio Fujiwara, Masahide
  Sasaki, and Zhen Wang","Temperature Dependent Performances of Superconducting Nanowire
  Single-Photon Detectors in an Ultralow-Temperature Region","12 pages, 3 figures","Applied Physics Express 3 (2010) 102502","10.1143/APEX.3.102502",,"quant-ph cond-mat.supr-con","http://arxiv.org/licenses/nonexclusive-distrib/1.0/","  We present the performances of a superconducting nanowire single-photon
detector (SNSPD) in an ultralow-temperature region from 16 mK to 4 K. The
system detection efficiency of the SNSPD showed saturation in the bias-current
and temperature dependences, and reached the considerably high value of 15% for
100 Hz dark count rate below 1.4 K at a wavelength of 1550 nm even without an
optical cavity structure. We found that the dark count exists even at 16 mK and
black body radiation becomes its dominant origin in the low temperatures for
fiber-coupled devices.
","[{""version"":""v1"",""created"":""Tue, 21 Sep 2010 01:35:19 GMT""}]","2015-05-20"
"1009.3982","EPTCS","Peter Csaba \""Olveczky (University of Oslo)","Proceedings First International Workshop on Rewriting Techniques for
  Real-Time Systems",,"EPTCS 36, 2010","10.4204/EPTCS.36",,"cs.LO","http://arxiv.org/licenses/nonexclusive-distrib/1.0/","  This volume contains the proceedings of the First International Workshop on
Rewriting Techniques for Real-Time Systems (RTRTS 2010), held in Longyearbyen,
Spitsbergen, on April 6-9, 2010.
  The aim of the workshop is to bring together researchers with an interest in
the use of rewriting-based techniques (including rewriting logic) and tools for
the modeling, analysis, and/or implementation of real-time and hybrid systems,
and to give them the opportunity to present their recent works, discuss future
research directions, and exchange ideas. The topics of the workshop comprise,
but are not limited to: methods and tools supporting rewriting-based modeling
and analysis of real-time and hybrid systems, and extensions of such systems;
use of rewriting techniques to provide rigorous support for model-based
software engineering of timed systems; applications and case studies; and
comparison with other formalisms and tools.
","[{""version"":""v1"",""created"":""Tue, 21 Sep 2010 02:19:53 GMT""}]","2010-09-22"
"1009.3983","Noam D. Elkies","Noam D. Elkies","Every even number greater than 454 is the sum of seven cubes","9 pages",,,,"math.NT","http://arxiv.org/licenses/nonexclusive-distrib/1.0/","  It is conjectured that every integer N>454 is the sum of seven nonnegative
cubes. We prove the conjecture when N is congruent to 2 mod 4. This result,
together with a recent proof for 4|N, shows that the conjecture is true for all
even N.
","[{""version"":""v1"",""created"":""Tue, 21 Sep 2010 02:24:50 GMT""}]","2010-09-22"
"1009.3984","Hieu Dinh","Hieu Dinh and Sanguthevar Rajasekaran","A memory-efficient data structure representing exact-match overlap
  graphs with application for next generation DNA assembly",,,,,"cs.DS cs.CE","http://arxiv.org/licenses/nonexclusive-distrib/1.0/","  An exact-match overlap graph of $n$ given strings of length $\ell$ is an
edge-weighted graph in which each vertex is associated with a string and there
is an edge $(x,y)$ of weight $\omega = \ell - |ov_{max}(x,y)|$ if and only if
$\omega \leq \lambda$, where $|ov_{max}(x,y)|$ is the length of $ov_{max}(x,y)$
and $\lambda$ is a given threshold. In this paper, we show that the exact-match
overlap graphs can be represented by a compact data structure that can be
stored using at most $(2\lambda -1 )(2\lceil\log n\rceil +
\lceil\log\lambda\rceil)n$ bits with a guarantee that the basic operation of
accessing an edge takes $O(\log \lambda)$ time.
  Exact-match overlap graphs have been broadly used in the context of DNA
assembly and the \emph{shortest super string problem} where the number of
strings $n$ ranges from a couple of thousands to a couple of billions, the
length $\ell$ of the strings is from 25 to 1000, depending on DNA sequencing
technologies. However, many DNA assemblers using overlap graphs are facing a
major problem of constructing and storing them. Especially, it is impossible
for these DNA assemblers to handle the huge amount of data produced by the next
generation sequencing technologies where the number of strings $n$ is usually
very large ranging from hundred million to a couple of billions. In fact, to
our best knowledge there is no DNA assemblers that can handle such a large
number of strings. Fortunately, with our compact data structure, the major
problem of constructing and storing overlap graphs is practically solved since
it only requires linear time and and linear memory. As a result, it opens the
door of possibilities to build a DNA assembler that can handle large-scale
datasets efficiently.
","[{""version"":""v1"",""created"":""Tue, 21 Sep 2010 02:39:34 GMT""}]","2010-09-22"
"1009.3985","Paul Monsky","Paul Monsky","Disquisitiones Arithmeticae and online sequence A108345","7 pages",,,,"math.NT","http://arxiv.org/licenses/nonexclusive-distrib/1.0/","  Let g be the element that is the sum of x^(n^2) for n >= 0 of A=Z/2[[x]], and
let B consist of all n for which the coefficient of x^n in 1/g is 1. (The
elements of B are the entries 0, 1, 2, 3, 5, 7, 8, 9, 13, ... in A108345; see
The On-Line Encyclopedia of Integer Sequences (OEIS).) Cooper, Eichhorn, and
O'Bryant [1] have shown that the (upper) density of B is at most 1/4, and it is
conjectured that B has density 0. This note uses results of Gauss on sums of 3
squares to show that the subset of B consisting of all n not congruent to 15
mod 16 has density 0. The final section gives some computer calculations, made
by Kevin O'Bryant, indicating that, pace [1], B has density 1/32.
","[{""version"":""v1"",""created"":""Tue, 21 Sep 2010 02:48:31 GMT""}]","2010-09-22"
"1009.3986","Ricardo Demarco","R. Demarco, R. Gobat, P. Rosati, C. Lidman, A. Rettura, M. Nonino, A.
  van der Wel, M. J. Jee, J. P. Blakeslee, H. C. Ford, M. Postman","Star Formation Histories in a Cluster Environment at z~0.84","36 pages, 5 tables, 14 figures. Accepted for publication in The
  Astrophysical Journal",,"10.1088/0004-637X/725/1/1252",,"astro-ph.CO","http://arxiv.org/licenses/nonexclusive-distrib/1.0/","  We present a spectrophotometric analysis of galaxies belonging to the
dynamically young, massive cluster RX J0152.7-1357 at z~0.84, aimed at
understanding the effects of the cluster environment on the star formation
history (SFH) of cluster galaxies and the assembly of the red-sequence (RS). We
use VLT/FORS spectroscopy, ACS/WFC optical and NTT/SofI near-IR data to
characterize SFHs as a function of color, luminosity, morphology, stellar mass,
and local environment from a sample of 134 spectroscopic members. In order to
increase the signal-to-noise, individual galaxy spectra are stacked according
to these properties. Moreover, the D4000, Balmer, CN3883, Fe4383 and C4668
indices are also quantified. The SFH analysis shows that galaxies in the blue
faint-end of the RS have on average younger stars (Delta t ~ 2 Gyr) than those
in the red bright-end. We also found, for a given luminosity range, differences
in age (Delta t ~ 0.5 - 1.3 Gyr) as a function of color, indicating that the
intrinsic scatter of the RS may be due to age variations. Passive galaxies in
the blue faint-end of the RS are preferentially located in the low density
areas of the cluster, likely being objects entering the RS from the ""blue
cloud"". It is likely that the quenching of the star formation of these RS
galaxies is due to interaction with the intracluster medium. Furthermore, the
SFH of galaxies in the RS as a function of stellar mass reveals signatures of
""downsizing"" in the overall cluster.
","[{""version"":""v1"",""created"":""Tue, 21 Sep 2010 03:03:04 GMT""}]","2015-05-20"
"1009.3987","Thomas Pannuti","Thomas G. Pannuti, Jeonghee Rho, Kazimierz J. Borkowski and P. Brian
  Cameron","Mixed-Morphology Supernova Remnants in X-rays: Isothermal Plasma in HB21
  and Probable Oxygen-Rich Ejecta in CTB 1","46 pages, 16 figures, accepted for publication in the Astronomical
  Journal",,"10.1088/0004-6256/140/6/1787",,"astro-ph.HE","http://arxiv.org/licenses/nonexclusive-distrib/1.0/","  (Abridged) We present an analysis of X-ray observations made of the Galactic
supernova remnants (SNRs) HB21 (G89.0+4.7) and CTB 1 (G116.9+0.2), two
well-known mixed-morphology (MM) SNRs. We find a marked contrast between the
X-ray properties of these SNRs: for HB21, the extracted ASCA spectra of the
northwest and southeast regions of the X-ray emitting plasma can be fit with a
single thermal model with marginally enhanced silicon and sulfur abundances.
For both of these regions, the derived column density and temperature are
N_H~0.3x10^22 cm^-2 and kT~0.7 keV, respectively. No significant spatial
differences in temperature or elemental abundances between the two regions are
detected and the X-ray-emitting plasma in both regions is close to ionization
equilibrium. Our Chandra spectral analysis of CTB 1 reveals that this source is
likely an oxygen-rich SNR with enhanced abundances of oxygen and neon. The
extracted ASCA spectra for the southwestern and northeastern regions of CTB 1
cannot be fit with a single thermal component. Based on our fits to these
spectra, we derive a column density N_H~0.6x10^22 cm^-2 and a temperature for
the soft thermal component of kT_soft~0.28 keV. The hard emission from the
southwest may be modeled with either a thermal component (kT_hard~3 keV) or by
a power law component (Gamma~2-3) while the hard emission from the northeast
may be modeled with a power law component (Gamma~1.4). We have also extracted
ASCA GIS spectra of the discrete X-ray source 1WGA J0001.4+6229 which is seen
in projection toward CTB 1. These spectra are best fit using a power-law model
with a photon index Gamma=2.2^{+0.5}_{-1.2} which is typical for featureless
power-law continua produced by rotation-powered pulsars. This source may be a
neutron star associated with CTB 1.
","[{""version"":""v1"",""created"":""Tue, 21 Sep 2010 03:10:19 GMT""}]","2015-05-20"
"1009.3988","Mohammad Hamdipour","M. Hamdipour and Yu. M. Shukrinov","Study of charge-phase diagrams for coupled system of Josephson junctions","Dubna-Nano2010 conference : http://theor.jinr.ru/~nano10/ will be
  published online in Journal of Physics: Conference series",,"10.1088/1742-6596/248/1/012042",,"cond-mat.mes-hall cond-mat.supr-con","http://arxiv.org/licenses/nonexclusive-distrib/1.0/","  Dynamics of stacked intrinsic Josephson junctions (IJJ) in the high-Tc
superconductors is theoretically investigated. We calculate the current-voltage
characteristics (CVC) of IJJ and study the breakpoint region on the outermost
branch of the CVC for the stacks with 9 IJJ. A method for investigation of the
fine structure in CVC of IJJ based on the recording the ""phase-charge"" diagrams
is suggested. It is demonstrated that this method reflects the main features of
the breakpoint region.
","[{""version"":""v1"",""created"":""Tue, 21 Sep 2010 03:24:55 GMT""}]","2015-05-20"
"1009.3989","Zhiping Jin","Zhi-Ping Jin, Yi-Zhong Fan and Da-Ming Wei","The bulk Lorentz factor of outflow powering X-ray flare in GRB afterglow","6 pages, 3 figures, ApJ in press",,"10.1088/0004-637X/724/2/861",,"astro-ph.HE","http://arxiv.org/licenses/nonexclusive-distrib/1.0/","  We develop two methods to estimate the bulk Lorentz factor of X-ray flare
outflow. In the first method the outflow is assumed to be baryonic and is
accelerated by the thermal pressure, for which the final bulk Lorentz factor is
limited by the outflow luminosity as well as the initial radius of the outflow
getting accelerated. Such a method may be applied to a considerable fraction of
flares. The second method, based on the curvature effect interpretation of the
quick decline of the flare, can give a tightly constrained estimate of the bulk
Lorentz factor but can only be applied to a few giant flares. The results
obtained in these two different ways are consistent with each other. The
obtained bulk Lorentz factor (or just upper limit) of the X-ray flare outflows,
ranging from ten to a few hundred, is generally smaller than that of the
Gamma-ray Burst (GRB) outflows.
","[{""version"":""v1"",""created"":""Tue, 21 Sep 2010 03:34:11 GMT""}]","2015-05-20"
"1009.3990","Paul Monsky","Paul Monsky","A result of Lemmermeyer on class numbers","4 pages",,,,"math.NT","http://arxiv.org/licenses/nonexclusive-distrib/1.0/","  I present Franz Lemmermeyer's proof that if p is a prime congruent to 9 mod
16 then the class number of Q(p^(1/4)) is congruent to 2 mod 4.
","[{""version"":""v1"",""created"":""Tue, 21 Sep 2010 03:37:52 GMT""}]","2010-09-22"
"1009.3991","Ignacio Uriarte-Tuero","David Covert, Derrick Hart, Alex Iosevich, Steven Senger, Ignacio
  Uriarte-Tuero","A Furstenberg-Katznelson-Weiss type theorem on (d + 1)-point
  configurations in sets of positive density in finite field geometries",,,,,"math.CO math.CA","http://arxiv.org/licenses/nonexclusive-distrib/1.0/","  We show that if $E \subset \mathbb{F}_q^d$, the $d$-dimensional vector space
over the finite field with $q$ elements, and $|E| \geq \rho q^d$, where $
q^{-\frac{1}{2}}\ll \rho \leq 1$, then $E$ contains an isometric copy of at
least $c \rho^{d-1} q^{d+1 \choose 2}$ distinct $(d+1)$-point configurations.
","[{""version"":""v1"",""created"":""Tue, 21 Sep 2010 03:44:47 GMT""}]","2010-09-22"
"1009.3992","Constantine Yannouleas","Constantine Yannouleas, Uzi Landman","Comment on ""Observation of a Pinning Mode in a Wigner Solid with nu=1/3
  Fractional Quantum Hall Excitations""","Clarifications added (footnote [9]). Short comment; 1 page with 1
  figure. For related papers, see http://www.prism.gatech.edu/~ph274cy",,,,"cond-mat.str-el cond-mat.mes-hall nucl-th physics.atm-clus","http://arxiv.org/licenses/nonexclusive-distrib/1.0/","  A recent letter [H. Zhu et al., Phys. Rev. Lett. 105, 126803 (2010)] reports
the first measurements of a pinned mode in a Wigner solid at the (electronic)
nu = 1/3 fractional quantum Hall effect (FQHE) filling. The authors suggest
that an interpretation of their findings may be found within the interacting
composite fermion (ICF) theory. However, to date there is no record reporting
crystalline correlations for nu ~ 1/3 obtained from ICF theory, or related
theories. We argue that an appropriate interpretation of these findings follows
naturally from the rotating-Wigner-molecule approach, which (with inclusion of
the rovibrational spectrum of the molecule) encompasses both the crystalline
and liquid aspects in the FQHE regime (in particular for nu=1/3, as well as in
its neighborhood created by deviations of nu from 1/3, as revealed
experimentally).
","[{""version"":""v1"",""created"":""Tue, 21 Sep 2010 03:45:47 GMT""},{""version"":""v2"",""created"":""Sun, 3 Oct 2010 22:23:30 GMT""}]","2010-10-05"
"1009.3993","Qing-You Sun","De-Xing Kong and Kefeng Liu","Hyperbolic Gradient Flow: Evolution of Graphs in R^{n+1}","16 pages, 3 figures, This paper was accepted by the proceeding of the
  conference in honor of Professers Zhengguo Bai and Yibing Shen's birthdays,
  June 2010",,,,"math.DG math.AP","http://arxiv.org/licenses/nonexclusive-distrib/1.0/","  In this paper we introduce a new geometric flow --- the hyperbolic gradient
flow for graphs in the $(n+1)$-dimensional Euclidean space $\mathbb{R}^{n+1}$.
This kind of flow is new and very natural to understand the geometry of
manifolds. We particularly investigate the global existence of the evolution of
convex hypersurfaces in $\mathbb{R}^{n+1}$ and the evolution of plane curves,
and prove that, under the hyperbolic gradient flow, they converge to the
hyperplane and the straight line, respectively, when $t$ goes to the infinity.
Our results show that the theory of shock waves of hyperbolic conservation laws
can be naturally applied to do surgery on manifolds. Some fundamental but open
problems are also given.
","[{""version"":""v1"",""created"":""Tue, 21 Sep 2010 03:46:04 GMT""}]","2016-09-09"
"1009.3994","Atsufumi Honda","Atsufumi Honda","Isometric Immersions of the Hyperbolic Plane into the Hyperbolic Space","20 pages, 5 figures",,,,"math.DG","http://arxiv.org/licenses/nonexclusive-distrib/1.0/","  In this paper, we parametrize the space of isometric immersions of the
hyperbolic plane into the hyperbolic 3-space in terms of null-causal curves in
the space of oriented geodesics. Moreover, we characterize ""ideal cones"" (i.e.,
cones whose vertices are on the ideal boundary) by behavior of their mean
curvature.
","[{""version"":""v1"",""created"":""Tue, 21 Sep 2010 04:05:09 GMT""}]","2010-09-22"
"1009.3995","Valentina Klochkova","Valentina Klochkova, Eugene Chentsov, Anatoly Miroshnichenko","The Inhomogeneous Wind of the LBV Candidate CygOB2-No.12","3 pages, 2 figures, IAU Symposium No.272 ""Active OB stars: structure,
  evolution, mass loss and critical limits"", 2010",,"10.1017/S174392131101091X",,"astro-ph.SR","http://arxiv.org/licenses/nonexclusive-distrib/1.0/","  We present the results of high-resolution spectroscopy of the extremely
luminous star CygOB2-No.12. We identified about 200 spectral features in the
range 4552-7939 AA, including the interstellar NaI, KI lines and numerous very
strong DIBs, along with the HeI, CII, and SiII lines. An MK spectral type we
derived for the object is B4.5Ia+. Our analysis of the radial velocity data
shows the presence of a gradient in the stellar atmosphere, caused by both
atmospheric expansion and matter infall onto the star. The Halpha emission
displays broad Thompson wings, a slightly blue-shifted PCyg type absorption
component and a time-variable core absorption. We conclude that the wind is
variable in time.
","[{""version"":""v1"",""created"":""Tue, 21 Sep 2010 05:18:23 GMT""}]","2015-05-20"
"1009.3996","Yoshinori Gongyo","Osamu Fujino, Yoshinori Gongyo","On canonical bundle formulae and subadjunctions","12 pages",,,,"math.AG","http://arxiv.org/licenses/nonexclusive-distrib/1.0/","  We consider a canonical bundle formula for generically finite proper
surjective morphisms and obtain subadjunction formulae for minimal log
canonical centers of log canonical pairs. We also treat related topics and
applications.
","[{""version"":""v1"",""created"":""Tue, 21 Sep 2010 05:20:23 GMT""}]","2010-09-22"
"1009.3997","Atsushi Nobe","Atsushi Nobe","An ultradiscrete integrable map arising from a pair of tropical elliptic
  pencils","14 pages, 4 figures","Physics Letters A 375 (2011) pp. 4178-4182","10.1016/j.physleta.2011.10.010",,"nlin.SI","http://arxiv.org/licenses/nonexclusive-distrib/1.0/","  We present a tropical geometric description of a piecewise linear map whose
invariant curve is a concave polygon. In contrast to convex polygons, a concave
one is not directly related to tropical geometry; nevertheless the description
is given in terms of the addition formula of a tropical elliptic curve. We show
that the map is arising from a pair of tropical elliptic pencils each member of
which is the invariant curve of the ultradiscrete QRT map.
","[{""version"":""v1"",""created"":""Tue, 21 Sep 2010 05:34:46 GMT""}]","2011-11-02"
"1009.3998","Ben Green","Ben Green, Terence Tao, Tamar Ziegler","An inverse theorem for the Gowers U^{s+1}[N]-norm","116 pages. Submitted",,,,"math.CO math.DS","http://arxiv.org/licenses/nonexclusive-distrib/1.0/","  We prove the inverse conjecture for the Gowers U^{s+1}[N]-norm for all s >=
3; this is new for s > 3, and the cases s<3 have also been previously
established. More precisely, we establish that if f : [N] -> [-1,1] is a
function with || f ||_{U^{s+1}[N]} > \delta then there is a bounded-complexity
s-step nilsequence F(g(n)\Gamma) which correlates with f, where the bounds on
the complexity and correlation depend only on s and \delta. From previous
results, this conjecture implies the Hardy-Littlewood prime tuples conjecture
for any linear system of finite complexity.
","[{""version"":""v1"",""created"":""Tue, 21 Sep 2010 05:41:11 GMT""},{""version"":""v2"",""created"":""Wed, 22 Sep 2010 06:22:22 GMT""},{""version"":""v3"",""created"":""Sun, 27 Mar 2011 09:40:56 GMT""}]","2011-03-29"
"1009.3999","Siva Athreya","Siva Athreya, Sunder Sethuraman, and Balint Toth","On the range, local times and periodicity of random walk on an interval",,,,,"math.PR","http://arxiv.org/licenses/nonexclusive-distrib/1.0/","  The range, local times, and periodicity of symmetric, weakly asymmetric and
asymmetric random walks at the time of exit from a strip with $N$ locations are
considered. Several results on asymptotic distributions are obtained.
","[{""version"":""v1"",""created"":""Tue, 21 Sep 2010 05:46:41 GMT""}]","2010-09-22"
