"1009.4060","Akhilesh Prasad Dr.","Akhilesh Prasad and Manish Kumar (Indian School of Mines)","Continuity of Pseudo-Differential Operator $h_{\mu,a}$ Involving Hankel
  Translation and Hankel Convolution on Some Gevrey Spaces",,"Published in Integral Transforms and Special Functions, Volume 21,
  Issue 6 June 2010 , pages 465 - 477","10.1080/10652460903371256",,"math.FA","http://arxiv.org/licenses/nonexclusive-distrib/1.0/","  The Pseudo-Differential Operator (p.d.o.) $h_{\mu,a}$ associated with the
Bessel Operator involving the symbol $a(x,y)$ whose derivatives satisfy certain
growth conditions depending on some increasing sequences is studied on certain
Gevrey spaces. The p.d.o. $h_{\mu,a}$ on Hankel translation $\tau$ and Hankel
convolution of Gevrey functions is continuous linear map into another Gevrey
spaces.
","[{""version"":""v1"",""created"":""Tue, 21 Sep 2010 11:12:49 GMT""}]","2010-09-22"
"1009.4061","Bernd Sing","Bernd Sing","More Kolakoski Sequences","17 pages, 3 tables, 1 figure","INTEGERS Vol. 11B (2011): Proceedings of the Leiden Numeration
  Conference 2010",,"A14 (at http://math.colgate.edu/~integers/vol11b.html )","math.CO","http://arxiv.org/licenses/nonexclusive-distrib/1.0/","  Our goal in this article is to review the known properties of the mysterious
Kolakoski sequence and at the same time look at generalizations of it over
arbitrary two letter alphabets. Our primary focus will here be the case where
one of the letters is odd while the other is even, since in the other cases the
sequences in question can be rewritten as (well-known) primitive substitution
sequences. We will look at word and letter frequencies, squares, palindromes
and complexity.
","[{""version"":""v1"",""created"":""Tue, 21 Sep 2010 11:12:55 GMT""}]","2019-07-23"
"1009.4062","Jesus Salas","Jesper L. Jacobsen and Jesus Salas","Is the five-flow conjecture almost false?","44 pages (LaTeX2e). Includes tex file, three sty files, and a
  mathematica script polyG119_7.m. Many improvements from version 3, in
  particular Sections 3 and 4 have been mostly re-writen, and Sections 7 and 8
  have been eliminated. (This material can now be found in arXiv:1303.5210.)
  Final version published in J. Combin. Theory B","J. Combin. Theory B 103 (2013) 532-565","10.1016/j.jctb.2013.06.001",,"math.CO cond-mat.stat-mech math-ph math.MP","http://arxiv.org/licenses/nonexclusive-distrib/1.0/","  The number of nowhere zero Z_Q flows on a graph G can be shown to be a
polynomial in Q, defining the flow polynomial \Phi_G(Q). According to Tutte's
five-flow conjecture, \Phi_G(5) > 0 for any bridgeless G.A conjecture by Welsh
that \Phi_G(Q) has no real roots for Q \in (4,\infty) was recently disproved by
Haggard, Pearce and Royle. These authors conjectured the absence of roots for Q
\in [5,\infty). We study the real roots of \Phi_G(Q) for a family of non-planar
cubic graphs known as generalised Petersen graphs G(m,k). We show that the
modified conjecture on real flow roots is also false, by exhibiting infinitely
many real flow roots Q>5 within the class G(nk,k). In particular, we compute
explicitly the flow polynomial of G(119,7), showing that it has real roots at
Q\approx 5.0000197675 and Q\approx 5.1653424423. We moreover prove that the
graph families G(6n,6) and G(7n,7) possess real flow roots that accumulate at
Q=5 as n\to\infty (in the latter case from above and below); and that
Q_c(7)\approx 5.2352605291 is an accumulation point of real zeros of the flow
polynomials for G(7n,7) as n\to\infty.
","[{""version"":""v1"",""created"":""Tue, 21 Sep 2010 11:19:23 GMT""},{""version"":""v2"",""created"":""Tue, 19 Oct 2010 16:05:19 GMT""},{""version"":""v3"",""created"":""Wed, 20 Oct 2010 09:26:30 GMT""},{""version"":""v4"",""created"":""Mon, 1 Jul 2013 10:54:07 GMT""}]","2015-10-07"
"1009.4063","Bhaswati Mookerjea","Bhaswati Mookerjea (TIFR, India), Pietro Parisi (INAF & Universita di
  Bologna, Italy), Sudip Bhattacharyya (TIFR, India), Nicola Masetti (INAF,
  Bologna, Italy), Thomas Kruehler (MPE & Technische Universitaet Muenchen,
  Garching, Germany), and Jochen Greiner (MPE Garching, Germany)","Optical/IR counterpart to the resolved X-ray jet source CXO
  J172337.5-373442 and its distance","Accepted for publication in MNRAS",,"10.1111/j.1745-3933.2010.00960.x",,"astro-ph.GA astro-ph.HE","http://arxiv.org/licenses/nonexclusive-distrib/1.0/","  We present results of observations in the optical to mid-infrared wavelengths
of the X-ray source CXO J172337.5-373442, which was serendipitously discovered
in the Chandra images and was found to have a fully resolved X-ray jet. The
observations include a combination of photometry and spectroscopy in the
optical using ground-based telescopes and mid-infrared photometry using
Spitzer. We detect the optical/IR counterpart of CXO J172337.5-373442 and
identify it to be a G9-V star located at a distance of 334+-60~pc. Comparable
values of the hydrogen column densities determined independently from the
optical/IR observations and X-ray observations indicate that the optical source
is associated with the X-ray source. Since the X-ray luminosity can not be
explained in terms of emission from a single G9-V star, it is likely that CXO
J172337.5-373442 is an accreting compact object in a binary system. Thus, CXO
J172337.5-373442 is the nearest known resolved X-ray jet from a binary system,
which is not a symbiotic star. Based on the existing X-ray data, the nature of
the compact object can not be confirmed. However the low luminosity of the
X-ray point source, 7.1x10^{30} Lsun combined with estimates of the age of the
jet and a lack of detection of bright outburst, suggests that the X-ray jet was
launched during extreme quiescence of the object. The measured low X-ray
luminosity of the jet suggests the likelihood of such jets being more
ubiquitous than our current understanding.
","[{""version"":""v1"",""created"":""Tue, 21 Sep 2010 11:25:09 GMT""}]","2015-05-20"
"1009.4064","Anton Cox","Anton Cox and Maud De Visscher","Diagrammatic Kazhdan-Lusztig theory for the (walled) Brauer algebra","32 pages, 22 figures",,,,"math.RT","http://arxiv.org/licenses/nonexclusive-distrib/1.0/","  We determine the decomposition numbers for the Brauer and walled Brauer
algebra in characteristic zero in terms of certain polynomials associated to
cap and curl diagrams (recovering a result of Martin in the Brauer case). We
consider a second family of polynomials associated to such diagrams, and use
these to determine projective resolutions of the standard modules. We then
relate these two families of polynomials to Kazhdan-Lusztig theory via the work
of Lascoux-Sch\""utzenberger and Boe, inspired by work of Brundan and Stroppel
in the cap diagram case.
","[{""version"":""v1"",""created"":""Tue, 21 Sep 2010 11:28:52 GMT""}]","2010-09-22"
"1009.4065","Claire Amiot","Claire Amiot (IRMA), Steffen Oppermann","Algebras of acyclic cluster type: tree type and type $\widetilde{A}$","v2: 37 pages. Title is changed. A mistake in the previous version is
  now corrected (see Remark 3.14). Other changes making the paper coherent with
  the version 2 of 1003.4916","Nagoya Math. J. 211 (2013), 1-50","10.1215/00277630-2083124",,"math.RT","http://arxiv.org/licenses/nonexclusive-distrib/1.0/","  In this paper, we study algebras of global dimension at most 2 whose
generalized cluster category is equivalent to the cluster category of an
acyclic quiver which is either a tree or of type $\widetilde{A}$. We are
particularly interested in their derived equivalence classification. We prove
that each algebra which is cluster equivalent to a tree quiver is derived
equivalent to the path algebra of this tree. Then we describe explicitly the
algebras of cluster type $\A_n$ for each possible orientation of $\A_n$. We
give an explicit way to read off in which derived equivalence class such an
algebra lies, and describe the Auslander-Reiten quiver of its derived category.
Together, these results in particular provide a complete classification of
algebras which are cluster equivalent to tame acyclic quivers.
","[{""version"":""v1"",""created"":""Tue, 21 Sep 2010 11:28:52 GMT""},{""version"":""v2"",""created"":""Sun, 11 Mar 2012 19:34:44 GMT""}]","2015-01-14"
"1009.4066","Falko Ziebert","Fabien Closa, Falko Ziebert, Elie Raphael","Interplay of internal stresses, electric stresses and surface diffusion
  in polymer films","14 pages, 7 figures, 1 table",,"10.1103/PhysRevE.83.051603",,"cond-mat.soft cond-mat.mtrl-sci","http://arxiv.org/licenses/nonexclusive-distrib/1.0/","  We investigate two destabilization mechanisms for elastic polymer films and
put them into a general framework: first, instabilities due to in-plane stress
and second due to an externally applied electric field normal to the film's
free surface. As shown recently, polymer films are often stressed due to
out-of-equilibrium fabrication processes as e.g. spin coating. Via an
Asaro-Tiller-Grinfeld mechanism as known from solids, the system can decrease
its energy by undulating its surface by surface diffusion of polymers and
thereby relaxing stresses. On the other hand, application of an electric field
is widely used experimentally to structure thin films: when the electric
Maxwell surface stress overcomes surface tension and elastic restoring forces,
the system undulates with a wavelength determined by the film thickness. We
develop a theory taking into account both mechanisms simultaneously and discuss
their interplay and the effects of the boundary conditions both at the
substrate and the free surface.
","[{""version"":""v1"",""created"":""Tue, 21 Sep 2010 11:51:29 GMT""},{""version"":""v2"",""created"":""Tue, 22 Feb 2011 14:26:11 GMT""}]","2015-05-20"
"1009.4067","Wouter Vlemmings","Wouter Vlemmings","Magnetic Fields around (post-)AGB stars and (Pre-)Planetary Nebulae","8 pages, 3 figures, to appear in the proceedings of the Asymmetric
  Planetary Nebulae V (APN V) conference (replaced with minor textual and
  figure corrections)",,,,"astro-ph.SR","http://arxiv.org/licenses/nonexclusive-distrib/1.0/","  Observational evidence for strong magnetic fields throughout the envelopes of
evolved stars is increasing. Many of the instruments coming on line in the
near-future will be able to make further contributions to this field.
Specifically, maser polarization observations and dust/line polarization in the
sub-mm regime has the potential to finally provide a definite picture of the
magnetic field strength and configuration from the Asymptotic Giant Branch
(AGB) all the way to the Planetary Nebula phase. While current observations are
limited in sample size, strong magnetic fields appear ubiquitous at all stages
of (post-)AGB evolution. Recent observations also strongly support a field
structure that is maintained from close to the star to several thousands of AU
distance. While its origin is still unclear, the magnetic field is thus a
strong candidate for shaping the stellar outflows on the path to the planetary
nebula phase and might even play a role in determining the stellar mass-loss.
","[{""version"":""v1"",""created"":""Tue, 21 Sep 2010 11:57:42 GMT""},{""version"":""v2"",""created"":""Wed, 6 Oct 2010 08:33:42 GMT""}]","2010-10-07"
"1009.4068","Ali Mahdipour-Shirayeh","A. Mahdipour-Shirayeh","Preliminary group classification for generalized inviscid Burger's
  equation","15 pages",,,,"math.DG","http://arxiv.org/licenses/nonexclusive-distrib/1.0/","  Preliminary group classification for a class of generalized inviscid Burger's
equations in the general form $u_t+g(x, u)u_x = f(x, u)$ is given and
additional equivalence transformations are found. Adduced results complete and
essentially generalize recent works on the subject . A number of new
interesting nonlinear invariant models which have non-trivial invariance
algebras are obtained. The result of the work is a wide class of equations
summarized in table form.
","[{""version"":""v1"",""created"":""Tue, 21 Sep 2010 12:05:25 GMT""}]","2010-09-22"
"1009.4069","Gleb Gribakin","G. F. Gribakin, J. A. Young, and C. M. Surko","Positron-molecule interactions: resonant attachment, annihilation, and
  bound states","50 pages, 40 figures","Reviews of Modern Physics, Volume 82, pages 2557-2607 (2010)","10.1103/RevModPhys.82.2557",,"physics.atom-ph","http://arxiv.org/licenses/nonexclusive-distrib/1.0/","  This article presents an overview of current understanding of the interaction
of low-energy positrons with molecules with emphasis on resonances, positron
attachment and annihilation. Annihilation rates measured as a function of
positron energy reveal the presence of vibrational Feshbach resonances (VFR)
for many polyatomic molecules. These resonances lead to strong enhancement of
the annihilation rates. They also provide evidence that positrons bind to many
molecular species. A quantitative theory of VFR-mediated attachment to small
molecules is presented. It is tested successfully for selected molecules (e.g.,
methyl halides and methanol) where all modes couple to the positron continuum.
Combination and overtone resonances are observed and their role is elucidated.
In larger molecules, annihilation rates from VFR far exceed those explicable on
the basis of single-mode resonances. These enhancements increase rapidly with
the number of vibrational degrees of freedom. While the details are as yet
unclear, intramolecular vibrational energy redistribution to states that do not
couple directly to the positron continuum appears to be responsible for these
enhanced annihilation rates. Downshifts of the VFR from the vibrational mode
energies have provided binding energies for thirty species. Their dependence
upon molecular parameters and their relationship to positron-atom and
positron-molecule binding energy calculations are discussed. Feshbach
resonances and positron binding to molecules are compared with the analogous
electron-molecule (negative ion) cases. The relationship of VFR-mediated
annihilation to other phenomena such as Doppler-broadening of the gamma-ray
annihilation spectra, annihilation of thermalized positrons in gases, and
annihilation-induced fragmentation of molecules is discussed.
","[{""version"":""v1"",""created"":""Tue, 21 Sep 2010 12:05:56 GMT""}]","2010-09-22"
"1009.4070","Shuyan Liu","Shuyan Liu","Estimation of the spectral measure of multivariate regularly varying
  distributions","23 pages, 3 figures",,,,"math.ST stat.TH","http://arxiv.org/licenses/nonexclusive-distrib/1.0/","  In the paper, the estimator for the spectral measure of multivariate stable
distributions introduced by Davydov and co-workers are extended to the
regularly varying distributions. The sampling method is modified to optimize
the rate of convergence of estimator. An estimator of the total mass of
spectral measure is proposed. The consistency and the asymptotic normality of
estimators are proved.
","[{""version"":""v1"",""created"":""Tue, 21 Sep 2010 12:09:55 GMT""}]","2010-09-22"
"1009.4071","Johannes Hofmann","Johannes Hofmann","Dimensional reduction in quantum field theories at finite temperature
  and density","10 pages, 6 figures; v2: corrected typos and references, version
  accepted for publication in PRD","Phys.Rev.D82:125027,2010","10.1103/PhysRevD.82.125027",,"hep-th cond-mat.str-el cond-mat.supr-con","http://arxiv.org/licenses/nonexclusive-distrib/1.0/","  In this work we present two correspondences between the massless Gross-Neveu
model with one or two coupling constants in 1+1 dimensions and nonrelativistic
field theories in 3+1 dimensions. It is shown that on a mean-field level the
massless Gross-Neveu model can be mapped onto BCS theory provided that
translational invariance of the condensate is assumed. The generalized massless
Gross-Neveu model with two coupling constants is mapped onto a quasi
one-dimensional extended Hubbard model used in the description of spin-Peierls
systems. It is shown that the particle hole symmetry of the Hubbard model
implies self-consistency of the condensate. The dimensional reduction allows an
identification of the phase diagrams of the models.
","[{""version"":""v1"",""created"":""Tue, 21 Sep 2010 12:10:56 GMT""},{""version"":""v2"",""created"":""Thu, 16 Dec 2010 20:19:03 GMT""}]","2010-12-23"
"1009.4072","Maximilian Schlosshauer","Maximilian Schlosshauer and Kristian Camilleri","What classicality? Decoherence and Bohr's classical concepts","6 pages","AIP Conf. Proc. 1327, 26-35 (2011)","10.1063/1.3567426",,"quant-ph","http://arxiv.org/licenses/nonexclusive-distrib/1.0/","  Niels Bohr famously insisted on the indispensability of what he termed
""classical concepts."" In the context of the decoherence program, on the other
hand, it has become fashionable to talk about the ""dynamical emergence of
classicality"" from the quantum formalism alone. Does this mean that decoherence
challenges Bohr's dictum -- for example, that classical concepts do not need to
be assumed but can be derived? In this paper, we'll try to shed some light down
the murky waters where formalism and philosophy mingle. To begin, we'll clarify
the notion of classicality in the decoherence description. We'll then discuss
Bohr's and Heisenberg's takes on the quantum-classical problem and reflect on
the different meanings of the terms ""classicality"" and ""classical concepts"" in
the writings of Bohr and his followers. This analysis will allow us to put
forward some tentative suggestions for how we may better understand the
relation between decoherence-induced classicality and Bohr's classical
concepts.
","[{""version"":""v1"",""created"":""Tue, 21 Sep 2010 12:14:01 GMT""},{""version"":""v2"",""created"":""Mon, 12 Mar 2012 21:46:18 GMT""}]","2012-03-14"
"1009.4073","Andre Rubbia","A. Curioni, L. Epprecht, A. Gendotti, L. Knecht, D. Lussi,
  A.Marchionni, G. Natterer, F. Resnati, A. Rubbia, J. Coleman, M.Lewis, K.
  Mavrokoridis, K. McCormick, C. Touramanis","Towards a liquid Argon TPC without evacuation: filling of a 6 m^3 vessel
  with argon gas from air to ppm impurities concentration through flushing","9 pages, 6 figures, to appear in Proc. 1st International Workshop
  towards the Giant Liquid Argon Charge Imaging Experiment (GLA2010), Tsukuba,
  March 2010","J.Phys.Conf.Ser.308:012024,2011","10.1088/1742-6596/308/1/012024",,"physics.ins-det","http://arxiv.org/licenses/nonexclusive-distrib/1.0/","  In this paper we present a successful experimental test of filling a volume
of 6 m$^3$ with argon gas, starting from normal ambient air and reducing the
impurities content down to few parts per million (ppm) oxygen equivalent. This
level of contamination was directly monitored measuring the slow component of
the scintillation light of the Ar gas, which is sensitive to {\it all} sources
of impurities affecting directly the argon scintillation.
","[{""version"":""v1"",""created"":""Tue, 21 Sep 2010 12:16:17 GMT""},{""version"":""v2"",""created"":""Wed, 22 Sep 2010 06:31:25 GMT""}]","2011-07-28"
"1009.4074","Antonio Padilla","Antonio Padilla","The good, the bad and the ugly .... of Horava gravity","7 pages","J.Phys.Conf.Ser.259:012033,2010","10.1088/1742-6596/259/1/012033",,"hep-th","http://arxiv.org/licenses/nonexclusive-distrib/1.0/","  I review the good, the bad and the ugly of the non-projectable versions of
Horava gravity. I explain how this non-relativistic theory was constructed and
why it was touted with such excitement as a quantum theory of gravity. I then
review some of the issues facing the theory, explaining how strong coupling
occurs and why this is such a problem for both phenomenology and the question
of renormalisability. Finally I comment on possible violations of Equivalence
Principle, and explain why these could be an issue for Blas et al's ""healthy
extension"". This paper was presented as a talk at PASCOS 2010 in Valencia.
","[{""version"":""v1"",""created"":""Tue, 21 Sep 2010 12:22:39 GMT""}]","2011-01-04"
"1009.4075","Michael Lubasch","Michael Lubasch, Florian Mintert, Sandro Wimberger","Dynamical enhancement of spatial entanglement in massive particles","4 pages, 4 figures","Phys. Rev. A 84, 063615 (2011)","10.1103/PhysRevA.84.063615",,"quant-ph","http://arxiv.org/licenses/nonexclusive-distrib/1.0/","  We discuss dynamical enhancement of entanglement in a driven Bose-Hubbard
model and find an enhancement of two orders of magnitude which is robust
against fluctuations in experimental parameters.
","[{""version"":""v1"",""created"":""Tue, 21 Sep 2010 12:27:08 GMT""}]","2013-12-03"
"1009.4076","Julie Grollier","A. Dussaux, A. V. Khvalkovskiy, J. Grollier, V. Cros, A. Fukushima, M.
  Konoto, H. Kubota, K. Yakushiji, S. Yuasa, K. Ando and A. fert","Phase locking of vortex based spin transfer oscillators to a microwave
  current",,,"10.1063/1.3565159",,"cond-mat.mtrl-sci","http://arxiv.org/licenses/nonexclusive-distrib/1.0/","  Phase locking experiments on vortex based spin transfer oscillators with an
external microwave current are performed. We present clear evidence of phase
locking, frequency pulling, as well as fractional synchronization in this
system, with a minimum peak linewidth of only 3 kHz in the locked state. We
find that locking ranges of the order of 1/3 of the oscillator frequency are
easily achievable because of the large tunability $\partial f/\partial I_{dc}$
observed in our vortex based systems. Such large locking ranges allow us to
demonstrate the simultaneous phase locking of two independent oscillators
connected in series with the external source.
","[{""version"":""v1"",""created"":""Tue, 21 Sep 2010 12:32:32 GMT""}]","2015-05-20"
"1009.4077","Joachim Hemberger","G. Giovannetti, A. Stroppa, S. Picozzi, D. Baldomir, V. Pardo, S.
  Blanco-Canosa, F. Rivadulla, S. Jodlauk, D. Niermann, J. Rohrkamp, T. Lorenz,
  J. Hemberger, S. Streltsov, and D.I. Khomskii","CdV2O4: A rare example of a collinear multiferroic spinel","4+ pages, 3 figures","Phys. Rev. B 83, 060402(R) (2011)","10.1103/PhysRevB.83.060402",,"cond-mat.str-el","http://arxiv.org/licenses/nonexclusive-distrib/1.0/","  By studying the dielectric properties of the geometrically frustrated spinel
CdV2O4, we observe ferroelectricity developing at the transition into the
collinear antiferromagnetic ground state. In this multiferroic spinel,
ferroelectricity is driven by local magnetostriction and not by the more common
scenario of spiral magnetism. The experimental findings are corroborated by
ab-initio calculations of the electric polarization and the underlying spin and
orbital order. The results point towards a charge rearrangement due to
dimerization, where electronic correlations and the proximity to the
insulator-metal transition play an important role.
","[{""version"":""v1"",""created"":""Tue, 21 Sep 2010 12:45:51 GMT""}]","2011-07-19"
"1009.4078","Onofre Rojas","M.T. Thomaz and O. Rojas","The high-temperature expansion of the classical Ising model with S_z^2
  term","10 pages, 3 figures","Condens. Matter Phys., Vol. 15, No. 1, 13706 (2012)","10.5488/CMP.15.13706",,"cond-mat.stat-mech","http://arxiv.org/licenses/nonexclusive-distrib/1.0/","  We derive the high-temperature expansion of the Helmholtz free energy up to
the order \beta^{17} of the one-dimensional spin-S Ising model, with single-ion
anisotropy term, in the presence of a longitudinal magnetic field. We show that
the values of some thermodynamical functions for the ferromagnetic models, in
the presence of a weak magnetic field, are not small corrections to their
values with h=0. This model with S=3 was applied by Kishine et al. [J.-i.
Kishine et al., Phys. Rev. B, 2006, 74, 224419] to analyze experimental data of
the single-chain magnet [Mn (saltmen)]_2 [Ni(pac)_2 (py)_2] (PF_6)_2 for T<40
K. We show that for T<35 K the thermodynamic functions of the large-spin limit
model are poor approximations to their analogous spin-3 functions.
","[{""version"":""v1"",""created"":""Tue, 21 Sep 2010 12:47:41 GMT""},{""version"":""v2"",""created"":""Wed, 21 Sep 2011 20:31:22 GMT""},{""version"":""v3"",""created"":""Wed, 28 Dec 2011 13:47:19 GMT""},{""version"":""v4"",""created"":""Thu, 26 Apr 2012 02:58:14 GMT""}]","2012-04-27"
"1009.4079","Oliver Goertsches","Oliver Goertsches","The equivariant cohomology of isotropy actions on symmetric spaces","11 pages. v2 corrects a faulty quotation of Proposition VII.3.4 in
  Loos, Symmetric spaces (Proposition 4.8 in v1) which led to incorrect
  conclusions. Statement of main theorem remains unchanged in v2","Documenta Math. 17 (2012), 79-94",,,"math.DG","http://arxiv.org/licenses/nonexclusive-distrib/1.0/","  We show that for every symmetric space G/K of compact type with K connected,
the K-action on G/K by left translations is equivariantly formal.
","[{""version"":""v1"",""created"":""Tue, 21 Sep 2010 12:47:49 GMT""},{""version"":""v2"",""created"":""Tue, 19 Oct 2010 08:24:06 GMT""}]","2012-03-01"
