"1005.2297","Simon Verley","S. Verley, M. Rela\~no, C. Kramer, E. M. Xilouris, M. Boquien, D.
  Calzetti, F. Combes, C. Buchbender, J. Braine, G. Quintana-Lacaci, F. S.
  Tabatabaei, S. Lord, F. Israel, G. Stacey, P. van der Werf","Properties of compact 250 \mu m emission and HII regions in M33
  (HERM33ES)","4 pages, 3 figures, Accpeted for publication in the A&A Herschel
  Special Issue",,,,"astro-ph.CO","http://arxiv.org/licenses/nonexclusive-distrib/1.0/","  Within the framework of the HERM33ES Key Project, using the high resolution
and sensitivity of the Herschel photometric data, we study the compact emission
in the Local Group spiral galaxy M33 to investigate the nature of the compact
SPIRE emission sources. We extracted a catalogue of sources at 250um in order
to investigate the nature of this compact emission. Taking advantage of the
unprecedented Herschel resolution at these wavelengths, we also focus on a more
precise study of some striking Halpha shells in the northern part of the
galaxy. We present a catalogue of 159 compact emission sources in M33
identified by SExtractor in the 250um SPIRE band that is the one that provides
the best spatial resolution. We also measured fluxes at 24um and Halpha for
those 159 extracted sources. The morphological study of the shells also
benefits from a multiwavelength approach including Halpha, far-UV from GALEX,
and infrared from both Spitzer IRAC 8um and MIPS 24um in order to make
comparisons. For the 159 compact sources selected at 250um, we find a very
strong Pearson correlation coefficient with the MIPS 24um emission (r24 = 0.94)
and a rather strong correlation with the Halpha emission, although with more
scatter (rHa = 0.83). The morphological study of the Halpha shells shows a
displacement between far-ultraviolet, Halpha, and the SPIRE bands. The cool
dust emission from SPIRE clearly delineates the Halpha shell structures. The
very strong link between the 250um compact emission and the 24um and Halpha
emissions, by recovering the star formation rate from standard recipes for HII
regions, allows us to provide star formation rate calibrations based on the
250um compact emission alone. The different locations of the Halpha and
far-ultraviolet emissions with respect to the SPIRE cool dust emission leads to
a dynamical age of a few Myr for the Halpha shells and the associated cool
dust.
","[{""version"":""v1"",""created"":""Thu, 13 May 2010 11:02:22 GMT""}]","2015-03-17"
"1005.2298","Sheng Li","Sheng Li","Inhomogeneous Reheating Scenario with DBI fields","7pages, 4eps figures(figures are corrected for presentation), some
  references added and updated, published by JCAP","JCAP 1008:024,2010","10.1088/1475-7516/2010/08/024",,"hep-th astro-ph.CO","http://arxiv.org/licenses/nonexclusive-distrib/1.0/","  We discuss a new mechanism which can be responsible for the origin of the
primordial perturbation in inflationary models, the inhomogeneous DBI reheating
scenario. Light DBI fields fluctuate during inflation, and finally create the
density perturbations through modulation of the inflation decay rate. In this
note, we investigate the curvature perturbation and its non-Gaussianity from
this new mechanism. Presenting generalized expressions for them, we show that
the curvature perturbation not only depends on the particular process of decay
but is also dependent on the sound speed $c_s$ from the DBI action. More
interestingly we find that the non-Gaussianity parameter $f_{NL}$ is
independent of $c_s$. As an application we exemplify some decay processes which
give a viable and detectable non-Gaussianity. Finally we find a possible
connection between our model and the DBI-Curvaton mechanism.
","[{""version"":""v1"",""created"":""Thu, 13 May 2010 11:18:31 GMT""},{""version"":""v2"",""created"":""Thu, 20 May 2010 15:02:34 GMT""},{""version"":""v3"",""created"":""Wed, 18 Aug 2010 07:51:11 GMT""},{""version"":""v4"",""created"":""Wed, 20 Nov 2013 03:30:28 GMT""}]","2015-03-17"
"1005.2299","Nicolo' Maria Calcavecchia","Nicolo' Maria Calcavecchia and Elisabetta Di Nitto","Incorporating prediction models in the SelfLet framework: a plugin
  approach",,,,,"cs.SE","http://arxiv.org/licenses/nonexclusive-distrib/1.0/","  A complex pervasive system is typically composed of many cooperating
\emph{nodes}, running on machines with different capabilities, and pervasively
distributed across the environment. These systems pose several new challenges
such as the need for the nodes to manage autonomously and dynamically in order
to adapt to changes detected in the environment. To address the above issue, a
number of autonomic frameworks has been proposed. These usually offer either
predefined self-management policies or programmatic mechanisms for creating new
policies at design time. From a more theoretical perspective, some works
propose the adoption of prediction models as a way to anticipate the evolution
of the system and to make timely decisions. In this context, our aim is to
experiment with the integration of prediction models within a specific
autonomic framework in order to assess the feasibility of such integration in a
setting where the characteristics of dynamicity, decentralization, and
cooperation among nodes are important. We extend an existing infrastructure
called \emph{SelfLets} in order to make it ready to host various prediction
models that can be dynamically plugged and unplugged in the various component
nodes, thus enabling a wide range of predictions to be performed. Also, we show
in a simple example how the system works when adopting a specific prediction
model from the literature.
","[{""version"":""v1"",""created"":""Thu, 13 May 2010 11:18:41 GMT""}]","2015-03-17"
"1005.2300","Elizabeth Hanbury","Michael Farber and Elizabeth Hanbury","Topology of configuration space of two particles on a graph, II","24 pages, 12 figures; Section 7 revised in v2, published version","Algebr. Geom. Topol. 10 (2010) 2203-2227","10.2140/agt.2010.10.2203",,"math.AT math.CO","http://arxiv.org/licenses/nonexclusive-distrib/1.0/","  This paper continues the investigation of the configuration space of two
distinct points on a graph. We analyze the process of adding an additional edge
to the graph and the resulting changes in the topology of the configuration
space. We introduce a linking bilinear form on the homology group of the graph
with values in the cokernel of the intersection form (introduced in Part I of
this work). For a large class of graphs, which we call mature graphs, we give
explicit expressions for the homology groups of the configuration space. We
show that under a simple condition, adding an edge to a mature graph yields
another mature graph.
","[{""version"":""v1"",""created"":""Thu, 13 May 2010 11:19:17 GMT""},{""version"":""v2"",""created"":""Mon, 25 Oct 2010 10:49:01 GMT""}]","2015-03-17"
"1005.2301","Andrew Adamatzky","Andrew Adamatzky","Slime mould logical gates: exploring ballistic approach",,"Applications, Tools and Techniques on the Road to Exascale
  Computing (IOS Press, 2012), pp. 41-56",,,"nlin.PS physics.bio-ph q-bio.CB","http://arxiv.org/licenses/nonexclusive-distrib/1.0/","  Plasmodium of \emph{Physarum polycephalum} is a single cell visible by
unaided eye. On a non-nutrient substrate the plasmodium propagates as a
traveling localization, as a compact wave-fragment of protoplasm. The
plasmodium-localization travels in its originally predetermined direction for a
substantial period of time even when no gradient of chemo-attractants is
present. We utilize this property of \emph{Physarum} localizations to design a
two-input two-output Boolean logic gates $<x, y> \to <xy, x+y>$ and $<x, y> \to
<x, bar{x}y>$. We verify the designs in laboratory experiments and computer
simulations. We cascade the logical gates into one-bit half-adder and simulate
its functionality.
","[{""version"":""v1"",""created"":""Thu, 13 May 2010 11:19:37 GMT""}]","2012-08-14"
"1005.2302","Andrzej Bozek","A.Bozek, M.Rozanska et al. (Belle Collaboration)","Observation of B+ -> Dbar*0 tau+ nu_tau and Evidence for B+ -> Dbar^0
  tau+ nu_tau at Belle","6 pages, 4 figures, submitted to Phys. Rev. Lett","Phys.Rev.D82:072005,2010","10.1103/PhysRevD.82.072005","Belle Preprint 2010-8 KEK Preprint 2010-7","hep-ex","http://arxiv.org/licenses/nonexclusive-distrib/1.0/","  We present measurements of B+ -> Dbar*0 tau+ nu_tau and B+ -> Dbar^0 tau+
nu_tau decays in a data sample of 657 x 10^6 BBbar pairs collected with the
Belle detector at the KEKB asymmetric-energy e+e- collider. We find
446^{+58}_{-56} events of the decay B+ -> Dbar*0 tau+ nu_tau with a
significance of 8.1 standard deviations, and 146^{+42}_{-41} events of the
decay B+ -> Dbar0 tau+ nu_tau with a significance of 3.5 standard deviations.
The latter signal provides the first evidence for this decay mode. The measured
branching fractions are B(B+ -> Dbar*0 tau+ nu_tau)=(2.12^{+0.28}_{-0.27}
(stat) +- 0.29 (syst)) % and B(B+ -> Dbar0 tau+ nu_tau)=(0.77 +- 0.22 (stat) +-
0.12 (syst)) %.
","[{""version"":""v1"",""created"":""Thu, 13 May 2010 11:22:22 GMT""}]","2014-11-21"
"1005.2303","Andrew Adamatzky","Jeff Jones and Andrew Adamatzky","Towards Physarum Binary Adders","Biosystems (2010), in press. Please download final version of the
  paper from the Publishers's site","Biosystems Volume 101, Issue 1, July 2010, Pages 51-58","10.1016/j.biosystems.2010.04.005",,"nlin.PS cs.AI physics.bio-ph q-bio.CB","http://arxiv.org/licenses/nonexclusive-distrib/1.0/","  Plasmodium of \emph{Physarum polycephalum} is a single cell visible by
unaided eye. The plasmodium's foraging behaviour is interpreted in terms of
computation. Input data is a configuration of nutrients, result of computation
is a network of plasmodium's cytoplasmic tubes spanning sources of nutrients.
Tsuda et al (2004) experimentally demonstrated that basic logical gates can be
implemented in foraging behaviour of the plasmodium. We simplify the original
designs of the gates and show --- in computer models --- that the plasmodium is
capable for computation of two-input two-output gate $<x, y> \to <xy, x+y>$ and
three-input two-output $<x, y, z> \to < \bar{x}yz, x+y+z>$. We assemble the
gates in a binary one-bit adder and demonstrate validity of the design using
computer simulation.
","[{""version"":""v1"",""created"":""Thu, 13 May 2010 11:53:09 GMT""}]","2015-03-17"
"1005.2304","Dr. Amish G. Joshi","Amish G. Joshi, R.G. Kulkarni, W.B. Yelon, Ram Prasad, M.R. Gonal","Neutron structural studies on the superconducting
  (Nd1-xCax)(Ba1.6La0.4)Cu3Oz system","13 Pages, 5 Figures","Journal of Applied Physics, Vol. 105, 083919 (2009)","10.1063/1.3116532",,"cond-mat.supr-con cond-mat.mtrl-sci cond-mat.str-el","http://arxiv.org/licenses/nonexclusive-distrib/1.0/","  We have investigated the influence of Ca ions substitution on the structural
and superconducting properties of (Nd1-xCax)(Ba1.6La0.4)Cu3Oz system.
Magnetization, X-ray diffraction and neutron diffraction studies have been
carried out on a series of compounds with x = 0.0 to 0.6. The superconducting
transition temperature Tc, determined from magnetization measurements increases
with increasing Ca2+ substitution. Neutron diffraction studies reveal that
these compounds crystallize in a tetragonal structure (space group P4/mmm). A
detailed analysis of the neutron diffraction data reveals that Ca and La ions
are intermixed at the nominal Ba and Nd sites. While a major fraction of Ca
ions occupy the usual Nd site, a small fraction occupies the Ba site.
Consequently, the corresponding amount of La substitutes at the nominal Nd
site. The intermixing of Ca and La sites randomizes the chain site oxygens
leading to a tetragonal structure despite an oxygen content close to 7.0 for
all the Ca doped samples. Further increase of Ca content lead to change in its
co-ordination from six-fold to eight-fold at x >= 0.4.
","[{""version"":""v1"",""created"":""Thu, 13 May 2010 12:12:59 GMT""}]","2010-05-14"
"1005.2305","Vladimir Kolmogorov","Vladimir Kolmogorov","Generalized roof duality and bisubmodular functions","14 pages. Shorter version to appear in NIPS 2010",,,,"cs.DM","http://arxiv.org/licenses/nonexclusive-distrib/1.0/","  Consider a convex relaxation $\hat f$ of a pseudo-boolean function $f$. We
say that the relaxation is {\em totally half-integral} if $\hat f(x)$ is a
polyhedral function with half-integral extreme points $x$, and this property is
preserved after adding an arbitrary combination of constraints of the form
$x_i=x_j$, $x_i=1-x_j$, and $x_i=\gamma$ where $\gamma\in\{0, 1, 1/2}$ is a
constant. A well-known example is the {\em roof duality} relaxation for
quadratic pseudo-boolean functions $f$. We argue that total half-integrality is
a natural requirement for generalizations of roof duality to arbitrary
pseudo-boolean functions. Our contributions are as follows. First, we provide a
complete characterization of totally half-integral relaxations $\hat f$ by
establishing a one-to-one correspondence with {\em bisubmodular functions}.
Second, we give a new characterization of bisubmodular functions. Finally, we
show some relationships between general totally half-integral relaxations and
relaxations based on the roof duality.
","[{""version"":""v1"",""created"":""Thu, 13 May 2010 12:19:41 GMT""},{""version"":""v2"",""created"":""Thu, 2 Sep 2010 15:58:50 GMT""}]","2015-03-17"
"1005.2306","Ryo Takahasi","Naoyuki Haba, Kin-ya Oda, Ryo Takahashi","Phenomenological Aspects of Dirichlet Higgs Model from Extra-Dimension","24 pages, 8 figures, title changed, phenomenological consequences
  substantially modified","JHEP 1007:079,2010; Erratum-ibid.1011:071,2010; JHEP 1011:071,2010","10.1007/JHEP07(2010)079 10.1007/JHEP11(2010)071",,"hep-ph astro-ph.CO hep-ex hep-th","http://arxiv.org/licenses/nonexclusive-distrib/1.0/","  We study a simple five-dimensional extension of the Standard Model,
compactified on a flat line segment in which there propagate Higgs and gauge
bosons of the Standard Model. We impose a Dirichlet boundary condition on the
Higgs field to realize its vacuum expectation value. Since a flat
Nambu-Goldstone zero-mode of the bulk Higgs is eliminated by the Dirichlet
boundary condition, a superposition of the Higgs Kaluza-Klein modes play the
role of the Nambu-Goldstone boson except at the boundaries. We discuss
phenomenology of our model at the LHC, namely the top Yukawa deviation and the
production and decay of the physical Higgs field, as well as the constraints
from the electroweak precision measurements.
","[{""version"":""v1"",""created"":""Thu, 13 May 2010 12:20:50 GMT""},{""version"":""v2"",""created"":""Tue, 22 Jun 2010 11:58:50 GMT""},{""version"":""v3"",""created"":""Mon, 1 Nov 2010 16:04:26 GMT""}]","2015-03-17"
"1005.2307","Gary Westfall","The STAR Collaboration: M.M. Aggarwal, et al.","Balance Functions from Au+Au, d+Au, and p+p Collisions at
  $\sqrt{s_{NN}}$ = 200 GeV","17 pages, 23 figures","Phys.Rev.C82:024905,2010","10.1103/PhysRevC.82.024905",,"nucl-ex","http://arxiv.org/licenses/nonexclusive-distrib/1.0/","  Balance functions have been measured for charged particle pairs, identified
charged pion pairs, and identified charged kaon pairs in Au+Au, d+Au, and p+p
collisions at $\sqrt{s_{NN}}$ = 200 GeV at the Relativistic Heavy Ion Collider
using the STAR detector. These balance functions are presented in terms of
relative pseudorapidity, $\Delta \eta$, relative rapidity, $\Delta y$, relative
azimuthal angle, $\Delta \phi$, and invariant relative momentum, $q_{\rm inv}$.
In addition, balance functions are shown in terms of the three components of
$q_{\rm inv}$: $q_{\rm long}$, $q_{\rm out}$, and $q_{\rm side}$. For charged
particle pairs, the width of the balance function in terms of $\Delta \eta$
scales smoothly with the number of participating nucleons, while HIJING and
UrQMD model calculations show no dependence on centrality or system size. For
charged particle and charged pion pairs, the balance functions widths in terms
of $\Delta \eta$ and $\Delta y$ are narrower in central Au+Au collisions than
in peripheral collisions. The width for central collisions is consistent with
thermal blast-wave models where the balancing charges are highly correlated in
coordinate space at breakup. This strong correlation might be explained either
by delayed hadronization or by limited diffusion during the reaction.
Furthermore, the narrowing trend is consistent with the lower kinetic
temperatures inherent to more central collisions. In contrast, the width of the
balance function for charged kaon pairs in terms of $\Delta y$ shows little
centrality dependence, which may signal a different production mechanism for
kaons. The widths of the balance functions for charged pions and kaons in terms
of $q_{\rm inv}$ narrow in central collisions compared to peripheral
collisions, which may be driven by the change in the kinetic temperature.
","[{""version"":""v1"",""created"":""Thu, 13 May 2010 12:25:18 GMT""}]","2015-03-17"
"1005.2308","Edwin Henneken","Edwin A. Henneken, Michael J. Kurtz, Alberto Accomazzi, Carolyn Grant,
  Donna Thompson, Elizabeth Bohlen, Giovanni Di Milia, Jay Luker, Stephen S.
  Murray","Finding Your Literature Match -- A Recommender System","Contribution to the proceedings of the colloquium Future Professional
  Communication in Astronomy II, 13-14 April 2010, Cambridge, Massachusetts. 11
  pages, 4 figures.",,"10.1007/978-1-4419-8369-5_14",,"cs.DL cs.IR","http://creativecommons.org/licenses/publicdomain/","  The universe of potentially interesting, searchable literature is expanding
continuously. Besides the normal expansion, there is an additional influx of
literature because of interdisciplinary boundaries becoming more and more
diffuse. Hence, the need for accurate, efficient and intelligent search tools
is bigger than ever. Even with a sophisticated search engine, looking for
information can still result in overwhelming results. An overload of
information has the intrinsic danger of scaring visitors away, and any
organization, for-profit or not-for-profit, in the business of providing
scholarly information wants to capture and keep the attention of its target
audience. Publishers and search engine engineers alike will benefit from a
service that is able to provide visitors with recommendations that closely meet
their interests. Providing visitors with special deals, new options and
highlights may be interesting to a certain degree, but what makes more sense
(especially from a commercial point of view) than to let visitors do most of
the work by the mere action of making choices? Hiring psychics is not an
option, so a technological solution is needed to recommend items that a visitor
is likely to be looking for. In this presentation we will introduce such a
solution and argue that it is practically feasible to incorporate this approach
into a useful addition to any information retrieval system with enough usage.
","[{""version"":""v1"",""created"":""Thu, 13 May 2010 12:35:22 GMT""}]","2016-01-27"
"1005.2309","Antoni Szczurek","Piotr Lebiedowicz and Antoni Szczurek","Exclusive $pp \to nn \pi^{+}\pi^{+}$ reaction at LHC and RHIC","22 pages, 18 figures, calculations have been corrected, new processes
  added, discussion expanded in print in Phys. Rev.D","Phys.Rev.D83:076002,2011","10.1103/PhysRevD.83.076002",,"hep-ph","http://arxiv.org/licenses/nonexclusive-distrib/1.0/","  We evaluate differential distributions for the four-body $p p \to n n \pi^+
\pi^+$ reaction. The amplitude for the process is calculated in the Regge
approach including many diagrams. We make predictions for possible future
experiments at RHIC and LHC energies. Very large cross sections are found which
is partially due to interference of a few mechanisms. Presence of several
interfering mechanisms precludes extraction of the elastic $\pi^+ \pi^+$
scattering cross section. Absorption effects are estimated. Differential
distributions in pseudorapidity, rapidity, invariant two-pion mass,
transverse-momentum and energy distributions of neutrons are presented for
proton-proton collisions at $\sqrt{s}$ = 500 GeV (RHIC) and $\sqrt{s}$ = 0.9,
2.36 and 7 TeV (LHC). Cross sections with experimental cuts are presented.
","[{""version"":""v1"",""created"":""Thu, 13 May 2010 12:46:43 GMT""},{""version"":""v2"",""created"":""Wed, 22 Sep 2010 13:42:09 GMT""},{""version"":""v3"",""created"":""Tue, 29 Mar 2011 14:51:24 GMT""}]","2015-03-17"
"1005.2310","Eran Bouchbinder","Eran Bouchbinder","Autonomy and Singularity in Dynamic Fracture","4 pages, 2 figures, related papers: arXiv:0902.2121 and
  arXiv:0807.4868","Phys. Rev. E 82, 015101(R) (2010)","10.1103/PhysRevE.82.015101",,"cond-mat.mtrl-sci","http://arxiv.org/licenses/nonexclusive-distrib/1.0/","  The recently developed weakly nonlinear theory of dynamic fracture predicts
$1/r$ corrections to the standard asymptotic linear elastic $1/\sqrt{r}$
displacement-gradients, where $r$ is measured from the tip of a tensile crack.
We show that the $1/r$ singularity does not automatically conform with the
notion of autonomy (autonomy means that any crack tip nonlinear solution is
uniquely determined by the surrounding linear elastic $1/\sqrt{r}$ fields) and
that it does not automatically satisfy the resultant Newton's equation in the
crack parallel direction. We show that these two properties are interrelated
and that by requiring that the resultant Newton's equation is satisfied,
autonomy of the $1/r$ singular solution is retained. We further show that the
resultant linear momentum carried by the $1/r$ singular fields vanishes
identically. Our results, which reveal the physical and mathematical nature of
the new solution, are in favorable agreement with recent near tip measurements.
","[{""version"":""v1"",""created"":""Thu, 13 May 2010 12:48:30 GMT""}]","2015-05-19"
"1005.2311","Filip Dutka","F. Dutka and M. Napi\'orkowski","The influence of line tension on the formation of liquid bridges","4 pages, 5 figures","J. Chem. Phys. 133, 051101 (2010)","10.1063/1.3469770",,"cond-mat.soft","http://arxiv.org/licenses/nonexclusive-distrib/1.0/","  The formation of liquid bridges between a planar and conical substrates is
analyzed macroscopically taking into account the line tension. Depending on the
value of the line tension coefficient \tau and geometric parameters of the
system one observes two different scenarios of liquid bridge formation upon
changing the fluid state along the bulk liquid-vapor coexistence. For \tau >
\tau * (\tau * < 0) there is a first-order transition to a state with
infinitely thick liquid bridge. For \tau < \tau * the scenario consists of two
steps: first there is a first-order transition to a state with liquid bridge of
finite thickness which upon further increase of temperature is followed by
continuous growth of the thickness of the bridge to infinity. In addition to
constructing the relevant phase diagram we examine the dependence of the width
of the bridge on thermodynamic and geometric parameters of the system.
","[{""version"":""v1"",""created"":""Thu, 13 May 2010 12:54:02 GMT""}]","2011-12-01"
"1005.2312","Ricardo Hueso","A. S\'anchez-Lavega, A. Wesley, G. Orton, R. Hueso, S. Perez-Hoyos, L.
  N. Fletcher, P. Yanamandra-Fisher, J. Legarreta, I. de Pater, H. Hammel, A.
  Simon-Miller, J. M. Gomez-Forrellad, J. L. Ortiz, E. Garc\'ia-Melendo, R. C.
  Puetter, P. Chodas","The impact of a large object with Jupiter in July 2009","15 pages, 5 figures","The Astrophysical Journal Letters, 715, 2, L150 (2010)","10.1088/2041-8205/715/2/L155",,"astro-ph.EP","http://arxiv.org/licenses/nonexclusive-distrib/1.0/","  On 2009 July 19, we observed a single, large impact on Jupiter at a
planetocentric latitude of 55^{\circ}S. This and the Shoemaker-Levy 9 (SL9)
impacts on Jupiter in 1994 are the only planetary-scale impacts ever observed.
The 2009 impact had an entry trajectory opposite and with a lower incidence
angle than that of SL9. Comparison of the initial aerosol cloud debris
properties, spanning 4,800 km east-west and 2,500 km north-south, with those
produced by the SL9 fragments, and dynamical calculations of pre-impact orbit,
indicate that the impactor was most probably an icy body with a size of 0.5-1
km. The collision rate of events of this magnitude may be five to ten times
more frequent than previously thought. The search for unpredicted impacts, such
as the current one, could be best performed in 890-nm and K (2.03-2.36 {\mu}m)
filters in strong gaseous absorption, where the high-altitude aerosols are more
reflective than Jupiter's primary cloud.
","[{""version"":""v1"",""created"":""Thu, 13 May 2010 13:02:05 GMT""}]","2010-05-14"
"1005.2313","Vasiliy Kharchenko","D.O. Kharchenko, V.O. Kharchenko, I.O. Lysenko, S.V. Kokhan","Stochastic effects at ripple formation processes in anisotropic systems
  with multiplicative noise",,"Phys. Rev. E, 82, 061108 (2010)","10.1103/PhysRevE.82.061108",,"cond-mat.stat-mech","http://arxiv.org/licenses/nonexclusive-distrib/1.0/","  We study pattern formation processes in anisotropic system governed by the
Kuramoto-Sivashinsky equation with multiplicative noise as a generalization of
the Bradley-Harper model for ripple formation induced by ion bombardment. For
both linear and nonlinear systems we study noise induced effects at ripple
formation and discuss scaling behavior of the surface growth and roughness
characteristics. It was found that the secondary parameters of the ion beam
(beam profile and variations of an incidence angle) can crucially change the
topology of patterns and the corresponding dynamics.
","[{""version"":""v1"",""created"":""Thu, 13 May 2010 13:03:10 GMT""}]","2015-05-19"
