"1005.2240","Yun Soo  Myung","Yun Soo Myung","Entropic force and its cosmological implications","16 pages, no figures, version ""Accepted for publication in
  Astrophysics & Space Science""","Astrophys.Space Sci.335:553-559,2011","10.1007/s10509-011-0753-3",,"hep-th gr-qc","http://arxiv.org/licenses/nonexclusive-distrib/1.0/","  We investigate a possibility of realizing the entropic force into the
cosmology. A main issue is how the holographic screen is implemented in the
Newtonian cosmology. Contrary to the relativistic realization of Friedmann
equations, we do not clarify the connection between Newtonian cosmology and
entropic force because there is no way of implementing the holographic screen
in the Newtonian cosmology.
","[{""version"":""v1"",""created"":""Thu, 13 May 2010 01:33:33 GMT""},{""version"":""v2"",""created"":""Wed, 25 May 2011 01:48:41 GMT""}]","2011-09-12"
"1005.2241","Arata Yamamoto","Arata Yamamoto (Kyoto U.)","QCD Dirac spectrum and components of the gauge field",,"Nucl.Phys.B844:115-128,2011","10.1016/j.nuclphysb.2010.10.027",,"hep-lat hep-th","http://arxiv.org/licenses/nonexclusive-distrib/1.0/","  We analyze the relation between the Dirac spectrum and the gauge field in
SU(3) lattice QCD. We focus on how components of the gauge field are related to
the Dirac spectrum. First, we consider momentum components of the gauge field.
It turns out that the broad region of momentum components is relevant for the
low-lying Dirac spectrum and zero modes, i.e., topological charges. The
connection with chiral random matrix theory is also discussed. Second, we
consider an SU(2) subgroup component of the SU(3) gauge field. The SU(2)
subgroup component behaves like the SU(2) gauge field in the low-lying Dirac
spectrum.
","[{""version"":""v1"",""created"":""Thu, 13 May 2010 01:50:32 GMT""},{""version"":""v2"",""created"":""Fri, 29 Oct 2010 16:34:05 GMT""}]","2010-11-23"
"1005.2242","Stanley P. Gudder","Stan Gudder","Quantum measures and the coevent interpretation","one file submitted","Reports on Mathematical Physics 2011; 67(1): 137-156","10.1016/S0034-4877(11)80019-4",,"quant-ph","http://arxiv.org/licenses/nonexclusive-distrib/1.0/","  This paper first reviews quantum measure and integration theory. A new
representation of the quantum integral is presented. This representation is
illustrated by computing some quantum (Lebesgue)${}^2$ integrals. The rest of
the paper only considers finite spaces. Anhomomorphic logics are discussed and
the classical domain of a coevent is studied. Pure quantum measures and
coevents are considered and it is shown that pure quantum measures are strictly
contained in the extremal elements for the set of quantum measures bounded
above by one. Moreover, we prove that any quantum measure on a finite event
space $\ascript$ can be transferred to an ordinary measure on an anhomomorphic
logic $\ascript ^*$. In this way, the quantum dynamics on $\ascript$ can be
described by a classical dynamics on the larger space $\ascript ^*$.
","[{""version"":""v1"",""created"":""Thu, 13 May 2010 01:53:53 GMT""},{""version"":""v2"",""created"":""Sat, 24 Jul 2010 19:31:49 GMT""}]","2022-09-01"
"1005.2243","Huan Xu Dr.","Huan Xu, Shie Mannor","Robustness and Generalization",,,,,"cs.LG","http://arxiv.org/licenses/nonexclusive-distrib/1.0/","  We derive generalization bounds for learning algorithms based on their
robustness: the property that if a testing sample is ""similar"" to a training
sample, then the testing error is close to the training error. This provides a
novel approach, different from the complexity or stability arguments, to study
generalization of learning algorithms. We further show that a weak notion of
robustness is both sufficient and necessary for generalizability, which implies
that robustness is a fundamental property for learning algorithms to work.
","[{""version"":""v1"",""created"":""Thu, 13 May 2010 01:59:57 GMT""}]","2015-03-17"
"1005.2244","Milko Iliev","V. G. Ivanov, M. V. Abrashev, M. N. Iliev, M. M. Gospodinov, J. Meen,
  M. I. Aroyo","Short-Range B-site Ordering in Inverse Spinel Ferrite NiFe2O4","10 pages, 5 figures, 6 tables","Phys. Rev. B 82, 024104 (2010)","10.1103/PhysRevB.82.024104",,"cond-mat.mtrl-sci","http://arxiv.org/licenses/nonexclusive-distrib/1.0/","  The Raman spectra of single crystals of NiFe2O4 were studied in various
scattering configurations in close comparison with the corresponding spectra of
Ni0.7Zn0.3Fe2O4 and Fe3O4. The number of experimentally observed Raman modes
exceeds significantly that expected for a normal spinel structure and the
polarization properties of most of the Raman lines provide evidence for a
microscopic symmetry lower than that given by the Fd-3m space group. We argue
that the experimental results can be explained by considering the short range
1:1 ordering of Ni2+ and Fe3+ at the B-sites of inverse spinel structure, most
probably of tetragonal P4_122/P4_322 symmetry.
","[{""version"":""v1"",""created"":""Thu, 13 May 2010 02:03:47 GMT""}]","2015-05-19"
"1005.2245","Milko Iliev","V. G. Ivanov, M. N. Iliev, Y.-H. A. Wang, A. Gupta","Ferromagnetic spinel CuCr2Se4 studied by Raman spectroscopy and lattice
  dynamics calculations","6 pages, 7 figures, 5 tables","Phys. Rev. B 81, 224302 (2010)","10.1103/PhysRevB.81.224302",,"cond-mat.mtrl-sci","http://arxiv.org/licenses/nonexclusive-distrib/1.0/","  The lattice dynamics of the ferromagnetic spinel CuCr2Se4 (Tc = 430K) was
studied experimentally by measuring the Raman spectra and theoretically by
calculation of zone center phonon frequencies within a shell model. All Raman
allowed modes (A1g + E_g + 3F2g) were identified and assigned to specific
atomic motions. The relative intensity of the Raman lines varies strongly with
excitation photon energy between 1.58 and 2.71 eV, but no significant phonon
anomalies are observed near Tc.
","[{""version"":""v1"",""created"":""Thu, 13 May 2010 02:05:48 GMT""}]","2015-05-19"
"1005.2246","A. Rod Gover","A. Cap, A.R. Gover, M. Hammerl","Projective BGG equations, algebraic sets, and compactifications of
  Einstein geometries","22 pages","J. London Math. Soc. 86 no. 2 (2012) 433-454","10.1112/jlms/jds002",,"math.DG gr-qc math-ph math.MP","http://arxiv.org/licenses/nonexclusive-distrib/1.0/","  For curved projective manifolds we introduce a notion of a normal tractor
frame field, based around any point. This leads to canonical systems of
(redundant) coordinates that generalise the usual homogeneous coordinates on
projective space. These give preferred local maps to the model projective space
that encode geometric contact with the model to a level that is optimal, in a
suitable sense. In terms of the trivialisations arising from the special
frames, normal solutions of classes of natural linear PDE (so-called first BGG
equations) are shown to be necessarily polynomial in the generalised
homogeneous coordinates; the polynomial system is the pull back of a polynomial
system that solves the corresponding problem on the model. Thus questions
concerning the zero locus of solutions, as well as related finer geometric and
smooth data, are reduced to a study of the corresponding polynomial systems and
algebraic sets. We show that a normal solution determines a canonical manifold
stratification that reflects an orbit decomposition of the model. Applications
include the construction of structures that are analogues of Poincare-Einstein
manifolds.
","[{""version"":""v1"",""created"":""Thu, 13 May 2010 02:08:02 GMT""},{""version"":""v2"",""created"":""Wed, 4 May 2011 03:39:07 GMT""}]","2015-09-29"
"1005.2247","Liangjin Yao","Liangjin Yao","The sum of a maximal monotone operator of type (FPV) and a maximal
  monotone operator with full domain is maximal monotone","15 pages Revision",,,,"math.FA math.OC","http://arxiv.org/licenses/nonexclusive-distrib/1.0/","  The most important open problem in Monotone Operator Theory concerns the
maximal monotonicity of the sum of two maximal monotone operators provided that
Rockafellar's constraint qualification holds.
  In this paper, we prove the maximal monotonicity of $A+B$ provided that $A$
and $B$ are maximal monotone operators such that $\dom A\cap\inte\dom
B\neq\varnothing$, $A+N_{\overline{\dom B}}$ is of type (FPV), and $\dom
A\cap\overline{\dom B}\subseteq\dom B$. The proof utilizes the Fitzpatrick
function in an essential way.
","[{""version"":""v1"",""created"":""Thu, 13 May 2010 02:21:50 GMT""},{""version"":""v2"",""created"":""Sat, 14 Aug 2010 00:34:05 GMT""}]","2010-08-17"
"1005.2248","Diego Scheide","Jessica McDonald, Bojan Mohar, Diego Scheide","Kempe equivalence of edge-colourings in subcubic and subquartic graphs","15 pages, 7 figures",,,,"math.CO","http://arxiv.org/licenses/nonexclusive-distrib/1.0/","  It is proved that all 4-edge-colourings of a (sub)cubic graph are Kempe
equivalent. This resolves a conjecture of the second author. In fact, it is
found that the maximum degree Delta=3 is a threshold for Kempe equivalence of
(Delta+1)-edge-colourings, as such an equivalence does not hold in general when
Delta=4. One extra colour allows a similar result in this latter case however,
namely, when Delta<=4 it is shown that all (Delta+2)-edge-colourings are Kempe
equivalent.
","[{""version"":""v1"",""created"":""Thu, 13 May 2010 02:24:18 GMT""},{""version"":""v2"",""created"":""Tue, 18 May 2010 18:51:55 GMT""}]","2015-03-17"
"1005.2249","Tong Zhang","Tong Zhang","Sparse Recovery with Orthogonal Matching Pursuit under RIP",,,,,"cs.IT math.IT","http://arxiv.org/licenses/nonexclusive-distrib/1.0/","  This paper presents a new analysis for the orthogonal matching pursuit (OMP)
algorithm. It is shown that if the restricted isometry property (RIP) is
satisfied at sparsity level $O(\bar{k})$, then OMP can recover a
$\bar{k}$-sparse signal in 2-norm. For compressed sensing applications, this
result implies that in order to uniformly recover a $\bar{k}$-sparse signal in
$\Real^d$, only $O(\bar{k} \ln d)$ random projections are needed. This analysis
improves earlier results on OMP that depend on stronger conditions such as
mutual incoherence that can only be satisfied with $\Omega(\bar{k}^2 \ln d)$
random projections.
","[{""version"":""v1"",""created"":""Thu, 13 May 2010 02:38:29 GMT""},{""version"":""v2"",""created"":""Fri, 3 Jun 2011 04:54:57 GMT""}]","2011-06-06"
"1005.2250","Michael Giudici","John Bamberg and Michael Giudici","Point regular groups of automorphisms of generalised quadrangles","some minor changes (including to title) after referee's comments",,"10.1016/j.jcta.2010.11.004",,"math.CO","http://arxiv.org/licenses/nonexclusive-distrib/1.0/","  We study the point regular groups of automorphisms of some of the known
generalised quadrangles. In particular we determine all point regular groups of
automorphisms of the thick classical generalised quadrangles. We also construct
point regular groups of automorphisms of the generalised quadrangle of order
$(q-1,q+1)$ obtained by Payne derivation from the classical symplectic
quadrangle $\mathsf{W}(3,q)$. For $q=p^f$ with $f\geq 2$ we obtain at least two
nonisomorphic groups when $p\geq 5$ and at least three nonisomorphic groups
when $p=2$ or $3$. Our groups include nonabelian 2-groups, groups of exponent 9
and nonspecial $p$-groups. We also enumerate all point regular groups of
automorphisms of some small generalised quadrangles.
","[{""version"":""v1"",""created"":""Thu, 13 May 2010 02:45:55 GMT""},{""version"":""v2"",""created"":""Thu, 28 Oct 2010 12:15:04 GMT""}]","2012-06-26"
"1005.2251","Onur Sahin","Onur Sahin, Osvaldo Simeone, and Elza Erkip","Interference Channel with a Half-Duplex Out-of-Band Relay","5 pages, 5 figures, to appear in Proceedings of IEEE ISIT 2010",,"10.1109/ISIT.2010.5513378",,"cs.IT math.IT","http://arxiv.org/licenses/nonexclusive-distrib/1.0/","  A Gaussian interference channel (IC) aided by a half-duplex relay is
considered, in which the relay receives and transmits in an orthogonal band
with respect to the IC. The system thus consists of two parallel channels, the
IC and the channel over which the relay is active, which is referred to as
Out-of-Band Relay Channel (OBRC). The OBRC is operated by separating a multiple
access phase from the sources to the relay and a broadcast phase from the relay
to the destinations. Conditions under which the optimal operation, in terms of
the sum-capacity, entails either signal relaying and/or interference forwarding
by the relay are identified. These conditions also assess the optimality of
either separable or non-separable transmission over the IC and OBRC.
Specifically, the optimality of signal relaying and separable coding is
established for scenarios where the relay-to-destination channels set the
performance bottleneck with respect to the source-to-relay channels on the
OBRC. Optimality of interference forwarding and non-separable operation is also
established in special cases.
","[{""version"":""v1"",""created"":""Thu, 13 May 2010 02:54:49 GMT""}]","2016-11-17"
"1005.2252","Roland Roeder","Roland K.W. Roeder","A dichotomy for Fatou components of polynomial skew products","To appear in Conformal Geometry and Dynamics. 13 pages. Version 2 is
  updated with some additional details in the proof, a new example, and a
  discussion of how much of the Axiom-A hypothesis is needed. Comments welcome",,,,"math.DS","http://arxiv.org/licenses/nonexclusive-distrib/1.0/","  We consider polynomial maps of the form f(z,w) = (p(z),q(z,w)) that extend as
holomorphic maps of CP^2. Mattias Jonsson introduces in (Math. Ann., 1999) a
notion of connectedness for such polynomial skew products that is analogous to
connectivity for the Julia set of a polynomial map in one-variable. We prove
the following dichotomy: if f is an Axiom-A polynomial skew product, and f is
connected, then every Fatou component of f is homeomorphic to an open ball;
otherwise, some Fatou component of f has infinitely generated first homology.
","[{""version"":""v1"",""created"":""Thu, 13 May 2010 02:58:03 GMT""},{""version"":""v2"",""created"":""Thu, 6 Jan 2011 03:44:56 GMT""}]","2011-01-07"
"1005.2253","Masayuki Tanaka","Masayuki Tanaka, Carlos De Breuck, Bram Venemans, and Jaron Kurk","The Environmental Dependence of Galaxy Properties at z=2","15 pages, 15 figures, accepted for publication in A&A.",,"10.1051/0004-6361/200913939",,"astro-ph.CO","http://arxiv.org/licenses/nonexclusive-distrib/1.0/","  We report on the environmental dependence of galaxy properties at z=2.15. We
construct multi-band photometric data sets in the (proto-)cluster PKS1138-26
field and in the GOODS field. We then fit spectral energy distributions of the
galaxies with model templates generated with the latest stellar population
synthesis code and derive physical properties of galaxies from the fits. To
quantify the environmental dependence of galaxy properties, a special care is
taken of systematic errors -- we use data sets that have almost the same
wavelength samplings, use the same code to fit SEDs with the same set of
templates, and compare relative differences between the two samples. We find
that the PKS1138 galaxies have similar ages, shorter star formation time
scales, lower star formation rates, and weaker dust extinction compared to the
GOODS galaxies at z~2. This trend is similar to that observed locally,
suggesting that the environmental dependence of galaxy properties is already
partly in place as early as z=2.15. We show that the PKS1138 galaxies assemble
the bulk of their masses ~1 Gyr earlier than field galaxies, i.e., the galaxy
formation depends on environment. Galaxy mergers should frequently occur during
the first collapse of clusters and they might play an important role in driving
the observed environmental dependence of galaxy properties at z=2.15.
","[{""version"":""v1"",""created"":""Thu, 13 May 2010 03:03:06 GMT""}]","2015-05-19"
"1005.2254","John Scoville","John Scoville","On Universal Complexity Measures","The paper has been withdrawn due to the poor predictive performance
  of circuit complexity vs. universal data compression. Given this fact, as
  well as the high computational complexity, the method seems to have little
  practical utility",,,,"cs.IT cs.CC math.IT","http://arxiv.org/licenses/nonexclusive-distrib/1.0/","  We relate the computational complexity of finite strings to universal
representations of their underlying symmetries. First, Boolean functions are
classified using the universal covering topologies of the circuits which
enumerate them. A binary string is classified as a fixed point of its
automorphism group; the irreducible representation of this group is the
string's universal covering group. Such a measure may be used to test the
quasi-randomness of binary sequences with regard to first-order set membership.
Next, strings over general alphabets are considered. The complexity of a
general string is given by a universal representation which recursively factors
the codeword number associated with a string. This is the complexity of the
representation recursively decoding a Godel number having the value of the
string; the result is a tree of prime numbers which forms a universal
representation of the string's group symmetries.
","[{""version"":""v1"",""created"":""Thu, 13 May 2010 03:45:44 GMT""},{""version"":""v2"",""created"":""Mon, 17 May 2010 10:58:58 GMT""},{""version"":""v3"",""created"":""Tue, 18 May 2010 17:14:55 GMT""},{""version"":""v4"",""created"":""Mon, 24 May 2010 02:44:36 GMT""},{""version"":""v5"",""created"":""Mon, 27 Sep 2010 02:48:15 GMT""},{""version"":""v6"",""created"":""Fri, 1 Oct 2010 03:28:56 GMT""},{""version"":""v7"",""created"":""Thu, 7 Oct 2010 22:51:13 GMT""},{""version"":""v8"",""created"":""Wed, 20 Oct 2010 18:39:14 GMT""},{""version"":""v9"",""created"":""Fri, 16 Sep 2011 23:55:09 GMT""}]","2011-09-20"
"1005.2255","Jorgen Rasmussen","Jorgen Rasmussen","On the CFT duals for near-extremal black holes","11 pages","Mod.Phys.Lett.A26:1601-1611,2011","10.1142/S0217732311035973",,"hep-th","http://arxiv.org/licenses/nonexclusive-distrib/1.0/","  We consider Kerr-Newman-AdS-dS black holes near extremality and work out the
near-horizon geometry of these near-extremal black holes. We identify the exact
U(1)_L x U(1)_R isometries of the near-horizon geometry and provide boundary
conditions enhancing them to a pair of commuting Virasoro algebras. The
conserved charges of the corresponding asymptotic symmetries are found to be
well defined and non-vanishing and to yield central charges c_L\neq0 and c_R=0.
The Cardy formula subsequently reproduces the Bekenstein-Hawking entropy of the
black hole. This suggests that the near-extremal Kerr-Newman-AdS-dS black hole
is holographically dual to a non-chiral two-dimensional conformal field theory.
","[{""version"":""v1"",""created"":""Thu, 13 May 2010 04:11:32 GMT""}]","2011-08-03"
"1005.2256","Matilde Marcolli","Matilde Marcolli (Caltech), Elena Pierpaoli (USC), Kevin Teh (Caltech)","The spectral action and cosmic topology","55 pages, LaTeX","Commun.Math.Phys.304:125-174,2011","10.1007/s00220-011-1211-3",,"hep-th astro-ph.CO gr-qc math-ph math.MP","http://arxiv.org/licenses/nonexclusive-distrib/1.0/","  The spectral action functional, considered as a model of gravity coupled to
matter, provides, in its non-perturbative form, a slow-roll potential for
inflation, whose form and corresponding slow-roll parameters can be sensitive
to the underlying cosmic topology. We explicitly compute the non-perturbative
spectral action for some of the main candidates for cosmic topologies, namely
the quaternionic space, the Poincare' dodecahedral space, and the flat tori. We
compute the corresponding slow-roll parameters and see we check that the
resulting inflation model behaves in the same way as for a simply-connected
spherical topology in the case of the quaternionic space and the Poincare'
homology sphere, while it behaves differently in the case of the flat tori. We
add an appendix with a discussion of the case of lens spaces.
","[{""version"":""v1"",""created"":""Thu, 13 May 2010 04:47:00 GMT""}]","2011-04-22"
"1005.2257","Matthias Vigelius","Matthias Vigelius, Andrew Melatos","Gravitational-wave spin-down and stalling lower limits on the electrical
  resistivity of the accreted mountain in a millisecond pulsar","accepted for publication in ApJ.",,"10.1088/0004-637X/717/1/404",,"astro-ph.HE gr-qc","http://arxiv.org/licenses/nonexclusive-distrib/1.0/","  The electrical resistivity of the accreted mountain in a millisecond pulsar
is limited by the observed spin-down rate of binary radio millisecond pulsars
(BRMSPs) and the spins and X-ray fluxes of accreting millisecond pulsars
(AMSPs). We find $\eta \ge 10^{-28}\,\mathrm{s}\,
(\tau_\mathrm{SD}/1\,\mathrm{Gyr})^{-0.8}$ (where $\tau_\mathrm{SD}$ is the
spin-down age) for BRMSPs and $\eta \ge
10^{-25}\,\mathrm{s}\,(\dot{M}_\mathrm{a}/\dot{M}_\mathrm{E})^{0.6}$ (where
$\dot{M}_\mathrm{a}$ and $\dot{M}_\mathrm{E}$ are the actual and Eddington
accretion rates) for AMSPs. These limits are inferred assuming that the
mountain attains a steady state, where matter diffuses resistively across
magnetic flux surfaces but is replenished at an equal rate by infalling
material. The mountain then relaxes further resistively after accretion ceases.
The BRMSP spin-down limit approaches the theoretical electron-impurity
resistivity at temperatures $\ga 10^5$ K for an impurity concentration of $\sim
0.1$, while the AMSP stalling limit falls two orders of magnitude below the
theoretical electron-phonon resistivity for temperatures above $10^8$ K. Hence
BRMSP observations are already challenging theoretical resistivity calculations
in a useful way. Next-generation gravitational-wave interferometers will
constrain $\eta$ at a level that will be competitive with electromagnetic
observations.
","[{""version"":""v1"",""created"":""Thu, 13 May 2010 05:41:01 GMT""}]","2015-05-19"
"1005.2258","SiddeswaraVasu Kalangi","K. S. Vasu, Biswanath Chakraborty, S. Sampath, and A. K. Sood,","Probing top-gated field effect transistor of reduced graphene oxide
  monolayer made by dielectrophoresis","12 pages, 5 figures",,"10.1016/j.ssc.2010.05.018",,"cond-mat.mes-hall","http://arxiv.org/licenses/nonexclusive-distrib/1.0/","  We demonstrate top-gated field effect transistor made of reduced graphene
oxide (RGO) monolayer (graphene) by dielectrophoresis. Raman spectrum of RGO
flakes of typical size of 5{\mu}m x 5{\mu}m show a single 2D band at 2687 cm-1,
characteristic of a single layer graphene. The two probe current - voltage
measurements of RGO flakes, deposited in between the patterned electrodes with
a gap of 2.5 {\mu}m using a.c. dielectrophoresis show ohmic behavior with a
resistance of ~ 37k{\Omega}. The temperature dependence of the resistance (R)
of RGO measured between temperatures 305 K to 393 K yields temperature
coefficient of resistance [dR/dT]/R ~ -9.5x10-4 K-1, same as mechanically
exfoliated single layer graphene. The field effect transistor action was
obtained by electrochemical top-gating using solid polymer electrolyte (PEO +
LiClO4) and Pt wire. Ambipolar nature of graphene flakes is observed upto a
doping level of ~ 6x1012/cm2 and carrier mobility of ~ 50 cm2V-1sec-1. The
source - drain current characteristics shows a tendency of current saturation
at high source - drain voltage which is analyzed quantitatively by a diffusive
transport model.
","[{""version"":""v1"",""created"":""Thu, 13 May 2010 05:41:46 GMT""}]","2015-05-19"
"1005.2259","Julie D\'eserti","Julie D\'eserti","Automorphismes d'entropie positive, le cas des surfaces rationnelles","94 pages, in French",,,,"math.AG math.DS","http://arxiv.org/licenses/nonexclusive-distrib/1.0/","  A complex compact surface which carries an automorphism of positive
topological entropy has been proved by Cantat to be a torus, a K3 surface, an
Enriques surface or a non-minimal rational surface. We deal with results
obtained in this last case. After some recalls on birational maps, algebraic
geometry and dynamic, we will speak about Bedford and Kim's works, but also
about McMullen's work and more recently about Grivaux and the author's work.
These notes have been written for four talks given at IMPA in february/march
2010.
","[{""version"":""v1"",""created"":""Thu, 13 May 2010 06:04:05 GMT""},{""version"":""v2"",""created"":""Wed, 7 Jul 2010 19:49:39 GMT""}]","2015-03-17"
