"1005.4478","Jie Chen","Jie Chen, Gang Zhang, Baowen Li","How to Improve The Accuracy of Equilibrium Molecular Dynamics For
  Computation of Thermal Conductivity?","21 pages, 3 figures","Phys. Lett. A, 375, 2392 (2010)","10.1016/j.physleta.2010.03.067",,"cond-mat.stat-mech","http://arxiv.org/licenses/nonexclusive-distrib/1.0/","  Equilibrium molecular dynamics (EMD) simulations through Green-Kubo formula
(GKF) have been widely used in the study of thermal conductivity of various
materials. However, there exist controversial simulation results which have
huge discrepancies with experimental ones in literatures. In this paper, we
demonstrate that the fluctuation in calculated thermal conductivity is due to
the uncertainty in determination of the truncation time, which is related to
the ensemble and size dependent phonon relaxation time. We thus propose a new
scheme in the direct integration of heat current autocorrelation function
(HCACF) and a nonzero correction in the double-exponential-fitting of HCACF to
describe correctly the contribution to thermal conductivity from low frequency
phonons. By using crystalline Silicon (Si) and Germanium (Ge) as examples, we
demonstrate that our method can give rise to the values of thermal conductivity
in an excellent agreement with experimental ones.
","[{""version"":""v1"",""created"":""Tue, 25 May 2010 04:15:35 GMT""}]","2015-05-19"
"1005.4479","Xiong Wei Liu","T. Fischer, I. Sagert, M. Hempel, G. Pagliara, J. Schaffner-Bielich,
  A. Mezzacappa, F.-K. Thielemann and M. Liebendorfer","Exploring the QCD phase transition in core collapse supernova
  simulations in spherical symmetry","14 pages, 4 figures, 1 table. To appear in Proceedings for ""Compact
  stars in the QCD phase diagram II (CSQCD II), May 20-24, 2009, KIAA at Peking
  University, Beijing - P. R. China [http://vega.bac.pku.edu.cn/rxxu/csqcd.htm]",,,,"astro-ph.SR astro-ph.CO","http://arxiv.org/licenses/nonexclusive-distrib/1.0/","  For finite chemical potential effective models of QCD predict a first order
phase transition. In favour for the search of such a phase transition in
nature, we construct an equation of state for strange quark matter based on the
MIT bag model. We apply this equation of state to highly asymmetric core
collapse supernova matter with finite temperatures and large baryon densities.
The phase transition is constructed using the general Gibbs conditions, which
results in an extended coexistence region between the pure hadronic and pure
quark phases in the phase diagram, i.e. the mixed phase. The supernovae are
simulated via general relativistic radiation hydrodynamics based on three
flavor Boltzmann neutrino transport in spherical symmetry. During the dynamical
evolution temperatures above 10 MeV, baryon densities above nuclear saturation
density and a proton-to-baryon ratio below 0.2 are obtained. At these
conditions the phase transition is triggered which leads to a significant
softening of the EoS for matter in the mixed phase. As a direct consequence of
the stiffening of the EoS again for matter in the pure quark phase, a shock
wave forms at the boundary between the mixed and the pure hadronic phases. This
shock is accelerated and propagates outward which releases a burst of neutrinos
dominated by electron anti-neutrinos due to the lifted degeneracy of the
shock-heated hadronic material. We discuss the radiation-hydrodynamic evolution
of the phase transition at the example of several low and intermediate mass
Fe-core progenitor stars and illustrate the expected neutrino signal from the
phase transition.
","[{""version"":""v1"",""created"":""Tue, 25 May 2010 04:25:21 GMT""},{""version"":""v2"",""created"":""Tue, 27 Jul 2010 14:40:28 GMT""}]","2010-07-28"
"1005.4480","Muhammad Sharif","M. Sharif and M. Zubair","Dynamics of Bianchi I Universe with Magnetized Anisotropic Dark Energy","16 pages, 2 figures, accepted for publication in Astrophys. Space Sci","Astrophys.Space Sci.330:399-405,2010","10.1007/s10509-010-0414-y",,"gr-qc","http://arxiv.org/licenses/nonexclusive-distrib/1.0/","  We study Bianchi type $I$ cosmological model in the presence of magnetized
anisotropic dark energy. The energy-momentum tensor consists of anisotropic
fluid with anisotropic EoS $p=\omega{\rho}$ and a uniform magnetic field of
energy density $\rho_B$. We obtain exact solutions to the field equations using
the condition that expansion is proportional to the shear scalar. The physical
behavior of the model is discussed with and without magnetic field. We conclude
that universe model as well as anisotropic fluid do not approach isotropy
through the evolution of the universe.
","[{""version"":""v1"",""created"":""Tue, 25 May 2010 04:28:12 GMT""}]","2010-11-03"
"1005.4481","Jie Chen","Jie Chen, Gang Zhang, Baowen Li","Molecular Dynamics Simulations of Heat Conduction in Nanostructures:
  Effect of Heat Bath","18 pages, 4 figures. This manuscript is accepted for publication in
  JPSJ","J. Phys. Soc. Jpn., 79, 074604 (2010)","10.1143/JPSJ.79.074604",,"cond-mat.mes-hall","http://arxiv.org/licenses/nonexclusive-distrib/1.0/","  We investigate systematically the impacts of heat bath used in molecular
dynamics simulations on heat conduction in nanostructures exemplified by
Silicon Nanowires (SiNWs) and Silicon/Germanium nano junction. It is found that
multiple layers of Nos\'e-Hoover heat bath are required to reduce the
temperature jump at the boundary, while only a single layer of Langevin heat
bath is sufficient to generate a linear temperature profile with small boundary
temperature jump. Moreover, an intermediate value of heat bath parameter is
recommended for both Nos\'e-Hoover and Langevin heat bath in order to achieve
correct temperature profile and thermal conductivity in homogeneous materials.
Furthermore, the thermal rectification ratio in Si/Ge thermal diode depends on
the choice of Nos\'e-Hoover heat bath parameter remarkably, which may lead to
non-physical results. In contrast, Langevin heat bath is recommended because it
can produce consistent results with experiment in large heat bath parameter
range.
","[{""version"":""v1"",""created"":""Tue, 25 May 2010 04:32:58 GMT""}]","2015-05-19"
"1005.4482","Alexey Lukoyanov","Yu.Yu. Tsiovkin, A.V. Lukoyanov, A.O. Shorikov, A.A. Povzner, L.Yu.
  Tsiovkina, A.A. Dyachenko, V.B. Bystrushkin, M.V. Raybukhina, M.A. Korotin,
  V.V. Dremov, V.I. Anisimov","Evolution of electrical resistivity and electronic structure of
  transuranium metals under pressure: Numerical investigations","12 pages, 7 figures",,,,"cond-mat.str-el","http://arxiv.org/licenses/nonexclusive-distrib/1.0/","  The influence of electronic structure evolution upon pressure on the
temperature dependencies of electrical resistivity of pure Np, Pu, Am, and Cm
metals have been investigated within coherent potential approximation (CPA) for
many-bands conductivity model. Electronic structure of pure actinide metals was
calculated within the local density approximation with the Hubbard U and
spin-orbit coupling corrections (LDA+U+SO) method in various phases at normal
conditions and under pressure. They were compared with the corresponding cubic
(bcc or fcc) phases. The densities of states of the latter were used as a
starting point of model investigations of electrical resistivity. The obtained
results were found in good agreement with available experimental data. The
nature of large magnitude of resistivity of actinides was discussed in terms of
the proposed conductivity model using the ab initio calculated parameters.
","[{""version"":""v1"",""created"":""Tue, 25 May 2010 05:19:29 GMT""}]","2010-05-26"
"1005.4483","Petarpa Boonserm","Petarpa Boonserm (Chulalongkorn University), Matt Visser (Victoria
  University of Wellington)","Quasi-normal frequencies: Key analytic results","V1: 29 pages; V2: Reformatted, 31 pages. Title changed to reflect
  major additions and revisions. Now describes exact QNFs for the double-delta
  potential in terms of the Lambert W function. V3: Minor edits for clarity.
  Four references added. No physics changes. Still 31 pages","JHEP 1103:073,2011","10.1007/JHEP03(2011)073",,"math-ph gr-qc hep-th math.MP quant-ph","http://arxiv.org/licenses/nonexclusive-distrib/1.0/","  The study of exact quasi-normal modes [QNMs], and their associated
quasi-normal frequencies [QNFs], has had a long and convoluted history -
replete with many rediscoveries of previously known results. In this article we
shall collect and survey a number of known analytic results, and develop
several new analytic results - specifically we shall provide several new QNF
results and estimates, in a form amenable for comparison with the extant
literature. Apart from their intrinsic interest, these exact and approximate
results serve as a backdrop and a consistency check on ongoing efforts to find
general model-independent estimates for QNFs, and general model-independent
bounds on transmission probabilities. Our calculations also provide yet another
physics application of the Lambert W function. These ideas have relevance to
fields as diverse as black hole physics, (where they are related to the damped
oscillations of astrophysical black holes, to greybody factors for the Hawking
radiation, and to more speculative state-counting models for the Bekenstein
entropy), to quantum field theory (where they are related to Casimir energies
in unbounded systems), through to condensed matter physics, (where one may
literally be interested in an electron tunelling through a physical barrier).
","[{""version"":""v1"",""created"":""Tue, 25 May 2010 05:34:11 GMT""},{""version"":""v2"",""created"":""Thu, 13 Jan 2011 23:00:05 GMT""},{""version"":""v3"",""created"":""Thu, 20 Jan 2011 04:42:55 GMT""}]","2011-03-21"
"1005.4484","Binyong Sun","Binyong Sun, Chen-Bo Zhu","A note on special orthogonal groups following Waldspurger","This note is incorporated into the article ""Multiplicity one
  theorems: the Archimedean case"", arXiv:0903.1413, to appear in Annals of
  Mathematics",,,,"math.RT","http://arxiv.org/licenses/nonexclusive-distrib/1.0/","  The purpose of this note is to verify that the archimedean multiplicity one
theorems shown for orthogonal groups (as well as general linear and unitary
groups) in a previous paper of the authors remain valid for special orthogonal
groups. The necessary ingredients to establish this variant are due to
Waldspurger.
","[{""version"":""v1"",""created"":""Tue, 25 May 2010 05:47:13 GMT""},{""version"":""v2"",""created"":""Tue, 11 Oct 2011 11:56:50 GMT""}]","2011-10-12"
"1005.4485","Seiji Zenitani","Seiji Zenitani, Michael Hesse, and Alex Klimas","Resistive Magnetohydrodynamic Simulations of Relativistic Magnetic
  Reconnection","published in ApJL","Astrophysical Journal, 716, L214 (2010)","10.1088/2041-8205/716/2/L214",,"astro-ph.HE","http://arxiv.org/licenses/nonexclusive-distrib/1.0/","  Resistive relativistic magnetohydrodynamic (RRMHD) simulations are applied to
investigate the system evolution of relativistic magnetic reconnection. A
time-split Harten--Lan--van Leer method is employed. Under a localized
resistivity, the system exhibits a fast reconnection jet with an Alfv\'{e}nic
Lorentz factor inside a narrow Petschek-type exhaust. Various shock structures
are resolved in and around the plasmoid such as the post-plasmoid vertical
shocks and the ""diamond-chain"" structure due to multiple shock reflections.
Under a uniform resistivity, Sweet--Parker-type reconnection slowly evolves.
Under a current-dependent resistivity, plasmoids are repeatedly formed in an
elongated current sheet. It is concluded that the resistivity model is of
critical importance for RRMHD modeling of relativistic magnetic reconnection.
","[{""version"":""v1"",""created"":""Tue, 25 May 2010 06:06:16 GMT""},{""version"":""v2"",""created"":""Fri, 4 Jun 2010 18:08:09 GMT""}]","2010-06-07"
"1005.4486","N.D. Hari Dass","N.D. Hari Dass","Unknown single oscillator coherent states do have statistical
  significance","4 pages in Revtex",,,,"quant-ph","http://arxiv.org/licenses/nonexclusive-distrib/1.0/","  It is shown, contrary to popular belief, that {\it single unknown} oscillator
coherent states can be endowed with a {\em measurable statistical
significance}.
","[{""version"":""v1"",""created"":""Tue, 25 May 2010 06:06:37 GMT""}]","2010-05-26"
"1005.4487","Kazuhiro Sakai","Yasuyuki Hatsuda, Katsushi Ito, Kazuhiro Sakai, Yuji Satoh","Six-point gluon scattering amplitudes from Z_4-symmetric integrable
  model","29 pages, 11 figures, v2: physical interpretations added, a figure
  removed, to appear in JHEP","JHEP 1009:064,2010","10.1007/JHEP09(2010)064",,"hep-th","http://arxiv.org/licenses/nonexclusive-distrib/1.0/","  We study six-point gluon scattering amplitudes in N=4 super Yang-Mills theory
at strong coupling by investigating the thermodynamic Bethe ansatz equations of
the underlying Z_4-symmetric integrable model both analytically and
numerically. By the conformal field theory (CFT) perturbation, we compute the
free energy part of the remainder function with generic chemical potential near
the CFT/small mass limit. Combining this with the expansion of the Y-functions,
we obtain the remainder function near the small mass limit up to a function of
the chemical potential, which can be evaluated numerically. We also find the
leading corrections to the remainder function near the large mass limit. We
confirm that these results are in good agreement with numerical computations.
","[{""version"":""v1"",""created"":""Tue, 25 May 2010 06:12:08 GMT""},{""version"":""v2"",""created"":""Wed, 15 Sep 2010 14:24:18 GMT""}]","2014-11-21"
"1005.4488","Mikhail Grinberg","Mikhail Grinberg","Dimensions of the Ascending and Descending Sets in Complex Stratified
  Morse Theory","31 pages",,,,"math.AG math.CV","http://arxiv.org/licenses/nonexclusive-distrib/1.0/","  We present a new construction of gradient-like vector fields in the setting
of Morse theory on a complex analytic stratification. We prove that the
ascending and descending sets for these vector fields possess cell
decompositions satisfying the dimension bounds conjectured by M. Goresky and R.
MacPherson. Similar results by C.-H. Cho and G. Marelli have recently appeared
in arXiv:0908.1862.
","[{""version"":""v1"",""created"":""Tue, 25 May 2010 06:15:28 GMT""}]","2010-05-26"
"1005.4489","Tarun Deep Saini","Tarun Deep Saini, Shiv K. Sethi and Varun Sahni","Possible use of self-calibration to reduce systematic uncertainties in
  determining distance-redshift relation via gravitational radiation from
  merging binaries","6 pages, 2 figures, accepted for publication in PRD","Phys.Rev.D81:103009,2010","10.1103/PhysRevD.81.103009",,"astro-ph.CO gr-qc","http://arxiv.org/licenses/nonexclusive-distrib/1.0/","  By observing mergers of compact objects, future gravity wave experiments
would measure the luminosity distance to a large number of sources to a high
precision but not their redshifts. Given the directional sensitivity of an
experiment, a fraction of such sources (gold plated -- GP) can be identified
optically as single objects in the direction of the source. We show that if an
approximate distance-redshift relation is known then it is possible to
statistically resolve those sources that have multiple galaxies in the beam. We
study the feasibility of using gold plated sources to iteratively resolve the
unresolved sources, obtain the self-calibrated best possible distance-redshift
relation and provide an analytical expression for the accuracy achievable. We
derive lower limit on the total number of sources that is needed to achieve
this accuracy through self-calibration. We show that this limit depends
exponentially on the beam width and give estimates for various experimental
parameters representative of future gravitational wave experiments DECIGO and
BBO.
","[{""version"":""v1"",""created"":""Tue, 25 May 2010 06:29:57 GMT""}]","2011-02-28"
"1005.4490","Nico Lastzka","Nico Lastzka, Jessica Steinlechner, Sebastian Steinlechner and Roman
  Schnabel","Measuring small absorptions exploiting photo-thermal self-phase
  modulation",,,,,"physics.optics","http://arxiv.org/licenses/nonexclusive-distrib/1.0/","  We present a method for the measurement of small optical absorption
coefficients. The method exploits the deformation of cavity Airy peaks that
occur if the cavity contains an absorbing material with a non-zero
thermo-refractive coefficient dn/dT or a non-zero expansion coefficient ath .
Light absorption leads to a local temperature change and to an
intensity-dependent phase shift, i.e. to a photo-thermal self-phase modulation.
The absorption coefficient is derived from a comparison of time-resolved
measurements with a numerical time-domain simulation applying a Markov-chain
Monte-Carlo (MCMC) algorithm. We apply our method to the absorption coefficient
of lithium niobate (LN) doped with 7mol% magnesium oxide (MgO) and derive a
value of alphaLN = (5.9 +/- 0.9) *10^-4/cm . Our method should also apply to
materials with much lower absorption coefficients. Based on our modelling we
estimate that with cavity finesse values of the order 10^4, absorption
coefficients of as low as 10^-8 /cm can be measured.
","[{""version"":""v1"",""created"":""Tue, 25 May 2010 06:53:16 GMT""}]","2010-05-26"
"1005.4491","Ettore Vicari","Francesco Parisen Toldin, Andrea Pelissetto, Ettore Vicari","Universality of the glassy transitions in the two-dimensional +- J Ising
  model","9 pages, 17 figs","Phys. Rev. E 82 (2010) 021106","10.1103/PhysRevE.82.021106",,"cond-mat.dis-nn cond-mat.stat-mech","http://arxiv.org/licenses/nonexclusive-distrib/1.0/","  We investigate the zero-temperature glassy transitions in the square-lattice
+- J Ising model, with bond distribution $P(J_{xy}) = p \delta(J_{xy} - J) +
(1-p) \delta(J_{xy} + J)$; p=1 and p=1/2 correspond to the pure Ising model and
to the Ising spin glass with symmetric bimodal distribution, respectively. We
present finite-temperature Monte Carlo simulations at p=4/5, which is close to
the low-temperature paramagnetic-ferromagnetic transition line located at
p=0.89, and at p=1/2. Their comparison provides a strong evidence that the
glassy critical behavior that occurs for $1-p_0<p<p_0$, $p_0=0.897$, is
universal, i.e., independent of p. Moreover, we show that glassy and magnetic
modes are not coupled at the multicritical zero-temperature point where the
paramagnetic-ferromagnetic transition line and the T=0 glassy transition line
meet. On the theoretical side we discuss the validity of finite-size scaling in
glassy systems with a zero-temperature transition and a discrete Hamiltonian
spectrum. Because of a freezing phenomenon which occurs in a finite volume at
sufficiently low temperatures, the standard finite-size scaling limit in terms
of $TL^{1/\nu}$ does not exist: the renormalization-group invariant quantity
$\xi/L$ should be used instead as basic variable.
","[{""version"":""v1"",""created"":""Tue, 25 May 2010 07:09:37 GMT""}]","2010-08-25"
"1005.4492","Nazli Besharati","A. Ahadi, Nazli Besharati, E. S. Mahmoodian and M. Mortezaeefar","Silver block intersection graphs of Steiner 2-designs",,,,,"math.CO","http://arxiv.org/licenses/nonexclusive-distrib/1.0/","  For a block design $\cal{D}$, a series of {\sf block intersection graphs}
$G_i$, or $i$-{\rm BIG}($\cal{D}$), $i=0, ..., k$ is defined in which the
vertices are the blocks of $\cal{D}$, with two vertices adjacent if and only if
the corresponding blocks intersect in exactly $i$ elements. A silver graph $G$
is defined with respect to a maximum independent set of $G$, called a {\sf
diagonal} of that graph. Let $G$ be $r$-regular and $c$ be a proper $(r +
1)$-coloring of $G$. A vertex $x$ in $G$ is said to be {\sf rainbow} with
respect to $c$ if every color appears in the closed neighborhood $N[x] = N(x)
\cup \{x\}$. Given a diagonal $I$ of $G$, a coloring $c$ is said to be silver
with respect to $I$ if every $x\in I$ is rainbow with respect to $c$. We say
$G$ is {\sf silver} if it admits a silver coloring with respect to some $I$.
  We investigate conditions for 0-{\rm BIG}($\cal{D}$) and 1-{\rm
BIG}($\cal{D}$) of Steiner systems ${\cal{D}}=S(2,k,v)$ to be silver.
","[{""version"":""v1"",""created"":""Tue, 25 May 2010 07:23:11 GMT""},{""version"":""v2"",""created"":""Mon, 26 Mar 2012 14:46:51 GMT""},{""version"":""v3"",""created"":""Wed, 28 Mar 2012 11:01:08 GMT""}]","2012-03-29"
"1005.4493","Chandrasekhar Venkataraman","Chandrasekhar Venkataraman, Omar Lakkis and Anotida Madzvamuse","Global existence for semilinear reaction-diffusion systems on evolving
  domains","24 pages, 3 figures","Journal of Mathematical Biology online first 4 Feb 2011","10.1007/s00285-011-0404-x","SMRR-2010-12","nlin.PS math.DS","http://arxiv.org/licenses/nonexclusive-distrib/1.0/","  We present global existence results for solutions of reaction-diffusion
systems on evolving domains. Global existence results for a class of
reaction-diffusion systems on fixed domains are extended to the same systems
posed on spatially linear isotropically evolving domains. The results hold
without any assumptions on the sign of the growth rate. The analysis is valid
for many systems that commonly arise in the theory of pattern formation. We
present numerical results illustrating our theoretical findings.
","[{""version"":""v1"",""created"":""Tue, 25 May 2010 07:28:15 GMT""},{""version"":""v2"",""created"":""Sun, 20 Jun 2010 14:28:44 GMT""},{""version"":""v3"",""created"":""Sat, 20 Nov 2010 15:43:48 GMT""}]","2011-04-06"
"1005.4494","Svante Janson","Svante Janson and Joel Spencer","Phase transitions for modified Erd\""os-R\'enyi processes","22 pages",,"10.1007/s11512-011-0157-1",,"math.CO math.PR","http://arxiv.org/licenses/nonexclusive-distrib/1.0/","  A fundamental and very well studied region of the Erd\""os-R\'enyi process is
the phase transition at n/2 edges in which a giant component suddenly appears.
We examine the process beginning with an initial graph. We further examine the
Bohman-Frieze process in which edges between isolated vertices are more likely.
While the positions of the phase transitions vary, the three processes belong,
roughly speaking, to the same universality class. In particular, the growth of
the giant component in the barely supercritical region is linear in all cases.
","[{""version"":""v1"",""created"":""Tue, 25 May 2010 07:34:09 GMT""}]","2015-05-19"
"1005.4495","Sebastian Deffner","Sebastian Deffner and Eric Lutz","Generalized Clausius inequality for nonequilibrium quantum processes","4 pages, 2 figures","Phys. Rev. Lett. 105 (2010) 170402","10.1103/PhysRevLett.105.170402",,"cond-mat.stat-mech quant-ph","http://arxiv.org/licenses/nonexclusive-distrib/1.0/","  We show that the nonequilibrium entropy production for a driven quantum
system is larger than the Bures length, the geometric distance between its
actual state and the corresponding equilibrium state. This universal lower
bound generalizes the Clausius inequality to arbitrary nonequilibrium processes
beyond linear response. We further derive a fundamental upper bound for the
quantum entropy production rate and discuss its connection to the
Bremermann-Bekenstein bound.
","[{""version"":""v1"",""created"":""Tue, 25 May 2010 07:45:17 GMT""}]","2011-04-28"
"1005.4496","Secretary Aircc Journal","Dewan Md. Farid(1), Nouria Harbi(1), and Mohammad Zahidur Rahman(2),
  ((1)University Lumiere Lyon 2 - France, (2)Jahangirnagar University,
  Bangladesh)","Combining Naive Bayes and Decision Tree for Adaptive Intrusion Detection","14 Pages, IJNSA","International Journal of Network Security & Its Applications 2.2
  (2010) 12-25","10.5121/ijnsa.2010.2202",,"cs.AI","http://creativecommons.org/licenses/by-nc-sa/3.0/","  In this paper, a new learning algorithm for adaptive network intrusion
detection using naive Bayesian classifier and decision tree is presented, which
performs balance detections and keeps false positives at acceptable level for
different types of network attacks, and eliminates redundant attributes as well
as contradictory examples from training data that make the detection model
complex. The proposed algorithm also addresses some difficulties of data mining
such as handling continuous attribute, dealing with missing attribute values,
and reducing noise in training data. Due to the large volumes of security audit
data as well as the complex and dynamic properties of intrusion behaviours,
several data miningbased intrusion detection techniques have been applied to
network-based traffic data and host-based data in the last decades. However,
there remain various issues needed to be examined towards current intrusion
detection systems (IDS). We tested the performance of our proposed algorithm
with existing learning algorithms by employing on the KDD99 benchmark intrusion
detection dataset. The experimental results prove that the proposed algorithm
achieved high detection rates (DR) and significant reduce false positives (FP)
for different types of network intrusions using limited computational
resources.
","[{""version"":""v1"",""created"":""Tue, 25 May 2010 07:47:00 GMT""}]","2010-07-15"
