"1005.4536","Hiroshi Tanida","Hiroshi Tanida, Daiki Tanaka, Masafumi Sera, Chikako Moriyoshi,
  Yoshihiro Kuroiwa, Tomoaki Takesaka, Takashi Nishioka, Harukazu Kato, and
  Masahiro Matsumura","Anisotropic Transport Properties of CeRu$_2$Al$_{10}$","4 pages, 5 figures",,,,"cond-mat.str-el","http://arxiv.org/licenses/nonexclusive-distrib/1.0/","  We studied the transport properties of CeRu_2Al_10 single crystals. All the
transport properties show largely anisotropic behaviors below T_0. Those along
the a- and c-axes show similar behaviors, but are different from those along
the b-axis. This suggests that the system could be viewed as a two-dimensional
system. The results of the thermal conductivity and thermoelectric power could
be explained by assuming the singlet ground state below T_0. However, the
ground state is not simple but has some kind of structure within a spin gap.
","[{""version"":""v1"",""created"":""Tue, 25 May 2010 11:29:04 GMT""}]","2010-05-26"
"1005.4537","Eugene Lytvynov Prof","Guanhua Li, Eugene Lytvynov","A note on equilibrium Glauber and Kawasaki dynamics for permanental
  point processes",,,,,"math.PR","http://arxiv.org/licenses/nonexclusive-distrib/1.0/","  We construct two types of equilibrium dynamics of an infinite particle system
in a locally compact metric space $X$ for which a permanental point process is
a symmetrizing, and hence invariant measure. The Glauber dynamics is a
birth-and-death process in $X$, while in the Kawasaki dynamics interacting
particles randomly hop over $X$. In the case $X=\mathbb R^d$, we consider a
diffusion approximation for the Kawasaki dynamics at the level of Dirichlet
forms. This leads us to an equilibrium dynamics of interacting Brownian
particles for which a permanental point process is a symmetrizing measure.
","[{""version"":""v1"",""created"":""Tue, 25 May 2010 11:32:51 GMT""},{""version"":""v2"",""created"":""Fri, 23 Jul 2010 16:42:54 GMT""},{""version"":""v3"",""created"":""Thu, 9 Dec 2010 17:58:31 GMT""}]","2010-12-10"
"1005.4538","Mehmet Sahin","M. Sahin (TOBB University of Economics and Technology, Physics
  Division, Ankara, Turkey), S. Sultansoy (TOBB University of Economics and
  Technology, Physics Division, Ankara, Turkey and Institute of Physics,
  National Academy of Sciences, Baku, Azerbaijan), S. Turkoz (Ankara
  University, Department of Physics, Ankara, Turkey)","A Search for the Fourth SM Family Quarks through Anomalous Decays","8 pages, 2 figures","Phys.Rev.D82:051503,2010","10.1103/PhysRevD.82.051503",,"hep-ph hep-ex","http://arxiv.org/licenses/nonexclusive-distrib/1.0/","  The existence of fourth family follows from the basics of the Standard Model.
Because of the high masses of the fourth family quarks, their anomalous decays
could be dominant, if certain criteria are met. This will drastically change
the search strategy at hadron colliders. We show that the fourth SM family down
quarks with masses up to 400-450 GeV can be observed (or excluded) via
anomalous decays by Tevatron before the LHC.
","[{""version"":""v1"",""created"":""Tue, 25 May 2010 11:33:06 GMT""},{""version"":""v2"",""created"":""Sat, 5 Jun 2010 15:29:07 GMT""},{""version"":""v3"",""created"":""Sat, 31 Jul 2010 17:36:45 GMT""}]","2014-11-21"
"1005.4539","Raja Giryes","Raja Giryes and Michael Elad","RIP-Based Near-Oracle Performance Guarantees for Subspace-Pursuit,
  CoSaMP, and Iterative Hard-Thresholding","33 pages, 7 figures, submitted to IEEE on information theory, 2010",,,,"stat.ME","http://arxiv.org/licenses/nonexclusive-distrib/1.0/","  This paper presents an average case denoising performance analysis for the
Subspace Pursuit (SP), the CoSaMP and the IHT algorithms. This analysis
considers the recovery of a noisy signal, with the assumptions that (i) it is
corrupted by an additive random white Gaussian noise; and (ii) it has a
K-sparse representation with respect to a known dictionary D. The proposed
analysis is based on the Restricted-Isometry-Property (RIP), establishing a
near-oracle performance guarantee for each of these algorithms. The results for
the three algorithms differ in the bounds' constants and in the cardinality
requirement (the upper bound on $K$ for which the claim is true).
  Similar RIP-based analysis was carried out previously for the Dantzig
Selector (DS) and the Basis Pursuit (BP). Past work also considered a
mutual-coherence-based analysis of the denoising performance of the DS, BP, the
Orthogonal Matching Pursuit (OMP) and the thresholding algorithms. This work
differs from the above as it addresses a different set of algorithms. Also,
despite the fact that SP, CoSaMP, and IHT are greedy-like methods, the
performance guarantees developed in this work resemble those obtained for the
relaxation-based methods (DS and BP), suggesting that the performance is
independent of the sparse representation entries contrast and magnitude.
","[{""version"":""v1"",""created"":""Tue, 25 May 2010 11:34:56 GMT""}]","2010-05-26"
"1005.4540","Haris Aziz","Haris Aziz, Felix Brandt, and Hans Georg Seedig","Optimal Partitions in Additively Separable Hedonic Games","11 pages; A preliminary version of this work was invited for
  presentation in the session `Cooperative Games and Combinatorial
  Optimization' at the 24th European Conference on Operational Research (EURO
  2010) in Lisbon","Artificial Intelligence 195, 2013","10.1016/j.artint.2012.09.006",,"cs.GT","http://arxiv.org/licenses/nonexclusive-distrib/1.0/","  We conduct a computational analysis of fair and optimal partitions in
additively separable hedonic games. We show that, for strict preferences, a
Pareto optimal partition can be found in polynomial time while verifying
whether a given partition is Pareto optimal is coNP-complete, even when
preferences are symmetric and strict. Moreover, computing a partition with
maximum egalitarian or utilitarian social welfare or one which is both Pareto
optimal and individually rational is NP-hard. We also prove that checking
whether there exists a partition which is both Pareto optimal and envy-free is
$\Sigma_{2}^{p}$-complete. Even though an envy-free partition and a Nash stable
partition are both guaranteed to exist for symmetric preferences, checking
whether there exists a partition which is both envy-free and Nash stable is
NP-complete.
","[{""version"":""v1"",""created"":""Tue, 25 May 2010 11:38:41 GMT""},{""version"":""v2"",""created"":""Fri, 9 Jul 2010 09:23:29 GMT""},{""version"":""v3"",""created"":""Thu, 3 Mar 2011 23:33:22 GMT""}]","2015-02-06"
"1005.4541","Mubasher Jamil","Ahmad Sheykhi, Kayoomars Karami, Mubasher Jamil, E. Kazemi and M.
  Haddad","Holographic dark energy in Brans-Dicke theory with log correction","19 pages, accepted for publication in 'General Relativity and
  Gravitation'","Gen. Relativ. Gravit. (2012) 44:623-638","10.1007/s10714-011-1315-2",,"physics.gen-ph","http://arxiv.org/licenses/nonexclusive-distrib/1.0/","  In the derivation of holographic dark energy density, the area law of the
black hole entropy plays a crucial role. However, the entropy-area relation can
be modified from the inclusion of quantum effects, motivated from the loop
quantum gravity, string theory and black hole physics. In this paper, we study
cosmological implication of the interacting entropy-corrected holographic dark
energy model in the framework of Brans-Dicke cosmology. We obtain the equation
of state and the deceleration parameters of the entropy-corrected holographic
dark energy in a non-flat Universe. As system's IR cutoff we choose the radius
of the event horizon measured on the sphere of the horizon, defined as
$L=ar(t)$. We find out that when the entropy-corrected holographic dark energy
is combined with the Brans-Dicke field, the transition from normal state where
$w_D >-1 $ to the phantom regime where $w_D <-1 $ for the equation of state of
interacting dark energy can be more easily achieved for than when resort to the
Einstein field equations is made.
","[{""version"":""v1"",""created"":""Tue, 25 May 2010 11:43:40 GMT""},{""version"":""v2"",""created"":""Tue, 1 Nov 2011 04:23:12 GMT""}]","2012-03-12"
"1005.4542","N.D. Hari Dass","N.D. Hari Dass","A new form of the no-cloning theorem for harmonic oscillator coherent
  states","2 pages in Revtex",,,,"quant-ph","http://arxiv.org/licenses/nonexclusive-distrib/1.0/","  We give an alternative formulation of the no-cloning theorem that applies to
harmonic oscillator coherent states. It says that {\em unknown} single harmonic
oscillator coherent states can not be {\em amplified}. Conversely it says that
{\em known} harmonic oscillator coherent states can be directly amplified
through an universal unitary process. It is also shown that such a formulation
is needed for the consistency of {\em information cloning} proposed by us long
ago.
","[{""version"":""v1"",""created"":""Tue, 25 May 2010 11:44:16 GMT""}]","2010-05-26"
"1005.4543","XiuYi Yang","Xiu-Yi Yang and Tai-Fu Feng","Heavy fermions and two loop electroweak corrections to $b\rightarrow
  s+\gamma$","30 pages,4 figures","JHEP 1005:059, 2010","10.1007/JHEP05(2010)059",,"hep-ph","http://arxiv.org/licenses/nonexclusive-distrib/1.0/","  Applying effective Lagrangian method and on-shell scheme, we analyze the
electroweak corrections to the rare decay $b\rightarrow s+\gamma$ from some
special two loop diagrams in which a closed heavy fermion loop is attached to
the virtual charged gauge bosons or Higgs. At the decoupling limit where the
virtual fermions in inner loop are much heavier than the electroweak scale, we
verify the final results satisfying the decoupling theorem explicitly when the
interactions among Higgs and heavy fermions do not contain the nondecoupling
couplings. Adopting the universal assumptions on the relevant couplings and
mass spectrum of new physics, we find that the relative corrections from those
two loop diagrams to the SM theoretical prediction on the branching ratio of
$B\rightarrow X_{_s}\gamma$ can reach 5% as the energy scale of new physics
$\Lambda_{_{\rm NP}}=200$ GeV.
","[{""version"":""v1"",""created"":""Tue, 25 May 2010 11:49:29 GMT""}]","2014-11-21"
"1005.4544","Thomas Dent","Thomas Dent","Recent variations of fundamental parameters and their implications for
  gravitation","MG12 conference proceedings, space limited to 6 pages",,,,"astro-ph.CO gr-qc","http://arxiv.org/licenses/nonexclusive-distrib/1.0/","  We compare the sensitivity of a recent bound on time variation of the fine
structure constant from optical clocks with bounds on time varying fundamental
constants from atomic clocks sensitive to the electron-to-proton mass ratio,
from radioactive decay rates in meteorites, and from the Oklo natural reactor.
Tests of the Weak Equivalence Principle also lead to comparable bounds on
present time variations of constants, as well as putting the strongest limits
on variations tracking the gravitational potential. For recent time variations,
the ""winner in sensitivity"" depends on possible relations between the
variations of different couplings in the standard model of particle physics.
WEP tests are currently the most sensitive within scenarios with unification of
gauge interactions. A detection of time variation in atomic clocks would favour
dynamical dark energy and put strong constraints on the dynamics of a
cosmological scalar field.
","[{""version"":""v1"",""created"":""Tue, 25 May 2010 11:49:45 GMT""}]","2010-05-26"
"1005.4545","Michael M. Wolf","Michael M. Wolf, David Perez-Garcia","The inverse eigenvalue problem for quantum channels","16 pages",,,,"quant-ph math-ph math.MP math.SP","http://arxiv.org/licenses/nonexclusive-distrib/1.0/","  Given a list of n complex numbers, when can it be the spectrum of a quantum
channel, i.e., a completely positive trace preserving map? We provide an
explicit solution for the n=4 case and show that in general the
characterization of the non-zero part of the spectrum can essentially be given
in terms of its classical counterpart - the non-zero spectrum of a stochastic
matrix. A detailed comparison between the classical and quantum case is given.
We discuss applications of our findings in the analysis of time-series and
correlation functions and provide a general characterization of the peripheral
spectrum, i.e., the set of eigenvalues of modulus one. We show that while the
peripheral eigen-system has the same structure for all Schwarz maps, the
constraints imposed on the rest of the spectrum change immediately if one
departs from complete positivity.
","[{""version"":""v1"",""created"":""Tue, 25 May 2010 11:49:57 GMT""}]","2010-05-27"
"1005.4546","Jens Hornbostel","Jens Hornbostel","Preorientations of the derived motivic multiplicative group","erratum added","Algebr. Geom. Topol. 18 (2018) 1257-1258","10.2140/agt.2018.18.1257 10.2140/agt.2013.13.2667",,"math.KT math.AT","http://arxiv.org/licenses/nonexclusive-distrib/1.0/","  We provide a proof in the language of model categories and symmetric spectra
of Lurie's theorem that topological complex $K$-theory represents orientations
of the derived multiplicative group. Then we generalize this result to the
motivic situation. Along the way, a number of useful model structures and
Quillen adjunctions both in the classical and in the motivic case are
established.
","[{""version"":""v1"",""created"":""Tue, 25 May 2010 11:55:07 GMT""},{""version"":""v2"",""created"":""Wed, 25 May 2011 13:29:58 GMT""},{""version"":""v3"",""created"":""Fri, 17 Nov 2017 08:52:41 GMT""}]","2018-03-16"
"1005.4547","Michael Bebronne","Michael V. Bebronne","Quasi-linear static solutions in massive gravity",,"Phys.Rev.D82:024020,2010","10.1103/PhysRevD.82.024020","ULB-TH/10-17","gr-qc hep-th","http://arxiv.org/licenses/nonexclusive-distrib/1.0/","  The static vacuum spherically symmetric solutions of massive gravity theories
possess two integration constant: the mass M and a scalar charge S. The
presence of this scalar charge reflects the modification of the gravitational
interaction as compared to General Relativity. Surprisingly, these solutions
are non-linear even at large distances from the sources, implying that their
asymptotic behavior is different from that obtained in the linear perturbation
theory. The aim of this paper is to understand how these modified spherically
symmetric solutions emerge from a quasi-linear approximation in order to
generalize them to any arbitrary mass distribution. Along with these modified
solutions, we found a new class of static solutions having a Yukawa shape.
","[{""version"":""v1"",""created"":""Tue, 25 May 2010 11:58:11 GMT""},{""version"":""v2"",""created"":""Thu, 22 Jul 2010 07:39:29 GMT""}]","2014-11-21"
"1005.4548","Richard Moloney","Faruk Gologlu, Gary McGuire, Richard Moloney","Binary Kloosterman sums using Stickelberger's theorem and the
  Gross-Koblitz formula","Minor error corrected in final section",,,,"math.NT","http://arxiv.org/licenses/nonexclusive-distrib/1.0/","  Let $\mathcal{K}(a)$ denote the Kloosterman sum on the finite field of order
$2^n$. We give a simple characterization of $\mathcal{K}(a)$ modulo 16, in
terms of the trace of $a$ and one other function. We also give a
characterization of $\mathcal{K}(a)$ modulo 64 in terms of a different
function, which we call the lifted trace. Our proofs use Fourier analysis,
Stickelberger's theorem and the Gross-Koblitz formula.
","[{""version"":""v1"",""created"":""Tue, 25 May 2010 12:14:40 GMT""},{""version"":""v2"",""created"":""Fri, 28 May 2010 13:31:43 GMT""}]","2010-05-31"
"1005.4549","Deepak Baskaran Dr.","W. Zhao, D. Baskaran, L. P. Grishchuk","Relic gravitational waves in the light of 7-year Wilkinson Microwave
  Anisotropy Probe data and improved prospects for the Planck mission","27 pages, 12 (colour) figures. Published in Phys. Rev. D. V.3:
  modifications made to reflect the published version","Phys.Rev.D82:043003,2010","10.1103/PhysRevD.82.043003",,"gr-qc astro-ph.CO hep-ph hep-th","http://arxiv.org/licenses/nonexclusive-distrib/1.0/","  The new release of data from Wilkinson Microwave Anisotropy Probe improves
the observational status of relic gravitational waves. The 7-year results
enhance the indications of relic gravitational waves in the existing data and
change to the better the prospects of confident detection of relic
gravitational waves by the currently operating Planck satellite. We apply to
WMAP7 data the same methods of analysis that we used earlier [W. Zhao, D.
Baskaran, and L.P. Grishchuk, Phys. Rev. D 80, 083005 (2009)] with WMAP5 data.
We also revised by the same methods our previous analysis of WMAP3 data. It
follows from the examination of consecutive WMAP data releases that the maximum
likelihood value of the quadrupole ratio $R$, which characterizes the amount of
relic gravitational waves, increases up to $R=0.264$, and the interval
separating this value from the point $R=0$ (the hypothesis of no gravitational
waves) increases up to a $2\sigma$ level. The primordial spectra of density
perturbations and gravitational waves remain blue in the relevant interval of
wavelengths, but the spectral indices increase up to $n_s =1.111$ and
$n_t=0.111$. Assuming that the maximum likelihood estimates of the perturbation
parameters that we found from WMAP7 data are the true values of the parameters,
we find that the signal-to-noise ratio $S/N$ for the detection of relic
gravitational waves by the Planck experiment increases up to $S/N=4.04$, even
under pessimistic assumptions with regard to residual foreground contamination
and instrumental noises. We comment on theoretical frameworks that, in the case
of success, will be accepted or decisively rejected by the Planck observations.
","[{""version"":""v1"",""created"":""Tue, 25 May 2010 12:15:55 GMT""},{""version"":""v2"",""created"":""Tue, 29 Jun 2010 08:29:53 GMT""},{""version"":""v3"",""created"":""Thu, 12 Aug 2010 18:32:50 GMT""}]","2015-03-17"
"1005.4550","Yong-Jun Zhang","Yong-Jun Zhang, Bin Zhang","Proton Sea Quark Flavour Asymmetry and Roper Resonance",,,"10.1088/1674-1137/36/3/001",,"hep-ph","http://arxiv.org/licenses/nonexclusive-distrib/1.0/","  We study the proton and the Roper resonance together with the meson cloud
model, by constructing a Hamiltonian matrix and solving the eigenvalue
equation. The proton sea quark flavour asymmetry and some properties of the
Roper resonance are thus reproduced in one scheme.
","[{""version"":""v1"",""created"":""Tue, 25 May 2010 12:32:54 GMT""},{""version"":""v2"",""created"":""Fri, 16 Dec 2011 06:55:19 GMT""}]","2015-05-19"
"1005.4551","Sergei Lukyanets P","Sergei P. Lukyanets, Oleksandr V. Kliushnychenko","Distinguishability of particles and its implications for peculiar mass
  transport in inhomogeneous media","7 pages, 3 figures","Phys. Rev. E 85, 051111 (2010)","10.1103/PhysRevE.82.051111",,"cond-mat.dis-nn","http://arxiv.org/licenses/nonexclusive-distrib/1.0/","  A mass transport directed from low to high density region in an inhomogeneous
medium is modeled as a limiting case of a two-component lattice gas with
excluded volume constraint and one of the components fixed. In the
long-wavelength approximation, density relaxation of mobile particles is
governed by a diffusion process and interaction with a medium inhomogeneity
represented by a static component distribution. It is shown that density
relaxation can be locally accompanied by a density distribution compression. In
quasi one-dimensional case, the compression dynamics manifests itself in a
hopping-like motion of diffusing substance packet front position due to a
staged passing through inhomogeneity barriers and leads to a fragmentation of a
packet and retardation of its spreading. A root-mean-square displacement
reflects only an averaged packet front dynamics and becomes inappropriate as a
transport characteristic in this regime. In a stationary case mass transport
throughout a whole system may be directed from a boundary with low
concentration towards a boundary with that of high one. Implications of the
excluded volume constraint and particles distinguishability for these effects
are discussed.
","[{""version"":""v1"",""created"":""Tue, 25 May 2010 12:37:17 GMT""}]","2012-10-05"
"1005.4552","Josef Urban","Josef Urban, Jesse Alama, Piotr Rudnicki, and Herman Geuvers","A Wiki for Mizar: Motivation, Considerations, and Initial Prototype","To appear in The 9th International Conference on Mathematical
  Knowledge Management: MKM 2010","Intelligent Computer Mathematics 2010, LNCS 6167, pp. 455-469","10.1007/978-3-642-14128-7_38",,"cs.DL","http://arxiv.org/licenses/nonexclusive-distrib/1.0/","  Formal mathematics has so far not taken full advantage of ideas from
collaborative tools such as wikis and distributed version control systems
(DVCS). We argue that the field could profit from such tools, serving both
newcomers and experts alike. We describe a preliminary system for such
collaborative development based on the Git DVCS. We focus, initially, on the
Mizar system and its library of formalized mathematics.
","[{""version"":""v1"",""created"":""Tue, 25 May 2010 12:42:29 GMT""}]","2011-07-27"
"1005.4553","Olivier Bouaziz","Olivier Bouaziz (MAP5), S\'egolen Geffray (IRMA), Olivier Lopez (LSTA)","Semiparametric inference for the recurrent event process by means of a
  single-index model",,,,,"math.ST stat.TH","http://arxiv.org/licenses/nonexclusive-distrib/1.0/","  In this paper, we introduce new parametric and semiparametric regression
techniques for a recurrent event process subject to random right censoring. We
develop models for the cumula- tive mean function and provide asymptotically
normal estimators. Our semiparametric model which relies on a single-index
assumption can be seen as a dimension reduction technique that, contrary to a
fully nonparametric approach, is not stroke by the curse of dimensional- ity
when the number of covariates is high. We discuss data-driven techniques to
choose the parameters involved in the estimation procedures and provide a
simulation study to support our theoretical results.
","[{""version"":""v1"",""created"":""Tue, 25 May 2010 12:44:02 GMT""},{""version"":""v2"",""created"":""Wed, 15 Dec 2010 15:29:09 GMT""},{""version"":""v3"",""created"":""Wed, 17 Sep 2014 06:18:33 GMT""}]","2015-03-17"
"1005.4554","Carlo Ferrigno","C. Ferrigno, E. Bozzo, M. Falanga, L. Stella, S. Campana, T. Belloni,
  G.L. Israel, L. Pavan, E. Kuulkers, A. Papitto","INTEGRAL, Swift, and RXTE observations of the 518 Hz accreting transient
  pulsar Swift J1749.4-2807","Accepted for publication on A&A",,"10.1051/0004-6361/201015033",,"astro-ph.HE","http://arxiv.org/licenses/nonexclusive-distrib/1.0/","  The burst-only Swift J1749.4-2807 source was discovered in a high
X-ray-active state, while during an {INTEGRAL observations of the Galactic
bulge on 2010 April 10. Pulsations at 518 Hz were discovered in the RXTE data,
confirming previous suggestions of possible associations between burst-only
sources and accreting millisecond X-ray pulsars. The subsequent discovery of
X-ray eclipses made Swift J1749.4$-$2807 the first eclipsing accreting
millisecond X-ray pulsar. We obtain additional information on Swift
J1749.4-2807 and other burst-only sources. We report on the results of a
monitoring campaign on the source, carried out for about two weeks with the
Swift, INTEGRAL, and RXTE satellites.
  The observations showed that the X-ray spectrum (energy range 0.5-40 keV) of
Swift J1749.4-2807 during the entire event was accurately modeled by an
absorbed power-law model (N_H~3e2 cm^-2, Gamma~1.7). X-ray eclipses were also
detected in the Swift data and provides a clear evidence of a dust-scattering
halo located along the line of sight to the source. Only one type-I X-ray burst
was observed throughout the two-weeks long monitoring. The X-ray flux of Swift
J1749.4-2807 decayed below the detection threshold of Swift/XRT about 11 days
after the discovery, in a exponential fashion (e-folding time of tau=12^+7_-3
days). We compare the properties of the outburst observed from Swift
J1749.4-2807 with those of the previously known millisecond X-ray pulsars and
other transient low mass X-ray binaries.
","[{""version"":""v1"",""created"":""Tue, 25 May 2010 12:46:08 GMT""},{""version"":""v2"",""created"":""Thu, 14 Oct 2010 09:56:00 GMT""}]","2015-05-19"
"1005.4555","Pankaj Jha","Pankaj K. Jha and Yuri V. Rostovtsev","Analytical solutions for a two-level system driven by a class of chirped
  pulses","5 pages, 5 figures","Phys. Rev. A 82, 015801 (2010)","10.1103/PhysRevA.82.015801",,"quant-ph","http://arxiv.org/licenses/nonexclusive-distrib/1.0/","  We present analytical solutions for the problem of a two-level atom driven by
a class of chirped pulses. The solutions are given in terms of Heun functions.
Using appropriate chirping parameters an enhancement of four-orders of
magnitudes in the population transfer is obtained.
","[{""version"":""v1"",""created"":""Tue, 25 May 2010 12:47:47 GMT""}]","2010-07-23"
"1005.4556","Sander Dommers","Sander Dommers, Cristian Giardin\`a and Remco van der Hofstad","Ising models on power-law random graphs",,"Journal of Statistical Physics, 141(4):638-660, (2010)","10.1007/s10955-010-0067-9",,"math.PR cond-mat.stat-mech math-ph math.MP","http://arxiv.org/licenses/nonexclusive-distrib/1.0/","  We study a ferromagnetic Ising model on random graphs with a power-law degree
distribution and compute the thermodynamic limit of the pressure when the mean
degree is finite (degree exponent $\tau>2$), for which the random graph has a
tree-like structure. For this, we adapt and simplify an analysis by Dembo and
Montanari, which assumes finite variance degrees ($\tau>3$). We further
identify the thermodynamic limits of various physical quantities, such as the
magnetization and the internal energy.
","[{""version"":""v1"",""created"":""Tue, 25 May 2010 12:49:43 GMT""},{""version"":""v2"",""created"":""Tue, 12 Oct 2010 12:59:47 GMT""}]","2011-07-01"
