"1005.4420","Anthony R.  Dobrovolskis","Anthony R. Dobrovolskis, Jose' Luis Alvarellos, Kevin J. Zahnle, and
  Jack J. Lissauer","Exchange of ejecta between Telesto and Calypso: Tadpoles, horseshoes,
  and passing orbits",,,"10.1016/j.icarus.2010.06.023",,"astro-ph.EP","http://arxiv.org/licenses/nonexclusive-distrib/1.0/","  We have numerically integrated the orbits of ejecta from Telesto and Calypso,
the two small Trojan companions of Saturn's major satellite Tethys. Ejecta were
launched with speeds comparable to or exceeding their parent's escape velocity,
consistent with impacts into regolith surfaces. We find that the fates of
ejecta fall into several distinct categories, depending on both the speed and
direction of launch.
  The slowest ejecta follow sub-orbital trajectories and re-impact their source
moon in less than one day. Slightly faster debris barely escape their parent's
Hill sphere and are confined to tadpole orbits, librating about Tethys'
triangular Lagrange points L4 (leading, near Telesto) or L5 (trailing, near
Calypso) with nearly the same orbital semi-major axis as Tethys, Telesto, and
Calypso. These ejecta too eventually re-impact their source moon, but with a
median lifetime of a few dozen years. Those which re-impact within the first
ten years or so have lifetimes near integer multiples of 348.6 days (half the
tadpole period).
  Still faster debris with azimuthal velocity components >~ 10 m/s enter
horseshoe orbits which enclose both L4 and L5 as well as L3, but which avoid
Tethys and its Hill sphere. These ejecta impact either Telesto or Calypso at
comparable rates, with median lifetimes of several thousand years. However,
they cannot reach Tethys itself; only the fastest ejecta, with azimuthal
velocities >~ 40 m/s, achieve ""passing orbits"" which are able to encounter
Tethys. Tethys accretes most of these ejecta within several years, but some 1 %
of them are scattered either inward to hit Enceladus or outward to strike
Dione, over timescales on the order of a few hundred years.
","[{""version"":""v1"",""created"":""Mon, 24 May 2010 20:12:53 GMT""}]","2015-05-19"
"1005.4421","Christopher Howls Dr","C.J. Howls","Exponential asymptotics and boundary value problems: keeping both sides
  happy at all orders",,,"10.1098/rspa.2010.0096",,"math.CA","http://arxiv.org/licenses/nonexclusive-distrib/1.0/","  We introduce templates for exponential asymptotic expansions that, in
contrast to matched asymptotic approaches, enable the simultaneous satisfaction
of both boundary values in classes of linear and nonlinear equations that are
singularly perturbed with an asymptotic parameter epsilon \to 0+ and have a
single boundary layer at one end of the interval. For linear equations, the
template is a transseries that takes the form of a sliding ladder of
exponential scales. For nonlinear equations, the transseries template is a
two-dimensional array of exponential scales that tilts and realigns asymptotic
balances as the interval is traversed. An exponential asymptotic approach also
reveals how boundary value problems force the surprising presence of
transseries in the linear case and negative powers of epsilon terms in the
series beyond all orders in the nonlinear case. We also demonstrate how these
transseries can be resummed to generate multiple-scales-type approximations
that can generate uniformly better approximations to the exact solution out to
larger values of the perturbation parameter. Finally we show for a specific
example how a reordering of the terms in the exponential asymptotics can lead
to an acceleration of the accuracy of a truncated expansion.
","[{""version"":""v1"",""created"":""Mon, 24 May 2010 20:17:08 GMT""}]","2015-05-19"
"1005.4422","Stefania Salvadori","S. Salvadori (1), P. Dayal (2), A. Ferrara (3) ((1) Kapteyn
  Astronomical Institute, Groningen, The Netherlands (2) SISSA/ISAS, Trieste,
  Italy (3) Scuola Normale Superiore, Pisa, Italy)","High redshift Lya emitters: clues on the Milky Way infancy","Accepted for publication in MNRAS letter",,"10.1111/j.1745-3933.2010.00880.x",,"astro-ph.CO","http://arxiv.org/licenses/nonexclusive-distrib/1.0/","  With the aim of determining if Milky Way (MW) progenitors could be identified
as high redshift Lyman Alpha Emitters (LAEs) we have derived the intrinsic
properties of z ~ 5.7 MW progenitors, which are then used to compute their
observed Lyman-alpha luminosity, L_alpha, and equivalent width, EW. MW
progenitors visible as LAEs are selected according to the canonical
observational criterion, L_alpha > 10^42 erg/s and EW > 20 A. Progenitors of
MW-like galaxies have L_alpha = 10^(39-43.25) erg/s, making some of them
visible as LAEs. In any single MW merger tree realization, typically only 1
(out of ~ 50) progenitor meets the LAE selection criterion, but the probability
to have at least one LAE is very high, P = 68%. The identified LAE stars have
ages, t_* ~ 150-400 Myr at z ~ 5.7 with the exception of five small progenitors
with t_* < 5 Myr and large EW = 60-130 A. LAE MW progenitors provide > 10% of
the halo very metal-poor stars [Fe/H] < -2, thus establishing a potentially
fruitful link between high-z galaxies and the Local Universe.
","[{""version"":""v1"",""created"":""Mon, 24 May 2010 20:17:16 GMT""}]","2015-05-19"
"1005.4423","Carl R. Brune","Carl R. Brune","R-matrix Methods with an application to 12C(alpha,gamma)16O","7 pages. Published in the Proceedings of the Fifth European Summer
  School on Experimental Nuclear Astrophysics, Santa Tecla, Sicily, Italy,
  20-27 September 2009, Editors Claudio Spitaleri, Claus Rolfs, and Rosario
  Gianluca Pizzone, AIP Conference Proceedings number 1213 (AIP, New York,
  2010), pp. 35-41",,"10.1063/1.3362603",,"nucl-th nucl-ex","http://arxiv.org/licenses/nonexclusive-distrib/1.0/","  We review some aspects of R-matrix theory and its application to the
semi-empirical analysis of nuclear reactions. Important applications for
nuclear astrophysics and recent results for the ${}^{12}{\rm
C}(\alpha,\gamma){}^{16}{\rm O}$ reaction are emphasized.
","[{""version"":""v1"",""created"":""Mon, 24 May 2010 20:22:36 GMT""}]","2015-05-19"
"1005.4424","Jianguang Guo","Jianguang Guo, Timo Budarz, Joshua M. Ward, and Earl W. Prohofsky","The dynamical transition in proteins and non-Gaussian behavior of low
  frequency modes in Self Consistent Normal Mode Analysis","17 pages, 6 figures, 1 table",,"10.1103/PhysRevE.82.041917",,"physics.bio-ph","http://arxiv.org/licenses/nonexclusive-distrib/1.0/","  Self Consistent Normal Mode Analysis (SCNMA) is applied to heme c type
cytochrome f to study temperature dependent protein motion. Classical Normal
Mode Analysis (NMA) assumes harmonic behavior and the protein Mean Square
Displacement (MSD) has a linear dependence on temperature. This is only
consistent with low temperature experimental results. To connect the protein
vibrational motions between low temperature and physiological temperature, we
have incorporated a fitted set of anharmonic potentials into SCNMA. In
addition, Quantum Harmonic Oscillator (QHO) theory has been used to calculate
the displacement distribution for individual vibrational modes. We find that
the modes involving soft bonds exhibit significant non-Gaussian dynamics at
physiological temperature, which suggests it may be the cause of the
non-Gaussian behavior of the protein motions probed by Elastic Incoherent
Neutron Scattering (EINS). The combined theory displays a dynamical transition
caused by the softening of few ""torsional"" modes in the low frequency regime (<
50cm-1or < 6meVor > 0.6ps). These modes change from Gaussian to a classical
distribution upon heating. Our theory provides an alternative way to understand
the microscopic origin of the protein dynamical transition.
","[{""version"":""v1"",""created"":""Mon, 24 May 2010 20:30:09 GMT""},{""version"":""v2"",""created"":""Wed, 26 May 2010 14:47:47 GMT""}]","2013-05-29"
"1005.4425","Youness Lamzouri","Youness Lamzouri","Extreme values of $\arg L(1,\chi)$","20 pages. To appear in Acta Arithmetica",,,,"math.NT","http://arxiv.org/licenses/nonexclusive-distrib/1.0/","  In this paper we study the distribution of extreme values of $\arg
L(1,\chi)$, as $\chi$ varies over primitive characters modulo a large prime
$q$.
","[{""version"":""v1"",""created"":""Mon, 24 May 2010 20:34:40 GMT""}]","2010-05-26"
"1005.4426","Lillian Pierce","Lillian B. Pierce","A note on twisted discrete singular Radon transforms",,,,,"math.CA","http://arxiv.org/licenses/nonexclusive-distrib/1.0/","  In this paper we consider three types of discrete operators stemming from
singular Radon transforms. We first extend an $\ell^p$ result for translation
invariant discrete singular Radon transforms to a class of twisted operators
including an additional oscillatory component, via a simple method of descent
argument. Second, we note an $\ell^2$ bound for quasi-translation invariant
discrete twisted Radon transforms. Finally, we extend an existing $\ell^2$
bound for a closely related non-translation invariant discrete oscillatory
integral operator with singular kernel to an $\ell^p$ bound for all $1< p<
\infty$. This requires an intricate induction argument involving layers of
decompositions of the operator according to the Diophantine properties of the
coefficients of its polynomial phase function.
","[{""version"":""v1"",""created"":""Mon, 24 May 2010 20:39:34 GMT""}]","2010-05-26"
"1005.4427","Daniel Levcovitz","Napoleon Caro (ICMC, USP, Brazil) and Daniel Levcovitz (ICMC, USP,
  Brazil)","On a theorem of Stafford","7 pages",,,"Notas do ICMC. S\'erie matem\'atica 327","math.RA","http://arxiv.org/licenses/nonexclusive-distrib/1.0/","  Stafford proved that every left or right ideal of the Weyl algebra A_n(K) is
generated by two elements. In this paper we prove that every left or right
ideal of the ring of differential operators over the field of formal Laurent
series K((x_1,...,x_n)) is also generated by two elements. The same is true for
the ring of differential operators over the convergent Laurent series
C{{x_1,...,x_n}}. This is in accordance with the conjecture that says that in a
(noncommutative) noetherian simple ring, every left or right ideal is generated
by two elements.
","[{""version"":""v1"",""created"":""Mon, 24 May 2010 20:40:08 GMT""}]","2010-05-26"
"1005.4428","Lucio Robledo","Lucio Robledo, Hannes Bernien, Ilse van Weperen and Ronald Hanson","Control and coherence of the optical transition of single defect centers
  in diamond","5 pages,4 figures","Phys. Rev. Lett. 105, 177403 (2010)","10.1103/PhysRevLett.105.177403",,"quant-ph cond-mat.mes-hall","http://arxiv.org/licenses/nonexclusive-distrib/1.0/","  We demonstrate coherent control of the optical transition of single
Nitrogen-Vacancy defect centers in diamond. On applying short resonant laser
pulses, we observe optical Rabi oscillations with a half-period as short as 1
nanosecond, an order of magnitude shorter than the spontaneous emission time.
By studying the decay of Rabi oscillations, we find that the decoherence is
dominated by laser-induced spectral jumps. By using a low-power probe pulse as
a detuning sensor and applying post-selection, we demonstrate that spectral
diffusion can be overcome in this system to generate coherent photons.
","[{""version"":""v1"",""created"":""Mon, 24 May 2010 20:44:45 GMT""}]","2010-10-26"
"1005.4429","Anna Pachol","Andrzej Borowiec, Anna Pacho{\l}","$\kappa$-Minkowski Spacetimes and DSR Algebras: Fresh Look and Old
  Problems",,"SIGMA 6:086,2010","10.3842/SIGMA.2010.086",,"math-ph hep-th math.MP","http://creativecommons.org/licenses/by-nc-sa/3.0/","  Some classes of Deformed Special Relativity (DSR) theories are reconsidered
within the Hopf algebraic formulation. For this purpose we shall explore a
minimal framework of deformed Weyl-Heisenberg algebras provided by a smash
product construction of DSR algebra. It is proved that this DSR algebra, which
uniquely unifies $\kappa$-Minkowski spacetime coordinates with Poincar\'e
generators, can be obtained by nonlinear change of generators from undeformed
one. Its various realizations in terms of the standard (undeformed)
Weyl-Heisenberg algebra opens the way for quantum mechanical interpretation of
DSR theories in terms of relativistic (St\""uckelberg version) Quantum
Mechanics. On this basis we review some recent results concerning twist
realization of $\kappa$-Minkowski spacetime described as a quantum covariant
algebra determining a deformation quantization of the corresponding linear
Poisson structure. Formal and conceptual issues concerning quantum
$\kappa$-Poincar\'e and $\kappa$-Minkowski algebras as well as DSR theories are
discussed. Particularly, the so-called ""$q$-analog"" version of DSR algebra is
introduced. Is deformed special relativity quantization of doubly special
relativity remains an open question. Finally, possible physical applications of
DSR algebra to description of some aspects of Planck scale physics are shortly
recalled.
","[{""version"":""v1"",""created"":""Mon, 24 May 2010 20:56:17 GMT""},{""version"":""v2"",""created"":""Wed, 20 Oct 2010 05:18:03 GMT""}]","2010-10-27"
"1005.4430","Kathryn V. Johnston","Erika T. Hamden, Christine M. Simpson, Kathryn V. Johnston and Duane
  M. Lee","Measuring Transverse Motions for Nearby Galaxy Clusters","Accepted for publication in ApJ Letters",,"10.1088/2041-8205/716/2/L205",,"astro-ph.CO astro-ph.GA","http://arxiv.org/licenses/nonexclusive-distrib/1.0/","  Measuring the full three-dimensional motions of extra-galactic objects in the
Universe presents a seemingly insurmountable challenge. In this paper we
investigate the application of a technique to measure tangential motion that
has previously only been applied nearby within the Local Group of galaxies, to
clusters of galaxies far beyond its borders. We show that mapping the mean
line-of-sight motion throughout a galaxy cluster could in principle be used to
detect the ""perspective rotation"" induced by the projection of the cluster's
tangential motion into the line-of-sight. The signal will be most prominent for
clusters of the largest angular extent, most symmetric intrinsic velocity
distribution and surveyed with the largest number of pointings possible. We
investigate the feasibility of detecting this signal using three different
approaches: measuring line-of-sight motions of individual cluster members;
taking spectra of intracluster gas; and mapping distortions of the Cosmic
Microwave Background radiation. We conclude that future spectroscopic surveys
of 1000's of members of nearby galaxy clusters hold the most promise of
measuring cluster tangential motions using this technique.
","[{""version"":""v1"",""created"":""Mon, 24 May 2010 21:00:57 GMT""}]","2015-05-19"
"1005.4431","Alessandro Gaz","Alessandro Gaz","CKM angles and sides from BaBar","4 pages, 2 figures, contributed to the Lake Louise Winter Institute
  2010",,,,"hep-ex","http://arxiv.org/licenses/nonexclusive-distrib/1.0/","  The CKM paradigm has been proven to be successful in explaining the flavour
structure of the standard model and the non-trivial imaginary phase of the CKM
matrix is the only know source of CP-violation. B-meson decays allow us to
precisely determine the fundamental parameters of the CKM matrix and put
stringent constraints on the models of New Physics. I present some of the most
recent measurements related to the CKM Unitarity Triangle performed by the
BaBar experiment, located at the SLAC National Accelerator Laboratory. Most
results are based on the final BaBar dataset, consisting of 467 M BB pairs.
","[{""version"":""v1"",""created"":""Mon, 24 May 2010 21:04:16 GMT""}]","2010-05-26"
"1005.4432","Roopesh Ojha","Roopesh Ojha, Matthias Kadler, Moritz B\""ock, Roy Booth, M. S. Dutka,
  P. G. Edwards, A. L. Fey, L. Fuhrmann, R. A. Gaume, H. Hase, S. Horiuchi, D.
  L. Jauncey, K. J. Johnston, U. Katz, M. Lister, J. E. J. Lovell, C. M\""uller,
  C. Pl\""otz, J. F. H. Quick, E. Ros, G. B. Taylor, D. J. Thompson, S. J.
  Tingay, G. Tosti, A. K. Tzioumis, J. Wilms and J. A. Zensus","TANAMI: Tracking Active Galactic Nuclei with Austral Milliarcsecond
  Interferometry I. First-Epoch 8.4 GHz Images","35 pages, 18 figures",,"10.1051/0004-6361/200912724",,"astro-ph.CO astro-ph.HE","http://arxiv.org/licenses/nonexclusive-distrib/1.0/","  We introduce the TANAMI program (Tracking Active Galactic Nuclei with Austral
Milliarcsecond Interferometry) which is monitoring an initial sample of 43
extragalactic jets located south of -30 degrees declination at 8.4 GHz and 22
GHz since 2007. All aspects of the program are discussed. First epoch results
at 8.4 GHz are presented along with physical parameters derived therefrom. We
present first epoch images for 43 sources, some observed for the first time at
milliarcsecond resolution. Parameters of these images as well as physical
parameters derived from them are also presented and discussed. These and
subsequent images from the TANAMI survey are available at
http://pulsar.sternwarte.uni-erlangen.de/tanami/ We obtain reliable, high
dynamic range images of the southern hemisphere AGN. All the quasars and BL Lac
objects in the sample have a single-sided radio morphology. Galaxies are either
double-sided, single-sided or irregular. About 28% of the TANAMI sample has
been detected by LAT during its first three months of operations. Initial
analysis suggests that when galaxies are excluded, sources detected by LAT have
larger opening angles than those not detected by LAT. Brightness temperatures
of LAT detections and non-detections seem to have similar distributions. The
redshift distributions of the TANAMI sample and sub-samples are similar to
those seen for the bright gamma-ray AGN seen by LAT and EGRET but none of the
sources with a redshift above 1.8 have been detected by LAT.
","[{""version"":""v1"",""created"":""Mon, 24 May 2010 21:07:04 GMT""}]","2015-05-19"
"1005.4433","Michael Gutperle","Marco Chiodaroli, Michael Gutperle, Ling-Yan Hung","Boundary entropy of supersymmetric Janus solutions","35 pages, pdf-LaTeX, 5 figures, v2: minor changes, typos corrected,
  reference added","JHEP 1009:082,2010","10.1007/JHEP09(2010)082",,"hep-th","http://arxiv.org/licenses/nonexclusive-distrib/1.0/","  In this paper we compute the holographic boundary entropy for half-BPS Janus
deformations of the $AdS_3\times S^3\times T^4$ vacuum of type IIB
supergravity. Previous work \cite{Chiodaroli:2009yw} has shown that there are
two independent deformations of this sort. In one case, the six-dimensional
dilaton jumps across the interface, while the other case displays a jump of
axion and four-form potential. In case of a jump of the six-dimensional
dilaton, it is possible to compare the holographic result with the
weak-coupling result for a two-dimensional interface CFT where the radii of the
compactified bosons jump across the interface. We find exact agreement between
holographic and CFT results. This is to be contrasted with the holographic
calculation for the non-supersymmetric Janus solution, which agrees with the
CFT result only at the leading order in the jump parameter. We also examine the
implications of the holographic calculation in case of a solution with a jump
in the axion, which can be associated with a deformation of the CFT by the
$Z_2$-orbifold twist operator.
","[{""version"":""v1"",""created"":""Mon, 24 May 2010 21:07:38 GMT""},{""version"":""v2"",""created"":""Sat, 19 Jun 2010 20:45:43 GMT""}]","2014-11-21"
"1005.4434","Daniele Rosso","Daniele Rosso","Classic and mirabolic Robinson-Schensted-Knuth correspondence for
  partial flags","27 pages, slightly rewritten to combine two papers into one and
  clarify some sections","Canad. J. Math. 64 (2012), no. 5, 1090-1121","10.4153/CJM-2011-071-7",,"math.AG math.CO","http://arxiv.org/licenses/nonexclusive-distrib/1.0/","  In this paper we first generalize to the case of partial flags a result
proved both by Spaltenstein and by Steinberg that relates the relative position
of two complete flags and the irreducible components of the flag variety in
which they lie, using the Robinson-Schensted-Knuth correspondence. Then we use
this result to generalize the mirabolic Robinson-Schensted-Knuth correspondence
defined by Travkin, to the case of two partial flags and a line.
","[{""version"":""v1"",""created"":""Mon, 24 May 2010 21:11:45 GMT""},{""version"":""v2"",""created"":""Thu, 16 Jun 2011 14:54:07 GMT""}]","2013-10-16"
"1005.4435","Prudence Heck","Prudence Heck","Twisted homology cobordism invariants of knots in aspherical manifolds",,,,,"math.GT","http://arxiv.org/licenses/nonexclusive-distrib/1.0/","  We fix a null-homologous, homotopically essential knot $J$ in a 3-manifold
with PTFA fundamental group and study concordance of knots that are homotopic
to $J$. We construct an infinite family of knots that are characteristic to
$J$, and then use $L^2$-methods to show that they are not concordant to $J$.
","[{""version"":""v1"",""created"":""Mon, 24 May 2010 21:12:52 GMT""}]","2010-05-26"
"1005.4436","Matthew Stover","Matthew Stover","Volumes of Picard modular surfaces","To appear in Proceedings of the AMS",,,,"math.GT","http://arxiv.org/licenses/nonexclusive-distrib/1.0/","  We show that the conjectural cusped complex hyperbolic 2-orbifolds of minimal
volume are the two smallest arithmetic complex hyperbolic 2-orbifolds. We then
show that every arithmetic cusped complex hyperbolic 2-manifold of minimal
volume covers one of these two orbifolds. We also give all minimal volume
manifolds that simultaneously cover both minimal orbifolds.
","[{""version"":""v1"",""created"":""Mon, 24 May 2010 21:27:27 GMT""},{""version"":""v2"",""created"":""Wed, 2 Feb 2011 18:17:15 GMT""}]","2011-02-03"
"1005.4437","David Loeffler","Richard Hill and David Loeffler","Emerton's Jacquet functors for non-Borel parabolic subgroups","25 pages","Documenta Math. 16 (2011), 1--31",,,"math.NT math.RT","http://arxiv.org/licenses/nonexclusive-distrib/1.0/","  This paper studies Emerton's Jacquet module functor for locally analytic
representations of p-adic reductive groups. When P is a parabolic subgroup
whose Levi factor M is not commutative, we show that passing to an isotypical
subspace for the derived subgroup of M gives rise to essentially admissible
locally analytic representations of the torus Z(M), which have a natural
interpretation in terms of rigid geometry. We use this to extend Emerton's
representation-theoretic construction of eigenvarieties by constructing
eigenvarieties interpolating automorphic representations whose local components
at p are not necessarily principal series.
","[{""version"":""v1"",""created"":""Mon, 24 May 2010 21:27:44 GMT""}]","2011-08-30"
"1005.4438","Martin Hairer","Martin Hairer and Jochen Voss","Approximations to the Stochastic Burgers Equation",,,"10.1007/s00332-011-9104-3",,"math.PR math.NA","http://arxiv.org/licenses/nonexclusive-distrib/1.0/","  This article is devoted to the numerical study of various finite difference
approximations to the stochastic Burgers equation. Of particular interest in
the one-dimensional case is the situation where the driving noise is white both
in space and in time. We demonstrate that in this case, different finite
difference schemes converge to different limiting processes as the mesh size
tends to zero. A theoretical explanation of this phenomenon is given and we
formulate a number of conjectures for more general classes of equations,
supported by numerical evidence.
","[{""version"":""v1"",""created"":""Mon, 24 May 2010 21:32:30 GMT""}]","2013-09-20"
"1005.4439","Jose Barbon","Jose L. F. Barbon and Javier Martinez-Magan","Spontaneous fragmentation of topological black holes","19 pages, 4 figures","JHEP 1008:031,2010","10.1007/JHEP08(2010)031","IFT UAM/CSIC-10-27","hep-th","http://arxiv.org/licenses/nonexclusive-distrib/1.0/","  We study the metastability of Anti-de Sitter topological black holes with
compact hyperbolic horizons. We focus on the five-dimensional case, an AdS/CFT
dual to thermal states in the maximally supersymmetric large-N Yang-Mills
theory, quantized on a three-dimensional compact hyperboloid. We estimate the
various rates for quantum-statistical D3-brane emission, using WKB methods in
the probe-brane approximation, including thermal tunneling and Schwinger pair
production. The topological black holes are found to be metastable at high
temperature. At low temperatures, D-branes are emitted without exponential
suppression in superradiant modes, producing an instability in qualitative
agreement with expectations from weakly-coupled gauge dynamics.
","[{""version"":""v1"",""created"":""Mon, 24 May 2010 21:32:41 GMT""}]","2014-11-21"
