"1005.4365","Arkadiusz Wojs","Arkadiusz Wojs, Csaba Toke, and Jainendra K. Jain","Landau level mixing and the emergence of Pfaffian excitations for the
  5/2 fractional quantum Hall effect","4 pages, 5 figures","Phys. Rev. Lett. 105, 096802 (2010)","10.1103/PhysRevLett.105.096802",,"cond-mat.str-el","http://arxiv.org/licenses/nonexclusive-distrib/1.0/","  We report on exact diagonalization studies for fully spin polarized 5/2
fractional quantum Hall effect, incorporating Landau level mixing through the
Bishara-Nayak effective interaction. We find that there is an experimentally
accessible region in the phase diagram where the Pfaffian model accurately
describes not only the ground state but also the neutral and charged
excitations. These results are consistent with the observed persistence of the
5/2 Hall effect down to very low magnetic fields; they are also relevant to the
experimental attempts to detect nonabelian braid statistics.
","[{""version"":""v1"",""created"":""Mon, 24 May 2010 16:00:36 GMT""}]","2015-05-19"
"1005.4366","Abdelmalek Abdesselam","Abdelmalek Abdesselam","The Ground State Energy of The Massless Spin-Boson Model","32 pages, 4 figures, a remark and references added, typos corrected,
  minor computational errors corrected","Annales Henri Poincare 12:1321-1347,2011","10.1007/s00023-011-0103-6",,"math-ph cond-mat.other math.MP math.PR quant-ph","http://arxiv.org/licenses/nonexclusive-distrib/1.0/","  We provide an explicit combinatorial expansion for the ground state energy of
the massless spin-Boson model as a power series in the coupling parameter. Our
method uses the technique of cluster expansion in constructive quantum field
theory and takes as a starting point the functional integral representation and
its reduction to an Ising model on the real line with long range interactions.
We prove the analyticity of our expansion and provide an explicit lower bound
on the radius of convergence. We do not need multiscale nor renormalization
group analysis. A connection to the loop-erased random walk is indicated.
","[{""version"":""v1"",""created"":""Mon, 24 May 2010 16:01:51 GMT""},{""version"":""v2"",""created"":""Tue, 15 Jun 2010 20:47:44 GMT""}]","2011-10-10"
"1005.4367","N. E. J. Bjerrum-Bohr","N. E. J. Bjerrum-Bohr, Poul H. Damgaard, Bo Feng and Thomas
  Sondergaard","Gravity and Yang-Mills Amplitude Relations","4 pages, REVTeX, minor typos corrected and references added.
  Published version","Phys.Rev.D82:107702,2010","10.1103/PhysRevD.82.107702",,"hep-th","http://arxiv.org/licenses/nonexclusive-distrib/1.0/","  Using only general features of the S-matrix and quantum field theory, we
prove by induction the Kawai-Lewellen-Tye relations that link products of gauge
theory amplitudes to gravity amplitudes at tree level. As a bonus of our
analysis, we provide a novel and more symmetric form of these relations. We
also establish an infinite tower of new identities between amplitudes in gauge
theories.
","[{""version"":""v1"",""created"":""Mon, 24 May 2010 16:02:29 GMT""},{""version"":""v2"",""created"":""Fri, 29 Oct 2010 11:45:32 GMT""}]","2010-12-13"
"1005.4368","Hao Pan","Hao Pan","On a conjecture of Sun","This is a very preliminary draft",,,,"math.NT","http://arxiv.org/licenses/nonexclusive-distrib/1.0/","  We confirm a conjecture of Sun on the expansions of $n(m^k-1)/(m-1)$ in base
$m$.
","[{""version"":""v1"",""created"":""Mon, 24 May 2010 16:04:10 GMT""},{""version"":""v2"",""created"":""Tue, 25 May 2010 02:57:15 GMT""}]","2010-05-26"
"1005.4369","Keun Su Kim","Keun Su Kim, Sung Chul Jung, Myung Ho Kang, and Han Woong Yeom","Nearly Massless Electrons in the Silicon Interface with a Metal Film","4 pages, 4 figures, accepted for publication in Physical Review
  Letters","Phys. Rev. Lett. 104, 246803 (2010)","10.1103/PhysRevLett.104.246803",,"cond-mat.mtrl-sci","http://arxiv.org/licenses/nonexclusive-distrib/1.0/","  We demonstrate the realization of nearly massless electrons in the most
widely used device material, silicon, at the interface with a metal film. Using
angle-resolved photoemission, we found that the surface band of a monolayer
lead film drives a hole band of the Si inversion layer formed at the interface
with the film to have nearly linear dispersion with an effective mass about 20
times lighter than bulk Si and comparable to graphene. The reduction of mass
can be accounted for by repulsive interaction between neighboring bands of the
metal film and Si substrate. Our result suggests a promising way to take
advantage of massless carriers in silicon-based thin-film devices, which can
also be applied for various other semiconductor devices.
","[{""version"":""v1"",""created"":""Mon, 24 May 2010 16:10:54 GMT""}]","2011-08-22"
"1005.4370","Jose  Pelaez R.","A. Gomez Nicola, J.R. Pelaez and J. Ruiz de Elvira, (U. Complutense de
  Madrid)","Non-factorization of four-quark condensates at low energies within
  Chiral Perturbation Theory","12 pages, one figure, version accepted in Phys. Rev. D. New appendix
  with technical details and further comments and references added throughout
  the text","Phys.Rev.D82:074012,2010","10.1103/PhysRevD.82.074012",,"hep-ph","http://arxiv.org/licenses/nonexclusive-distrib/1.0/","  Four-quark correlators and the factorization hypothesis are analyzed in the
meson sector within Chiral Perturbation Theory. Factorization of the four-quark
condensate holds to leading and next to leading order. However at next to next
to leading order, a term with a nontrivial space-time dependence in the
four-quark correlator yields a divergent four-quark condensate, whereas the
two-quark condensate and the scalar susceptibility are finite. Such a
non-factorization term vanishes only in the chiral limit. We also comment on
how factorization still holds in the large $N_c$ limit, provided such a limit
is taken before renormalization.
","[{""version"":""v1"",""created"":""Mon, 24 May 2010 16:11:08 GMT""},{""version"":""v2"",""created"":""Tue, 21 Sep 2010 16:17:10 GMT""}]","2010-10-27"
"1005.4371","Gelu M. Nita","Gelu M. Nita and Dale E. Gary","The Generalized Spectral Kurtosis Estimator","5 pages, 2 figures, MNRAS Letters accepted",,"10.1111/j.1745-3933.2010.00882.x",,"astro-ph.IM","http://arxiv.org/licenses/nonexclusive-distrib/1.0/","  Due to its conceptual simplicity and its proven effectiveness in real-time
detection and removal of radio frequency interference (RFI) from radio
astronomy data, the Spectral Kurtosis (SK) estimator is likely to become a
standard tool of a new generation of radio telescopes. However, the SK
estimator in its original form must be developed from instantaneous power
spectral density (PSD) estimates, and hence cannot be employed as an RFI
excision tool downstream of the data pipeline in existing instruments where any
time averaging is performed. In this letter, we develop a generalized estimator
with wider applicability for both instantaneous and averaged spectral data,
which extends its practical use to a much larger pool of radio instruments.
","[{""version"":""v1"",""created"":""Mon, 24 May 2010 16:29:31 GMT""}]","2015-05-19"
"1005.4372","Thomas Langley","Thomas Langley, Jeffrey Liese, and Jeffrey Remmel","Generating functions for Wilf equivalence under generalized factor order","23 pages",,,,"math.CO","http://arxiv.org/licenses/nonexclusive-distrib/1.0/","  Kitaev, Liese, Remmel, and Sagan recently defined generalized factor order on
words comprised of letters from a partially ordered set $(P, \leq_P)$ by
setting $u \leq_P w$ if there is a subword $v$ of $w$ of the same length as $u$
such that the $i$-th character of $v$ is greater than or equal to the $i$-th
character of $u$ for all $i$. This subword $v$ is called an embedding of $u$
into $w$. For the case where $P$ is the positive integers with the usual
ordering, they defined the weight of a word $w = w_1\ldots w_n$ to be
$\text{wt}(w) = x^{\sum_{i=1}^n w_i} t^{n}$, and the corresponding weight
generating function $F(u;t,x) = \sum_{w \geq_P u} \text{wt}(w)$. They then
defined two words $u$ and $v$ to be Wilf equivalent, denoted $u \backsim v$, if
and only if $F(u;t,x) = F(v;t,x)$. They also defined the related generating
function $S(u;t,x) = \sum_{w \in \mathcal{S}(u)} \text{wt}(w)$ where
$\mathcal{S}(u)$ is the set of all words $w$ such that the only embedding of
$u$ into $w$ is a suffix of $w$, and showed that $u \backsim v$ if and only if
$S(u;t,x) = S(v;t,x)$. We continue this study by giving an explicit formula for
$S(u;t,x)$ if $u$ factors into a weakly increasing word followed by a weakly
decreasing word. We use this formula as an aid to classify Wilf equivalence for
all words of length 3. We also show that coefficients of related generating
functions are well-known sequences in several special cases. Finally, we
discuss a conjecture that if $u \backsim v$ then $u$ and $v$ must be
rearrangements, and the stronger conjecture that there also must be a
weight-preserving bijection $f: \mathcal{S}(u) \rightarrow \mathcal{S}(v)$ such
that $f(u)$ is a rearrangement of $u$ for all $u$.
","[{""version"":""v1"",""created"":""Mon, 24 May 2010 16:31:36 GMT""}]","2010-05-25"
"1005.4373","Achill Sch\""urmann","Renaud Coulangeon and Achill Sch\""urmann","Energy minimization, periodic sets and spherical designs","16 pages; incorporated referee comments","International Mathematics Research Notices, vol. 2011, No. 4,
  829-848","10.1093/imrn/rnr048",,"math.MG math-ph math.MP math.NT","http://arxiv.org/licenses/nonexclusive-distrib/1.0/","  We study energy minimization for pair potentials among periodic sets in
Euclidean spaces. We derive some sufficient conditions under which a point
lattice locally minimizes the energy associated to a large class of potential
functions. This allows in particular to prove a local version of Cohn and
Kumar's conjecture that $\mathsf{A}_2$, $\mathsf{D}_4$, $\mathsf{E}_8$ and the
Leech lattice are globally universally optimal, regarding energy minimization,
and among periodic sets of fixed point density.
","[{""version"":""v1"",""created"":""Mon, 24 May 2010 16:40:19 GMT""},{""version"":""v2"",""created"":""Wed, 2 Feb 2011 20:36:10 GMT""}]","2014-06-23"
"1005.4374","Nina Golyandina E.","Nina Golyandina","On the choice of parameters in Singular Spectrum Analysis and related
  subspace-based methods","32 pages, 29 figures, 5 tables","Statistics and Its Interface, 2010, 3, 259-279",,,"stat.ME","http://arxiv.org/licenses/nonexclusive-distrib/1.0/","  In the present paper we investigate methods related to both the Singular
Spectrum Analysis (SSA) and subspace-based methods in signal processing. We
describe common and specific features of these methods and consider different
kinds of problems solved by them such as signal reconstruction, forecasting and
parameter estimation. General recommendations on the choice of parameters to
obtain minimal errors are provided. We demonstrate that the optimal choice
depends on the particular problem. For the basic model `signal + residual' we
show that the error behavior depends on the type of residuals, deterministic or
stochastic, and whether the noise is white or red. The structure of errors and
the convergence rate are also discussed. The analysis is based on known
theoretical results and extensive computer simulations.
","[{""version"":""v1"",""created"":""Mon, 24 May 2010 16:44:31 GMT""},{""version"":""v2"",""created"":""Wed, 20 Jul 2011 09:48:57 GMT""}]","2011-07-21"
"1005.4375","Kenneth Phillips","K. J. H. Phillips, K. M. Aggarwal, E. Landi, and F. P. Keenan","Highly Ionized Sodium X-ray Line Emission from the Solar Corona and the
  Abundance of Sodium","Latex file and 5 figures in color. Astronomy and Astrophysics (to be
  published)",,"10.1051/0004-6361/201014454",,"astro-ph.SR","http://arxiv.org/licenses/nonexclusive-distrib/1.0/","  {The \ion{Na}{x} X-ray lines between 10.9 and 11.2~\AA\ have attracted little
attention but are of interest since they enable an estimate of the coronal
abundance of Na to be made. This is of great interest in the continuing debate
on the nature of the FIP (first ionization potential) effect. } {Observations
of the \ion{Na}{x} lines with the Solar Maximum Mission Flat Crystal
Spectrometer and a rocket-borne X-ray spectrometer are used to measure the
Na/Ne abundance ratio, i.e. the ratio of an element with very low FIP to one
with high FIP.} {New atomic data are used to generate synthetic spectra which
are compared with the observations, with temperature and the Na/Ne abundance
ratio as free parameters.} {Temperature estimates from the observations
indicate that the line emission is principally from non-flaring active regions,
and that the Na/Ne abundance ratio is $0.07 \pm 50$\%.} {The Na/Ne abundance
ratio is close to a coronal value for which the abundances of low-FIP elements
(FIP $< 10$~eV) are enhanced by a factor of 3 to 4 over those found in the
photosphere. For low-temperature ($T_e \leqslant 1.5$~MK) spectra, the presence
of \ion{Fe}{xvii} lines requires that either a higher-temperature component is
present or a revision of ionization or recombination rates is needed. }
","[{""version"":""v1"",""created"":""Mon, 24 May 2010 16:46:56 GMT""}]","2015-05-19"
"1005.4376","Santo Fortunato Dr","Andrea Lancichinetti, Mikko Kivela, Jari Saramaki, Santo Fortunato","Characterizing the community structure of complex networks","15 pages, 20 figures, 4 tables","PLoS One 5(8), e11976 (2010)","10.1371/journal.pone.0011976",,"physics.soc-ph cs.IR","http://arxiv.org/licenses/nonexclusive-distrib/1.0/","  Community structure is one of the key properties of complex networks and
plays a crucial role in their topology and function. While an impressive amount
of work has been done on the issue of community detection, very little
attention has been so far devoted to the investigation of communities in real
networks. We present a systematic empirical analysis of the statistical
properties of communities in large information, communication, technological,
biological, and social networks. We find that the mesoscopic organization of
networks of the same category is remarkably similar. This is reflected in
several characteristics of community structure, which can be used as
``fingerprints'' of specific network categories. While community size
distributions are always broad, certain categories of networks consist mainly
of tree-like communities, while others have denser modules. Average path
lengths within communities initially grow logarithmically with community size,
but the growth saturates or slows down for communities larger than a
characteristic size. This behaviour is related to the presence of hubs within
communities, whose roles differ across categories. Also the community
embeddedness of nodes, measured in terms of the fraction of links within their
communities, has a characteristic distribution for each category. Our findings
are verified by the use of two fundamentally different community detection
methods.
","[{""version"":""v1"",""created"":""Mon, 24 May 2010 16:48:03 GMT""}]","2010-09-17"
"1005.4377","Ulrich Krohn","Armen Sargsyan, David Sarkisyan, Ulrich Krohn, James Keaveney, Charles
  Adams","Effect of buffer gas on electromagnetically induced transparency in a
  ladder system using thermal rubidium vapor","4 pages, 4 figures",,"10.1103/PhysRevA.82.045806",,"physics.atom-ph","http://arxiv.org/licenses/nonexclusive-distrib/1.0/","  We report on the first observation of electromagnetically induced
transparency (EIT) in a ladder system in the presence of a buffer gas. In
particular we study the 5S1/2 - 5P3/2 - 5D5/2 transition in thermal rubidium
vapor with a neon buffer gas at a pressure of 6 Torr. In contrast to the line
narrowing effect of buffer gas on {\Lambda}-systems we show that the presence
of the buffer gas leads to an additional broadening of (32 +/- 5) MHz, which
suggests a cross section for Rb(5D5/2)-Ne of {\sigma} = (7 +/- 1) x 10-19 m2.
However, in the limit where the coupling Rabi frequency is larger than k the
collisional dephasing a strong transparency feature can still be observed.
","[{""version"":""v1"",""created"":""Mon, 24 May 2010 17:01:33 GMT""}]","2015-05-19"
"1005.4378","Israel Perez","Israel Perez, Victor Sosa and Fidel Gamboa","Study of higher-order harmonics of complex ac susceptibility in
  $YB_2C_3O_{7-\delta}$ thin films by the mutual inductive method","8 pages, 3 figures","Physica C, 470 2061-2066 (2010)","10.1016/j.physc.2010.09.014",,"cond-mat.supr-con cond-mat.mes-hall","http://arxiv.org/licenses/nonexclusive-distrib/1.0/","  We have applied the mutual inductive method to study higher-order harmonics
of complex ac susceptibility $\chi_n=\chi'_n-i\chi""_n$ for
$$YB_2C_3O_{7-\delta}$ thin films as function of the temperature and the
applied field. The experimental results were compared with analytical and
numerical results obtained from the Ishida-Mazaki model and the solution of the
integral equation for the current density, respectively. Both models allow us
to reproduced the main experimental features, however, as $n$ increases the
numerical model shows notable discrepancies. This failure can be attributed to
the current-voltage characteristics. Also this investigation yields the
activation energy $U_c$ and the critical current density $J_c$ for two samples
both at T=0.
","[{""version"":""v1"",""created"":""Mon, 24 May 2010 17:01:40 GMT""}]","2010-12-17"
"1005.4379","Zachary Snow","Zachary Snow and David Baelde and Gopalan Nadathur","A Meta-Programming Approach to Realizing Dependently Typed Logic
  Programming",,,,,"cs.LO","http://arxiv.org/licenses/nonexclusive-distrib/1.0/","  Dependently typed lambda calculi such as the Logical Framework (LF) can
encode relationships between terms in types and can naturally capture
correspondences between formulas and their proofs. Such calculi can also be
given a logic programming interpretation: the Twelf system is based on such an
interpretation of LF. We consider here whether a conventional logic programming
language can provide the benefits of a Twelf-like system for encoding type and
proof-and-formula dependencies. In particular, we present a simple mapping from
LF specifications to a set of formulas in the higher-order hereditary Harrop
(hohh) language, that relates derivations and proof-search between the two
frameworks. We then show that this encoding can be improved by exploiting
knowledge of the well-formedness of the original LF specifications to elide
much redundant type-checking information. The resulting logic program has a
structure that closely resembles the original specification, thereby allowing
LF specifications to be viewed as hohh meta-programs. Using the Teyjus
implementation of lambdaProlog, we show that our translation provides an
efficient means for executing LF specifications, complementing the ability that
the Twelf system provides for reasoning about them.
","[{""version"":""v1"",""created"":""Mon, 24 May 2010 17:03:47 GMT""}]","2010-05-25"
"1005.4380","Daniel Mehkeri","Daniel M\'ehkeri","A simple computational interpretation of set theory","v3: various copyediting, added thm 5.2 to better explain 6.4",,,,"math.LO","http://arxiv.org/licenses/nonexclusive-distrib/1.0/","  CZF is a system of set theory which, over classical logic, is equivalent to
ZF, while over intuitionistic logic, it has a well-known constructive
type-theoretic interpretation. This article introduces a simpler, intuitive
family of constructive interpretations: sets are well-founded extensional
computable conditional enumerations of sets. One interpretation in this family
is just this: all sets are inductively built from the empty set by iterating
the construction {f_n | n:N ^ g_n = h_n}, where, in turn, g and h are
computable sequences of sets, and f is a computable sequence such that f_n is a
set when g_n and h_n are extensionally equal. Extended Church's Thesis, an
assumption which is incompatible with classical logic, is required to make this
a model of CZF. Besides its foundational interest, it yields a direct
conservativity result for certain choice principles, the Subcountability axiom,
and for some so-called Omniscience principles, including first-order arithmetic
Omniscience. A larger interpretation in this family also models the Regular
Extension Axiom.
","[{""version"":""v1"",""created"":""Mon, 24 May 2010 17:08:34 GMT""},{""version"":""v2"",""created"":""Sun, 21 Nov 2010 07:52:57 GMT""},{""version"":""v3"",""created"":""Tue, 22 Feb 2011 02:51:26 GMT""}]","2011-02-23"
"1005.4381","Dilip G. Banhatti","S. Muthumeenal, Dilip G Banhatti (School of Physics, Madurai Kamaraj
  University, Madurai, India)","Application of slingshot model to the giant radio galaxy DA240 (Brief :
  DA 240 in slingshot model)","6 pages, 2 figures, based on S Muthumeenal's 2007 MPhil project;
  Keywords. active galaxy - radio galaxy - beam model - slingshot model",,,,"astro-ph.CO physics.comp-ph","http://arxiv.org/licenses/nonexclusive-distrib/1.0/","  We attempt a slingshot model interpretation of the unusual association of
some 1&1/3 dozen nonstellar galaxian objects around the parent optical galaxy
of the giant radio galaxy DA 240 (= 0748.6+55.8 (J2000)). Similar
interpretation may be possible for another large radio galaxy 3C 31 (= NGC 383
= 0104.6+32.1 (1950.0)).
","[{""version"":""v1"",""created"":""Mon, 24 May 2010 17:09:59 GMT""}]","2010-05-25"
"1005.4382","Andrew Cooper","Andrew A Cooper","A Characterization of the Singular Time of the Mean Curvature Flow","10 pages",,,,"math.DG math.AP","http://arxiv.org/licenses/nonexclusive-distrib/1.0/","  In this note we investigate the behaviour at finite-time singularities of the
mean curvature flow of compact Riemannian submanifolds M^m_t\hookrightarrow
(N^{m+n}, h). We show that they are characterized by the blow-up of a trace A =
H \cdot II of the square of the second fundamental form.
","[{""version"":""v1"",""created"":""Mon, 24 May 2010 17:11:44 GMT""}]","2010-05-25"
"1005.4383","Elena del Valle","Elena del Valle","Steady state entanglement of two coupled qubits","7 pages, 5 figures","JOSA B, Vol. 28, p. 228-235 (2011)","10.1364/JOSAB.28.000228",,"quant-ph cond-mat.mes-hall","http://arxiv.org/licenses/nonexclusive-distrib/1.0/","  The maximum entanglement between two coupled qubits in the steady state under
two independent incoherent sources of excitation is reported. Asymmetric
configurations where one qubit is excited while the other one dissipates the
excitation are optimal for entanglement, reaching values three times larger
than with thermal sources. The reason is the purification of the steady state
mixture (that includes a Bell state) thanks to the saturation of the pumped
qubit. Photon antibunching between the cross emission of the qubits can be used
to experimentally evidence the large degrees of entanglement.
","[{""version"":""v1"",""created"":""Mon, 24 May 2010 17:12:02 GMT""}]","2011-01-11"
"1005.4384","Silvia Alencar","S.H.P. Alencar, P.S. Teixeira, M.M. Guimaraes, P.T. McGinnis, J.F.
  Gameiro, J. Bouvier, S. Aigrain, E. Flaccomio and F. Favata","Accretion dynamics and disk evolution in NGC 2264: a study based on the
  Corot photometric observations","8 pages, 4 figures, to be published in Astronomy and Astrophysics",,"10.1051/0004-6361/201014184",,"astro-ph.SR","http://arxiv.org/licenses/nonexclusive-distrib/1.0/","  The young cluster NGC 2264 was observed with the Corot satellite for 23 days
uninterruptedly in March 2008 with unprecedent photometric accuracy. We present
here the first results of the analysis of the accreting population. We intended
to look for possible light curve variability of the same nature as that
observed in the classical T Tauri star AA Tau, which was attributed to a
magnetically controlled inner disk warp, which is directly associated with the
interaction between the stellar magnetic field and the inner disk region. We
analysed the Corot light curves of 83 previously known classical T Tauri stars
that belong to NGC 2264 and classified them according to their morphology. We
also studied the Corot light curve morphology as a function of a Spitzer-based
classification of the star-disk systems. The classification derived on the
basis of the Corot light curve morphology agrees very well with the Spitzer
IRAC-based classification of the systems. The percentage of AA Tau-like light
curves decreases as the inner disk dissipates, from 40% +- 10% in systems with
thick inner disks to 36% +- 16% in systems with anemic disks and none in naked
photosphere systems. Indeed, 91% +- 29% of the CTTS with naked photospheres
exhibit pure spot-like variability, while only 18% +- 7% of the thick disk
systems do so, presumably those seen at low inclination and thus free of
variable obscuration. AA Tau-like light curves are found to be fairly common,
with a frequency of at least ~ 30 to 40% in young stars with inner dusty disks.
The temporal evolution of the light curves indicates that the structure of the
inner disk warp, located close to the corotation radius and responsible for the
obscuration episodes, varies over a timescale of a few (~ 1-3) rotational
periods. This probably reflects the highly dynamical nature of the star-disk
magnetospheric interaction.
","[{""version"":""v1"",""created"":""Mon, 24 May 2010 17:33:20 GMT""}]","2015-05-19"
"1005.4385","Andrey Pepelyshev","Andrey Pepelyshev","The role of the nugget term in the Gaussian process method","MODA 9 - Advances in model-oriented design and analysis, Contrib.
  Statist., June 14th-19th 2010, Bertinoro, Bologna, Italy",,,,"stat.ME","http://arxiv.org/licenses/nonexclusive-distrib/1.0/","  The maximum likelihood estimate of the correlation parameter of a Gaussian
process with and without of a nugget term is studied in the case of the
analysis of deterministic models.
","[{""version"":""v1"",""created"":""Mon, 24 May 2010 17:45:39 GMT""}]","2010-05-25"
