"1006.3921","Francois Dubois","Fran\c{c}ois Dubois (LM-Orsay)","Nonlinear Interpolation and Total Variation Diminishing Schemes",,,,,"math.NA","http://arxiv.org/licenses/nonexclusive-distrib/1.0/","  The Van Leer approach for the approximation of nonlinear scalar conservation
laws is studied in one space dimension. The problem can be reduced to a
nonlinear interpolation and we propose a convexity property for the
interpolated values. We prove that under general hypotheses the method of lines
in well posed in $\ ell^{\infty} \cap {\rm BV} $ and we give precise sufficient
conditions to establish that the total variation is diminishing. We observe
that the second order accuracy can be maintained even at non sonic extrema. We
establish also that both the TVD property and second order accuracy can be
maintained after discretization in time with the second order accurate Heun
scheme. Numerical illustration for the advection equation is presented.
","[{""version"":""v1"",""created"":""Sun, 20 Jun 2010 09:45:24 GMT""}]","2010-07-28"
"1006.3922","Ciprian Tudor","Ciprian Tudor (LPP)","Asymptotic Cram\'er's theorem and analysis on Wiener space","To appear in ""Seminaire de Probabilites XLIII""",,,,"math.PR","http://arxiv.org/licenses/nonexclusive-distrib/1.0/","  We prove an asymptotic Cram\'er's theorem, that is, if the sequence $(X_{n}+
Y_{n})_{n\geq 1}$ converges in law to the standard normal distribution and for
every $n\geq 1$ the random variables $X_{n}$ and $Y_{n}$ are independent, then
$(X_{n})_{n\geq 1}$ {\it and } $(Y_{n}) _{n\geq 1}$ converge in law to a normal
distribution. Then we compare this result with recent criteria for the central
convergence obtained in terms of Malliavin derivatives.
","[{""version"":""v1"",""created"":""Sun, 20 Jun 2010 09:48:06 GMT""}]","2010-06-22"
"1006.3923","Diego Garlaschelli","Diego Garlaschelli, Franco Ruzzenenti, Riccardo Basosi","Complex Networks and Symmetry I: A Review","Final accepted version","Symmetry 2, no. 3, pp. 1683-1709 (2010)","10.3390/sym2031683",,"q-fin.GN cond-mat.stat-mech math-ph math.MP nlin.AO physics.soc-ph","http://creativecommons.org/licenses/by/3.0/","  In this review we establish various connections between complex networks and
symmetry. While special types of symmetries (e.g., automorphisms) are studied
in detail within discrete mathematics for particular classes of deterministic
graphs, the analysis of more general symmetries in real complex networks is far
less developed. We argue that real networks, as any entity characterized by
imperfections or errors, necessarily require a stochastic notion of invariance.
We therefore propose a definition of stochastic symmetry based on graph
ensembles and use it to review the main results of network theory from an
unusual perspective. The results discussed here and in a companion paper show
that stochastic symmetry highlights the most informative topological properties
of real networks, even in noisy situations unaccessible to exact techniques.
","[{""version"":""v1"",""created"":""Sun, 20 Jun 2010 09:49:33 GMT""},{""version"":""v2"",""created"":""Wed, 22 Sep 2010 21:57:48 GMT""}]","2010-11-04"
"1006.3924","Valentin Zagrebnov","Thomas Jaeck, Joseph V. Pul\'e, Valentin Zagrebnov (CPT)","On the nature of Bose-Einstein condensation enhanced by localization",,,"10.1063/1.3488965",,"math-ph math.MP","http://arxiv.org/licenses/nonexclusive-distrib/1.0/","  In a previous paper we established that for the perfect Bose gas and the
mean-field Bose gas with an external random or weak potential, whenever there
is generalized Bose-Einstein condensation in the eigenstates of the single
particle Hamiltonian, there is also generalized condensation in the kinetic
energy states. In these cases Bose-Einstein condensation is produced or
enhanced by the external potential. In the present paper we establish a
criterion for the absence of condensation in single kinetic energy states and
prove that this criterion is satisfied for a class of random potentials and
weak potentials. This means that the condensate is spread over an infinite
number of states with low kinetic energy without any of them being
macroscopically occupied.
","[{""version"":""v1"",""created"":""Sun, 20 Jun 2010 09:50:07 GMT""},{""version"":""v2"",""created"":""Sun, 3 Oct 2010 18:24:56 GMT""}]","2015-05-19"
"1006.3925","Paolo Mason","Yacine Chitour, Fr\'ed\'eric Jean (ENSTA), Paolo Mason","Optimal control models of the goal-oriented human locomotion",,,,,"math.OC","http://arxiv.org/licenses/nonexclusive-distrib/1.0/","  In recent papers it has been suggested that human locomotion may be modeled
as an inverse optimal control problem. In this paradigm, the trajectories are
assumed to be solutions of an optimal control problem that has to be
determined. We discuss the modeling of both the dynamical system and the cost
to be minimized, and we analyze the corresponding optimal synthesis. The main
results describe the asymptotic behavior of the optimal trajectories as the
target point goes to infinity.
","[{""version"":""v1"",""created"":""Sun, 20 Jun 2010 09:51:59 GMT""}]","2010-07-26"
"1006.3926","Xiang-Song Chen","Xiang-Song Chen and Ben-Chao Zhu","Physical decomposition of the gauge and gravitational fields","11 pages, no figure; significant revision, with discussion on
  relations of various metric decompositions","Phys.Rev.D83:084006,2011","10.1103/PhysRevD.83.084006",,"gr-qc hep-th math-ph math.MP","http://arxiv.org/licenses/nonexclusive-distrib/1.0/","  Physical decomposition of the non-Abelian gauge field has recently solved the
two-decade-lasting problem of a meaningful gluon spin. Here we extend this
approach to gravity and attack the century-lasting problem of a meaningful
gravitational energy. The metric is unambiguously separated into a pure
geometric term which contributes null curvature tensor, and a physical term
which represents the true gravitational effect and always vanishes in a flat
space-time. By this decomposition the conventional pseudo-tensors of the
gravitational stress-energy are easily rescued to produce definite physical
result. Our decomposition applies to any symmetric tensor, and has interesting
relation to the transverse-traceless (TT) decomposition discussed by Arnowitt,
Deser and Misner, and by York.
","[{""version"":""v1"",""created"":""Sun, 20 Jun 2010 11:17:07 GMT""},{""version"":""v2"",""created"":""Tue, 22 Jun 2010 08:03:27 GMT""},{""version"":""v3"",""created"":""Wed, 19 Jan 2011 12:30:33 GMT""}]","2011-04-22"
"1006.3927","Xiang-Song Chen","Xiang-Song Chen and Ben-Chao Zhu","The true radiation gauge for gravity","11 pages, no figure; significant revision, showing how the TT gauge
  can be adapted in the presence of source","Phys.Rev.D83:061501,2011","10.1103/PhysRevD.83.061501",,"gr-qc hep-th math-ph math.MP","http://arxiv.org/licenses/nonexclusive-distrib/1.0/","  Corresponding to the similarity between the Lorentz gauge $\partial_\mu
A^\mu=0$ in electrodynamics and $g^{\mu\nu}\Gamma^\rho_{\mu\nu}=0$ in gravity,
we show that the counterpart of the radiation gauge $\partial_iA^i=0$ is
$g^{ij}\Gamma^\rho_{ij}=0$, in stead of other forms as discussed before.
Particularly: 1) at least for a weak field, $g^{ij}\Gamma^\rho_{ij}=0$ fixes
the gauge completely and picks out exactly the two physical components of the
gravitational field; 2) like $A^0$, the non-dynamical components $h_{0\mu}$ are
solved instantaneously; 3) gravitational radiation is generated by the
""transverse"" part of the energy-momentum tensor, similar to the transverse
current $\vec J_\perp$. This true"" radiation gauge $g^{ij}\Gamma^\rho_{ij}=0$
is especially pertinent for studying gravitational energy, such as the energy
flow in gravitational radiation. It agrees with the transverse-traceless (TT)
gauge for a pure wave, and reveals remarkably how the TT gauge can be adapted
in the presence of source.
","[{""version"":""v1"",""created"":""Sun, 20 Jun 2010 11:22:44 GMT""},{""version"":""v2"",""created"":""Tue, 22 Jun 2010 07:58:42 GMT""},{""version"":""v3"",""created"":""Tue, 18 Jan 2011 15:06:14 GMT""}]","2011-03-21"
"1006.3928","Ding Ming","Ming Ding and Fan Xu","The multiplication theorem and bases in finite and affine quantum
  cluster algebras","20 pages, the integral bases of cluster algebra of affine types are
  replaced",,,,"math.RT math.QA math.RA","http://arxiv.org/licenses/nonexclusive-distrib/1.0/","  We prove a multiplication theorem for quantum cluster algebras of acyclic
quivers. The theorem generalizes the multiplication formula for quantum cluster
variables in \cite{fanqin}. We apply the formula to construct some
$\mathbb{ZP}$-bases in quantum cluster algebras of finite and affine types.
Under the specialization $q$ and coefficients to $1$, these bases are the
integral bases of cluster algebra of finite and affine types (see \cite{CK1}
and \cite{DXX}).
","[{""version"":""v1"",""created"":""Sun, 20 Jun 2010 11:29:15 GMT""},{""version"":""v2"",""created"":""Sat, 26 Jun 2010 03:09:29 GMT""},{""version"":""v3"",""created"":""Fri, 8 Oct 2010 10:14:54 GMT""},{""version"":""v4"",""created"":""Sat, 6 Nov 2010 12:34:38 GMT""}]","2010-11-09"
"1006.3929","Nikolay Volchanskiy","G. Vereshkov and N. Volchanskiy","Symmetries of higher-spin fields and the electromagnetic N-N(1680) form
  factors","11 pp., 2 figs","Phys.Rev.C82:045204,2010","10.1103/PhysRevC.82.045204",,"hep-ph","http://arxiv.org/licenses/nonexclusive-distrib/1.0/","  We study the Q^2-evolution of the form factors (FFs) for the
nucleon-to-N(1680) transition in the framework of an effective field theory. To
this end, the intrinsic symmetries of the spin-5/2 Rarita-Schwinger (RS) fields
are analyzed, and a Lagrangian of the electromagnetic N-N(1680) interactions is
constructed. The Lagrangian preserves all the intrinsic symmetries of the
spin-5/2 field--point and gauge invariance--and does not involve lower-spin
components of the reducible RS field. Besides, the symmetries postulate the
definitions of the Lagrangian FFs. These FFs are modeled as dispersionlike
expansions in a vector-meson--dominance model. A good agreement with the
experimental data is achieved.
","[{""version"":""v1"",""created"":""Sun, 20 Jun 2010 11:40:10 GMT""}]","2010-10-27"
"1006.3930","Olivia Caramello Dr","Olivia Caramello","The unification of Mathematics via Topos Theory","42 pages",,,,"math.CT math.AG math.LO","http://arxiv.org/licenses/nonexclusive-distrib/1.0/","  We present a set of principles and methodologies which may serve as
foundations of a unifying theory of Mathematics. These principles are based on
a new view of Grothendieck toposes as unifying spaces being able to act as
`bridges' for transferring information, ideas and results between distinct
mathematical theories.
","[{""version"":""v1"",""created"":""Sun, 20 Jun 2010 12:06:01 GMT""}]","2010-06-22"
"1006.3931","Kimmo Tuominen","Topi Kahara and Kimmo Tuominen","Effective models of two-flavor QCD: finite $\mu$ and $m_q$-dependence","10 pages, 6 figures","Phys.Rev.D82:114026,2010","10.1103/PhysRevD.82.114026",,"hep-ph","http://arxiv.org/licenses/nonexclusive-distrib/1.0/","  We study effective models of chiral fields and Polyakov loop expected to
describe the dynamics responsible for the phase structure of two-flavor QCD at
finite temperature and density. We consider chiral sector described either
using linear sigma model or Nambu-Jona-Lasinio model and study the phase
diagram and determine the location of the critical point as a function of the
explicit chiral symmetry breaking (i.e. the bare quark mass $m_q$). We also
discuss the possible emergence of the quarkyonic phase in this model.
","[{""version"":""v1"",""created"":""Sun, 20 Jun 2010 12:37:29 GMT""}]","2011-01-20"
"1006.3932","Brian Macdonald","Brian Macdonald","Density of Complex Zeros of a System of Real Random Polynomials","25 pages, 4 figures","Macdonald, Brian. Density of Complex Zeros of a System of Real
  Random Polynomials. Journal of Statistical Physics: Volume 136, Issue 5
  (2009), Page 807-833","10.1007/s10955-009-9810-5",,"math-ph math.CV math.MP","http://arxiv.org/licenses/nonexclusive-distrib/1.0/","  We study the density of complex zeros of a system of real random SO($m+1$)
polynomials in several variables. We show that the density of complex zeros of
this random polynomial system with real coefficients rapidly approaches the
density of complex zeros in the complex coefficients case. We also show that
the behavior the scaled density of complex zeros near $\mathbb{R}^m$ of the
system of real random polynomials is different in the $m\geq 2$ case than in
the $m=1$ case: the density goes to infinity instead of tending linearly to
zero.
","[{""version"":""v1"",""created"":""Sun, 20 Jun 2010 13:29:06 GMT""}]","2010-06-22"
"1006.3933","David Coward","D.M. Coward, M. Todd, T.P. Vaalsta, M. Laas-Bourez, A. Klotz, A.
  Imerito, L. Yan, P. Luckas, A.B. Fletcher, M.G. Zadnik, R.R. Burman, D.G.
  Blair, J. Zadko, M. Boer, P. Thierry, E.J. Howell, S. Gordon, A. Ahmat, J.
  Moore, and K. Frost","The Zadko Telescope: A Southern Hemisphere Telescope for Optical
  Transient Searches, Multi-Messenger Astronomy and Education","9 pages, 6 figures, Publications of the Astronomical Society of
  Australia (in press)","Publications of the Astronomical Society of Australia, 2010, 27,
  331","10.1071/AS09078",,"astro-ph.IM astro-ph.CO","http://arxiv.org/licenses/nonexclusive-distrib/1.0/","  The new 1-m f/4 fast-slew Zadko Telescope was installed in June 2008 about 70
km north of Perth, Western Australia. It is the only metre-class optical
facility at this southern latitude between the east coast of Australia and
South Africa, and can rapidly image optical transients at a longitude not
monitored by other similar facilities. We report on first imaging tests of a
pilot program of minor planet searches, and Target of Opportunity observations
triggered by the Swift satellite. In 12 months, 6 gamma-ray burst afterglows
were detected, with estimated magnitudes; two of them, GRB 090205 (z = 4.65)
and GRB 090516 (z = 4.11), are among the most distant optical transients imaged
by an Australian telescope. Many asteroids were observed in a systematic
3-month search. In September 2009, an automatic telescope control system was
installed, which will be used to link the facility to a global robotic
telescope network; future targets will include fast optical transients
triggered by highenergy satellites, radio transient detections, and LIGO
gravitational wave candidate events. We also outline the importance of the
facility as a potential tool for education, training, and public outreach.
","[{""version"":""v1"",""created"":""Sun, 20 Jun 2010 13:39:11 GMT""}]","2015-05-19"
"1006.3934","Alexei Yu. Pirkovskii","Alexei Yu. Pirkovskii and Yurii V. Selivanov","Structure theory of homologically trivial and annihilator locally
  C*-algebras","35 pages",,,,"math.OA math.FA","http://arxiv.org/licenses/nonexclusive-distrib/1.0/","  We study the structure of certain classes of homologically trivial locally
C*-algebras. These include algebras with projective irreducible Hermitian
A-modules, biprojective algebras, and superbiprojective algebras. We prove
that, if A is a locally C*-algebra, then all irreducible Hermitian A-modules
are projective if and only if A is a direct topological sum of elementary
C*-algebras. This is also equivalent to A being an annihilator (dual,
complemented, left quasi-complemented, or topologically modular annihilator)
topological algebra. We characterize all annihilator $\sigma$-C*-algebras and
describe the structure of biprojective locally C*-algebras. Also, we present an
example of a biprojective locally C*-algebra that is not topologically
isomorphic to a Cartesian product of biprojective C*-algebras. Finally, we show
that every superbiprojective locally C*-algebra is topologically *-isomorphic
to a Cartesian product of full matrix algebras.
","[{""version"":""v1"",""created"":""Sun, 20 Jun 2010 14:16:48 GMT""}]","2010-06-23"
"1006.3935","Wei Chen","Wei Chen, Christoph Tegenkamp, Herbert Pfn\""ur, Thomas Bredow","Color centers in NaCl by hybrid functionals","13 pages, 6 figures","Phys. Rev. B 82, 104106 (2010)","10.1103/PhysRevB.82.104106",,"cond-mat.mtrl-sci physics.comp-ph","http://arxiv.org/licenses/nonexclusive-distrib/1.0/","  We present in this work the electronic structure and transition energies
(both thermodynamic and optical) of Cl vacancies in NaCl by hybrid density
functionals. The underestimated transition energies by the semi-local
functional inherited from the band gap problem are recovered by the PBE0 hybrid
functional through the non-local exact exchange, whose amount is adjusted to
reproduce the experimental band gap. The hybrid functional also gives a better
account of the lattice relaxation for the defect systems arising from the
reduced self-interaction. On the other hand, the quantitative agreement with
experimental vertical transition energy cannot be achieved with hybrid
functionals due to the inaccurate descriptions of the ionization energies of
the localized defect and the positions of the band edges.
","[{""version"":""v1"",""created"":""Sun, 20 Jun 2010 14:19:45 GMT""},{""version"":""v2"",""created"":""Mon, 13 Sep 2010 11:48:19 GMT""}]","2010-09-14"
"1006.3936","Yan Zhang","Y. Zhang, L. X. Yang, F. Chen, B. Zhou, X. F. Wang, X. H. Chen, M.
  Arita, K. Shimada, H. Namatame, M. Taniguchi, J. P. Hu, B. P. Xie, D. L. Feng","Out-of-plane momentum and symmetry dependent superconducting gap in
  Ba0.6K0.4Fe2As2","5 pages, 4 figures","Physical Review Letters 105, 117003 (2010)",,,"cond-mat.supr-con","http://arxiv.org/licenses/nonexclusive-distrib/1.0/","  The three-dimensional band structure and superconducting gap of
Ba0.6K0.4Fe2As2 are studied with high-resolution angle-resolved photoemission
spectroscopy. In contrast to previous results, we have identified three
hole-like Fermi surfaces near the zone center with sizable out-of-plane or kz
dispersion. The superconducting gap on certain Fermi surface shows significant
kz-dependence. Moreover, we found that the superconducting gap sizes are
different at the same Fermi momentum for two bands with different spatial
symmetries (one odd, one even). Our results provide further information on the
rich superconducting gap structure in iron pnictides, and a distinct test for
theories.
","[{""version"":""v1"",""created"":""Sun, 20 Jun 2010 14:46:30 GMT""}]","2010-09-14"
"1006.3937","Peter D. Olmsted","Chinmay Das, Khizar H. Sheik, Peter D. Olmsted, Simon D. Connell","Nano-scale mechanical probing of supported lipid bilayers with atomic
  force microscopy","6 pages, 6 figures, accepted for publication in Physical Review E","Phys. Rev. E 82, 041920 (2010) [6 pages]","10.1103/PhysRevE.82.041920",,"physics.bio-ph cond-mat.mes-hall cond-mat.mtrl-sci cond-mat.soft","http://arxiv.org/licenses/nonexclusive-distrib/1.0/","  We present theory and experiments for the force-distance curve $F(z_0)$ of an
atomic force microscope (AFM) tip (radius $R$) indenting a supported fluid
bilayer (thickness $2d$). For realistic conditions the force is dominated by
the area compressibility modulus $\kappa_A$ of the bilayer, and, to an
excellent approximation, given by $F= \pi \kappa_A R z_0^2/(2d-z_0)^2$. The
experimental AFM force curves from coexisting liquid ordered and liquid
disordered domains in 3-component lipid bilayers are well-described by our
model, and provides $\kappa_A$ in agreement with literature values. The liquid
ordered phase has a yield like response that we model by hydrogen bond
breaking.
","[{""version"":""v1"",""created"":""Sun, 20 Jun 2010 15:11:47 GMT""},{""version"":""v2"",""created"":""Tue, 12 Oct 2010 21:29:42 GMT""}]","2010-10-27"
"1006.3938","Till Barmeier","Till Barmeier","Permutation Modular Invariants from Modular Functors","30 pages, several figures",,,"ZMP-HH/10-15, Hamburger Beitr\""age zur Mathematik Nr. 382","math.QA","http://arxiv.org/licenses/nonexclusive-distrib/1.0/","  For any finite group G with a finite G-set X and a modular tensor category C
we construct a part of the algebraic structure of an associated G-equivariant
monoidal category: For any group element g in G we exhibit the module category
structure of the g-component over the trivial component. This uses the
formalism of permutation equivariant modular functors that was worked out in
arXiv:1004.1825. As an application we show that the corresponding modular
invariant partition function is given by permutation by g.
","[{""version"":""v1"",""created"":""Sun, 20 Jun 2010 15:12:10 GMT""}]","2010-06-22"
