"1006.3899","Nathan Smith","Nathan Smith, Weidong Li, Alexei V. Filippenko, and Ryan Chornock","Observed Fractions of Core-Collapse Supernova Types and Initial Masses
  of their Single and Binary Progenitor Stars","MNRAS accepted, 18 pages, 8 Figures, 1 color figure",,"10.1111/j.1365-2966.2011.17229.x",,"astro-ph.HE astro-ph.CO astro-ph.SR","http://arxiv.org/licenses/nonexclusive-distrib/1.0/","  We analyse observed fractions of core-collapse SN types from the Lick
Observatory SN Search, and we discuss corresponding implications for massive
star evolution. For a standard IMF, observed fractions of SN types cannot be
reconciled with expectations of single-star evolution. The mass range of WR
stars that shed their H envelopes via their own mass loss accounts for less
than half the observed fraction of SNeIbc. Progenitors of SNeIbc must extend to
a much lower range of initial masses than classical WR stars, and we argue that
most SNIbc and SNIIb progenitors must arise from binary Roche-lobe overflow.
SNeIc still trace higher mass and metallicity, because line-driven winds in the
WR stage remove the He layer and propel the transition from SNIb to Ic. Less
massive progenitors of SNeIb and IIb may not be classical WR stars; they may be
underluminous with weak winds, possibly hidden by overluminous mass-gainer
companions that appear as B[e] supergiants or related objects having aspherical
circumstellar material. The remaining SN types (II-P, II-L, and IIn) are
redistributed across the full range of initial mass. We consider direct
collapse to black holes without visible SNe, but find this problematic. Major
areas of remaining uncertainty are (1) the influence of binary separation,
rotation, and metallicity, (2) mass differences in progenitors of SNeIIn
compared to SNeII-L and II-P, and (3) SNeIc arising from single stars with
eruptive mass loss, its dependence on metallicity, and how it relates to
diversity within the SNIc subclass. (abridged)
","[{""version"":""v1"",""created"":""Sat, 19 Jun 2010 22:23:41 GMT""}]","2015-05-19"
"1006.3900","Vladimir Kulinskii L","L.A. Bulavin and V.L. Kulinskii and N.P. Malomuzh","Peculiarities in the behavior of the entropy diameter for molecular
  liquids as the reflection of molecular rotations and the excluded volume
  effects","22 pages, 8 figures, 3 Tables","J. Mol. Liq., 2011, v. 161, pp. 19-29","10.1016/j.molliq.2011.03.016",,"cond-mat.stat-mech","http://arxiv.org/licenses/nonexclusive-distrib/1.0/","  The behavior of the diameter of the coexistence curve in terms of the entropy
and the corresponding diameter are investigated. It is shown that the diameter
of the coexistence curve in term of the entropy is sensitive to the change in
the character of the rotational motion of the molecule in liquid phase which is
governed by the short range correlations. The model of the compressible
effective volume is proposed to describe the phase coexistence both in terms of
the density and the entropy.
","[{""version"":""v1"",""created"":""Sat, 19 Jun 2010 22:26:09 GMT""},{""version"":""v2"",""created"":""Sat, 16 Oct 2010 00:58:13 GMT""},{""version"":""v3"",""created"":""Sun, 24 Apr 2011 19:09:42 GMT""}]","2013-04-26"
"1006.3901","Fabian Wauthier","Fabian L. Wauthier and Michael I. Jordan","Heavy-Tailed Processes for Selective Shrinkage","10 pages, 4 figures, submitted for publication",,,,"stat.ML stat.AP stat.ME","http://arxiv.org/licenses/nonexclusive-distrib/1.0/","  Heavy-tailed distributions are frequently used to enhance the robustness of
regression and classification methods to outliers in output space. Often,
however, we are confronted with ""outliers"" in input space, which are isolated
observations in sparsely populated regions. We show that heavy-tailed
stochastic processes (which we construct from Gaussian processes via a copula),
can be used to improve robustness of regression and classification estimators
to such outliers by selectively shrinking them more strongly in sparse regions
than in dense regions. We carry out a theoretical analysis to show that
selective shrinkage occurs, provided the marginals of the heavy-tailed process
have sufficiently heavy tails. The analysis is complemented by experiments on
biological data which indicate significant improvements of estimates in sparse
regions while producing competitive results in dense regions.
","[{""version"":""v1"",""created"":""Sat, 19 Jun 2010 23:34:53 GMT""},{""version"":""v2"",""created"":""Wed, 23 Jun 2010 09:09:01 GMT""}]","2010-06-24"
"1006.3902","Zaitov Adilbek Atachanovich","Adilbek A. Zaitov, Ilhom I. Tojiev","On a metric on the space of idempotent probability measures","9 pages",,,,"math.GN math.FA","http://arxiv.org/licenses/nonexclusive-distrib/1.0/","  In this paper we construct a metric on the space of idempotent probability
measures on the given compactum, which is an idempotent analog of the
Kantorovich metric on the space of probability measures.
","[{""version"":""v1"",""created"":""Sun, 20 Jun 2010 00:36:30 GMT""},{""version"":""v2"",""created"":""Thu, 15 Mar 2012 16:17:06 GMT""}]","2012-03-16"
"1006.3903","Adam Pound","Adam Pound","Motion of small bodies in general relativity: foundations and
  implementations of the self-force","246 pages, 15 figures, PhD thesis, abstract truncated to meet arXiv
  requirements",,,,"gr-qc","http://arxiv.org/licenses/nonexclusive-distrib/1.0/","  Extreme mass-ratio inspirals, in which solar-mass compact bodies spiral into
supermassive black holes, are an important potential source for gravitational
wave detectors. Because of the extreme mass-ratio, one can model these systems
using perturbation theory. However, in order to relate the motion of the small
body to the emitted waveform, one requires a model that is accurate on
extremely long timescales. Additionally, in order to avoid intractable
divergences, one requires a model that treats the small body as asymptotically
small rather than exactly pointlike. Both of these difficulties can be resolved
by using techniques of singular perturbation theory. I begin this dissertation
with an analysis of singular perturbation theory on manifolds, including the
common techniques of matched asymptotic expansions and two-timescale
expansions. I then formulate a systematic asymptotic expansion in which the
metric perturbation due to the body is expanded while a representative
worldline is held fixed, and I contrast it with a regular expansion in which
both the metric and the worldline must be expanded. This results in an
approximation that is potentially uniformly accurate on long timescales. The
equation of motion for the body's fixed worldline is determined by performing a
local-in-space expansion in the neighbourhood of the body. Using this local
expansion as boundary data, I construct a global solution to the perturbative
Einstein equation. To concretely characterize orbits, I next devise a
relativistic generalization of the Newtonian method of osculating orbits.
Making use of this method and two-timescale expansions, I examine the utility
of adiabatic approximations that can forgo an explicit calculation of the
force.
","[{""version"":""v1"",""created"":""Sun, 20 Jun 2010 02:20:15 GMT""}]","2010-06-22"
"1006.3904","Xiangjun Wang","Xiangjun Wang and Qibing Zheng","The homology of simplicial complement and the cohomology of the
  moment-angle complexes","2 figures",,,,"math.AT","http://arxiv.org/licenses/nonexclusive-distrib/1.0/","  A simplicial complement P is a sequence of subsets of [m] and the simplicial
complement P corresponds to a unique simplicial complex K with vertices in [m].
In this paper, we defined the homology of a simplicial complement
$H_{i,\sigma}(\Lambda^{*,*}[P], d)$ over a principle ideal domain k and proved
that $H_{*,*}(\Lambda[P], d)$ is isomorphic to the Tor of the corresponding
face ring k(K) by the Taylor resolutions. As applications, we give methods to
compute the ring structure of Tor_{*,*}^{k[x]}(k(K), k)$, $link_{K}\sigma$,
$star_{K}\sigma$ and the cohomology of the generalized moment-angle complexes.
","[{""version"":""v1"",""created"":""Sun, 20 Jun 2010 03:26:26 GMT""},{""version"":""v2"",""created"":""Wed, 17 Nov 2010 02:10:26 GMT""},{""version"":""v3"",""created"":""Thu, 18 Nov 2010 23:47:41 GMT""}]","2010-11-22"
"1006.3905","Masashi Aiki","Masashi Aiki and Tatsuo Iguchi","Motion of a Vortex Filament in the Half Space","8 pages",,,,"math.AP","http://arxiv.org/licenses/nonexclusive-distrib/1.0/","  A model equation for the motion of a vortex filament immersed in three
dimensional, incompressible and inviscid fluid is investigated as a humble
attempt to model the motion of a tornado. We solve an initial-boundary value
problem in the half space where we impose a boundary condition in which the
vortex filament is allowed to move on the boundary.
","[{""version"":""v1"",""created"":""Sun, 20 Jun 2010 03:26:37 GMT""}]","2010-06-22"
"1006.3906","Chaiho Rim Prof","Goro Ishiki, Chaiho Rim","Boundary correlation numbers in one matrix model","16 pages, 3 figures, add elaboration on matter Cardy state and
  references","Phys.Lett.B694:272-277,2010","10.1016/j.physletb.2010.10.001",,"hep-th","http://arxiv.org/licenses/nonexclusive-distrib/1.0/","  We introduce one matrix model coupled to multi-flavor vectors. The two-flavor
vector model is demonstrated to reproduce the two-point correlation numbers of
boundary primary fields of two dimensional (2, 2p+1) minimal Liouville gravity
on disk, generalizing the loop operator (resolvent) description. The model can
properly describe non-trivial boundary conditions for the matter Cardy state as
well as for the Liouville field. From this we propose that the n-flavor vector
model will be suited for producing the boundary correlation numbers with n
different boundary conditions on disk.
","[{""version"":""v1"",""created"":""Sun, 20 Jun 2010 03:52:00 GMT""},{""version"":""v2"",""created"":""Fri, 1 Oct 2010 09:00:05 GMT""}]","2010-12-07"
"1006.3907","Ching Hung Lam","Robert L. Griess Jr., Ching Hung Lam","A moonshine path for 5A and associated lattices of ranks 8 and 16",,,,,"math.GR math.NT","http://arxiv.org/licenses/nonexclusive-distrib/1.0/","  We continue the program, begun in \cite{gl3cpath}, to make a moonshine path
between a node of the extended $E_8$-diagram and the Monster simple group. Our
goal is to provide a context for observations of McKay, Glauberman and Norton
by realizing their theories in a more concrete form. In this article, we treat
the 5A-node. Most work in this article is a study of certain lattices of ranks
8, 16 and 24 whose determinants are powers of 5.
","[{""version"":""v1"",""created"":""Sun, 20 Jun 2010 04:23:21 GMT""}]","2010-06-22"
"1006.3908","Ilse Plauchu-Frayn","I. Plauchu-Frayn (1) and R. Coziol (1) ((1) Depto. de Astronomia de la
  Univ. de Guanajuato, Mexico)","Comparative Study of Asymmetry Origin of Galaxies in Different
  Environments. II. Near-Infrared observations","36 pages, 16 figures. Accepted for publication in AJ: corrected typos
  and references",,"10.1088/0004-6256/140/2/612",,"astro-ph.CO","http://arxiv.org/licenses/nonexclusive-distrib/1.0/","  In this second paper of two analyses, we present near-infrared (NIR)
morphological and asymmetry studies performed in sample of 92 galaxies found in
different density environments: galaxies in Compact Groups (HCGs), Isolated
Pairs of Galaxies (KPGs), and Isolated Galaxies (KIGs). Both studies have
proved useful for identifying the effect of interactions on galaxies. In the
NIR, the properties of the galaxies in HCGs, KPGs, and KIGs are more similar
than they are in the optical. This is because the NIR band traces the older
stellar populations, which formed earlier and are more relaxed than the younger
populations. However, we found asymmetries related to interactions in both KPG
and HCG samples. In HCGs, the fraction of asymmetric galaxies is even higher
than what we found in the optical. In the KPGs the interactions look like very
recent events, while in the HCGs galaxies are more morphologically evolved and
show properties suggesting they suffered more frequent interactions. The key
difference seems to be the absence of star formation in the HCGs; while
interactions produce intense star formation in the KPGs, we do not see this
effect in the HCGs. This is consistent with the dry merger hypothesis (Coziol &
Plauchu-Frayn 2007); the interaction between galaxies in compact groups, (CGs),
is happening without the presence of gas. If the gas was spent in stellar
formation (to build the bulge of the numerous early-type galaxies), then the
HCGs possibly started interacting sometime before the KPGs. On the other hand,
the dry interaction condition in CGs suggests that the galaxies are on merging
orbits, and consequently such system cannot be that much older either.
[abridge]
","[{""version"":""v1"",""created"":""Sun, 20 Jun 2010 04:50:13 GMT""},{""version"":""v2"",""created"":""Sun, 4 Jul 2010 18:28:26 GMT""}]","2015-05-19"
"1006.3909","Ruo-Wei Hung","Ruo-Wei Hung","Constructing Two Edge-Disjoint Hamiltonian Cycles and Two Equal
  Node-Disjoint Cycles in Twisted Cubes","9 pages, 5 figures",,,,"cs.DC","http://arxiv.org/licenses/nonexclusive-distrib/1.0/","  The hypercube is one of the most popular interconnection networks since it
has simple structure and is easy to implement. The $n$-dimensional twisted
cube, denoted by $TQ_n$, an important variation of the hypercube, possesses
some properties superior to the hypercube. Recently, some interesting
properties of $TQ_n$ were investigated. In this paper, we construct two
edge-disjoint Hamiltonian cycles in $TQ_n$ for any odd integer $n\geqslant 5$.
The presence of two edge-disjoint Hamiltonian cycles provides an advantage when
implementing two algorithms that require a ring structure by allowing message
traffic to be spread evenly across the twisted cube. Furthermore, we construct
two equal node-disjoint cycles in $TQ_n$ for any odd integer $n\geqslant 3$, in
which these two cycles contain the same number of nodes and every node appears
in one cycle exactly once. In other words, we decompose a twisted cube into two
components with the same size such that each component contains a Hamiltonian
cycle.
","[{""version"":""v1"",""created"":""Sun, 20 Jun 2010 05:37:07 GMT""},{""version"":""v2"",""created"":""Tue, 29 Jun 2010 09:20:23 GMT""}]","2010-06-30"
"1006.3910","Daniel Urban F","D. F. Urban, J. B\""urki, C. A. Stafford, and Hermann Grabert","The Nanoscale Free-Electron Model","To appear in ""Handbook of Nanophysics"" (ed. K.Sattler) (Taylor &
  Francis 2010)",,,,"cond-mat.mes-hall","http://arxiv.org/licenses/nonexclusive-distrib/1.0/","  A brief review of the nanoscale free-electron model of metal nanowires is
presented. This continuum description of metal nanostructures allows for a
unified treatment of cohesive and conducting properties. Conductance channels
act as delocalized chemical bonds whose breaking is responsible for jumps in
the conductance and force oscillations. It is argued that surface and
quantum-size effects are the two dominant factors in the energetics of a
nanowire, and much of the phenomenology of nanowire stability and structural
dynamics can be understood based on the interplay of these two competing
factors. A linear stability analysis reveals a sequence of ``magic''
conductance values for which the underlying nanowire geometry is exceptionally
stable. The stable configurations include Jahn-Teller deformed wires of broken
axial symmetry. The model naturally explains the experimentally observed shell
and supershell structures.
","[{""version"":""v1"",""created"":""Sun, 20 Jun 2010 06:11:33 GMT""}]","2010-06-22"
"1006.3911","Robert McDougall Kerr","Robert M. Kerr","Numerical generation of a vortex ring cascade in quantum turbulence","22 pages 17 figures",,,,"cond-mat.quant-gas nlin.PS","http://arxiv.org/licenses/nonexclusive-distrib/1.0/","  A symmetric anti-parallel quantum pair of vortices is simulated using the
three-dimensional Gross-Pitaevski equations. The initial development before
cores interact directly demonstrates the traditional vortex dynamics of
stretching, curvature and torsion in a manner consistent with a filament
calculation and simulations of the classical, ideal Euler equations. Once the
cores begin to interact, reconnection develops in the vacuum that forms between
the pair. Out of the reconnection region, vortex waves are emitted with
properties similar to waves in the local induction approximation. These waves
propagate down the initial vortex and deepen. When they deepen far enough,
secondary reconnections occur and vortex rings form. Near this time, spectra
have a $k^{-3}$ regime. As the vortex rings fully separate, the high wavenumber
spectra grow until, at the final time simulated, spectra in two directions
develop nearly -5/3 subranges. This occurs without the dissipation of energy.
Preliminary analysis of the flow of energies in spectral scale and physical
space is discussed.
","[{""version"":""v1"",""created"":""Sun, 20 Jun 2010 06:16:49 GMT""},{""version"":""v2"",""created"":""Tue, 21 Sep 2010 18:29:41 GMT""}]","2010-09-22"
"1006.3912","Ananta Pradhan","Ananta C. Pradhan, Amit Pathak and Jayant Murthy","Far Ultraviolet Diffuse Emission from the Large Magellanic Cloud","Accepted in ApJ Letters",,"10.1088/2041-8205/718/2/L141",,"astro-ph.GA","http://arxiv.org/licenses/nonexclusive-distrib/1.0/","  We present the first observations of diffuse radiation in the far ultraviolet
(1000 -- 1150 \AA) from the Large Magellanic Cloud based on observations made
with the {\it Far Ultraviolet Spectroscopic Explorer}. The fraction of the
total radiation in the field emitted as diffuse radiation is typically 5 --
20\% with a high of 45\% near N70 where there are few exciting stars,
indicating that much of the emission is not due to nearby stars. Much less
light is scattered in the far ultraviolet than at longer wavelengths with the
stellar radiation going into heating the interstellar dust.
","[{""version"":""v1"",""created"":""Sun, 20 Jun 2010 06:40:39 GMT""},{""version"":""v2"",""created"":""Fri, 2 Jul 2010 04:10:45 GMT""}]","2015-05-19"
"1006.3913","Chamberlain Fong","Chamberlain Fong","Methods for Accelerating Conway's Doomsday Algorithm (part 1)","added references to Lewis Carroll's early work on a perpetual
  calendar algorithm",,,,"cs.DS cs.DM","http://arxiv.org/licenses/nonexclusive-distrib/1.0/","  We propose a modification of a key component in the Doomsday Algorithm for
calculating the day of the week of any calendar date. In particular, we propose
to replace the calculation of the required term: \lfloor \frac{x}{12} \rfloor +
x \bmod 12 + \lfloor \frac{x \bmod 12}{4} \rfloor with the term 2y + 10 \, (y
\bmod 2) + z + \lfloor \frac{2 \, (y \bmod 2) + z}{4} \rfloor where x is an
input 2-digit year; y is the tens digit of x; z is the ones digit of x; We
argue the fact that our modification operates on individual base-10 digits
makes the algorithm easier to calculate mentally.
","[{""version"":""v1"",""created"":""Sun, 20 Jun 2010 06:43:53 GMT""},{""version"":""v2"",""created"":""Wed, 23 Jun 2010 01:39:36 GMT""},{""version"":""v3"",""created"":""Thu, 1 Jul 2010 04:59:22 GMT""},{""version"":""v4"",""created"":""Thu, 15 Jul 2010 05:45:11 GMT""},{""version"":""v5"",""created"":""Fri, 16 Jul 2010 00:18:40 GMT""},{""version"":""v6"",""created"":""Mon, 20 Sep 2010 00:04:01 GMT""},{""version"":""v7"",""created"":""Tue, 5 Oct 2010 04:42:20 GMT""},{""version"":""v8"",""created"":""Thu, 27 Jan 2011 03:12:00 GMT""}]","2011-01-28"
"1006.3914","Andrey Tsiganov","A. V. Tsiganov","On bi-integrable natural Hamiltonian systems on the Riemannian manifolds","24 pages, LaTeX with AMSfonts (some new references were added)","J. of Nonlinear Mathematical Physics, v.18, n.2, 245-268,2011","10.1142/S1402925111001507",,"nlin.SI","http://arxiv.org/licenses/nonexclusive-distrib/1.0/","  We introduce the concept of natural Poisson bivectors, which generalizes the
Benenti approach to construction of natural integrable systems on the
Riemannian manifolds and allows us to consider almost the whole known zoo of
integrable systems in framework of bi-hamiltonian geometry.
","[{""version"":""v1"",""created"":""Sun, 20 Jun 2010 06:53:43 GMT""},{""version"":""v2"",""created"":""Thu, 2 Sep 2010 06:07:21 GMT""},{""version"":""v3"",""created"":""Wed, 13 Oct 2010 04:46:11 GMT""},{""version"":""v4"",""created"":""Mon, 25 Oct 2010 12:23:21 GMT""}]","2011-09-06"
"1006.3915","Xinhua Xiong","Xinhua, xiong","Two identities involving the cubic partition function","8 pages",,,,"math.NT","http://arxiv.org/licenses/nonexclusive-distrib/1.0/","  We give a new proof of Chan's identity involving the cubic partition function
and we also give a new identity for the cubic partition function which is
analogues to the Zuckerman's identity for the ordinary partition function.
","[{""version"":""v1"",""created"":""Sun, 20 Jun 2010 07:20:03 GMT""},{""version"":""v2"",""created"":""Tue, 22 Jun 2010 05:26:49 GMT""}]","2010-06-23"
"1006.3916","Shahram Mohsenipour","Shahram Mohsenipour","Model Theory of the Inaccessibility Scheme",,,,,"math.LO","http://arxiv.org/licenses/nonexclusive-distrib/1.0/","  Suppose L = {<, . . .} is any countable first order language in which < is
interpreted as a linear order. Let T be any complete first order theory in the
language L such that T has a kappa-like model where kappa is an inaccessible
cardinal. Such T satisfies the Inaccessibility Scheme. In this paper we study
model theory of the inaccessibility scheme at the level of the existence of
elementary end extensions for various models of it.
","[{""version"":""v1"",""created"":""Sun, 20 Jun 2010 07:50:10 GMT""}]","2010-06-22"
"1006.3917","Paul Woon Yin Lee","Paul W.Y. Lee","A Remark on the Potentials of Optimal Transport Maps","20 pages",,,,"math.DG math.DS","http://arxiv.org/licenses/nonexclusive-distrib/1.0/","  Optimal maps, solutions to the optimal transportation problems, are
completely determined by the corresponding c-convex potential functions. In
this paper, we give simple sufficient conditions for a smooth function to be
c-convex when the cost is given by minimizing a Lagrangian action.
","[{""version"":""v1"",""created"":""Sun, 20 Jun 2010 08:04:10 GMT""}]","2010-06-22"
"1006.3918","I. Dattner","I. Dattner, A. Goldenshluger, A. Juditsky","On deconvolution of distribution functions","Published in at http://dx.doi.org/10.1214/11-AOS907 the Annals of
  Statistics (http://www.imstat.org/aos/) by the Institute of Mathematical
  Statistics (http://www.imstat.org)","Annals of Statistics 2011, Vol. 39, No. 5, 2477-2501","10.1214/11-AOS907","IMS-AOS-AOS907","math.ST stat.TH","http://arxiv.org/licenses/nonexclusive-distrib/1.0/","  The subject of this paper is the problem of nonparametric estimation of a
continuous distribution function from observations with measurement errors. We
study minimax complexity of this problem when unknown distribution has a
density belonging to the Sobolev class, and the error density is ordinary
smooth. We develop rate optimal estimators based on direct inversion of
empirical characteristic function. We also derive minimax affine estimators of
the distribution function which are given by an explicit convex optimization
problem. Adaptive versions of these estimators are proposed, and some numerical
results demonstrating good practical behavior of the developed procedures are
presented.
","[{""version"":""v1"",""created"":""Sun, 20 Jun 2010 08:19:43 GMT""},{""version"":""v2"",""created"":""Fri, 24 Feb 2012 06:39:37 GMT""}]","2012-02-27"
"1006.3919","Ying Cui","Ying Cui, Vincent K.N.Lau","Convergence-Optimal Quantizer Design of Distributed Contraction-based
  Iterative Algorithms with Quantized Message Passing","17 pages, 9 figures, Transaction on Signal Processing, accepted",,"10.1109/TSP.2010.2055861",,"cs.DC","http://arxiv.org/licenses/nonexclusive-distrib/1.0/","  In this paper, we study the convergence behavior of distributed iterative
algorithms with quantized message passing. We first introduce general iterative
function evaluation algorithms for solving fixed point problems distributively.
We then analyze the convergence of the distributed algorithms, e.g. Jacobi
scheme and Gauss-Seidel scheme, under the quantized message passing. Based on
the closed-form convergence performance derived, we propose two quantizer
designs, namely the time invariant convergence-optimal quantizer (TICOQ) and
the time varying convergence-optimal quantizer (TVCOQ), to minimize the effect
of the quantization error on the convergence. We also study the tradeoff
between the convergence error and message passing overhead for both TICOQ and
TVCOQ. As an example, we apply the TICOQ and TVCOQ designs to the iterative
waterfilling algorithm of MIMO interference game.
","[{""version"":""v1"",""created"":""Sun, 20 Jun 2010 08:32:16 GMT""}]","2015-05-19"
"1006.3920","Toshihiko Sasaki","Toshihiko Sasaki, Tsubasa Ichikawa and Izumi Tsutsui","Outcome Independence of Entanglement in One-Way Computation","6 pages, 4 figures","J. Phys. Soc. Jpn. 81 (2012) 064005","10.1143/JPSJ.81.064005",,"quant-ph","http://arxiv.org/licenses/nonexclusive-distrib/1.0/","  We show that the various intermediate states appearing in the process of
one-way computation at a given step of measurement are all equivalent modulo
local unitary transformations. This implies, in particular, that all those
intermediate states share the same entanglement irrespective of the measurement
outcomes, indicating that the process of one-way computation is essentially
unique with respect to local quantum operations.
","[{""version"":""v1"",""created"":""Sun, 20 Jun 2010 09:40:51 GMT""},{""version"":""v2"",""created"":""Wed, 11 Apr 2012 23:46:34 GMT""}]","2012-05-25"
