"1006.3878","Benjamin Lund","Ben D. Lund, George B. Purdy, Justin W. Smith","A Bichromatic Incidence Bound and an Application","12 pages","Discrete & Computational Geometry, Volume 46, Number 4, 2011,
  611-625","10.1007/s00454-011-9367-3",,"math.CO cs.CG","http://arxiv.org/licenses/nonexclusive-distrib/1.0/","  We prove a new, tight upper bound on the number of incidences between points
and hyperplanes in Euclidean d-space. Given n points, of which k are colored
red, there are O_d(m^{2/3}k^{2/3}n^{(d-2)/3} + kn^{d-2} + m) incidences between
the k red points and m hyperplanes spanned by all n points provided that m =
\Omega(n^{d-2}). For the monochromatic case k = n, this was proved by Agarwal
and Aronov.
  We use this incidence bound to prove that a set of n points, no more than n-k
of which lie on any plane or two lines, spans \Omega(nk^2) planes. We also
provide an infinite family of counterexamples to a conjecture of Purdy's on the
number of hyperplanes spanned by a set of points in dimensions higher than 3,
and present new conjectures not subject to the counterexample.
","[{""version"":""v1"",""created"":""Sat, 19 Jun 2010 16:20:24 GMT""},{""version"":""v2"",""created"":""Wed, 7 Jul 2010 20:22:05 GMT""},{""version"":""v3"",""created"":""Mon, 20 Sep 2010 13:30:14 GMT""},{""version"":""v4"",""created"":""Thu, 23 Sep 2010 19:37:24 GMT""},{""version"":""v5"",""created"":""Sun, 10 Apr 2011 20:17:31 GMT""},{""version"":""v6"",""created"":""Wed, 27 Apr 2011 02:12:13 GMT""}]","2012-01-10"
"1006.3879","Ratbay Myrzakulov","K.K.Yerzhanov, Sh.R.Myrzakul, I.I.Kulnazarov, R.Myrzakulov","Accelerating cosmology in F(T) gravity with scalar field","6 pages",,,,"gr-qc astro-ph.CO hep-th","http://arxiv.org/licenses/nonexclusive-distrib/1.0/","  This work deals with $F(T)$ gravity models driven by real scalar fields with
usual and phantom dynamics. We illustrate the results with examples of current
interest, and we find some analytical solutions for scale factors and scalar
fields. The results indicate that torsion-scalar models also admit the
accelerated expansion of the universe.
","[{""version"":""v1"",""created"":""Sat, 19 Jun 2010 16:38:16 GMT""}]","2010-06-22"
"1006.3880","Silvia Heluani Dr.","Carlos Figueroa, Horacio Brizuela and Silvia P. Heluani","Convergence method for calculating solutions to the 3D invariant
  embedding integro-differential equations describing electron transport
  processes","15 pages, 3 figures, accepted for publication in Journal of Materials
  Science",,"10.1007/s10853-010-4578-1",,"cond-mat.mtrl-sci math-ph math.MP","http://arxiv.org/licenses/nonexclusive-distrib/1.0/","  The electron and photon transport processes in spectroscopy techniques
described by the invariant embedding theory is here revisited. We report a
convergence method to obtain closed analytical solutions to the 3D
integro-differential equations. This method was successfully used in
calculating the dependence of the electron backscattered fraction on the atomic
number and on the energy. Also the fraction of absorbed electron as a function
of incident angles was calculated. Using a states ladder model for the electron
energies, this method provides a tool for testing physical parameters involved
in the transport theory, such as the elastic and inelastic cross sections. The
outstanding feature of the invariant embedding differential equations of
considering observable quantities (such as the emergent flux of particles) as
independent variables makes them a suitable tool to describe experimental
situations.
","[{""version"":""v1"",""created"":""Sat, 19 Jun 2010 17:35:31 GMT""}]","2010-06-22"
"1006.3881","Victor Bogdan","Victor M. Bogdan","Generalized vectorial Lebesgue and Bochner integration theory","86 pages",,,,"math.FA","http://arxiv.org/licenses/nonexclusive-distrib/1.0/","  This paper contains a development of the Theory of Lebesgue and Bochner
spaces of summable functions. It represents a synthesis of the results due to
H. Lebesgue, S. Banach, S. Bochner, G. Fubini, S. Saks, F. Riesz, N. Dunford,
P. Halmos, and other contributors to this theory.
  The construction of the theory is based on the notion of a measure on a
prering of sets in any abstract space X. No topological structure of the space
X is required for the development of the theory.
  Measures on prerings generalize the notion of abstract Lebesgue measures.
These measures are readily available and it is not necessary to extend them
beforehand onto a sigma-ring for the development of the theory.
  The basic tool in the development of the theory is the construction and
characterization of Lebesgue-Bochner spaces of summable functions as in the
paper of Bogdanowicz, ""A Generalization of the Lebesgue-Bochner-Stieltjes
Integral and a New Approach to the Theory of Integration"", Proc. of Nat. Acad.
Sci. USA, Vol. 53, No. 3, (1965), p. 492--498
","[{""version"":""v1"",""created"":""Sat, 19 Jun 2010 17:39:41 GMT""}]","2010-06-22"
"1006.3882","Cesim K. Dumlu","Cesim K. Dumlu","Schwinger Vacuum Pair Production in Chirped Laser Pulses",,"Phys.Rev.D82:045007,2010","10.1103/PhysRevD.82.045007",,"hep-th quant-ph","http://arxiv.org/licenses/nonexclusive-distrib/1.0/","  The recent developments of high intensity ultra-short laser pulses have
raised the hopes of observing Schwinger vacuum pair production which is one of
the important non-perturbative phenomena in Quantum electrodynamics (QED). The
quantitative analysis of realistic high intensity laser pulses is vital for
understanding the effect of the field parameters on the momentum spectrum of
the produced particles. In this study, we analyze chirped laser pulses with a
sub-cycle structure, and investigate the effects of the chirp parameter on the
momentum spectrum of the produced particles. The combined effect of the chirp
and carrier phase of the laser pulse is also analyzed. These effects are
qualitatively explained by investigating the turning point structure of the
potential within the framework of the complex WKB scattering approach to pair
production.
","[{""version"":""v1"",""created"":""Sat, 19 Jun 2010 17:42:36 GMT""}]","2014-11-21"
"1006.3883","Boyan Jonov","Boyan Jonov","Initial Complex Associated to a Jet Scheme of a Determinantal Variety","To appear in Journal of Pure and Applied Algebra",,,,"math.AC math.AG math.CO","http://arxiv.org/licenses/nonexclusive-distrib/1.0/","  We show in this paper that the principal component of the first order jet
scheme over the classical determinantal variety of m x n matrices of rank at
most 1 is arithmetically Cohen-Macaulay, by showing that an associated
Stanley-Reisner simplicial complex is shellable.
","[{""version"":""v1"",""created"":""Sat, 19 Jun 2010 19:18:08 GMT""}]","2010-06-22"
"1006.3884","Heloise Nonne","H. Nonne, E. Boulat, S. Capponi, and P. Lecheminant","Competing orders in the generalized Hund chain model at half-filling","26 pages, 14 figures","Phys. Rev. B 82, 155134 (2010)","10.1103/PhysRevB.82.155134",,"cond-mat.str-el","http://arxiv.org/licenses/nonexclusive-distrib/1.0/","  By using a combination of several non-perturbative techniques -- a
one-dimensional field theoretical approach together with numerical simulations
using density matrix renormalization group -- we present an extensive study of
the phase diagram of the generalized Hund model at half-filling. This model
encloses the physics of various strongly correlated one-dimensional systems,
such as two-leg electronic ladders, ultracold degenerate fermionic gases
carrying a large hyperfine spin 3/2, other cold gases like Ytterbium 171 or
alkaline-earth condensates. A particular emphasis is laid on the possibility to
enumerate and exhaust the eight possible Mott insulating phases by means of a
duality approach. We exhibit a one-to-one correspondence between these phases
and those of the two-leg Hubbard ladder with interchain hopping. Our results
obtained from a weak coupling analysis are in remarkable quantitative agreement
with our numerical results carried out at moderate coupling.
","[{""version"":""v1"",""created"":""Sat, 19 Jun 2010 19:34:21 GMT""},{""version"":""v2"",""created"":""Sat, 23 Oct 2010 09:42:32 GMT""}]","2010-10-26"
"1006.3885","Wolfgang Kastaun","Wolfgang Kastaun and Beatrix Willburger and Kostas D. Kokkotas","On the saturation amplitude of the f-mode instability","24 pages, 31 figures, 6 tables. Updated article to published version.
  Fixed a typo in Eq. 31","Phys.Rev.D82:104036,2010","10.1103/PhysRevD.82.104036",,"gr-qc astro-ph.SR","http://arxiv.org/licenses/nonexclusive-distrib/1.0/","  We investigate strong nonlinear damping effects which occur during high
amplitude oscillations of neutron stars, and the gravitational waves they
produce. For this, we use a general relativistic nonlinear hydrodynamics code
in conjunction with a fixed spacetime (Cowling approximation) and a polytropic
equation of state (EOS). Gravitational waves are estimated using the quadrupole
formula. Our main interest are l=m=2 f modes subject to the CFS (Chandrasekhar,
Friedman, Schutz) instability, but we also investigate axisymmetric and
quasiradial modes. We study various models to determine the influence of
rotation rate and EOS. We find that axisymmetric oscillations at high
amplitudes are predominantly damped by shock formation, while the
nonaxisymmetric f modes are mainly damped by wave breaking and, for rapidly
rotating models, coupling to nonaxisymmetric inertial modes. From the observed
nonlinear damping, we derive upper limits for the saturation amplitude of
CFS-unstable f modes. Finally, we estimate that the corresponding gravitational
waves for an oscillation amplitude at the upper limit should be detectable with
the advanced LIGO and VIRGO interferometers at distances above 10 MPc. This
strongly depends on the stellar model, in particular on the mode frequency.
","[{""version"":""v1"",""created"":""Sat, 19 Jun 2010 20:08:30 GMT""},{""version"":""v2"",""created"":""Wed, 5 Oct 2011 13:58:55 GMT""}]","2011-10-06"
"1006.3886","Michael Kinyon","Kenneth W. Johnson, Michael Kinyon, Gabor Nagy, Petr Vojtechovsky","Searching for small simple automorphic loops","15 pages. V2: revisions following suggestions of referee, to appear
  in LMS J. Computation and Mathematics","LMS J. Comput. Math. 14 (2011) 200-213","10.1112/S1461157010000173",,"math.GR","http://arxiv.org/licenses/nonexclusive-distrib/1.0/","  A loop is (right) automorphic if all its (right) inner mappings are
automorphisms. Using the classification of primitive groups of small degrees,
we show that there is no nonassociative simple commutative automorphic loop of
order less than $2^{12}$, and no nonassociative simple automorphic loop of
order less that 2500. We obtain examples of nonassociative simple right
automorphic loops.
","[{""version"":""v1"",""created"":""Sat, 19 Jun 2010 20:22:56 GMT""},{""version"":""v2"",""created"":""Thu, 18 Aug 2011 06:37:13 GMT""}]","2019-02-20"
"1006.3887","R. Mansilla","R. Mansilla, R. Mendozas","The Network of Mexican Cities","23 pages, 10 figures",,,,"nlin.AO q-bio.PE","http://arxiv.org/licenses/nonexclusive-distrib/1.0/","  The network of 5823 cities of Mexico with a population more than 5000
inhabitants is studied. Our analysis is focused to the spectral properties of
the adjacency matrix, the small-world properties of the network, the
distribution of the clustering coefficients and the degree distribution of the
vertices. The connection of these features with the spread of epidemics on this
network is also discussed.
","[{""version"":""v1"",""created"":""Sat, 19 Jun 2010 20:25:19 GMT""}]","2010-06-22"
"1006.3888","Barry Ganapol","B.D. Ganapol","Highly Accurate Solutions of the Blasius and Falkner-Skan Boundary Layer
  Equations via Convergence Acceleration","27 pages and 7 figures",,,,"math-ph math.MP","http://creativecommons.org/licenses/by-nc-sa/3.0/","  A new highly accurate algorithm for the solution of the Falkner-Skan equation
of boundary layer theory is presented. The algorithm, based on a Maclaurin
series representation, finds its coefficients from recurrence. In addition,
Wynn-epsilon convergence acceleration and continuous analytical continuation
enable an accurate evaluation. The most accurate skin friction coefficients
(shooting angle) to date are presented along with comparisons to past and
present values found in the literature. The algorithm, coded in FORTRAN, uses
neither enhanced precision arithmetic beyond quadruple precision nor computer
algebra to achieve results in a timely fashion.
  Key Words: Falkner-Skan flow; Blasius flow; Wynn-epsilon acceleration;
Romberg acceleration; Continuous analytical continuation
","[{""version"":""v1"",""created"":""Sat, 19 Jun 2010 20:49:25 GMT""}]","2010-06-22"
"1006.3889","Linfeng Zhou","Linfeng Zhou","Spherically symmetric Finsler metrics in R^n",,,,,"math.DG","http://arxiv.org/licenses/nonexclusive-distrib/1.0/","  In this paper, we give the general form of spherically symmetric Finsler
metrics in $R^n$ and surprisedly find that many well-known Finsler metrics
belong to this class. Then we explicitly express projective metrics of this
type. The necessary and sufficient conditions that projective Finsler metrics
with spherical symmetry have constant flag curvature are also obtained.
","[{""version"":""v1"",""created"":""Sat, 19 Jun 2010 20:49:38 GMT""}]","2010-06-22"
"1006.3890","Linfeng Zhou","Linfeng Zhou","Projective spherically symmetric Finsler metrics with constant flag
  curvature in R^n",,,,,"math.DG","http://arxiv.org/licenses/nonexclusive-distrib/1.0/","  We investigate projective spherically symmetric Finsler metrics with constant
flag curvature in $R^n$ and give the complete classification theorems.
Furthermore, a new class of Finsler metrics with two parameters on
n-dimensional disk are found to have constant negative flag curvature.
","[{""version"":""v1"",""created"":""Sat, 19 Jun 2010 20:54:53 GMT""}]","2010-06-22"
"1006.3891","Darryl D. Holm","J. D. Gibbon and D. D. Holm","The gradient of potential vorticity, quaternions and an orthonormal
  frame for fluid particles","Dedicated to Raymond Hide on the occasion of his 80th birthday",,"10.1080/03091929.2010.513117",,"nlin.CD math-ph math.MP physics.ao-ph","http://arxiv.org/licenses/nonexclusive-distrib/1.0/","  The gradient of potential vorticity (PV) is an important quantity because of
the way PV (denoted as $q$) tends to accumulate locally in the oceans and
atmospheres. Recent analysis by the authors has shown that the vector quantity
$\bdB = \bnabla q\times \bnabla\theta$ for the three-dimensional incompressible
rotating Euler equations evolves according to the same stretching equation as
for $\bom$ the vorticity and $\bB$, the magnetic field in magnetohydrodynamics
(MHD). The $\bdB$-vector therefore acts like the vorticity $\bom$ in Euler's
equations and the $\bB$-field in MHD. For example, it allows various analogies,
such as stretching dynamics, helicity, superhelicity and cross helicity. In
addition, using quaternionic analysis, the dynamics of the $\bdB$-vector
naturally allow the construction of an orthonormal frame attached to fluid
particles\,; this is designated as a quaternion frame. The alignment dynamics
of this frame are particularly relevant to the three-axis rotations that
particles undergo as they traverse regions of a flow when the PV gradient
$\bnabla q$ is large.
","[{""version"":""v1"",""created"":""Sat, 19 Jun 2010 20:56:45 GMT""}]","2015-05-19"
"1006.3892","Martin Plenio","A. Vaziri and M.B. Plenio","Quantum coherence in ion channels: Resonances, Transport and
  Verification","Under review for New Jorunal of Physics","New J. Phys. 12, 085001 (2010)","10.1088/1367-2630/12/8/085001",,"quant-ph physics.bio-ph","http://arxiv.org/licenses/nonexclusive-distrib/1.0/","  Recently it was demonstrated that long-lived quantum coherence exists during
excitation energy transport in photosynthesis. It is a valid question up to
which length, time and mass scales quantum coherence may extend, how to one may
detect this coherence and what if any role it plays for the dynamics of the
system. Here we suggest that the selectivity filter of ion channels may exhibit
quantum coherence which might be relevant for the process of ion selectivity
and conduction. We show that quantum resonances could provide an alternative
approch to ultrafast 2D spectroscopy to probe these quantum coherences. We
demonstrate that the emergence of resonances in the conduction of ion channels
that are modulated periodicallly by time dependent external electric fields can
serve as signitures of quantum coherence in such a system. Assessments of
experimental feasibility and specific paths towards the experimental
realization of such experiments are presented. We show that this may be probed
by direct 2-D spectroscopy or through the emergence of resonances in the
conduction of ion channels that are modulated periodically by time dependent
external electric fields.
","[{""version"":""v1"",""created"":""Sat, 19 Jun 2010 21:02:58 GMT""}]","2015-05-19"
"1006.3893","Laith Haddad","L. H. Haddad and L. D. Carr","Relativistic linear stability equations for the nonlinear Dirac equation
  in Bose-Einstein condensates","6 pages, 3 figures","Europhys.Lett.94:56002,2011","10.1209/0295-5075/94/56002",,"cond-mat.quant-gas math-ph math.MP","http://arxiv.org/licenses/nonexclusive-distrib/1.0/","  We present relativistic linear stability equations (RLSE) for
quasi-relativistic cold atoms in a honeycomb optical lattice. These equations
are derived from first principles and provide a method for computing
stabilities of arbitrary localized solutions of the nonlinear Dirac equation
(NLDE), a relativistic generalization of the nonlinear Schr\""odinger equation.
We present a variety of such localized solutions: skyrmions, solitons,
vortices, and half-quantum vortices, and study their stabilities via the RLSE.
When applied to a uniform background, our calculations reveal an experimentally
observable effect in the form of Cherenkov radiation. Remarkably, the Berry
phase from the bipartite structure of the honeycomb lattice induces a
boson-fermion transmutation in the quasi-particle operator statistics.
","[{""version"":""v1"",""created"":""Sat, 19 Jun 2010 21:22:55 GMT""},{""version"":""v2"",""created"":""Mon, 28 Jun 2010 21:10:10 GMT""},{""version"":""v3"",""created"":""Wed, 5 Jan 2011 23:38:01 GMT""}]","2011-06-06"
"1006.3894","Stephane Caron","E. Altman, P. Bernhard, S. Caron, G. Kesidis, J. Rojas-Mora and S.
  Wong","A Study of Non-Neutral Networks with Usage-based Prices",,,,,"cs.NI","http://arxiv.org/licenses/nonexclusive-distrib/1.0/","  Hahn and Wallsten wrote that network neutrality ""usually means that broadband
service providers charge consumers only once for Internet access, do not favor
one content provider over another, and do not charge content providers for
sending information over broadband lines to end users."" In this paper we study
the implications of non-neutral behaviors under a simple model of linear
demand-response to usage-based prices. We take into account advertising
revenues and consider both cooperative and non-cooperative scenarios. In
particular, we model the impact of side-payments between service and content
providers. We also consider the effect of service discrimination by access
providers, as well as an extension of our model to non-monopolistic content
providers.
","[{""version"":""v1"",""created"":""Sat, 19 Jun 2010 21:34:14 GMT""}]","2010-06-22"
"1006.3895","Hyun Kyu Kim","Igor B. Frenkel and Hyun Kyu Kim","Quantum Teichm\""uller space from quantum plane","41 pages, 9 figures","Duke Math. J. 161, no. 2 (2012), 305-366","10.1215/00127094-1507390",,"math.RT math-ph math.GT math.MP math.QA","http://arxiv.org/licenses/nonexclusive-distrib/1.0/","  We derive the quantum Teichm\""uller space, previously constructed by Kashaev
and by Fock and Chekhov, from tensor products of a single canonical
representation of the modular double of the quantum plane. We show that the
quantum dilogarithm function appears naturally in the decomposition of the
tensor square, the quantum mutation operator arises from the tensor cube, the
pentagon identity from the tensor fourth power of the canonical representation,
and an operator of order three from isomorphisms between canonical
representation and its left and right duals. We also show that the quantum
universal Teichm\""uller space is realized in the infinite tensor power of the
canonical representation naturally indexed by rational numbers including the
infinity. This suggests a relation to the same index set in the classification
of projective modules over the quantum torus, the unitary counterpart of the
quantum plane, and points to a new quantization of the universal Teichm\""uller
space.
","[{""version"":""v1"",""created"":""Sat, 19 Jun 2010 21:51:12 GMT""}]","2019-12-19"
"1006.3896","Yolanda Gomez Dr.","Citlali Neria, Yolanda Gomez, and Luis F. Rodriguez (CRyA-UNAM)","Compact radio sources in the vicinity of the ultracompact HII region
  G78.4+2.6","Accepted for publication in RevMexAA, vol. 46, 2010",,,,"astro-ph.GA","http://arxiv.org/licenses/nonexclusive-distrib/1.0/","  Using the Very Large Array (VLA) at 3.6~cm we identify four new compact radio
sources in the vicinity of the cometary HII region G78.4+2.6 (VLA~1). The four
compact radio sources (named VLA~2 to VLA~5), have near-infrared counterparts,
as seen in the 3.6 $\mu$m Spitzer image. One of them (VLA~5) clearly shows
evidence of radio variability in a timescale of hours. We explore the
possibility that these radio sources are associated with pre-main sequence
(PMS) stars in the vicinity of the UC HII region G78.4+2.6. Our results favor
the smaller distance value of 1.7 kpc for G78.4+2.6. In addition to the
detection of the radio sources in the vicinity of G78.4+2.6, we detected
another group of five sources which appear located about 3' to the northwest of
the HII region. Some of them exhibit extended emission.
","[{""version"":""v1"",""created"":""Sat, 19 Jun 2010 21:56:35 GMT""}]","2010-06-22"
"1006.3897","Rudy Gilmore","Rudy C. Gilmore and Enrico Ramirez-Ruiz","Local absorption of high-energy emission from gamma-ray bursts","6 pages, 6 figures, updated to match published version","The Astrophysical Journal, Volume 721, Issue 1, pp. 709-714 (2010)","10.1088/0004-637X/721/1/709",,"astro-ph.HE","http://arxiv.org/licenses/nonexclusive-distrib/1.0/","  High-energy photons emitted from gamma-ray bursts (GRBs) are subject to
pair-production interactions with lower energy photons, leading to an effective
optical depth. In this Letter, we estimate the opacity resulting from photon
fields located at various distances from long GRB sites: that of the binary
companion to the massive stellar progenitor, that of the star-forming molecular
cloud containing the GRB, and the total photon field of the host galaxy. The
first two photon fields are found to be transparent for most reasonable sets of
assumptions about these systems. In the case of galactic radiation fields, we
have performed several numerical simulations to calculate the expected
opacities for different line-of-sight geometries through the host galaxy, and
include a full accounting of the infrared radiation produced by the absorption
and re-radiation of starlight by dust. The optical depth for GeV gamma-rays,
due to direct starlight is less than unity for all host galaxies. At higher
energies, $>$10 TeV, a spectral cutoff can occur due to the rapidly increasing
number of mid- to far-IR intra-galactic photons reradiated by dust. Photons in
the extragalactic background light therefore remain the only relevant source of
photon-photon opacity for ongoing GRB observations with Fermi LAT, and
potential future detections with ground-based gamma-ray telescopes.
","[{""version"":""v1"",""created"":""Sat, 19 Jun 2010 22:00:23 GMT""},{""version"":""v2"",""created"":""Sat, 30 Oct 2010 13:35:27 GMT""}]","2010-11-02"
"1006.3898","Guo-Li Wang","Hui-feng Fu, Xiang-jun Chen, Guo-Li Wang","Annihilation Rates of Heavy $1^{--}$ S-wave Quarkonia in Salpeter Method","10 pages,2 figures, 5 tables","Phys.Lett.B692:312-316,2010","10.1016/j.physletb.2010.07.050",,"hep-ph hep-ex","http://arxiv.org/licenses/nonexclusive-distrib/1.0/","  The annihilation rates of vector $1^{--}$ charmonium and bottomonium $^3S_1$
states $V \rightarrow e^+e^-$ and $V\rightarrow 3\gamma$, $V \rightarrow \gamma
gg$ and $V \rightarrow 3g$ are estimated in the relativistic Salpeter method.
We obtained $\Gamma(J/\psi\rightarrow 3\gamma)=6.8\times 10^{-4}$ keV,
$\Gamma(\psi(2S)\rightarrow 3\gamma)=2.5\times 10^{-4}$ keV,
$\Gamma(\psi(3S)\rightarrow 3\gamma)=1.7\times 10^{-4}$ keV,
$\Gamma(\Upsilon(1S)\rightarrow 3\gamma)=1.5\times 10^{-5}$ keV,
$\Gamma(\Upsilon(2S)\rightarrow 3\gamma)=5.7\times 10^{-6}$ keV,
$\Gamma(\Upsilon(3S)\rightarrow 3\gamma)=3.5\times 10^{-6}$ keV and
$\Gamma(\Upsilon(4S)\rightarrow 3\gamma)=2.6\times 10^{-6}$ keV. In our
calculations, special attention is paid to the relativistic correction, which
is important and can not be ignored for excited $2S$, $3S$ and higher excited
states.
","[{""version"":""v1"",""created"":""Sat, 19 Jun 2010 22:02:34 GMT""},{""version"":""v2"",""created"":""Thu, 19 Aug 2010 12:13:57 GMT""}]","2014-11-21"
