"1006.4021","Anna Pratoussevitch","Anna Pratoussevitch","The Combinatorial Geometry of Q-Gorenstein Quasi-Homogeneous Surface
  Singularities",,"Differential Geometry and its Applications 29 (2011), 507-515",,,"math.DG","http://arxiv.org/licenses/nonexclusive-distrib/1.0/","  The main result of this paper is a construction of fundamental domains for
certain group actions on Lorentz manifolds of constant curvature. We consider
the simply connected Lie group G~, the universal cover of the group SU(1,1) of
orientation-preserving isometries of the hyperbolic plane. The Killing form on
the Lie group G~ gives rise to a bi-invariant Lorentz metric of constant
curvature. We consider a discrete subgroup Gamma_1 and a cyclic discrete
subgroup Gamma_2 in G~ which satisfy certain conditions. We describe the
Lorentz space form Gamma_1\G~/Gamma_2 by constructing a fundamental domain for
the action of the product of Gamma_1 and Gamma_2 on G~ by (g,h)*x=gxh^{-1}.
This fundamental domain is a polyhedron in the Lorentz manifold G~ with totally
geodesic faces. For a co-compact subgroup the corresponding fundamental domain
is compact. The class of subgroups for which we construct fundamental domains
corresponds to an interesting class of singularities. The bi-quotients of the
form Gamma_1\G~/Gamma_2 are diffeomorphic to the links of quasi-homogeneous
Q-Gorenstein surface singularities.
","[{""version"":""v1"",""created"":""Mon, 21 Jun 2010 10:12:08 GMT""}]","2013-04-12"
"1006.4022","Pascu Catalin Moca","Catalin Pascu Moca and Adrian Roman","Quantum phase transition in a gapped Anderson model: A numerical
  renormalization group study","6 pages, 6 eps figures","Phys. Rev. B 81, 235106 (2010)","10.1103/PhysRevB.81.235106",,"cond-mat.mes-hall","http://arxiv.org/licenses/nonexclusive-distrib/1.0/","  We use the numerical renormalization group method to investigate the spectral
properties of a single-impurity Anderson model with a gap {\delta} across the
Fermi level in the conduction-electron spectrum. For any finite {\delta} > 0,
at half filling the ground state of the system is always a doublet. Away from
half filling a quantum phase transition (QPT) occurs as function of the gap
value {\delta}, and the system evolves from the strong-coupling (SC) Kondo-type
state, corresponding to {\delta} <{\delta}_C toward a localized moment (LM)
regime for {\delta} > {\delta}_C. The opening of the gap leads to the formation
of one (two) bound states when the system is in the SC (LM) regime. The
evolution across the QPT of their positions and the corresponding weights
together with the dynamic properties of the model are investigated.
","[{""version"":""v1"",""created"":""Mon, 21 Jun 2010 10:17:55 GMT""}]","2010-06-22"
"1006.4023","Juan M. Lopez","Juan M. Lopez, Marc Pradas, Aurora Hernandez-Machado","Activity statistics, avalanche kinetics, and velocity correlations in
  surface growth","6 pages, 3 eps figures",,"10.1103/PhysRevE.82.031127",,"cond-mat.stat-mech cond-mat.soft","http://arxiv.org/licenses/nonexclusive-distrib/1.0/","  We investigate the complex spatio-temporal dynamics in avalanche driven
surface growth by means of scaling theory. We study local activity statistics,
avalanche kinetics, and temporal correlations in the global interface velocity,
obtaining different scaling relationships among the involved critical exponents
depending on how far from or close to a critical point the system is. Our
scaling arguments are very general and connect local and global magnitudes
through several scaling relationships. We expect our results to be applicable
in a wide range of systems exhibiting interface kinetic roughening driven by
avalanches of local activity, either critical or not. As an example we apply
the scaling theory to analyze avalanches and roughening of forced-flow
imbibition fronts in excellent agreement with phase-field numerical
simulations.
","[{""version"":""v1"",""created"":""Mon, 21 Jun 2010 10:22:27 GMT""}]","2015-05-19"
"1006.4024","Himadri Ghosh Mr.","Himadri Ghosh, Sudip K. Garain, Sandip K. Chakrabarti, Philippe
  Laurent","Monte-Carlo Simulations of Thermal Comptonization Process in a Two
  Component Accretion Flow Around a Black Hole in presence of an Outflow","15 pages, 8 figures","International Journal of Modern Physics D, Vol. 19, No. 5 (2010)
  607-620","10.1142/S0218271810016555",,"astro-ph.HE","http://creativecommons.org/licenses/by/3.0/","  A black hole accretion may have both the Keplerian and the sub-Keplerian
component. In the so-called Chakrabarti-Titarchuk scenario, the Keplerian
component supplies low energy (soft) photons while the sub-Keplerian component
supplies hot electrons which exchange their energy with the soft photons
through Comptonization or inverse Comptonization processes. In the
sub-Keplerian component, a shock is generally produced due to the centrifugal
force. The postshock region is known as the CENtrifugal pressure-supported
BOundary Layer (CENBOL). In this paper, we compute the effects of the thermal
and the bulk motion Comptonization on the soft photons emitted from a Keplerian
disk by the CENBOL, the preshock sub-Keplerian disk and the outflowing jet. We
study the emerging spectrum when the converging inflow and the diverging
outflow (generated from the CENBOL) are simultaneously present. From the
strength of the shock, we calculate the percentage of matter being carried away
by the outflow and determine how the emerging spectrum depends on the outflow
rate. The preshock sub-Keplerian flow is also found to Comptonize the soft
photons significantly. The interplay between the up-scattering and
down-scattering effects determines the effective shape of the emerging
spectrum. By simulating several cases with various inflow parameters, we
conclude that whether the preshock flow, or the postshock CENBOL or the
emerging jet is dominant in shaping the emerging spectrum depends strongly on
the geometry of the flow and the strength of the shock in the sub-Keplerian
flow.
","[{""version"":""v1"",""created"":""Mon, 21 Jun 2010 10:24:13 GMT""}]","2010-06-22"
"1006.4025","Luca Fabbri","Luca Fabbri","Leptonic Electroweak Spin-Torsion Interactions","7 pages","Mod.Phys.Lett.A26:1697-1705,2011","10.1142/S0217732311036097",,"hep-th","http://arxiv.org/licenses/nonexclusive-distrib/1.0/","  In this paper we consider the most general field equations for a system of
two fermions of which one single-handed, showing that the spin-torsion
interactions among these spinors have a structure identical to that of the
electroweak forces among leptons; possible extensions are discussed.
","[{""version"":""v1"",""created"":""Mon, 21 Jun 2010 10:33:32 GMT""},{""version"":""v2"",""created"":""Thu, 14 Oct 2010 14:02:54 GMT""},{""version"":""v3"",""created"":""Fri, 5 Aug 2011 22:17:47 GMT""}]","2011-08-09"
"1006.4026","Elodie Leducq","Elodie Leducq","A proof of two conjectures on APN functions",,,,,"math.NT cs.IT math.IT","http://arxiv.org/licenses/nonexclusive-distrib/1.0/","  Dobbertin, Mills, M\""uller, Pott and Willems conjecture that two families of
power mapping are families of APN functions. Here we prove those two
conjectures.
","[{""version"":""v1"",""created"":""Mon, 21 Jun 2010 10:34:13 GMT""},{""version"":""v2"",""created"":""Fri, 25 Jun 2010 12:50:29 GMT""},{""version"":""v3"",""created"":""Thu, 9 Jun 2011 15:00:51 GMT""},{""version"":""v4"",""created"":""Mon, 24 Oct 2011 18:10:27 GMT""}]","2011-10-25"
"1006.4027","Archan S. Majumdar","T. Pramanik, S. Adhikari, A. S. Majumdar, D. Home","Proposal for testing non-locality of single photons in cavities","8 pages, 4 eps figs, accepted for publication in Physics Letters A",,,,"quant-ph physics.optics","http://arxiv.org/licenses/nonexclusive-distrib/1.0/","  A scheme is formulated for testing nonlocality of single photons by
considering the state of a single photon that could be located within one of
two spatially separated cavities. The outcomes of four experiments on this
state involving the resonant interactions of two-level atoms with these
cavities and a couple of other auxiliary ones is shown to lead to a
contradiction with the criterion of locality.
","[{""version"":""v1"",""created"":""Mon, 21 Jun 2010 10:43:17 GMT""},{""version"":""v2"",""created"":""Tue, 8 Nov 2011 10:29:34 GMT""}]","2011-11-09"
"1006.4028","Nazario Tantalo","G. M. de Divitiis, R. Petronzio and N. Tantalo","Distance preconditioning for lattice Dirac operators","5 pages, 3 figures","Phys.Lett.B692:157-160,2010","10.1016/j.physletb.2010.07.031",,"hep-lat","http://arxiv.org/licenses/nonexclusive-distrib/1.0/","  We propose a preconditioning of the Dirac operator based on the factorisation
of a predefined function related to the decay of the propagator with the
distance. We show that it can improve the accuracy of correlators involving
heavy quarks at large distances and accelerate the computation of light quark
propagators.
","[{""version"":""v1"",""created"":""Mon, 21 Jun 2010 10:44:09 GMT""}]","2014-11-21"
"1006.4029","Andreas Tilgner","S. Schmitz and A. Tilgner","Transitions in turbulent rotating Rayleigh-B\'enard convection",,,"10.1080/03091929.2010.504720",,"physics.flu-dyn physics.geo-ph","http://arxiv.org/licenses/nonexclusive-distrib/1.0/","  Numerical simulations of rotating Rayleigh-B\'enard convection are presented
for both no slip and free slip boundaries. The goal is to find a criterion
distinguishing convective flows dominated by the Coriolis force from those
nearly unaffected by rotation. If one uses heat transport as an indicator of
which regime the flow is in, one finds that the transition between the flow
regimes always occurs at the same value of a certain combination of Reynolds,
Prandtl and Ekman numbers for both boundary conditions. If on the other hand
one uses the helicity of the velocity field to identify flows nearly
independent of rotation, one finds the transition at a different location in
parameter space.
","[{""version"":""v1"",""created"":""Mon, 21 Jun 2010 10:46:58 GMT""}]","2015-05-19"
"1006.4030","Bin Wu","Bin Wu, Guido Masera","A Novel VLSI Architecture of Fixed-complexity Sphere Decoder","8 pages, this paper has been accepted by the conference DSD 2010",,,,"cs.IT math.IT","http://arxiv.org/licenses/nonexclusive-distrib/1.0/","  Fixed-complexity Sphere Decoder (FSD) is a recently proposed technique for
Multiple-Input Multiple-Output (MIMO) detection. It has several outstanding
features such as constant throughput and large potential parallelism, which
makes it suitable for efficient VLSI implementation. However, to our best
knowledge, no VLSI implementation of FSD has been reported in the literature,
although some FPGA prototypes of FSD with pipeline architecture have been
developed. These solutions achieve very high throughput but at very high cost
of hardware resources, making them impractical in real applications. In this
paper, we present a novel four-nodes-per-cycle parallel architecture of FSD,
with a breadth-first processing that allows for short critical path. The
implementation achieves a throughput of 213.3 Mbps at 400 MHz clock frequency,
at a cost of 0.18 mm2 Silicon area on 0.13{\mu}m CMOS technology. The proposed
solution is much more economical compared with the existing FPGA
implementations, and very suitable for practicl applications because of its
balanced performance and hardware-complexity; moreover it has the flexibility
to be expanded into an eight-nodes-per-cycle version in order to double the
throughput.
","[{""version"":""v1"",""created"":""Mon, 21 Jun 2010 10:55:56 GMT""}]","2010-06-22"
"1006.4031","Mattias Marklund","M. Stefan, G. Brodin, F. Haas, M. Marklund","Effects of the electron spin on the nonlinear generation of quasi-static
  magnetic fields in a plasma","12 pages",,"10.1017/S0022377810000516",,"physics.plasm-ph quant-ph","http://arxiv.org/licenses/nonexclusive-distrib/1.0/","  Through an extended kinetic model, we study the nonlinear generation of
quasi-static magnetic fields by high-frequency fields in a plasma, taking into
account the effects of the electron spin. It is found that although the largest
part of the nonlinear current in a moderate density, moderate temperature
plasma is due to the classical terms, the spin may still give a significant
contribution to the magnetic field generation mechanism. Applications of our
results are discussed.
","[{""version"":""v1"",""created"":""Mon, 21 Jun 2010 10:57:54 GMT""}]","2015-05-19"
"1006.4032","Paul Buehler","Gama Ahmed, Paul B\""uhler, Johann Marton, Ken Suzuki","Silicon photomultiplier timing performance study","Proceedings paper for SORMA 2010 conference","Nucl.Instrum.Meth.A652:528-531,2011","10.1016/j.nima.2010.08.051",,"physics.ins-det nucl-ex","http://arxiv.org/licenses/nonexclusive-distrib/1.0/","  Many characteristics of Silicon Photomultipliers can be tuned with
temperature and operation voltage. We present preliminary results of a study of
the effect of these two operation parameters on the time resolution of large
active area Multi-Pixel Photon Counters (MPPCs) manufactured by Hamamatsu.
Measurements at -10 C, 0 C, and 10 C at different bias voltages were performed.
The time resolution is best at low temperature and high over-voltage. Most
significant improvements can be achieved in cases with low number of fired
pixels (<10 pixels). Between the worst and best case among the considered
conditions a factor of 5 improvement was observed. In cases with large number
of fired pixels (>40 pixels) the effect of temperature and operation voltage
becomes smaller. The timing performance still improves with decreasing
temperature (~ factor of 2) but it hardly depends on the operation voltage. The
study shows, that especially in applications where only few photons are
available for detection a careful optimization of temperature and operation
voltage are advisable to obtain optimum timing results with the MPPC.
","[{""version"":""v1"",""created"":""Mon, 21 Jun 2010 11:05:52 GMT""}]","2011-09-23"
"1006.4033","Michael Thoennessen","S. Amos, J.L. Gross and M. Thoennessen","Discovery of Calcium, Indium, Tin, and Platinum Isotopes","to be published in At. Data Nuclear Data Tables, This updated paper
  combines manuscripts: 1004.4934 (Calcium), 1004.5266 (Indium), 1003.5127
  (Tin), and 1006.4033 (Platinum)",,"10.1016/j.adt.2011.03.001",,"nucl-ex","http://arxiv.org/licenses/nonexclusive-distrib/1.0/","  Currently, twenty-four calcium, thirty-eight indium, thirty-eight tin and
thirty-nine platinum isotopes have been observed and the discovery of these
isotopes is discussed here. For each isotope a brief synopsis of the first
refereed publication, including the production and identification method, is
presented.
","[{""version"":""v1"",""created"":""Mon, 21 Jun 2010 11:16:14 GMT""},{""version"":""v2"",""created"":""Wed, 8 Sep 2010 17:08:36 GMT""}]","2015-05-19"
"1006.4034","Reza Fareghbal","Reza Fareghbal","Hidden Conformal Symmetry of Warped AdS_3 Black Holes","12 pages; V2: references added, minor correction; V3: published
  version, minor clarification in section 3, typos corrected, one reference
  added","Phys.Lett.B694:138-142,2010","10.1016/j.physletb.2010.09.043","IPM/P-2010/023","hep-th","http://arxiv.org/licenses/nonexclusive-distrib/1.0/","  We show that for a certain low frequency limit the wave equation of a generic
massive scalar field in the background of the spacelike warped AdS_3 black hole
can be written as the Casimir of an SL(2,R) symmetry. Two sets of SL(2,R)
generators are found which uncover the hidden SL(2,R)\times SL(2,R) symmetry of
the solution. This symmetry is only locally defined and is spontaneously broken
to U(1)\times U(1) by a periodic identification of the \phi coordinate. By
using the generator of the identification we read the left and right
temperatures (T_L,T_R) of the proposed dual conformal field theory which are in
complete agreement with the WAdS/CFT conjecture. Moreover, under the above
condition of the scalar wave frequency, absorption cross section of the scalar
field is consistent with the two-point function of the dual CFT.
","[{""version"":""v1"",""created"":""Mon, 21 Jun 2010 11:19:49 GMT""},{""version"":""v2"",""created"":""Thu, 8 Jul 2010 08:01:10 GMT""},{""version"":""v3"",""created"":""Tue, 12 Oct 2010 07:09:27 GMT""}]","2014-11-21"
"1006.4035","Uwe Aickelin","Peer-Olaf Siebers, Uwe Aickelin, Helen Celia, Chris Clegg","Towards the Development of a Simulator for Investigating the Impact of
  People Management Practices on Retail Performance","24 pages, 7 figures, 6 tables, Journal of Simulation 2010",,,,"cs.AI cs.CE cs.MA","http://arxiv.org/licenses/nonexclusive-distrib/1.0/","  Often models for understanding the impact of management practices on retail
performance are developed under the assumption of stability, equilibrium and
linearity, whereas retail operations are considered in reality to be dynamic,
non-linear and complex. Alternatively, discrete event and agent-based modelling
are approaches that allow the development of simulation models of heterogeneous
non-equilibrium systems for testing out different scenarios. When developing
simulation models one has to abstract and simplify from the real world, which
means that one has to try and capture the 'essence' of the system required for
developing a representation of the mechanisms that drive the progression in the
real system. Simulation models can be developed at different levels of
abstraction. To know the appropriate level of abstraction for a specific
application is often more of an art than a science. We have developed a retail
branch simulation model to investigate which level of model accuracy is
required for such a model to obtain meaningful results for practitioners.
","[{""version"":""v1"",""created"":""Mon, 21 Jun 2010 11:23:23 GMT""}]","2010-07-05"
"1006.4036","Chaitanya Joshi","C. Joshi, A. Hutter, F. E. Zimmer, M. Jonson, E. Andersson, P. Ohberg","Quantum entanglement of nanocantilevers","10 pages, 8 figures","Phys. Rev. A 82, 043846 (2010)","10.1103/PhysRevA.82.043846",,"quant-ph","http://arxiv.org/licenses/nonexclusive-distrib/1.0/","  We propose a scheme to entangle two mechanical nanocantilevers through
indirect interactions mediated by a gas of ultra cold atoms. We envisage a
system of nanocantilevers magnetically coupled to a Bose-Einstein condensate of
atoms and focus on studying the dark states of the system. These dark states
are entangled states of the two nanocantilevers, with no coupling to the atomic
condensate. In the absence of dissipation, the degree of entanglement is found
to oscillate with time, while if dissipation is included, the system is found
to relax to a statistical mixture of dark states which remains time independent
until the inevitable thermal dephasing destroys the nanocantilever coherence.
This opens up the possibility of achieving long-lived entangled nanocantilever
states.
","[{""version"":""v1"",""created"":""Mon, 21 Jun 2010 11:24:30 GMT""},{""version"":""v2"",""created"":""Thu, 25 Nov 2010 11:21:12 GMT""}]","2015-05-19"
"1006.4037","Zengbo Wang","Zengbo Wang, Wei Guo, Lin Li, Zhu Liu, Boris Luk'yanchuk, Zaichun Chen
  and Minghui Hong","The optical microscopy with virtual image breaks a record: 50-nm
  resolution imaging is demonstrated",,"Nature Communications, 2, 218 (2012)","10.1038/ncomms1211",,"physics.optics","http://creativecommons.org/licenses/by/3.0/","  We demonstrate a new 'microsphere nanoscope' that uses ordinary SiO2
microspheres as superlenses to create a virtual image of the object in near
field. The magnified virtual image greatly overcomes the diffraction limit. We
are able to resolve clearly 50-nm objects under a standard white light source
in both transmission and reflection modes. The resolution achieved for white
light opens a new opportunity to image viruses, DNA and molecules in real time.
","[{""version"":""v1"",""created"":""Mon, 21 Jun 2010 11:25:01 GMT""}]","2012-03-21"
"1006.4038","Benjamin Lenk","Henning Ulrichs, Benjamin Lenk, Markus M\""unzenberg","Magnonic spin-wave modes in CoFeB antidot lattices","4 pages, 3 figures","Applied Physics Letters 97 (2010), 092506","10.1063/1.3483136",,"cond-mat.mtrl-sci","http://arxiv.org/licenses/nonexclusive-distrib/1.0/","  In this manuscript time-resolved magneto-optical Kerr effect experiments on
structured CoFeB films are presented. The geometries considered are two
dimensional square lattices of micrometer-sized antidots, fabricated by a
focused ion beam. The spin-wave spectra of these magnonic crystals show a novel
precessional mode, which can be related to a Bloch state at the zone boundary.
Additionally, another magnetic mode of different nature appears, whose
frequency displays no dependence on the externally applied magnetic field.
These findings are interpreted as delocalized and localized modes,
respectively.
","[{""version"":""v1"",""created"":""Mon, 21 Jun 2010 11:28:17 GMT""}]","2012-01-05"
"1006.4039","Feng Yan","Feng Yan, Shreyas Sundaram, S. V. N. Vishwanathan, Yuan Qi","Distributed Autonomous Online Learning: Regrets and Intrinsic
  Privacy-Preserving Properties","25 pages, 2 figures",,,,"cs.LG cs.AI","http://arxiv.org/licenses/nonexclusive-distrib/1.0/","  Online learning has become increasingly popular on handling massive data. The
sequential nature of online learning, however, requires a centralized learner
to store data and update parameters. In this paper, we consider online learning
with {\em distributed} data sources. The autonomous learners update local
parameters based on local data sources and periodically exchange information
with a small subset of neighbors in a communication network. We derive the
regret bound for strongly convex functions that generalizes the work by Ram et
al. (2010) for convex functions. Most importantly, we show that our algorithm
has \emph{intrinsic} privacy-preserving properties, and we prove the sufficient
and necessary conditions for privacy preservation in the network. These
conditions imply that for networks with greater-than-one connectivity, a
malicious learner cannot reconstruct the subgradients (and sensitive raw data)
of other learners, which makes our algorithm appealing in privacy sensitive
applications.
","[{""version"":""v1"",""created"":""Mon, 21 Jun 2010 11:30:06 GMT""},{""version"":""v2"",""created"":""Tue, 1 Feb 2011 03:16:12 GMT""},{""version"":""v3"",""created"":""Fri, 4 Feb 2011 16:06:35 GMT""}]","2011-02-07"
"1006.4040","Jorge Caravantes","Jorge Caravantes","Bertini-type theorems for formal functions in grassmannians","8 pages",,,,"math.AG","http://arxiv.org/licenses/nonexclusive-distrib/1.0/","  The present note generalizes Debarre's Bertini-type results for in- verse
images of Schubert varieties with the extension of formal func- tions.
","[{""version"":""v1"",""created"":""Mon, 21 Jun 2010 11:41:21 GMT""}]","2010-06-22"
"1006.4041","Dario Corradini","Dario Corradini, Sergey V. Buldyrev, Paola Gallo and H. Eugene Stanley","Effect of hydrophobic solutes on the liquid-liquid critical point","8 pages, 7 figures, 1 table. In press (Phys. Rev. E)",,"10.1103/PhysRevE.81.061504",,"cond-mat.soft","http://arxiv.org/licenses/nonexclusive-distrib/1.0/","  Jagla ramp particles, interacting through a ramp potential with two
characteristic length scales, are known to show in their bulk phase
thermodynamic and dynamic anomalies, similar to what is found in water. Jagla
particles also exhibit a line of phase transitions separating a low density
liquid phase and a high density liquid phase, terminating in a liquid-liquid
critical point in a region of the phase diagram that can be studied by
simulations. Employing molecular dynamics computer simulations, we study the
thermodynamics and the dynamics of solutions of hard spheres (HS) in a solvent
formed by Jagla ramp particles. We consider the cases of HS mole fraction x =
0.10, 0.15 and 0.20, and also the case x = 0.50 (a 1:1 mixture of HS and Jagla
particles). We find a liquid-liquid critical point, up to the highest HS mole
fraction; its position shifts to higher pressures and lower temperatures upon
increasing x. We also find that the diffusion coefficient anomalies appear to
be preserved for all the mole fractions studied.
","[{""version"":""v1"",""created"":""Mon, 21 Jun 2010 11:48:05 GMT""}]","2015-05-19"
"1006.4042","Ryo Takahasi","Tatsuo Kobayashi, Yuichiro Nakai, Ryo Takahashi","Revisiting superparticle spectra in superconformal flavor models","18 pages, 12 figures, reference added, minor corrections","JHEP 1009:093,2010","10.1007/JHEP09(2010)093","KUNS-2274, YITP-10-47","hep-ph astro-ph.CO hep-ex hep-th","http://arxiv.org/licenses/nonexclusive-distrib/1.0/","  We study superparticle spectra in the superconformal flavor scenario with
non-universal gaugino masses. The non-universality of gaugino masses can lead
to the wino-like or higgsino-like neutralino LSP. Furthermore, it is shown that
the parameter space for the higgsino-like LSP includes the region where the
fine-tuning problem can be improved. The degeneracy of soft scalar masses
squared does not drastically change by taking ratios of gaugino masses of order
one. The degeneracy of scalar masses for squarks and left-handed sleptons would
be good to avoid the FCNC problem but that of right-handed slepton masses is
weak. However, the overall size of right-handed slepton masses become larger
when the bino becomes heavier. It is also pointed out that such region can be
realized, and thus, that would be favorable to avoid the FCNC problem for soft
scalar masses as well as A-terms.
","[{""version"":""v1"",""created"":""Mon, 21 Jun 2010 11:48:06 GMT""},{""version"":""v2"",""created"":""Sun, 29 Aug 2010 10:12:02 GMT""}]","2014-11-21"
