"1006.4043","Marco Vignati","M. Vignati","Model of the response function of large mass bolometric detectors","7 pages, 13 figures. Changes wrt v1: two columns layout, corrected
  typos, increase of plot labels font, fixes in bibliography","J.Appl.Phys.108:084903,2010","10.1063/1.3498808",,"physics.ins-det nucl-ex","http://arxiv.org/licenses/nonexclusive-distrib/1.0/","  Large mass bolometers are used in particle physics experiments to search for
rare processes. By operating at low temperature, they are able to detect
particle energies from few keV up to several MeV, measuring the temperature
rise produced by the energy released. This study was performed on the
bolometers of the CUORE experiment. The response function of these detectors is
not linear in the energy range of interest, and it changes with the operating
temperature. The non-linearity is found to be dominated by the thermistor and
its biasing circuit. A method to obtain a linear response is the result of this
work. It allows a great simplification of the data analysis.
","[{""version"":""v1"",""created"":""Mon, 21 Jun 2010 11:54:45 GMT""},{""version"":""v2"",""created"":""Sat, 16 Oct 2010 08:15:44 GMT""}]","2010-10-27"
"1006.4044","David Kyed","David Kyed and Piotr M. So{\l}tan","Property (T) and exotic quantum group norms","20 pages",,,,"math.OA","http://arxiv.org/licenses/nonexclusive-distrib/1.0/","  Utilizing the notion of property (T) we construct new examples of quantum
group norms on the polynomial algebra of a compact quantum group, and provide
criteria ensuring that these are not equal to neither the minimal nor the
maximal norm. Along the way we generalize several classical operator algebraic
characterizations of property (T) to the quantum group setting which unify
recent approaches to property (T) for quantum groups with previous ones. The
techniques developed furthermore provide tools to answer two open problems;
firstly a question by B\'edos, Murphy and Tuset about automatic continuity of
the comultiplication and secondly a problem left open by Woronowicz regarding
the structure of elements whose coproduct is a finite sum of simple tensors.
","[{""version"":""v1"",""created"":""Mon, 21 Jun 2010 11:55:31 GMT""}]","2010-06-22"
"1006.4045","Francois Arleo","Francois Arleo, Stanley J. Brodsky, Dae Sung Hwang, Anne M. Sickles","Higher-twist contributions to large pT hadron production in hadronic
  collisions","4 pages, 2 figures. Talk given at the 45th Rencontres de Moriond QCD
  and High Energy Interactions, La Thuile, Italy, 13-20 March 2010",,,"LAPTH-021/10, SLAC-PUB-14180, CP3-Origins-2010-23","hep-ph hep-ex","http://arxiv.org/licenses/nonexclusive-distrib/1.0/","  The scaling behavior of large-pT hadron production in hadronic collisions is
investigated. A significant deviation from the NLO QCD predictions is reported,
especially at high values of xT=2pT/sqrt(s). In contrast, the prompt photon and
jet production data prove in agreement with leading-twist expectations. These
results are interpreted as coming from a non-negligible contribution of
higher-twist processes, where the hadron is produced directly in the hard
subprocess. Predictions for scaling exponents at RHIC are successfully compared
to PHENIX preliminary measurements. We suggest to trigger on isolated large-pT
hadron production to enhance higher-twist processes, and point that the use of
isolated hadrons as a signal for new physics at colliders can be affected by
the presence of direct hadron production processes.
","[{""version"":""v1"",""created"":""Mon, 21 Jun 2010 12:07:29 GMT""}]","2010-06-22"
"1006.4046","Benjamin Recht","Laura Balzano and Robert Nowak and Benjamin Recht","Online Identification and Tracking of Subspaces from Highly Incomplete
  Information",,,,,"cs.IT cs.SY math.IT math.OC stat.ML","http://arxiv.org/licenses/nonexclusive-distrib/1.0/","  This work presents GROUSE (Grassmanian Rank-One Update Subspace Estimation),
an efficient online algorithm for tracking subspaces from highly incomplete
observations. GROUSE requires only basic linear algebraic manipulations at each
iteration, and each subspace update can be performed in linear time in the
dimension of the subspace. The algorithm is derived by analyzing incremental
gradient descent on the Grassmannian manifold of subspaces. With a slight
modification, GROUSE can also be used as an online incremental algorithm for
the matrix completion problem of imputing missing entries of a low-rank matrix.
GROUSE performs exceptionally well in practice both in tracking subspaces and
as an online algorithm for matrix completion.
","[{""version"":""v1"",""created"":""Mon, 21 Jun 2010 12:12:27 GMT""},{""version"":""v2"",""created"":""Tue, 12 Jul 2011 20:19:54 GMT""}]","2011-07-14"
"1006.4047","Raphael Roux","Benjamin Jourdain (CERMICS), Rapha\""el Roux (CERMICS)","Convergence of a stochastic particle approximation for fractional scalar
  conservation laws",,,,,"math.PR math.AP","http://arxiv.org/licenses/nonexclusive-distrib/1.0/","  We give a probabilistic numerical method for solving a partial differential
equation with fractional diffusion and nonlinear drift. The probabilistic
interpretation of this equation uses a system of particles driven by L\'evy
alpha-stable processes and interacting with their drift through their empirical
cumulative distribution function. We show convergence to the solution for the
associated Euler scheme.
","[{""version"":""v1"",""created"":""Mon, 21 Jun 2010 12:17:49 GMT""}]","2010-07-26"
"1006.4048","Thibaut Allemand","Thibaut Allemand (DMA)","The incompressible Euler limit of the Boltzmann equation for a gas of
  fermions","25 pages",,,,"math.AP","http://arxiv.org/licenses/nonexclusive-distrib/1.0/","  We are interested in the hydrodynamic limit of the Boltzmann equation for a
gas of fermions in the incompressible Euler regime. We use the relative entropy
method as improved by Saint-Raymond. Our result is analogous to what is
obtained in the classical case, but the treatment is slightly complicated by
the cubic nonlinearity of the collision operator.
","[{""version"":""v1"",""created"":""Mon, 21 Jun 2010 12:19:17 GMT""},{""version"":""v2"",""created"":""Tue, 22 Jun 2010 15:23:26 GMT""},{""version"":""v3"",""created"":""Wed, 15 Sep 2010 05:07:49 GMT""},{""version"":""v4"",""created"":""Sat, 13 Aug 2011 06:56:54 GMT""}]","2011-08-16"
"1006.4049","Laurent Sanchez-Palencia","Luca Pezz\'e (LCFIO), Laurent Sanchez-Palencia (LCFIO)","Localized and extended states in a disordered trap","Published version","Physical Review Letters 106 (2011) 040601","10.1103/PhysRevLett.106.040601",,"cond-mat.other","http://arxiv.org/licenses/nonexclusive-distrib/1.0/","  We study Anderson localization in a disordered potential combined with an
inhomogeneous trap. We show that the spectrum displays both localized and
extended states, which coexist at intermediate energies. In the region of
coexistence, we find that the extended states result from confinement by the
trap and are weakly affected by the disorder. Conversely, the localized states
correspond to eigenstates of the disordered potential, which are only affected
by the trap via an inhomogeneous energy shift. These results are relevant to
disordered quantum gases and we propose a realistic scheme to observe the
coexistence of localized and extended states in these systems.
","[{""version"":""v1"",""created"":""Mon, 21 Jun 2010 12:20:59 GMT""},{""version"":""v2"",""created"":""Wed, 26 Jan 2011 09:07:14 GMT""}]","2015-05-19"
"1006.4050","Alain Thomas","Alain Thomas (LATP)","Infinite products of nonnegative $2\times2$ matrices by nonnegative
  vectors","8 pages",,,,"math.RA","http://arxiv.org/licenses/nonexclusive-distrib/1.0/","  Given a finite set $\{M_0,\dots,M_{d-1}\}$ of nonnegative $2\times 2$
matrices and a nonnegative column-vector $V$, we associate to each
$(\omega_n)\in\{0,\dots,d-1\}^\mathbb N$ the sequence of the column-vectors
$\displaystyle{M_{\omega_1}\dots M_{\omega_n}V\over\Vert M_{\omega_1}\dots
M_{\omega_n}V\Vert}$. We give the necessary and sufficient condition on the
matrices $M_k$ and the vector $V$ for this sequence to converge for all
\hbox{$(\omega_n)\in\{0,\dots,d-1\}^\mathbb N$} such that $\forall n,\
M_{\omega_1}\dots M_{\omega_n}V\ne\begin{pmatrix}0\\0\end{pmatrix}$.
","[{""version"":""v1"",""created"":""Mon, 21 Jun 2010 12:22:00 GMT""}]","2010-06-22"
"1006.4051","Stephane Le Borgne","Jean-Pierre Conze (IRMAR), St\'ephane Le Borgne (IRMAR), Mika\""el
  Roger (IRMAR)","Central limit theorem for products of toral automorphisms",,,,,"math.PR","http://arxiv.org/licenses/nonexclusive-distrib/1.0/","  Let $(\tau_n)$ be a sequence of toral automorphisms $\tau_n : x \rightarrow
A_n x \hbox{mod}\ZZ^d$ with $A_n \in {\cal A}$, where ${\cal A}$ is a finite
set of matrices in $SL(d, \mathbb{Z})$. Under some conditions the method of
""multiplicative systems"" of Koml\`os can be used to prove a Central Limit
Theorem for the sums $\sum_{k=1}^n f(\tau_k \circ \tau_{k-1} \cdots \circ
\tau_1 x)$ if $f$ is a H\""older function on $\mathbb{T}^d$. These conditions
hold for $2\times 2$ matrices with positive coefficients. In dimension $d$ they
can be applied when $A_n= A_n(\omega)$, with independent choices of
$A_n(\omega)$ in a finite set of matrices $\in SL(d, \mathbb{Z})$, in order to
prove a ""quenched"" CLT.
","[{""version"":""v1"",""created"":""Mon, 21 Jun 2010 12:23:49 GMT""}]","2010-06-22"
"1006.4052","Sylvain Nascimbene","Sylvain Nascimb\`ene (LKB - Lhomond), Nir Navon (LKB - Lhomond),
  Fr\'ed\'eric Chevy (LKB - Lhomond), C. Salomon (LKB - Lhomond)","The equation of state of ultracold Bose and Fermi gases: a few examples","14 pages, 6 figures","New Journal of Physics 12 (2010) 103026","10.1088/1367-2630/12/10/103026",,"cond-mat.quant-gas","http://arxiv.org/licenses/nonexclusive-distrib/1.0/","  We describe a powerful method for determining the equation of state of an
ultracold gas from in situ images. The method provides a measurement of the
local pressure of an harmonically trapped gas and we give several applications
to Bose and Fermi gases. We obtain the grand-canonical equation of state of a
spin-balanced Fermi gas with resonant interactions as a function of
temperature. We compare our equation of state with an equation of state
measured by the Tokyo group, that reveals a significant difference in the
high-temperature regime. The normal phase, at low temperature, is well
described by a Landau Fermi liquid model, and we observe a clear thermodynamic
signature of the superfluid transition. In a second part we apply the same
procedure to Bose gases. From a single image of a quasi ideal Bose gas we
determine the equation of state from the classical to the condensed regime.
Finally the method is applied to a Bose gas in a 3D optical lattice in the Mott
insulator regime. Our equation of state directly reveals the Mott insulator
behavior and is suited to investigate finite-temperature effects.
","[{""version"":""v1"",""created"":""Mon, 21 Jun 2010 12:24:41 GMT""}]","2015-05-19"
"1006.4053","Elisabeth Rieper","Elisabeth Rieper, Janet Anders, Vlatko Vedral","Quantum entanglement between the electron clouds of nucleic acids in DNA","7 pages, 4 figures, extended version",,,,"quant-ph","http://arxiv.org/licenses/nonexclusive-distrib/1.0/","  We model the electron clouds of nucleic acids in DNA as a chain of coupled
quantum harmonic oscillators with dipole-dipole interaction between nearest
neighbours resulting in a van der Waals type bonding. Crucial parameters in our
model are the distances between the acids and the coupling between them, which
we estimate from numerical simulations [1]. We show that for realistic
parameters nearest neighbour entanglement is present even at room temperature.
We quantify the amount of entanglement in terms of negativity and single base
von Neumann entropy. We find that the strength of the single base von Neumann
entropy depends on the neighbouring sites, thus questioning the notion of
treating single bases as logically independent units. We derive an analytical
expression for the binding energy of the coupled chain in terms of entanglement
and show the connection between entanglement and correlation energy, a quantity
commonly used in quantum chemistry.
","[{""version"":""v1"",""created"":""Mon, 21 Jun 2010 12:32:59 GMT""},{""version"":""v2"",""created"":""Wed, 23 Feb 2011 04:30:41 GMT""}]","2011-02-24"
"1006.4054","Christophe Vignat","A. Chevreuil, A. Plastino and C. Vignat","On a conjecture about Dirac's delta representation using q-exponentials",,,"10.1063/1.3478886",,"math-ph math.MP","http://arxiv.org/licenses/nonexclusive-distrib/1.0/","  A new representation of Dirac's delta-distribution, based on the so-called
q-exponentials, has been recently conjectured. We prove here that this
conjecture is indeed valid.
","[{""version"":""v1"",""created"":""Mon, 21 Jun 2010 12:39:44 GMT""}]","2015-05-19"
"1006.4055","M. Ebrahim Fouladvand","Yousef Jamali, M. Ebrahim Foulaadvand and H. Rafii Tabar","Computational modelling of the collective stochastic motion of Kinesin
  nano motors","8 pages, 14 eps figures","Journal of Theoretical and Computational Nano Sciences, Vol 7,
  pages 146-152, 2010",,"12345","cond-mat.soft physics.bio-ph q-bio.SC","http://arxiv.org/licenses/nonexclusive-distrib/1.0/","  We have developed a two dimensional stochastic molecular dynamics model for
the description of intra cellular collective motion of bio motors, in
particular Kinesins, on a microtubular track. The model is capable or
reproducing the hand-over-hand mechanism of the directed motion along the
microtubule. The model gives the average directed velocity and the current of
Kinesins along the microtubule. It is shown that beyond a certain density of
Kinesins, the average velocity and current undergo notable decrease which is
due to formation of traffic jams in the system.
","[{""version"":""v1"",""created"":""Mon, 21 Jun 2010 12:42:09 GMT""}]","2010-06-22"
"1006.4056","Reinado de Carvalho R","F. La Barbera, R.R. de Carvalho, I.G. de la Rosa, R.R. Gal, R.
  Swindle, P.A.A. Lopes","SPIDER - IV. Optical and NIR color gradients in Early-type galaxies: New
  Insights into Correlations with Galaxy Properties","Accepted for Publication in the Astronomical Journal",,"10.1088/0004-6256/140/5/1528",,"astro-ph.CO","http://arxiv.org/licenses/nonexclusive-distrib/1.0/","  We present an analysis of stellar population gradients in 4,546 Early-Type
Galaxies with photometry in $grizYHJK$ along with optical spectroscopy. A new
approach is described which utilizes color information to constrain age and
metallicity gradients. Defining an effective color gradient, $\nabla_{\star}$,
which incorporates all of the available color indices, we investigate how
$\nabla_{\star}$ varies with galaxy mass proxies, i.e. velocity dispersion,
stellar (M_star) and dynamical (M_dyn) masses, as well as age, metallicity, and
alpha/Fe. ETGs with M_dyn larger than 8.5 x 10^10, M_odot have increasing age
gradients and decreasing metallicity gradients wrt mass, metallicity, and
enhancement. We find that velocity dispersion and alpha/Fe are the main drivers
of these correlations. ETGs with 2.5 x 10^10 M_odot =< M_dyn =< 8.5 x 10^10
M_odot, show no correlation of age, metallicity, and color gradients wrt mass,
although color gradients still correlate with stellar population parameters,
and these correlations are independent of each other. In both mass regimes, the
striking anti-correlation between color gradient and alpha-enhancement is
significant at \sim 4sigma, and results from the fact that metallicity gradient
decreases with alpha/Fe. This anti-correlation may reflect the fact that star
formation and metallicity enrichment are regulated by the interplay between the
energy input from supernovae, and the temperature and pressure of the hot X-ray
gas in ETGs. For all mass ranges, positive age gradients are associated with
old galaxies (>5-7 Gyr). For galaxies younger than \sim 5 Gyr, mostly at
low-mass, the age gradient tends to be anti-correlated with the Age parameter,
with more positive gradients at younger ages.
","[{""version"":""v1"",""created"":""Mon, 21 Jun 2010 12:44:27 GMT""},{""version"":""v2"",""created"":""Wed, 15 Sep 2010 14:52:23 GMT""},{""version"":""v3"",""created"":""Fri, 17 Sep 2010 15:22:18 GMT""}]","2015-05-19"
"1006.4057","Christoph Lange","Christoph Lange","Towards OpenMath Content Dictionaries as Linked Data","Presented at the OpenMath Workshop 2010, http://cicm2010.cnam.fr/om/",,,,"cs.DL cs.MS","http://creativecommons.org/licenses/by-nc-sa/3.0/","  ""The term 'Linked Data' refers to a set of best practices for publishing and
connecting structured data on the web"". Linked Data make the Semantic Web work
practically, which means that information can be retrieved without complicated
lookup mechanisms, that a lightweight semantics enables scalable reasoning, and
that the decentral nature of the Web is respected. OpenMath Content
Dictionaries (CDs) have the same characteristics - in principle, but not yet in
practice. The Linking Open Data movement has made a considerable practical
impact: Governments, broadcasting stations, scientific publishers, and many
more actors are already contributing to the ""Web of Data"". Queries can be
answered in a distributed way, and services aggregating data from different
sources are replacing hard-coded mashups. However, these services are currently
entirely lacking mathematical functionality. I will discuss real-world
scenarios, where today's RDF-based Linked Data do not quite get their job done,
but where an integration of OpenMath would help - were it not for certain
conceptual and practical restrictions. I will point out conceptual shortcomings
in the OpenMath 2 specification and common bad practices in publishing CDs and
then propose concrete steps to overcome them and to contribute OpenMath CDs to
the Web of Data.
","[{""version"":""v1"",""created"":""Mon, 21 Jun 2010 13:00:22 GMT""}]","2010-06-22"
"1006.4058","Hui Shi","Hui Shi, Jun-Hui Zhao, Jinlin Han","A bipolar outflow from the massive protostellar core W51e2-E","5 pages, 2 figures, 1 table, accepted for publication in ApJL. v2:
  some typos corrected","Astrophysical Journal Letters 718 (2010) L181-L184","10.1088/2041-8205/718/2/L181",,"astro-ph.SR","http://arxiv.org/licenses/nonexclusive-distrib/1.0/","  We present high resolution images of the bipolar outflow from W51e2, which
are produced from the Submillimeter Array archival data observed for CO(3-2)
and HCN(4-3) lines with angular resolutions of 0.8"" x 0.6"" and 0.3"" x 0.2"",
respectively. The images show that the powerful outflow originates from the
protostellar core W51e2-E rather than from the ultracompact HII region W51e2-W.
The kinematic timescale of the outflow from W51e2-E is about 1000 yr, younger
than the age (~5000 yr) of the ultracompact HII region W51e2-W. A large mass
loss rate of ~1 x 10^{-3} M_sun yr^{-1} and a high mechanical power of 120
L_sun are inferred, suggesting that an O star or a cluster of B stars are
forming in W51e2-E. The observed outflow activity along with the inferred large
accretion rate indicates that at present W51e2-E is in a rapid phase of star
formation.
","[{""version"":""v1"",""created"":""Mon, 21 Jun 2010 13:04:21 GMT""},{""version"":""v2"",""created"":""Fri, 2 Jul 2010 04:12:26 GMT""},{""version"":""v3"",""created"":""Sun, 18 Jul 2010 05:52:55 GMT""}]","2010-07-20"
"1006.4059","Luca Rizzi","Luca Rizzi, Sergio Cacciatori, Vittorio Gorini, Alexander Kamenshchik,
  Oliver F. Piattella","Dark matter effects in vacuum spacetime","5 pages, 2 figures, expanded with comments about the exact motion and
  curvature invariants","Phys.Rev.D82:027301,2010","10.1103/PhysRevD.82.027301",,"gr-qc physics.gen-ph","http://arxiv.org/licenses/nonexclusive-distrib/1.0/","  We analyze a toy model describing an empty spacetime in which the motion of a
test mass (and the trajectories of photons) evidence the presence of a
continuous and homogeneous distribution of matter; however, since the
energy-momentum tensor vanishes, no real matter or energy distribution is
present at all. Thus, a hypothetical observer will conclude that he is immersed
in some sort of dark matter, even though he has no chance to directly detect
it. This suggests yet another possibility of explaining the elusive dark matter
as a purely dynamical effect due to the curvature of spacetime.
","[{""version"":""v1"",""created"":""Mon, 21 Jun 2010 13:08:13 GMT""},{""version"":""v2"",""created"":""Tue, 27 Jul 2010 18:07:20 GMT""}]","2014-11-21"
"1006.4060","Elisabeth Reiger","Benedikt Bauer, Andreas Rudolph, Marcello Soda, Anna Fontcuberta i
  Morral, Josef Zweck, Dieter Schuh and Elisabeth Reiger","Position controlled self-catalyzed growth of GaAs nanowires by molecular
  beam epitaxy","9 pages, 4 figures","Nanotechnology 21 (2010) 435601","10.1088/0957-4484/21/43/435601",,"cond-mat.mes-hall","http://arxiv.org/licenses/nonexclusive-distrib/1.0/","  GaAs nanowires are grown by molecular beam epitaxy using a self-catalyzed,
Ga-assisted growth technique. Position control is achieved by nano-patterning a
SiO2 layer with arrays of holes with a hole diameter of 85 nm and a hole pitch
varying between 200 nm and 2 \mum. Gallium droplets form preferentially at the
etched holes acting as catalyst for the nanowire growth. The nanowires have
hexagonal cross-sections with {110} side facets and crystallize predominantly
in zincblende. The interdistance dependence of the nanowire growth rate
indicates a change of the III/V ratio towards As-rich conditions for large hole
distances inhibiting NW growth.
","[{""version"":""v1"",""created"":""Mon, 21 Jun 2010 13:09:38 GMT""},{""version"":""v2"",""created"":""Fri, 20 Aug 2010 11:48:01 GMT""}]","2010-10-06"
"1006.4061","Li Shanshan","Jiang Hongyuan, Li Shanshan, Ren Yukun, and Jie (Jayne) Wu","Electric-triple-layer model based AC electroosmosis flow","authors erro, withdraw",,,,"physics.class-ph","http://arxiv.org/licenses/nonexclusive-distrib/1.0/","  The paper presents an novel electric triple layer(ETL) model as an improved
model of electrical double layer(EDL) to predict electroosmosis flow rate on
the electrode surface at low frequency. The predicted slip velocity based on
classical EDL theory is much higher than experimental results, and ETL model
can account for this deviation. Cross-over frequency at which the maximum
electroosmosis flow velocity occurs based on ETL model is a little bit higher
than that predicted in EDL theory, but still in keeping with classical
prediction. Influences of triple layer thickness and electrode surface
roughness on electroosmosis flow are analyzed via simulation and theoretical
analysis agrees with experimental data very well, proving its validity.
","[{""version"":""v1"",""created"":""Mon, 21 Jun 2010 13:11:17 GMT""},{""version"":""v2"",""created"":""Tue, 22 Jun 2010 01:29:03 GMT""},{""version"":""v3"",""created"":""Wed, 25 Aug 2010 01:36:32 GMT""},{""version"":""v4"",""created"":""Thu, 2 Feb 2012 18:55:25 GMT""}]","2012-02-03"
"1006.4062","Aleksi Vuorinen","Aleksi Kurkela, Paul Romatschke, Aleksi Vuorinen, Bin Wu","Looking inside neutron stars: Microscopic calculations confront
  observations","4 pages, 4 figures",,,"BI-TP 2010/17, INT PUB 10-025","astro-ph.HE hep-ph nucl-th","http://arxiv.org/licenses/nonexclusive-distrib/1.0/","  While QCD appears not to be accurately solvable in the regime of interest for
neutron star physics, microscopic calculations are feasible at both low and
very high densities. In this work, we propose using the most realistic
calculations in these two regimes of nuclear physics and perturbative QCD, and
construct equations of state by matching the results requiring thermodynamic
consistency. We find that the resulting equations of state --- in contrast to
several hadronic ones --- are able to reproduce current observational data on
neutron stars without any fine tuning, and allow stable hybrid stars with
masses up to 2.1M_{sun}. Using recent observations of star radii, we perform a
maximum likelihood analysis to further constrain the equation of state, and in
addition show that the effects of rotation on radii and masses should not be
neglected in future precision studies.
","[{""version"":""v1"",""created"":""Mon, 21 Jun 2010 13:13:09 GMT""}]","2010-06-22"
"1006.4063","Vasileios Iliopoulos MR","Vasileios Iliopoulos and David Penman","Variance of the number of Comparisons of Randomized Quicksort","20 pages. We do not intend to submit this elsewhere",,,,"math.PR","http://arxiv.org/licenses/nonexclusive-distrib/1.0/","  This paper gives a straightforward self-contained proof of the formula for
the variance of the number of comparisons used by the Quicksort sorting
algorithm when pivots are chosen uniformly at random. The result has been known
for some time but we had not found a single source giving all details of the
argument in a self-contained and explicit way. We hope these details may be of
interest to students and others wishing to understand this calculation. No
originality is claimed for the result.
","[{""version"":""v1"",""created"":""Mon, 21 Jun 2010 13:23:02 GMT""}]","2010-06-22"
