"1006.3982","David Webber","David M. Webber","Toward a sub-ppm measurement of the Fermi constant","MORIOND Electroweak 2010 proceedings, for the MuLan Collaboration",,,,"hep-ex","http://arxiv.org/licenses/nonexclusive-distrib/1.0/","  The Fermi constant, G_F, describes the strength of the weak force and is
determined most precisely from the mean life of the positive muon, tau_mu.
Advances in theory have reduced the theoretical uncertainty on G_F as
calculated from tau_mu to a few tenths of a part per million (ppm). The
remaining uncertainty on G_F is entirely experimental, and is dominated by the
uncertainty on tau_mu. The MuLan experiment is designed to measure the muon
lifetime to part-per-million precision, a better-than twenty-fold improvement
over the previous generation of experiments. In 2007, we reported an
intermediate result, tau_mu=2.197013(24) microseconds (11 ppm), which is in
excellent agreement with the previous world average. This mean life was
measured using a pulsed surface muon beam stopped in a ferromagnetic target,
surrounded by a symmetric scintillator detector array. Since this intermediate
measurement, the detector was instrumented with waveform digitizers, the muon
beam rate and beam extinction were increased, and two data sets were acquired
on different targets, each containing over 10^12 muon decays. These data will
lead to a new determination of G_F to better than a part per million.
","[{""version"":""v1"",""created"":""Mon, 21 Jun 2010 03:16:21 GMT""}]","2010-06-22"
"1006.3983","Fenghui Zhang","F. Zhang, L. Li, Z. Han","The Influence of Binary Interactions in Infrared passbands of
  populations","15 pages, 15 figures","MNRAS Volume 396 Issue 1, Pages 276 - 290 2009","10.1111/j.1365-2966.2008.14280.x",,"astro-ph.SR","http://arxiv.org/licenses/nonexclusive-distrib/1.0/","  In our evolutionary population synthesis models, the samples of binaries are
reproduced by the 'patched' Monte Carlo simulation and the stellar masses,
integrated J, H, K, L, L2 and M magnitudes, mass-to-light ratios and broad
colours involving infrared bands are presented, for an extensive set of
instantaneous-burst binary stellar populations. In addition, the fluctuations
in the integrated colours, which have been given by Zhang et al. (2005), are
reduced.
  By comparing the results for binary stellar populations with (Model A) and
without (Model B) binary interactions we show that the inclusion of binary
interactions makes the stellar mass of a binary stellar population smaller
(~3.6-4.5% during the past 15Gyr); magnitudes greater (except U, ~0.18mag at
the most); colours smaller (~0.15mag for V-K at the most); the mass-to-light
ratios greater (~0.06 for K-band) except those in the U and B passbands at
higher metallicities. And, Binary interactions make the V magnitude less
sensitive to age, R and I magnitudes more sensitive to metallicity.
  Given an age, the absolute values of the differences in the stellar mass,
magnitudes, mass-to-light ratios (except those in the U and B bands) between
Models A and B reach the maximum at Z=0.0001, i.e., the effects of binary
interactions on these parameters reach the maximum, while the differences in
some colours reach the maximum at Z ~0.01-0.0004. On the contrary, the absolute
value of the difference in the stellar mass is minimal at Z=0.03, those in the
U,B,V magnitudes and the mass-to-light ratios in the U and B bands reach the
minimum at Z ~0.01-0.004.
","[{""version"":""v1"",""created"":""Mon, 21 Jun 2010 03:22:08 GMT""},{""version"":""v2"",""created"":""Wed, 23 Jun 2010 04:34:45 GMT""}]","2010-06-24"
"1006.3984","Shingo Saito","Shingo Saito, Tatsushi Tanaka, and Noriko Wakabayashi","Combinatorial remarks on the cyclic sum formula for multiple zeta values","20 pages","Journal of Integer Sequences, vol. 14 (2011), Article 11.2.4",,,"math.NT math.CO","http://arxiv.org/licenses/nonexclusive-distrib/1.0/","  The multiple zeta values are generalizations of the values of the Riemann
zeta function at positive integers. They are known to satisfy a number of
relations, among which are the cyclic sum formula. The cyclic sum formula can
be stratified via linear operators defined by the second and third authors. We
give the number of relations belonging to each stratum by combinatorial
arguments.
","[{""version"":""v1"",""created"":""Mon, 21 Jun 2010 04:07:45 GMT""}]","2011-03-11"
"1006.3985","Haining Li","H. N. Li, N. Christlieb, T. Sch\""orck, J. E. Norris, M. S. Bessell, D.
  Yong, T. C. Beers, Y. S. Lee, A. Frebel, and G. Zhao","The stellar content of the Hamburg/ESO survey VI. The metallicity
  distribution of main-sequence turnoff stars in the Galactic halo","10 pages, 11 figures, accepted for publication in A&A",,"10.1051/0004-6361/201014797",,"astro-ph.GA","http://creativecommons.org/licenses/by-nc-sa/3.0/","  We determine the metallicity distribution function (MDF) of the Galactic halo
based on metal-poor main-sequence turnoff-stars (MSTO) which were selected from
the Hamburg/ESO objective-prism survey (HES) database. Corresponding follow-up
moderateresolution observations (R ~ 2000) of some 682 stars (among which 617
were accepted program stars) were carried out with the 2.3m telescope at the
Siding Spring Observatory (SSO). Corrections for the survey volume covered by
the sample stars were quantitatively estimated and applied to the observed MDF.
The corrections are quite small, when compared with those for a previously
studied sample of metal-poor giants. The corrected observational MDF of the
turnoff sample was then compared with that of the giants, as well as with a
number of theoretical predictions of Galactic chemical evolution, including the
mass-loss modified Simple Model. Although the survey-volume corrected MDFs of
the metal-poor turnoff and the halo giants notably differ in the region of
[Fe/H] > -2.0, below [Fe/H] ~ -2.0, (the region we scientifically focus on
most) both MDFs show a sharp drop at [Fe/H] ~ -3.6 and present rather similar
distributions in the low-metallicity tail. Theoretical models can fit some
parts of the observed MDF, but none is found to simultaneously reproduce the
peak as well as the features in the metal-poor region with [Fe/H] between -2.0
to -3.6. Among the tested models only the GAMETE model, when normalized to the
tail of the observed MDF below [Fe/H] ~ -3.0, and with Z_{cr} =
10^{-3.4}Z_{\odot}, is able to predict the sharp drop at [Fe/H] ~ -3.6.
","[{""version"":""v1"",""created"":""Mon, 21 Jun 2010 04:45:58 GMT""},{""version"":""v2"",""created"":""Tue, 22 Jun 2010 04:22:25 GMT""}]","2015-05-19"
"1006.3986","Teddy Cheung","The Fermi-LAT Collaboration","Fermi Gamma-ray Imaging of a Radio Galaxy","27 pages, includes Supplementary Online Material; corresponding
  authors: C.C. Cheung, Y. Fukazawa, J. Knodlseder, L. Stawarz","Science 328:725-729, 2010","10.1126/science.1184656",,"astro-ph.HE astro-ph.CO","http://arxiv.org/licenses/nonexclusive-distrib/1.0/","  The Fermi Gamma-ray Space Telescope has detected the gamma-ray glow emanating
from the giant radio lobes of the radio galaxy Centaurus A. The resolved
gamma-ray image shows the lobes clearly separated from the central active
source. In contrast to all other active galaxies detected so far in high-energy
gamma-rays, the lobe flux constitutes a considerable portion (>1/2) of the
total source emission. The gamma-ray emission from the lobes is interpreted as
inverse Compton scattered relic radiation from the cosmic microwave background
(CMB), with additional contribution at higher energies from the
infrared-to-optical extragalactic background light (EBL). These measurements
provide gamma-ray constraints on the magnetic field and particle energy content
in radio galaxy lobes, and a promising method to probe the cosmic relic photon
fields.
","[{""version"":""v1"",""created"":""Mon, 21 Jun 2010 04:55:36 GMT""}]","2010-06-22"
"1006.3987","Thomas Sch\""urmann","Thomas Sch\""urmann","A note on entropic uncertainty relations of position and momentum","2 pages, 2 figures, 2 references added","Journal of Russian Laser Research, January 2012, Vol. 33, Issue 1,
  Pages 52-54","10.1007/s10946-012-9258-y",,"quant-ph","http://arxiv.org/licenses/nonexclusive-distrib/1.0/","  We consider two entropic uncertainty relations of position and momentum
recently discussed in literature. By a suitable rescaling of one of them, we
obtain a smooth interpolation of both for high-resolution and low-resolution
measurements respectively. Because our interpolation has never been mentioned
in literature before, we propose it as a candidate for an improved entropic
uncertainty relation of position and momentum. Up to now, the author has
neither been able to falsify nor prove the new inequality. In our opinion it is
a challenge to do either one.
","[{""version"":""v1"",""created"":""Mon, 21 Jun 2010 05:12:50 GMT""},{""version"":""v2"",""created"":""Fri, 25 Jun 2010 20:27:04 GMT""},{""version"":""v3"",""created"":""Tue, 20 Dec 2011 17:44:52 GMT""},{""version"":""v4"",""created"":""Fri, 2 Mar 2012 04:39:39 GMT""}]","2015-10-27"
"1006.3988","Fei Zhou","Fei Zhou and Vidvuds Ozoli\c{n}\v{s}","Crystal field and magnetic structure of UO$_{2}$","16 pages, 4 figures, 3 tables. To appear in PRB","Phys. Rev. B 83, 085106 (2011)","10.1103/PhysRevB.83.085106",,"cond-mat.str-el cond-mat.mtrl-sci","http://arxiv.org/licenses/nonexclusive-distrib/1.0/","  The properties of UO$_{2}$ result from rich $f$-electron physics, including
electronic Coulomb interactions, spin-orbit and crystal field effects, as well
as inter-ionic multipolar coupling. We present a comprehensive theoretical
study of the electronic structure of UO$_{2}$ using a combined application of
self-consistent DFT+$U$ calculations and a model Hamiltonian. The $\Gamma_{5}$
ground state of U$^{4+}$ and the energies of crystal field excitations
$\Gamma_{5} \rightarrow \Gamma_{3,4,1}$ are reproduced in very good agreement
with experiment. We also investigate competing non-collinear magnetic
structures and confirm 3-k as the T=0 K ground state magnetic structure of
UO$_2$.
","[{""version"":""v1"",""created"":""Mon, 21 Jun 2010 05:40:49 GMT""},{""version"":""v2"",""created"":""Wed, 12 Jan 2011 21:48:57 GMT""}]","2015-11-17"
"1006.3989","Alastair Abbott","Alastair A. Abbott","De-quantisation of the Quantum Fourier Transform","14 pages. Belatedly updated to published version","Applied Mathematics and Computation 219, 3 (2012)","10.1016/j.amc.2011.06.057","CDMTCS Research Report 387","quant-ph","http://arxiv.org/licenses/nonexclusive-distrib/1.0/","  The quantum Fourier transform (QFT) plays an important role in many known
quantum algorithms such as Shor's algorithm for prime factorisation. In this
paper we show that the QFT algorithm can, on a restricted set of input states,
be de-quantised into a classical algorithm which is both more efficient and
simpler than the quantum algorithm. By working directly with the algorithm
instead of the circuit, we develop a simple classical version of the quantum
basis-state algorithm. We formulate conditions for a separable state to remain
separable after the QFT is performed, and use these conditions to extend the
de-quantised algorithm to work on all such states without loss of efficiency.
Our technique highlights the linearity of quantum mechanics as the fundamental
feature accounting for the difference between quantum and de-quantised
algorithms, and that it is this linearity which makes the QFT such a useful
tool in quantum computation.
","[{""version"":""v1"",""created"":""Mon, 21 Jun 2010 05:52:21 GMT""},{""version"":""v2"",""created"":""Fri, 24 Jan 2020 09:05:34 GMT""}]","2020-01-27"
"1006.3990","Mariano Trigo","M. Trigo, Y. M Sheu, J. Chen, V. H. Vishwanath, T. Graber, R. Henning
  and D. A. Reis","Imaging nonequilibrium atomic vibrations with x-ray diffuse scattering","10 pages, 3 figures",,"10.1103/PhysRevB.82.235205",,"cond-mat.mtrl-sci","http://arxiv.org/licenses/nonexclusive-distrib/1.0/","  For over a century, x-ray scattering has been the most powerful tool for
determining the equilibrium structure of crystalline materials. Deviations from
perfect periodicity, for example due to thermal motion of the atoms, reduces
the intensity of the Bragg peaks as well as produces structure in the diffuse
scattering background. Analysis of the thermal diffuse scattering (TDS) had
been used to determine interatomic force constants and phonon dispersion in
relatively simple cases before inelastic neutron scattering became the
preferred technique to study lattice dynamics. With the advent of intense
synchrotron x-ray sources, there was a renewed interest in TDS for measuring
phonon dispersion. The relatively short x-ray pulses emanating from these
sources also enables the measurement of phonon dynamics in the time domain.
Prior experiments on nonequilibrium phonons were either limited by
time-resolution and/or to relatively long wavelength excitations. Here we
present the first images of nonequilibrium phonons throughout the Brillouin
zone in photoexcited III-V semiconductors, indium-phosphide and
indium-antimonide, using picosecond time-resolved diffuse scattering. In each
case, we find that the lattice remain out of equilibrium for several hundred
picoseconds up to nanoseconds after laser excitation. The non-equilibrium
population is dominated by transverse acoustic phonons which in InP are
directed along high-symmetry directions. The results have wide implications for
the detailed study of electron-phonon and phonon-phonon coupling in solids.
","[{""version"":""v1"",""created"":""Mon, 21 Jun 2010 05:56:24 GMT""},{""version"":""v2"",""created"":""Wed, 23 Jun 2010 16:52:19 GMT""}]","2013-05-29"
"1006.3991","Akiya Miyamoto","Akiya Miyamoto, Go Iwai, and Katsumasa Ikematsu","KEK GRID for ILC Experiments","4 pages, 2 figures, proceedings of the Internationa Linear Collider
  Workshop LCWS2010, Beijing, China",,,,"physics.ins-det physics.comp-ph","http://arxiv.org/licenses/nonexclusive-distrib/1.0/","  The LCG GRID system is the indispensable infrastructure for large scale
computing required for ILC experiments. It had been used extensively for ILD
LOI studies and its use will be further increased in coming DBD studies.
Experiences during the LOI era and plan towards DBD study in KEK are presented.
","[{""version"":""v1"",""created"":""Mon, 21 Jun 2010 05:57:59 GMT""}]","2010-06-22"
"1006.3992","Timothy White","Timothy R. White, Brendon J. Brewer, Timothy R. Bedding, Dennis
  Stello, Hans Kjeldsen","A comparison of Bayesian and Fourier methods for frequency determination
  in asteroseismology","11 pages, 8 figures, accepted for publication in Communications in
  Asterosesimology",,"10.1553/cia161s39",,"astro-ph.IM","http://arxiv.org/licenses/nonexclusive-distrib/1.0/","  Bayesian methods are becoming more widely used in asteroseismic analysis. In
particular, they are being used to determine oscillation frequencies, which are
also commonly found by Fourier analysis. It is important to establish whether
the Bayesian methods provide an improvement on Fourier methods. We compare,
using simulated data, the standard iterative sine-wave fitting method against a
Markov Chain Monte Carlo (MCMC) code that has been introduced to infer purely
the frequencies of oscillation modes (Brewer et al. 2007). A uniform prior
probability distribution function is used for the MCMC method. We find the
methods do equally well at determining the correct oscillation frequencies,
although the Bayesian method is able to highlight the possibility of a
misidentification due to aliasing, which can be useful. In general, we suggest
that the least computationally intensive method is preferable.
","[{""version"":""v1"",""created"":""Mon, 21 Jun 2010 06:17:00 GMT""}]","2015-05-19"
"1006.3993","Cyril Prissette","Cyril Prissette (LSEET)","An Algorithm to List All the Fixed-Point Free Involutions on a Finite
  Set",,,,,"cs.DS","http://arxiv.org/licenses/nonexclusive-distrib/1.0/","  An involution on a finite set is a bijection such as I(I(e))=e for all the
element of the set. A fixed-point free involution on a finite set is an
involution such as I(e)=e for none element of the set. In this article, the
fixed-point free involutions are represented as partitions of the set and some
properties linked to this representation are exhibited. Then an optimal
algorithm to list all the fixed-point free involutions is presented. Its
soundness relies on the representation of the fixed-point free involutions as
partitions. Finally, an implementation of the algorithm is proposed, with an
effective data representation.
","[{""version"":""v1"",""created"":""Mon, 21 Jun 2010 06:38:46 GMT""}]","2010-07-26"
"1006.3994","Hao Yan PHD.","Hao Yan and Wen-An Yong","Weak entropy solutions of nonlinear reaction-hyperbolic systems for
  axonal transport",,,,,"math.AP","http://arxiv.org/licenses/nonexclusive-distrib/1.0/","  This paper is concerned with a class of nonlinear reaction-hyperbolic systems
as models for axonal transport in neuroscience. We show the global existence of
entropy-satisfying BV-solutions to the initial-value problems by using
hyperbolic-type methods. Moreover, we rigorously justify the limit as the
biochemical processes are much faster than the transport ones.
","[{""version"":""v1"",""created"":""Mon, 21 Jun 2010 06:45:45 GMT""}]","2010-06-22"
"1006.3995","Vinod Chandra","Vinod Chandra, V. Ravishankar","Quarkonia in anisotropic hot QCD medium in a quasi-particle model","7 pages, two column, 2 figure, one figure added, references added,
  revised version, title modified","Nucl.Phys.A848:330-340,2010","10.1016/j.nuclphysa.2010.09.015","TIFR/TH/10-17","nucl-th","http://arxiv.org/licenses/nonexclusive-distrib/1.0/","  The fate of heavy quarkonia states has been investigated in QCD at high
temperature when the plasma has a small momentum space anisotropy within a
quasi-particle model. A real time static potential has been obtained from a
Hard thermal loop expression for the gluon self-energy, by employing the
quasi-parton equilibrium distribution functions extracted from hot QCD
equations of state of $O(g^5)$ and $O(g^6\ln(1/g))$. Employing the potential,
quarkonia melting has been studied. It is found that the equations of state and
the momentum anisotropy cause significant modifications in the screening
properties of the plasma.
","[{""version"":""v1"",""created"":""Mon, 21 Jun 2010 06:54:17 GMT""},{""version"":""v2"",""created"":""Wed, 15 Sep 2010 05:54:46 GMT""}]","2010-11-23"
"1006.3996","Masahito Mochizuki","Nobuo Furukawa, Masahito Mochizuki","Roles of Bond Alternation in Magnetic Phase Diagram of RMnO3","5 pages, 6 figures","J. Phys. Soc. Jpn. 79 (2010) 033708","10.1143/JPSJ.79.033708",,"cond-mat.str-el cond-mat.mtrl-sci","http://arxiv.org/licenses/nonexclusive-distrib/1.0/","  In order to investigate nature of the antiferromagnetic structures in
perovskite RMnO3, we study a Heisenberg J1-J2 model with bond alternation using
analytical and numerical approaches. The magnetic phase diagram which includes
incommensurate spiral states and commensurate collinear states is reproduced.
We discuss that the magnetic structure with up-up-down-down spin configuration
(E-type structure) and the ferroelectricity emerge cooperatively to stabilize
this phase. Magnetoelastic couplings are crucial to understand the magnetic and
electric phase diagram of RMnO3.
","[{""version"":""v1"",""created"":""Mon, 21 Jun 2010 06:57:27 GMT""}]","2010-07-13"
"1006.3997","Katrin Grunert","Katrin Grunert","The Transformation Operator for One-Dimensional Schroedinger Operators
  on Almost Periodic Infinite-Gap Backgrounds","23 pages","J. Diff. Eq. 250, 3534-3558 (2011)","10.1016/j.jde.2010.11.012",,"math.SP","http://arxiv.org/licenses/nonexclusive-distrib/1.0/","  We investigate the kernels of the transformation operators for
one-dimensional Schroedinger operators with potentials, which are
asymptotically close to Bohr almost periodic infinite-gap potentials.
","[{""version"":""v1"",""created"":""Mon, 21 Jun 2010 06:57:33 GMT""},{""version"":""v2"",""created"":""Tue, 5 Apr 2011 07:00:24 GMT""}]","2011-04-06"
"1006.3998","Zhe-Yu Jeff Ou","L. Q. Chen, Guo-Wan Zhang, Cheng-ling Bian, Chun-Hua Yuan, Z. Y. Ou,
  Weiping Zhang","Observation of Rabi oscillation of light assisted by atomic spin wave",,,"10.1103/PhysRevLett.105.133603",,"quant-ph","http://arxiv.org/licenses/nonexclusive-distrib/1.0/","  Coherent conversion between a Raman pump field and its Stokes field is
observed in a Raman process with a strong atomic spin wave initially prepared
by another Raman process operated in the stimulated emission regime. The
oscillatory behavior resembles the Rabi oscillation in atomic population in a
two-level atomic system driven by a strong light field. The Rabi-like
oscillation frequency is found to be related to the strength of the pre-built
atomic spin wave. High conversion efficiency of 40% from the Raman pump field
to the Stokes field is recorded and it is independent of the input Raman pump
field. This process can act as a photon frequency multiplexer and may find wide
applications in quantum information science.
","[{""version"":""v1"",""created"":""Mon, 21 Jun 2010 06:58:31 GMT""}]","2015-05-19"
"1006.3999","Richard Woodard","E. O. Kahya (Friedrich-Schiller-Universitat, Jena), V. K. Onemli
  (Istanbul Technical University) and R. P. Woodard (University of Florida)","The Zeta-Zeta Correlator Is Time Dependent","7 pages, 2 figures, uses Revtex4","Phys.Lett.B694:101-107,2010","10.1016/j.physletb.2010.09.050","UFIFT-QG-10-03","astro-ph.CO gr-qc hep-th","http://arxiv.org/licenses/nonexclusive-distrib/1.0/","  We comment on the recent arguments by Senatore and Zaldarriaga that loop
corrections to the zeta-zeta correlator cannot grow with time after first
horizon crossing. We first emphasize the need to search for such secular
dependence in corrections whose in-out matrix elements are infrared singular on
an infinite spatial manifold. Then we give examples of such time dependence
from pure quantum gravity and from scalar potential models. Finally, we point
out that this time dependence arises from inflationary particle production and
is therefore unlikely to endanger the preservation of super-horizon
correlations as a record of inflation.
","[{""version"":""v1"",""created"":""Mon, 21 Jun 2010 07:19:20 GMT""}]","2010-12-09"
"1006.4000","Matilde Marcolli","Daniel Kolodrubetz and Matilde Marcolli","Boundary conditions of the RGE flow in the noncommutative geometry
  approach to particle physics and cosmology","18 pages LaTeX, 13 png figures","Phys.Lett.B693:166-174,2010","10.1016/j.physletb.2010.08.018",,"hep-th math-ph math.MP","http://arxiv.org/licenses/nonexclusive-distrib/1.0/","  We investigate the effect of varying boundary conditions on the
renormalization group flow in a recently developed noncommutative geometry
model of particle physics and cosmology. We first show that there is a
sensitive dependence on the initial conditions at unification, so that, varying
a parameter even slightly can be shown to have drastic effects on the running
of the model parameters. We compare the running in the case of the default and
the maximal mixing conditions at unification. We then exhibit explicitly a
particular choice of initial conditions at the unification scale, in the form
of modified maximal mixing conditions, which have the property that they
satisfy all the geometric constraints imposed by the noncommutative geometry of
the model at unification, and at the same time, after running them down to
lower energies with the renormalization group flow, they still agree in order
of magnitude with the predictions at the electroweak scale.
","[{""version"":""v1"",""created"":""Mon, 21 Jun 2010 07:23:56 GMT""},{""version"":""v2"",""created"":""Thu, 23 Sep 2010 15:32:24 GMT""}]","2014-11-21"
"1006.4001","Slawomir Breiter","Slawomir Breiter, Przemyslaw Bartczak, Maria Czekaj","YORP torques with 1D thermal model","15 pages, 10 figures, accepted to MNRAS, before language editing",,"10.1111/j.1365-2966.2010.17223.x",,"astro-ph.EP","http://arxiv.org/licenses/nonexclusive-distrib/1.0/","  A numerical model of the Yarkovsky-O'Keefe-Radzievskii-Paddack (YORP) effect
for objects defined in terms of a triangular mesh is described. The algorithm
requires that each surface triangle can be handled independently, which implies
the use of a 1D thermal model. Insolation of each triangle is determined by an
optimized ray-triangle intersection search. Surface temperature is modeled with
a spectral approach; imposing a quasi-periodic solution we replace heat
conduction equation by the Helmholtz equation. Nonlinear boundary conditions
are handled by an iterative, FFT based solver. The results resolve the question
of the YORP effect in rotation rate independence on conductivity within the
nonlinear 1D thermal model regardless of the accuracy issues and homogeneity
assumptions. A seasonal YORP effect in attitude is revealed for objects moving
on elliptic orbits when a nonlinear thermal model is used.
","[{""version"":""v1"",""created"":""Mon, 21 Jun 2010 07:34:37 GMT""},{""version"":""v2"",""created"":""Wed, 14 Jul 2010 14:30:40 GMT""}]","2010-07-15"
