"1006.4823","Olaf Hohm","Olaf Hohm, Chris Hull, and Barton Zwiebach","Generalized metric formulation of double field theory","36 pages, v2: minor corrections","JHEP 1008:008,2010","10.1007/JHEP08(2010)008","Imperial-TP-2010-CH-03, MIT-CTP-4154","hep-th","http://arxiv.org/licenses/nonexclusive-distrib/1.0/","  The generalized metric is a T-duality covariant symmetric matrix constructed
from the metric and two-form gauge field and arises in generalized geometry. We
view it here as a metric on the doubled spacetime and use it to give a simple
formulation with manifest T-duality of the double field theory that describes
the massless sector of closed strings. The gauge transformations are written in
terms of a generalized Lie derivative whose commutator algebra is defined by a
double field theory extension of the Courant bracket.
","[{""version"":""v1"",""created"":""Thu, 24 Jun 2010 16:03:12 GMT""},{""version"":""v2"",""created"":""Tue, 10 Aug 2010 22:54:53 GMT""}]","2014-11-21"
"1006.4824","Ying Cui","Rui Wang, Vincent K. N. Lau, and Ying Cui","Decentralized Fair Scheduling in Two-Hop Relay-Assisted Cognitive OFDMA
  Systems","29 pages, 9 figures, IEEE JOURNAL OF SELECTED TOPICS IN SIGNAL
  PROCESSING",,"10.1109/JSTSP.2010.2056352",,"cs.PF","http://arxiv.org/licenses/nonexclusive-distrib/1.0/","  In this paper, we consider a two-hop relay-assisted cognitive downlink OFDMA
system (named as secondary system) dynamically accessing a spectrum licensed to
a primary network, thereby improving the efficiency of spectrum usage. A
cluster-based relay-assisted architecture is proposed for the secondary system,
where relay stations are employed for minimizing the interference to the users
in the primary network and achieving fairness for cell-edge users. Based on
this architecture, an asymptotically optimal solution is derived for jointly
controlling data rates, transmission power, and subchannel allocation to
optimize the average weighted sum goodput where the proportional fair
scheduling (PFS) is included as a special case. This solution supports
decentralized implementation, requires small communication overhead, and is
robust against imperfect channel state information at the transmitter (CSIT)
and sensing measurement. The proposed solution achieves significant throughput
gains and better user-fairness compared with the existing designs. Finally, we
derived a simple and asymptotically optimal scheduling solution as well as the
associated closed-form performance under the proportional fair scheduling for a
large number of users. The system throughput is shown to be
$\mathcal{O}\left(N(1-q_p)(1-q_p^N)\ln\ln K_c\right)$, where $K_c$ is the
number of users in one cluster, $N$ is the number of subchannels and $q_p$ is
the active probability of primary users.
","[{""version"":""v1"",""created"":""Thu, 24 Jun 2010 16:19:05 GMT""}]","2015-05-19"
"1006.4825","Gisela Maintz Dr.","K.S. de Boer and G. Maintz","Hysteresis of atmospheric parameters of 12 RR Lyrae stars based on
  multichannel simultaneous Stroemgren photometry","12 pages, 11 figures",,"10.1051/0004-6361/201014030",,"astro-ph.SR","http://arxiv.org/licenses/nonexclusive-distrib/1.0/","  RR Lyrae stars have been observed to improve the insight into the processes
at work in their atmospheres. Simultaneous Stroemgren-photometry allows to
obtain a rapid sequence of measurements in which photometric indices are
unaffected by non-optimum observing conditions. The indices y, b-y, and c_1 are
used with an established calibration to derive T_eff and to derive the gravity,
log g_BJ from the Balmer jump, throughout the pulsation cycle. By employing the
equations for stellar structure, additional parameters can be derived.
Stroemgren photometry and its calibration in terms of T_eff and log g can be
used to determine the run of R and the atmosphere pulsation velocity. We find
that the Balmer-line strengths are correlated with T_eff and that the strength
of the Ca_ii K line correlates well with the radius of the star and thus the
pulsation-dependent density of the atmosphere. The density in the stellar
atmosphere fluctuates as indicated by the changes in the gravity log g_BJ,
derived from c_1, between 2.3 and 4.5 dex. Also the Stroemgren metal index,
m_1, fluctuates. We find a disagreement between log g(T,L,M), the gravity
calculated from T_eff, L, and the mass M,and the gravity log g_BJ. This can be
used to reassess the mass and the absolute magnitude of an individual star.The
curves derived for the pulsational velocity V_pul differ from curves obtained
from spectra needed to apply the Baade-Wesselink method; we think these
differences are due to phase dependent differences in the optical depth levels
sampled in continuum photometry and in spectroscopy. We find an atmospheric
oscillation in these fundamental mode RR Lyrae stars of periodicity P/7.
","[{""version"":""v1"",""created"":""Thu, 24 Jun 2010 16:20:21 GMT""}]","2015-05-19"
"1006.4826","Luca Stanco","Luca Stanco","Neutrinos Oscillations with Long-Base-Line Beams (Past, Present and very
  near Future)","14 pages, 10 figures, to appear in the Proceedings of the Int. Conf.
  Beyond the Standard Models of Particle Physics, Cosmology and Astrophysics
  (BEYOND 2010), 1-6 February 2010, Cape Town, South Africa",,"10.1142/9789814340861_0032",,"hep-ph hep-ex","http://arxiv.org/licenses/nonexclusive-distrib/1.0/","  We overview the status of the studies on neutrino oscillations with
accelerators at the present running experiments. Past and present results
enlighten the path towards the observation of massive neutrinos and the
settling of their oscillations. The very near future may still have addiction
from the outcome of the on-going experiments. OPERA is chosen as a relevant
example justified by the very recent results released.
","[{""version"":""v1"",""created"":""Thu, 24 Jun 2010 16:26:41 GMT""}]","2017-08-23"
"1006.4827","Graham Kirby","Alan Dearle, Graham Kirby, Ron Morrison, Andrew McCarthy, Kevin
  Mullen, Yanyan Yang, Richard Connor, Paula Welen, Andy Wilson","Architectural Support for Global Smart Spaces","4th International Conference on Mobile Data Management (MDM 2003)",,"10.1007/3-540-36389-0_11",,"cs.DC","http://arxiv.org/licenses/nonexclusive-distrib/1.0/","  A GLObal Smart Space (GLOSS) provides support for interaction amongst people,
artefacts and places while taking account of both context and movement on a
global scale. Crucial to the definition of a GLOSS is the provision of a set of
location-aware services that detect, convey, store and exploit location
information. We use one of these services, hearsay, to illustrate the
implementation dimensions of a GLOSS. The focus of the paper is on both local
and global software architecture to support the implementation of such
services. The local architecture is based on XML pipe-lines and is used to
construct location-aware components. The global architecture is based on a
hybrid peer-to-peer routing scheme and provides the local architectures with
the means to communicate in the global context.
","[{""version"":""v1"",""created"":""Thu, 24 Jun 2010 16:27:03 GMT""}]","2010-06-25"
"1006.4828","Vamsi Kundeti","Vamsi Kundeti and Sanguthevar Rajasekaran and Hieu Dinh","An Efficient Algorithm For Chinese Postman Walk on Bi-directed de Bruijn
  Graphs",,,"10.1007/978-3-642-17458-2_16",,"cs.DS","http://arxiv.org/licenses/nonexclusive-distrib/1.0/","  Sequence assembly from short reads is an important problem in biology. It is
known that solving the sequence assembly problem exactly on a bi-directed de
Bruijn graph or a string graph is intractable. However finding a Shortest
Double stranded DNA string (SDDNA) containing all the k-long words in the reads
seems to be a good heuristic to get close to the original genome. This problem
is equivalent to finding a cyclic Chinese Postman (CP) walk on the underlying
un-weighted bi-directed de Bruijn graph built from the reads. The Chinese
Postman walk Problem (CPP) is solved by reducing it to a general bi-directed
flow on this graph which runs in O(|E|2 log2(|V |)) time. In this paper we show
that the cyclic CPP on bi-directed graphs can be solved without reducing it to
bi-directed flow. We present a ?(p(|V | + |E|) log(|V |) + (dmaxp)3) time
algorithm to solve the cyclic CPP on a weighted bi-directed de Bruijn graph,
where p = max{|{v|din(v) - dout(v) > 0}|, |{v|din(v) - dout(v) < 0}|} and dmax
= max{|din(v) - dout(v)}. Our algorithm performs asymptotically better than the
bidirected flow algorithm when the number of imbalanced nodes p is much less
than the nodes in the bi-directed graph. From our experimental results on
various datasets, we have noticed that the value of p/|V | lies between 0.08%
and 0.13% with 95% probability.
","[{""version"":""v1"",""created"":""Thu, 24 Jun 2010 16:35:47 GMT""}]","2015-05-19"
"1006.4829","Graham Kirby","Ron Morrison, Graham Kirby, Dharini Balasubramaniam, Kath Mickan,
  Flavio Oquendo, Sorana C\^impan, Brian Warboys, Bob Snowdon, Mark Greenwood","Constructing Active Architectures in the ArchWare ADL","Submitted to ICSE 2004",,,"University of St Andrews CS/03/3","cs.SE","http://arxiv.org/licenses/nonexclusive-distrib/1.0/","  Software that cannot change is condemned to atrophy: it cannot accommodate
the constant revision and re-negotiation of its business goals nor intercept
the potential of new technology. To accommodate change in such systems we have
defined an active software architecture to be: dynamic in that the structure
and cardinality of the components and interactions are not statically known;
updatable in that components can be replaced dynamically; and evolvable in that
it permits its executing specification to be changed. Here we describe the
facilities of the ArchWare architecture description language (ADL) for
specifying active architectures. The contribution of the work is the unique
combination of concepts including: a {\pi}-calculus based communication and
expression language for specifying executable architectures; hyper-code as an
underlying representation of system execution; a decomposition operator to
break up and introspect on executing systems; and structural reflection for
creating new components and binding them into running systems.
","[{""version"":""v1"",""created"":""Thu, 24 Jun 2010 16:36:07 GMT""}]","2010-06-25"
"1006.4830","Ulisses Barres de Almeida","U. Barres de Almeida (Durham), M. J. Ward (Durham), T. P. Dominici
  (LNA/MCT), Z. Abraham (IAG/USP), G. A. P. Franco (UFMG), M. K. Daniel
  (Durham), P. M. Chadwick (Durham) and C. Boisson (Obs. Paris-Meudon)","Particle Acceleration and Magnetic Field Structure in PKS 2155-304:
  Optical Polarimetric Observations","11 pages, 5 figures, accepted for publication in MNRAS",,"10.1111/j.1365-2966.2010.17236.x",,"astro-ph.HE astro-ph.CO","http://arxiv.org/licenses/nonexclusive-distrib/1.0/","  In this paper we present multiband optical polarimetric observations of the
VHE blazar PKS 2155-304 made simultaneously with a H.E.S.S./Fermi high-energy
campaign in 2008, when the source was found to be in a low state. The intense
daily coverage of the dataset allowed us to study in detail the temporal
evolution of the emission and we found that the particle acceleration
timescales are decoupled from the changes in the polarimetric properties of the
source. We present a model in which the optical polarimetric emission
originates at the polarised mm-wave core and propose an explanation for the
lack of correlation between the photometric and polarimetric fluxes. The
optical emission is consistent with an inhomogeneous synchrotron source in
which the large scale field is locally organised by a shock in which particle
acceleration takes place. Finally, we use these optical polarimetric
observations of PKS 2155-304 at a low state to propose an origin for the
quiescent gamma-ray flux of the object, in an attempt to provide clues for the
source of its recently established persistent TeV emission.
","[{""version"":""v1"",""created"":""Thu, 24 Jun 2010 16:38:54 GMT""}]","2015-05-19"
"1006.4831","Joan-Andreu Lazaro-Cami","Joan-Andreu Lazaro-Cami, Kamaludin Dingle, and Jeroen Lamb","Knudsen's law and random billiards in irrational triangles","21 pages, 5 figures",,,,"math.DS math-ph math.MP","http://arxiv.org/licenses/nonexclusive-distrib/1.0/","  We prove Knudsen's law for a gas of particles bouncing freely in a two
dimensional pipeline with serrated walls consisting of irrational triangles.
Dynamics are randomly perturbed and the corresponding random map studied under
a skew-type deterministic representation which is shown to be ergodic and
exact.
","[{""version"":""v1"",""created"":""Thu, 24 Jun 2010 16:41:22 GMT""}]","2010-06-25"
"1006.4832","Kristiaan Pelckmans","Kristiaan Pelckmans","MINLIP for the Identification of Monotone Wiener Systems",,,,,"cs.LG","http://arxiv.org/licenses/nonexclusive-distrib/1.0/","  This paper studies the MINLIP estimator for the identification of Wiener
systems consisting of a sequence of a linear FIR dynamical model, and a
monotonically increasing (or decreasing) static function. Given $T$
observations, this algorithm boils down to solving a convex quadratic program
with $O(T)$ variables and inequality constraints, implementing an inference
technique which is based entirely on model complexity control. The resulting
estimates of the linear submodel are found to be almost consistent when no
noise is present in the data, under a condition of smoothness of the true
nonlinearity and local Persistency of Excitation (local PE) of the data. This
result is novel as it does not rely on classical tools as a 'linearization'
using a Taylor decomposition, nor exploits stochastic properties of the data.
It is indicated how to extend the method to cope with noisy data, and empirical
evidence contrasts performance of the estimator against other recently proposed
techniques.
","[{""version"":""v1"",""created"":""Thu, 24 Jun 2010 16:42:38 GMT""}]","2010-06-25"
"1006.4833","Graham Kirby","Graham Kirby, Evangelos Zirintsis, Alan Dearle, Ron Morrison","A Generic Storage API","Submitted to ACSC 2004",,,"University of St Andrews CS/03/2","cs.DB","http://arxiv.org/licenses/nonexclusive-distrib/1.0/","  We present a generic API suitable for provision of highly generic storage
facilities that can be tailored to produce various individually customised
storage infrastructures. The paper identifies a candidate set of minimal
storage system building blocks, which are sufficiently simple to avoid
encapsulating policy where it cannot be customised by applications, and
composable to build highly flexible storage architectures. Four main generic
components are defined: the store, the namer, the caster and the interpreter.
It is hypothesised that these are sufficiently general that they could act as
building blocks for any information storage and retrieval system. The essential
characteristics of each are defined by an interface, which may be implemented
by multiple implementing classes.
","[{""version"":""v1"",""created"":""Thu, 24 Jun 2010 16:47:28 GMT""}]","2010-06-25"
"1006.4834","Nicholas Tsamis","N. C. Tsamis (University of Crete) and R. P. Woodard (University of
  Florida)","Primordial Density Perturbations and Reheating from Gravity","37 pages, 2 figures, uses LaTeX2e","Phys.Rev.D82:063502,2010","10.1103/PhysRevD.82.063502","CCTP-2010-8, UFIFT-QG-10-04","gr-qc astro-ph.CO hep-th","http://arxiv.org/licenses/nonexclusive-distrib/1.0/","  We consider the presence and evolution of primordial density perturbations in
a cosmological model based on a simple ansatz which captures -- by providing a
set of effective gravitational field equations -- the strength of the enhanced
quantum loop effects that can arise during inflation. After deriving the
general equations that perturbations obey, we concentrate on scalar
perturbations and show that their evolution is quite different than that of
conventional inflationary models but still phenomenologically acceptable. The
main reason for this novel evolution is the presence of an oscillating regime
after the end of inflation which makes all super-horizon scalar modes
oscillate. The same reason allows for a natural and very fast reheating
mechanism for the universe.
","[{""version"":""v1"",""created"":""Thu, 24 Jun 2010 16:53:53 GMT""}]","2014-11-21"
"1006.4835","Ulisses Barres de Almeida","U. Barres de Almeida (on behalf of the H.E.S.S. Collaboration)","Results from H.E.S.S. Observations of Relativistic Sources","8 pages, 3 figures, Invited Observational Review at the Conference
  ""High-Energy Phenomena in Relativistic Outflows"" (HEPRO-II)",,,,"astro-ph.HE","http://arxiv.org/licenses/nonexclusive-distrib/1.0/","  The High Energy Stereoscopic System (H.E.S.S.) is a southern hemisphere array
of four Imaging Atmospheric Cherenkov Telescopes observing the sky in the very
high energy gamma-ray range (E $>$ 100 GeV). VHE observations are an invaluable
tool to study the acceleration and propagation of energetic particles in many
astrophysical systems where relativistic outflows are the main drivers of the
emission, such as AGNs and galactic binary systems. In this paper the main
results of the H.E.S.S. observations of these objects will be reviewed, and the
general picture that emerges from them will be presented. We will also comment
on prospects for future investigations with H.E.S.S.-II.
","[{""version"":""v1"",""created"":""Thu, 24 Jun 2010 17:06:25 GMT""}]","2010-06-25"
"1006.4836","Christopher Gerig","Christopher Gerig","Essential Cohomology of the p-Groups with a Cyclic Subgroup of Index p","Minor edit to acknowledgements/references",,,,"math.GR","http://arxiv.org/licenses/nonexclusive-distrib/1.0/","  In this paper we determine explicitly the mod-p essential cohomology ideals
of the p-groups with a cyclic subgroup of index p.
","[{""version"":""v1"",""created"":""Thu, 24 Jun 2010 17:09:48 GMT""},{""version"":""v2"",""created"":""Fri, 25 Jun 2010 10:29:34 GMT""}]","2010-06-28"
"1006.4837","Krista Gile","Krista J. Gile","Improved Inference for Respondent-Driven Sampling Data with Application
  to HIV Prevalence Estimation","36 pages, 12 figures, under review",,,,"stat.ME","http://arxiv.org/licenses/nonexclusive-distrib/1.0/","  Respondent-driven sampling is a form of link-tracing network sampling, which
is widely used to study hard-to-reach populations, often to estimate population
proportions. Previous treatments of this process have used a with-replacement
approximation, which we show induces bias in estimates for large sample
fractions and differential network connectedness by characteristic of interest.
  We present a treatment of respondent-driven sampling as a successive sampling
process. Unlike existing representations, our approach respects the essential
without-replacement feature of the process, while converging to an existing
with-replacement representation for small sample fractions, and to the sample
mean for a full-population sample.
  We present a successive-sampling based estimator for population means based
on respondent-driven sampling data, and demonstrate its superior performance
when the size of the hidden population is known. We present sensitivity
analyses for unknown population sizes. In addition, we note that like other
existing estimators, our new estimator is subject to bias induced by the
selection of the initial sample. Using data collected among three populations
in two countries, we illustrate the application of this approach to populations
with varying characteristics. We conclude that the successive sampling
estimator improves on existing estimators, and can also be used as a diagnostic
tool when population size is not known.
","[{""version"":""v1"",""created"":""Thu, 24 Jun 2010 17:10:22 GMT""}]","2010-06-25"
"1006.4838","Martin Mourigal","M. Mourigal, M. E. Zhitomirsky and A. L. Chernyshev","Field-induced decay dynamics in square-lattice antiferromagnet","12 pages, 11 figures, final version","Phys. Rev. B, 82, 144402 (2010)","10.1103/PhysRevB.82.144402",,"cond-mat.str-el","http://arxiv.org/licenses/nonexclusive-distrib/1.0/","  Dynamical properties of the square-lattice Heisenberg antiferromagnet in
applied magnetic field are studied for arbitrary value S of the spin. Above the
threshold field for two-particle decays, the standard spin-wave theory yields
singular corrections to the excitation spectrum with logarithmic divergences
for certain momenta. We develop a self-consistent approximation applicable for
S >= 1, which avoids such singularities and provides regularized magnon decay
rates. Results for the dynamical structure factor obtained in this approach are
presented for S = 1 and S = 5/2.
","[{""version"":""v1"",""created"":""Thu, 24 Jun 2010 17:12:36 GMT""},{""version"":""v2"",""created"":""Fri, 1 Oct 2010 16:30:55 GMT""}]","2010-10-04"
"1006.4839","Alexander Mishchenko","A.S.Mishchenko","Transitive Lie algebroids - categorical point of view","6 pages",,,,"math.AT","http://arxiv.org/licenses/nonexclusive-distrib/1.0/","  The intention of this article is to make an attempt of classification of
transitive Lie algebroids and on this basis to construct a classifying space.
The realization of the intention allows to describe characteristic classes of
transitive Lie algebroids form the point of view a natural transformation of
functors similar to the classical abstract characteristic classes for vector
bundles.
","[{""version"":""v1"",""created"":""Thu, 24 Jun 2010 17:21:02 GMT""}]","2010-06-25"
"1006.4840","Srinivasa Rao Singamaneni","S. S. Rao, A. Stesmans, Y. Wang and Y. Chen","Direct ESR evidence for magnetic behaviour of graphene","Presented in EMRS SPRING 2010",,,"0061404","cond-mat.mes-hall","http://arxiv.org/licenses/nonexclusive-distrib/1.0/","  Recently, there have appeared theoretical works on the magnetic properties of
graphene and graphene nanoribbons envisaging possible spin-based applications
along with fundamental scientific insight. The theoretical efforts, however,
appear not paralleled by experimental investigation to test magnetic
properties. Yet, room temperature ferromagnetism (RTFM) has recently been
experimentally reported in graphene (G-600) [Nano. Letters 9, 220 (2009)], the
origin of which remains still unexplored. Inspired by this observation, and in
attempt to trace the origin of RTFM, we here report on low temperature K-band
electron spin resonance (ESR) observations on G-600. Two distinct C-related
paramagnetic signals are revealed, both of a Lorentzian shape: a) a broad at g
= 2.00278 which can be attributed to graphitic-like (GL) carbon; b) a narrower
signal at g = 2.00288 which is associated with free radical like (FL) carbon.
No other signals could be detected. We speculate that the GL ESR signal may
come from the conductive {\pi}-carriers propagating in the interior of graphene
sheets, while the FL ESR signal may stem from the edges of graphene sheets due
to non-bonding localized electronic states. It is suggested that the long range
direct/indirect exchange interaction between GL and FL C-related magnetic spin
centers may lead to the reported RTFM, this pointing to C origin of the later.
","[{""version"":""v1"",""created"":""Thu, 24 Jun 2010 17:32:17 GMT""}]","2010-06-25"
"1006.4841","Srinivasa Rao Singamaneni","S. S. Rao, A. Stesmans, J. V. Noyen, P. Jacobs and B. Sels","ESR evidence for disordered magnetic phase from ultra-small carbon
  nanotubes embedded in zeolite nanochannels","Accepted to be published in EuroPhysics Letters",,"10.1209/0295-5075/90/57003",,"cond-mat.mes-hall","http://arxiv.org/licenses/nonexclusive-distrib/1.0/","  A multi-frequency electron spin resonance (ESR) study provides evidence for
the occurrence of low temperature ferromagnetic/spin-glass behavior in aligned
arrays of sub-nanometer single walled carbon nanotubes confined in zeolite
nano-channels, owing to sp2-type non-bonding carbon associated localized states
with density of ~3 x 1019 /g. Features related to the much anticipated
conduction ESR are not detected. In the paramagnetic phase, the ESR linewidth
is found to be weakly dependent on microwave frequency.
","[{""version"":""v1"",""created"":""Thu, 24 Jun 2010 17:33:41 GMT""}]","2015-05-19"
