"1006.4860","Bruce Berriman","G. Bruce Berriman, Ewa Deelman, Paul Groth, and Gideon Juve","The Application of Cloud Computing to the Creation of Image Mosaics and
  Management of Their Provenance","15 pages, 3 figure","SPIE Conference 7740: Software and Cyberinfrastructure for
  Astronomy (2010)","10.1117/12.856486",,"astro-ph.IM cs.DC","http://arxiv.org/licenses/nonexclusive-distrib/1.0/","  We have used the Montage image mosaic engine to investigate the cost and
performance of processing images on the Amazon EC2 cloud, and to inform the
requirements that higher-level products impose on provenance management
technologies. We will present a detailed comparison of the performance of
Montage on the cloud and on the Abe high performance cluster at the National
Center for Supercomputing Applications (NCSA). Because Montage generates many
intermediate products, we have used it to understand the science requirements
that higher-level products impose on provenance management technologies. We
describe experiments with provenance management technologies such as the
""Provenance Aware Service Oriented Architecture"" (PASOA).
","[{""version"":""v1"",""created"":""Thu, 24 Jun 2010 18:40:24 GMT""}]","2015-05-19"
"1006.4861","Markus Aschwanden","Markus J. Aschwanden","The State of Self-Organized Criticality of the Sun During the Last 3
  Solar Cycles. I. Observations","subm. to Solar Physics","Solar Physics 274, 99-117 (2011)","10.1007/s11207-011-9755-0",,"astro-ph.SR","http://arxiv.org/licenses/nonexclusive-distrib/1.0/","  We analyze the occurrence frequency distributions of peak fluxes $P$, total
fluxes $E$, and durations $T$ of solar flares over the last three solar cycles
(during 1980--2010) from hard X-ray data of HXRBS/SMM, BATSE/CGRO, and RHESSI.
From the synthesized data we find powerlaw slopes with mean values of
$\alpha_P=1.72\pm0.08$ for the peak flux, $\alpha_E=1.60\pm0.14$ for the total
flux, and $\alpha_T=1.98\pm0.35$ for flare durations. We find a systematic
anti-correlation of the powerlaw slope of peak fluxes as a function of the
solar cycle, varying with an approximate sinusoidal variation
$\alpha_P(t)=\alpha_0+\Delta \alpha \cos{[2\pi (t-t_0)/T_{cycle}]}$, with a
mean of $\alpha_0=1.73$, a variation of $\Delta \alpha =0.14$, a solar cycle
period $T_{cycle}=12.6$ yrs, and a cycle minimum time $t_0=1984.1$. The
powerlaw slope is flattest during the maximum of a solar cycle, which indicates
a higher magnetic complexity of the solar corona that leads to an
overproportional rate of powerful flares.
","[{""version"":""v1"",""created"":""Thu, 24 Jun 2010 19:08:04 GMT""},{""version"":""v2"",""created"":""Tue, 5 Oct 2010 19:04:51 GMT""},{""version"":""v3"",""created"":""Wed, 6 Oct 2010 22:52:12 GMT""}]","2012-01-13"
"1006.4862","Ezequiel Rela","Ursula Molter and Ezequiel Rela","Small Furstenberg sets","Final version",,,,"math.CA math.CO","http://arxiv.org/licenses/nonexclusive-distrib/1.0/","  For $\alpha$ in $(0,1]$, a subset $E$ of $\RR$ is called Furstenberg set of
type $\alpha$ or $F_\alpha$-set if for each direction $e$ in the unit circle
there is a line segment $\ell_e$ in the direction of $e$ such that the
Hausdorff dimension of the set $E\cap\ell_e$ is greater or equal than $\alpha$.
In this paper we show that if $\alpha > 0$, there exists a set $E\in F_\alpha$
such that $\HH{g}(E)=0$ for
$g(x)=x^{1/2+3/2\alpha}\log^{-\theta}(\frac{1}{x})$,
$\theta>\frac{1+3\alpha}{2}$, which improves on the the previously known bound,
that $H^{\beta}(E) = 0$ for $\beta>1/2+3/2\alpha$. Further, by refining the
argument in a subtle way, we are able to obtain a sharp dimension estimate for
a whole class of zero-dimensional Furstenberg type sets. Namely, for
$\h_\gamma(x)=\log^{-\gamma}(\frac{1}{x})$, $\gamma>0$, we construct a set
$E_\gamma\in F_{\h_\gamma}$ of Hausdorff dimension not greater than 1/2. Since
in a previous work we showed that 1/2 is a lower bound for the Hausdorff
dimension of any $E\in F_{\h_\gamma}$, with the present construction, the value
1/2 is sharp for the whole class of Furstenberg sets associated to the zero
dimensional functions $\h_\gamma$.
","[{""version"":""v1"",""created"":""Thu, 24 Jun 2010 19:22:36 GMT""},{""version"":""v2"",""created"":""Thu, 14 Apr 2011 20:50:26 GMT""},{""version"":""v3"",""created"":""Mon, 12 Nov 2012 14:59:03 GMT""}]","2012-11-13"
"1006.4863","Gabriel Sanchez-Colon","S. Chaturvedi, V. Gupta, G. S\'anchez-Col\'on, and N. Mukunda","Recursive parametrization of Quark flavour mixing matrices",,"Rev. Mex. Fis. 57 (2011) 146-153",,,"hep-ph","http://arxiv.org/licenses/nonexclusive-distrib/1.0/","  We examine quark flavour mixing matrices for three and four generations using
the recursive parametrization of $U(n)$ and $SU(n)$ matrices developed by some
of us in Refs.[2] and [3]. After a brief summary of the recursive
parametrization, we obtain expressions for the independent rephasing invariants
and also the constraints on them that arise from the requirement of mod
symmetry of the flavour mixing matrix.
","[{""version"":""v1"",""created"":""Thu, 24 Jun 2010 19:28:14 GMT""}]","2013-04-04"
"1006.4864","Benedek Valko","Timo Sepp\""al\""ainen, Benedek Valk\'o","Bounds for scaling exponents for a 1+1 dimensional directed polymer in a
  Brownian environment","26 pages, minor changes in Section 3.2, typos corrected, reference
  added","Alea 7, 451-476 (2010)",,,"math.PR math-ph math.MP","http://arxiv.org/licenses/nonexclusive-distrib/1.0/","  We study the scaling exponents of a 1+1-dimensional directed polymer in a
Brownian random environment introduced by O'Connell and Yor. For a version of
the model with boundary conditions that are stationary in a space-time sense we
identify the exact values of the exponents. For the version without the
boundary conditions we get the conjectured upper bounds on the exponents.
","[{""version"":""v1"",""created"":""Thu, 24 Jun 2010 19:39:12 GMT""},{""version"":""v2"",""created"":""Thu, 1 Jul 2010 19:41:41 GMT""}]","2011-09-13"
"1006.4865","Ioan Baldea","Ioan Baldea and Horst Koppel","Reply to Comment on ""Electron transport through correlated molecules
  computed using the time-independent Wigner function: Two critical tests''","Accepted for publication in Phys. Rev. B","Phys. Rev. B 82 (8), 087302 (2010)","10.1103/PhysRevB.82.087302",,"cond-mat.mes-hall","http://arxiv.org/licenses/nonexclusive-distrib/1.0/","  In their Comment, Greer et al (i) put us in charge of a pretended wrong
claim, which we never made in Phys.~Rev.~B {\bf 78}, 115315 (2008), where we
criticized a method (DG)proposed by two of them, (ii) incorrectly claim that
the DG method can reproduce the conductance quantum $g_0$, but (iii) to deduce
$g_0$ for a toy model, they carry out calculations within the standard Landauer
method, which has nothing to do with the DG's. We present results for their
model obtained within the DG method, which demonstrate that the DG method fails
as lamentably as in the examples we presented in our earlier work. We also
analyze the physical reasons why the DG method fails.
","[{""version"":""v1"",""created"":""Thu, 24 Jun 2010 19:42:39 GMT""}]","2010-08-06"
"1006.4866","Al\'an Aspuru-Guzik","Joel Yuen-Zhou, Jacob J. Krich, Masoud Mohseni, Al\'an Aspuru-Guzik","Quantum State and Process Tomography of Energy Transfer Systems via
  Ultrafast Spectroscopy","IMPORTANT: Supporting information in PDF format can be downloaded
  from source folder","Proceedings of the National Academy of Sciences of the United
  States of America, 2011 108 (43) 17615-17620","10.1073/pnas.1110642108",,"quant-ph cond-mat.mes-hall cond-mat.mtrl-sci physics.chem-ph","http://arxiv.org/licenses/nonexclusive-distrib/1.0/","  The description of excited state dynamics in multichromophoric systems
constitutes both a theoretical and experimental challenge in modern physical
chemistry. An experimental protocol which can systematically characterize both
coherent and dissipative processes at the level of the evolving quantum state
of the chromophores is desired. In this article, we show that a carefully
chosen set of polarization controlled two-color heterodyned photon-echo
experiments can be used to reconstruct the time-evolving density matrix of the
one-exciton manifold of a heterodimer. This possibility in turn allows for a
complete description of the excited state dynamics via quantum process
tomography (QPT). Calculations on the dimer show that QPT can reveal rich
information about system-bath interactions, which otherwise appear nontrivially
hidden in the polarization monitored in standard four-wave mixing experiments.
Our study presents a novel method for analyzing condensed phase experiments
with a quantum information processing perspective.
","[{""version"":""v1"",""created"":""Thu, 24 Jun 2010 19:45:11 GMT""},{""version"":""v2"",""created"":""Mon, 26 Jul 2010 19:10:29 GMT""},{""version"":""v3"",""created"":""Fri, 28 Oct 2011 07:35:11 GMT""}]","2011-10-31"
"1006.4867","Russell J. Smith","Russell J. Smith, John R. Lucey, Derek Hammer, Ann E. Hornschemeier,
  David Carter, Michael J. Hudson, Ronald O. Marzke, Mustapha Mouhcine, Sareh
  Eftekharzadeh, Phil James, Habib Khosroshahi, Ehsan Kourkchi, Arna Karick","Ultraviolet tails and trails in cluster galaxies: A sample of candidate
  gaseous stripping events in Coma","MNRAS, in press",,"10.1111/j.1365-2966.2010.17253.x",,"astro-ph.CO","http://arxiv.org/licenses/nonexclusive-distrib/1.0/","  We have used new deep observations of the Coma cluster from GALEX to identify
13 star-forming galaxies with asymmetric morphologies in the ultraviolet. Aided
by optical broad-band and H-alpha imaging, we interpret the asymmetric features
as being due to star formation within gas stripped from the galaxies by
interaction with the cluster environment. The selected objects display a range
of structures from broad fan-shaped systems of filaments and knots
(`jellyfish') to narrower and smoother tails extending up to 100 kpc in length.
Some of the features have been discussed previously in the literature, while
others are newly identified here. As an ensemble, the candidate stripping
events are located closer to the cluster centre than other star-forming
galaxies; their radial distribution is similar to that of all cluster members,
dominated by passive galaxies. The fraction of blue galaxies which are
undergoing stripping falls from 40% in the central 500 kpc, to less than 5%
beyond 1 Mpc. We find that tails pointing away from (i.e. galaxies moving
towards) the cluster centre are strongly favoured (11/13 cases). From the small
number of `outgoing' galaxies with stripping signatures we conclude that the
stripping events occur primarily on first passage towards the cluster centre,
and are short-lived compared to the cluster crossing time. Using infall
trajectories from simulations, the observed fraction of blue galaxies
undergoing stripping can be reproduced if the events are triggered at a
threshold radius of ~1 Mpc and detectable for ~500 Myr. HST images are
available for two galaxies from our sample and reveal compact blue knots
coincident with UV and H-alpha emission, apparently forming stars within the
stripped material. Our results confirm that stripping of gas from infalling
galaxies, and associated star formation in the stripped material, is a
widespread phenomenon in rich clusters.
","[{""version"":""v1"",""created"":""Thu, 24 Jun 2010 20:00:02 GMT""},{""version"":""v2"",""created"":""Mon, 28 Jun 2010 22:54:38 GMT""}]","2015-05-19"
"1006.4868","Qimiao Si","Seiji J. Yamamoto, Qimiao Si","Global Phase Diagram of the Kondo Lattice: From Heavy Fermion Metals to
  Kondo Insulators","(v3) leftover typos corrected. (v2) Published version. 32 pages, 4
  figures. Section 7, on the connection between the Kondo lattice systems and
  the holographic models of non-Fermi liquid, is expanded. (v1) special issue
  of JLTP on quantum criticality","J.Low.Temp.Phys.161:233-262,2010","10.1007/s10909-010-0221-4",,"cond-mat.str-el hep-th","http://arxiv.org/licenses/nonexclusive-distrib/1.0/","  We discuss the general theoretical arguments advanced earlier for the T=0
global phase diagram of antiferromagnetic Kondo lattice systems, distinguishing
between the established and the conjectured. In addition to the well-known
phase of a paramagnetic metal with a ""large"" Fermi surface (P_L), there is also
an antiferromagnetic phase with a ""small"" Fermi surface (AF_S). We provide the
details of the derivation of a quantum non-linear sigma-model (QNLsM)
representation of the Kondo lattice Hamiltonian, which leads to an effective
field theory containing both low-energy fermions in the vicinity of a Fermi
surface and low-energy bosons near zero momentum. An asymptotically exact
analysis of this effective field theory is made possible through the
development of a renormalization group procedure for mixed fermion-boson
systems. Considerations on how to connect the AF_S and P_L phases lead to a
global phase diagram, which not only puts into perspective the theory of local
quantum criticality for antiferromagnetic heavy fermion metals, but also
provides the basis to understand the surprising recent experiments in
chemically-doped as well as pressurized YbRh2Si2. We point out that the AF_S
phase still occurs for the case of an equal number of spin-1/2 local moments
and conduction electrons. This observation raises the prospect for a global
phase diagram of heavy fermion systems in the Kondo-insulator regime. Finally,
we discuss the connection between the Kondo breakdown physics discussed here
for the Kondo lattice systems and the non-Fermi liquid behavior recently
studied from a holographic perspective.
","[{""version"":""v1"",""created"":""Thu, 24 Jun 2010 20:00:03 GMT""},{""version"":""v2"",""created"":""Wed, 29 Sep 2010 17:49:15 GMT""},{""version"":""v3"",""created"":""Thu, 30 Sep 2010 04:15:20 GMT""}]","2011-03-28"
"1006.4869","Amy Ksir","David Joyner, Amy Ksir, and Caroline Grant Melles","Automorphism Groups on Tropical Curves: Some Cohomology Calculations","17 pages. Comments welcome. Version 2: plugged a small leak in the
  proof of Prop.1, section 5; fixed typos and added an acknowledgement",,,,"math.AG","http://creativecommons.org/licenses/by/3.0/","  Let $X$ be an abstract tropical curve and let $G$ be a finite subgroup of the
automorphism group of $X$. Let $D$ be a divisor on $X$ whose equivalence class
is $G$-invariant. We address the following question: is there always a divisor
$D'$ in the equivalence class of $D$ which is $G$-invariant? Our main result is
that the answer is ""yes"" for all abstract tropical curves. A key step in our
proof is a tropical analogue of Hilbert's Theorem 90.
","[{""version"":""v1"",""created"":""Thu, 24 Jun 2010 20:11:51 GMT""},{""version"":""v2"",""created"":""Mon, 18 Oct 2010 21:30:35 GMT""}]","2010-10-20"
"1006.4870","Craig Harrison","Craig Harrison, Matthew Colless, Harald Kuntschner, Warrick Couch,
  Roberto De Propris, Michael Pracy","The stellar populations of early-type galaxies -- I. Observations,
  line-strengths and stellar population parameters","17 pages, 9 figures, 7 tables, accepted by MNRAS",,"10.1111/j.1365-2966.2010.17349.x",,"astro-ph.CO","http://arxiv.org/licenses/nonexclusive-distrib/1.0/","  The influence of environment on the formation and evolution of early-type
galaxies is, as yet, an unresolved issue. Constraints can be placed on models
of early-type galaxy formation and evolution by examining their stellar
populations as a function of environment. We present a catalogue of galaxies
well suited to such an investigation. The magnitude-limited (b_J<19.45) sample
was drawn from four clusters (Coma, A1139, A3558, and A930 at <z>=0.04) and
their surrounds. The catalogue contains luminosities, redshifts, velocity
dispersions and Lick line strengths for 416 galaxies, of which 245 are
classified as early-types. Luminosity-weighted ages, metallicities, and
alpha-element abundance ratios have been estimated for 219 of these
early-types. We also outline the steps necessary for measuring fully-calibrated
Lick indices and estimating the associated stellar population parameters using
up-to-date methods and stellar population models. In a subsequent paper we
perform a detailed study of the stellar populations of early-type galaxies in
clusters and investigate the effects of environment.
","[{""version"":""v1"",""created"":""Thu, 24 Jun 2010 20:17:07 GMT""}]","2015-05-19"
"1006.4871","Sergey Bravyi","Sergey Bravyi, Bernhard Leemhuis, and Barbara M. Terhal","Topological order in an exactly solvable 3D spin model","39 pages, 15 figures","Ann. Phys., Vol. 326:4, page 839 (2011)","10.1016/j.aop.2010.11.002",,"quant-ph","http://arxiv.org/licenses/nonexclusive-distrib/1.0/","  We study a 3D generalization of the toric code model introduced recently by
Chamon. This is an exactly solvable spin model with six-qubit nearest neighbor
interactions on an FCC lattice whose ground space exhibits topological quantum
order. The elementary excitations of this model which we call monopoles can be
geometrically described as the corners of rectangular-shaped membranes. We
prove that the creation of an isolated monopole separated from other monopoles
by a distance R requires an operator acting on at least R^2 qubits. Composite
particles that consist of two monopoles (dipoles) and four monopoles
(quadrupoles) can be described as end-points of strings. The peculiar feature
of the model is that dipole-type strings are rigid, that is, such strings must
be aligned with face-diagonals of the lattice. For periodic boundary conditions
the ground space can encode 4g qubits where g is the greatest common divisor of
the lattice dimensions. We describe a complete set of logical operators acting
on the encoded qubits in terms of closed strings and closed membranes.
","[{""version"":""v1"",""created"":""Thu, 24 Jun 2010 20:20:05 GMT""}]","2015-05-19"
"1006.4872","Alfredo Donno","Daniele D'Angeli and Alfredo Donno","Generalized crested products of Markov chains","18 pages","European J. Combin. 32, Issue 2 (2011), 243-257",,,"math.PR math.CO","http://arxiv.org/licenses/nonexclusive-distrib/1.0/","  We define a finite Markov chain, called generalized crested product, which
naturally appears as a generalization of the first crested product of Markov
chains. A complete spectral analysis is developed and the $k$-step transition
probability is given. It is important to remark that this Markov chain
describes a more general version of the classical Ehrenfest diffusion model. As
a particular case, one gets a generalization of the classical Insect Markov
chain defined on the ultrametric space. Finally, an interpretation in terms of
representation group theory is given, by showing the correspondence between the
spectral decomposition of the generalized crested product and the Gelfand pairs
associated with the generalized wreath product of permutation groups.
","[{""version"":""v1"",""created"":""Thu, 24 Jun 2010 20:23:13 GMT""}]","2016-02-16"
"1006.4873","Oleg Gutik","Ivan Chuchman and Oleg Gutik","Topological monoids of almost monotone injective co-finite partial
  selfmaps of positive integers","10 pages","Carpathian Mathematical Publications 2 (2010), no. 1, 119-132",,,"math.GR math.GN","http://arxiv.org/licenses/nonexclusive-distrib/1.0/","  In this paper we study the semigroup $I_\infty^\dnearrow(N)$ of partial
co-finite almost monotone bijective transformations of the set of positive
integers $\mathbb{N}$. We show that the semigroup $I_\infty^\dnearrow(N)$ has
algebraic properties similar to the bicyclic semigroup: it is bisimple and all
of its non-trivial group homomorphisms are either isomorphisms or group
homomorphisms. Also we prove that every Baire topology $\tau$ on
$I_\infty^\dnearrow(N)$ such that $(I_\infty^\dnearrow(N),\tau)$ is a
semitopological semigroup is discrete, describe the closure of
$(I_\infty^\dnearrow(N),\tau)$ in a topological semigroup and construct
non-discrete Hausdorff semigroup topologies on $I_\infty^\dnearrow(N)$.
","[{""version"":""v1"",""created"":""Thu, 24 Jun 2010 20:25:12 GMT""},{""version"":""v2"",""created"":""Fri, 15 Oct 2010 08:38:19 GMT""}]","2010-10-18"
"1006.4874","Eduardo Mucciolo","Claudio Chamon, Eduardo R. Mucciolo, Liliana Arrachea, Rodrigo B.
  Capaz","Heat pumping in nanomechanical systems","4 pages, 1 figure, published version","Phys. Rev. Lett. 106, 135504 (2011)","10.1103/PhysRevLett.106.135504",,"cond-mat.mes-hall","http://arxiv.org/licenses/nonexclusive-distrib/1.0/","  We propose using a phonon pumping mechanism to transfer heat from a cold to a
hot body using a propagating modulation of the medium connecting the two
bodies. This phonon pump can cool nanomechanical systems without the need for
active feedback. We compute the lowest temperature that this refrigerator can
achieve.
","[{""version"":""v1"",""created"":""Thu, 24 Jun 2010 20:35:02 GMT""},{""version"":""v2"",""created"":""Fri, 11 Mar 2011 00:25:56 GMT""},{""version"":""v3"",""created"":""Thu, 7 Apr 2011 14:57:24 GMT""}]","2015-05-19"
"1006.4875","Alma Xochitl Gonzalez Morales","Dario Nunez, Alma X. Gonzalez Morales, Jorge L. Cervantes-Cota,
  Tonatiuh Matos","Testing DM halos using rotation curves and lensing: A warning on the
  determination of the halo mass","5 pages, 2 figures, accepted in Phys. Rev. D","Phys.Rev.D82:024025,2010","10.1103/PhysRevD.82.024025",,"astro-ph.GA gr-qc","http://arxiv.org/licenses/nonexclusive-distrib/1.0/","  There are two observations of galaxies that can offer some insight into the
nature of the dark matter (DM), namely the rotation curves and the
gravitational lensing. While the first one can be studied using the Newtonian
limit, the second one is completely relativistic. Each one separately can not
determine the nature of DM, but both together give us key information about
this open problem. In this work we use a static and spherically symmetric
metric to model the DM halo in a galaxy or in a galaxy cluster. The metric
contains two free functions, one associated with the distribution of mass and
the other one with the gravitational potential. We use galactic, typical
rotation curves to univocally determine the kinematics of the halos. We compute
separately the mass functions for a perfect fluid and a scalar field, and
demonstrate that both models can be fitted to the observations, though with
different masses. We then employ lensing to discriminate between these models.
This procedure represents a test of models using two measurements: rotation
curves and lensing.
","[{""version"":""v1"",""created"":""Thu, 24 Jun 2010 20:38:30 GMT""}]","2014-11-21"
"1006.4876","Nathan Mayne Dr","Nathan Mayne","Observational indicators of the transition from fully convective stars
  to stars with radiative cores","9 pages and 6 figures. Accepted for publication in MNRAS",,"10.1111/j.1365-2966.2010.17245.x",,"astro-ph.SR astro-ph.EP","http://arxiv.org/licenses/nonexclusive-distrib/1.0/","  We present a discussion of the similarities and key differences between the
transition onto (at the turn-on) and away from (at the turn-off) the main
sequence, the latter termed the Hertzsprung gap. Using a set of model
isochrones and adopting an initial mass function leads us to predict a dearth
of G-type stars for any star forming region. This is caused by the (relatively)
constant spectral type at which the transition from a fully convective star to
a star with a radiative core begins. We also present analysis of the details of
this transition in the ONC. In particular we show that a gap in the photometric
and spectral type distributions is centred on, and a change in the fractional
X-ray luminosity and rotation rate distribution occurs approximately at, the
position of a peak in radiative core size as a function of mass. Whilst
photometric signatures of this transition are lost at ages over ~20 Myrs, we
show that changes in fractional X-ray luminosity and magnetic field
configuration persist to older ages. Analysis of literature data show that the
mass at which the change in fractional X-ray luminosity is observed decreases
with age.
","[{""version"":""v1"",""created"":""Thu, 24 Jun 2010 20:51:51 GMT""}]","2015-05-19"
"1006.4878","Mattias Marklund","A. P. Misra, G. Brodin, M. Marklund, P. K. Shukla","Circularly polarized modes in magnetized spin plasmas","10 pages",,"10.1017/S0022377810000450",,"physics.plasm-ph","http://arxiv.org/licenses/nonexclusive-distrib/1.0/","  The influence of the intrinsic spin of electrons on the propagation of
circularly polarized waves in a magnetized plasma is considered. New eigenmodes
are identified, one of which propagates below the electron cyclotron frequency,
one above the spin-precession frequency, and another close to the
spin-precession frequency.\ The latter corresponds to the spin modes in
ferromagnets under certain conditions. In the nonrelativistic motion of
electrons, the spin effects become noticeable even when the external magnetic
field $B_{0}$ is below the quantum critical\ magnetic field strength, i.e.,
$B_{0}<$ $B_{Q} =4.4138\times10^{9}\, \mathrm{T}$ and the electron density
satisfies $n_{0} \gg n_{c}\simeq10^{32}$m$^{-3}$. The importance of electron
spin (paramagnetic) resonance (ESR) for plasma diagnostics is discussed.
","[{""version"":""v1"",""created"":""Thu, 24 Jun 2010 21:10:51 GMT""}]","2015-05-19"
