"1006.5051","Ping Li","Ping Li","Fast ABC-Boost for Multi-Class Classification",,,,,"cs.LG stat.ML","http://arxiv.org/licenses/nonexclusive-distrib/1.0/","  Abc-boost is a new line of boosting algorithms for multi-class
classification, by utilizing the commonly used sum-to-zero constraint. To
implement abc-boost, a base class must be identified at each boosting step.
Prior studies used a very expensive procedure based on exhaustive search for
determining the base class at each boosting step. Good testing performances of
abc-boost (implemented as abc-mart and abc-logitboost) on a variety of datasets
were reported.
  For large datasets, however, the exhaustive search strategy adopted in prior
abc-boost algorithms can be too prohibitive. To overcome this serious
limitation, this paper suggests a heuristic by introducing Gaps when computing
the base class during training. That is, we update the choice of the base class
only for every $G$ boosting steps (i.e., G=1 in prior studies). We test this
idea on large datasets (Covertype and Poker) as well as datasets of moderate
sizes. Our preliminary results are very encouraging. On the large datasets,
even with G=100 (or larger), there is essentially no loss of test accuracy. On
the moderate datasets, no obvious loss of test accuracy is observed when G<=
20~50. Therefore, aided by this heuristic, it is promising that abc-boost will
be a practical tool for accurate multi-class classification.
","[{""version"":""v1"",""created"":""Fri, 25 Jun 2010 19:48:50 GMT""}]","2010-06-28"
"1006.5052","Manoranjan Kumar","Manoranjan Kumar, S. Ramasesha and Z.G. Soos","Bond-order wave phase, spin solitons and thermodynamics of a frustrated
  linear spin-1/2 Heisenberg antiferromagnet","10 pages, 12 figures","Published as Phys. Rev. B 81, 054413 (2010)","10.1103/PhysRevB.81.054413",,"cond-mat.str-el","http://arxiv.org/licenses/nonexclusive-distrib/1.0/","  The linear spin-1/2 Heisenberg antiferromagnet with exchanges $J_1$, $J_2$
between first and second neighbors has a bond-order wave (BOW) phase that
starts at the fluid-dimer transition at $J_2/J_1 = 0.2411$ and is particularly
simple at $J_2/J_1 = 1/2$. The BOW phase has a doubly degenerate singlet ground
state, broken inversion symmetry and a finite energy gap $E_m$ to the lowest
triplet state.
  The interval $0.4<J_2/J_1<1.0$ has large $E_m$ and small finite size
corrections. Exact solutions are presented up to $N=28$ spins with either
periodic or open boundary conditions and for thermodynamics up to $N=18$. The
elementary excitations of the BOW phase with large $E_m$ are topological
spin-1/2 solitons that separate BOWs with opposite phase in a regular array of
spins. The molar spin susceptibility $\chi_M(T)$ is exponentially small for $T
\ll E_m$ and increases nearly linearly with $T$ to a broad maximum. $J_1$,
$J_2$ spin chains approximate the magnetic properties of the BOW phase of
Hubbard-type models and provide a starting point for modeling alkali-TCNQ
salts.
","[{""version"":""v1"",""created"":""Fri, 25 Jun 2010 19:50:19 GMT""}]","2010-06-28"
"1006.5053","Guillaume Chapuy","Guillaume Chapuy","A new combinatorial identity for unicellular maps, via a direct
  bijective approach",,"Advances in Applied Mathematics, 47(4):874-893 (2011)",,,"math.CO","http://arxiv.org/licenses/nonexclusive-distrib/1.0/","  A unicellular map, or one-face map, is a graph embedded in an orientable
surface such that its complement is a topological disk. In this paper, we give
a new viewpoint to the structure of these objects, by describing a
decomposition of any unicellular map into a unicellular map of smaller genus.
This gives a new combinatorial identity for the number $\epsilon_g(n)$ of
unicellular maps of size $n$ and genus $g$. Contrarily to the Harer-Zagier
recurrence formula, this identity is recursive in only one parameter (the
genus). Iterating the construction gives an explicit bijection between
unicellular maps and plane trees with distinguished vertices, which gives a
combinatorial explanation (and proof) of the fact that $\epsilon_g(n)$ is the
product of the $n$-th Catalan number by a polynomial in $n$. The combinatorial
interpretation also gives a new and simple formula for this polynomial.
Variants of the problem are considered, like bipartite unicellular maps, or
unicellular maps with cubic vertices only.
","[{""version"":""v1"",""created"":""Fri, 25 Jun 2010 19:51:44 GMT""}]","2012-03-15"
"1006.5054","Jose Geraldo Peixoto de Faria","J. G. Oliveira Junior, J. G. Peixoto de Faria and M. C. Nemes","Residual entanglement and sudden death: A direct connection","8 pages, 6 figures, to appear in PLA, DOI information:
  10.1016/j.physleta.2011.10.020",,"10.1016/j.physleta.2011.10.020",,"quant-ph math-ph math.MP","http://arxiv.org/licenses/nonexclusive-distrib/1.0/","  We explore the results of [V. Coffman, et al., Phys. Rev. A 61 (2000) 052306]
derived for general tripartite states in a dynamical context. We study a class
of physically motivated tripartite systems. We show that whenever entanglement
sudden death occurs in one of the partitions residual entanglement will appear.
For fourpartite systems however, the appearance of residual entanglement is not
conditioned by sudden death of entanglement. We can only say that if sudden
death of entanglement occurs in some partition there will certainly be residual
entanglement.
","[{""version"":""v1"",""created"":""Fri, 25 Jun 2010 19:52:32 GMT""},{""version"":""v2"",""created"":""Sun, 30 Oct 2011 01:49:20 GMT""}]","2011-11-01"
"1006.5055","Guangtun Zhu","Guangtun Zhu, Michael R. Blanton (NYU), and John Moustakas (UCSD)","Stellar Populations of Elliptical Galaxies in the Local Universe","Accepted to ApJ, in emulateapj style, 3 tables, 23 figures. Minor
  changes. Samples are available on http://bias.cosmo.fas.nyu.edu/galevolution/",,"10.1088/0004-637X/722/1/491",,"astro-ph.CO","http://arxiv.org/licenses/nonexclusive-distrib/1.0/","  We study the stellar populations of 1,923 elliptical galaxies at z<0.05
selected from the Sloan Digital Sky Survey as a function of velocity
dispersion, sigma, and environment. We construct average, high signal-to-noise
spectra and find the following: (1) lower-sigma galaxies have a bluer optical
continuum and stronger (but still weak) emission lines; (2) at fixed sigma,
field ellipticals have a slightly bluer stellar continuum, especially at
wavelengths \lesssim 4000 \AA, and have stronger (but still weak) emission
lines compared to their group counterparts, although this environmental
dependence is strongest for low-sigma ellipticals. Based on Lick indices
measured from both the individual and average spectra, we find that: (1) at a
given sigma, elliptical galaxies in groups have systematically weaker Balmer
absorption than their field counterparts, although this environmental
dependence is most pronounced at low sigma; (2) there is no clear environmental
dependence of <Fe>, while the alpha-element absorption indices such as Mgb are
only slightly stronger in galaxies belonging to rich groups. An analysis based
on simple stellar populations (SSPs) reveals that more massive elliptical
galaxies are older, more metal-rich and more strongly alpha-enhanced. We also
find that: (1) the SSP-equivalent ages of galaxies in rich groups are, on
average, ~1 Gyr older than in the field, although once again this effect is
strongest at low sigma; (2) galaxies in rich groups have slightly lower [Fe/H]
and are marginally more strongly alpha-enhanced; and (3) there is no
significant environmental dependence of total metallicity, [Z/H]. Our results
are generally consistent with stronger low-level recent star formation in field
ellipticals at low sigma, similar to recent results based on ultraviolet and
infrared observations. (Abridged)
","[{""version"":""v1"",""created"":""Fri, 25 Jun 2010 20:00:21 GMT""},{""version"":""v2"",""created"":""Tue, 17 Aug 2010 21:16:50 GMT""}]","2015-05-19"
"1006.5056","Essam Abulwafa","El-Said A. El-Wakil, Essam M. Abulwafa, Emad K. El-shewy and Abeer A.
  Mahmoud","Ion-Acoustic Waves in Unmagnitized Collisionless Weakly Relativistic
  Plasma using Time-Fractional KdV Equation","16 pages+5 figures",,,,"physics.plasm-ph nlin.PS","http://arxiv.org/licenses/nonexclusive-distrib/1.0/","  The reductive perturbation method has been employed to derive the Korteweg-de
Vries (KdV) equation for small but finite amplitude electrostatic ion-acoustic
waves in unmagnitized collisionless weakly relativistic warm plasma. The
Lagrangian of the time fractional KdV equation is used in similar form to the
Lagrangian of the regular KdV equation. The variation of the functional of this
Lagrangian leads to the Euler-Lagrange equation that leads to the time
fractional KdV equation. The Riemann-Liouvulle definition of the fractional
derivative is used to describe the time fractional operator in the fractional
KdV equation. The variational-iteration method given by He is used to solve the
derived time fractional KdV equation. The calculations of the solution with
initial condition A0*sech(cx)^2 are carried out. The result of the present
investigation may be applicable to some plasma environments, such as
ionosphere.
","[{""version"":""v1"",""created"":""Fri, 25 Jun 2010 20:16:36 GMT""}]","2010-06-29"
"1006.5057","Kasper Larsen","Kasper Larsen, Hang Yu","Horizon dependence of utility optimizers in incomplete models",,,,,"q-fin.PM","http://arxiv.org/licenses/nonexclusive-distrib/1.0/","  This paper studies the utility maximization problem with changing time
horizons in the incomplete Brownian setting. We first show that the primal
value function and the optimal terminal wealth are continuous with respect to
the time horizon $T$. Secondly, we exemplify that the expected utility stemming
from applying the $T$-horizon optimizer on a shorter time horizon $S$, $S < T$,
may not converge as $S\uparrow T$ to the $T$-horizon value. Finally, we provide
necessary and sufficient conditions preventing the existence of this
phenomenon.
","[{""version"":""v1"",""created"":""Fri, 25 Jun 2010 20:16:40 GMT""},{""version"":""v2"",""created"":""Thu, 30 Sep 2010 01:09:43 GMT""},{""version"":""v3"",""created"":""Fri, 1 Oct 2010 14:19:14 GMT""}]","2010-10-04"
"1006.5058","Brice Rodrigue Mbombo Dempowo Jr","Yousef Al-Gadid, Brice R. Mbombo, Vladimir G. Pestov","Sur les espaces test pour la moyennabilit\'e","12 pages, French language, Latex 2e. The final submission to C.R.
  Math. Rep. Acad. Sci. Canada. taking into account referee's remarks","C. R. Math. Acad. Sci. Soc. R. Canada, Vol.33 (2011), No. 3, pp.
  65-77",,,"math.GR","http://arxiv.org/licenses/nonexclusive-distrib/1.0/","  We observe that a Polish group $G$ is amenable if and only if every
continuous action of $G$ on the Hilbert cube admits an invariant probability
measure. This generalizes a result of Bogatyi and Fedorchuk. We also show that
actions on the Cantor space can be used to detect amenability and extreme
amenability of Polish non-archimedean groups as well as amenability at infinity
of discrete countable groups. As corollary, the latter property can also be
tested by actions on the Hilbert cube. These results generalize a criterion due
to Giordano and de la Harpe.
","[{""version"":""v1"",""created"":""Fri, 25 Jun 2010 20:19:04 GMT""},{""version"":""v2"",""created"":""Wed, 18 Aug 2010 17:25:08 GMT""},{""version"":""v3"",""created"":""Sun, 22 Aug 2010 22:54:07 GMT""},{""version"":""v4"",""created"":""Thu, 26 Aug 2010 18:37:00 GMT""},{""version"":""v5"",""created"":""Mon, 23 May 2011 17:23:48 GMT""},{""version"":""v6"",""created"":""Wed, 25 May 2011 09:47:26 GMT""}]","2011-08-08"
"1006.5059","Claudine Badue","Claudine Badue, Jussara Almeida, Virgilio Almeida, Ricardo
  Baeza-Yates, Berthier Ribeiro-Neto, Artur Ziviani, Nivio Ziviani","Capacity Planning for Vertical Search Engines",,,,,"cs.IR","http://arxiv.org/licenses/nonexclusive-distrib/1.0/","  Vertical search engines focus on specific slices of content, such as the Web
of a single country or the document collection of a large corporation. Despite
this, like general open web search engines, they are expensive to maintain,
expensive to operate, and hard to design. Because of this, predicting the
response time of a vertical search engine is usually done empirically through
experimentation, requiring a costly setup. An alternative is to develop a model
of the search engine for predicting performance. However, this alternative is
of interest only if its predictions are accurate. In this paper we propose a
methodology for analyzing the performance of vertical search engines. Applying
the proposed methodology, we present a capacity planning model based on a
queueing network for search engines with a scale typically suitable for the
needs of large corporations. The model is simple and yet reasonably accurate
and, in contrast to previous work, considers the imbalance in query service
times among homogeneous index servers. We discuss how we tune up the model and
how we apply it to predict the impact on the query response time when
parameters such as CPU and disk capacities are changed. This allows a manager
of a vertical search engine to determine a priori whether a new configuration
of the system might keep the query response under specified performance
constraints.
","[{""version"":""v1"",""created"":""Fri, 25 Jun 2010 20:22:08 GMT""}]","2010-06-29"
"1006.5060","Xiaohui Xie","Gui-Bo Ye and Xiaohui Xie","Learning sparse gradients for variable selection and dimension reduction",,,,,"stat.ML cs.LG stat.ME","http://arxiv.org/licenses/nonexclusive-distrib/1.0/","  Variable selection and dimension reduction are two commonly adopted
approaches for high-dimensional data analysis, but have traditionally been
treated separately. Here we propose an integrated approach, called sparse
gradient learning (SGL), for variable selection and dimension reduction via
learning the gradients of the prediction function directly from samples. By
imposing a sparsity constraint on the gradients, variable selection is achieved
by selecting variables corresponding to non-zero partial derivatives, and
effective dimensions are extracted based on the eigenvectors of the derived
sparse empirical gradient covariance matrix. An error analysis is given for the
convergence of the estimated gradients to the true ones in both the Euclidean
and the manifold setting. We also develop an efficient forward-backward
splitting algorithm to solve the SGL problem, making the framework practically
scalable for medium or large datasets. The utility of SGL for variable
selection and feature extraction is explicitly given and illustrated on
artificial data as well as real-world examples. The main advantages of our
method include variable selection for both linear and nonlinear predictions,
effective dimension reduction with sparse loadings, and an efficient algorithm
for large p, small n problems.
","[{""version"":""v1"",""created"":""Fri, 25 Jun 2010 20:27:00 GMT""},{""version"":""v2"",""created"":""Thu, 1 Jul 2010 05:06:43 GMT""}]","2010-07-02"
"1006.5061","Sergiy Vorobyov A.","Xiaowen Gong, Sergiy A. Vorobyov, and Chintha Tellambura","Optimal Bandwidth and Power Allocation for Sum Ergodic Capacity under
  Fading Channels in Cognitive Radio Networks","28 pages, 6 figures, submitted to the IEEE Trans. Signal Processing
  in June 2010","X. Gong, S.A. Vorobyov, C. Tellambura, ""Optimal bandwidth and
  power allocation for sum ergodic capacity under fading channels in cognitive
  radio networks,"" IEEE Trans. Signal Processing, vol. 59, no. 4, pp.
  1814-1826, Apr. 2011","10.1109/TSP.2010.2101069",,"cs.IT math.IT","http://arxiv.org/licenses/nonexclusive-distrib/1.0/","  This paper studies optimal bandwidth and power allocation in a cognitive
radio network where multiple secondary users (SUs) share the licensed spectrum
of a primary user (PU) under fading channels using the frequency division
multiple access scheme. The sum ergodic capacity of all the SUs is taken as the
performance metric of the network. Besides all combinations of the peak/average
transmit power constraints at the SUs and the peak/average interference power
constraint imposed by the PU, total bandwidth constraint of the licensed
spectrum is also taken into account. Optimal bandwidth allocation is derived in
closed-form for any given power allocation. The structures of optimal power
allocations are also derived under all possible combinations of the
aforementioned power constraints. These structures indicate the possible
numbers of users that transmit at nonzero power but below their corresponding
peak powers, and show that other users do not transmit or transmit at their
corresponding peak power. Based on these structures, efficient algorithms are
developed for finding the optimal power allocations.
","[{""version"":""v1"",""created"":""Fri, 25 Jun 2010 20:30:48 GMT""}]","2015-05-19"
"1006.5062","Plamen Iliev","Plamen Iliev and Paul Terwilliger","The Rahman polynomials and the Lie algebra sl_3(C)",,"Trans. Amer. Math. Soc. 364 (2012), no. 8, 4225--4238","10.1090/S0002-9947-2012-05495-X",,"math.RT math.CA","http://arxiv.org/licenses/nonexclusive-distrib/1.0/","  We interpret the Rahman polynomials in terms of the Lie algebra $sl_3(C)$.
Using the parameters of the polynomials we define two Cartan subalgebras for
$sl_3(C)$, denoted $H$ and $\tilde{H}$. We display an antiautomorphism
$\dagger$ of $sl_3(C)$ that fixes each element of $H$ and each element of
$\tilde{H}$. We consider a certain finite-dimensional irreducible
$sl_3(C)$-module $V$ consisting of homogeneous polynomials in three variables.
We display a nondegenerate symmetric bilinear form $<,>$ on $V$ such that
$<\beta \xi,\zeta> = < \xi,\beta^\dagger \zeta>$ for all $\beta \in sl_3(C)$
and $\xi,\zeta \in V$. We display two bases for $V$; one diagonalizes $H$ and
the other diagonalizes $\tilde{H}$. Both bases are orthogonal with respect to
$<,>$. We show that when $<,>$ is applied to a vector in each basis, the result
is a trivial factor times a Rahman polynomial evaluated at an appropriate
argument. Thus for both transition matrices between the bases each entry is
described by a Rahman polynomial. From these results we recover the previously
known orthogonality relation for the Rahman polynomials. We also obtain two
seven-term recurrence relations satisfied by the Rahman polynomials, along with
the corresponding relations satisfied by the dual polynomials. These recurrence
relations show that the Rahman polynomials are bispectral. In our theory the
roles of $H$ and $\tilde{H}$ are interchangable, and for us this explains the
duality and bispectrality of the Rahman polynomials. We view the action of $H$
and $\tilde{H}$ on $V$ as a rank 2 generalization of a Leonard pair.
","[{""version"":""v1"",""created"":""Fri, 25 Jun 2010 20:33:32 GMT""}]","2012-04-25"
"1006.5063","Matthew Gonderinger","Matthew Gonderinger and Michael J. Ramsey-Musolf","Electron-to-Tau Lepton Flavor Violation at the Electron-Ion Collider","19 pages, 7 figures","JHEP 1011:045,2010","10.1007/JHEP11(2010)045","NPAC-10-09","hep-ph","http://arxiv.org/licenses/nonexclusive-distrib/1.0/","  We analyze the potential sensitivity of a search for $e\rightarrow\tau$
conversion at a proposed electron-ion collider (EIC) facility. To that end, we
calculate the cross sections for $e\rightarrow\tau$ events in a leptoquark
framework assuming that the leptoquark masses are on the order of several
hundred GeV or more. Given present limits on leptoquarks from direct searches
at HERA and rare decay processes, an EIC sensitive to 0.1 fb $e\rightarrow\tau$
cross sections could probe previously unexplored regions of parameter space for
these lepton flavor violating events (assuming 90 GeV center-of-mass energy and
10 fb$^{-1}$ integrated luminosity). Depending on the species of leptoquark and
flavor structure of the couplings, an EIC search could surpass the HERA and
rare process sensitivity to $e\rightarrow\tau$ conversion amplitudes by as much
as an order of magnitude or more. We also derive updated limits on quark
flavor-diagonal LFV leptoquark interactions using the most recent BaBar
$\tau\rightarrow e\gamma$ search. We find that limits from an EIC
$e\rightarrow\tau$ search could be competitive with the most recent
$\tau\rightarrow e\gamma$ limit for a subset of the quark flavor-diagonal
leptoquark couplings. Using an SU(5) GUT model in which leptoquark couplings
are constrained by the neutrino masses and mixing, we illustrate how observable
leptoquark-induced $e\rightarrow\tau$ conversion can be consistent with
stringent LFV limits imposed by $\mu\rightarrow e\gamma$ and $\mu\rightarrow e$
conversion searches.
","[{""version"":""v1"",""created"":""Fri, 25 Jun 2010 20:35:29 GMT""}]","2010-11-17"
"1006.5064","Matt Mahoney","J. Matthew Mahoney","A Composition Formula for Asymptotic Morphisms",,,,,"math.KT math.FA math.OA","http://arxiv.org/licenses/nonexclusive-distrib/1.0/","  For graded $C^*$-algebras $A$ and $B$, we construct a semigroup ${\cal
AP}(A,B)$ out of asymptotic pairs. This semigroup is similar to the semigroup
$\Psi(A,B)$ of unbounded KK-modules defined by Baaj and Julg and there is a map
$\Psi(A,B) \to {\cal AP}(A,B)$ when $B$ is stable. Furthermore, there is a
natural semigroup homomorphism ${\cal AP}(A,B) \to E(A,B)$, where $E(A,B)$ is
the E-theory group. We denote the image of this map $E'(A,B)$ and prove both
that $E'(A,B)$ is a group and that the composition product of E-theory
specializes to a composition product on these subgroups. Our main result is a
formula for the composition product on $E'$ under certain operator-theoretic
hypotheses about the asymptotic pairs being composed. This result is
complementary to known results about the Kasparov product of unbounded
KK-modules.
","[{""version"":""v1"",""created"":""Fri, 25 Jun 2010 20:36:47 GMT""}]","2010-06-29"
"1006.5065","Ronald Elsner","Ronald F. Elsner, Stephen L. O'Dell, Brian D. Ramsey, and Martin C.
  Weisskopf","Methods of optimizing X-ray optical prescriptions for wide-field
  applications","14 pages, to be presented at SPIE conference 7732 (paper 93)",,"10.1117/12.856420",,"astro-ph.IM astro-ph.HE","http://creativecommons.org/licenses/publicdomain/","  We are working on the development of a method for optimizing wide-field X-ray
telescope mirror prescriptions, including polynomial coefficients, mirror shell
relative displacements, and (assuming 4 focal plane detectors) detector
placement along the optical axis and detector tilt. With our methods, we hope
to reduce number of Monte-Carlo ray traces required to search the
multi-dimensional design parameter space, and to lessen the complexity of
finding the optimum design parameters in that space. Regarding higher order
polynomial terms as small perturbations of an underlying Wolter I optic design,
we begin by using the results of Monte-Carlo ray traces to devise trial
analytic functions, for an individual Wolter I mirror shell, that can be used
to represent the spatial resolution on an arbitrary focal surface. We then
introduce a notation and tools for Monte-Carlo ray tracing of a polynomial
mirror shell prescription which permits the polynomial coefficients to remain
symbolic. In principle, given a set of parameters defining the underlying
Wolter I optics, a single set of Monte-Carlo ray traces are then sufficient to
determine the polymonial coefficients through the solution of a large set of
linear equations in the symbolic coefficients. We describe the present status
of this development effort.
","[{""version"":""v1"",""created"":""Fri, 25 Jun 2010 20:38:12 GMT""}]","2015-05-19"
"1006.5066","Sergiy Vorobyov A.","Youngwook Ko, Masoud Ardakani, and Sergiy A. Vorobyov","Power Allocation Strategies across N Orthogonal Channels at Both Source
  and Relay","24 pages, 8 figures, submitted to the IEEE Trans. Communications in
  March 2010","Y. Ko, M. Ardakani, and S.A. Vorobyov, ""Power allocation
  strategies across N orthogonal channels at both source and relay,"" IEEE
  Trans. Communications, vol. 60, no. 6, pp. 1469-1473, June 2012",,,"cs.IT math.IT","http://arxiv.org/licenses/nonexclusive-distrib/1.0/","  We consider a wireless relay network with one source, one relay and one
destination, where communications between nodes are preformed via N orthogonal
channels. This, for example, is the case when orthogonal frequency division
multiplexing is employed for data communications. Since the power available at
the source and relay is limited, we study optimal power allocation strategies
at the source and relay in order to maximize the overall source-destination
capacity under individual power constraints at the source and/or the relay.
Depending on the availability of the channel state information at the source
and rely, optimal power allocation strategies are performed at both the source
and relay or only at the relay. Considering different setups for the problem,
various optimization problems are formulated and solved. Some properties of the
optimal solution are also proved.
","[{""version"":""v1"",""created"":""Fri, 25 Jun 2010 20:42:06 GMT""}]","2013-02-20"
