"1006.5087","Lei Zhou","Lei Zhou and Wei Yu","Gaussian Z-Interference Channel with a Relay Link: Achievability Region
  and Asymptotic Sum Capacity","IEEE Transactions on Information Theory, Vol. 58, No. 4, April 2012",,,,"cs.IT math.IT","http://creativecommons.org/licenses/publicdomain/","  This paper studies a Gaussian Z-interference channel with a rate-limited
digital relay link from one receiver to another. Achievable rate regions are
derived based on a combination of Han-Kobayashi common-private information
splitting technique and several different relay strategies including
compress-and-forward and a partial decode-and-forward strategy, in which the
interference is partially decoded then binned and forwarded through the digital
link for subtraction at the other end. For the Gaussian Z-interference channel
with a digital link from the interference-free receiver to the interfered
receiver, the capacity region is established in the strong interference regime;
an achievable rate region is established in the weak interference regime. In
the weak interference regime, the partial decode-and-forward strategy is shown
to be asymptotically sum-capacity achieving in the high signal-to-noise ratio
and high interference-to-noise ratio limit. In this case, each relay bit
asymptotically improves the sum capacity by one bit. For the Gaussian
Z-interference channel with a digital link from the interfered receiver to the
interference-free receiver, the capacity region is established in the strong
interference regime; achievable rate regions are established in the moderately
strong and weak interference regimes. In addition, the asymptotically sum
capacity is established in the limit of large relay link rate. In this case,
the sum capacity improvement due to the digital link is bounded by half a bit
when the interference link is weaker than certain threshold, but the sum
capacity improvement becomes unbounded as the interference link becomes
stronger.
","[{""version"":""v1"",""created"":""Sat, 26 Jun 2010 00:49:34 GMT""},{""version"":""v2"",""created"":""Sat, 29 Oct 2011 06:07:22 GMT""},{""version"":""v3"",""created"":""Sat, 10 Dec 2011 04:05:24 GMT""},{""version"":""v4"",""created"":""Wed, 25 Apr 2012 19:07:47 GMT""}]","2012-04-26"
"1006.5088","Edward Green","Dave Pandres, Jr","Gravitational and electroweak unification by replacing diffeomorphisms
  with larger group","28 pages,","Gen.Rel.Grav.41:2501-2528,2009","10.1007/s10714-009-0788-8",,"gr-qc","http://arxiv.org/licenses/nonexclusive-distrib/1.0/","  The covariance group for general relativity, the diffeomorphisms, is replaced
by a group of coordinate transformations which contains the diffeomorphisms as
a proper subgroup. The larger group is defined by the assumption that all
observers will agree whether any given quantity is conserved. Alternatively,
and equivalently, it is defined by the assumption that all observers will agree
that the general relativistic wave equation describes the propagation of light.
Thus, the group replacement is analogous to the replacement of the Lorentz
group by the diffeomorphisms that led Einstein from special relativity to
general relativity, and is also consistent with the assumption of constant
light velocity that led him to special relativity. The enlarged covariance
group leads to a non-commutative geometry based not on a manifold, but on a
nonlocal space in which paths, rather than points, are the most primitive
invariant entities. This yields a theory which unifies the gravitational and
electroweak interactions. The theory contains no adjustable parameters, such as
those that are chosen arbitrarily in the standard model.
","[{""version"":""v1"",""created"":""Sat, 26 Jun 2010 01:05:27 GMT""}]","2012-08-27"
"1006.5089","Didier Queloz","Didier Queloz and David Anderson and Andrew Collier Cameron and
  Micha\""el Gillon and Leslie Hebb and Coel Hellier and Pierre Maxted and
  Francesco Pepe and Don Pollacco and Damien S\'egransan and Barry Smalley and
  Amaury H.M.J Triaud and St\'ephane Udry and Richard West","WASP-8b: a retrograde transiting planet in a multiple system","A&A Letter Accepted (21/6/2010)",,"10.1051/0004-6361/201014768",,"astro-ph.EP","http://arxiv.org/licenses/nonexclusive-distrib/1.0/","  We report the discovery of WASP-8, a transiting planet of 2.25+-0.08 M_Jup on
a strongly inclined eccentric 8.15-day orbit, moving in a retrograde direction
to the rotation of its late-G host star. Evidence is found that the star is in
a multiple stellar system with two other companions. The dynamical complexity
of the system indicates that it may have experienced secular interactions such
as the Kozai mechanism or a formation that differs from the ``classical""
disc-migration theory.
","[{""version"":""v1"",""created"":""Sat, 26 Jun 2010 01:33:12 GMT""}]","2015-05-19"
"1006.5090","Vladimir Pestov","Vladimir Pestov","PAC learnability of a concept class under non-atomic measures: a problem
  by Vidyasagar","14 pages, 1 figure, latex 2e with Springer macros","Lect. Notes in Artificial Intelligence 6331, Springer, 2010, pp.
  134-147",,,"cs.LG","http://arxiv.org/licenses/nonexclusive-distrib/1.0/","  In response to a 1997 problem of M. Vidyasagar, we state a necessary and
sufficient condition for distribution-free PAC learnability of a concept class
$\mathscr C$ under the family of all non-atomic (diffuse) measures on the
domain $\Omega$. Clearly, finiteness of the classical Vapnik-Chervonenkis
dimension of $\mathscr C$ is a sufficient, but no longer necessary, condition.
Besides, learnability of $\mathscr C$ under non-atomic measures does not imply
the uniform Glivenko-Cantelli property with regard to non-atomic measures. Our
learnability criterion is stated in terms of a combinatorial parameter
$\VC({\mathscr C}\,{\mathrm{mod}}\,\omega_1)$ which we call the VC dimension of
$\mathscr C$ modulo countable sets. The new parameter is obtained by
``thickening up'' single points in the definition of VC dimension to
uncountable ``clusters''. Equivalently, $\VC(\mathscr C\modd\omega_1)\leq d$ if
and only if every countable subclass of $\mathscr C$ has VC dimension $\leq d$
outside a countable subset of $\Omega$. The new parameter can be also expressed
as the classical VC dimension of $\mathscr C$ calculated on a suitable subset
of a compactification of $\Omega$. We do not make any measurability assumptions
on $\mathscr C$, assuming instead the validity of Martin's Axiom (MA).
","[{""version"":""v1"",""created"":""Sat, 26 Jun 2010 01:44:57 GMT""}]","2010-11-08"
"1006.5091","Dilian Yang","Dilian Yang","Functional Equations and Fourier Analysis","8 pages, to appear in CMB","Can. Math. Bull. 56 (2013) 218-224","10.4153/CMB-2011-136-7",,"math.FA","http://arxiv.org/licenses/nonexclusive-distrib/1.0/","  By exploring the relations among functional equations, harmonic analysis and
representation theory, we give a unified and very accessible approach to solve
three important functional equations -- the d'Alembert equation, the Wilson
equation, and the d'Alembert long equation, on compact groups.
","[{""version"":""v1"",""created"":""Sat, 26 Jun 2010 02:06:21 GMT""}]","2019-08-15"
"1006.5092","Glen D. Anderson","G. D. Anderson and M. Vuorinen","Reflections on Ramanujan's Mathematical Gems",,,,,"math.CV","http://arxiv.org/licenses/nonexclusive-distrib/1.0/","  The authors provide a survey of certain aspects of their joint work with the
late M. K. Vamanamurthy. Most of the results are simple to state and deal with
special functions, a topic of research where S. Ramanujan's contributions are
well-known landmarks. The comprehensive bibliography includes references to the
latest contributions to this field.
","[{""version"":""v1"",""created"":""Sat, 26 Jun 2010 02:07:10 GMT""}]","2010-06-29"
"1006.5093","Paulo Cortes","P. C. Cortes, R. Parra, J. R. Cortes, E. Hardy","G30.79~FIR~10: A gravitationally bound infalling high-Mass star forming
  clump","Accepted for publication by Astronomy and Astrophysics",,"10.1051/0004-6361/200811137",,"astro-ph.GA","http://arxiv.org/licenses/nonexclusive-distrib/1.0/","  Infalling motions were detected and modeled toward this source. A mean infall
velocity of 0.5 km/s with an infall mass rate of 5x10^-3 Solar masses per year
was obtained. Also, a previously estimated value for the magnetic field
strength in the plane of the sky was refined to be 855 micro Gauss which we
used to calculate a mass-to-magnetic flux ratio of 1.9, or super-critical. The
virial mass from turbulent motions was also calculated finding Mvir=563 solar
masses, which gives a ratio of Msubmm/Mvir=5.9. Both values strongly suggest
that this clump must be in a state of gravitational collapse.
","[{""version"":""v1"",""created"":""Sat, 26 Jun 2010 02:15:05 GMT""}]","2015-05-19"
"1006.5094","EPTCS","Alessandro Aldini (Univ. of Urbino)","Approximate Testing Equivalence Based on Time, Probability, and Observed
  Behavior",,"EPTCS 28, 2010, pp. 1-15","10.4204/EPTCS.28.1",,"cs.LO","http://arxiv.org/licenses/nonexclusive-distrib/1.0/","  Several application domains require formal but flexible approaches to the
comparison problem. Different process models that cannot be related by
behavioral equivalences should be compared via a quantitative notion of
similarity, which is usually achieved through approximation of some
equivalence. While in the literature the classical equivalence subject to
approximation is bisimulation, in this paper we propose a novel approach based
on testing equivalence. As a step towards flexibility and usability, we study
different relaxations taking into account orthogonal aspects of the process
observations: execution time, event probability, and observed behavior. In this
unifying framework, both interpretation of the measures and decidability of the
verification algorithms are discussed.
","[{""version"":""v1"",""created"":""Sat, 26 Jun 2010 03:02:59 GMT""}]","2010-06-29"
"1006.5095","EPTCS","Karine Altisen (Verimag (Grenoble INP)), Yanhong Liu (Verimag
  (Grenoble INP)), Matthieu Moy (Verimag (Grenoble INP))","Performance Evaluation of Components Using a Granularity-based Interface
  Between Real-Time Calculus and Timed Automata",,"EPTCS 28, 2010, pp. 16-33","10.4204/EPTCS.28.2",,"cs.PF cs.LO","http://arxiv.org/licenses/nonexclusive-distrib/1.0/","  To analyze complex and heterogeneous real-time embedded systems, recent works
have proposed interface techniques between real-time calculus (RTC) and timed
automata (TA), in order to take advantage of the strengths of each technique
for analyzing various components. But the time to analyze a state-based
component modeled by TA may be prohibitively high, due to the state space
explosion problem. In this paper, we propose a framework of granularity-based
interfacing to speed up the analysis of a TA modeled component. First, we
abstract fine models to work with event streams at coarse granularity. We
perform analysis of the component at multiple coarse granularities and then
based on RTC theory, we derive lower and upper bounds on arrival patterns of
the fine output streams using the causality closure algorithm. Our framework
can help to achieve tradeoffs between precision and analysis time.
","[{""version"":""v1"",""created"":""Sat, 26 Jun 2010 03:03:05 GMT""}]","2010-06-29"
"1006.5096","EPTCS","Dami\'an Barsotti (Universidad Nacional de C\'ordoba), Nicol\'as
  Wolovick (Universidad Nacional de C\'ordoba)","Automatic Probabilistic Program Verification through Random Variable
  Abstraction",,"EPTCS 28, 2010, pp. 34-47","10.4204/EPTCS.28.3",,"cs.LO cs.PL","http://arxiv.org/licenses/nonexclusive-distrib/1.0/","  The weakest pre-expectation calculus has been proved to be a mature theory to
analyze quantitative properties of probabilistic and nondeterministic programs.
We present an automatic method for proving quantitative linear properties on
any denumerable state space using iterative backwards fixed point calculation
in the general framework of abstract interpretation. In order to accomplish
this task we present the technique of random variable abstraction (RVA) and we
also postulate a sufficient condition to achieve exact fixed point computation
in the abstract domain. The feasibility of our approach is shown with two
examples, one obtaining the expected running time of a probabilistic program,
and the other the expected gain of a gambling strategy.
  Our method works on general guarded probabilistic and nondeterministic
transition systems instead of plain pGCL programs, allowing us to easily model
a wide range of systems including distributed ones and unstructured programs.
We present the operational and weakest precondition semantics for this programs
and prove its equivalence.
","[{""version"":""v1"",""created"":""Sat, 26 Jun 2010 03:03:08 GMT""}]","2010-06-29"
"1006.5097","EPTCS","Alessandro Bianco (University of Naples, Italy), Marco Faella
  (University of Naples, Italy), Fabio Mogavero (University of Naples, Italy),
  Aniello Murano (University of Naples, Italy)","Quantitative Fairness Games",,"EPTCS 28, 2010, pp. 48-63","10.4204/EPTCS.28.4",,"cs.GT cs.DC","http://arxiv.org/licenses/nonexclusive-distrib/1.0/","  We consider two-player games played on finite colored graphs where the goal
is the construction of an infinite path with one of the following
frequency-related properties: (i) all colors occur with the same asymptotic
frequency, (ii) there is a constant that bounds the difference between the
occurrences of any two colors for all prefixes of the path, or (iii) all colors
occur with a fixed asymptotic frequency.
  These properties can be viewed as quantitative refinements of the classical
notion of fair path in a concurrent system, whose simplest form checks whether
all colors occur infinitely often. In particular, the first two properties
enforce equal treatment of all the jobs involved in the system, while the third
one represents a way to assign a given priority to each job. For all the above
goals, we show that the problem of checking whether there exists a winning
strategy is CoNP-complete.
","[{""version"":""v1"",""created"":""Sat, 26 Jun 2010 03:03:15 GMT""}]","2010-06-29"
"1006.5098","EPTCS","David Cachera, Arnaud Jobin","Injecting Abstract Interpretations into Linear Cost Models",,"EPTCS 28, 2010, pp. 64-81","10.4204/EPTCS.28.5",,"cs.LO cs.PL","http://arxiv.org/licenses/nonexclusive-distrib/1.0/","  We present a semantics based framework for analysing the quantitative
behaviour of programs with regard to resource usage. We start from an
operational semantics equipped with costs. The dioid structure of the set of
costs allows for defining the quantitative semantics as a linear operator. We
then present an abstraction technique inspired from abstract interpretation in
order to effectively compute global cost information from the program.
Abstraction has to take two distinct notions of order into account: the order
on costs and the order on states. We show that our abstraction technique
provides a correct approximation of the concrete cost computations.
","[{""version"":""v1"",""created"":""Sat, 26 Jun 2010 03:03:19 GMT""}]","2010-06-29"
"1006.5099","EPTCS","Mario Coppo (Dipartimento di Informatica, Universit\`a di Torino),
  Ferruccio Damiani (Dipartimento di Informatica, Universit\`a di Torino),
  Maurizio Drocco (Dipartimento di Informatica, Universit\`a di Torino), Elena
  Grassi (Dipartimento di Informatica and Molecular Biotechnology Center,
  Dipartimento di Genetica, Biologia e Biochimica, Universit\`a di Torino),
  Angelo Troina (Dipartimento di Informatica, Universit\`a di Torino)","Stochastic Calculus of Wrapped Compartments",,"EPTCS 28, 2010, pp. 82-98","10.4204/EPTCS.28.6",,"cs.CE cs.FL cs.LO q-bio.QM","http://arxiv.org/licenses/nonexclusive-distrib/1.0/","  The Calculus of Wrapped Compartments (CWC) is a variant of the Calculus of
Looping Sequences (CLS). While keeping the same expressiveness, CWC strongly
simplifies the development of automatic tools for the analysis of biological
systems. The main simplification consists in the removal of the sequencing
operator, thus lightening the formal treatment of the patterns to be matched in
a term (whose complexity in CLS is strongly affected by the variables matching
in the sequences).
  We define a stochastic semantics for this new calculus. As an application we
model the interaction between macrophages and apoptotic neutrophils and a
mechanism of gene regulation in E.Coli.
","[{""version"":""v1"",""created"":""Sat, 26 Jun 2010 03:03:25 GMT""}]","2010-06-29"
"1006.5100","EPTCS","Sonja Georgievska, Suzana Andova","Testing Reactive Probabilistic Processes",,"EPTCS 28, 2010, pp. 99-113","10.4204/EPTCS.28.7",,"cs.LO","http://arxiv.org/licenses/nonexclusive-distrib/1.0/","  We define a testing equivalence in the spirit of De Nicola and Hennessy for
reactive probabilistic processes, i.e. for processes where the internal
nondeterminism is due to random behaviour. We characterize the testing
equivalence in terms of ready-traces. From the characterization it follows that
the equivalence is insensitive to the exact moment in time in which an internal
probabilistic choice occurs, which is inherent from the original testing
equivalence of De Nicola and Hennessy. We also show decidability of the testing
equivalence for finite systems for which the complete model may not be known.
","[{""version"":""v1"",""created"":""Sat, 26 Jun 2010 03:03:32 GMT""}]","2010-06-29"
"1006.5101","EPTCS","Matthias G\""udemann, Frank Ortmeier","Probabilistic Model-Based Safety Analysis",,"EPTCS 28, 2010, pp. 114-128","10.4204/EPTCS.28.8",,"cs.LO","http://arxiv.org/licenses/nonexclusive-distrib/1.0/","  Model-based safety analysis approaches aim at finding critical failure
combinations by analysis of models of the whole system (i.e. software,
hardware, failure modes and environment). The advantage of these methods
compared to traditional approaches is that the analysis of the whole system
gives more precise results. Only few model-based approaches have been applied
to answer quantitative questions in safety analysis, often limited to analysis
of specific failure propagation models, limited types of failure modes or
without system dynamics and behavior, as direct quantitative analysis is uses
large amounts of computing resources. New achievements in the domain of
(probabilistic) model-checking now allow for overcoming this problem.
  This paper shows how functional models based on synchronous parallel
semantics, which can be used for system design, implementation and qualitative
safety analysis, can be directly re-used for (model-based) quantitative safety
analysis. Accurate modeling of different types of probabilistic failure
occurrence is shown as well as accurate interpretation of the results of the
analysis. This allows for reliable and expressive assessment of the safety of a
system in early design stages.
","[{""version"":""v1"",""created"":""Sat, 26 Jun 2010 03:03:37 GMT""}]","2010-06-29"
"1006.5102","EPTCS","Ukachukwu Ndukwu (Deptartment of Computing, Macquarie University,
  Australia.), Annabelle McIver (Deptartment of Computing, Macquarie
  University, Australia.)","An expectation transformer approach to predicate abstraction and data
  independence for probabilistic programs",,"EPTCS 28, 2010, pp. 129-143","10.4204/EPTCS.28.9",,"cs.LO","http://arxiv.org/licenses/nonexclusive-distrib/1.0/","  In this paper we revisit the well-known technique of predicate abstraction to
characterise performance attributes of system models incorporating probability.
We recast the theory using expectation transformers, and identify transformer
properties which correspond to abstractions that yield nevertheless exact bound
on the performance of infinite state probabilistic systems. In addition, we
extend the developed technique to the special case of ""data independent""
programs incorporating probability. Finally, we demonstrate the subtleness of
the extended technique by using the PRISM model checking tool to analyse an
infinite state protocol, obtaining exact bounds on its performance.
","[{""version"":""v1"",""created"":""Sat, 26 Jun 2010 03:03:45 GMT""}]","2010-06-29"
"1006.5103","EPTCS","Markus Rabe (Saarland University), Sven Schewe (University of
  Liverpool)","Optimal Time-Abstract Schedulers for CTMDPs and Markov Games",,"EPTCS 28, 2010, pp. 144-158","10.4204/EPTCS.28.10",,"cs.FL","http://arxiv.org/licenses/nonexclusive-distrib/1.0/","  We study time-bounded reachability in continuous-time Markov decision
processes for time-abstract scheduler classes. Such reachability problems play
a paramount role in dependability analysis and the modelling of manufacturing
and queueing systems. Consequently, their analysis has been studied
intensively, and techniques for the approximation of optimal control are well
understood. From a mathematical point of view, however, the question of
approximation is secondary compared to the fundamental question whether or not
optimal control exists.
  We demonstrate the existence of optimal schedulers for the time-abstract
scheduler classes for all CTMDPs. Our proof is constructive: We show how to
compute optimal time-abstract strategies with finite memory. It turns out that
these optimal schedulers have an amazingly simple structure - they converge to
an easy-to-compute memoryless scheduling policy after a finite number of steps.
  Finally, we show that our argument can easily be lifted to Markov games: We
show that both players have a likewise simple optimal strategy in these more
general structures.
","[{""version"":""v1"",""created"":""Sat, 26 Jun 2010 03:03:47 GMT""}]","2010-06-29"
"1006.5104","EPTCS","Anton Stefanek (Imperial College London), Richard Hayden (Imperial
  College London), Jeremy Bradley (Imperial College London)","A new tool for the performance analysis of massively parallel computer
  systems",,"EPTCS 28, 2010, pp. 159-181","10.4204/EPTCS.28.11",,"cs.PF cs.DC cs.NA","http://arxiv.org/licenses/nonexclusive-distrib/1.0/","  We present a new tool, GPA, that can generate key performance measures for
very large systems. Based on solving systems of ordinary differential equations
(ODEs), this method of performance analysis is far more scalable than
stochastic simulation. The GPA tool is the first to produce higher moment
analysis from differential equation approximation, which is essential, in many
cases, to obtain an accurate performance prediction. We identify so-called
switch points as the source of error in the ODE approximation. We investigate
the switch point behaviour in several large models and observe that as the
scale of the model is increased, in general the ODE performance prediction
improves in accuracy. In the case of the variance measure, we are able to
justify theoretically that in the limit of model scale, the ODE approximation
can be expected to tend to the actual variance of the model.
","[{""version"":""v1"",""created"":""Sat, 26 Jun 2010 03:03:55 GMT""}]","2010-06-29"
"1006.5105","Jennifer Johnson-Leung","Jennifer Johnson-Leung and Brooks Roberts","Siegel modular forms of degree two attached to Hilbert modular forms","23 pages, 2 tables",,,,"math.NT math.RT","http://arxiv.org/licenses/nonexclusive-distrib/1.0/","  Let E/Q be a real quadratic field and pi_0 a cuspidal, irreducible,
automorphic representation of GL(2,A_E) with trivial central character and
infinity type (2,2n+2) for some non-negative integer n. We show that there
exists a non-zero Siegel paramodular newform F with weight, level, Hecke
eigenvalues, epsilon factor and L-function determined explicitly by pi_0. We
tabulate these invariants in terms of those of pi_0 for every rational prime p.
","[{""version"":""v1"",""created"":""Sat, 26 Jun 2010 03:10:34 GMT""}]","2010-06-29"
"1006.5106","Gregory Jenkins","G. S. Jenkins, D. C. Schmadel, A. B. Sushkov, G. D. Gu, H. Kontani,
  and H. D. Drew","Terahertz Hall Measurements On Optimally Doped Single Crystal Bi-2212","10 pages, 2 figures","Phys. Rev. B 82, 094518 (2010)","10.1103/PhysRevB.82.094518",,"cond-mat.supr-con cond-mat.str-el","http://arxiv.org/licenses/nonexclusive-distrib/1.0/","  The infrared Hall angle in optimally doped single crystal $\rm Bi_2 Sr_2 Ca
Cu_2 O_{8+x}$ was measured from 3.05 to 21.75 meV as a continuous function of
temperature from 25 to 300\,K. In the normal state, the temperature dependence
of the real part of the cotangent of the infrared Hall angle obeys the same
power law as dc measurements. The measured Hall frequency $\rm \omega_H$ is
significantly larger than the expected value based upon ARPES data analyzed in
terms of the relaxation time approximation. This discrepancy as well as the
temperature dependence of $\rm Re(\cot{\theta_H})$ and $\omega_H$ is well
described by a Fermi liquid theory in which current vertex corrections produced
by electron-magnon scattering are included.
","[{""version"":""v1"",""created"":""Sat, 26 Jun 2010 03:10:37 GMT""}]","2010-09-29"
