"1006.5107","EPTCS","Alessandra Di Pierro (University of Verona), Gethin Norman (University
  of Glasgow)","Proceedings Eighth Workshop on Quantitative Aspects of Programming
  Languages",,"EPTCS 28, 2010","10.4204/EPTCS.28",,"cs.PL cs.LO cs.PF","http://arxiv.org/licenses/nonexclusive-distrib/1.0/","  This volume contains the proceedings of the Eighth Workshop on Quantitative
Aspects of Programming Languages (QAPL 2010), held in Paphos, Cyprus, on March
27-28, 2010. QAPL 2010 is a satellite event of the European Joint Conferences
on Theory and Practice of Software (ETAPS 2010).
  The workshop theme is on quantitative aspects of computation. These aspects
are related to the use of physical quantities (storage space, time, bandwidth,
etc.) as well as mathematical quantities (e.g. probability and measures for
reliability, security and trust), and play an important (sometimes essential)
role in characterising the behavior and determining the properties of systems.
Such quantities are central to the definition of both the model of systems
(architecture, language design, semantics) and the methodologies and tools for
the analysis and verification of the systems properties.
  The aim of this workshop is to discuss the explicit use of quantitative
information such as time and probabilities either directly in the model or as a
tool for the analysis of systems.
","[{""version"":""v1"",""created"":""Sat, 26 Jun 2010 03:34:52 GMT""}]","2010-06-29"
"1006.5108","Arijit Bhattacharyay","Arijit Bhattacharyay","Does the fluctuation-dissipation relation guarantee equilibrium?","8 pages, no figure",,,,"cond-mat.stat-mech","http://arxiv.org/licenses/nonexclusive-distrib/1.0/","  We study a symmetry broken harmonic oscillator in contact with a heat bath
characterized by a fixed temperature. The overdampped system is solved exactly
to show symmetry broken directed transport raising the question whether
fluctuation-dissipation relation does guarantee equilibrium.
","[{""version"":""v1"",""created"":""Sat, 26 Jun 2010 03:44:25 GMT""},{""version"":""v2"",""created"":""Tue, 29 Jun 2010 17:21:19 GMT""},{""version"":""v3"",""created"":""Thu, 1 Jul 2010 07:27:15 GMT""}]","2010-07-02"
"1006.5109","Martin Weides","M. Weides, U. Peralagu, H. Kohlstedt, J. Pfeiffer, M. Kemmler, C.
  G\""urlich, E. Goldobin, D. Koelle, R. Kleiner","Critical current diffraction pattern of SIFS Josephson junctions with
  step-like F-layer","7 pages, 3 figures","Supercond. Sci. Technol. 23, 095007 (2010)","10.1088/0953-2048/23/9/095007",,"cond-mat.supr-con","http://arxiv.org/licenses/nonexclusive-distrib/1.0/","  We present the latest generation of
superconductor-insulator-ferromagnet-superconductor Josephson tunnel junctions
with a step-like thickness of the ferromagnetic (F) layer. The F-layer
thicknesses $d_1$ and $d_2$ in both halves were varied to obtain different
combinations of positive and negative critical current densities $j_{c,1}$ and
$j_{c,2}$. The measured dependences of the critical current on applied magnetic
field can be well described by a model which takes into account different
critical current densities (obtained from reference junctions) and different
net magnetization of the multidomain ferromagnetic layer in both halves.
","[{""version"":""v1"",""created"":""Sat, 26 Jun 2010 04:01:57 GMT""},{""version"":""v2"",""created"":""Thu, 15 Jul 2010 14:53:34 GMT""}]","2010-08-09"
"1006.5110","Bin Yang","Bin Yang, David Jewitt","Identification of Magnetite in B-type Asteroids","19 pages, 5 figures, accepted by AJ",,"10.1088/0004-6256/140/3/692",,"astro-ph.EP","http://arxiv.org/licenses/nonexclusive-distrib/1.0/","  Spectrally blue (B-type) asteroids are rare, with the second discovered
asteroid Pallas being the largest and most famous example. We conducted a
focused, infrared spectroscopic survey of B-type asteroids to search for
water-related features in these objects. Our results show that the negative
optical spectral slope of some B-type asteroids is due to the presence of a
broad absorption band centered near 1.0 micron. The 1-micron band can be
matched in position and shape using magnetite (Fe3O4), which is an important
indicator of past aqueous alteration in the parent body. Furthermore, our
observations of B-type asteroid (335) Roberta in the 3-micron region reveal an
absorption feature centered at 2.9 micron, which is consistent with the
absorption due to phyllosilicates (another hydration product) observed in CI
chondrites. The new observations suggest that at least some B-type asteroids
are likely to have incorporated significant amounts of water ice and to have
experienced intensive aqueous alteration.
","[{""version"":""v1"",""created"":""Sat, 26 Jun 2010 04:06:45 GMT""}]","2015-05-19"
"1006.5111","Timothy Matisziw","Timothy C. Matisziw, Alan T. Murray","Modeling s-t Path Availability to Support Disaster Vulnerability
  Assessment of Network Infrastructure",,"Matisziw, T.C. and A.T. Murray. 2009. Modeling s-t Path
  Availability to Support Disaster Vulnerability Assessment of Network
  Infrastructure. Computers & Operations Research. 36(1), 16-26",,,"physics.data-an cs.NA physics.comp-ph","http://arxiv.org/licenses/nonexclusive-distrib/1.0/","  The maintenance of system flow is critical for effective network operation.
Any type of disruption to network facilities (arcs/nodes) potentially risks
loss of service, leaving users without access to important resources. It is
therefore an important goal of planners to assess infrastructures for
vulnerabilities, identifying those vital nodes/arcs whose debilitation would
compromise the most source-sink (s-t) interaction or system flow. Due to the
budgetary limitations of disaster management agencies, protection/fortification
and planning for the recovery of these vital infrastructure facilities is a
logical and efficient proactive approach to reducing worst-case risk of service
disruption. Given damage to a network, evaluating the potential for flow
between s-t pairs requires assessing the availability of an operational s-t
path. Recent models proposed for identifying infrastructure vital to system
flow have relied on enumeration of all s-t paths to support this task. This
paper proposes an alternative model constraint structure that does not require
complete enumeration of s-t paths, providing computational benefits over
existing models. To illustrate the model, an application to a practical
infrastructure planning problem is presented.
","[{""version"":""v1"",""created"":""Sat, 26 Jun 2010 04:07:23 GMT""}]","2010-06-29"
"1006.5112","Giridhar Nandipati","G. Nandipati, A. Kara, S. I. Shah and T. S. Rahman","Island Size Selectivity during 2D Ag Island Coarsening on Ag (111)",,,"10.1088/0953-8984/23/26/262001",,"cond-mat.mtrl-sci","http://arxiv.org/licenses/nonexclusive-distrib/1.0/","  We report on early stages of submonolayer Ag island coarsening on Ag(111)
surface at room temperature ($300$ K) carried out using realistic kinetic Monte
Carlo (KMC) simulations. We find that during early stages, coarsening proceeds
as a sequence of selected island sizes creating peaks and valleys in the island
size distribution. We find that island-size selectivity is due to formation of
kinetically stable islands for certain sizes because of adatom
detachment/attachment processes and large activation barrier for kink
detachment.
  In addition, we find that the ratio of number of adatom attachment to
detachment processes to be independent of parameters of initial configuration
and also on the initial shapes of the islands confirming that island-size
selectivity is independent of initial conditions.These simulations were carried
out using a very large database of processes identified by their local
environment and whose activation barriers were calculated using the
embedded-atom method.
","[{""version"":""v1"",""created"":""Sat, 26 Jun 2010 04:49:08 GMT""}]","2015-05-19"
"1006.5113","Ghassan Samara","Ghassan Samara, Sureswaran Ramadas, Wafaa A.H. Al-Salihy","Design of Simple and Efficient Revocation List Distribution in Urban
  areas for VANET's","5 pages","(IJCSIS) International Journal of Computer Science and Information
  Security, Vol. 8, No. 1, April 2010",,,"cs.NI","http://arxiv.org/licenses/nonexclusive-distrib/1.0/","  Vehicular Ad hoc Networks is one of the most challenging research area in the
field of Mobile Ad Hoc Networks, in this research we propose a flexible,
simple, and scalable design for revocation list distribution in VANET, which
will reduce channel overhead and eliminate the use of CRL. Also it will
increase the security of the network and helps in identifying the adversary
vehicles.
","[{""version"":""v1"",""created"":""Sat, 26 Jun 2010 04:55:19 GMT""}]","2010-06-29"
"1006.5114","Yong-Jun Zhang","Yong-Jun Zhang","Entropy and Entropy Production in Some Applications",,"Physica A 396, (2014) 88","10.1016/j.physa.2013.11.011",,"cond-mat.stat-mech math-ph math.MP quant-ph","http://arxiv.org/licenses/nonexclusive-distrib/1.0/","  By using entropy and entropy production, we calculate the steady flux of some
phenomena. The method we use is a competition method, $S_S/\tau+\sigma={\it
maximum}$, where $S_S$ is system entropy, $\sigma$ is entropy production and
$\tau$ is microscopic interaction time. System entropy is calculated from the
equilibrium state by studying the flux fluctuations. The phenomena we study
include ionic conduction, atomic diffusion, thermal conduction and viscosity of
a dilute gas.
","[{""version"":""v1"",""created"":""Sat, 26 Jun 2010 06:01:12 GMT""},{""version"":""v2"",""created"":""Tue, 26 Nov 2013 08:53:56 GMT""}]","2016-07-26"
"1006.5115","Paoti Chang","C.-C. Peng, P.Chang, et al, the Belle Collaboration","Search for B_{s}^{0}->hh Decays at the $\Upsilon(5S)$ Resonance","6 pages, 2 figure, two tables","Phys.Rev.D82:072007,2010","10.1103/PhysRevD.82.072007","KEK preprint 2010-14, Belle preprint 2010-11","hep-ex","http://arxiv.org/licenses/nonexclusive-distrib/1.0/","  We have searched for B_{s}^{0}->hh decays, where h stands for a charged or
neutral kaon, or a charged pion. These results are based on a 23.6 fb^{-1} data
sample collected with the Belle detector on the \Upsilon(5S) resonance at the
KEKB asymmetric-energy e^{+}e^{-} collider, containing 1.25x10^6
B_{s}^{(*)}\bar{B}_{s}^{(*)} events. We observe the decay B_{s}^{0}->K^{+}K^{-}
and measure its branching fraction, \mathcal{B}(B_{s}^{0}->K^{+}K^{-}) =
[3.8_{-0.9}^{+1.0}(\mathrm{stat})\pm 0.5(\mathrm{syst})\pm 0.5(f_s)] \times
10^{-5}. The first error is statistical, the second is systematic, and the
third error is due to the uncertainty in the B^0_s production fraction in
$e^+e^-\to b\bar{b}$ events. No significant signals are seen in other decay
modes, and we set upper limits at 90% confidence level:
\mathcal{B}(B_{s}^{0}->K^-\pi^{+})< 2.6 \times 10^{-5},
\mathcal{B}(B_{s}^{0}->\pi^{+}\pi^{-})< 1.2 \times 10^{-5} and
\mathcal{B}(B_{s}^{0}->K^0\bar{K}^0) < 6.6\times 10^{-5}.
","[{""version"":""v1"",""created"":""Sat, 26 Jun 2010 06:28:39 GMT""},{""version"":""v2"",""created"":""Fri, 25 Mar 2011 00:32:59 GMT""}]","2011-03-28"
"1006.5116","Leonid A. Krivitsky","Dmitry A. Kalashnikov and Leonid A. Krivitsky","Spectrally Resolved Quantum Tomography of Polarization Entangled States","Submitted for publication","New J. Phys. 12 (2010) 093040","10.1088/1367-2630/12/9/093040",,"quant-ph","http://arxiv.org/licenses/nonexclusive-distrib/1.0/","  We study broadband polarization entangled states generated within the line
width of type-II Spontaneous Parametric Down Conversion (SPDC). Applying a
complete quantum polarization tomography protocol at arbitrary combination of
frequency and angular sideband modes we reveal a complex structure of
non-degenerate non-collinear polarization entangled states generated within the
SPDC line width. It is demonstrated that simultaneous compensation of
longitudinal and transverse walk off leads to homogenizing the structure of
polarization entanglement.
","[{""version"":""v1"",""created"":""Sat, 26 Jun 2010 06:47:24 GMT""},{""version"":""v2"",""created"":""Sat, 25 Sep 2010 10:20:14 GMT""}]","2015-05-19"
"1006.5117","Grace Chiu","Penny S Reynolds and Grace S Chiu","Understanding thermoregulatory transitions during haemorrhage by
  piecewise regression",,,,,"stat.AP q-bio.TO","http://arxiv.org/licenses/nonexclusive-distrib/1.0/","  Transition points are common in physiological processes. However the
transition between normothermia and hypothermia during haemorrhagic shock has
rarely been systematically quantified from intensive time series data. We
estimated the critical transition point (CTP) and provided confidence intervals
for core body temperature response to acute severe haemorrhage in a conscious
rat model. Estimates were obtained by traditional piecewise linear regression
(broken stick model) and compared to those from the more novel bent cable
regression. Bent cable regression relaxes the assumption of an abrupt point
transition, and thus allows the capture of a potentially gradual transition
phase; the broken stick is a special case of the bent cable model. We
calculated two types of confidence intervals, assuming either independent or
autoregressive structure for the residuals. In spite of the severity of the
haemorrhage, median temperature change was minor (0.8 C; IQR 0.57-1.31 C) and
only four of 38 rats were clinically hypothermic (core temperature < 35 C).
However, a transition could be estimated for 23 rats. Bent cable fits were
superior when the transition appeared to be gradual rather than abrupt. In all
cases, assuming independence gave incorrect uncertainty estimates of CTP. For
15 animals, neither model could be fitted because of irregular temperature
profiles that did not conform to the assumption of a single transition.
Arbitrary imposition of broken stick fits on a gradual transition profile and
assuming independent rather than autocorrelated error may result in misleading
estimates of CTP. Identification of the onset of irreversible shock will
require further quantification of appropriate time-dependent physiological
variables and their behaviour during haemorrhage.
","[{""version"":""v1"",""created"":""Sat, 26 Jun 2010 07:03:05 GMT""}]","2010-07-01"
"1006.5118","Vladimir S. Manko","F.J. Ernst, V.S. Manko and E. Ruiz","On interrelations between Sibgatullin's and Alekseev's approaches to the
  construction of exact solutions of the Einstein-Maxwell equations","7 pages, no figures, section II extended","J.Phys.Conf.Ser.229:012050,2010","10.1088/1742-6596/229/1/012050",,"gr-qc","http://arxiv.org/licenses/nonexclusive-distrib/1.0/","  The integral equations involved in Alekseev's ""monodromy transform"" technique
are shown to be simple combinations of Sibgatullin's integral equations and
normalizing conditions. An additional complex conjugation introduced by
Alekseev in the integrands makes his scheme mathematically inconsistent;
besides, in the electrovac case all Alekseev's principal value integrals
contain an intrinsic error which has never been identified before. We also
explain how operates a non-trivial double-step algorithm devised by Alekseev
for rewriting, by purely algebraic manipulations and in a different (more
complicated) parameter set, any particular specialization of the known
analytically extended N-soliton electrovac solution obtained in 1995 with the
aid of Sibgatullin's method.
","[{""version"":""v1"",""created"":""Sat, 26 Jun 2010 08:00:03 GMT""}]","2010-12-17"
"1006.5119","Kausik Majumdar","Kausik Majumdar, Kota V. R. M. Murali, Navakanta Bhat and Yu-Ming Lin","External Bias Dependent Direct To Indirect Bandgap Transition in
  Graphene Nanoribbon","Accepted for publication in Nano Letters",,"10.1021/nl100909n",,"cond-mat.mes-hall cond-mat.mtrl-sci","http://arxiv.org/licenses/nonexclusive-distrib/1.0/","  In this work, using self-consistent tight-binding calculations, for the first
time, we show that a direct to indirect bandgap transition is possible in an
armchair graphene nanoribbon by the application of an external bias along the
width of the ribbon, opening up the possibility of new device applications.
With the help of Dirac equation, we qualitatively explain this bandgap
transition using the asymmetry in the spatial distribution of the perturbation
potential produced inside the nanoribbon by the external bias. This is followed
by the verification of the bandgap trends with a numerical technique using
Magnus expansion of matrix exponentials. Finally, we show that the carrier
effective masses possess tunable sharp characters in the vicinity of the
bandgap transition points.
","[{""version"":""v1"",""created"":""Sat, 26 Jun 2010 08:04:15 GMT""}]","2015-05-19"
"1006.5120","Anna Giordano Bruno","Dikran Dikranjan, Anna Giordano Bruno","The Pinsker subgroup of an algebraic flow","17 pages",,,,"math.GR math.GN","http://arxiv.org/licenses/nonexclusive-distrib/1.0/","  The algebraic entropy h, defined for endomorphisms f of abelian groups G,
measures the growth of the trajectories of non-empty finite subsets F of G with
respect to f. We show that this growth can be either polynomial or exponential.
The greatest f-invariant subgroup of G where this growth is polynomial
coincides with the greatest f-invariant subgroup P(G,f) of G (named Pinsker
subgroup of f) such that h(f|_P(G,f))=0. We obtain also an alternative
characterization of P(G,f) from the point of view of the quasi-periodic points
of f. This gives the following application in ergodic theory: for every
continuous injective endomorphism g of a compact abelian group K there exists a
largest g-invariant closed subgroup N of K such that g|_N is ergodic;
furthermore, the induced endomorphism g' of the quotient K/N has zero
topological entropy.
","[{""version"":""v1"",""created"":""Sat, 26 Jun 2010 08:31:22 GMT""}]","2010-06-29"
"1006.5121","Zuhui Fan","Zuhui Fan, Huanyuan Shan, Jiayi Liu","Noisy weak-lensing convergence peak statistics near clusters of galaxies
  and beyond","10 figures, ApJ in press",,"10.1088/0004-637X/719/2/1408",,"astro-ph.CO","http://arxiv.org/licenses/nonexclusive-distrib/1.0/","  Taking into account noise from intrinsic ellipticities of source galaxies, in
this paper, we study the peak statistics in weak-lensing convergence maps
around clusters of galaxies and beyond. We emphasize how the noise peak
statistics is affected by the density distribution of nearby clusters, and also
how cluster-peak signals are changed by the existence of noise. These are the
important aspects to be understood thoroughly in weak-lensing analyses for
individual clusters as well as in cosmological applications of weak-lensing
cluster statistics. We adopt Gaussian smoothing with the smoothing scale
$\theta_G=0.5\hbox{ arcmin}$ in our analyses. It is found that the noise peak
distribution near a cluster of galaxies depends sensitively on the density
profile of the cluster. For a cored isothermal cluster with the core radius
$R_c$, the inner region with $R\le R_c$ appears noisy containing on average
$\sim 2.4$ peaks with $\nu\ge 5$ for $R_c= 1.7\hbox{ arcmin}$ and the true peak
height of the cluster $\nu=5.6$, where $\nu$ denotes the convergence signal to
noise ratio. For a NFW cluster of the same mass and the same central $\nu$, the
average number of peaks with $\nu\ge 5$ within $R\le R_c$ is $\sim 1.6$. Thus a
high peak corresponding to the main cluster can be identified more cleanly in
the NFW case. In the outer region with $R_c<R\le 5R_c$, the number of high
noise peaks is considerably enhanced in comparison with that of the pure noise
case without the nearby cluster. (abridged)
","[{""version"":""v1"",""created"":""Sat, 26 Jun 2010 08:32:53 GMT""}]","2015-05-19"
"1006.5122","Anna Giordano Bruno","Dikran Dikranjan, Anna Giordano Bruno","Entropy in a category","26 pages",,,,"math.GR math.CT math.GN","http://arxiv.org/licenses/nonexclusive-distrib/1.0/","  The Pinsker subgroup of an abelian group with respect to an endomorphism was
introduced in the context of algebraic entropy. Motivated by the nice
properties and characterizations of the Pinsker subgroup, we generalize its
construction in two directions. We introduce the concept of entropy function h
of an abelian category and define the Pinsker radical with respect to h, so
that the class of all objects with trivial Pinsker radical is the torsion class
of a torsion theory.
","[{""version"":""v1"",""created"":""Sat, 26 Jun 2010 08:35:46 GMT""},{""version"":""v2"",""created"":""Sun, 27 Feb 2011 10:28:42 GMT""}]","2011-03-01"
"1006.5123","Hrushikesh Mhaskar","F. Filbir, H. N. Mhaskar","Marcinkiewicz--Zygmund measures on manifolds","28 pages, submitted for publication",,,,"math.CA","http://arxiv.org/licenses/nonexclusive-distrib/1.0/","  Let ${\mathbb X}$ be a compact, connected, Riemannian manifold (without
boundary), $\rho$ be the geodesic distance on ${\mathbb X}$, $\mu$ be a
probability measure on ${\mathbb X}$, and $\{\phi_k\}$ be an orthonormal system
of continuous functions, $\phi_0(x)=1$ for all $x\in{\mathbb X}$,
$\{\ell_k\}_{k=0}^\infty$ be an nondecreasing sequence of real numbers with
$\ell_0=1$, $\ell_k\uparrow\infty$ as $k\to\infty$, $\Pi_L:={\mathsf
{span}}\{\phi_j : \ell_j\le L\}$, $L\ge 0$. We describe conditions to ensure an
equivalence between the $L^p$ norms of elements of $\Pi_L$ with their suitably
discretized versions. We also give intrinsic criteria to determine if any
system of weights and nodes allows such inequalities. The results are stated in
a very general form, applicable for example, when the discretization of the
integrals is based on weighted averages of the elements of $\Pi_L$ on geodesic
balls rather than point evaluations.
","[{""version"":""v1"",""created"":""Sat, 26 Jun 2010 09:00:12 GMT""},{""version"":""v2"",""created"":""Wed, 24 Nov 2010 18:24:39 GMT""}]","2010-11-25"
"1006.5124","Riccardo Re","Salvatore Giuffrida, Renato Maggioni, Riccardo Re","Multiplications of Maximal Rank in the Cohomology of P^1\times P ^1","To appear in Collectanea Mathematica",,,,"math.AG math.AC","http://arxiv.org/licenses/nonexclusive-distrib/1.0/","  We show that the linear map defined by multiplication with a general
bi-homogeneous form between two bi-graduated pieces of the first cohomology of
a nonsingular quadric in the projective space is of maximal rank. This is the
first non trivial case of a more general open problem on natural linear maps
between vector spaces of tensors defined in terms of multiplications and
contractions. An interpretation in terms of bi-homogeneous linear differential
operators with polynomial coefficients is also given.
","[{""version"":""v1"",""created"":""Sat, 26 Jun 2010 09:58:43 GMT""}]","2010-06-29"
"1006.5125","Andrew MacFadyen","Hendrik van Eerten, Weiqun Zhang and Andrew MacFadyen (New York
  University)","Off-Axis Gamma-Ray Burst Afterglow Modeling Based On A Two-Dimensional
  Axisymmetric Hydrodynamics Simulation","14 pages, 12 figures, submitted to ApJ","Astrophysical Journal 722 (2010) 235-247","10.1088/0004-637X/722/1/235",,"astro-ph.HE astro-ph.CO astro-ph.SR","http://arxiv.org/licenses/nonexclusive-distrib/1.0/","  Starting as highly relativistic collimated jets, gamma-ray burst outflows
gradually decelerate and become non-relativistic spherical blast waves.
Although detailed analytical solutions describing the afterglow emission
received by an on-axis observer during both the early and late phases of the
outflow evolution exist, a calculation of the received flux during the
intermediate phase and for an off-axis observer requires either a more
simplified analytical model or direct numerical simulations of the outflow
dynamics. In this paper we present light curves for off-axis observers covering
the long-term evolution of the blast wave calculated from a high resolution
two-dimensional relativistic hydrodynamics simulation using a synchrotron
radiation model. We compare our results to earlier analytical work and
calculate the consequence of the observer angle with respect to the jet axis
both for the detection of orphan afterglows and for jet break fits to the
observational data. We find that observable jet breaks can be delayed for up to
several weeks for off-axis observers, potentially leading to overestimation of
the beaming corrected total energy. When using our off-axis light curves to
create synthetic Swift X-ray data, we find that jet breaks are likely to remain
hidden in the data. We also confirm earlier results in the literature finding
that only a very small number of local Type Ibc supernovae can harbor an orphan
afterglow.
","[{""version"":""v1"",""created"":""Sat, 26 Jun 2010 10:06:51 GMT""}]","2015-05-19"
