"1001.0187","Luis A. Garc\'ia","Luis A. Garcia and Jagdish R. Luthra","Hybrid and optical implementation of the Deutsch-Jozsa algorithm","6 pages, 3 figures",,,,"quant-ph","http://arxiv.org/licenses/nonexclusive-distrib/1.0/","  A hybrid model of the Deutsch-Jozsa algorithm is presented, inspired by the
proposals of hybrid computation by S. Lloyd and P. van Loock et. al. The model
is based on two observations made about both the discrete and continuous
algorithms already available. First, the Fourier transform is a single-step
operation in a continuous-variable (CV) setting. Additionally, any
implementation of the oracle is nontrivial in both schemes. The steps of the
computation are very similar to those in the CV algorithm, with the main
difference being the way in which the qunats, or quantum units of analogic
information, and the qubits interact in the oracle. Using both discrete and
continuous states of light, linear devices, and photo-detection, an optical
implementation of the oracle is proposed. For simplicity, infinitely squeezed
states are used in the continuous register, whereas the optical qubit is
encoded in the dual-rail logic of the KLM protocol. The initial assumption of
ideal states as qunats will be dropped to study the effects of finite squeezing
in the quality of the computation.
","[{""version"":""v1"",""created"":""Thu, 31 Dec 2009 22:03:59 GMT""}]","2010-01-05"
"1001.0188","Alexandre Belloni","Alexandre Belloni, Victor Chernozhukov","Least squares after model selection in high-dimensional sparse models","Published in at http://dx.doi.org/10.3150/11-BEJ410 the Bernoulli
  (http://isi.cbs.nl/bernoulli/) by the International Statistical
  Institute/Bernoulli Society (http://isi.cbs.nl/BS/bshome.htm)","Bernoulli 2013, Vol. 19, No. 2, 521-547","10.3150/11-BEJ410","IMS-BEJ-BEJ410","math.ST math.PR stat.ME stat.TH","http://arxiv.org/licenses/nonexclusive-distrib/1.0/","  In this article we study post-model selection estimators that apply ordinary
least squares (OLS) to the model selected by first-step penalized estimators,
typically Lasso. It is well known that Lasso can estimate the nonparametric
regression function at nearly the oracle rate, and is thus hard to improve
upon. We show that the OLS post-Lasso estimator performs at least as well as
Lasso in terms of the rate of convergence, and has the advantage of a smaller
bias. Remarkably, this performance occurs even if the Lasso-based model
selection ""fails"" in the sense of missing some components of the ""true""
regression model. By the ""true"" model, we mean the best s-dimensional
approximation to the nonparametric regression function chosen by the oracle.
Furthermore, OLS post-Lasso estimator can perform strictly better than Lasso,
in the sense of a strictly faster rate of convergence, if the Lasso-based model
selection correctly includes all components of the ""true"" model as a subset and
also achieves sufficient sparsity. In the extreme case, when Lasso perfectly
selects the ""true"" model, the OLS post-Lasso estimator becomes the oracle
estimator. An important ingredient in our analysis is a new sparsity bound on
the dimension of the model selected by Lasso, which guarantees that this
dimension is at most of the same order as the dimension of the ""true"" model.
Our rate results are nonasymptotic and hold in both parametric and
nonparametric models. Moreover, our analysis is not limited to the Lasso
estimator acting as a selector in the first step, but also applies to any other
estimator, for example, various forms of thresholded Lasso, with good rates and
good sparsity properties. Our analysis covers both traditional thresholding and
a new practical, data-driven thresholding scheme that induces additional
sparsity subject to maintaining a certain goodness of fit. The latter scheme
has theoretical guarantees similar to those of Lasso or OLS post-Lasso, but it
dominates those procedures as well as traditional thresholding in a wide
variety of experiments.
","[{""version"":""v1"",""created"":""Thu, 31 Dec 2009 22:10:59 GMT""},{""version"":""v2"",""created"":""Fri, 26 Mar 2010 14:43:22 GMT""},{""version"":""v3"",""created"":""Sat, 11 Jun 2011 22:56:57 GMT""},{""version"":""v4"",""created"":""Thu, 25 Aug 2011 02:30:15 GMT""},{""version"":""v5"",""created"":""Wed, 20 Mar 2013 12:16:15 GMT""}]","2013-03-21"
"1001.0189","John Beamish","James Day, Oleksandr Syshchenko, John Beamish","Non-linear Elastic Response in Solid Helium: critical velocity or strain",,"Phys. Rev. Lett. 104, 075302 (2010)","10.1103/PhysRevLett.104.075302",,"cond-mat.other","http://arxiv.org/licenses/nonexclusive-distrib/1.0/","  Torsional oscillator experiments show evidence of mass decoupling in solid
4He. This decoupling is amplitude dependent, suggesting a critical velocity for
supersolidity. We observe similar behavior in the elastic shear modulus. By
measuring the shear modulus over a wide frequency range, we can distinguish
between an amplitude dependence which depends on velocity and one which depends
on some other parameter like displacement. In contrast to the torsional
oscillator behavior, the modulus depends on the magnitude of stress, not
velocity. We interpret our results in terms of the motion of dislocations which
are weakly pinned by 3He impurities but which break away when large stresses
are applied.
","[{""version"":""v1"",""created"":""Thu, 31 Dec 2009 22:31:48 GMT""},{""version"":""v2"",""created"":""Fri, 29 Jan 2010 21:50:58 GMT""}]","2010-04-15"
"1001.0190","David Latham PhD","David W. Latham (Harvard-Smithsonian Center for Astrophysics), William
  J. Borucki (NASA Ames Research Center), David G. Koch (NASA Ames Research
  Center), Timothy M. Brown (Las Cumbres Observatory Global Telescope), Lars A.
  Buchhave (Harvard-Smithsonian Center for Astrophysics), Gibor Basri
  (University of California, Berkeley), Natalie M. Batalha (San Jose State
  University), Douglas A. Caldwell (SETI Institute), William D. Cochran
  (University of Texas, Austin), Edward W. Dunham (Lowell Observatory,
  Flagstaff), Gabor Furesz (Harvard-Smithsonian Center for Astrophysics),
  Thomas N. Gautier III (Jet Propulsion Laboratory), John C. Geary
  (Harvard-Smithsonian Center for Astrophysics), Ronald L. Gilliland (Space
  Telescope Science Institute), Steve B. Howell (National Optical Astronomy
  Observatory), Jon M. Jenkins (SETI Institute), Jack J. Lissauer (NASA Ames
  Research Center), Geoffrey W. Marcy (University of California, Berkeley),
  David G. Monet (US Naval Observatory, Flagstaff Station), Jason F. Rowe (NASA
  Ames Research Center), Dimitar D. Sasselov (Harvard-Smithsonian Center for
  Astrophysics)","Kepler-7b: A Transiting Planet with Unusually Low Density","19 pages, 3 figures",,"10.1088/2041-8205/713/2/L140",,"astro-ph.EP","http://creativecommons.org/licenses/publicdomain/","  We report the discovery and confirmation of Kepler-7b, a transiting planet
with unusually low density. The mass is less than half that of Jupiter, Mp =
0.43 Mj, but the radius is fifty percent larger, Rp = 1.48 Rj. The resulting
density, 0.17 g/cc, is the second lowest reported so far for an extrasolar
planet. The orbital period is fairly long, P = 4.886 days, and the host star is
not much hotter than the Sun, Teff = 6000 K. However, it is more massive and
considerably larger than the sun, Mstar = 1.35 Msun and Rstar = 1.84 Rsun, and
must be near the end of its life on the Main Sequence.
","[{""version"":""v1"",""created"":""Thu, 31 Dec 2009 23:14:20 GMT""}]","2012-12-14"
"1001.0191","Mikhail Kotchetov","Yuri Bahturin and Mikhail Kochetov","Group gradings on restricted Cartan type Lie algebras","Several typographical errors have been corrected","Pacific Journal of Mathematics, 253 (2011), no. 2, p. 289-319",,,"math.RA","http://arxiv.org/licenses/nonexclusive-distrib/1.0/","  For a given abelian group G, we classify the isomorphism classes of
G-gradings on the simple restricted Lie algebras of types W(m;1) and S(m;1)
(m>=2), in terms of numerical and group-theoretical invariants. Our main tool
is automorphism group schemes, which we determine for the simple restricted Lie
algebras of types S(m;1) and H(m;1). The ground field is assumed to be
algebraically closed of characteristic p>3.
","[{""version"":""v1"",""created"":""Thu, 31 Dec 2009 23:40:32 GMT""},{""version"":""v2"",""created"":""Fri, 30 Nov 2012 22:35:27 GMT""}]","2012-12-04"
"1001.0192","Paula Szkody","Paula Szkody, Anjum Mukadam, Boris T. Gansicke, Arne Henden, Matthew
  Templeton, Jon Holtzman, Michael H. Montgomery, Steve B. Howell, Atsuko
  Nitta, Edward M. Sion, Richard D. Schwartz, William Dillon","Finding the Instability Strip for Accreting Pulsating White Dwarfs from
  HST and Optical Observations","19 pages, 6 tables 14 figs; accepted in ApJ",,"10.1088/0004-637X/710/1/64",,"astro-ph.SR","http://arxiv.org/licenses/nonexclusive-distrib/1.0/","  Time-resolved low resolution Hubble Space Telescope ultraviolet spectra
together with ground-based optical photometry and spectra are used to constrain
the temperatures and pulsation properties of six cataclysmic variables
containing pulsating white dwarfs. Combining our temperature determinations for
the five pulsating white dwarfs that are several years past outburst with past
results on six other systems shows that the instability strip for accreting
pulsating white dwarfs ranges from 10,500-15,000K, a wider range than evident
for ZZ Ceti pulsators. Analysis of the UV/optical pulsation properties reveals
some puzzling aspects. While half the systems show high pulsation amplitudes in
the UV compared to their optical counterparts, others show UV/optical amplitude
ratios that are less than one or no pulsations at either wavelength region.
","[{""version"":""v1"",""created"":""Thu, 31 Dec 2009 23:31:57 GMT""}]","2015-05-14"
"1001.0193","Benjamin Matschke","Benjamin Matschke","A Note on Masspartitions by Hyperplanes","3 pages, 1 figure",,,,"math.CO","http://arxiv.org/licenses/nonexclusive-distrib/1.0/","  A triple of positive integers (d,h,m) is admissible if for any m given masses
in R^d there exist h hyperplanes that cut each of these masses into 2^h equal
pieces. We present an elementary reduction which combined with results by Ramos
(1996) yields all the admissible triples that were known up to now (with one
exception) as well as new ones.
","[{""version"":""v1"",""created"":""Thu, 31 Dec 2009 23:42:54 GMT""}]","2010-01-05"
"1001.0194","Todd Eisworth","Todd Eisworth","A coloring theorem for succesors of singular cardinal","Initial version",,,,"math.LO","http://arxiv.org/licenses/nonexclusive-distrib/1.0/","  We formulate and prove (in {\sf ZFC}) a strong coloring theorem which holds
at successors of singular cardinals, and use it to answer several questions
concerning Shelah's principle $Pr_1(\mu^+,\mu^+,\mu^+,\cf(\mu))$ for singular
$\mu$.
","[{""version"":""v1"",""created"":""Thu, 31 Dec 2009 23:50:36 GMT""}]","2010-01-05"
"1001.0196","Edward Walker","Edward Walker","A distributed file system for a wide-area high performance computing
  infrastructure","6 pages, Proceedings of Third USENIX Workshop on Real, Large
  Distributed Systems, Seattle, Nov 2006",,,,"cs.DC cs.OS","http://arxiv.org/licenses/nonexclusive-distrib/1.0/","  We describe our work in implementing a wide-area distributed file system for
the NSF TeraGrid. The system, called XUFS, allows private distributed name
spaces to be created for transparent access to personal files across over 9000
computer nodes. XUFS builds on many principles from prior distributed file
systems research, but extends key design goals to support the workflow of
computational science researchers. Specifically, XUFS supports file access from
the desktop to the wide-area network seamlessly, survives transient
disconnected operations robustly, and demonstrates comparable or better
throughput than some current high performance file systems on the wide-area
network.
","[{""version"":""v1"",""created"":""Fri, 1 Jan 2010 00:34:59 GMT""}]","2010-01-05"
"1001.0197","Michael Gross","Michael A. K. Gross, John J. Rasmussen, and Elizabeth M. Moore","Pointing the SOFIA Telescope","4 pages, 3 figures. To appear in Proc. ADASS XIX (Sapporo, Japan,
  2009)",,,,"astro-ph.IM","http://arxiv.org/licenses/nonexclusive-distrib/1.0/","  SOFIA is an airborne, gyroscopically stabilized 2.5m infrared telescope,
mounted to a spherical bearing. Unlike its predecessors, SOFIA will work in
absolute coordinates, despite its continually changing position and attitude.
In order to manage this, SOFIA must relate equatorial and telescope coordinates
using a combination of avionics data and star identification, manage field
rotation and track sky images. We describe the algorithms and systems required
to acquire and maintain the equatorial reference frame, relate it to tracking
imagers and the science instrument, set up the oscillating secondary mirror,
and aggregate pointings into relocatable nods and dithers.
","[{""version"":""v1"",""created"":""Fri, 1 Jan 2010 00:26:20 GMT""}]","2010-01-05"
"1001.0198","Otakar Svitek","Otakar Svitek","Features of gravitational waves in higher dimensions","to appear in ERE09 proceedings","J.Phys.Conf.Ser.229:012070,2010","10.1088/1742-6596/229/1/012070",,"gr-qc","http://arxiv.org/licenses/nonexclusive-distrib/1.0/","  There are several fundamental differences between four-dimensional and
higher-dimensional gravitational waves, namely in the so called braneworld
set-up. One of them is their asymptotic behavior within the Cauchy problem.
This study is connected with the so called Hadamard problem, which aims at the
question of Huygens principle validity. We investigate the effect of braneworld
scenarios on the character of propagation of gravitational waves on FRW
background.
","[{""version"":""v1"",""created"":""Fri, 1 Jan 2010 00:37:10 GMT""},{""version"":""v2"",""created"":""Wed, 13 Jan 2010 17:20:08 GMT""}]","2011-01-13"
"1001.0200","Jon A. Wellner","Fuchang Gao (University of Idaho), Wenbo V. Li (University of
  Delaware), Jon A. Wellner (University of Washington)","How many Laplace transforms of probability measures are there?","15 pages",,,,"math.ST stat.TH","http://arxiv.org/licenses/nonexclusive-distrib/1.0/","  A bracketing metric entropy bound for the class of Laplace transforms of
probability measures on [0,\infty) is obtained through its connection with the
small deviation probability of a smooth Gaussian process. Our results for the
particular smooth Gaussian process seem to be of independent interest.
","[{""version"":""v1"",""created"":""Fri, 1 Jan 2010 00:46:37 GMT""}]","2010-01-05"
"1001.0201","Charles Frohman","Charles Frohman","The Full Pythagorean Theorem","10 pages, 3 figures",,,,"math.HO","http://arxiv.org/licenses/nonexclusive-distrib/1.0/","  We motivate and then prove a generalized pythagorean theorem for
parallelepipeds in Euclidean space.
","[{""version"":""v1"",""created"":""Fri, 1 Jan 2010 04:16:43 GMT""}]","2010-01-05"
"1001.0202","Jonathan Holland","Jonathan Holland and George Sparling","Causal geometries and third-order ordinary differential equations",,,,,"math.DG math.SG","http://arxiv.org/licenses/nonexclusive-distrib/1.0/","  We discuss contact invariant structures on the space of solutions of a
third-order ordinary differential equation. Associated to any third-order
differential equation modulo contact transformations, Chern introduced a
degenerate conformal Lorentzian metric on the space of 2-jets of functions of
one variable. When the Wuenschmann invariant vanishes, the degenerate metric
descends to a proper conformal Lorentzian metric on the space of solutions. In
the general case, when the Wuenschmann invariant is not zero, we define the
notion of a causal geometry, and show that the space of solutions supports one.
The Wuenschmann invariant is then related to the projective curvature of the
indicatrix curve cut out by the causal geometry in the projective tangent
space. When the Wuenschmann vanishes, the causal structure is then precisely
the sheaf of null geodesics of the Chern conformal structure. We then introduce
a Lagrangian and associated Hamiltonian from which the degenerate conformal
Lorentzian metric are constructed. Finally, necessary and sufficient conditions
are given for a rank three degenerate conformal Lorentzian metric in four
dimensions to correspond to a third-order differential equation.
","[{""version"":""v1"",""created"":""Fri, 1 Jan 2010 01:54:49 GMT""}]","2010-01-05"
"1001.0203","Wei Sun","Li Ma and Wei Sun","On the generalized Feynman-Kac transformation for nearly symmetric
  Markov processes",,,,,"math.PR","http://arxiv.org/licenses/nonexclusive-distrib/1.0/","  Suppose $X$ is a right process which is associated with a non-symmetric
Dirichlet form $(\mathcal{E},D(\mathcal{E}))$ on $L^{2}(E;m)$. For $u\in
D(\mathcal{E})$, we have Fukushima's decomposition:
$\tilde{u}(X_{t})-\tilde{u}(X_{0})=M^{u}_{t}+N^{u}_{t}$. In this paper, we
investigate the strong continuity of the generalized Feynman-Kac semigroup
defined by $P^{u}_{t}f(x)=E_{x}[e^{N^{u}_{t}}f(X_{t})]$. Let
$Q^{u}(f,g)=\mathcal{E}(f,g)+\mathcal{E}(u,fg)$ for $f,g\in
D(\mathcal{E})_{b}$. Denote by $J_1$ the dissymmetric part of the jumping
measure $J$ of $(\mathcal{E},D(\mathcal{E}))$. Under the assumption that $J_1$
is finite, we show that $(Q^{u},D(\mathcal{E})_{b})$ is lower semi-bounded if
and only if there exists a constant $\alpha_0\ge 0$ such that
$\|P^{u}_{t}\|_2\leq e^{\alpha_0 t}$ for every $t>0$. If one of these
conditions holds, then $(P^{u}_{t})_{t\geq0}$ is strongly continuous on
$L^{2}(E;m)$. If $X$ is equipped with a differential structure, then this
result also holds without assuming that $J_1$ is finite.
","[{""version"":""v1"",""created"":""Fri, 1 Jan 2010 01:59:39 GMT""},{""version"":""v2"",""created"":""Tue, 5 Jan 2010 02:27:39 GMT""}]","2010-01-05"
"1001.0204","Alberto Carrami\~nana","Alberto Carraminana, Luis Carrasco, Alicia Porras, Elsa Recillas","Extensive near infrared monitoring of millimeter-wave / gamma-ray bright
  blazars","Contribution to 2009 Fermi Symposium eConf proceedings Co91122",,,,"astro-ph.HE astro-ph.CO","http://arxiv.org/licenses/nonexclusive-distrib/1.0/","  We established a sample of millimeter-wave and gamma-ray bright active
galactic nuclei matching the WMAP catalog with the EGRET catalog, highest
energy photons and the Fermi bright source list. We have monitored over 80 of
these objects in the near infrared, obtaining over 2000 JHKs data points
directly comparable with Fermi data. We present examples of correlated near
infrared and gamma-ray activity of known blazars and recently identified
sources.
","[{""version"":""v1"",""created"":""Fri, 1 Jan 2010 02:00:03 GMT""}]","2010-01-05"
"1001.0205","Gerhard Brunthaler","T. H\""ormann and G. Brunthaler","Dipole trap model for the metallic state in gated silicon-inversion
  layers","16 pages, 10 figures, submitted",,"10.1103/PhysRevB.82.205310",,"cond-mat.str-el cond-mat.dis-nn","http://arxiv.org/licenses/nonexclusive-distrib/1.0/","  In order to investigate the metallic state in high-mobility Si-MOS
structures, we have further developed and precised the dipole trap model which
was originally proposed by B.L. Altshuler and D.L. Maslov [Phys. Rev. Lett.\
82, 145 (1999)]. Our additional numerical treatment enables us to drop several
approximations and to introduce a limited spatial depth of the trap states
inside the oxide as well as to include a distribution of trap energies. It
turns out that a pronounced metallic state can be caused by such trap states at
appropriate energies whose behavior is in good agreement with experimental
observations.
","[{""version"":""v1"",""created"":""Fri, 1 Jan 2010 02:30:21 GMT""}]","2015-05-14"
"1001.0207","James Stankewicz","Alexander Brown, Eleanor Dannenberg, Jennifer Fox, Joshua Hanna,
  Katherine Keck, Alexander Moore, Zachary Robbins, Brandon Samples, and James
  Stankewicz","On a Generalization of the Frobenius Number","5 pages",,,,"math.NT","http://arxiv.org/licenses/nonexclusive-distrib/1.0/","  We consider a generalization of the Frobenius Problem where the object of
interest is the greatest integer which has exactly $j$ representations by a
collection of positive relatively prime integers. We prove an analogue of a
theorem of Brauer and Shockley and show how it can be used for computation.
","[{""version"":""v1"",""created"":""Fri, 1 Jan 2010 04:37:45 GMT""},{""version"":""v2"",""created"":""Thu, 7 Jan 2010 15:53:45 GMT""}]","2010-01-07"
"1001.0208","Matthew Patitz","David Doty, Jack H. Lutz, Matthew J. Patitz, Scott M. Summers, Damien
  Woods","Intrinsic Universality in Self-Assembly",,,,,"cs.CC","http://arxiv.org/licenses/nonexclusive-distrib/1.0/","  We show that the Tile Assembly Model exhibits a strong notion of universality
where the goal is to give a single tile assembly system that simulates the
behavior of any other tile assembly system. We give a tile assembly system that
is capable of simulating a very wide class of tile systems, including itself.
Specifically, we give a tile set that simulates the assembly of any tile
assembly system in a class of systems that we call \emph{locally consistent}:
each tile binds with exactly the strength needed to stay attached, and that
there are no glue mismatches between tiles in any produced assembly.
  Our construction is reminiscent of the studies of \emph{intrinsic
universality} of cellular automata by Ollinger and others, in the sense that
our simulation of a tile system $T$ by a tile system $U$ represents each tile
in an assembly produced by $T$ by a $c \times c$ block of tiles in $U$, where
$c$ is a constant depending on $T$ but not on the size of the assembly $T$
produces (which may in fact be infinite). Also, our construction improves on
earlier simulations of tile assembly systems by other tile assembly systems (in
particular, those of Soloveichik and Winfree, and of Demaine et al.) in that we
simulate the actual process of self-assembly, not just the end result, as in
Soloveichik and Winfree's construction, and we do not discriminate against
infinite structures. Both previous results simulate only temperature 1 systems,
whereas our construction simulates tile assembly systems operating at
temperature 2.
","[{""version"":""v1"",""created"":""Fri, 1 Jan 2010 15:39:54 GMT""},{""version"":""v2"",""created"":""Wed, 3 Feb 2010 11:18:29 GMT""}]","2016-09-08"
"1001.0209","Slim Ibrahim Dr","Lassaad Aloui, Slim Ibrahim, Kenji Nakanishi","Exponential Energy Decay for Damped Klein-Gordon Equation with
  Nonlinearities of Arbitrary Growth",,,,,"math.AP","http://arxiv.org/licenses/nonexclusive-distrib/1.0/","  We derive a uniform exponential decay of the total energy for the nonlinear
Klein-Gordon equation with a damping around spatial infinity in the whole space
or in the exterior of a star shaped obstacle.
","[{""version"":""v1"",""created"":""Fri, 1 Jan 2010 05:29:50 GMT""}]","2010-01-05"
"1001.0210","Alexander Vardy","Hessam Mahdavifar and Alexander Vardy","Achieving the Secrecy Capacity of Wiretap Channels Using Polar Codes","15 pages, to appear in the IEEE Transactions on Information Theory",,,,"cs.IT cs.CR math.IT","http://arxiv.org/licenses/nonexclusive-distrib/1.0/","  Suppose Alice wishes to send messages to Bob through a communication channel
C_1, but her transmissions also reach an eavesdropper Eve through another
channel C_2. The goal is to design a coding scheme that makes it possible for
Alice to communicate both reliably and securely. Reliability is measured in
terms of Bob's probability of error in recovering the message, while security
is measured in terms of Eve's equivocation ratio. Wyner showed that the
situation is characterized by a single constant C_s, called the secrecy
capacity, which has the following meaning: for all $\epsilon > 0$, there exist
coding schemes of rate $R \ge C_s - \epsilon$ that asymptotically achieve both
the reliability and the security objectives. However, his proof of this result
is based upon a nonconstructive random-coding argument. To date, despite a
considerable research effort, the only case where we know how to construct
coding schemes that achieve secrecy capacity is when Eve's channel C_2 is an
erasure channel, or a combinatorial variation thereof.
  Polar codes were recently invented by Arikan; they approach the capacity of
symmetric binary-input discrete memoryless channels with low encoding and
decoding complexity. Herein, we use polar codes to construct a coding scheme
that achieves the secrecy capacity for a wide range of wiretap channels. Our
construction works for any instantiation of the wiretap channel model, as long
as both C_1 and C_2 are symmetric and binary-input, and C_2 is degraded with
respect to C_1. Moreover, we show how to modify our construction in order to
provide strong security, in the sense defined by Maurer, while still operating
at a rate that approaches the secrecy capacity. In this case, we cannot
guarantee that the reliability condition will be satisfied unless the main
channel C_1 is noiseless, although we believe it can be always satisfied in
practice.
","[{""version"":""v1"",""created"":""Fri, 1 Jan 2010 05:30:10 GMT""},{""version"":""v2"",""created"":""Mon, 4 Apr 2011 00:48:19 GMT""}]","2015-03-13"
