"1001.0160","Ryan Adams","Ryan Prescott Adams, Hanna M. Wallach, Zoubin Ghahramani","Learning the Structure of Deep Sparse Graphical Models","20 pages, 6 figures, AISTATS 2010, Revised",,,,"stat.ML","http://arxiv.org/licenses/nonexclusive-distrib/1.0/","  Deep belief networks are a powerful way to model complex probability
distributions. However, learning the structure of a belief network,
particularly one with hidden units, is difficult. The Indian buffet process has
been used as a nonparametric Bayesian prior on the directed structure of a
belief network with a single infinitely wide hidden layer. In this paper, we
introduce the cascading Indian buffet process (CIBP), which provides a
nonparametric prior on the structure of a layered, directed belief network that
is unbounded in both depth and width, yet allows tractable inference. We use
the CIBP prior with the nonlinear Gaussian belief network so each unit can
additionally vary its behavior between discrete and continuous representations.
We provide Markov chain Monte Carlo algorithms for inference in these belief
networks and explore the structures learned on several image data sets.
","[{""version"":""v1"",""created"":""Thu, 31 Dec 2009 19:47:34 GMT""},{""version"":""v2"",""created"":""Thu, 19 Aug 2010 19:56:20 GMT""}]","2010-08-20"
"1001.0161","Mairi Sakellariadou","Mairi Sakellariadou","Phenomenology of loop quantum cosmology","16 pages, 3 figures; Invited talk in the First Mediterranean
  Conference on Classical and Quantum Gravity (Crete, Greece)","J.Phys.Conf.Ser.222:012027,2010","10.1088/1742-6596/222/1/012027",,"gr-qc astro-ph.CO hep-ph hep-th","http://arxiv.org/licenses/nonexclusive-distrib/1.0/","  After introducing the basic ingredients of Loop Quantum Cosmology, I will
briefly discuss some of its phenomenological aspects. Those can give some
useful insight about the full Loop Quantum Gravity theory and provide an answer
to some long-standing questions in early universe cosmology.
","[{""version"":""v1"",""created"":""Thu, 31 Dec 2009 17:32:29 GMT""}]","2014-11-20"
"1001.0162","Jan O Kleppe","Jan O. Kleppe, Rosa M. Mir\'o-Roig","Families of determinantal schemes","The non-emptiness of W(b;a) is restated as (2.2) in this version; the
  codimension c=2 case in (2.5)-(2.6) is reconsidered, and c > 2 (c > 3) is now
  an assumption in (2.16)-(2.17). 13 pages","Proc. Amer. Math. Soc. 139 (2011), 3831-3843",,,"math.AG","http://arxiv.org/licenses/nonexclusive-distrib/1.0/","  Given integers a_0 \le a_1 \le ... \le a_{t+c-2} and b_1 \le ... \le b_t, we
denote by W(b;a) \subset Hilb^p(\PP^{n}) the locus of good determinantal
schemes X \subset \PP^{n} of codimension c defined by the maximal minors of a t
x (t+c-1) homogeneous matrix with entries homogeneous polynomials of degree
a_j-b_i. The goal of this short note is to extend and complete the results
given by the authors in [10] and determine under weakened numerical assumptions
the dimension of W(b;a), as well as whether the closure of W(b;a) is a
generically smooth irreducible component of the Hilbert scheme Hilb^p(\PP^{n}).
","[{""version"":""v1"",""created"":""Thu, 31 Dec 2009 17:50:07 GMT""},{""version"":""v2"",""created"":""Thu, 18 Aug 2011 21:55:15 GMT""}]","2011-09-15"
"1001.0163","Francisco Sastre","Francisco Sastre","Short-time dynamic in the Majority vote model: The ordered and
  disordered initial cases","6 pages, 9 figures",,,,"cond-mat.stat-mech","http://arxiv.org/licenses/nonexclusive-distrib/1.0/","  This work presents short-time Monte Carlo simulations for the two dimensional
Majority-vote model starting from ordered and disordered states. It has been
found that there are two pseudo-critical points, each one within the error-bar
range of previous reported values performed using fourth order cumulant
crossing method. The results show that the short-time dynamic for this model
has a dependence on the initial conditions. Based on this dependence a method
is proposed for the evaluation of the pseudo critical points and the extraction
of the dynamical critical exponent $z$ and the static critical exponent
$\beta/\nu$ for this model.
","[{""version"":""v1"",""created"":""Thu, 31 Dec 2009 18:01:15 GMT""}]","2010-01-05"
"1001.0164","Vladimir S. Gerdjikov","Vladimir S. Gerdjikov","Bose-Einstein Condensates and spectral properties of multicomponent
  nonlinear Schrodinger equations","Submitted to Discrete and Continuous Dynamical Systems B, special
  volume of LENCOS conference, July 14-17, Seville",,,,"nlin.SI nlin.PS","http://arxiv.org/licenses/nonexclusive-distrib/1.0/","  We analyze the properties of the soliton solutions of a class of models
describing one-dimensional BEC with spin F. We describe the minimal sets of
scattering data which determine uniquely both the corresponding potential of
the Lax operator and its scattering matrix. Next we give several reductions of
these MNLS, derive their N-soliton solutions and analyze the soliton
interactions. Finally we prove an important theorem proving that if the initial
conditions satisfy the reduction then one gets a solution of the reduced MNLS.
","[{""version"":""v1"",""created"":""Thu, 31 Dec 2009 18:01:27 GMT""}]","2010-01-05"
"1001.0166","Vladimir S. Gerdjikov","V. S. Gerdjikov","On reductions of soliton solutions of multi-component NLS models and
  spinor Bose-Einstein condensates","AIP AMiTaNS'09 Proceedings,","AIP CP vol. 1186, 15-27 (2009)","10.1063/1.3265325",,"nlin.SI","http://arxiv.org/licenses/nonexclusive-distrib/1.0/","  We consider a class of multicomponent nonlinear Schrodinger equations (MNLS)
related to the symmetric BD.I-type symmetric spaces. As important particular
case of these MNLS we obtain the Kulish-Sklyanin model. Some new reductions and
their effects on the soliton solutions are obtained by proper modifying the
Zakahrov-Shabat dressing method.
","[{""version"":""v1"",""created"":""Thu, 31 Dec 2009 18:17:35 GMT""}]","2015-05-14"
"1001.0167","Yunnan Wu","Yunnan Wu and Anxiao Jiang","Position Modulation Code for Rewriting Write-Once Memories","Submitted to IEEE Transactions on Information Theory on Sept. 23,
  2009",,,,"cs.IT math.IT","http://arxiv.org/licenses/nonexclusive-distrib/1.0/","  A write-once memory (wom) is a storage medium formed by a number of
``write-once'' bit positions (wits), where each wit initially is in a `0' state
and can be changed to a `1' state irreversibly. Examples of write-once memories
include SLC flash memories and optical disks. This paper presents a low
complexity coding scheme for rewriting such write-once memories, which is
applicable to general problem configurations. The proposed scheme is called the
\emph{position modulation code}, as it uses the positions of the zero symbols
to encode some information. The proposed technique can achieve code rates
higher than state-of-the-art practical solutions for some configurations. For
instance, there is a position modulation code that can write 56 bits 10 times
on 278 wits, achieving rate 2.01. In addition, the position modulation code is
shown to achieve a rate at least half of the optimal rate.
","[{""version"":""v1"",""created"":""Thu, 31 Dec 2009 18:33:24 GMT""}]","2010-01-05"
"1001.0168","Vladimir S. Gerdjikov","V. S. Gerdjikov, N. A. Kostov and T. I. Valchev","Bose-Einstein condensates with F=1 and F=2. Reductions and soliton
  interactions of multi-component NLS models","SPIE UNO-09-UN101-19, SPIE Volume: 7501, (2009)",,"10.1117/12.849184",,"nlin.SI","http://arxiv.org/licenses/nonexclusive-distrib/1.0/","  We analyze a class of multicomponent nonlinear Schrodinger equations (MNLS)
related to the symmetric BD.I-type symmetric spaces and their reductions. We
briefly outline the direct and the inverse scattering method for the relevant
Lax operators and the soliton solutions. We use the Zakharov-Shabat dressing
method to obtain the two-soliton solution and analyze the soliton interactions
of the MNLS equations and some of their reductions.
","[{""version"":""v1"",""created"":""Thu, 31 Dec 2009 18:30:57 GMT""}]","2015-05-14"
"1001.0169","Jan Cameron","Jan Cameron, Junsheng Fang, Kunal Mukherjee","Mixing subalgebras of finite von Neumann algebras","24 pages, minor typos corrected",,,,"math.OA","http://arxiv.org/licenses/nonexclusive-distrib/1.0/","  Jolissaint and Stalder introduced definitions of mixing and weak mixing for
von Neumann subalgebras of finite von Neumann algebras. In this note, we study
various algebraic and analytical properties of subalgebras with these mixing
properties. We prove some basic results about mixing inclusions of von Neumann
algebras and establish a connection between mixing properties and normalizers
of von Neumann subalgebras. The special case of mixing subalgebras arising from
inclusions of countable discrete groups finds applications to ergodic theory,
in particular, a new generalization of a classical theorem of Halmos on the
automorphisms of a compact abelian group. For a finite von Neumann algebra $M$
and von Neumann subalgebras $A$, $B$ of $M$, we introduce a notion of weak
mixing of $B\subseteq M$ relative to $A$. We show that weak mixing of $B\subset
M$ relative to $A$ is equivalent to the following property: if $x\in M$ and
there exist a finite number of elements $x_1,...,x_n\in M$ such that $Ax\subset
\sum_{i=1}^nx_iB$, then $x\in B$. We conclude the paper with an assortment of
further examples of mixing subalgebras arising from the amalgamated free
product and crossed product constructions.
","[{""version"":""v1"",""created"":""Thu, 31 Dec 2009 18:42:36 GMT""},{""version"":""v2"",""created"":""Wed, 29 Jun 2011 02:29:30 GMT""},{""version"":""v3"",""created"":""Wed, 27 Jul 2011 17:00:56 GMT""}]","2011-07-28"
"1001.0170","Michael Khasin","M. Khasin, M.I. Dykman and B. Meerson","Speeding up disease extinction with a limited amount of vaccine",,,"10.1103/PhysRevE.81.051925",,"q-bio.PE cond-mat.stat-mech","http://arxiv.org/licenses/nonexclusive-distrib/1.0/","  We consider optimal vaccination protocol where the vaccine is in short
supply. In this case, disease extinction results from a large and rare
fluctuation. We show that the probability of such fluctuation can be
exponentially increased by vaccination. For periodic vaccination with fixed
average rate, the optimal vaccination protocol is model independent and
presents a sequence of short pulses. The effect of vaccination can be
resonantly enhanced if the pulse period coincides with the characteristic
period of the disease dynamics or its multiples. This resonant effect is
illustrated using a simple epidemic model. If the system is periodically
modulated, the pulses must be synchronized with the modulation, whereas in the
case of a wrong phase the vaccination can lead to a negative result. The
analysis is based on the theory of fluctuation-induced population extinction in
periodically modulated systems that we develop.
","[{""version"":""v1"",""created"":""Thu, 31 Dec 2009 19:01:58 GMT""},{""version"":""v2"",""created"":""Sun, 31 Jan 2010 23:29:07 GMT""}]","2013-05-29"
"1001.0171","H. J. Xiang","H. J. Xiang, Su-Huai Wei, and X. G. Gong","Novel Structural Motifs in Oxidized Graphene",,,,,"cond-mat.mtrl-sci","http://arxiv.org/licenses/nonexclusive-distrib/1.0/","  The structural and electronic properties of oxidized graphene are
investigated on the basis of the genetic algorithm and density functional
theory calculations. We find two new low energy semiconducting phases of the
fully oxidized graphene (C1O). In one phase, there is parallel epoxy pair
chains running along the zigzag direction. In contrast, the ground state phase
with a slightly lower energy and a much larger band gap contains epoxy groups
in three different ways: normal epoxy, unzipped epoxy, and epoxy pair. For
partially oxidized graphene, a phase separation between bare graphene and fully
oxidized graphene is predicted.
","[{""version"":""v1"",""created"":""Thu, 31 Dec 2009 19:14:19 GMT""}]","2010-01-05"
"1001.0172","Dylan Thurston","Steven J. Gortler and Dylan P. Thurston","Characterizing the universal rigidity of generic frameworks","18 pages, v2: updates throughout; v3: published version","Discrete & Computational Geometry, Volume 51, Issue 4 (2014),
  Pages 1017-1036","10.1007/s00454-014-9590-9",,"math.MG math.OC","http://creativecommons.org/licenses/by-nc-sa/3.0/","  A framework is a graph and a map from its vertices to E^d (for some d). A
framework is universally rigid if any framework in any dimension with the same
graph and edge lengths is a Euclidean image of it. We show that a generic
universally rigid framework has a positive semi-definite stress matrix of
maximal rank. Connelly showed that the existence of such a positive
semi-definite stress matrix is sufficient for universal rigidity, so this
provides a characterization of universal rigidity for generic frameworks. We
also extend our argument to give a new result on the genericity of strict
complementarity in semidefinite programming.
","[{""version"":""v1"",""created"":""Thu, 31 Dec 2009 19:19:37 GMT""},{""version"":""v2"",""created"":""Sat, 9 Oct 2010 16:45:25 GMT""},{""version"":""v3"",""created"":""Mon, 16 Jun 2014 05:39:32 GMT""}]","2014-06-17"
"1001.0173","Cornelia C. Lang","Cornelia C. Lang, Q. Daniel Wang, Fangjun Lu and Kelsey Clubb","The Radio Properties and Magnetic Field Configuration in the Crab-like
  Pulsar Wind Nebula G54.1+0.3","35 pages, 19 figures, accepted for publication in the Astrophysical
  Journal",,"10.1088/0004-637X/709/2/1125",,"astro-ph.GA astro-ph.HE","http://arxiv.org/licenses/nonexclusive-distrib/1.0/","  We present a multifrequency radio investigation of the Crab-like pulsar wind
nebula (PWN) G54.1+0.3 using the Very Large Array. The high resolution of the
observations reveals that G54.1+0.3 has a complex radio structure which
includes filamentary and loop-like structures that are magnetized, a diffuse
extent similar to the associated diffuse X-ray emission. But the radio and
X-ray structures in the central region differ strikingly, indicating that they
trace very different forms of particle injection from the pulsar and/or
particle acceleration in the nebula. No spectral index gradient is detected in
the radio emission across the PWN, whereas the X-ray emission softens outward
in the nebula. The extensive radio polarization allows us to image in detail
the intrinsic magnetic field, which is well-ordered and reveals that a number
of loop-like filaments are strongly magnetized. In addition, we determine that
there are both radial and toroidal components to the magnetic field structure
of the pulsar wind nebula. Strong mid-IR emission detected in Spitzer Space
Telescope data is closely correlated with the radio emission arising from the
southern edge of G54.1+0.3. In particular, the distributions of radio and X-ray
emission compared with the mid-IR emission suggest that the PWN may be
interacting with this interstellar cloud. This may be the first PWN where we
are directly detecting its interplay with an interstellar cloud that has
survived the impact of the supernova explosion associated with the pulsar's
progenitor.
","[{""version"":""v1"",""created"":""Thu, 31 Dec 2009 19:48:05 GMT""}]","2015-05-14"
"1001.0174","Efstratia Kalfagianni","Efstratia Kalfagianni","An intrinsic approach to invariants of framed links in 3-manifolds",,"Quantum Topol. 2 (2011), 71-96",,,"math.GT math.QA","http://creativecommons.org/licenses/publicdomain/","  We study framed links in irreducible 3-manifolds that are $Z$-homology
3-spheres or atoroidal $Q$-homology 3-spheres. We calculate the dual of the
Kauffman skein module over the ring of two variable power series with complex
coefficients. For links in $S^3$ we give a new construction of the classical
Kauffman polynomial.
","[{""version"":""v1"",""created"":""Fri, 1 Jan 2010 00:01:53 GMT""},{""version"":""v2"",""created"":""Fri, 22 Oct 2010 18:18:12 GMT""},{""version"":""v3"",""created"":""Tue, 1 Feb 2011 18:05:17 GMT""}]","2011-02-02"
"1001.0175","Iain Murray","Iain Murray, Ryan Prescott Adams, David J.C. MacKay","Elliptical slice sampling","8 pages, 6 figures, appearing in AISTATS 2010 (JMLR: W&CP volume 6).
  Differences from first submission: some minor edits in response to feedback.",,,,"stat.CO stat.ML","http://arxiv.org/licenses/nonexclusive-distrib/1.0/","  Many probabilistic models introduce strong dependencies between variables
using a latent multivariate Gaussian distribution or a Gaussian process. We
present a new Markov chain Monte Carlo algorithm for performing inference in
models with multivariate Gaussian priors. Its key properties are: 1) it has
simple, generic code applicable to many models, 2) it has no free parameters,
3) it works well for a variety of Gaussian process based models. These
properties make our method ideal for use while model building, removing the
need to spend time deriving and tuning updates for more complex algorithms.
","[{""version"":""v1"",""created"":""Thu, 31 Dec 2009 19:41:31 GMT""},{""version"":""v2"",""created"":""Fri, 19 Mar 2010 13:05:31 GMT""}]","2010-03-22"
"1001.0177","Alexis Zamora","Claudia R. Alcantara, Abel Castorena and Alexis G. Zamora","On the slope of relatively minimal fibrations on rational complex
  surfaces","Final version. Typos and small inaccurancies corrected. A new, more
  motivated introduction. To appear in Collectanea Math",,,,"math.AG","http://arxiv.org/licenses/nonexclusive-distrib/1.0/","  Given a relatively minimal fibration $f: S \to \Bbb P^1$ on a rational
surface $S$ with general fiber $C$ of genus $g$, we investigate under what
conditions the inequality $6(g-1)\le K_f^2$ occurs, where $K_f$ is the
canonical relative sheaf of $f$. We give sufficient conditions for having such
inequality, depending on the genus and gonality of $C$ and the number of
certain exceptional curves on $S$. We illustrate how these results can be used
for constructing fibrations with the desired property. For fibrations of genus
$11\le g\le 49$ we prove the inequality: $$ 6(g-1) +4 -4\sqrt g \le K_f^2.$$
","[{""version"":""v1"",""created"":""Thu, 31 Dec 2009 20:00:37 GMT""},{""version"":""v2"",""created"":""Fri, 13 Aug 2010 19:58:54 GMT""},{""version"":""v3"",""created"":""Tue, 17 Aug 2010 18:31:20 GMT""}]","2010-08-18"
"1001.0178","Sergio Dain","Sergio Dain and Mar\'ia E. Gabach Cl\'ement","Small deformations of extreme Kerr black hole initial data","26 pages, 4 figures","Class.Quant.Grav.28:075003,2011","10.1088/0264-9381/28/7/075003",,"gr-qc","http://arxiv.org/licenses/nonexclusive-distrib/1.0/","  We prove the existence of a family of initial data for Einstein equations
which represent small deformations of the extreme Kerr black hole initial data.
The data in this family have the same asymptotic geometry as extreme Kerr. In
particular, the deformations preserve the angular momentum and the area of the
cylindrical end.
","[{""version"":""v1"",""created"":""Thu, 31 Dec 2009 20:51:13 GMT""}]","2011-03-03"
"1001.0179","Oleg Mokhov","O. I. Mokhov","Deformations of Poisson structures by closed 3-forms","5 pages",,,,"math.SG hep-th math-ph math.DG math.DS math.MP nlin.SI","http://arxiv.org/licenses/nonexclusive-distrib/1.0/","  We prove that an arbitrary Poisson structure omega^{ij}(u) and an arbitrary
closed 3-form T_{ijk}(u) generate the local Poisson structure A^{ij}(u,u_x) =
M^i_s(u,u_x)omega^{sj}(u), where M^i_s(u,u_x)(delta^s_j +
omega^{sp}(u)T_{pjk}(u)u^k_x) = delta^i_j, on the corresponding loop space. We
obtain also a special graded epsilon-deformation of an arbitrary Poisson
structure omega^{ij}(u) by means of an arbitrary closed 3-form T_{ijk}(u).
","[{""version"":""v1"",""created"":""Thu, 31 Dec 2009 20:52:06 GMT""}]","2010-01-06"
"1001.0180","Serban Raianu","Miodrag C. Iovanov, Serban Raianu","The Bijectivity of the Antipode Revisited","6p",,,,"math.QA math.RT","http://arxiv.org/licenses/nonexclusive-distrib/1.0/","  We provide a very short approach to several fundamental results for Hopf
algebras with nonzero integrals. Besides being short, our approach is the first
to prove the bijectivity of the antipode without using the uniqueness of the
integrals of Hopf algebras and to obtain the uniqueness of integrals as a
corollary in a way similar to the classical theory of the Haar measure on
compact groups.
","[{""version"":""v1"",""created"":""Thu, 31 Dec 2009 21:01:45 GMT""},{""version"":""v2"",""created"":""Mon, 1 Mar 2010 20:12:02 GMT""},{""version"":""v3"",""created"":""Wed, 19 May 2010 04:05:29 GMT""},{""version"":""v4"",""created"":""Mon, 23 Aug 2010 22:48:16 GMT""}]","2010-08-25"
"1001.0182","Alexander Gavrilenko","Alexander V. Gavrilenko, Carla S. McKinney, Vladimir I. Gavrilenko","Effects of Molecular Adsorption on Optical Losses of the Ag (111)
  Surface","7 pages, 4 figures, 1 table",,"10.1103/PhysRevB.82.155426",,"cond-mat.mtrl-sci physics.comp-ph","http://arxiv.org/licenses/nonexclusive-distrib/1.0/","  The first principles density functional theory (DFT) is applied to study
effects of molecular adsorption on optical losses of silver (111) surface. The
ground states of the systems including water, methanol, and ethanol molecules
adsorbed on Ag (111) surface were obtained by the total energy minimization
method within the local density approximation (LDA). Optical functions were
calculated within the Random Phase Approximation (RPA) approach. Contribution
of the surface states to optical losses was studied by calculations of the
dielectric function of bare Ag (111) surface. Substantial modifications of the
real and imaginary parts of the dielectric functions spectra in the near
infrared and visible spectral regions, caused by surface states and molecular
adsorption, were obtained. The results are discussed in comparison with
available experimental data.
","[{""version"":""v1"",""created"":""Thu, 31 Dec 2009 21:20:52 GMT""}]","2015-05-14"
"1001.0183","Alexandros Karlis K","A.K. Karlis, F.K. Diakonos, V. Constantoudis, P. Schmelcher","The simplified stochastic Fermi-Ulam model revisited","This paper has been withdrawn by the authors. The work has been
  redone on a totally new basis. The new results relate not only to the
  stochastic simplified FUM, but to time-dependent billiards in general",,,,"nlin.CD","http://arxiv.org/licenses/nonexclusive-distrib/1.0/","  The description of Fermi acceleration developing in the phase-randomized
simplified Fermi-Ulam model (SFUM) can be achieved in terms of a random walk
taking place in momentum space. Within this framework the evolution of the
probability density function of particle velocities is determined by the
Fokker-Planck equation (FPE). However, the standard treatment in the literature
leads to a result, which even though is in agreement with the numerical
results, it is inconsistent with the transport coefficients used for the
construction of the FPE. In this work we present a consistent scheme for the
description of Fermi acceleration, resolving this contradiction.
","[{""version"":""v1"",""created"":""Thu, 31 Dec 2009 21:19:29 GMT""},{""version"":""v2"",""created"":""Tue, 8 Feb 2011 09:24:05 GMT""}]","2011-02-09"
"1001.0184","Michael Chance","Mike Chance","Degenerate Maxima in Hamiltonian Systems","13 pages",,,,"math.SG","http://arxiv.org/licenses/nonexclusive-distrib/1.0/","  In this paper we explore loops of non-autonomous Hamiltonian diffeomorphisms
with degenerate fixed maxima. We show that such loops can not have totally
degenerate fixed global maxima. This has applications for the Hofer geometry of
the group of Hamiltonians for certain symplectic 4 manifolds and also gives
criteria for certain 4 manifolds to be uniruled.
","[{""version"":""v1"",""created"":""Thu, 31 Dec 2009 21:30:14 GMT""}]","2010-01-05"
"1001.0185","Piers Coleman","Piers Coleman","Quantum Criticality and Novel Phases: A panel discussion","Report on the panel discussion at the 2009 Dresden Meeting on Quantum
  Criticality and Novel Phases","Physica Status Solidi B, 247, 506-512 (2010)","10.1002/pssb.200983083",,"cond-mat.str-el","http://arxiv.org/licenses/nonexclusive-distrib/1.0/","  Physicists gathered in august at Dresden for a conference about ""Quantum
Criticality and Novel Phases"". As one part of the meeting, nine panelists
hosted an open and free-wheeling discussion on the topic of the meeting. This
article outlines the discussions that took place during at this panel-meeting
on the afternoon of August 3rd, 2009.
","[{""version"":""v1"",""created"":""Thu, 31 Dec 2009 21:44:52 GMT""}]","2010-08-23"
"1001.0186","Benjamin Matschke","Benjamin Matschke","On the Square Peg Problem and Its Relatives","22 pages, 14 figures; improved proofs, new corollaries, includes more
  results form author's thesis; accepted version",,,,"math.MG math.AT","http://creativecommons.org/licenses/by-nc-sa/4.0/","  Toeplitz's Square Peg Problem asks whether every continuous simple closed
curve in the plane contains the four vertices of a square. It has been proved
for various classes of sufficiently smooth curves, some of which are dense,
none of which are open. In this paper we prove it for several open classes of
curves, one of which is also dense. This can be interpreted in saying that the
Square Peg Problem is solved for generic curves. The latter class contains all
previously known classes for which the Square Peg Problem has been proved in
the affirmative. [footnote]
  We also prove results about rectangles inscribed in immersed curves. Finally,
we show that the problem of finding a regular octahedron on metric 2-spheres
has a ""topological counter-example"", that is, a certain test map with boundary
condition exists.
","[{""version"":""v1"",""created"":""Thu, 31 Dec 2009 23:25:38 GMT""},{""version"":""v2"",""created"":""Fri, 18 Mar 2022 14:02:32 GMT""}]","2022-03-21"
