"1001.0212","Walter D. Neumann","Jason Behrstock, Walter D Neumann","Quasi-isometric classification of non-geometric 3-manifold groups","Minor revision (added footnote in the Introduction)","J. Reine Angew. Math. Issue 669 (2012), 101--120","10.1515/CRELLE.2011.143",,"math.GT math.GR","http://arxiv.org/licenses/nonexclusive-distrib/1.0/","  We describe the quasi-isometric classification of fundamental groups of
irreducible non-geometric 3-manifolds which do not have ""too many"" arithmetic
hyperbolic geometric components, thus completing the quasi-isometric
classification of 3--manifold groups in all but a few exceptional cases.
","[{""version"":""v1"",""created"":""Fri, 1 Jan 2010 05:39:01 GMT""},{""version"":""v2"",""created"":""Fri, 12 Feb 2010 05:44:21 GMT""}]","2014-07-29"
"1001.0213","Wei-Tou Ni","Wei-Tou Ni","Testing Relativistic Gravity and Detecting Gravitational Waves in Space","8 pages, 1 figure, invited presentation for the Ninth Asia-Pacific
  International Conference on Gravitation and Astrophysics (ICGA9), Wuhan, June
  28-July 3, 2009; for the proceedings to be published by World Scientific",,"10.1142/9789814307673_0004",,"gr-qc","http://arxiv.org/licenses/nonexclusive-distrib/1.0/","  For testing gravity and detecting gravitational waves in space, deep-space
laser ranging using drag-free spacecraft is a common method. Deep space
provides a large arena and a long integration time. Laser technology provides
measurement sensitivity, while drag-free technology ensures that gravitational
phenomenon to be measured with least spurious noises. In this talk, we give an
overview of motivations and methods of various space missions/proposals testing
relativistic gravity and detecting gravitational waves, and refer to various
references.
","[{""version"":""v1"",""created"":""Fri, 1 Jan 2010 05:54:25 GMT""}]","2017-08-23"
"1001.0214","Hideo Hasegawa","Hideo Hasegawa (Tokyo Gakugei Univ.)","The entropy in finite $N$-unit nonextensive systems: the ordinary
  average and $q$-average","23 pages, 5 figures: the final version accepted in J. Math. Phys","J. Math. Phys. 51 (2010) 093301","10.1063/1.3479394",,"cond-mat.stat-mech","http://arxiv.org/licenses/nonexclusive-distrib/1.0/","  We have discussed the Tsallis entropy in finite $N$-unit nonextensive
systems, by using the multivariate $q$-Gaussian probability distribution
functions (PDFs) derived by the maximum entropy methods with the normal average
and the $q$-average ($q$: the entropic index). The Tsallis entropy obtained by
the $q$-average has an exponential $N$ dependence: $S_q^{(N)}/N \simeq
\:e^{(1-q)N \:S_1^{(1)}} $ for large $N$ ($\gg \frac{1}{(1-q)} >0$). In
contrast, the Tsallis entropy obtained by the normal average is given by
$S_q^{(N)}/N \simeq [1/(q-1)N]$ for large $N$ ($\gg \frac{1}{(q-1)} > 0)$. $N$
dependences of the Tsallis entropy obtained by the $q$- and normal averages are
generally quite different, although the both results are in fairly good
agreement for $\vert q-1 \vert \ll 1.0$. The validity of the factorization
approximation to PDFs which has been commonly adopted in the literature, has
been examined. We have calculated correlations defined by $C_m= \langle (\delta
x_i \:\delta x_j)^m \rangle -\langle (\delta x_i)^m \rangle\: \langle (\delta
x_j)^m \rangle$ for $i \neq j$ where $\delta x_i=x_i -\langle x_i \rangle$, and
the bracket $\langle \cdot \rangle$ stands for the normal and $q$-averages. The
first-order correlation ($m=1$) expresses the intrinsic correlation and
higher-order correlations with $m \geq 2$ include nonextensivity-induced
correlation, whose physical origin is elucidated in the superstatistics.
","[{""version"":""v1"",""created"":""Fri, 1 Jan 2010 06:02:37 GMT""},{""version"":""v2"",""created"":""Tue, 5 Jan 2010 21:23:11 GMT""},{""version"":""v3"",""created"":""Thu, 14 Jan 2010 21:27:53 GMT""},{""version"":""v4"",""created"":""Tue, 27 Jul 2010 03:40:00 GMT""}]","2015-05-14"
"1001.0215","Dmitry Prokhorov","D. A. Prokhorov, Joseph Silk","Can the excess in the FeXXVI Ly gamma line from the Galactic Center
  provide evidence for 17 keV sterile neutrinos?","3 pages, submitted to Physical Review Letters",,"10.1088/2041-8205/725/2/L131",,"astro-ph.HE","http://arxiv.org/licenses/nonexclusive-distrib/1.0/","  The standard model of particle physics assumes that neutrinos are massless,
although adding non-zeros is required by the experimentally established
phenomenon of neutrino oscillations requires neutrinos to have non-zero mass.
Sterile neutrinos (or right-handed neutrinos) are a good warm dark matter
candidate. We find that the excess of the intensity in the 8.7 keV line (at the
energy of the FeXXVI Ly$\gamma$ line) in the spectrum of the Galactic center
observed by the Suzaku X-ray mission cannot be explained by standard ionization
and recombination processes. We suggest that the origin of this excess is via
decays of sterile neutrinos with a mass of 17.4 keV and estimate the value of
the mixing angle. The estimated value of the mixing angle $\sin^2(2\theta)=(4.1
\pm 2.2)\times10^{-12}$ lies in the allowed region of the mixing angle of dark
matter sterile neutrino with a mass of 17-18 keV.
","[{""version"":""v1"",""created"":""Fri, 1 Jan 2010 06:19:31 GMT""}]","2015-05-14"
"1001.0216","Douglas Caldwell","Douglas A. Caldwell, Jeffery J. Kolodziejczak, Jeffrey E. Van Cleve,
  Jon M. Jenkins, Paul R. Gazis, Vic S. Argabright, Eric E. Bachtell, Edward W.
  Dunham, John C. Geary, Ronald L. Gilliland, Hema Chandrasekaran, Jie Li,
  Peter Tenenbaum, Hayley Wu, William J. Borucki, Stephen T. Bryson, Jessie L.
  Dotson, Michael R. Haas, David G. Koch","Instrument Performance in Kepler's First Months","5 pages, 2 figures, 2 tables, Astrophysical Journal Letters, accepted",,"10.1088/2041-8205/713/2/L92",,"astro-ph.EP astro-ph.IM","http://arxiv.org/licenses/nonexclusive-distrib/1.0/","  The Kepler Mission relies on precise differential photometry to detect the 80
parts per million (ppm) signal from an Earth-Sun equivalent transit. Such
precision requires superb instrument stability on time scales up to ~2 days and
systematic error removal to better than 20 ppm. To this end, the spacecraft and
photometer underwent 67 days of commissioning, which included several data sets
taken to characterize the photometer performance. Because Kepler has no
shutter, we took a series of dark images prior to the dust cover ejection, from
which we measured the bias levels, dark current, and read noise. These basic
detector properties are essentially unchanged from ground-based tests,
indicating that the photometer is working as expected. Several image artifacts
have proven more complex than when observed during ground testing, as a result
of their interactions with starlight and the greater thermal stability in
flight, which causes the temperature-dependent artifact variations to be on the
timescales of transits. Because of Kepler's unprecedented sensitivity and
stability, we have also seen several unexpected systematics that affect
photometric precision. We are using the first 43 days of science data to
characterize these effects and to develop detection and mitigation methods that
will be implemented in the calibration pipeline. Based on early testing, we
expect to attain Kepler's planned photometric precision over 80%-90% of the
field of view.
","[{""version"":""v1"",""created"":""Fri, 1 Jan 2010 08:11:24 GMT""}]","2015-05-14"
"1001.0217","Shlomo Reisner","Jaegil Kim and Shlomo Reisner","Local minimality of the volume-product at the simplex","Mathematika, accepted",,"10.1112/S0025579310001555",,"math.MG math.FA","http://arxiv.org/licenses/nonexclusive-distrib/1.0/","  It is proved that the simplex is a strict local minimum for the volume
product, P(K)=min(vol(K) vol(K^z)), K^z is the polar body of K with respect to
z, the minimum is taken over z in the interior of K, in the Banach-Mazur space
of n-dimensional (classes of ) convex bodies. Linear local stability in the
neighborhood of the simplex is proved as well. The proof consists of an
extension to the non-symmetric setting of methods that were recently introduced
by Nazarov, Petrov, Ryabogin and Zvavitch, as well as proving results of
independent interest, concerning stability of square order of volumes of polars
of non-symmetric convex bodies.
","[{""version"":""v1"",""created"":""Fri, 1 Jan 2010 08:32:55 GMT""},{""version"":""v2"",""created"":""Tue, 31 Aug 2010 07:41:40 GMT""}]","2014-01-14"
"1001.0218","Tian De Cao","Tian De Cao","The free states-related Fermi pocket of cuprate superconductors","7 pages",,,,"physics.gen-ph","http://arxiv.org/licenses/nonexclusive-distrib/1.0/","  To stress the effect of the pairing position deviating from the Fermi level,
we must investigate the pairs in the wave vector space, and then we use the
dynamic equation to study some correlation functions. This article shows that
the Fermi pocket is related to the effect of free electron states on the ARPES
experiment. This also leads us to understand why the Fermi arc appears in
Bi2212 while the Fermi pocket appears in Bi2201 with the valence bandwidth and
the work function known for them.
","[{""version"":""v1"",""created"":""Fri, 1 Jan 2010 08:56:13 GMT""},{""version"":""v2"",""created"":""Tue, 26 Jan 2010 00:53:36 GMT""},{""version"":""v3"",""created"":""Mon, 17 May 2010 07:28:16 GMT""},{""version"":""v4"",""created"":""Tue, 13 Jul 2010 13:35:42 GMT""}]","2010-07-14"
"1001.0219","Roberto Zucchini","Roberto Zucchini","The gauging of BV algebras","81 pages","J.Geom.Phys.60:1860-1880,2010","10.1016/j.geomphys.2010.07.003","DFUB 12/09","hep-th math.DG","http://arxiv.org/licenses/nonexclusive-distrib/1.0/","  A BV algebra is a formal framework within which the BV quantization algorithm
is implemented. In addition to the gauge symmetry, encoded in the BV master
equation, the master action often exhibits further global symmetries, which may
be in turn gauged. We show how to carry this out in a BV algebraic set up.
Depending on the nature of the global symmetry, the gauging involves coupling
to a pure ghost system with a varying amount of ghostly supersymmetry. Coupling
to an N=0 ghost system yields an ordinary gauge theory whose observables are
appropriately classified by the invariant BV cohomology. Coupling to an N=1
ghost system leads to a topological gauge field theory whose observables are
classified by the equivariant BV cohomology. Coupling to higher $N$ ghost
systems yields topological gauge field theories with higher topological
symmetry. In the latter case, however, problems of a completely new kind
emerge, which call for a revision of the standard BV algebraic framework.
","[{""version"":""v1"",""created"":""Fri, 1 Jan 2010 09:11:35 GMT""}]","2014-11-20"
"1001.0220","Shin'ichi Nojiri","Jiro Matsumoto and Shin'ichi Nojiri","Reconstruction of k-essence model","LaTeX 9 pages","Phys.Lett.B687:236-242,2010","10.1016/j.physletb.2010.03.030",,"hep-th","http://arxiv.org/licenses/nonexclusive-distrib/1.0/","  We explicitly construct the k-essence models which reproduce the arbitrary
FRW cosmology, that is, the arbitrary time-development of the scale factor or
the Hubble rate. The k-essence model includes scalar quintessence model,
tachyon dark energy model, ghost condensation model as special cases. Explicit
formulas of the reconstruction are given. First we consider the case that the
action only contains the kinetic term. In this case, we find that the model
reproducing the development of the universe in the exact $\Lambda$CDM model
cannot be constructed although there is a model which reproduces the
development infinitely closing to $\Lambda$CDM model. We find, however, the
solution is not stable. Another is more general case including potential etc.,
where we find that there appear infinite number of arbitrary functions of the
scalar fields, which are redundant to the time development of the scale factor.
By adjusting one of the redundant functions, however, we can obtain the model
where any solution we need could be stable.
","[{""version"":""v1"",""created"":""Fri, 1 Jan 2010 10:34:34 GMT""}]","2010-04-30"
"1001.0222","Shoichi Ichinose","Shoichi Ichinose","Casimir Energy of the Universe and New Regularization of Higher
  Dimensional Quantum Field Theories","13 paes, 8 figures, proceedings of 1st Mediterranean Conf. on CQG","J.Phys.Conf.Ser.222:012048,2010","10.1088/1742-6596/222/1/012048","US-10-01","hep-th","http://arxiv.org/licenses/nonexclusive-distrib/1.0/","  Casimir energy is calculated for the 5D electromagnetism and 5D scalar theory
in the {\it warped} geometry. It is compared with the flat case. A new
regularization, called {\it sphere lattice regularization}, is taken. In the
integration over the 5D space, we introduce two boundary curves (IR-surface and
UV-surface) based on the {\it minimal area principle}. It is a {\it direct}
realization of the geometrical approach to the {\it renormalization group}. The
regularized configuration is {\it closed-string like}. We do {\it not} take the
KK-expansion approach. Instead, the position/momentum propagator is exploited,
combined with the {\it heat-kernel method}. All expressions are closed-form
(not KK-expanded form). The {\it generalized} P/M propagators are introduced.
We numerically evaluate $\La$(4D UV-cutoff), $\om$(5D bulk curvature, warp
parameter) and $T$(extra space IR parameter) dependence of the Casimir energy.
We present two {\it new ideas} in order to define the 5D QFT: 1) the summation
(integral) region over the 5D space is {\it restricted} by two minimal surfaces
(IR-surface, UV-surface) ; or 2) we introduce a {\it weight function} and
require the dominant contribution, in the summation, is given by the {\it
minimal surface}. Based on these, 5D Casimir energy is {\it finitely} obtained
after the {\it proper renormalization procedure.} The {\it warp parameter}
$\om$ suffers from the {\it renormalization effect}. The IR parameter $T$ does
not. We examine the meaning of the weight function and finally reach a {\it new
definition} of the Casimir energy where {\it the 4D momenta(or coordinates) are
quantized} with the extra coordinate as the Euclidean time (inverse
temperature). We examine the cosmological constant problem and present an
answer at the end. Dirac's large number naturally appears.
","[{""version"":""v1"",""created"":""Fri, 1 Jan 2010 10:35:18 GMT""}]","2014-11-20"
"1001.0223","Yu. I. Manin","Yu. I. Manin","Combinatorial cubic surfaces and reconstruction theorems","28 pages",,,,"math.AG","http://arxiv.org/licenses/nonexclusive-distrib/1.0/","  This note contains a solution to the following problem: reconstruct the
definition field and the equation of a projective cubic surface, using only
combinatorial information about the set of its rational points. This
information is encoded in two relations: collinearity and coplanarity of
certain subsets of points. We solve this problem, assuming mild ``general
position'' properties. This study is motivated by an attempt to address the
Mordell--Weil problem for cubic surfaces using essentially model theoretic
methods. However, the language of model theory is not used explicitly.
","[{""version"":""v1"",""created"":""Fri, 1 Jan 2010 10:35:25 GMT""}]","2010-01-05"
"1001.0224","Toshiyuki Kobayashi","Toshiyuki Kobayashi","Algebraic analysis of minimal representations","Special Volume for Mikio Sato in celebration of fifty years of
  algebraic analysis","Publications of the Research Institute for Mathematical Sciences,
  47, no. 2, (2011), 585-611","10.2977/PRIMS/45",,"math.RT math.AP","http://arxiv.org/licenses/nonexclusive-distrib/1.0/","  Small representations of a group bring us to large symmetries in a
representation space. Analysis on minimal representations utilises large
symmetries in their geometric models, and serves as a driving force in creating
new interesting problems that interact with other branches of mathematics.
  This article discusses the following three topics that arise from minimal
representations of the indefinite orthogonal group:
  1. construction of conservative quantities for ultra-hyperbolic equations,
  2. quantative discrete branching laws,
  3. deformation of the Fourier transform with emphasis on the prominent roles
of Sato's idea on algebraic analysis.
","[{""version"":""v1"",""created"":""Fri, 1 Jan 2010 11:10:35 GMT""}]","2011-09-27"
"1001.0225","Vladimir A. Yurovsky","V. A. Yurovsky (School of Chemistry, Tel Aviv University), M. Olshanii
  (Department of Physics, University of Massachusetts Boston)","Restricted Thermalization for Two Interacting Atoms in a Multimode
  Harmonic Waveguide","Two LATeX files, the main text and the supplement","Phys. Rev. A 81, 043641 (2010)","10.1103/PhysRevA.81.043641",,"physics.atom-ph physics.gen-ph","http://arxiv.org/licenses/nonexclusive-distrib/1.0/","  In this article, we study the thermalizability of a system consisting of two
atoms in a circular, transversely harmonic waveguide in the multimode regime.
While showing some signatures of the quantum-chaotic behavior, the system fails
to reach a thermal equilibrium in a relaxation from an initial state, even when
the interaction between the atoms is infinitely strong. We relate this
phenomenon to the previously addressed unattainability of a complete quantum
chaos in the Seba billiard [P. Seba, Phys. Rev. Lett., 64, 1855 (1990)], and we
conjecture the absence of a complete thermalization to be a generic property of
integrable quantum systems perturbed by a non-integrable but well localized
perturbation.
","[{""version"":""v1"",""created"":""Fri, 1 Jan 2010 12:27:52 GMT""}]","2010-06-01"
"1001.0226","Huai Yang Cui","Huai-yang Cui","Derivation of Gell-Mann-Nishijima formula from the electromagnetic field
  modes of a hadron","LaTex, 10 pages, 5 figures",,,,"physics.gen-ph","http://arxiv.org/licenses/nonexclusive-distrib/1.0/","  When an electron probes another elementary particle Q, the wave function of
the electron can be separated into two independent parts, the first part
represents the electronic motion, the second part represents the
electromagnetic field mode around the particle Q. In analogy with optical modes
$TEM_{nlm}$ for a laser resonator, when the electromagnetic field around the
particle Q forms into a mode, the quantum numbers of the mode satisfy the
Gell-Mann-Nishijima formula, these quantum numbers are recognized as the charge
number, baryon number and strangeness number. The modes are used as a visual
model to understand the abstract baryon number and strangeness number of
hadrons.
","[{""version"":""v1"",""created"":""Fri, 1 Jan 2010 12:30:13 GMT""},{""version"":""v2"",""created"":""Fri, 23 Jul 2010 05:31:04 GMT""}]","2015-03-13"
"1001.0227","Kazem Azizi","T. M. Aliev, K. Azizi, M. Savci","Analysis of the $\Lambda_{b}\rar \Lambda \ell^+\ell^- $ decay in QCD","18 Pages, 2 Figures and 9 Tables","Phys.Rev.D81:056006,2010","10.1103/PhysRevD.81.056006",,"hep-ph","http://arxiv.org/licenses/nonexclusive-distrib/1.0/","  Taking into account the $\Lambda$ baryon distribution amplitudes and the most
general form of the interpolating current of the $\Lambda_{b}$, the
semileptonic $\Lambda_{b}\rar \Lambda \ell^+\ell^- $ transition is investigated
in the framework of the light cone QCD sum rules. Sum rules for all twelve form
factors responsible for the $\Lambda_{b}\rar \Lambda \ell^+\ell^- $ decay are
constructed. The obtained results for the form factors are used to compute the
branching fraction. A comparison of the obtained results with the existing
predictions of the heavy quark effective theory is presented. The results of
the branching ratio shows the detectability of this channel at the LHCb in the
near future is quite high.
","[{""version"":""v1"",""created"":""Fri, 1 Jan 2010 12:38:37 GMT""},{""version"":""v2"",""created"":""Mon, 29 Mar 2010 14:12:36 GMT""},{""version"":""v3"",""created"":""Mon, 17 May 2010 14:43:55 GMT""}]","2010-05-19"
"1001.0229","Tim Bedding","T. R. Bedding, D. Huber, D. Stello, Y. P. Elsworth, S. Hekker, T.
  Kallinger, S. Mathur, B. Mosser, H. L. Preston, J. Ballot, C. Barban, A. M.
  Broomhall, D. L. Buzasi, W. J. Chaplin, R. A. Garcia, M. Gruberbauer, S. J.
  Hale, J. De Ridder, S. Frandsen, W. J. Borucki, T. Brown, J.
  Christensen-Dalsgaard, R. L. Gilliland, J. M. Jenkins, H. Kjeldsen, D. Koch,
  K. Belkacem, L. Bildsten, H. Bruntt, T. L. Campante, S. Deheuvels, A.
  Derekas, M.-A. Dupret, M.-J. Goupil, A. Hatzes, G. Houdek, M. J. Ireland, C.
  Jiang, C. Karoff, L. L. Kiss, Y. Lebreton, A. Miglio, J. Montalban, A. Noels,
  I. W. Roxburgh, V. Sangaralingam, I. R. Stevens, M. D. Suran, N. J. Tarrant,
  and A. Weiss","Solar-like oscillations in low-luminosity red giants: first results from
  Kepler","accepted by ApJ Letters, to appear in special Kepler issue. Updated
  references",,"10.1088/2041-8205/713/2/L176",,"astro-ph.SR","http://arxiv.org/licenses/nonexclusive-distrib/1.0/","  We have measured solar-like oscillations in red giants using time-series
photometry from the first 34 days of science operations of the Kepler Mission.
The light curves, obtained with 30-minute sampling, reveal clear oscillations
in a large sample of G and K giants, extending in luminosity from the red clump
down to the bottom of the giant branch. We confirm a strong correlation between
the large separation of the oscillations (Delta nu) and the frequency of
maximum power (nu_max). We focus on a sample of 50 low-luminosity stars (nu_max
> 100 muHz, L <~ 30 L_sun) having high signal-to-noise ratios and showing the
unambiguous signature of solar-like oscillations. These are H-shell-burning
stars, whose oscillations should be valuable for testing models of stellar
evolution and for constraining the star-formation rate in the local disk. We
use a new technique to compare stars on a single echelle diagram by scaling
their frequencies and find well-defined ridges corresponding to radial and
non-radial oscillations, including clear evidence for modes with angular degree
l=3. Measuring the small separation between l=0 and l=2 allows us to plot the
so-called C-D diagram of delta nu_02 versus Delta nu. The small separation
delta nu_01 of l=1 from the midpoint of adjacent l=0 modes is negative,
contrary to the Sun and solar-type stars. The ridge for l=1 is notably
broadened, which we attribute to mixed modes, confirming theoretical
predictions for low-luminosity giants. Overall, the results demonstrate the
tremendous potential of Kepler data for asteroseismology of red giants.
","[{""version"":""v1"",""created"":""Fri, 1 Jan 2010 12:43:46 GMT""},{""version"":""v2"",""created"":""Fri, 22 Jan 2010 12:16:44 GMT""}]","2015-05-14"
"1001.0230","Yuriy Drozd","Yuriy A. Drozd, Ruslan V. Skuratovskii","Cubic rings and their ideals","9 pages","Ukrainian Math. J. 62, No. 4 (2010), 464-470",,,"math.AC","http://arxiv.org/licenses/nonexclusive-distrib/1.0/","  We give an explicit description of cubic rings over a discrete valuation
ring, as well as a description of all ideals of such rings.
","[{""version"":""v1"",""created"":""Fri, 1 Jan 2010 12:52:19 GMT""}]","2010-05-19"
"1001.0231","Pran Nath","Tarek Ibrahim and Pran Nath","Large Tau and Tau Neutrino Electric Dipole Moments in Models with Vector
  Like Multiplets","16 pages, 4 figures. Accepted for publication in Physical Review D","Phys.Rev.D81:033007,2010","10.1103/PhysRevD.81.033007",,"hep-ph","http://arxiv.org/licenses/nonexclusive-distrib/1.0/","  It is shown that the electric dipole moment of the tau lepton several orders
of magnitude larger than predicted by the standard model can be generated from
mixings in models with vector like mutiplets. The EDM of the tau lepton arises
from loops involving the exchange of the W, the charginos, the neutralinos, the
sleptons, the mirror leptons, and the mirror sleptons. The EDM of the Dirac tau
neutrino is also computed from loops involving the exhange of the W, the
charginos, the mirror leptons and mirror sleptons. A numerical analysis is
presented and it is shown that the EDMs of the tau lepton and of the tau
neutrino which lie just a couple of orders of magnitude below the sensitivity
of the current experiment can be achieved. Thus the predictions of the model
are testable in improved experiment on the EDM of the tau and of the tau
neutrino.
","[{""version"":""v1"",""created"":""Fri, 1 Jan 2010 13:16:56 GMT""}]","2010-04-28"
"1001.0233","Biswarup Das","Biswarup Das, Debashish Goswami and Kalyan B. Sinha","A homomorphism theorem and a Trotter product formula for quantum
  stochastic flows with unbounded coefficients",,"Comm. Math. Phys. 330 (2014) no. 2 435-467","10.1007/s00220-014-1993-1",,"math.OA math.PR","http://arxiv.org/licenses/nonexclusive-distrib/1.0/","  We give a new method for proving the homomorphic property of a quantum
stochastic ow satisfying a quantum stochastic differential equation with
unbounded coefficients, under some further hypotheses. As an application, we
prove a Trotter product formula for quantum stochastic ows and obtain quantum
stochastic dilations of a class of quantum dynamical semigroups generalizing
results of [5]
","[{""version"":""v1"",""created"":""Fri, 1 Jan 2010 13:31:33 GMT""},{""version"":""v2"",""created"":""Mon, 22 Apr 2013 11:37:40 GMT""}]","2016-11-25"
