"1001.0990","Tomasz Schreiber","Tomasz Schreiber, Christoph Thaele","Typical Geometry, Second-Order Properties and Central Limit Theory for
  Iteration Stable Tessellations","51 pages",,,,"math.PR","http://arxiv.org/licenses/nonexclusive-distrib/1.0/","  Since the seminal work of Mecke, Nagel and Weiss, the iteration stable (STIT)
tessellations have attracted considerable interest in stochastic geometry as a
natural and flexible yet analytically tractable model for hierarchical spatial
cell-splitting and crack-formation processes. The purpose of this paper is to
describe large scale asymptotic geometry of STIT tessellations in
$\mathbb{R}^d$ and more generally that of non-stationary iteration infinitely
divisible tessellations. We study several aspects of the typical first-order
geometry of such tessellations resorting to martingale techniques as providing
a direct link between the typical characteristics of STIT tessellations and
those of suitable mixtures of Poisson hyperplane tessellations. Further, we
also consider second-order properties of STIT and iteration infinitely
divisible tessellations, such as the variance of the total surface area of cell
boundaries inside a convex observation window. Our techniques, relying on
martingale theory and tools from integral geometry, allow us to give explicit
and asymptotic formulae. Based on these results, we establish a functional
central limit theorem for the length/surface increment processes induced by
STIT tessellations. We conclude a central limit theorem for total edge
length/facet surface, with normal limit distribution in the planar case and
non-normal ones in all higher dimensions.
","[{""version"":""v1"",""created"":""Wed, 6 Jan 2010 21:47:55 GMT""},{""version"":""v2"",""created"":""Thu, 7 Jan 2010 21:38:54 GMT""},{""version"":""v3"",""created"":""Mon, 29 Mar 2010 20:23:35 GMT""}]","2015-03-13"
"1001.0991","Alexey Kuznetsov","Alexey Kuznetsov","On extrema of stable processes","Published in at http://dx.doi.org/10.1214/10-AOP577 the Annals of
  Probability (http://www.imstat.org/aop/) by the Institute of Mathematical
  Statistics (http://www.imstat.org)","Annals of Probability 2011, Vol. 39, No. 3, 1027-1060","10.1214/10-AOP577","IMS-AOP-AOP577","math.PR","http://arxiv.org/licenses/nonexclusive-distrib/1.0/","  We study the Wiener--Hopf factorization and the distribution of extrema for
general stable processes. By connecting the Wiener--Hopf factors with a certain
elliptic-like function we are able to obtain many explicit and general results,
such as infinite series representations and asymptotic expansions for the
density of supremum, explicit expressions for the Wiener--Hopf factors and the
Mellin transform of the supremum, quasi-periodicity and functional identities
for these functions, finite product representations in some special cases and
identities in distribution satisfied by the supremum functional.
","[{""version"":""v1"",""created"":""Thu, 7 Jan 2010 07:29:00 GMT""},{""version"":""v2"",""created"":""Mon, 14 Jun 2010 15:11:11 GMT""},{""version"":""v3"",""created"":""Fri, 8 Apr 2011 09:54:40 GMT""}]","2011-04-11"
"1001.0992","Stefano Longhi","S. Longhi","Rectification of light refraction in curved waveguide arrays","3 pages, 3 figures","Opt. Lett. 34, 458 (2009)","10.1364/OL.34.000458",,"physics.optics","http://arxiv.org/licenses/nonexclusive-distrib/1.0/","  An 'optical ratchet' for discretized light in photonic lattices, which
enables to observe rectification of light refraction at any input beam
conditions, is theoretically presented, and a possible experimental
implementation based on periodically-curved zigzag waveguide arrays is
proposed.
","[{""version"":""v1"",""created"":""Wed, 6 Jan 2010 21:53:06 GMT""}]","2015-05-14"
"1001.0993","Anupam Mazumdar","Anupam Mazumdar, Jonathan Rocher","Particle physics models of inflation and curvaton scenarios","275+3 pages, Review for Phys. Rept. (References added), Comments
  welcome","Phys.Rept.497:85-215,2011","10.1016/j.physrep.2010.08.001",,"hep-ph astro-ph.CO gr-qc hep-th","http://arxiv.org/licenses/nonexclusive-distrib/1.0/","  We review the particle theory origin of inflation and curvaton mechanisms for
generating large scale structures and the observed temperature anisotropy in
the cosmic microwave background (CMB) radiation. Since inflaton or curvaton
energy density creates all matter, it is important to understand the process of
reheating and preheating into the relevant degrees of freedom required for the
success of Big Bang Nucleosynthesis. We discuss two distinct classes of models,
one where inflaton and curvaton belong to the hidden sector, which are coupled
to the Standard Model gauge sector very weakly. There is another class of
models of inflaton and curvaton, which are embedded within Minimal
Supersymmetric Standard Model (MSSM) gauge group and beyond, and whose origins
lie within gauge invariant combinations of supersymmetric quarks and leptons.
Their masses and couplings are all well motivated from low energy physics,
therefore such models provide us with a unique opportunity that they can be
verified/falsified by the CMB data and also by the future collider and
non-collider based experiments. We then briefly discuss stringy origin of
inflation, alternative cosmological scenarios, and bouncing universes.
","[{""version"":""v1"",""created"":""Wed, 6 Jan 2010 21:53:11 GMT""},{""version"":""v2"",""created"":""Mon, 18 Jan 2010 14:07:30 GMT""}]","2011-01-04"
"1001.0994","Joseph Rudnick","Roya Zandi, Joseph Rudnick, Aviva Shackell, Douglas Abraham","Boundary conditions and the critical Casimir force on an Ising model
  film: exact results in one and two dimensions","18 page, 10 figures",,,,"cond-mat.stat-mech","http://arxiv.org/licenses/nonexclusive-distrib/1.0/","  Finite size effect in critical systems can be interpreted as universal
Casimir forces. Here we compare the Casimir force for free, periodic and
antiperiodic boundary conditions in the exactly calculable case of the Ising
model in one and two dimensions. We employ a new procedure which allows us to
calculate the Casimir force with periodic and antiperiodic boundary conditions
analytically in a transparent manner. Quite interestingly, we find an
attractive Casimir force for the case of periodic boundary condition but a
repulsive Casimir force for the anti-periodic one.
","[{""version"":""v1"",""created"":""Wed, 6 Jan 2010 21:54:45 GMT""}]","2010-01-08"
"1001.0995","Francisco Lobo","Francisco S. N. Lobo, Miguel A. Oliveira","General class of vacuum Brans-Dicke wormholes","4 pages, 2 figures. V2: minor additions, matches published version","Phys.Rev.D81:067501,2010","10.1103/PhysRevD.81.067501",,"gr-qc astro-ph.HE hep-th","http://arxiv.org/licenses/nonexclusive-distrib/1.0/","  Recently, traversable wormhole geometries were constructed in the context of
f(R) gravity. The latter is equivalent to a Brans-Dicke theory with a coupling
parameter w=0, which is apparently excluded from the narrow interval,
-3/2<w<-4/3, extensively considered in the literature of static wormhole
solutions in vacuum Brans-Dicke theory. However, this latter interval is only
valid for a specific choice of an integration constant of the field equations
derived on the basis of a post-Newtonian weak field approximation, and there is
no reason for it to hold in the presence of compact objects with strong
gravitational fields. In this context, we construct a general class of vacuum
Brans-Dicke wormholes that include the value of w=0. Furthermore, we present
the general condition for the existence of vacuum Brans-Dicke wormhole
geometries, and show that the presence of effective negative energy densities
is a generic feature of these vacuum solutions.
","[{""version"":""v1"",""created"":""Wed, 6 Jan 2010 21:57:18 GMT""},{""version"":""v2"",""created"":""Mon, 22 Mar 2010 21:44:44 GMT""}]","2010-05-12"
"1001.0997","Stefano Longhi","S. Longhi","Discrete diffraction and shape-invariant beams in optical waveguide
  arrays","14 pages, 5 figures","Phys. Rev. A 79, 033847 (2009)","10.1103/PhysRevA.79.033847",,"physics.optics","http://arxiv.org/licenses/nonexclusive-distrib/1.0/","  General properties of linear propagation of discretized light in homogeneous
and curved waveguide arrays are comprehensively investigated and compared to
those of paraxial diffraction in continuous media. In particular, general laws
describing beam spreading, beam decay and discrete far-field patterns in
homogeneous arrays are derived using the method of moments and the steepest
descend method. In curved arrays, the method of moments is extended to describe
evolution of global beam parameters. A family of beams which propagate in
curved arrays maintaining their functional shape -referred to as discrete
Bessel beams- is also introduced. Propagation of discrete Bessel beams in
waveguide arrays is simply described by the evolution of a complex $q$
parameter similar to the complex $q$ parameter used for Gaussian beams in
continuous lensguide media. A few applications of the $q$ parameter formalism
are discussed, including beam collimation and polygonal optical Bloch
oscillations. \
","[{""version"":""v1"",""created"":""Wed, 6 Jan 2010 22:02:46 GMT""}]","2015-05-14"
"1001.0998","Genaro Toledo","D. Garcia Gudino and G. Toledo Sanchez","Finite width induced modification to the electromagnetic form factors of
  spin-1 particles","11 pages, 1 figure. Extended discussion, main equations rewritten to
  exhibit limiting behavior. Results for K* meson added. Accepted for
  publication in PRD","Phys.Rev.D81:073006,2010","10.1103/PhysRevD.81.073006",,"hep-ph","http://arxiv.org/licenses/nonexclusive-distrib/1.0/","  The inclusion of the unstable features of a spin-1 particle, without breaking
the electromagnetic gauge invariance, can be properly accomplished by including
higher order contributions as done in the so-called fermion loop scheme (for
the W gauge boson), and the boson loop scheme (for vector mesons). This induces
a non trivial modification to the electromagnetic vertex of the particle, which
must be considered in addition to any other contribution computed as stable
particles. Considering the modified electromagnetic vertex, we obtain general
expressions for the corresponding corrections to the multipoles as a function
of the mass of the particles in the loop. For the W gauge boson no substantial
deviations from the stable case is observed. For the rho and K* mesons the mass
of the particles in the loop makes a significant effect, and can be comparable
with corrections of different nature .
","[{""version"":""v1"",""created"":""Wed, 6 Jan 2010 22:05:53 GMT""},{""version"":""v2"",""created"":""Wed, 24 Mar 2010 17:34:31 GMT""}]","2010-04-22"
"1001.0999","Xuele Liu","Xincheng Xie, Xuele Liu","Spin Nernst effect in the absence of a magnetic field","5 pages, 5 figures",,"10.1016/j.ssc.2009.12.017",,"cond-mat.mes-hall cond-mat.dis-nn","http://arxiv.org/licenses/nonexclusive-distrib/1.0/","  We study the spin Nernst effect of a mesoscopic four-terminal cross-bar
device with the Rashba spin-orbit interaction (SOI) in the absence of a
magnetic field. The interplay between the spin Nernst effect and the seebeck
coefficient is investigated for a wide range of the Rashba SOI. When no peaks
appeared in the seebeck coefficient, an oscillatory spin Nernst effect still
occurs. In addition, the disorder effect on the spin Nernst effect is also
studied. We find that the spin Nernst effect can be enhanced up to threefold by
disorder. Besides, due to the interface effect, the counter propagating of the
charge current to the direction of the temperature gradient is possible for a
nonuniform system.
","[{""version"":""v1"",""created"":""Wed, 6 Jan 2010 22:09:14 GMT""}]","2010-01-08"
"1001.1000","Stefano Longhi","S. Longhi","Optical analogue of population trapping in the continuum: classical and
  quantum interference effects","12 pages, 2 figures","Phys. Rev. A 79, 023811 (2009)","10.1103/PhysRevA.79.023811",,"quant-ph","http://arxiv.org/licenses/nonexclusive-distrib/1.0/","  A quantum theory of light propagation in two optical channel waveguides
tunnelling-coupled to a common continuum of modes (such as those of a slab
waveguide) is presented, and classical and quantum interference effects are
investigated. For classical light, the photonic system realizes an optical
analogue of coherent population trapping in the continuum encountered in atomic
physics, where destructive interference between different light leakage
channels leads to the appearance of a trapped state embedded in the continuum.
For nonclassical light, two-photon interference effects are predicted, such as
the tendency of photon pairs to bunch when decaying into the continuum.
","[{""version"":""v1"",""created"":""Wed, 6 Jan 2010 22:11:45 GMT""}]","2015-05-14"
"1001.1001","Philip Judge Dr","Philip G. Judge","The chromosphere: gateway to the corona, or the purgatory of solar
  physics?","To appear in the proceedings of the 25th NSO Workshop ""Chromospheric
  Structure and Dynamics. From Old Wisdom to New Insights"", Memorie della
  Societa' Astronomica Italiana, Eds. Tritschler et al",,"10.1103/PhysRevE.82.016313",,"astro-ph.SR","http://arxiv.org/licenses/nonexclusive-distrib/1.0/","  I argue that one should attempt to understand the solar chromosphere not only
for its own sake, but also if one is interested in the physics of: the corona;
astrophysical dynamos; space weather; partially ionized plasmas; heliospheric
UV radiation; the transition region. I outline curious observations which I
personally find puzzling and deserving of attention.
","[{""version"":""v1"",""created"":""Wed, 6 Jan 2010 22:12:29 GMT""}]","2013-05-29"
"1001.1002","Ryan Martin","Kirsten Hogenson and Ryan R. Martin and Yi Zhao","Tiling tripartite graphs with 3-colorable graphs: The extreme case","29 pages, 5 figures. arXiv admin note: substantial text overlap with
  arXiv:0804.4154",,"10.1007/s00373-018-1929-1",,"math.CO","http://arxiv.org/licenses/nonexclusive-distrib/1.0/","  There is a sufficiently large $N\in h\mathbb{N}$ such that the following
holds. If $G$ is a tripartite graph with $N$ vertices in each vertex class such
that every vertex is adjacent to at least $2N/3+2h-1$ vertices in each of the
other classes, then $G$ can be tiled perfectly by copies of $K_{h,h,h}$. This
extends work by two of the authors [Electron. J. Combin, 16(1), 2009] and also
gives a sufficient condition for tiling by any fixed 3-colorable graph.
Furthermore, we show that $2N/3+2h-1$ in our result can not be replaced by
$2N/3+ h-2$ and that if $N$ is divisible by $6h$, then we can replace it with
the value $2N/3+h-1$ and this is tight.
","[{""version"":""v1"",""created"":""Wed, 6 Jan 2010 22:18:39 GMT""},{""version"":""v2"",""created"":""Wed, 18 May 2016 04:33:28 GMT""},{""version"":""v3"",""created"":""Sat, 21 May 2016 14:44:32 GMT""},{""version"":""v4"",""created"":""Fri, 10 Aug 2018 20:53:56 GMT""}]","2018-08-14"
"1001.1003","Julio  Ramirez Velez","J.C. Ramirez Velez, M. Semel, M. Stift, M.J. Martinez Gonzalez, P.
  Petit and N. Dunstone","Spectropolarimetric multi line analysis of stellar magnetic fields","Accepted for publication in Astronomy and Astrophysics",,"10.1051/0004-6361/200810484",,"astro-ph.SR","http://arxiv.org/licenses/nonexclusive-distrib/1.0/","  In this paper we study the feasibility of inferring the magnetic field from
polarized multi-line spectra using two methods: The pseudo line approach and
The PCA-ZDI approach. We use multi-line techniques, meaning that all the lines
of a stellar spectrum contribute to obtain a polarization signature. The use of
multiple lines dramatically increases the signal to noise ratio of these
polarizations signatures. Using one technique, the pseudo-line approach, we
construct the pseudo-line as the mean profile of all the individual lines. The
other technique, the PCA-ZDI approach proposed recently by Semel et al. (2006)
for the detection of polarized signals, combines Principle Components Analysis
(PCA) and the Zeeman Do ppler Imaging technique (ZDI). This new method has a
main advantage: the polarized signature is extracted using cross correlations
between the stellar spectra nd functions containing the polarization properties
of each line. These functions are the principal components of a database of
synthetic spectra. The synthesis of the spectra of the database are obtained
using the radiative transfer equations in LTE. The profiles built with the
PCA-ZDI technique are denominated Multi-Zeeman-Signatures. The construction of
the pseudo line as well as the Multi-Zeeman-Signatures is a powerful tool in
the study of stellar and solar magnetic fields. The information of the physical
parameters that governs the line formation is contained in the final polarized
profiles. In particular, using inversion codes, we have shown that the magnetic
field vector can be properly inferred with both approaches despite the magnetic
field regime.
","[{""version"":""v1"",""created"":""Wed, 6 Jan 2010 22:25:40 GMT""}]","2015-05-14"
"1001.1004","Timur Tscherbul","T. V. Tscherbul, T. Calarco, I. Lesanovsky, R. V. Krems, A. Dalgarno,
  J. Schmiedmayer","RF-field-induced Feshbach resonances","10 pages, 4 figures; minor typos corrected, journal reference added","Phys. Rev. A 81, 050701(R) (2010)","10.1103/PhysRevA.81.050701",,"physics.atom-ph","http://arxiv.org/licenses/nonexclusive-distrib/1.0/","  A rigorous quantum theory of atomic collisions in the presence of radio
frequency (rf) magnetic fields is developed and applied to elucidate the
effects of combined dc and rf magnetic fields on elastic scattering in
ultracold collisions of Rb atoms. We show that rf fields can be used to induce
Feshbach resonances, which can be tuned by varying the amplitude and frequency
of the rf field. The rf-induced Feshbach resonances occur also in collisions of
atoms in low-field-seeking states at moderate rf field strengths easily
available in atom chip experiments, which opens up the world of tunable
interactions to magnetically trappable atomic quantum gases.
","[{""version"":""v1"",""created"":""Wed, 6 Jan 2010 22:43:41 GMT""},{""version"":""v2"",""created"":""Tue, 11 May 2010 19:13:40 GMT""}]","2010-05-12"
"1001.1005","Hugh Hudson","Hugh Hudson, Lyndsay Fletcher, Sa""m Krucker","The white-light continuum in the impulsive phase of a solar flare","6 pages, 2 figures To appear in Proceedings of 25th NSO Workshop:
  Chromospheric Structure and Dynamics",,,,"astro-ph.SR","http://arxiv.org/licenses/nonexclusive-distrib/1.0/","  We discuss the IR/visible/VUV continuum emission of the impulsive phase of a
solar flare, using TRACE UV and EUV images to characterize the spectral energy
distribution. This continuum has been poorly observed but dominates the radiant
energy energetically. Recent bolometric observations of solar flares
furthermore point to the impulsive phase as the source of a major fraction of
the radiant energy. This component appears to exhibit a Balmer jump and thus
must originate in an optically thin region above the quiet photosphere, with an
elevated temperature and strong ionization.
","[{""version"":""v1"",""created"":""Wed, 6 Jan 2010 22:56:17 GMT""}]","2010-01-08"
"1001.1006","Ramis Movassagh","Ramis Movassagh, Edward Farhi, Jeffrey Goldstone, Daniel Nagaj, Tobias
  J. Osborne, Peter W. Shor","Unfrustrated Qudit Chains and their Ground States","5 pages, 5 figures. Typos corrected","Phys. Rev. A 82, 012318 (2010)","10.1103/PhysRevA.82.012318",,"quant-ph cond-mat.stat-mech math-ph math.MP","http://arxiv.org/licenses/nonexclusive-distrib/1.0/","  We investigate chains of 'd' dimensional quantum spins (qudits) on a line
with generic nearest neighbor interactions without translational invariance. We
find the conditions under which these systems are not frustrated, i.e. when the
ground states are also the common ground states of all the local terms in the
Hamiltonians. The states of a quantum spin chain are naturally represented in
the Matrix Product States (MPS) framework. Using imaginary time evolution in
the MPS ansatz, we numerically investigate the range of parameters in which we
expect the ground states to be highly entangled and find them hard to
approximate using our MPS method.
","[{""version"":""v1"",""created"":""Wed, 6 Jan 2010 22:49:51 GMT""},{""version"":""v2"",""created"":""Wed, 21 Jul 2010 02:40:57 GMT""},{""version"":""v3"",""created"":""Wed, 29 Jun 2011 00:20:25 GMT""}]","2013-05-29"
"1001.1007","David Sivakoff","David Sivakoff","Emergence of a Giant Component in Random Site Subgraphs of a
  d-Dimensional Hamming Torus","37 pages, 1 figure",,,,"math.PR","http://arxiv.org/licenses/nonexclusive-distrib/1.0/","  The d-dimensional Hamming torus is the graph whose vertices are all of the
integer points inside an a_1 n X a_2 n X ... X a_d n box in R^d (for constants
a_1, ..., a_d > 0), and whose edges connect all vertices within Hamming
distance one. We study the size of the largest connected component of the
subgraph generated by independently removing each vertex of the Hamming torus
with probability 1-p. We show that if p=\lambda / n, then there exists
\lambda_c > 0, which is the positive root of a degree d polynomial whose
coefficients depend on a_1, ..., a_d, such that for \lambda < \lambda_c the
largest component has O(log n) vertices (a.a.s. as n \to \infty), and for
\lambda > \lambda_c the largest component has (1-q) \lambda (\prod_i a_i)
n^{d-1} + o(n^{d-1}) vertices and the second largest component has O(log n)
vertices (a.a.s.). An implicit formula for q < 1 is also given. Surprisingly,
the value of \lambda_c that we find is distinct from the critical value for the
emergence of a giant component in the random edge subgraph of the Hamming
torus. Additionally, we show that if p = c log n / n, then when c < (d-1) /
(\sum a_i) the site subgraph of the Hamming torus is not connected, and when c
> (d-1) / (\sum a_i) the subgraph is connected (a.a.s.). We also show that the
subgraph is connected precisely when it contains no isolated vertices.
","[{""version"":""v1"",""created"":""Wed, 6 Jan 2010 23:11:57 GMT""},{""version"":""v2"",""created"":""Wed, 7 Apr 2010 23:39:15 GMT""}]","2010-04-09"
"1001.1009","Frederic Thouin","Frederic Thouin (1), Mark Coates (1), Michael Rabbat (1) ((1) McGill
  University, Montreal, Canada)","Multi-path Probabilistic Available Bandwidth Estimation through Bayesian
  Active Learning",,,,,"cs.NI cs.LG","http://arxiv.org/licenses/nonexclusive-distrib/1.0/","  Knowing the largest rate at which data can be sent on an end-to-end path such
that the egress rate is equal to the ingress rate with high probability can be
very practical when choosing transmission rates in video streaming or selecting
peers in peer-to-peer applications. We introduce probabilistic available
bandwidth, which is defined in terms of ingress rates and egress rates of
traffic on a path, rather than in terms of capacity and utilization of the
constituent links of the path like the standard available bandwidth metric. In
this paper, we describe a distributed algorithm, based on a probabilistic
graphical model and Bayesian active learning, for simultaneously estimating the
probabilistic available bandwidth of multiple paths through a network. Our
procedure exploits the fact that each packet train provides information not
only about the path it traverses, but also about any path that shares a link
with the monitored path. Simulations and PlanetLab experiments indicate that
this process can dramatically reduce the number of probes required to generate
accurate estimates.
","[{""version"":""v1"",""created"":""Wed, 6 Jan 2010 23:33:49 GMT""}]","2010-01-08"
"1001.1010","Hendrik B. Grundling","Hendrik Grundling, Karl-Hermann Neeb","Localization via Automorphisms of the CARs. Local gauge invariance","15 pages","Lett.Math.Phys.93:169-185,2010","10.1007/s11005-010-0403-7",,"math-ph hep-th math.MP","http://arxiv.org/licenses/nonexclusive-distrib/1.0/","  The classical matter fields are sections of a vector bundle E with base
manifold M. The space L^2(E) of square integrable matter fields w.r.t. a
locally Lebesgue measure on M, has an important module action of C_b^\infty(M)
on it. This module action defines restriction maps and encodes the local
structure of the classical fields. For the quantum context, we show that this
module action defines an automorphism group on the algebra A, of the canonical
anticommutation relations on L^2(E), with which we can perform the analogous
localization. That is, the net structure of the CAR, A, w.r.t. appropriate
subsets of M can be obtained simply from the invariance algebras of appropriate
subgroups. We also identify the quantum analogues of restriction maps. As a
corollary, we prove a well-known ""folk theorem,"" that the algebra A contains
only trivial gauge invariant observables w.r.t. a local gauge group acting on
E.
","[{""version"":""v1"",""created"":""Thu, 7 Jan 2010 00:05:50 GMT""}]","2014-11-20"
