"1001.1052","James Lutsko","James F. Lutsko, Vasileios Basios, Gregoire Nicolis, John J. Kozak,
  Mike Sleutel and Dominique Maes","Kinetic roughening-like transition with finite nucleation barrier","15 pages, 5 figures, to appear in J. Chem. Phys","J. Chem. Phys. 132, 035102 (2010)","10.1063/1.3294561",,"cond-mat.soft","http://arxiv.org/licenses/nonexclusive-distrib/1.0/","  Recent observations of the growth of protein crystals have identified two
different growth regimes. At low supersaturation, the surface of the crystal is
smooth and increasing in size due to the nucleation of steps at defects and the
subsequent growth of the steps. At high supersaturation, nucleation occurs at
many places simultaneously, the crystal surface becomes rough and the growth
velocity increases more rapidly with increasing supersaturation than in the
smooth regime. Kinetic roughening transitions are typically assumed to be due
to the vanishing of the barrier for two-dimension nucleation on the surface of
the crystal. We show here, by means of both analytic mean field models and
kinetic Monte Carlo simulations that a transition between different growth
modes reminiscent of kinetic roughening can also arise as a kinetic effect
occurring at finite nucleation barriers.
","[{""version"":""v1"",""created"":""Thu, 7 Jan 2010 11:17:08 GMT""}]","2015-05-14"
"1001.1053","Ren-Bao Liu","Jing Wang, Bang-Fen Zhu, Ren-Bao Liu","Second-order nonlinear optical effects of spin currents","10 pages, 3 figures","Phys. Rev. Lett. 104, 256601 (2010)","10.1103/PhysRevLett.104.256601",,"cond-mat.other","http://arxiv.org/licenses/nonexclusive-distrib/1.0/","  A pure spin current formed by opposite spins moving in opposite directions is
a rank-2 axial tensor which breaks the inversion symmetry. Thus a spin current
has a second-order optical susceptibility, with unique polarization-dependence
determined by the symmetry properties of the current. In particular, a
longitudinal spin current, in which the spin polarization directions are
parallel or anti-parallel to the moving directions, being a chiral quantity,
leads to a chiral sum-frequency effect. Microscopic calculations based on the
eight-band model of a III-V compound semiconductor confirm the symmetry
analysis and show that the susceptibility is quite measurable under realistic
conditions. The second-order nonlinear optical effects may be used for in-situ
and non-destructive detection of spin currents, as a standard spectroscopy tool
in research of spintronics.
","[{""version"":""v1"",""created"":""Thu, 7 Jan 2010 11:26:16 GMT""},{""version"":""v2"",""created"":""Tue, 26 Jan 2010 05:34:08 GMT""}]","2010-06-30"
"1001.1054","Lusaka Bhattacharya","Lusaka Bhattacharya and Pradip Roy","Jet-photons from an anisotropic {\em Quark-Gluon-Plasma}","15 pages, 11 eps figures, Accepted for publication in Journal of
  Physics G","J.Phys.G37:105010,2010","10.1088/0954-3899/37/10/105010",,"hep-ph nucl-th","http://arxiv.org/licenses/nonexclusive-distrib/1.0/","  We calculate the $p_T$ distributions of jet conversion photons from {\em
Quark Gluon Plasma} with pre-equilibrium momentum-space anisotropy. A
phenomenological model has been used for the time evolution of hard momentum
scale $p_{\rm hard}(\tau)$ and anisotropy parameter $\xi(\tau)$. As a result of
pre-equilibrium momentum-space anisotropy, we find significant modification of
the jet conversion photon $p_T$ distribution. For example, with {\em fixed
initial condition} (FIC) pre-equilibrium anisotropy, we predict significant
enhancement of the jet-photon $p_T$ distribution in the entire region, whereas
for pre-equilibrium anisotropy with {\em fixed final multiplicity} (FFM),
suppression of the jet conversion photons $p_T$ distribution is observed. The
results with FFM (as it is the most realistic situation) have been compared
with high $p_T$ PHENIX photon data. It is found that the data is reproduced
well if the isotropization time lies within $1.5$ fm/c.
","[{""version"":""v1"",""created"":""Thu, 7 Jan 2010 11:26:21 GMT""},{""version"":""v2"",""created"":""Mon, 12 Jul 2010 09:30:45 GMT""}]","2011-03-28"
"1001.1055","Jahan Zahid","Jahan Zahid","Simultaneous zeros of a Cubic and Quadratic form","19 pages",,"10.1112/jlms/jdr018",,"math.NT math.AG","http://arxiv.org/licenses/nonexclusive-distrib/1.0/","  We verify a conjecture of Emil Artin, for the case of a Cubic and Quadratic
form over any $p$-adic field, provided the cardinality of the residue class
field exceeds 293. That is any Cubic and Quadratic form with at least 14
variables has a non-trivial $p$-adic zero, with the aforementioned condition on
the residue class field.
  A crucial step in the proof, involves generalizing a $p$-adic minimization
procedure due to W. M. Schmidt to hold for systems of forms of arbitrary
degrees.
","[{""version"":""v1"",""created"":""Thu, 7 Jan 2010 14:53:41 GMT""}]","2014-02-26"
"1001.1056","Florian Hengstberger","F. Hengstberger, M. Eisterer, H. W. Weber","Thickness dependence of the critical current density in superconducting
  films: a geometrical approach","7 pages, 3 figures","Appl. Phys. Lett. 96, 022508 (2010)","10.1063/1.3290254",,"cond-mat.supr-con","http://arxiv.org/licenses/nonexclusive-distrib/1.0/","  We analyze the influence of the magnetic field generated by the supercurrents
(self-field) on the current density distribution by numerical simulations. The
thickness of the superconducting film determines the self-field and
consequently the critical current density at zero applied field. We find an
equation, which derives the thickness dependence of the critical current
density from its dependence on the magnetic induction. Solutions of the
equation reproduce numerical simulations to great accuracy, thus enabling a
quantification of the dependence of the self-field critical current density
with increasing film thickness. This result is technologically relevant for the
development of coated conductors with thicker superconducting layers.
","[{""version"":""v1"",""created"":""Thu, 7 Jan 2010 12:18:26 GMT""}]","2010-01-21"
"1001.1057","Gr\'egory Potel","R. A. Broglia, G. Potel, F. Barranco, E. Vigezzi","Difference between stable and exotic nuclei: medium polarization effects",,"J.Phys.G37:064022,2010","10.1088/0954-3899/37/6/064022",,"nucl-th","http://arxiv.org/licenses/nonexclusive-distrib/1.0/","  The bare NN-potential, parametrized so as to reproduce the nuclear phase
shifts leads to a sizable Cooper pair binding energy in nuclei along the
stability valley. It is a much debated matter whether this value accounts for
the ""empirical"" value of the pairing gap or whether a similarly important
contribution arises from the exchange of collective vibrations between Cooper
pair partners. In keeping with the fact that two-particle transfer reactions
are the specific probe of pairing in nuclei, and that exotic halo nuclei like
11Li are extremely polarizable, we find that the recent studied reaction,
namely 11Li+p -> 9Li+t, provides direct evidence of phonon mediated pairing in
nuclei.
","[{""version"":""v1"",""created"":""Thu, 7 Jan 2010 12:30:53 GMT""}]","2012-02-14"
"1001.1058","Valentina Vacca","V. Vacca, M.Murgia, F. Govoni, L. Feretti, G. Giovannini, E. Orr\'u,
  A. Bonafede","The intracluster magnetic field power spectrum in Abell 665","12 pages, 6 figures, accepted for publication on A&A, language
  editing. For a high quality version see
  http://erg.ca.astro.it/preprints/a665_halo/",,,,"astro-ph.CO","http://arxiv.org/licenses/nonexclusive-distrib/1.0/","  The goal of this work is to investigate the power spectrum of the magnetic
field associated with the giant radio halo in the galaxy cluster A665. For
this, we present new deep Very Large Array total intensity and polarization
observations at 1.4 GHz. We simulated Gaussian random three-dimensional
turbulent magnetic field models to reproduce the observed radio halo emission.
By comparing observed and synthetic radio halo images we constrained the
strength and structure of the intracluster magnetic field. We assumed that the
magnetic field power spectrum is a power law with a Kolmogorov index and we
imposed a local equipartition of energy density between relativistic particles
and field. Under these assumptions, we find that the radio halo emission in
A665 is consistent with a central magnetic field strength of about 1.3 micro-G.
To explain the azimuthally averaged radio brightness profile, the magnetic
field energy density should decrease following the thermal gas density, leading
to an averaged magnetic field strength over the central 1 Mpc^3 of about 0.75
micro-G. From the observed brightness fluctuations of the radio halo, we infer
that the outer scale of the magnetic field power spectrum is ~450 kpc, and the
corresponding magnetic field auto-correlation length is ~100 kpc.
","[{""version"":""v1"",""created"":""Thu, 7 Jan 2010 12:24:42 GMT""},{""version"":""v2"",""created"":""Mon, 8 Feb 2010 10:08:30 GMT""}]","2010-02-08"
"1001.1059","Viktor Dotsenko","Victor Dotsenko and Boris Klumov","Attempted Bethe ansatz solution for one-dimensional directed polymers in
  random media","32 pages, 1 figure","J. Stat. Mech. (2010) P03022","10.1088/1742-5468/2010/03/P03022",,"cond-mat.stat-mech cond-mat.dis-nn","http://arxiv.org/licenses/nonexclusive-distrib/1.0/","  We study the statistical properties of one-dimensional directed polymers in a
short-range random potential by mapping the replicated problem to a many body
quantum boson system with attractive interactions. We find the full set of
eigenvalues and eigenfunctions of the many-body system and perform the
summation over the entire spectrum of excited states. The analytic continuation
of the obtained exact expression for the replica partition function from
integer to non-integer replica parameter N turns out to be ambiguous.
Performing the analytic continuation simply by assuming that the parameter N
can take arbitrary complex values, and going to the thermodynamic limit of the
original directed polymer problem, we obtain the explicit universal expression
for the probability distribution function of free energy fluctuations.
","[{""version"":""v1"",""created"":""Thu, 7 Jan 2010 12:37:07 GMT""}]","2015-05-14"
"1001.1060","Frederic Helein","Fr\'ed\'eric H\'elein (IMJ), Laurent Hauswirth (LAMA), Frank Pacard
  (LAMA)","A note on some overdetermined elliptic problem",,,,,"math-ph math.AP math.DG math.MP","http://arxiv.org/licenses/nonexclusive-distrib/1.0/","  We define the notion of an exceptional manifold to be a flat Riemannian
manifold with boundary which supports a positive harmonic function satisfying
simultaneously a zero Dirichlet condition and a constant (nonzero) Neumann
condtion at the boundary. We study the two-dimensional case: we present various
examples and give a general construction algorithm of such surface by using
complex analysis. We deduce a classification of all such surfaces assuming some
further natural hypotheses and prove a Bernstein type theorem.
","[{""version"":""v1"",""created"":""Thu, 7 Jan 2010 12:39:10 GMT""}]","2010-01-11"
"1001.1061","Xavier Artru","X. Artru (IPNL)","Recursive fragmentation model with quark spin. Application to quark
  polarimetry","XIII Workshop on High Energy Spin Physics, DSPIN 2009, Dubna, Russia,
  September 1-5, 2009",,,,"hep-ph","http://arxiv.org/licenses/nonexclusive-distrib/1.0/","  An elementary recursive model accounting for the quark spin in the
fragmentation of a quark into mesons is presented. The quark spin degree of
freedom is represented by a two-components spinor. Spin one meson can be
included. The model produces Collins effect and jet handedness. The influence
of the initial quark polarisation decays exponentially with the rank of the
meson, at dierent rates for longitudinal and transverse polarisations
","[{""version"":""v1"",""created"":""Thu, 7 Jan 2010 12:41:29 GMT""}]","2010-01-08"
"1001.1062","Johannes G\""utschow","Johannes G\""utschow","Entanglement Generation of Clifford Quantum Cellular Automata","to appear in the ""DPG spring meeting 2009"" special issue of Applied
  Physics B",,"10.1007/s00340-009-3840-1",,"quant-ph","http://arxiv.org/licenses/nonexclusive-distrib/1.0/","  Clifford quantum cellular automata (CQCAs) are a special kind of quantum
cellular automata (QCAs) that incorporate Clifford group operations for the
time evolution. Despite being classically simulable, they can be used as basic
building blocks for universal quantum computation. This is due to the
connection to translation-invariant stabilizer states and their entanglement
properties. We will give a self-contained introduction to CQCAs and investigate
the generation of entanglement under CQCA action. Furthermore, we will discuss
finite configurations and applications of CQCAs.
","[{""version"":""v1"",""created"":""Thu, 7 Jan 2010 13:17:56 GMT""}]","2010-01-08"
"1001.1063","Katherine Blundell","Mary Erlund, Andy Fabian, Katherine Blundell, Carolin Crawford, Paul
  Hirst","Two types of shock in the hotspot of the giant quasar 4C74.26: a
  high-resolution comparison from Chandra, Gemini & MERLIN","In press at MNRAS",,"10.1111/j.1365-2966.2010.16304.x",,"astro-ph.CO astro-ph.HE","http://arxiv.org/licenses/nonexclusive-distrib/1.0/","  New Chandra observations have resolved the structure of the X-ray luminous
southern hotspot in the giant radio quasar 4C74.26 into two distinct features.
The nearer one to the nucleus is an extremely luminous peak, extended some 5
kpc perpendicular to the orientation of the jet; 19 kpc projected further away
from the central nucleus than this is a fainter X-ray arc having similar
symmetry. This arc is co-spatial with near-IR and optical emission imaged with
Gemini, and radio emission imaged with MERLIN. The angular separation of the
double shock structure (itself ~19 kpc or 10 arcsec in size) from the active
nucleus which fuels them of ~550 kpc is a reminder of the challenge of
connecting ""unidentified"" hard X-ray or Fermi sources with their origins.
","[{""version"":""v1"",""created"":""Thu, 7 Jan 2010 13:19:12 GMT""}]","2015-05-14"
"1001.1064","Marko Woelki","Marko Woelki and Kirone Mallick","Transfer matrices for the totally asymmetric exclusion process","7 pages",,"10.1088/1751-8113/43/18/185003",,"cond-mat.stat-mech","http://arxiv.org/licenses/nonexclusive-distrib/1.0/","  We consider the totally asymmetric simple exclusion process (TASEP) on a
finite lattice with open boundaries. We show, using the recursive structure of
the Markov matrix that encodes the dynamics, that there exist two transfer
matrices $T_{L-1,L}$ and $\tilde{T}_{L-1,L}$ that intertwine the Markov
matrices of consecutive system sizes:
$\tilde{T}_{L-1,L}M_{L-1}=M_{L}T_{L-1,L}$. This semi-conjugation property of
the dynamics provides an algebraic counterpart for the matrix-product
representation of the steady state of the process.
","[{""version"":""v1"",""created"":""Thu, 7 Jan 2010 12:53:57 GMT""}]","2015-05-14"
"1001.1065","Sebastian Bernhardsson","Seung Ki Baek and Sebastian Bernhardsson","Equilibrium solution to the lowest unique positive integer game","8 pages, 3 figures","Fluctuation and Noise Letters, 9:1, pp. 61-68 (2010)","10.1142/S0219477510000071",,"math.CO cs.GT math.PR","http://arxiv.org/licenses/nonexclusive-distrib/1.0/","  We address the equilibrium concept of a reverse auction game so that no one
can enhance the individual payoff by a unilateral change when all the others
follow a certain strategy. In this approach the combinatorial possibilities to
consider become very much involved even for a small number of players, which
has hindered a precise analysis in previous works. We here present a systematic
way to reach the solution for a general number of players, and show that this
game is an example of conflict between the group and the individual interests.
","[{""version"":""v1"",""created"":""Thu, 7 Jan 2010 12:55:40 GMT""}]","2010-10-26"
"1001.1066","E.G. van Putten","E.G. van Putten, A. Lagendijk, and A.P. Mosk","Optimal Concentration of Light in Turbid Materials","We corrected an ambiguous description of the focus size in our
  abstract and text pointed out by an anonymous referee",,"10.1364/JOSAB.28.001200",,"physics.optics","http://arxiv.org/licenses/nonexclusive-distrib/1.0/","  In turbid materials it is impossible to concentrate light into a focus with
conventional optics. Recently it has been shown that the intensity on a dyed
probe inside a turbid material can be enhanced by spatially shaping the wave
front of light before it enters a turbid medium. Here we show that this
enhancement is due to concentration of light energy to a spot much smaller than
a wavelength. We focus light on a dyed probe sphere that is hidden under an
opaque layer. The light is optimally concentrated to a focus which does not
exceed the smallest focal area physically possible by more than 68%. A
comparison between the intensity enhancements of both the emission and
excitation light supports the conclusion of optimal light concentration.
","[{""version"":""v1"",""created"":""Thu, 7 Jan 2010 12:57:36 GMT""},{""version"":""v2"",""created"":""Thu, 4 Mar 2010 13:47:31 GMT""}]","2015-05-14"
"1001.1067","Kausik Pal","Kausik Pal, Abhee K. Dutt-Mazumder","Symmetric and anti-symmetric Landau parameters and magnetic properties
  of dense quark matter","14 pages, 5 figures, abstract and introduction modifified. Published
  in Phys. Rev. C. 81, 054906 (2010)","Phys.Rev.C81:054906,2010","10.1103/PhysRevC.81.054906",,"hep-ph astro-ph.HE nucl-th","http://arxiv.org/licenses/nonexclusive-distrib/1.0/","  We calculate the dimensionless Fermi liquid parameters (FLPs),
$F_{0,1}^{sym}$ and $F_{0,1}^{asym}$, for spin asymmetric dense quark matter.
In general, the FLPs are infrared divergent due to the exchange of massless
gluons. To remove such divergences, the Hard Density Loop (HDL) corrected gluon
propagator is used. The FLPs so determined are then invoked to calculate
magnetic properties such as magnetization $\langle M\rangle$ and magnetic
susceptibility $\chi_M$ of spin polarized quark matter. Finally, we investigate
the possibility of magnetic instability by studying the density dependence of
$\langle M\rangle$ and $\chi_M$.
","[{""version"":""v1"",""created"":""Thu, 7 Jan 2010 13:05:40 GMT""},{""version"":""v2"",""created"":""Wed, 26 May 2010 10:56:15 GMT""}]","2014-11-20"
"1001.1068","Matteo Luca Ruggiero","Angelo Tartaglia, Matteo Luca Ruggiero, Emiliano Capolongo","A null frame for spacetime positioning by means of pulsating sources","19 pages, revised to match the version accepted for publication in
  Advances in Space Research","Adv.Space Res.47:645-653,2011","10.1016/j.asr.2010.10.023",,"gr-qc astro-ph.IM physics.space-ph","http://arxiv.org/licenses/nonexclusive-distrib/1.0/","  We introduce an operational approach to the use of pulsating sources, located
at spatial infinity, for defining a relativistic positioning and navigation
system, based on the use of four-dimensional bases of null four-vectors, in
flat spacetime. As a prototypical case, we show how pulsars can be used to
define such a positioning system. The reception of the pulses for a set of
different sources whose positions in the sky and periods are assumed to be
known allows the determination of the user's coordinates and spacetime
trajectory, in the reference frame where the sources are at rest. We describe
our approach in flat Minkowski spacetime, and discuss the validity of this and
other approximations we have considered.
","[{""version"":""v1"",""created"":""Thu, 7 Jan 2010 13:25:36 GMT""},{""version"":""v2"",""created"":""Fri, 11 Jun 2010 11:16:12 GMT""},{""version"":""v3"",""created"":""Sat, 30 Oct 2010 11:17:53 GMT""}]","2011-03-04"
"1001.1069","Marcella Massardi","Marcella Massardi, Anna Bonaldi, Mattia Negrello, Sara Ricciardi,
  Alvise Raccanelli, Gianfranco De Zotti","A model for the cosmological evolution of low frequency radio sources","14 pages, 11 figures, accepted for publication on MNRAS",,"10.1111/j.1365-2966.2010.16305.x",,"astro-ph.CO","http://arxiv.org/licenses/nonexclusive-distrib/1.0/","  We present a new evolutionary model that describes the population properties
of radio sources at frequencies <5 GHz, thus complementing the De Zotti et al.
(2005) model, holding at higher frequencies. We find that simple analytic
luminosity evolution is still sufficient to fit the wealth of available data on
local luminosity functions, multi-frequency source counts, and redshift
distributions. However, the fit requires a luminosity-dependent decline of
source luminosities at high redshifts, at least for steep-spectrum sources,
thus confirming earlier indications of a ""downsizing"" also for radio sources.
The upturn of source counts at sub-mJy levels is accounted for by a
straightforward extrapolation, using the empirical far-IR/radio correlation, of
evolutionary models matching the far-IR counts and redshift distributions of
star-forming galaxies. We also discuss the implications of the new model for
the interpretation of data on large-scale clustering of radio sources and on
the Integrated Sachs-Wolfe (ISW) effect, and for the investigation of the
contribution of discrete sources to the extragalactic background. As for the
ISW effect, a new analysis exploiting a very clean CMB map, yields at a
substantially higher significance than reported before.
","[{""version"":""v1"",""created"":""Thu, 7 Jan 2010 13:38:24 GMT""}]","2015-05-14"
"1001.1070","Benny Malengier","J. Kacur, B. Malengier, P. Kison","Numerical modelling of unsaturated-saturated flow under centrifugation
  with no outflow",,,,,"physics.comp-ph","http://arxiv.org/licenses/nonexclusive-distrib/1.0/","  A novel centrifuge set-up for the study of unsaturated flow characteristics
in porous media is examined. In this set-up, simple boundary conditions can be
used, but a free moving boundary between unsaturated-saturated flow arises. A
precise and numerically efficient approximation is presented for the
mathematical model based on Richards' nonlinear and degenerate equation
expressed in terms of effective saturation using the Van Genuchten-Mualem
ansatz for the soil parameters in the unsaturated zone. Sensitivity of the
measurable quantities (rotational moment, center of gravity and time period to
achieve quasi steady state) on the soil parameters is investigated in several
numerical experiments. They show that the set-up is suitable for the
determination of the soil parameters via the solution of an inverse problem in
an iterative way, excluding the saturated hydraulic conductivity. For this
parameter, an existing simple centrifuge set-up is repeated and augmented with
transient measurements.
","[{""version"":""v1"",""created"":""Thu, 7 Jan 2010 13:38:21 GMT""}]","2010-01-08"
"1001.1071","Roumen Tsekov","Roumen Tsekov","Quantum diffusion",,"Phys. Scr. 83 (2011) 035004","10.1088/0031-8949/83/03/035004",,"quant-ph cond-mat.other","http://arxiv.org/licenses/nonexclusive-distrib/1.0/","  Quantum diffusion is studied via dissipative Madelung hydrodynamics.
Initially the wave packet spreads ballistically, than passes for an instant
through normal diffusion and later tends asymptotically to a sub-diffusive law.
It is shown that the apparent quantum diffusion coefficient is not a universal
physical parameter since it depends on the initial wave packet preparation. The
overdamped quantum diffusion of an electron in the field of a periodic
potential is also investigated; in this case the wave packet spreads
logarithmically in time. Thermo-quantum diffusion of heavier particles as
hydrogen, deuterium and tritium atoms in periodic potentials is studied and a
simple estimate of the tunneling effect is obtained in the frames of a
quasi-equilibrium semiclassical approach. The effective thermo-quantum
temperature is also discussed in relation to the known temperature dependence
of muon diffusivity in solids.
","[{""version"":""v1"",""created"":""Thu, 7 Jan 2010 13:39:52 GMT""},{""version"":""v2"",""created"":""Tue, 18 Jan 2011 14:55:53 GMT""},{""version"":""v3"",""created"":""Wed, 20 Apr 2011 05:30:25 GMT""}]","2011-04-21"
