"1001.2557","Rouven Essig","Rouven Essig, Philip Schuster, Natalia Toro, Bogdan Wojtsekhowski","An Electron Fixed Target Experiment to Search for a New Vector Boson A'
  Decaying to e+e-","19 pages, 12 figures, 2 tables","JHEP02(2011)009","10.1007/JHEP02(2011)009","SLAC-PUB-13882, SU-ITP-10/01","hep-ph","http://arxiv.org/licenses/nonexclusive-distrib/1.0/","  We describe an experiment to search for a new vector boson A' with weak
coupling alpha' > 6 x 10^{-8} alpha to electrons (alpha=e^2/4pi) in the mass
range 65 MeV < m_A' < 550 MeV. New vector bosons with such small couplings
arise naturally from a small kinetic mixing of the ""dark photon"" A' with the
photon -- one of the very few ways in which new forces can couple to the
Standard Model -- and have received considerable attention as an explanation of
various dark matter related anomalies. A' bosons are produced by radiation off
an electron beam, and could appear as narrow resonances with small production
cross-section in the trident e+e- spectrum. We summarize the experimental
approach described in a proposal submitted to Jefferson Laboratory's PAC35,
PR-10-009. This experiment, the A' Experiment (APEX), uses the electron beam of
the Continuous Electron Beam Accelerator Facility at Jefferson Laboratory
(CEBAF) at energies of ~1-4 GeV incident on 0.5-10% radiation length Tungsten
wire mesh targets, and measures the resulting e+e- pairs to search for the A'
using the High Resolution Spectrometer and the septum magnet in Hall A. With a
~1 month run, APEX will achieve very good sensitivity because the statistics of
e+e- pairs will be ~10,000 times larger in the explored mass range than any
previous search for the A' boson. These statistics and the excellent mass
resolution of the spectrometers allow sensitivity to alpha'/alpha one to three
orders of magnitude below current limits, in a region of parameter space of
great theoretical and phenomenological interest. Similar experiments could also
be performed at other facilities, such as the Mainz Microtron.
","[{""version"":""v1"",""created"":""Fri, 15 Jan 2010 17:45:21 GMT""}]","2015-05-18"
"1001.2563","Kathryn Zurek","Kathryn M. Zurek","TASI 2009 Lectures: Searching for Unexpected Physics at the LHC","35 pages, 21 figures",,,,"hep-ph","http://arxiv.org/licenses/nonexclusive-distrib/1.0/","  These TASI lectures consider low mass hidden sectors from Hidden Valleys,
Quirks and Unparticles. We show how each corresponds to a different limit of
the same class of models: hidden sectors with non-abelian gauge groups with
mass gaps well below a TeV that communicate to the Standard Model through weak
scale suppressed higher dimension operators. We provide concrete examples of
such models and discuss LHC signatures. Lastly we turn to discussing the
application of Hidden Valleys to dark matter sectors.
","[{""version"":""v1"",""created"":""Fri, 15 Jan 2010 16:46:12 GMT""}]","2016-09-08"
"1001.2585","Mikhail A. Vasiliev","O.A. Gelfond and M.A. Vasiliev","Unfolding versus BRST and currents in Sp(2M) invariant higher-spin
  theory","25 pages, no figures; V2: typos corrected, Conclusion with discussion
  added",,,"FIAN/TD/30-09","hep-th","http://arxiv.org/licenses/nonexclusive-distrib/1.0/","  The correspondence between BRST and unfolded formulations of field equations
on group manifolds and homogeneous spaces is described. The previously
introduced nonstandard BRST operator, that underlies Sp(2M) invariant
higher-spin field equations, is shown to admit a natural oscillator-like
realization. The coordinate independent form of conserved currents in the
Sp(2M) invariant higher-spin theory is derived from the BRST formulation on
Sp(2M) extended by the Heisenberg group.
","[{""version"":""v1"",""created"":""Fri, 15 Jan 2010 20:55:32 GMT""},{""version"":""v2"",""created"":""Sun, 17 Jan 2010 19:59:24 GMT""}]","2010-01-18"
"1001.2589","Ioannis Florakis","Ioannis Florakis","String Models with Massive boson-fermion Degeneracy",,,"10.1002/prop.201000015","LPTENS-10-02","hep-th","http://arxiv.org/licenses/nonexclusive-distrib/1.0/","  We discuss constructions of string vacua with a novel Massive boson-fermion
Degeneracy Symmetry (MSDS) as candidate vacua able to describe the early
non-geometrical era of the universe. Based on a talk given at the Workshop on
Cosmology & Strings, Corfu Institute, Greece, Sept 12, 2009.
","[{""version"":""v1"",""created"":""Fri, 15 Jan 2010 18:22:15 GMT""},{""version"":""v2"",""created"":""Sat, 16 Jan 2010 07:14:17 GMT""},{""version"":""v3"",""created"":""Fri, 29 Jan 2010 10:14:22 GMT""}]","2015-05-18"
"1001.2595","Michael Jura","M. Jura, S. Xu (UCLA)","The Survival of Water within Extrasolar Minor Planets","Astronomical Journal, in press, 24 pages, 7 figures",,"10.1088/0004-6256/140/5/1129",,"astro-ph.EP","http://arxiv.org/licenses/nonexclusive-distrib/1.0/","  We compute that extrasolar minor planets can retain much of their internal
H_2O during their host star's red giant evolution. The eventual accretion of a
water-rich body or bodies onto a helium white dwarf might supply an observable
amount of atmospheric hydrogen, as seems likely for GD 362. More generally, if
hydrogen pollution in helium white dwarfs typically results from accretion of
large parent bodies rather than interstellar gas as previously supposed, then
H_2O probably constitutes at least 10% of the aggregate mass of extrasolar
minor planets. One observational test of this possibility is to examine the
atmospheres of externally-polluted white dwarfs for oxygen in excess of that
likely contributed by oxides such as SiO_2. The relatively high oxygen
abundance previously reported in GD 378 plausibly but not uniquely can be
explained by accretion of an H_2O-rich parent body or bodies. Future
ultraviolet observations of white dwarf pollutions can serve to investigate the
hypothesis that environments with liquid water that are suitable habitats for
extremophiles are widespread in the Milky Way.
","[{""version"":""v1"",""created"":""Fri, 15 Jan 2010 17:23:58 GMT""},{""version"":""v2"",""created"":""Sun, 17 Jan 2010 17:14:21 GMT""}]","2015-05-18"
"1001.2618","Seick Kim","Kyungkeun Kang, Seick Kim","Global pointwise estimates for Green's matrix of second order elliptic
  systems","17 pages, accepted in J. Differential Equations, references added","J. Differential Equations 249 (2010) 2643--2662","10.1016/j.jde.2010.05.017",,"math.AP","http://arxiv.org/licenses/nonexclusive-distrib/1.0/","  We establish global pointwise bounds for the Green's matrix for divergence
form, second order elliptic systems in a domain under the assumption that weak
solutions of the system vanishing on a portion of the boundary satisfy a
certain local boundedness estimate. Moreover, we prove that such a local
boundedness estimate for weak solutions of the system is equivalent to the
usual global pointwise bound for the Green's matrix. In the scalar case, such
an estimate is a consequence of De Giorgi-Moser-Nash theory and holds for
equations with bounded measurable coefficients in arbitrary domains. In the
vectorial case, one need to impose certain assumptions on the coefficients of
the system as well as on domains to obtain such an estimate. We present a
unified approach valid for both the scalar and vectorial cases and discuss
several applications of our result.
","[{""version"":""v1"",""created"":""Fri, 15 Jan 2010 16:00:21 GMT""},{""version"":""v2"",""created"":""Sun, 23 May 2010 23:57:07 GMT""}]","2010-09-07"
"1001.2629","Kimiko Yamada","Kimiko Yamada","Finiteness of isomorphic classes in the set of moduli schemes of sheaves
  on a surface",,,,,"math.AG","http://arxiv.org/licenses/nonexclusive-distrib/1.0/","  When a non-singular complex projective surface $X$ satisfies that $K_X\sim
0$, we shall show that there are only finitely many isomorphic classes as
abstract schemes in the set of moduli scheme of $H$-semistable sheaves with
fixed Chern classes $\alpha$ on $X$, where $H$ runs over the set of all
$\alpha$-generic polarizations on $X$.
","[{""version"":""v1"",""created"":""Fri, 15 Jan 2010 18:06:22 GMT""}]","2010-01-18"
"1001.2663","Tomasz Pawlowski","Wojciech Kaminski, Tomasz Pawlowski","Cosmic recall and the scattering picture of Loop Quantum Cosmology","RevTex4, 19 pages, 3 figures","Phys.Rev.D81:084027,2010","10.1103/PhysRevD.81.084027",,"gr-qc","http://arxiv.org/licenses/nonexclusive-distrib/1.0/","  The global dynamics of a homogeneous universe in Loop Quantum Cosmology is
viewed as a scattering process of its geometrodynamical equivalent. This
picture is applied to build a flexible (easy to generalize) and not restricted
just to exactly solvable models method of verifying the preservation of the
semiclassicality through the bounce. The devised method is next applied to two
simple examples: (i) the isotropic Friedman Robertson Walker universe, and (ii)
the isotropic sector of the Bianchi I model. For both of them we show, that the
dispersions in the logarithm of the volume ln(v) and scalar field momentum
ln(p_phi) in the distant future and past are related via strong triangle
inequalities. This implies in particular a strict preservation of the
semiclassicality (in considered degrees of freedom) in both the cases (i) and
(ii). Derived inequalities are general: valid for all the physical states
within the considered models.
","[{""version"":""v1"",""created"":""Fri, 15 Jan 2010 19:05:37 GMT""}]","2010-04-22"
"1001.2703","Harold Steinacker","Harald Grosse, Fedele Lizzi and Harold Steinacker","Noncommutative gauge theory and symmetry breaking in matrix models","29 pages","Phys.Rev.D81:085034,2010","10.1103/PhysRevD.81.085034","DSF/3/2010, ICCUB-10-006, UWTHPh-2010-1","hep-th","http://arxiv.org/licenses/nonexclusive-distrib/1.0/","  We show how the fields and particles of the standard model can be naturally
realized in noncommutative gauge theory. Starting with a Yang-Mills matrix
model in more than 4 dimensions, a SU(n) gauge theory on a Moyal-Weyl space
arises with all matter and fields in the adjoint of the gauge group. We show
how this gauge symmetry can be broken spontaneously down to SU(3)_c x SU(2)_L x
U(1)_Q (resp. SU(3)_c x U(1)_Q), which couples appropriately to all fields in
the standard model. An additional U(1)_B gauge group arises which is anomalous
at low energies, while the trace-U(1) sector is understood in terms of emergent
gravity. A number of additional fields arise which we assume to be massive, in
a pattern that is reminiscent of supersymmetry. The symmetry breaking might
arise via spontaneously generated fuzzy spheres, in which case the mechanism is
similar to brane constructions in string theory.
","[{""version"":""v1"",""created"":""Fri, 15 Jan 2010 18:03:58 GMT""}]","2010-05-12"
"1001.2704","Tania Robens","T.Robens, C.H.Chung","Alternative subtraction scheme using Nagy Soper dipoles","6 pages, 1 figure, presented at RADCOR 09",,,"TTK-10-07","hep-ph","http://arxiv.org/licenses/nonexclusive-distrib/1.0/","  We present an alternative subtraction scheme for the treatment of infrared
divergences in NLO QCD calculations. In this scheme, the number of
transformations is greatly reduced with respect to the standard subtraction
scheme by Catani and Seymour. We discuss the general setup of the scheme as
well as first applications to NLO processes at hadron and lepton colliders.
","[{""version"":""v1"",""created"":""Fri, 15 Jan 2010 16:27:46 GMT""}]","2010-01-18"
"1001.2708","Watson Varricatt P.","Watson P. Varricatt, Christopher J. Davis, Suzanne Ramsay, Stephen P.
  Todd","A near IR imaging survey of intermediate and high-mass young stellar
  outflow candidates","64 pages, 53 figures, Accepted for publication in the MNRAS","MNRAS 404 (2010) 661-720","10.1111/j.1365-2966.2010.16356.x",,"astro-ph.SR","http://arxiv.org/licenses/nonexclusive-distrib/1.0/","  We have carried out a near-infrared imaging survey of luminous young stellar
outflow candidates using the United Kingdom Infrared Telescope. Observations
were obtained in the broad band K (2.2 mu) and through narrow band filters at
the wavelengths of H_2 v=1--0 S(1) (2.1218 mu) and Br gamma (2.166 mu) lines.
Fifty regions were imaged with a field of view of 2.2 X 2.2 arcmin^2. Several
young embedded clusters are unveiled in our near-infrared images. 76% of the
objects exhibit H_2 emission and 50% or more of the objects exhibit aligned H_2
emission features suggesting collimated outflows, many of which are new
detections. These observations suggest that disk accretion is probably the
leading mechanism in the formation of stars, at least up to late O spectral
types. The young stellar objects responsible for many of these outflows are
positively identified in our images based on their locations with respect to
the outflow lobes, 2MASS colours and association with MSX, IRAS, millimetre and
radio sources. The close association of molecular outflows detected in CO with
the H_2 emission features produced by shock excitation by jets from the young
stellar objects suggests that the outflows from these objects are jet-driven.
Towards strong radio emitting sources, H_2 jets were either not detected or
were weak when detected, implying that most of the accretion happens in the
pre-UCHII phase; accretion and outflows are probably weak when the YSO has
advanced to its UCHII stage.
","[{""version"":""v1"",""created"":""Fri, 15 Jan 2010 17:55:05 GMT""}]","2015-05-18"
"1001.2717","Maria Grazia Pia","M. G. Pia, P. Saracco, M. Sudhakar, A. Zoglauer, M. Augelli, E.
  Gargioni, C. H. Kim, L. Quintieri, P. P. de Queiroz Filho, D. de Souza
  Santos, G. Weidenspointner, M. Begalli","Design and performance evaluations of generic programming techniques in
  a R&D prototype of Geant4 physics","To be published in the Proceedings of the CHEP (Computing in High
  Energy Physics) 2009 conference",,"10.1088/1742-6596/219/4/042019",,"physics.comp-ph hep-ex","http://arxiv.org/licenses/nonexclusive-distrib/1.0/","  A R&D project has been recently launched to investigate Geant4 architectural
design in view of addressing new experimental issues in HEP and other related
physics disciplines. In the context of this project the use of generic
programming techniques besides the conventional object oriented is
investigated. Software design features and preliminary results from a new
prototype implementation of Geant4 electromagnetic physics are illustrated.
Performance evaluations are presented. Issues related to quality assurance in
Geant4 physics modelling are discussed.
","[{""version"":""v1"",""created"":""Fri, 15 Jan 2010 16:21:39 GMT""}]","2015-05-18"
"1001.2718","Donatello Dolce","Donatello Dolce","Quantum Mechanics from Periodic Dynamics: the bosonic case","6 pages. Talk given at QTRF5, Vaxjo, Sweden. Updated references","AIP Conf. Proc. -- May 4, 2010 -- Volume 1232, pp. 222-227","10.1063/1.3431493","MZ-TH/09-23","hep-th hep-ph quant-ph","http://arxiv.org/licenses/nonexclusive-distrib/1.0/","  Enforcing the periodicity hypothesis of the ""old"" formulation of Quantum
Mechanics we show the possibility for a new scenario where Special Relativity
and Quantum Mechanics are unified in a Deterministic Field Theory
[arXiv:0903.3680]. A novel interpretation of the AdS/CFT conjecture is
discussed.
","[{""version"":""v1"",""created"":""Fri, 15 Jan 2010 18:38:47 GMT""},{""version"":""v2"",""created"":""Mon, 25 Jan 2010 19:26:06 GMT""},{""version"":""v3"",""created"":""Tue, 4 May 2010 14:28:05 GMT""},{""version"":""v4"",""created"":""Fri, 26 Aug 2011 07:58:27 GMT""}]","2011-08-29"
"1001.2721","Alessandro Cobbe","Alessandro Cobbe","Steinitz classes of some abelian and nonabelian extensions of even
  degree",,"Journal de Th\'eorie des Nombres de Bordeaux, tome 22, num\'ero 3,
  2010, pages 607-628","10.5802/jtnb.735",,"math.NT","http://arxiv.org/licenses/nonexclusive-distrib/1.0/","  The Steinitz class of a number field extension K/k is an ideal class in the
ring of integers O_k of k, which, together with the degree [K:k] of the
extension determines the O_k-module structure of O_K. We call R_t(k,G) the
classes which are Steinitz classes of a tamely ramified G-extension of k. We
will say that those classes are realizable for the group G; it is conjectured
that the set of realizable classes is always a group.
  In this paper we will develop some of the ideas contained in arXiv:0910.5080
to obtain some results in the case of groups of even order. In particular we
show that to study the realizable Steinitz classes for abelian groups, it is
enough to consider the case of cyclic groups of 2-power degree.
","[{""version"":""v1"",""created"":""Fri, 15 Jan 2010 16:02:23 GMT""}]","2016-02-26"
"1001.2723","Reinier Heeres","Reinier W. Heeres, Sander N. Dorenbos, Benny Koene, Glenn S. Solomon,
  Leo P. Kouwenhoven, Valery Zwiller","On-Chip Single Plasmon Detection",,,"10.1021/nl903761t",,"cond-mat.mes-hall","http://arxiv.org/licenses/nonexclusive-distrib/1.0/","  Surface plasmon polaritons (plasmons) have the potential to interface
electronic and optical devices. They could prove extremely useful for
integrated quantum information processing. Here we demonstrate on-chip
electrical detection of single plasmons propagating along gold waveguides. The
plasmons are excited using the single-photon emission of an optically emitting
quantum dot. After propagating for several micrometers, the plasmons are
coupled to a superconducting detector in the near-field. Correlation
measurements prove that single plasmons are being detected.
","[{""version"":""v1"",""created"":""Fri, 15 Jan 2010 16:04:09 GMT""}]","2010-01-18"
"1001.2724","Maria Grazia Pia","M. G. Pia, G. Weidenspointner, M. Augelli, L. Quintieri, P. Saracco,
  M. Sudhakar, A. Zoglauer","New models for PIXE simulation with Geant4","To be published in the Proceedings of the CHEP (Computing in High
  Energy Physics) 2009 conference",,"10.1088/1742-6596/219/3/032018",,"physics.comp-ph hep-ex physics.ins-det","http://arxiv.org/licenses/nonexclusive-distrib/1.0/","  Particle induced X-ray emission (PIXE) is a physical effect that is not yet
adequately modelled in Geant4. The current status as in Geant4 9.2 release is
reviewed and new developments are described. The capabilities of the software
prototype are illustrated in application to the shielding of the X-ray
detectors of the eROSITA telescope on the upcoming Spectrum-X-Gamma space
mission.
","[{""version"":""v1"",""created"":""Fri, 15 Jan 2010 16:12:16 GMT""}]","2015-05-18"
"1001.2725","Dionigi Benincasa Mr","Dionigi M. T. Benincasa, Fay Dowker","The Scalar Curvature of a Causal Set","Typo in definition of equation (3) and definition of n(x,y)
  corrected. Note: published version still contains typo","Phys.Rev.Lett.104:181301,2010","10.1103/PhysRevLett.104.181301",,"gr-qc hep-th","http://arxiv.org/licenses/nonexclusive-distrib/1.0/","  A one parameter family of retarded linear operators on scalar fields on
causal sets is introduced. When the causal set is well-approximated by 4
dimensional Minkowski spacetime, the operators are Lorentz invariant but
nonlocal, are parametrised by the scale of the nonlocality and approximate the
continuum scalar D'Alembertian, $\Box$, when acting on fields that vary slowly
on the nonlocality scale. The same operators can be applied to scalar fields on
causal sets which are well-approximated by curved spacetimes in which case they
approximate $\Box - {{1/2}}R$ where $R$ is the Ricci scalar curvature. This can
used to define an approximately local action functional for causal sets.
","[{""version"":""v1"",""created"":""Fri, 15 Jan 2010 16:10:27 GMT""},{""version"":""v2"",""created"":""Sat, 16 Jan 2010 12:57:31 GMT""},{""version"":""v3"",""created"":""Fri, 7 May 2010 14:38:15 GMT""},{""version"":""v4"",""created"":""Tue, 1 Nov 2011 14:47:28 GMT""}]","2011-11-02"
"1001.2726","Josep M. Pons","J. M. Pons, D. C. Salisbury, K. A. Sundermeyer","Observables in classical canonical gravity: folklore demystified","15 pages, To appear in Proceedings of 1st Mediterranean Conference on
  Classical and Quantum Gravity. Corrected minor typos",,"10.1088/1742-6596/222/1/012018",,"gr-qc hep-th","http://arxiv.org/licenses/nonexclusive-distrib/1.0/","  We give an overview of some conceptual difficulties, sometimes called
paradoxes, that have puzzled for years the physical interpetation of classical
canonical gravity and, by extension, the canonical formulation of generally
covariant theories. We identify these difficulties as stemming form some
terminological misunderstandings as to what is meant by ""gauge invariance"", or
what is understood classically by a ""physical state"". We make a thorough
analysis of the issue and show that all purported paradoxes disappear when the
right terminology is in place. Since this issue is connected with the search of
observables - gauge invariant quantities - for these theories, we formally show
that time evolving observables can be constructed for every observer. This
construction relies on the fixation of the gauge freedom of diffeomorphism
invariance by means of a scalar coordinatization. We stress the condition that
the coordinatization must be made with scalars. As an example of our method for
obtaining observables we discuss the case of the massive particle in AdS
spacetime.
","[{""version"":""v1"",""created"":""Fri, 15 Jan 2010 16:21:25 GMT""},{""version"":""v2"",""created"":""Wed, 12 May 2010 10:43:14 GMT""}]","2015-05-18"
"1001.2727","Nadezhda Gribova","N. Gribova, A. Arnold, H. Maleki, T. Schilling, C. Holm","2D versus 3D Freezing of a Lennard-Jones Fluid in a Slit Pore","This paper has been withdrawn by the author due to more complete
  study presented in arXiv:1104.0611",,,,"cond-mat.soft cond-mat.stat-mech","http://arxiv.org/licenses/nonexclusive-distrib/1.0/","  We present a computer simulation study of a (6,12)-Lennard-Jones fluid
confined to a slit pore, formed by two uniform planes. These interact via a
(3,9)-Lennard-Jones potential with the fluid particles. When the fluid
approaches the liquid-to-solid transition we first observe layering parallel to
the walls. In order to investigate the nature of the freezing transition, we
performed a detailed analysis of the bond-orientational order parameter in the
layers. Changing the distance between the slit wall, we studied howthe
behaviour changes from a quasi-2d crystallization without hysteresis and an
intermediate hexatic phase to a standard 3d nucleation.
","[{""version"":""v1"",""created"":""Fri, 15 Jan 2010 16:26:12 GMT""},{""version"":""v2"",""created"":""Wed, 20 Jul 2011 10:33:04 GMT""}]","2011-07-21"
"1001.2728","Guangxiang Su","Guangxiang Su","Burghelea-Haller analytic torsion for twisted de Rham complexes","14 pages",,,,"math.DG math.SP","http://arxiv.org/licenses/nonexclusive-distrib/1.0/","  In this paper, we extend the Burghelea-Haller analytic torsion to the twisted
de Rham complexes. We also compare it with the twisted refined analytic torsion
defined by Huang.
","[{""version"":""v1"",""created"":""Fri, 15 Jan 2010 16:27:30 GMT""}]","2010-01-18"
"1001.2729","Frank Wilczek","Frank Wilczek","Prelude to Compressed Baryonic Matter","12 pages, to appear in ""The CBM Book: compressed baryonic matter in
  laboratory experiments""",,"10.1007/978-3-642-13293-3_1",,"hep-ph","http://arxiv.org/licenses/nonexclusive-distrib/1.0/","  This is intended to appear as the introduction to ""The CBM Physics Book:
compressed baryonic matter in laboratory experiments"" (ed. B. Friman, C.
H\""ohne, S. Leupold, J. Knoll, J. Randrup, R. Rapp, P. Senger), to be published
by Springer. At the end there is a new proposal for numerically tractable
models of interacting many-body systems.
","[{""version"":""v1"",""created"":""Fri, 15 Jan 2010 16:28:03 GMT""}]","2015-05-18"
"1001.2730","Bennie F. L. Ward","B.F.L. Ward (1), S. Joseph (1), S. Majhi (2), S.A. Yost (3) ((1)
  Department of Physics, Baylor University, Waco, TX, USA, (2) Theory Division,
  Saha Institute of Nuclear Physics, Kolkata, In, (3) Department of Physics,
  The Citadel, Charleston, SC, USA)","MC Realization of IR-Improved DGLAP-CS Parton Showers: HERWIRI1.0","7 pages, 2 figures, to appear Proc. RADCOR2009","Pos RADCOR2009: 070, 2010","10.1142/S021773231003402X","BU-HEPP-10-01","hep-ph","http://arxiv.org/licenses/nonexclusive-distrib/1.0/","  We introduce the new IR-improved
Dokshitzer-Gribov-Lipatov-Altarelli-Parisi-Callan-Symanzik (DGLAP-CS) kernels
recently developed by one of us into the HERWIG6.5 to generate a new MC,
HERWIRI1.0(31), for hadron-hadron scattering at high energies. We use MC data
to compare the parton shower generated by the standard DGLAP-CS kernels and
that generated by the new IR-improved DGLAP-CS kernels. The seamless interface
to MC@NLO, MC@NLO/HERWIRI, is illustrated. We show comparisons with FNAL data
and we discuss some possible LHC phenomenology implications.
","[{""version"":""v1"",""created"":""Fri, 15 Jan 2010 16:33:44 GMT""}]","2015-05-18"
