"1001.2781","Nan Ma","Nan Ma and Prakash Ishwar","Interaction Strictly Improves the Wyner-Ziv Rate-distortion function","5 pages, submitted to IEEE International Symposium on Information
  Theory (ISIT) 2010",,,,"cs.IT math.IT","http://arxiv.org/licenses/nonexclusive-distrib/1.0/","  In 1985 Kaspi provided a single-letter characterization of the
sum-rate-distortion function for a two-way lossy source coding problem in which
two terminals send multiple messages back and forth with the goal of
reproducing each other's sources. Yet, the question remained whether more
messages can strictly improve the sum-rate-distortion function. Viewing the
sum-rate as a functional of the distortions and the joint source distribution
and leveraging its convex-geometric properties, we construct an example which
shows that two messages can strictly improve the one-message (Wyner-Ziv)
rate-distortion function. The example also shows that the ratio of the
one-message rate to the two-message sum-rate can be arbitrarily large and
simultaneously the ratio of the backward rate to the forward rate in the
two-message sum-rate can be arbitrarily small.
","[{""version"":""v1"",""created"":""Fri, 15 Jan 2010 21:53:42 GMT""},{""version"":""v2"",""created"":""Tue, 1 Jun 2010 19:59:47 GMT""}]","2010-06-02"
"1001.2782","Jorge Littin Mr.","Jorge Littin, Servet Martinez","R-positivity of matrices and Hamiltonians on nearest neighbors
  trajectories",,,,,"math.PR","http://arxiv.org/licenses/nonexclusive-distrib/1.0/","  We revisit the $R-$positivity of nearest neighbors matrices on ${\ZZ_+}$ and
the Gibbs measures on the set of nearest neighbors trajectories on ${\ZZ_+}$
whose Hamiltonians award either visits to sites a or visits to edges. We give
conditions that guarantee the $R-$positivity or equivalently the existence of
the infinite volume Gibbs measure, and we show geometrical recurrence of the
associated Markov chain. In this work we generalize and sharpen results
obtained in [3] and [6].
","[{""version"":""v1"",""created"":""Fri, 15 Jan 2010 21:55:25 GMT""}]","2010-01-19"
"1001.2783","Leonard S. Kisslinger","Ernest M. Henley (Department of Physics, University of Washington)
  Mikkel B. Johnson (Los Alamos National Laboratory, Los Alamos, NM) Leonard S.
  Kisslinger (Department of Physics, Carnegie Mellon University)","EWPT Nucleation With MSSM and Electromagnetic Field Creation","9 pages, 5 figures","Phys.Rev.D81:085035,2010","10.1103/PhysRevD.81.085035",,"astro-ph.CO hep-ph","http://arxiv.org/licenses/nonexclusive-distrib/1.0/","  Using EW-MSSM field theory, so the EWPT is first order, we derive the
equations of motion for the gauge fields. With an isospin ansatz we derive
e.o.m. for the electrically charged W fields uncoupled from all other fields.
These and the lepton currents serve as the current for the Maxwell-like e.o.m.
for the electromagnetic field. The electromagnetic field arising during EWPT
bubble nucleation without leptons is found. We then calculate the electron
current contribution, which is seen to be quite large. This provides the basis
for determinining the magnetic field created by EWPT bubble collisions, which
could seed galactic and extra-galactic magnetic fields.
","[{""version"":""v1"",""created"":""Fri, 15 Jan 2010 21:55:51 GMT""}]","2010-05-12"
"1001.2784","Carlos Hernaski C. A. Hernaski","C. A. Hernaski, B. Pereira-Dias, A. A. Vargas-Paredes","Extending the Spin Projection Operators for Gravity Models with
  Parity-Breaking in 3-D","6 pages","Phys.Lett.A374:3410-3415,2010","10.1016/j.physleta.2010.06.048",,"hep-th gr-qc","http://arxiv.org/licenses/nonexclusive-distrib/1.0/","  We propose a new basis of spin-operators, specific for the case of planar
theories, which allows a Lagrangian decomposition into spin-parity components.
The procedure enables us to discuss unitarity and spectral properties of
gravity models with parity-breaking in a systematic way.
","[{""version"":""v1"",""created"":""Fri, 15 Jan 2010 22:18:17 GMT""},{""version"":""v2"",""created"":""Thu, 12 Aug 2010 17:23:23 GMT""}]","2010-08-13"
"1001.2786","Lalitha Sankar","Lalitha Sankar, Elza Erkip, and H. Vincent Poor","A General Coding Scheme for Two-User Fading Interference Channels",,,,,"cs.IT math.IT","http://arxiv.org/licenses/nonexclusive-distrib/1.0/","  A Han-Kobayashi based achievable scheme is presented for ergodic fading
two-user Gaussian interference channels (IFCs) with perfect channel state
information at all nodes and Gaussian codebooks with no time-sharing. Using
max-min optimization techniques, it is shown that jointly coding across all
states performs at least as well as separable coding for the sub-classes of
uniformly weak (every sub-channel is weak) and hybrid (mix of strong and weak
sub-channels that do not achieve the interference-free sum-capacity) IFCs. For
the uniformly weak IFCs, sufficient conditions are obtained for which the
sum-rate is maximized when interference is ignored at both receivers.
","[{""version"":""v1"",""created"":""Fri, 15 Jan 2010 22:32:16 GMT""}]","2010-01-19"
"1001.2787","Ronald Moore","Ronald S. Moore, Andreas Jansson, Vladimir Shiltsev","Beam instrumentation for the Tevatron Collider",,"JINST 4:P12018,2009","10.1088/1748-0221/4/12/P12018","FERMILAB-PUB-09-497-AD-APC","physics.acc-ph physics.ins-det","http://creativecommons.org/licenses/publicdomain/","  The Tevatron in Collider Run II (2001-present) is operating with six times
more bunches and many times higher beam intensities and luminosities than in
Run I (1992-1995). Beam diagnostics were crucial for the machine start-up and
the never-ending luminosity upgrade campaign. We present the overall picture of
the Tevatron diagnostics development for Run II, outline machine needs for new
instrumentation, present several notable examples that led to Tevatron
performance improvements, and discuss the lessons for future colliders.
","[{""version"":""v1"",""created"":""Fri, 15 Jan 2010 22:39:41 GMT""}]","2010-01-19"
"1001.2788","Michael Wilkinson","M. Wilkinson, B. Mehlig, K. Gustavsson and E. Werner","Clustering of exponentially separating trajectories","4 pages, 2 figures",,,,"nlin.CD","http://arxiv.org/licenses/nonexclusive-distrib/1.0/","  It might be expected that trajectories for a dynamical system which has no
negative Lyapunov exponent (implying exponential growth of small separations
will not cluster together. However, clustering can occur such that the density
$\rho(\Delta x)$ of trajectories within distance $\Delta x$ of a reference
trajectory has a power-law divergence, so that $\rho(\Delta x)\sim \Delta
x^{-\beta}$ when $\Delta x$ is sufficiently small, for some $0<\beta<1$. We
demonstrate this effect using a random map in one dimension. We find no
evidence for this effect in the chaotic logistic map, and argue that the effect
is harder to observe in deterministic maps.
","[{""version"":""v1"",""created"":""Sat, 16 Jan 2010 09:56:15 GMT""}]","2010-01-19"
"1001.2789","Andreas Seeger","Yaryong Heo, Fedor Nazarov, Andreas Seeger","On radial and conical Fourier multipliers",,"Journal of Geometric Analysis, Vol 21 (2011), issue 1, 96-117",,,"math.CA","http://arxiv.org/licenses/nonexclusive-distrib/1.0/","  We investigate connections between radial Fourier multipliers on $R^d$ and
certain conical Fourier multipliers on $R^{d+1}$. As an application we obtain a
new weak type endpoint bound for the Bochner-Riesz multipliers associated to
the light cone in $R^{d+1}$, where $d\ge 4$, and results on characterizations
of $L^p\to L^{p,\nu}$ inequalities for convolutions with radial kernels.
","[{""version"":""v1"",""created"":""Fri, 15 Jan 2010 23:02:48 GMT""}]","2012-03-20"
"1001.2790","John E. Vaillancourt","Jessie L. Dotson, John E. Vaillancourt, Larry Kirby, C. Darren Dowell,
  Roger H. Hildebrand, and Jacqueline A. Davidson","350 micron Polarimetry from the Caltech Submillimeter Observatory","48 pages, 56 figures, ApJS in press","2010, ApJS, 186, 406","10.1088/0067-0049/186/2/406",,"astro-ph.GA","http://arxiv.org/licenses/nonexclusive-distrib/1.0/","  We present a summary of data obtained with the 350 micron polarimeter, Hertz,
at the Caltech Submillimeter Observatory. We give tabulated results and maps
showing polarization vectors and flux contours. The summary includes over 4300
individual measurements in 56 Galactic sources and 2 galaxies. Of these
measurements, 2153 have P >= 3\sigma_p statistical significance. The median
polarization of the entire data set is 1.46%.
","[{""version"":""v1"",""created"":""Sat, 16 Jan 2010 00:44:50 GMT""}]","2010-02-22"
"1001.2791","Artem Boriskin","A. V. Boriskin, S. V. Boriskina, T. Benson, P. Sewell, A. I. Nosich","Focusing properties of mushroom microlenses","3 pages, 5 figures","Proc. Int. Conf. on Advanced Optoelectronics and Lasers (CAOL-05),
  Yalta (Ukraine), Sept. 2005, pp. 259-261",,,"physics.optics","http://arxiv.org/licenses/nonexclusive-distrib/1.0/","  Focusing properties of a novel type photoresist microlens are studied. A
specific character of the microlens is its mushroom shape. Recently it was
predicted and experimentally revealed that such a lens integrated with a
light-emitting diode is capable of enhancing its output efficiency and
directivity. In our paper we describe the true electromagnetic performance of a
mushroom lens by applying a mathematically rigorous method of boundary integral
equations. Numerical results are presented for the mushroom lens illuminated
with a plane E-polarized wave and include figures describing the evolution of
the lens focal spot and near field maps.
","[{""version"":""v1"",""created"":""Fri, 15 Jan 2010 23:46:05 GMT""}]","2010-01-19"
"1001.2793","Ana Rechtman","Fernando Alcalde Cuesta, Ana Rechtman","Minimal F{\o}lner foliations are amenable",,,,,"math.DS math.FA","http://arxiv.org/licenses/nonexclusive-distrib/1.0/","  For finitely generated groups, amenability and F{\o}lner properties are
equivalent. However, contrary to a widespread idea, Kaimanovich showed that
F{\o}lner condition does not imply amenability for discrete measured
equivalence relations. In this paper, we exhibit two examples of $C^\infty$
foliations of closed manifolds that are F{\o}lner and non amenable with respect
to a finite transverse invariant measure and a transverse invariant volume,
respectively. We also prove the equivalence between the two notions when the
foliation is minimal, that is all the leaves are dense, giving a positive
answer to a question of Kaimanovich. The equivalence is stated with respect to
transverse invarian measures or some tangentially smooth measures. The latter
include harmonic measures, and in this case the F{\o}lner condition has to be
replaced by $\eta$-F{\o}lner (where the usual volume is modified by the modular
form $\eta$ of the measure).
","[{""version"":""v1"",""created"":""Fri, 15 Jan 2010 23:50:06 GMT""},{""version"":""v2"",""created"":""Wed, 6 Jul 2011 13:48:18 GMT""}]","2011-07-07"
"1001.2794","Jorge Perez-Peraza A.","M. Alvarez Madrigal, J. Perez Peraza, V.M. Velasco","The influence of cosmic rays on the size of the Antarctic Ozone Hole","14 pages and 4 figures",,,,"hep-ph physics.ao-ph","http://arxiv.org/licenses/nonexclusive-distrib/1.0/","  The Antarctic region in which severe ozone depletion has taken place is known
as the ozone hole. This region has two basic indicators: the area, where the
ozone abundance is low (size), and the quantity of ozone mass deficit (depth).
The energetic particles that penetrate deeply into the atmosphere and galactic
cosmic rays (GCR) modify the ozone abundance in the stratosphere. With this
research project, we are looking for evidence of a connection between
variations in the cosmic ray flux and variations in the size of the ozone hole.
In addition, we are looking for signs of the kind of processes that physically
connect GCR fluxes with variations in the stratospheric ozone hole size (OHS)
in the Antarctic region. With this goal in mind, we also analyze here the
atmospheric temperature (AT) anomalies, which have often been linked with such
variations. Using Morlet's wavelet spectral analysis to compute the coherence
between two time series, we found that during the analyzed period (1982-2005),
there existed a common signal of around 3 and 5 years between the OHS and GCR
time series, during September and November, respectively. In both cases, the
relationship showed a time-dependent anti-correlation between the two series.
On the other hand, for October the analysis showed a time-dependent correlation
that occurs around 1.7 years. These results seem to indicate that there exist
at least two kinds of modulation processes of GCR fluxes on the OHS that work
simultaneously but that change their relative relevance along the timeline.
","[{""version"":""v1"",""created"":""Fri, 15 Jan 2010 23:55:32 GMT""}]","2010-01-19"
"1001.2795","Vladimir Nazarov","V. U. Nazarov, G. Vignale, and Y.-C. Chang","On the relation between the scalar and tensor exchange-correlation
  kernels of the time-dependent density-functional theory","8 pages, Submitted to Journal of Chemical Physics","Journal of Chemical Physics 133, 021101 (2010)","10.1063/1.3455711",,"cond-mat.str-el cond-mat.mtrl-sci","http://arxiv.org/licenses/nonexclusive-distrib/1.0/","  The scalar $f_{xc}$ and tensor $\hat{f}_{xc}$ exchange-correlation (xc)
kernels are key ingredients of the time-dependent density functional theory and
the time-dependent current density functional theory, respectively. We derive a
comparatively simple relation between these two kernels under the assumption
that the dynamic xc can be considered ""weak"". We expect our formula to serve as
a convenient bridge between the scalar $f_{xc}$ which directly enters many
applications and the tensor $\hat{f}_{xc}$ which, due to its locality in space,
is much easier to approximate.
","[{""version"":""v1"",""created"":""Sat, 16 Jan 2010 00:04:07 GMT""}]","2010-07-15"
"1001.2796","Simon Schuler","J.R. King, S.C. Schuler, L.M. Hobbs, M.H. Pinsonneault","Li I and K I Scatter in Cool Pleiades Dwarfs","35 pages, 7 figures; accepted by ApJ",,"10.1088/0004-637X/710/2/1610",,"astro-ph.SR","http://arxiv.org/licenses/nonexclusive-distrib/1.0/","  We utilize high-resolution (R~60,000), high S/N (~100) spectroscopy of 17
cool Pleiades dwarfs to examine the confounding star-to-star scatter in the
6707 Li I line strengths in this young cluster. Our Pleiads, selected for their
small projected rotational velocity and modest chromospheric emission, evince
substantial scatter in the linestrengths of 6707 Li I feature that is absent in
the 7699 K I resonance line. The Li I scatter is not correlated with that in
the high-excitation 7774 O I feature, and the magnitude of the former is
greater than the latter despite the larger temperature sensitivity of the O I
feature. These results suggest that systematic errors in linestrength
measurements due to blending, color (or color-based T_eff) errors, or line
formation effects related to an overlying chromosphere are not the principal
source of Li I scatter in our stars. There do exist analytic spot models that
can produce the observed Li scatter without introducing scatter in the K I line
strengths or the color-magnitude diagram. However, these models predict factor
of >3 differences in abundances derived from the subordinate 6104 and resonance
6707 Li I features; we find no difference in the abundances determined from
these two features. These analytic spot models also predict CN line strengths
significantly larger than we observe in our spectra. The simplest explanation
of the Li, K, CN, and photometric data is that there must be a real abundance
component to the Pleiades Li dispersion. We suggest that this real abundance
component is the manifestation of relic differences in erstwhile
pre-main-sequence Li burning caused by effects of surface activity on stellar
structure. We discuss observational predictions of these effects.
","[{""version"":""v1"",""created"":""Sat, 16 Jan 2010 00:11:20 GMT""}]","2015-05-18"
"1001.2797","Krzysztof Latuszynski","Krzysztof Latuszynski and Jeffrey S. Rosenthal","Adaptive Gibbs samplers",,,,,"stat.CO","http://arxiv.org/licenses/nonexclusive-distrib/1.0/","  We consider various versions of adaptive Gibbs and Metropolis within-Gibbs
samplers, which update their selection probabilities (and perhaps also their
proposal distributions) on the fly during a run, by learning as they go in an
attempt to optimise the algorithm. We present a cautionary example of how even
a simple-seeming adaptive Gibbs sampler may fail to converge. We then present
various positive results guaranteeing convergence of adaptive Gibbs samplers
under certain conditions.
","[{""version"":""v1"",""created"":""Sat, 16 Jan 2010 00:55:16 GMT""}]","2010-01-19"
"1001.2798","David Miller","David L. Miller (1), Kevin D. Kubista (1), Gregory M. Rutter (2), Ming
  Ruan (1), Walt A. de Heer (1), Phillip N. First (1), Joseph A. Stroscio (2)
  ((1) School of Physics, Georgia Institute of Technology (2) Center for
  Nanoscale Science and Technology, National Institute of Standards and
  Technology)","Structural Determination of Multilayer Graphene via Atomic Moir\'{e}
  Interferometry","6 pages, 5 figures","Phys. Rev. B 81, 125427 (2010)","10.1103/PhysRevB.81.125427",,"cond-mat.mtrl-sci","http://arxiv.org/licenses/nonexclusive-distrib/1.0/","  Rotational misalignment of two stacked honeycomb lattices produces a moir\'e
pattern that is observable in scanning tunneling microscopy as a small
modulation of the apparent surface height. This is known from experiments on
highly-oriented pyrolytic graphite. Here, we observe the combined effect of
three-layer moir\'e patterns in multilayer graphene grown on SiC
($000\bar{1}$). Small-angle rotations between the first and third layer are
shown to produce a ""double-moir\'e"" pattern, resulting from the interference of
moir\'e patterns from the first three layers. These patterns are strongly
affected by relative lattice strain between the layers. We model the moir\'e
patterns as a beat-period of the mismatched reciprocal lattice vectors and show
how these patterns can be used to determine the relative strain between
lattices, in analogy to strain measurement by optical moir\'e interferometry.
","[{""version"":""v1"",""created"":""Sat, 16 Jan 2010 01:02:14 GMT""}]","2010-03-25"
"1001.2799","Huaiyu Duan","Huaiyu Duan (LANL), George M. Fuller (UCSD) and Yong-Zhong Qian (UMN)","Collective Neutrino Oscillations","Submitted to Annual Review of Nuclear and Particle Science","Ann. Rev. Nucl. Part. Sci. 60:569 (2010)","10.1146/annurev.nucl.012809.104524","LA-UR 09-08309, INT-PUB 10-001","hep-ph astro-ph.HE","http://arxiv.org/licenses/nonexclusive-distrib/1.0/","  We review the rich phenomena associated with neutrino flavor transformation
in the presence of neutrino self-coupling. Our exposition centers on three
collective neutrino oscillation scenarios: a simple bipolar neutrino system
that initially consists of mono-energetic electron neutrinos and antineutrinos;
a homogeneous and isotropic neutrino gas with multiple neutrino/antineutrino
species and continuous energy spectra; and a generic neutrino gas in an
anisotropic environment. We use each of these scenarios to illustrate key
facets of collective neutrino oscillations. We discuss the implications of
collective neutrino flavor oscillations for core collapse supernova physics and
for the prospects of obtaining fundamental neutrino properties, e.g., the
neutrino mass hierarchy and $\theta_{13}$ from a future observed supernova
neutrino signal.
","[{""version"":""v1"",""created"":""Sat, 16 Jan 2010 01:44:53 GMT""}]","2011-02-02"
"1001.2800","Tadashi Kon","K. Iizuka, T. Kon, K. Kato, T. Ishikawa, Y. Kurihara, M. Jimbo and M.
  Kuroda","Systematic study of 1-loop correction on sparticle decay widths using
  GRACE/SUSY-loop","6 pages, 4 figures, added references, contribution to the proceedings
  of the 9th International Symposium on Radiative Corrections (RADCOR 2009),
  October 25-30 2009, Ascona, Switzerland","PoS RADCOR2009:068,2010",,"KEK-CP-228, CUCP-10-1, KU-PH-004","hep-ph","http://arxiv.org/licenses/nonexclusive-distrib/1.0/","  The 1-loop corrected decay widths of sparticles (charginos, neutralinos,
gluino and sfermions) in the framework of the MSSM are calculated
systematically using GRACE/SUSY-loop, which is the program package for the
automatic calculation of the MSSM amplitudes in the 1-loop order. We present
the renormalization scheme used in our system and show some numerical results
of decay widths of sfermions and gluino using the SPS1a' parameter set and
other SUSY parameter sets.
","[{""version"":""v1"",""created"":""Sat, 16 Jan 2010 03:11:43 GMT""},{""version"":""v2"",""created"":""Tue, 26 Jan 2010 03:52:49 GMT""}]","2014-11-20"
"1001.2801","Qun Wang","Jun Song, Zuo-tang Liang, Yu-xin Liu, Feng-lan Shao, Qun Wang","The entropy puzzle and the quark combination model","RevTex 4, 4 pages, 2 tables, 4 figures, discussions and references
  added, to appear in PRC","Phys.Rev.C81:057901,2010","10.1103/PhysRevC.81.057901",,"nucl-th","http://arxiv.org/licenses/nonexclusive-distrib/1.0/","  We use two available methods, the Duhem-Gibbs relation and the entropy
formula in terms of particle phase space distributions, to calculate the
entropy in a quark combination model. The entropy of the system extracted from
the Duhem-Gibbs relation is found to increase in hadronization if the average
temperature of the hadronic phase is lower than that of the quark phase. The
increase of the entropy can also be confirmed from the entropy formula if the
volume of the hadronic phase is larger than 2.5-3.0 times that of the quark
phase. So whether the entropy increases or decreases during combination depends
on the temperature before and after combination and on how much expansion the
system undergoes during combination. The current study provides an example to
shed light on the entropy issue in the quark combination model.
","[{""version"":""v1"",""created"":""Sat, 16 Jan 2010 03:13:26 GMT""},{""version"":""v2"",""created"":""Fri, 23 Apr 2010 02:13:48 GMT""}]","2014-11-20"
"1001.2803","Cheol-Hwan Park","Cheol-Hwan Park, Feliciano Giustino, Catalin D. Spataru, Marvin L.
  Cohen and Steven G. Louie","Angle-resolved photoemission spectra of graphene from first-principles
  calculations",,"Nano Lett. 9, 4234-4239 (2009)","10.1021/nl902448v",,"cond-mat.mtrl-sci","http://arxiv.org/licenses/nonexclusive-distrib/1.0/","  Angle-resolved photoemission spectroscopy (ARPES) is a powerful experimental
technique for directly probing electron dynamics in solids. The energy vs.
momentum dispersion relations and the associated spectral broadenings measured
by ARPES provide a wealth of information on quantum many-body interaction
effects. In particular, ARPES allows studies of the Coulomb interaction among
electrons (electron-electron interactions) and the interaction between
electrons and lattice vibrations (electron-phonon interactions). Here, we
report ab initio simulations of the ARPES spectra of graphene including both
electron-electron and electron-phonon interactions on the same footing. Our
calculations reproduce some of the key experimental observations related to
many-body effects, including the indication of a mismatch between the upper and
lower halves of the Dirac cone.
","[{""version"":""v1"",""created"":""Sat, 16 Jan 2010 04:01:33 GMT""}]","2010-01-19"
"1001.2805","Mortuza Ali","Mortuza Ali and Margreta Kuijper","Source Coding With Side Information Using List Decoding",,,,,"cs.IT math.IT","http://creativecommons.org/licenses/by-nc-sa/3.0/","  The problem of source coding with side information (SCSI) is closely related
to channel coding. Therefore, existing literature focuses on using the most
successful channel codes namely, LDPC codes, turbo codes, and their variants,
to solve this problem assuming classical unique decoding of the underlying
channel code. In this paper, in contrast to classical decoding, we have taken
the list decoding approach. We show that syndrome source coding using list
decoding can achieve the theoretical limit. We argue that, as opposed to
channel coding, the correct sequence from the list produced by the list decoder
can effectively be recovered in case of SCSI, since we are dealing with a
virtual noisy channel rather than a real noisy channel. Finally, we present a
guideline for designing constructive SCSI schemes using Reed Solomon code, BCH
code, and Reed-Muller code, which are the known list-decodable codes.
","[{""version"":""v1"",""created"":""Sat, 16 Jan 2010 04:59:23 GMT""}]","2010-01-19"
"1001.2808","George Savvidy K","George Savvidy","Topological mass generation in four-dimensional gauge theory","18 pages, Note added addressing the question of minimal number of
  derivarives in the cubic vertices for high spin fields, references added","Phys.Lett.B694:65-73,2010","10.1016/j.physletb.2010.09.036","NRCPS-HE-10-01","hep-th","http://arxiv.org/licenses/nonexclusive-distrib/1.0/","  The Lagrangian of non-Abelian tensor gauge fields describes the interaction
of the Yang-Mills and massless tensor bosons of increasing helicities. We have
found a metric-independent gauge invariant density which is a four-dimensional
analog of the Chern-Simons density. The Lagrangian augmented by this
Chern-Simons-like invariant describes massive Yang-Mills boson, providing a
gauge-invariant mass gap for a four-dimensional gauge field theory. We present
invariant densities which can provide masses to the high rank tensor bosons.
","[{""version"":""v1"",""created"":""Sat, 16 Jan 2010 12:43:21 GMT""},{""version"":""v2"",""created"":""Fri, 12 Nov 2010 14:50:31 GMT""},{""version"":""v3"",""created"":""Sun, 25 Oct 2020 13:49:41 GMT""}]","2020-10-27"
