"1001.2760","Charles Suggs","C. Chamon, R. Jackiw, Y. Nishida, S.-Y. Pi, L. Santos","Quantizing Majorana Fermions in a Superconductor","26 pages, no figures","Phys.Rev.B81:224515,2010","10.1103/PhysRevB.81.224515","CTP-MIT 4108","cond-mat.str-el hep-th","http://arxiv.org/licenses/nonexclusive-distrib/1.0/","  A Dirac-type matrix equation governs surface excitations in a topological
insulator in contact with an s-wave superconductor. The order parameter can be
homogenous or vortex valued. In the homogenous case a winding number can be
defined whose non-vanishing value signals topological effects. A vortex leads
to a static, isolated, zero energy solution. Its mode function is real, and has
been called ""Majorana."" Here we demonstrate that the reality/Majorana feature
is not confined to the zero energy mode, but characterizes the full quantum
field. In a four-component description a change of basis for the relevant
matrices renders the Hamiltonian imaginary and the full, space-time dependent
field is real, as is the case for the relativistic Majorana equation in the
Majorana matrix representation. More broadly, we show that the Majorana
quantization procedure is generic to superconductors, with or without the Dirac
structure, and follows from the constraints of fermionic statistics on the
symmetries of Bogoliubov-de Gennes Hamiltonians. The Hamiltonian can always be
brought to an imaginary form, leading to equations of motion that are real with
quantized real field solutions. Also we examine the Fock space realization of
the zero mode algebra for the Dirac-type systems. We show that a
two-dimensional representation is natural, in which fermion parity is
preserved.
","[{""version"":""v1"",""created"":""Fri, 15 Jan 2010 20:36:01 GMT""},{""version"":""v2"",""created"":""Mon, 12 Sep 2011 14:01:54 GMT""}]","2011-09-13"
"1001.2761","Graeme Milton","Graeme W. Milton","Realizability of metamaterials with prescribed electric permittivity and
  magnetic permeability tensors","12 pages, no figures",,"10.1088/1367-2630/12/3/033035",,"physics.optics","http://arxiv.org/licenses/nonexclusive-distrib/1.0/","  We show that any pair of real symmetric tensors $\BGve$ and $\BGm$ can be
realized as the effective electric permittivity and effective magnetic
permeability of a metamaterial at a given fixed frequency. The construction
starts with two extremely low loss metamaterials, with arbitrarily small
microstructure, whose existence is ensured by the work of Bouchitt{\'e} and
Bourel and Bouchitt\'e and Schweizer, one having at the given frequency a
permittivity tensor with exactly one negative eigenvalue, and a positive
permeability tensor, and the other having a positive permittivity tensor, and a
permeability tensor having exactly one negative eigenvalue. To achieve the
desired effective properties these materials are laminated together in a
hierarchical multiple rank laminate structure, with widely separated length
scales, and varying directions of lamination, but with the largest length scale
still much shorter than the wavelengths and attenuation lengths in the
macroscopic effective medium.
","[{""version"":""v1"",""created"":""Fri, 15 Jan 2010 20:52:00 GMT""}]","2015-05-18"
"1001.2762","Xue Feng Wang","Xue-Feng Wang and Tapash Chakraborty","Coulomb screening and collective excitations in biased bilayer graphene","4 pages, 4 figures","Phys. Rev. B 81, 081402(R) (2010).","10.1103/PhysRevB.81.081402",,"cond-mat.mes-hall","http://arxiv.org/licenses/nonexclusive-distrib/1.0/","  We have investigated the Coulomb screening properties and plasmon spectrum in
a bilayer graphene under a perpendicular electric bias. The bias voltage
applied between the two graphene layers opens a gap in the single particle
energy spectrum and modifies the many-body correlations and collective
excitations. The energy gap can soften the plasmon modes and lead to a
crossover of the plasmons from a Landau damped mode to being undamped. Plasmon
modes of long lifetime may be observable in experiments and may have potentials
for device applications.
","[{""version"":""v1"",""created"":""Fri, 15 Jan 2010 20:34:42 GMT""}]","2010-02-04"
"1001.2763","Pat Morin","Prosenjit Bose, Luc Devroye, Karim Douieb, Vida Dujmovic, James King,
  and Pat Morin","Point Location in Disconnected Planar Subdivisions",,,,,"cs.CG","http://arxiv.org/licenses/nonexclusive-distrib/1.0/","  Let $G$ be a (possibly disconnected) planar subdivision and let $D$ be a
probability measure over $\R^2$. The current paper shows how to preprocess
$(G,D)$ into an O(n) size data structure that can answer planar point location
queries over $G$. The expected query time of this data structure, for a query
point drawn according to $D$, is $O(H+1)$, where $H$ is a lower bound on the
expected query time of any linear decision tree for point location in $G$. This
extends the results of Collette et al (2008, 2009) from connected planar
subdivisions to disconnected planar subdivisions. A version of this structure,
when combined with existing results on succinct point location, provides a
succinct distribution-sensitive point location structure.
","[{""version"":""v1"",""created"":""Fri, 15 Jan 2010 20:41:20 GMT""}]","2010-01-18"
"1001.2764","Paul Terwilliger","Tatsuro Ito and Paul Terwilliger","Double Affine Hecke Algebras of Rank 1 and the $Z_3$-Symmetric
  Askey-Wilson Relations",,"SIGMA 6 (2010), 065, 9 pages","10.3842/SIGMA.2010.065",,"math.RA math.QA","http://creativecommons.org/licenses/by-nc-sa/3.0/","  We consider the double affine Hecke algebra
$H=H(k_0,k_1,k^\vee_0,k^\vee_1;q)$ associated with the root system
$(C^\vee_1,C_1)$. We display three elements $x$, $y$, $z$ in $H$ that satisfy
essentially the $Z_3$-symmetric Askey-Wilson relations. We obtain the relations
as follows. We work with an algebra $\hat H$ that is more general than $H$,
called the universal double affine Hecke algebra of type $(C_1^\vee,C_1)$. An
advantage of $\hat H$ over $H$ is that it is parameter free and has a larger
automorphism group. We give a surjective algebra homomorphism ${\hat H} \to H$.
We define some elements $x$, $y$, $z$ in $\hat H$ that get mapped to their
counterparts in $H$ by this homomorphism. We give an action of Artin's braid
group $B_3$ on $\hat H$ that acts nicely on the elements $x$, $y$, $z$; one
generator sends $x\mapsto y\mapsto z \mapsto x$ and another generator
interchanges $x$, $y$. Using the $B_3$ action we show that the elements $x$,
$y$, $z$ in $\hat H$ satisfy three equations that resemble the $Z_3$-symmetric
Askey-Wilson relations. Applying the homomorphism ${\hat H}\to H$ we find that
the elements $x$, $y$, $z$ in $H$ satisfy similar relations.
","[{""version"":""v1"",""created"":""Fri, 15 Jan 2010 20:42:33 GMT""},{""version"":""v2"",""created"":""Tue, 17 Aug 2010 05:38:30 GMT""}]","2010-08-18"
"1001.2765","Jinmyung Choi","Jinmyung Choi and K.A. Muttalib","Two-level correlation function of $\lambda$-ensembles","This paper has been withdrawn by the authors because more accurate
  results have been obtained, which is shown in arXiv:1006.1141",,,,"cond-mat.stat-mech","http://arxiv.org/licenses/nonexclusive-distrib/1.0/","  Recently we introduced a family of U(N) invariant random matrix ensembles
which is a one-paramter ($\lambda$) extension of the q-random matrix ensembles
(RMEs), given by the asymptotic weak confining potential $V(H) \sim [\ln
H]^{(1+\lambda)}$ \cite{cm-jpa09}. With numerical construction of the
corresponding orthogonal polynomials, we showed that the eigenvalue density of
the ensembles deviates from the inverse power law and that the two-level kernel
of the ensembles is qualitatively different from those of Gaussian and the
critical ensembles. In this work, we make further efforts to characterize the
two-level kernel of the $\lambda$-ensembles and discuss its various properties.
To this end, we first show that the kernel of the $\lambda$-ensembles also
possess an anomalous structure characteristic of the critical ensembles, namely
the ghost correlation peak. We then propose, albeit in a restricted regime, a
form of the two-level kernel which is distinct from the sine kernel of the
Gaussian ensembles as well as the sinh kernel of the critical ensembles. We
test the proposed form numerically and discuss its implications. In particular,
we show that the case $\lambda > 1$ is qualitatively distinct from the case
$\lambda <1$, the latter decribing true fat-tail ensembles.
","[{""version"":""v1"",""created"":""Fri, 15 Jan 2010 20:51:01 GMT""},{""version"":""v2"",""created"":""Wed, 9 Jun 2010 20:46:41 GMT""}]","2010-06-11"
"1001.2766","Seyed Hamed  Hassani","S. Hamed Hassani, Rudiger Urbanke","On the scaling of Polar codes: I. The behavior of polarized channels","Submitted to ISIT 2010",,,,"cs.IT math.IT","http://arxiv.org/licenses/nonexclusive-distrib/1.0/","  We consider the asymptotic behavior of the polarization process for polar
codes when the blocklength tends to infinity. In particular, we study the
problem of asymptotic analysis of the cumulative distribution $\mathbb{P}(Z_n
\leq z)$, where $Z_n=Z(W_n)$ is the Bhattacharyya process, and its dependence
to the rate of transmission R. We show that for a BMS channel $W$, for $R <
I(W)$ we have $\lim_{n \to \infty} \mathbb{P} (Z_n \leq
2^{-2^{\frac{n}{2}+\sqrt{n} \frac{Q^{-1}(\frac{R}{I(W)})}{2} +o(\sqrt{n})}}) =
R$ and for $R<1- I(W)$ we have $\lim_{n \to \infty} \mathbb{P} (Z_n \geq
1-2^{-2^{\frac{n}{2}+ \sqrt{n} \frac{Q^{-1}(\frac{R}{1-I(W)})}{2}
+o(\sqrt{n})}}) = R$, where $Q(x)$ is the probability that a standard normal
random variable will obtain a value larger than $x$. As a result, if we denote
by $\mathbb{P}_e ^{\text{SC}}(n,R)$ the probability of error using polar codes
of block-length $N=2^n$ and rate $R<I(W)$ under successive cancellation
decoding, then $\log(-\log(\mathbb{P}_e ^{\text{SC}}(n,R)))$ scales as
$\frac{n}{2}+\sqrt{n}\frac{Q^{-1}(\frac{R}{I(W)})}{2}+ o(\sqrt{n})$. We also
prove that the same result holds for the block error probability using the MAP
decoder, i.e., for $\log(-\log(\mathbb{P}_e ^{\text{MAP}}(n,R)))$.
","[{""version"":""v1"",""created"":""Fri, 15 Jan 2010 20:54:17 GMT""},{""version"":""v2"",""created"":""Fri, 15 Jan 2010 22:19:37 GMT""},{""version"":""v3"",""created"":""Thu, 28 Jan 2010 18:11:42 GMT""}]","2010-01-28"
"1001.2767","Mangesh Gupte","Mangesh Gupte and Mukund Sundararajan","Universally Optimal Privacy Mechanisms for Minimax Agents",,,,,"cs.CR cs.DB cs.DS","http://arxiv.org/licenses/nonexclusive-distrib/1.0/","  A scheme that publishes aggregate information about sensitive data must
resolve the trade-off between utility to information consumers and privacy of
the database participants. Differential privacy is a well-established
definition of privacy--this is a universal guarantee against all attackers,
whatever their side-information or intent. In this paper, we present a
universal treatment of utility based on the standard minimax rule from decision
theory (in contrast to the utility model in, which is Bayesian). In our model,
information consumers are minimax (risk-averse) agents, each possessing some
side-information about the query, and each endowed with a loss-function which
models their tolerance to inaccuracies. Further, information consumers are
rational in the sense that they actively combine information from the mechanism
with their side-information in a way that minimizes their loss. Under this
assumption of rational behavior, we show that for every fixed count query, a
certain geometric mechanism is universally optimal for all minimax information
consumers. Additionally, our solution makes it possible to release query
results at multiple levels of privacy in a collusion-resistant manner.
","[{""version"":""v1"",""created"":""Fri, 15 Jan 2010 20:56:37 GMT""}]","2010-01-18"
"1001.2768","William Detmold","William Detmold, Martin J. Savage","A method to study complex systems of mesons in Lattice QCD","JLAB-THY-10-1121, NT@UW-10-01, journal version","Phys.Rev.D82:014511,2010","10.1103/PhysRevD.82.014511",,"hep-lat","http://arxiv.org/licenses/nonexclusive-distrib/1.0/","  Finite density systems can be explored with Lattice QCD through the
calculation of multi-hadron correlation functions. Recently, systems with up to
12 $\pi^+$'s or $K^+$'s have been studied to determine the 3-$\pi^+$ and
3-$K^+$ interactions, and the corresponding chemical potentials have been
determined as a function of density. We derive recursion relations between
correlation functions that allow this work to be extended to systems of
arbitrary numbers of mesons and to systems containing many different types of
mesons, such as $\pi^+$'s, $K^+$'s, $\bar{D}^0$'s and $B^+$'s. These relations
allow for the study of finite-density systems in arbitrary volumes, and for the
study of high-density systems.
","[{""version"":""v1"",""created"":""Fri, 15 Jan 2010 20:59:20 GMT""},{""version"":""v2"",""created"":""Fri, 13 Aug 2010 16:08:17 GMT""}]","2010-08-16"
"1001.2769","Steffen Mieske","S. Mieske, A. Jordan, P. Cote, E. Peng, L. Ferrarese, J. Blakeslee, S.
  Mei, H. Baumgardt, J. Tonry, L. Infante, M. West","The ACS Fornax Cluster Survey. IX. The Color-Magnitude Relation of
  Globular Cluster Systems",,,"10.1088/0004-637X/710/2/1672",,"astro-ph.CO","http://arxiv.org/licenses/nonexclusive-distrib/1.0/","  We investigate the color-magnitude relation for globular clusters (GCs) --
the so-called ""blue tilt"" -- detected in the ACS Fornax Cluster Survey and
using the combined sample of GCs from the ACS Fornax and Virgo Cluster Surveys.
We find a tilt of gamma_z=d(g-z)/dz=-0.0257 +- 0.0050 for the full GC sample of
the Fornax Cluster Survey (~5800 GCs). This is slightly shallower than the
value gamma_z=-0.0459 +- 0.0048 found for the Virgo Cluster Survey GC sample
(~11100 GCs). The slope for the merged Fornax and Virgo datasets (~16900 GCs)
is gamma_z=-0.0293 +- 0.0085, corresponding to a mass-metallicity relation of Z
~ M^0.43. We find that the blue tilt sets in at GC masses in excess of M ~
2*10^5 M_sun. The tilt is stronger for GCs belonging to high-mass galaxies (M_*
> 5 * 10^10 M_sun) than for those in low-mass galaxies (M_* < 5 * 10^10 M_sun).
It is also more pronounced for GCs with smaller galactocentric distances. Our
findings suggest a range of mass-metallicity relations Z_GC ~ M_GC^(0.3-0.7)
which vary as a function of host galaxy mass/luminosity. We compare our
observations to a recent model of star cluster self-enrichment with generally
favorable results. We suggest that, within the context of this model, the
proto-cluster clouds out of which the GCs formed may have had density profiles
slightly steeper than isothermal and/or star formation efficiencies somewhat
below 0.3. We caution, however, that the significantly different appearance of
the CMDs defined by the GC systems associated with galaxies of similar mass and
morphological type pose a challenge to any single mechanism that seeks to
explain the blue tilt. We therefore suggest that the merger/accretion histories
of individual galaxies have played a non-negligible role determining the
distribution of GCs in the CMDs of individual GC systems.
","[{""version"":""v1"",""created"":""Fri, 15 Jan 2010 21:00:09 GMT""}]","2015-05-18"
"1001.2770","Kenneth Burch","R. Bouskila, R. McAloney, S. Mack, D.D. Awschalom, M.C. Goh, K.S.
  Burch","One-Dimensional Alignment of Nanoparticles Via Magnetic Sorting","11 pages, 5 figures. submitted to Nanoletters",,"10.1063/1.3405732",,"cond-mat.mes-hall cond-mat.mtrl-sci","http://arxiv.org/licenses/nonexclusive-distrib/1.0/","  Near room temperature, thin films of MnAs spontaneously align into two
phases, one ferromagnetic and the other paramagnetic. These two phases take the
intriguing form of nanoscale ""wires."" In this experiment, we investigate the
spontaneous formation of ordered linear arrays of magnetite nanoparticles on
MnAs thin films using scanning probe microscopy.
","[{""version"":""v1"",""created"":""Fri, 15 Jan 2010 21:00:21 GMT""}]","2015-05-18"
"1001.2771","Aleksander Sadowski","Aleksander Sadowski, Marek Sikora","Launching of jets by cold, magnetized disks in Kerr Metric","7 pages, 8 figures, submitted to ""A&A"", revised references",,"10.1051/0004-6361/201014076",,"astro-ph.HE","http://arxiv.org/licenses/nonexclusive-distrib/1.0/","  We confirm recent discovery by Cao that in the vicinity of fast rotating
black holes jets can be launched centrifugally by cold, magnetized disks even
for nearly vertically shaped magnetic flux surfaces. Outflows produced under
such extreme conditions are investigated via studying kinematics of test
particles in the force-free magnetosphere approximation. Implications of a
possibility of magneto-centrifugal launching of very well collimated central
outflows around the fast rotating black holes are discussed in the general
context of the jet formation scenarios in AGNs.
","[{""version"":""v1"",""created"":""Fri, 15 Jan 2010 21:04:40 GMT""},{""version"":""v2"",""created"":""Wed, 20 Jan 2010 13:06:00 GMT""}]","2015-05-18"
"1001.2772","Carrie Bridge","Carrie R. Bridge, Raymond G. Carlberg and Mark Sullivan","The CFHTLS Deep Catalog of Interacting Galaxies I. Merger Rate Evolution
  to z=1.2","e.g.: 17 pages, 14 figures, accepted for publication in ApJ","Astrophysical Journal 709 (2010) 1067-1082","10.1088/0004-637X/709/2/1067",,"astro-ph.CO","http://arxiv.org/licenses/nonexclusive-distrib/1.0/","  We present the rest-frame optical galaxy merger fraction between 0.2<z<1.2,
as a function of stellar mass and optical luminosity, as observed by the
Canada-France-Hawaii Telescope Legacy Deep Survey (CFHTLS-Deep). We developed a
new classification scheme to identify major galaxy-galaxy mergers based on the
presence of tidal tails and bridges. These morphological features are signposts
of recent and ongoing merger activity. Through the visual classification of all
galaxies, down to i_vega<22.2 (~27,000 galaxies) over 2 square degrees, we have
compiled the CFHTLS Deep Catalog of Interacting Galaxies, with ~1600 merging
galaxies. We find the merger fraction to be 4.3% +/-0.3% at z~0.3 and 19.0%
+/-2.5% at z~1, implying evolution of the merger fraction going as (1+z)^m,
with m=2.25 +/-0.24. This result is inconsistent with a mild or non-evolving
(m<1.5) scenario at a >4sigma level of confidence. A mild trend, where massive
galaxies with M>10^10.7 M_sun are undergoing fewer mergers than less massive
systems M~10^10 M_sun), consistent with the expectations of galaxy assembly
downsizing is observed. Our results also show that interacting galaxies have on
average SFRs double that found in non-interacting field galaxies. We conclude
that (1) the optical galaxy merger fraction does evolve with redshift, (2) the
merger fraction depends mildly on stellar mass, with lower mass galaxies having
higher merger fractions at z<1, and (3) star formation is triggered at all
phases of a merger, with larger enhancements at later stages, consistent with
N-body simulations.
","[{""version"":""v1"",""created"":""Fri, 15 Jan 2010 21:29:12 GMT""}]","2015-05-18"
"1001.2773","Graeme Milton","Graeme W. Milton and John R. Willis","Minimum variational principles for time-harmonic waves in a dissipative
  medium and associated variational principles of Hashin--Shtrikman type","23 pages 0 figures",,"10.1098/rspa.2010.0006",,"math-ph math.MP","http://arxiv.org/licenses/nonexclusive-distrib/1.0/","  Minimization variational principles for linear elastodynamic, acoustic, or
electromagnetic time-harmonic waves in dissipative media were obtained by
Milton, Seppecher and Bouchitt\'e generalizing the quasistatic variational
principles of Cherkaev and Gibiansky. Here a further generalization is made to
allow for a much wider variety of boundary conditions, and in particular
Dirichlet and Neumann boundary conditions. In addition minimization or
maximization principles of the Hashin-Shtrikman type, incorporating
""polarization fields"", are developed.
","[{""version"":""v1"",""created"":""Fri, 15 Jan 2010 21:06:42 GMT""}]","2015-05-18"
"1001.2775","Ryan Chornock","R. Chornock, A. V. Filippenko, W. Li, G. H. Marion, R. J. Foley, M.
  Modjaz, M. Rafelski, G. D. Becker, W. H. de Vries, P. Garnavich, R. A.
  Jorgenson, D. K. Lynch, A. L. Malec, E. C. Moran, M. T. Murphy, R. J. Rudy,
  R. W. Russell, J. M. Silverman, T. N. Steele, A. Stockton, A. M. Wolfe, C. E.
  Woodward","The Transitional Stripped-Envelope SN 2008ax: Spectral Evolution and
  Evidence for Large Asphericity","24 pages, 21 figures, 4 tables, appendix, minor revisions to match
  version accepted by ApJ",,"10.1088/0004-637X/739/1/41",,"astro-ph.SR astro-ph.CO","http://arxiv.org/licenses/nonexclusive-distrib/1.0/","  Supernova (SN) 2008ax in NGC 4490 was discovered within hours after shock
breakout, presenting the rare opportunity to study a core-collapse SN beginning
with the initial envelope-cooling phase immediately following shock breakout.
We present an extensive sequence of optical and near-infrared spectra, as well
as three epochs of optical spectropolarimetry. Our initial spectra, taken two
days after shock breakout, are dominated by hydrogen Balmer lines at high
velocity. However, by maximum light, He I lines dominated the optical and
near-infrared spectra, which closely resembled those of normal Type Ib
supernovae (SNe Ib) such as SN 1999ex. This spectroscopic transition defines
Type IIb supernovae, but the strong similarity of SN 2008ax to normal SNe Ib
beginning near maximum light, including an absorption feature near 6270A due to
H-alpha at high velocities, suggests that many objects classified as SNe Ib in
the literature may have ejected similar amounts of hydrogen as SN 2008ax,
roughly a few x 0.01 M_sun. Early-time spectropolarimetry (6 and 9 days after
shock breakout) revealed strong line polarization modulations of 3.4% across
H-alpha, indicating the presence of large asphericities in the outer ejecta.
The continuum shares a common polarization angle with the hydrogen, helium, and
oxygen lines, while the calcium and iron absorptions are oriented at different
angles. This is clear evidence of deviations from axisymmetry even in the outer
ejecta. Intrinsic continuum polarization of 0.64% only nine days after shock
breakout shows that the outer layers of the ejecta were quite aspherical. A
single epoch of late-time spectropolarimetry, as well as the shapes of the
nebular line profiles, demonstrate that asphericities extended from the
outermost layers all the way down to the center of this SN. [Abridged]
","[{""version"":""v1"",""created"":""Sat, 16 Jan 2010 06:51:55 GMT""},{""version"":""v2"",""created"":""Thu, 7 Jul 2011 19:11:57 GMT""}]","2015-05-18"
"1001.2777","Frank H. Lutz","Frank H. Lutz, Thom Sulanke, Anand K. Tiwari, Ashish K. Upadhyay","Equivelar and d-Covered Triangulations of Surfaces. I","21 pages, 4 figures",,,,"math.CO math.GT","http://arxiv.org/licenses/nonexclusive-distrib/1.0/","  We survey basic properties and bounds for $q$-equivelar and $d$-covered
triangulations of closed surfaces. Included in the survey is a list of the
known sources for $q$-equivelar and $d$-covered triangulations. We identify all
orientable and non-orientable surfaces $M$ of Euler characteristic
$0>\chi(M)\geq -230$ which admit non-neighborly $q$-equivelar triangulations
with equality in the upper bound
$q\leq\Bigl\lfloor\tfrac{1}{2}(5+\sqrt{49-24\chi (M)})\Bigl\rfloor$. These
examples give rise to $d$-covered triangulations with equality in the upper
bound $d\leq2\Bigl\lfloor\tfrac{1}{2}(5+\sqrt{49-24\chi (M)})\Bigl\rfloor$. A
generalization of Ringel's cyclic $7{\rm mod}12$ series of neighborly
orientable triangulations to a two-parameter family of cyclic orientable
triangulations $R_{k,n}$, $k\geq 0$, $n\geq 7+12k$, is the main result of this
paper. In particular, the two infinite subseries $R_{k,7+12k+1}$ and
$R_{k,7+12k+2}$, $k\geq 1$, provide non-neighborly examples with equality for
the upper bound for $q$ as well as derived examples with equality for the upper
bound for $d$.
","[{""version"":""v1"",""created"":""Fri, 15 Jan 2010 21:54:23 GMT""}]","2010-01-19"
"1001.2778","Michalis Vafopoulos n","Michalis Vafopoulos, Efstathios Amarantidis, Ioannis Antoniou","Modeling Web Evolution","15 pages, 7 figures",,,,"cs.NI cs.CC","http://arxiv.org/licenses/nonexclusive-distrib/1.0/","  The Web is the largest human information construct in history transforming
our society. How can we understand, measure and model the Web evolution in
order to design effective policies and optimize its social benefit? Early
measurements of the Internet traffic and the Web graph indicated the scale-free
structure of the Web and other Complex Networks. Going a step further
Kouroupas, Koutsoupias, Papadimitriou and Sideri (KKPS) presented an
economic-inspired model which explains the scale-free behavior as the
interaction of Documents, Users and Search engines. The purpose of this paper
is to clarify the open issues arising within the KKPS model through analysis
and simulations and to highlight future research developments in Web modeling,
which is the backbone of Web Science.
","[{""version"":""v1"",""created"":""Fri, 15 Jan 2010 21:46:46 GMT""}]","2010-01-19"
"1001.2779","Frank H. Lutz","Frank H. Lutz","Equivelar and d-Covered Triangulations of Surfaces. II. Cyclic
  Triangulations and Tessellations","27 pages, 18 figures",,,,"math.CO math.GT","http://arxiv.org/licenses/nonexclusive-distrib/1.0/","  With the $[0,1,2]$-family of cyclic triangulations we introduce a rich class
of vertex-transitive triangulations of surfaces. In particular, there are
infinite series of cyclic $q$-equivelar triangulations of orientable and
non-orientable surfaces for every $q=3k$, $k\geq 2$, and every $q=3k+1$, $k\geq
3$. Series of cyclic tessellations of surfaces are derived from these
triangulated series.
","[{""version"":""v1"",""created"":""Fri, 15 Jan 2010 21:56:14 GMT""}]","2010-01-19"
