"1001.2745","Manuel Calder\'on de la Barca S\'anchez","STAR Collaboration: B. I. Abelev, M. M. Aggarwal, Z. Ahammed, A. V.
  Alakhverdyants, B. D. Anderson, D. Arkhipkin, G. S. Averichev, J. Balewski,
  L. S. Barnby, S. Baumgart, D. R. Beavis, R. Bellwied, M. J. Betancourt, R. R.
  Betts, A. Bhasin, A. K. Bhati, H. Bichsel, J. Bielcik, J. Bielcikova, B.
  Biritz, L. C. Bland, B. E. Bonner, J. Bouchet, E. Braidot, A. V. Brandin, A.
  Bridgeman, E. Bruna, S. Bueltmann, I. Bunzarov, T. P. Burton, X. Z. Cai, H.
  Caines, M. Calder\'on de la Barca S\'anchez, O. Catu, D. Cebra, R. Cendejas,
  M. C. Cervantes, Z. Chajecki, P. Chaloupka, S. Chattopadhyay, H. F. Chen, J.
  H. Chen, J. Y. Chen, J. Cheng, M. Cherney, A. Chikanian, K. E. Choi, W.
  Christie, P. Chung, R. F. Clarke, M. J. M. Codrington, R. Corliss, J. G.
  Cramer, H. J. Crawford, D. Das, S. Dash, A. Davila Leyva, L. C. De Silva, R.
  R. Debbe, T. G. Dedovich, M. DePhillips, A. A. Derevschikov, R. Derradi de
  Souza, L. Didenko, P. Djawotho, S. M. Dogra, X. Dong, J. L. Drachenberg, J.
  E. Draper, J. C. Dunlop, M. R. Dutta Mazumdar, L. G. Efimov, E. Elhalhuli, M.
  Elnimr, J. Engelage, G. Eppley, B. Erazmus, M. Estienne, L. Eun, O.
  Evdokimov, P. Fachini, R. Fatemi, J. Fedorisin, R. G. Fersch, P. Filip, E.
  Finch, V. Fine, Y. Fisyak, C. A. Gagliardi, D. R. Gangadharan, M. S. Ganti,
  E. J. Garcia-Solis, A. Geromitsos, F. Geurts, V. Ghazikhanian, P. Ghosh, Y.
  N. Gorbunov, A. Gordon, O. Grebenyuk, D. Grosnick, B. Grube, S. M. Guertin,
  A. Gupta, N. Gupta, W. Guryn, B. Haag, T. J. Hallman, A. Hamed, L-X. Han, J.
  W. Harris, J. P. Hays-Wehle, M. Heinz, S. Heppelmann, A. Hirsch, E. Hjort, A.
  M. Hoffman, G. W. Hoffmann, D. J. Hofman, R. S. Hollis, H. Z. Huang, T. J.
  Humanic, L. Huo, G. Igo, A. Iordanova, P. Jacobs, W. W. Jacobs, P. Jakl, C.
  Jena, F. Jin, C. L. Jones, P. G. Jones, J. Joseph, E. G. Judd, S. Kabana, K.
  Kajimoto, K. Kang, J. Kapitan, K. Kauder, D. Keane, A. Kechechyan, D.
  Kettler, D. P. Kikola, J. Kiryluk, A. Kisiel, A. G. Knospe, A. Kocoloski, D.
  D. Koetke, T. Kollegger, J. Konzer, M. Kopytine, I. Koralt, W. Korsch, L.
  Kotchenda, V. Kouchpil, P. Kravtsov, K. Krueger, M. Krus, L. Kumar, P.
  Kurnadi, M. A. C. Lamont, J. M. Landgraf, S. LaPointe, J. Lauret, A. Lebedev,
  R. Lednicky, C-H. Lee, J. H. Lee, W. Leight, M. J. LeVine, C. Li, L. Li, N.
  Li, W. Li, X. Li, X. Li, Y. Li, Z. Li, G. Lin, S. J. Lindenbaum, M. A. Lisa,
  F. Liu, H. Liu, J. Liu, T. Ljubicic, W. J. Llope, R. S. Longacre, W. A. Love,
  Y. Lu, G. L. Ma, Y. G. Ma, D. P. Mahapatra, R. Majka, O. I. Mall, L. K.
  Mangotra, R. Manweiler, S. Margetis, C. Markert, H. Masui, H. S. Matis, Yu.
  A. Matulenko, D. McDonald, T. S. McShane, A. Meschanin, R. Milner, N. G.
  Minaev, S. Mioduszewski, A. Mischke, M. K. Mitrovski, B. Mohanty, M. M.
  Mondal, D. A. Morozov, M. G. Munhoz, B. K. Nandi, C. Nattrass, T. K. Nayak,
  J. M. Nelson, P. K. Netrakanti, M. J. Ng, L. V. Nogach, S. B. Nurushev, G.
  Odyniec, A. Ogawa, H. Okada, V. Okorokov, D. Olson, M. Pachr, B. S. Page, S.
  K. Pal, Y. Pandit, Y. Panebratsev, T. Pawlak, T. Peitzmann, V.
  Perevoztchikov, C. Perkins, W. Peryt, S. C. Phatak, P. Pile, M. Planinic, M.
  A. Ploskon, J. Pluta, D. Plyku, N. Poljak, A. M. Poskanzer, B. V. K. S.
  Potukuchi, C. B. Powell, D. Prindle, C. Pruneau, N. K. Pruthi, P. R.
  Pujahari, J. Putschke, R. Raniwala, S. Raniwala, R. L. Ray, R. Redwine, R.
  Reed, J. M. Rehberg, H. G. Ritter, J. B. Roberts, O. V. Rogachevskiy, J. L.
  Romero, A. Rose, C. Roy, L. Ruan, R. Sahoo, S. Sakai, I. Sakrejda, T. Sakuma,
  S. Salur, J. Sandweiss, E. Sangaline, J. Schambach, R. P. Scharenberg, N.
  Schmitz, T. R. Schuster, J. Seele, J. Seger, I. Selyuzhenkov, P. Seyboth, E.
  Shahaliev, M. Shao, M. Sharma, S. S. Shi, E. P. Sichtermann, F. Simon, R. N.
  Singaraju, M. J. Skoby, N. Smirnov, P. Sorensen, J. Sowinski, H. M. Spinka,
  B. Srivastava, T. D. S. Stanislaus, D. Staszak, J. R. Stevens, R. Stock, M.
  Strikhanov, B. Stringfellow, A. A. P. Suaide, M. C. Suarez, N. L. Subba, M.
  Sumbera, X. M. Sun, Y. Sun, Z. Sun, B. Surrow, T. J. M. Symons, A. Szanto de
  Toledo, J. Takahashi, A. H. Tang, Z. Tang, L. H. Tarini, T. Tarnowsky, D.
  Thein, J. H. Thomas, J. Tian, A. R. Timmins, S. Timoshenko, D. Tlusty, M.
  Tokarev, T. A. Trainor, V. N. Tram, S. Trentalange, R. E. Tribble, O. D.
  Tsai, J. Ulery, T. Ullrich, D. G. Underwood, G. Van Buren, M. van Leeuwen, G.
  van Nieuwenhuizen, J. A. Vanfossen Jr., R. Varma, G. M. S. Vasconcelos, A. N.
  Vasiliev, F. Videbaek, Y. P. Viyogi, S. Vokal, S. A. Voloshin, M. Wada, M.
  Walker, F. Wang, G. Wang, H. Wang, J. S. Wang, Q. Wang, X. L. Wang, Y. Wang,
  G. Webb, J. C. Webb, G. D. Westfall, C. Whitten Jr., H. Wieman, E. Wingfield,
  S. W. Wissink, R. Witt, Y. Wu, W. Xie, N. Xu, Q. H. Xu, W. Xu, Y. Xu, Z. Xu,
  L. Xue, Y. Yang, P. Yepes, K. Yip, I-K. Yoo, Q. Yue, M. Zawisza, H.
  Zbroszczyk, W. Zhan, S. Zhang, W. M. Zhang, X. P. Zhang, Y. Zhang, Z. P.
  Zhang, J. Zhao, C. Zhong, J. Zhou, W. Zhou, X. Zhu, Y. H. Zhu, R.
  Zoulkarneev, Y. Zoulkarneeva","Upsilon cross section in p+p collisions at sqrt(s) = 200 GeV","17 pages, 14 figures, STAR Collaboration","Phys.Rev.D82:012004,2010","10.1103/PhysRevD.82.012004",,"nucl-ex","http://arxiv.org/licenses/nonexclusive-distrib/1.0/","  We report on a measurement of the Upsilon(1S+2S+3S) -> e+e- cross section at
midrapidity in p+p collisions at sqrt(s)=200 GeV. We find the cross section to
be 114 +/- 38 (stat.) +23,-24 (syst.) pb. Perturbative QCD calculations at
next-to-leading order in the Color Evaporation Model are in agreement with our
measurement, while calculations in the Color Singlet Model underestimate it by
2 sigma. Our result is consistent with the trend seen in world data as a
function of the center-of-mass energy of the collision and extends the
availability of Upsilon data to RHIC energies. The dielectron continuum in the
invariant mass range near the Upsilon is also studied to obtain a combined
cross section of Drell-Yan plus (b b-bar) -> e+e-.
","[{""version"":""v1"",""created"":""Fri, 15 Jan 2010 17:40:04 GMT""},{""version"":""v2"",""created"":""Mon, 10 May 2010 19:29:51 GMT""}]","2010-08-04"
"1001.2746","Jacobo Ruiz de Elvira","J. Ruiz de Elvira, J.R. Pelaez, M.R. Pennington, D.J. Wilson","Structure of the lightest scalar meson from the 1/Nc expansion of
  Unitarized Chiral Perturbation Theory and Regge Theory","To appear in the Proceedings of the Hadron09 International
  Conference. 29th Nov-4th Dec. 2009. Tallahassee, FL, USA. 5 pages",,"10.1063/1.3483373",,"hep-ph","http://arxiv.org/licenses/nonexclusive-distrib/1.0/","  One-loop unitarized Chiral Perturbation Theory (UChPT) calculations, suggest
a different Nc behaviour for the sigma or f_0(600) and rho(770) mesons: while
the rho meson becomes narrower with Nc, as is expected for a q-qbar meson, the
sigma becomes broader, and its contribution to the total cross section is less
and less important. On the other hand, local duality requires a cancellation
between the sigma and rho amplitudes, but if there is a different Nc behaviour
for them, there is a possible contradiction between the Inverse Amplitude
Method (IAM) and local duality for large Nc. However, next to next to leading
order UChPT calculations suggested a subdominant q-qbar component for the sigma
with a mass around 1.2 GeV. In this work, we show that this subdominant q-qbar
component is indeed needed to ensure local duality.
","[{""version"":""v1"",""created"":""Fri, 15 Jan 2010 17:59:10 GMT""}]","2015-05-18"
"1001.2747","Paolo Nason","P. Nason","Recent developments in POWHEG","7 pages, 2 figures",,,,"hep-ph","http://arxiv.org/licenses/nonexclusive-distrib/1.0/","  I review recent developments in POWHEG, a method for interfacing
parton-shower generators with NLO QCD computations. I illustrate recent
progress in understanding several features of the method, and in clarifying
similarity and differences with respect to MC@NLO. Furthermore, I briefly
describe a recently introduced framework, the POWHEG BOX, that allows the
automatic POWHEG implementation of any given NLO calculation, and has been
recently applied to Z+jet production and to Higgs production via vector-boson
fusion.
","[{""version"":""v1"",""created"":""Fri, 15 Jan 2010 19:23:58 GMT""}]","2010-01-18"
"1001.2748","Simone Speziale","Laurent Freidel and Simone Speziale","Twisted geometries: A geometric parametrisation of SU(2) phase space","28 pages. v2 and v3 minor changes","Phys.Rev.D82:084040,2010","10.1103/PhysRevD.82.084040",,"gr-qc","http://arxiv.org/licenses/nonexclusive-distrib/1.0/","  A cornerstone of the loop quantum gravity program is the fact that the phase
space of general relativity on a fixed graph can be described by a product of
SU(2) cotangent bundles per edge. In this paper we show how to parametrize this
phase space in terms of quantities describing the intrinsic and extrinsic
geometry of the triangulation dual to the graph. These are defined by the
assignment to each triangle of its area, the two unit normals as seen from the
two polyhedra sharing it, and an additional angle related to the extrinsic
curvature. These quantities do not define a Regge geometry, since they include
extrinsic data, but a looser notion of discrete geometry which is twisted in
the sense that it is locally well-defined, but the local patches lack a
consistent gluing among each other. We give the Poisson brackets among the new
variables, and exhibit a symplectomorphism which maps them into the Poisson
brackets of loop gravity. The new parametrization has the advantage of a simple
description of the gauge-invariant reduced phase space, which is given by a
product of phase spaces associated to edges and vertices, and it also provides
an abelianisation of the SU(2) connection. The results are relevant for the
construction of coherent states, and as a byproduct, contribute to clarify the
connection between loop gravity and its subset corresponding to Regge
geometries.
","[{""version"":""v1"",""created"":""Fri, 15 Jan 2010 17:55:14 GMT""},{""version"":""v2"",""created"":""Mon, 17 May 2010 17:28:13 GMT""},{""version"":""v3"",""created"":""Mon, 20 Sep 2010 08:29:11 GMT""}]","2010-11-11"
"1001.2749","Christian Weinheimer","C. Weinheimer","Neutrino oscillations with a polarized laser beam: an analogical
  demonstration experiment","9 pages, 8 figures, this article will be published without the 4
  appendices in Progress in Particle and Nuclear Physics, Conference
  Proceedings of the Int. School on Nuclear Physics 2009 in Erice/Italy","C. Weinheimer, Prog. Part. Nucl. Phys. 64 (2010) 205-209","10.1016/j.ppnp.2009.12.011",,"quant-ph hep-ex hep-ph nucl-th physics.pop-ph","http://arxiv.org/licenses/nonexclusive-distrib/1.0/","  The underlying physics of neutrino oscillation in vacuum can be demonstrated
by an optical analogical experiment. Two different neutrino flavors are
represented by two polarization states of a laser beam, whereas the different
phase propagation in vacuum is mimicked by the propagation difference of an
ordinary and an extraordinary beam in a birefringent crystal. This allows us to
demonstrate neutrino oscillation by optical methods in a fully microscopic way
at the particle level. The description of both realizations of oscillation is
also mathematically identical. In our demonstration experiment we can vary the
oscillation parameters such as propagation length L and mixing angle Theta.
","[{""version"":""v1"",""created"":""Fri, 15 Jan 2010 17:58:57 GMT""}]","2015-05-18"
"1001.2750","Peter Schmitteckert","Peter Schmitteckert","Calculating Green Functions from Finite Systems","17 pages, 17 figures, accepted for publication, RFC: Please inform me
  about missing citations",,"10.1088/1742-6596/220/1/012022",,"cond-mat.str-el","http://arxiv.org/licenses/nonexclusive-distrib/1.0/","  In calculating Green functions for interacting quantum systems numerically
one often has to resort to finite systems which introduces a finite size level
spacing. In order to describe the limit of system size going to infinity
correctly, one has to introduce an artificial broadening larger than the finite
size level discretization. In this work we compare various discretization
schemes for impurity problems, i.e. a small system coupled to leads. Starting
from a naive linear discretization we will then discuss the logarithmic
discretization of the Wilson NRG, compare it to damped boundary conditions and
arbitrary discretization in energy space. We then discuss the importance of
choosing the right single particle basis when calculating bulk spectral
functions. Finally we show the influence of damped boundary conditions on the
time evolution of wave packets leading to a NRG-tsunami.
","[{""version"":""v1"",""created"":""Fri, 15 Jan 2010 18:33:31 GMT""}]","2015-05-18"
"1001.2751","Arnulf Jentzen","Arnulf Jentzen and Michael Roeckner","A Milstein scheme for SPDEs","The article is slightly revised and shortened. In particular, some
  numerical simulations are removed","J. Differential Equations 252 (2012), no. 1, 114-136","10.1016/j.jde.2011.08.050",,"math.NA math.AP math.PR","http://arxiv.org/licenses/nonexclusive-distrib/1.0/","  This article studies an infinite dimensional analog of Milstein's scheme for
finite dimensional stochastic ordinary differential equations (SODEs). The
Milstein scheme is known to be impressively efficient for SODEs which fulfill a
certain commutativity type condition. This article introduces the infinite
dimensional analog of this commutativity type condition and observes that a
certain class of semilinear stochastic partial differential equation (SPDEs)
with multiplicative trace class noise naturally fulfills the resulting infinite
dimensional commutativity condition. In particular, a suitable infinite
dimensional analog of Milstein's algorithm can be simulated efficiently for
such SPDEs and requires less computational operations and random variables than
previously considered algorithms for simulating such SPDEs. The analysis is
supported by numerical results for a stochastic heat equation and stochastic
reaction diffusion equations showing signifficant computational savings.
","[{""version"":""v1"",""created"":""Fri, 15 Jan 2010 19:03:59 GMT""},{""version"":""v2"",""created"":""Sun, 17 Jan 2010 19:51:14 GMT""},{""version"":""v3"",""created"":""Wed, 28 Jul 2010 14:48:49 GMT""},{""version"":""v4"",""created"":""Fri, 27 Jan 2012 15:41:13 GMT""}]","2021-11-02"
"1001.2752","Charles Sauerbier","Charles Sauerbier","A Polynomial Diophantine Generator Function for Integer Residuals","7 pages, 0 figures",,,,"cs.DM","http://arxiv.org/licenses/nonexclusive-distrib/1.0/","  Two Diophantine equation generator function for integer residuals produced by
integer division over closed intervals are presented. One each for the closed
intervals [1,Floor(n^0.5)] and [Ceiling(n^0.5),n], respectively.
","[{""version"":""v1"",""created"":""Fri, 15 Jan 2010 19:04:54 GMT""}]","2010-01-18"
"1001.2753","Phaedon-Stelios Koutsourelakis","P.S. Koutsourelakis and Elias Bilionis","Scalable Bayesian reduced-order models for high-dimensional multiscale
  dynamical systems",,,,,"stat.ML math-ph math.MP math.ST stat.TH","http://arxiv.org/licenses/nonexclusive-distrib/1.0/","  While existing mathematical descriptions can accurately account for phenomena
at microscopic scales (e.g. molecular dynamics), these are often
high-dimensional, stochastic and their applicability over macroscopic time
scales of physical interest is computationally infeasible or impractical. In
complex systems, with limited physical insight on the coherent behavior of
their constituents, the only available information is data obtained from
simulations of the trajectories of huge numbers of degrees of freedom over
microscopic time scales. This paper discusses a Bayesian approach to deriving
probabilistic coarse-grained models that simultaneously address the problems of
identifying appropriate reduced coordinates and the effective dynamics in this
lower-dimensional representation. At the core of the models proposed lie
simple, low-dimensional dynamical systems which serve as the building blocks of
the global model. These approximate the latent, generating sources and
parameterize the reduced-order dynamics. We discuss parallelizable, online
inference and learning algorithms that employ Sequential Monte Carlo samplers
and scale linearly with the dimensionality of the observed dynamics. We propose
a Bayesian adaptive time-integration scheme that utilizes probabilistic
predictive estimates and enables rigorous concurrent s imulation over
macroscopic time scales. The data-driven perspective advocated assimilates
computational and experimental data and thus can materialize data-model fusion.
It can deal with applications that lack a mathematical description and where
only observational data is available. Furthermore, it makes non-intrusive use
of existing computational models.
","[{""version"":""v1"",""created"":""Fri, 15 Jan 2010 19:37:59 GMT""},{""version"":""v2"",""created"":""Sat, 23 Jan 2010 02:48:04 GMT""}]","2016-09-08"
"1001.2754","Nat\'alia Landin Rezende","N.R. Landin, L.T.S. Mendes, L.P.R. Vaz","Theoretical values of convective turnover times and Rossby numbers for
  solar-like, pre-main sequence stars","10 pages, 14 figures, accepted for publication in A&A",,"10.1051/0004-6361/200913015",,"astro-ph.SR","http://arxiv.org/licenses/nonexclusive-distrib/1.0/","  Magnetic fields are at the heart of the observed stellar activity in
late-type stars, and they are presumably generated by a dynamo mechanism at the
interface layer between the radiative and the convective stellar regions. Since
dynamo models are based on the interaction between differential rotation and
convective motions, the introduction of rotation in the ATON 2.3 stellar code
allows for explorations regarding a physically consistent treatment of magnetic
effects in stellar structure and evolution, even though there are formidable
mathematical and numerical challenges involved. As examples, we present
theoretical estimates for both the local (tau_c) and global (tau_g) convective
turnover times for rotating pre-main sequence solar-type stars, based on
up-to-date input physics for stellar models. Our theoretical predictions are
compared with the previous ones available in the literature. In addition, we
investigate the dependence of the convective turnover time on convection
regimes, the presence of rotation and atmospheric treatment. Those estimates,
this quantities can be used to calculate the Rossby number, Ro, which is
related to the magnetic activity strength in dynamo theories and, at least for
main-sequence stars, shows an observational correlation with stellar activity.
More important, they can also contribute for testing stellar models against
observations. Our theoretical values of tau_c, tau_g and Ro qualitatively agree
with those published by Kim & Demarque (1996). By increasing the convection
efficiency, tau_g decreases for a given mass. FST models show still lower
values. The presence of rotation shifts tau_g towards slightly higher values
when compared with non-rotating models. The use of non-gray boundary conditions
in the models yields values of tau_g smaller than in the gray approximation.
","[{""version"":""v1"",""created"":""Fri, 15 Jan 2010 19:58:11 GMT""}]","2015-05-18"
"1001.2755","Ivan Todorov","M. Anoussis, A. Katavolos and I. G. Todorov","Operator algebras from the discrete Heisenberg semigroup",,"Proceedings of the Edinburgh Mathematical Society (2012) 55, 1-22","10.1017/S0013091510000143",,"math.OA","http://arxiv.org/licenses/nonexclusive-distrib/1.0/","  We study reflexivity and structure properties of operator algebras generated
by representations of the discrete Heisenberg semi-group. We show that the left
regular representation of this semi-group gives rise to a semi-simple reflexive
algebra. We exhibit an example of a representation which gives rise to a
non-reflexive algebra. En route, we establish reflexivity results for subspaces
of $H^{\infty}(\bb{T})\otimes\cl B(\cl H)$.
","[{""version"":""v1"",""created"":""Fri, 15 Jan 2010 20:06:25 GMT""}]","2014-07-15"
"1001.2756","Amir Mohammadi","G. A. Margulis, A. Mohammadi","Quantitative Version of the Oppenheim Conjecture for Inhomogeneous
  Quadratic Forms",,"Duke Math. J. 158, no. 1 (2011), 121-160","10.1215/00127094-1276319",,"math.DS math.NT","http://arxiv.org/licenses/nonexclusive-distrib/1.0/","  A quantitative version of the Oppenheim conjecture for inhomogeneous
quadratic forms is proved. We also give an application to eigenvalue spacing on
flat 2-tori with Aharonov-Bohm flux.
","[{""version"":""v1"",""created"":""Fri, 15 Jan 2010 20:11:58 GMT""}]","2019-12-19"
"1001.2757","Steven R. Cranmer","A. A. van Ballegooijen and S. R. Cranmer (Harvard-Smithsonian CfA)","Tangled Magnetic Fields in Solar Prominences","14 pages (emulateapj style), 10 figures, ApJ, in press",,"10.1088/0004-637X/711/1/164",,"astro-ph.SR","http://arxiv.org/licenses/nonexclusive-distrib/1.0/","  Solar prominences are an important tool for studying the structure and
evolution of the coronal magnetic field. Here we consider so-called ""hedgerow""
prominences, which consist of thin vertical threads. We explore the possibility
that such prominences are supported by tangled magnetic fields. A variety of
different approaches are used. First, the dynamics of plasma within a tangled
field is considered. We find that the contorted shape of the flux tubes
significantly reduces the flow velocity compared to the supersonic free fall
that would occur in a straight vertical tube. Second, linear force-free models
of tangled fields are developed, and the elastic response of such fields to
gravitational forces is considered. We demonstrate that the prominence plasma
can be supported by the magnetic pressure of a tangled field that pervades not
only the observed dense threads but also their local surroundings. Tangled
fields with field strengths of about 10 G are able to support prominence
threads with observed hydrogen density of the order of 10^(11) cm^(-3).
Finally, we suggest that the observed vertical threads are the result of
Rayleigh-Taylor instability. Simulations of the density distribution within a
prominence thread indicate that the peak density is much larger than the
average density. We conclude that tangled fields provide a viable mechanism for
magnetic support of hedgerow prominences.
","[{""version"":""v1"",""created"":""Fri, 15 Jan 2010 20:13:08 GMT""}]","2015-05-18"
"1001.2758","Antony Valentini","Antony Valentini","Beyond the Quantum","12 pages, 4 figures","Phys.World 22N11:32-37,2009",,,"quant-ph hep-th physics.hist-ph","http://arxiv.org/licenses/nonexclusive-distrib/1.0/","  At the 1927 Solvay conference, three different theories of quantum mechanics
were presented; however, the physicists present failed to reach a consensus.
Today, many fundamental questions about quantum physics remain unanswered. One
of the theories presented at the conference was Louis de Broglie's pilot-wave
dynamics. This work was subsequently neglected in historical accounts; however,
recent studies of de Broglie's original idea have rediscovered a powerful and
original theory. In de Broglie's theory, quantum theory emerges as a special
subset of a wider physics, which allows non-local signals and violation of the
uncertainty principle. Experimental evidence for this new physics might be
found in the cosmological-microwave-background anisotropies and with the
detection of relic particles with exotic new properties predicted by the
theory.
","[{""version"":""v1"",""created"":""Fri, 15 Jan 2010 20:18:37 GMT""}]","2010-09-13"
"1001.2759","Seongtag Kim","Seongtag Kim","Rigidity of noncompact complete Bach-flat manifolds","10 pages, To appear J. Geom. Physics","J. Geometry and Physics, 2010, Vol 60, p 637-642","10.1016/j.geomphys.2009.12.014",,"math.DG gr-qc","http://arxiv.org/licenses/nonexclusive-distrib/1.0/","  Let $(M,g)$ be a noncompact complete Bach-flat manifold with positive Yamabe
constant. We prove that $(M,g)$ is flat if $(M, g)$ has zero scalar curvature
and sufficiently small $L_{2}$ bound of curvature tensor. When $(M, g)$ has
nonconstant scalar curvature, we prove that $(M, g)$ is conformal to the flat
space if $(M, g)$ has sufficiently small $L_2$ bound of curvature tensor and
$L_{4/3}$ bound of scalar curvature.
","[{""version"":""v1"",""created"":""Fri, 15 Jan 2010 20:24:33 GMT""}]","2010-03-19"
