"1010.4924","Richard A. Klemm","Richard A. Klemm, Erica R. LaBerge, Dustin R. Morley, Takanari
  Kashiwagi, Manabu Tsujimoto, and Kazuo Kadowaki","Cavity mode waves during terahertz radiation from rectangular
  Bi$_2$Sr$_2$CaCu$_2$O$_{8+\delta}$ mesas","11 pages 9 figures, submitted to J. Phys.: Condens. Matter","J. Phys.: Condens. Matter 23, 025701 (2011)","10.1088/0953-8984/23/2/025701",,"cond-mat.supr-con cond-mat.str-el","http://arxiv.org/licenses/nonexclusive-distrib/1.0/","  We re-examined the angular dependence of the radiation from the intrinsic
Josephson junctions in rectangular mesas of Bi$_2$Sr$_2$CaCu$_2$O$_{8+\delta}$,
in order to determine if the cavity mode part of the radiation arises from
waves across the width $w$ or along the length $\ell$ of the mesas, associated
with ``hot spots'' [Wang {\it et al.}, Phys. Rev. Lett. {\bf 105}, 057002
(2010)]. We derived analytic forms for the angular dependence expected in both
cases for a general cavity mode in which the width of the mesa corresponds to
an integer multiple of one-half the wavelength of the radiation. Assuming the
coherent radiation from the $ac$ Josephson current source and the cavity
magnetic surface current density source combine incoherently, fits to the data
of Kadowaki {\it et al.} [J. Phys. Soc. Jpn. {\bf 79}, 023703 (2010)] on a mesa
with mean $\ell/w=5.17$ for both wave directions using two models for the
incoherent combination were made, which correspond to standing and traveling
waves, respectively. The results suggest that the combined output from the
uniform $ac$ Josephson current source plus a cavity wave forming along the
rectangle length is equally probable as that of the combined output from the
uniform $ac$ Josephson current plus a cavity wave across the width. However,
for mesas in which $n\ell/2w$ is integral, where $n$ is the index of the
rectangular TM$^z_{n,0}$ mode, it is shown that standing cavity mode waves
along the length of the mesa do not radiate in the $xz$ plane perpendicular to
the length of the mesa, suggesting experiments on such mesas could help to
resolve the question.
","[{""version"":""v1"",""created"":""Sun, 24 Oct 2010 03:54:34 GMT""}]","2011-07-21"
"1010.4925","Victor Chen","Victor Chen, Madhu Sudan, Ning Xie","Property Testing via Set-Theoretic Operations","Appears in ICS 2011",,,,"cs.DS","http://arxiv.org/licenses/nonexclusive-distrib/1.0/","  Given two testable properties $\mathcal{P}_{1}$ and $\mathcal{P}_{2}$, under
what conditions are the union, intersection or set-difference of these two
properties also testable? We initiate a systematic study of these basic
set-theoretic operations in the context of property testing. As an application,
we give a conceptually different proof that linearity is testable, albeit with
much worse query complexity. Furthermore, for the problem of testing
disjunction of linear functions, which was previously known to be one-sided
testable with a super-polynomial query complexity, we give an improved analysis
and show it has query complexity $O(1/\eps^2)$, where $\eps$ is the distance
parameter.
","[{""version"":""v1"",""created"":""Sun, 24 Oct 2010 04:02:45 GMT""}]","2010-10-26"
"1010.4926","Robert R. Tucci","Robert R. Tucci","QOperAv, a Code Generator for Generating Quantum Circuits for Evaluating
  Certain Quantum Operator Averages","5 pages, 5 files(1 .tex, 1 .sty, 1 .pdf, 1 .txt, 1 .xxx)Source code
  in QOperAv1-5.txt",,,,"quant-ph","http://arxiv.org/licenses/nonexclusive-distrib/1.0/","  This paper introduces QOperAv v1.5, a Java application available for free.
(Source code included in the distribution.) QOperAv is a ""code generator"" for
generating quantum circuits. The quantum circuits generated by QOperAv can be
used to evaluate with polynomial efficiency the average of $f(A)$ for some
simple (that is, computable with polynomial efficiency) function $f$ and a
Hermitian operator $A$, provided that we know how to compile $\exp(iA)$ with
polynomial efficiency. QOperAv implements an algorithm described in earlier
papers, that combines various standard techniques such as quantum phase
estimation and quantum multiplexors.
","[{""version"":""v1"",""created"":""Sun, 24 Oct 2010 04:21:51 GMT""}]","2010-10-26"
"1010.4927","Alexander Kosovichev","A. G. Kosovichev","Local Helioseismology of Sunspots: Current Status and Perspectives
  (Invited Review)","34 pages, 18 figures, submitted to Solar Physics",,"10.1007/s11207-012-9996-6",,"astro-ph.SR physics.plasm-ph physics.space-ph","http://arxiv.org/licenses/nonexclusive-distrib/1.0/","  Mechanisms of the formation and stability of sunspots are among the
longest-standing and intriguing puzzles of solar physics and astrophysics.
Sunspots are controlled by subsurface dynamics hidden from direct observations.
Recently, substantial progress in our understanding of the physics of the
turbulent magnetized plasma in strong-field regions has been made by using
numerical simulations and local helioseismology. Both the simulations and
helioseismic measurements are extremely challenging, but it becomes clear that
the key to understanding the enigma of sunspots is a synergy between models and
observations. Recent observations and radiative MHD numerical models have
provided a convincing explanation to the Evershed flows in sunspot penumbrae.
Also, they lead to the understanding of sunspots as self-organized magnetic
structures in the turbulent plasma of the upper convection zone, which are
maintained by a large-scale dynamics. Local helioseismic diagnostics of
sunspots still have many uncertainties, some of which are discussed in this
review. However, there have been significant achievements in resolving these
uncertainties, verifying the basic results by new high-resolution observations,
testing the helioseismic techniques by numerical simulations, and comparing
results obtained by different methods. For instance, a recent analysis of
helioseismology data from the Hinode space mission has successfully resolved
several uncertainties and concerns (such as the inclined-field and phase-speed
filtering effects) that might affect the inferences of the subsurface
wave-speed structure of sunspots and the flow pattern. It becomes clear that
for the understanding of the phenomenon of sunspots it is important to further
improve the helioseismology methods and investigate the whole life cycle of
active regions, from magnetic-flux emergence to dissipation.
","[{""version"":""v1"",""created"":""Sun, 24 Oct 2010 04:52:09 GMT""},{""version"":""v2"",""created"":""Sat, 19 Feb 2011 03:18:47 GMT""}]","2017-02-22"
"1010.4928","D. Kahl","D. Kahl, A. A. Chen, S. Kubono, D. N. Binh, J. Chen, T. Hashimoto, S.
  Hayakawa, D. Kaji, A. Kim, Y. Kurihara, N. H. Lee, S. Nishimura, Y. Ohshiro,
  K. Setoodeh nia, Y. Wakabayashi, H. Yamaguchi","30S Beam Development and X-ray Bursts","7 pages, 2 figures, 5th European Summer School on Experimental
  Nuclear Astrophysics, Santa Tecla, Sicily, September 2009","AIP Conf.Proc.1213:208,2010","10.1063/1.3362583",,"nucl-ex","http://arxiv.org/licenses/nonexclusive-distrib/1.0/","  Over the past three years, we have worked on developing a well-characterized
30S radioactive beam to be used in a future experiment aiming to directly
measure the 30S(alpha,p) stellar reaction rate within the Gamow window of Type
I X-ray bursts. The importance of the 30S(alpha,p) reaction to X-ray bursts is
discussed. Given the astrophysical motivation, the successful results of and
challenges involved in the production of a low-energy 30S beam are detailed.
Finally, an overview of our future plans regarding this on-going project are
presented.
","[{""version"":""v1"",""created"":""Sun, 24 Oct 2010 04:53:54 GMT""}]","2011-03-04"
"1010.4929","Li Yu","Li Yu","Small Cover and Halperin-Carlsson Conjecture -II","11 pages",,,,"math.AT math.CO math.GT","http://arxiv.org/licenses/nonexclusive-distrib/1.0/","  For a small cover Q^n and any principal (Z_2)^m-bundle M^n over Q^n, it was
shown in a previous work of the author that the total sum of Z_2-Betti numbers
of M^n is at least 2^m. In this paper, we prove that when M^n is connected, the
total sum of Z_2-Betti numbers of such an M^n exactly equals 2^m if and only if
M^n is homeomorphic to a product of spheres, and Q^n in this case must be a
generalized real Bott manifold (or equivalent, Q^n is a small cover over a
product of simplices).
","[{""version"":""v1"",""created"":""Sun, 24 Oct 2010 05:10:26 GMT""}]","2010-10-26"
"1010.4930","Alain Rapaport","Alain Rapaport (Mistea - EPI MERE INRA/INRIA), Denis Dochain (Cesame)","Minimal time control of fed-batch processes with growth functions having
  several maxima",,,,,"math.OC","http://arxiv.org/licenses/nonexclusive-distrib/1.0/","  We address the issue of minimal time optimal control of fedbatch reactor in
presence of complex non monotonic kinetics, that can be typically characterized
by the combination of two Haldane models. The optimal synthesis may present
several singular arcs. Global optimal trajectory results are provided on the
basis of a numerical approach that considers an approximation method with
smooth control inputs.
","[{""version"":""v1"",""created"":""Sun, 24 Oct 2010 05:30:13 GMT""}]","2010-10-26"
"1010.4931","Narinder Kumar Dhiman","Narinder K. Dhiman","Role of nuclear radii in the exotic cluster-decay","2 Pages, 2 Figures, DAE symposium on nuclear physics to be held in
  BITS, Pilani (2010)",,,,"nucl-th","http://arxiv.org/licenses/nonexclusive-distrib/1.0/","  We have calculated the half-lives of $^{56}$Ni$^{\ast}$ within PCM for
clusters $\ge ^{16}$O. The cluster decay half-lives studied with respect to
radius formula due to Royer (R$_{Royer}$) shows that the half-lives lie within
$\pm$7%, excluding Bass radius formula where these lie within $\pm$10%.
","[{""version"":""v1"",""created"":""Sun, 24 Oct 2010 06:12:42 GMT""}]","2010-10-26"
"1010.4932","Sumedh Anathpindika Dr","S. Anathpindika, H.C. Bhatt","On the interaction of a thin, supersonic shell with a molecular cloud","15 pages, 15 figures, and 1 Table; To appear in Monthly Notices to
  the RAS",,"10.1111/j.1365-2966.2010.17951.x",,"astro-ph.GA","http://arxiv.org/licenses/nonexclusive-distrib/1.0/","  Molecular clouds (MCs) are stellar nurseries, however, formation of stars
within MCs depends on the ambient physical conditions. MCs, over a free-fall
time are exposed to numerous dynamical phenomena, of which, the interaction
with a thin, dense shell of gas is but one. Below we present results from
self-gravitating, 3-D smoothed particle hydrodynamics ({\small SPH})
simulations of the problem; seven realisations of the problem have been
performed by varying the precollision density within the cloud, the nature of
the post-collision shock, and the spatial resolution in the computational
domain. Irrespective of the type of shock, a complex network of dense
filaments, seeded by numerical noise, readily appears in the shocked cloud.
Segregation of the dense and rarefied gas phases also manifests itself in a
bimodal distribution of gas density. We demonstrate that the power-spectrum for
rarefied gas is Kolomogorov like, while that for the denser gas is considerably
steeper. As a corollary to the main problem, we also look into the possibly
degenerative effect of the {\small SPH} artificial viscosity on the impact of
the incident shell. It is observed that stronger viscosity leads to greater
post-shock dissipation, that strongly decelerates the incident shock-front and
promotes formation of contiguous structure, albeit on a much longer timescale.
We conclude that too much viscosity is likely to enhance the proclivity towards
gravitational boundedness of structure, leading to unphysical fragmentation.On
the other hand, insufficient resolution appears to suppress fragmentation.
Convergence of results is tested at both extremes, first by repeating the test
case with more than a million particles and then with only half the number of
particles in the original test case.
","[{""version"":""v1"",""created"":""Sun, 24 Oct 2010 06:38:06 GMT""}]","2015-05-20"
"1010.4933","Antonio M. Moro","A.M. Moro, J.A. Caballero and J. Gomez-Camacho","One dimensional scattering of a two body interacting system by an
  infinite wall","37 pages, 8 figures",,,,"nucl-th physics.atm-clus quant-ph","http://arxiv.org/licenses/nonexclusive-distrib/1.0/","  The one-dimensional scattering of a two body interacting system by an
infinite wall is studied in a quantum-mechanical framework. This problem
contains some of the dynamical features present in the collision of atomic,
molecular and nuclear systems. The scattering problem is solved exactly, for
the case of a harmonic interaction between the fragments. The exact result is
used to assess the validity of two different approximations to the scattering
process. The adiabatic approximation, which considers that the relative
co-ordinate is frozen during the scattering process, is found to be inadequate
for this problem. The uncorrelated scattering approximation, which neglects the
correlation between the fragments, gives results in accordance with the exact
calculations when the scattering energy is high compared to the oscillator
parameter.
","[{""version"":""v1"",""created"":""Sun, 24 Oct 2010 06:51:25 GMT""}]","2010-10-26"
"1010.4934","Jaros{\l}aw Miszczak","Jaros{\l}aw Adam Miszczak, Izabela Sobota-Miszczak","Design-on-demand or how to create a target-oriented social web-site","12 pages, no figures",,,,"cs.CY cs.HC","http://arxiv.org/licenses/nonexclusive-distrib/1.0/","  We describe an informal methodology for developing on-line applications,
which is, to some extent, complementary to the Web 2.0 aspects of web
development. The presented methodology is suitable for developing low-cost and
non-cost web sites targeted at medium-sized communities. We present basic
building blocks used in the described strategy. To achieve a better
understanding of the discussed concepts we comment on their application during
the realization of two web projects. We focus on the role of community-driven
development, which is crucial for projects of the discussed type.
","[{""version"":""v1"",""created"":""Sun, 24 Oct 2010 07:04:24 GMT""}]","2010-10-26"
"1010.4935","Yehuda Band","Y. B. Band and I. Osherov","Correlation and Entanglement of Multipartite States","5 pages, 4 figures",,,,"quant-ph","http://arxiv.org/licenses/nonexclusive-distrib/1.0/","  We derive a classification and a measure of classical- and
quantum-correlation of multipartite qubit, qutrit, and in general, $n$-level
systems, in terms of SU$(n)$ representations of density matrices. We compare
the measure for the case of bipartite correlation with concurrence and the
entropy of entanglement. The characterization of correlation is in terms of the
number of nonzero singular values of the correlation matrix, but that of mixed
state entanglement requires additional invariant parameters in the density
matrix. For the bipartite qubit case, the condition for mixed state
entanglement is written explicitly in terms of the invariant paramters in the
density matrix. For identical particle systems we analyze the effects of
exchange symmetry on classical and quantum correlation.
","[{""version"":""v1"",""created"":""Sun, 24 Oct 2010 07:08:57 GMT""}]","2010-10-26"
"1010.4936","Holger Cartarius","Holger Cartarius, Eli Pollak","Imaginary time Gaussian dynamics of the Ar_3 cluster","10 pages, 4 figures, 1 tabular, minor changes in the text, to be
  published in the Journal of Chemical Physics","J. Chem. Phys. 134, 044107 (2011)","10.1063/1.3530592",,"physics.chem-ph physics.atm-clus","http://arxiv.org/licenses/nonexclusive-distrib/1.0/","  Semiclassical Gaussian approximations to the Boltzmann operator have become
an important tool for the investigation of thermodynamic properties of clusters
of atoms at low temperatures. Usually, numerically expensive thawed Gaussian
variants are applied. In this article, we introduce a numerically much cheaper
frozen Gaussian approximation to the imaginary time propagator with a width
matrix especially suited for the dynamics of clusters. The quality of the
results is comparable to that of thawed Gaussian methods based on the
single-particle ansatz. We apply the method to the argon trimer and investigate
the dissociation process of the cluster. The results clearly show a
classical-like transition from a bounded moiety to three free particles at a
temperature T ~ 20 K, whereas previous studies of the system were not able to
resolve this transition. Quantum effects, i.e., differences with the purely
classical case manifest themselves in the low-temperature behavior of the mean
energy and specific heat as well as in a slight shift of the transition
temperature. We also discuss the influence of an artificial confinement of the
atoms usually introduced to converge numerical computations. The results show
that restrictive confinements often implemented in studies of clusters can
influence the thermodynamic properties drastically. This finding may have
implications on other studies of atomic clusters.
","[{""version"":""v1"",""created"":""Sun, 24 Oct 2010 07:22:00 GMT""},{""version"":""v2"",""created"":""Fri, 3 Dec 2010 16:51:35 GMT""}]","2011-01-26"
"1010.4937","Xueting Tian","Wenxiang Sun and Xueting Tian","Diffeomorphisms with various $C^1$ stable properties","8 pages","Acta Mathematica Scientia 2012,32B(2):552-558",,,"math.DS","http://creativecommons.org/licenses/by-nc-sa/3.0/","  Let $M$ be a smooth compact manifold and $\Lambda$ be a compact invariant
set. In this paper we prove that for every robustly transitive set $\Lambda$,
$f|_\Lambda$ satisfies a $C^1-$generic-stable shadowable property (resp.,
$C^1-$generic-stable transitive specification property or $C^1-$generic-stable
barycenter property) if and only if $\Lambda$ is a hyperbolic basic set. In
particular, $f|_\Lambda$ satisfies a $C^1-$stable shadowable property (resp.,
$C^1-$stable transitive specification property or $C^1-$stable barycenter
property) if and only if $\Lambda$ is a hyperbolic basic set. Similar results
are valid for volume-preserving case.
","[{""version"":""v1"",""created"":""Sun, 24 Oct 2010 07:22:36 GMT""},{""version"":""v2"",""created"":""Fri, 4 Mar 2011 13:32:32 GMT""}]","2012-01-16"
"1010.4938","Rabinarayan Panda Mr.","R. N. Panda and S. K. Patra","Structure effect on one neutron removal reaction using relativistic mean
  field densities in Glauber model","6 pages, 3 figures","Int. J. of Mod. Phys. E, 20, 2505 (2011)","10.1142/S0218301311030029",,"nucl-th","http://arxiv.org/licenses/nonexclusive-distrib/1.0/","  We calculate the one neutron removal reaction cross-section $(\sigma_{-1n})$
for few stable and neutron-rich halo nuclei with $^{12}$C as target, using
relativistic mean field (RMF) densities, in the frame work of Glauber model.The
results are compared with the experimental data. Study of the stable nuclei
with the deformed densities have shown a good agreement with the data,however,
it differs significantly for the halo nuclei. We observe that while estimating
the $\sigma_{-1n}$value from the difference of reaction cross-section of two
neighboring nuclei with mass number A and that of A-1 in an isotopic chain, we
get good agreement with the known experimental data for the halo cases.
","[{""version"":""v1"",""created"":""Sun, 24 Oct 2010 07:24:35 GMT""}]","2021-06-01"
"1010.4939","Ken'ichi Tatematsu","Ken'ichi Tatematsu, Tomoya Hirota, Ryo Kandori, Tomofumi Umemoto","Chemical Variation in Molecular Cloud Cores in the Orion A Cloud","26 pages, 18 figures, to be published in Publications of the
  Astronomical Society of Japan","Publ.Astron.Soc.Japan 62 (2010) 1473-1482","10.1093/pasj/62.6.1473",,"astro-ph.GA","http://arxiv.org/licenses/nonexclusive-distrib/1.0/","  We have observed molecular cloud cores in the Orion A giant molecular cloud
(GMC) in CCS, HC3N, DNC, and HN13C to study their chemical characteristics. We
have detected CCS in the Orion A GMC for the first time. CCS was detected in
about a third of the observed cores. The cores detected in CCS are not
localized but are widely distributed over the Orion A GMC. The CCS peak
intensity of the core tends to be high in the southern region of the Orion A
GMC. The HC3N peak intensity of the core also tends to be high in the southern
region, while there are HC3N intense cores near Orion KL, which is not seen in
CCS. The core associated with Orion KL shows broad HC3N line profile, and star
formation activity near Orion KL seems to enhance the HC3N emission. The column
density ratio of NH3 to CCS is lower near the middle of the filament, and is
higher toward the northern and southern regions along the Orion A GMC filament.
This ratio is known to trace the chemical evolution in nearby dark cloud cores,
but seems to be affected by core gas temperature in the Orion A GMC: cores with
low NH3 to CCS column density ratios tend to have warmer gas temperature. The
value of the column density ratio of DNC to HN13C is generally similar to that
in dark cloud cores, but becomes lower around Orion KL due to higher gas
temperature.
","[{""version"":""v1"",""created"":""Sun, 24 Oct 2010 08:26:03 GMT""}]","2015-05-20"
"1010.4940","Raphael Voituriez","R.J. Hawkins, R. Poincloux, O. B\'enichou, M. Piel, P.Chavrier,
  R.Voituriez","Spontaneous contractility--mediated cortical flow generates cell
  migration in 3-dimensional environments","4 pages, 4 figures",,"10.1016/j.bpj.2011.07.038",,"q-bio.CB cond-mat.soft","http://arxiv.org/licenses/nonexclusive-distrib/1.0/","  We present a generic model of cell motility generated by acto-myosin
contraction of the cell cortex. We identify analytically dynamical
instabilities of the cortex and show that they trigger spontaneous cortical
flows which in turn can induce cell migration in 3-dimensional (3D)
environments as well as bleb formation. This contractility--based mechanism,
widely independent of actin treadmilling, appears as an alternative to the
classical picture of lamellipodial motility on flat substrates. Theoretical
predictions are compared to experimental data of tumor cells migrating in 3D
matrigel and suggest that this mechanism could be a general mode of cell
migration in 3D environments.
","[{""version"":""v1"",""created"":""Sun, 24 Oct 2010 08:49:11 GMT""}]","2015-05-20"
"1010.4941","Lisheng Geng","L. S. Geng, E. Oset, R. Molina, A. Mart\'inez Torres, T. Branz, F. K.
  Guo, L. R. Dai, and B. X. Sun","The $f_0(1370)$, $f_0(1710)$, $f_2(1270)$, $f_2'(1525)$, and
  $K_2^*(1430)$ as dynamically generated states from vector meson - vector
  meson interaction","9 pages; Invited talk at workshop CHIRAL'10, Valencia (Spain), June
  21-24, 2010","AIP Conf.Proc.1322:214-222,2010","10.1063/1.3541984",,"hep-ph","http://arxiv.org/licenses/nonexclusive-distrib/1.0/","  We report on some recent developments in understanding the nature of the
low-lying mesonic resonances $f_0(1370)$, $f_0(1710)$, $f_2(1270)$,
$f_2'(1525)$, and $K_2^*(1430)$. In particular we show that these five
resonances can be dynamically generated from vector meson--vector meson
interaction in a coupled-channel unitary approach, which utilizes the
phenomenologically very successful hidden-gauge Lagrangians to produce the
interaction kernel between two vector mesons, which is then unitarized by the
Bethe-Salpeter-equation method. The data on the strong decay branching ratios,
total decay widths, and radiative decay widths of these five states, and on
related $J/\psi$ decay processes can all be well described by such an approach.
We also make predictions, compare them with the results of earlier studies, and
highlight observables that if measured can be used to distinguish different
pictures of these resonances.
","[{""version"":""v1"",""created"":""Sun, 24 Oct 2010 08:51:04 GMT""}]","2011-03-04"
"1010.4942","Massimiliano Sassoli de Bianchi","Massimiliano Sassoli de Bianchi","From permanence to total availability: a quantum conceptual upgrade",,"Foundations of Science: Volume 17, Issue 3 (2012), Page 223-244","10.1007/s10699-011-9233-z",,"physics.gen-ph quant-ph","http://arxiv.org/licenses/nonexclusive-distrib/1.0/","  We consider the classical concept of time of permanence and observe that its
quantum equivalent is described by a bona fide self-adjoint operator. Its
interpretation, by means of the spectral theorem, reveals that we have to
abandon not only the idea that quantum entities would be characterizable in
terms of spatial trajectories but, more generally, that they would possess the
very attribute of spatiality. Consequently, a permanence time shouldn't be
interpreted as a ""time"" in quantum mechanics, but as a measure of the total
availability of a quantum entity in participating to a process of creation of a
spatial localization.
","[{""version"":""v1"",""created"":""Sun, 24 Oct 2010 08:54:47 GMT""},{""version"":""v2"",""created"":""Tue, 14 Jun 2011 10:16:08 GMT""}]","2012-07-13"
