"1010.4943","Xiangjun Xing","Xiangjun Xing","The Poisson-Boltzmann Theory for Two Parallel Uniformly Charged Plates","17 pages, 9 eps figures",,"10.1103/PhysRevE.83.041410",,"physics.class-ph cond-mat.mtrl-sci cond-mat.stat-mech","http://arxiv.org/licenses/nonexclusive-distrib/1.0/","  We solve the nonlinear Poisson-Boltzmann equation for two parallel and likely
charged plates both inside a symmetric elecrolyte, and inside a 2 : 1
asymmetric electrolyte, in terms of Weierstrass elliptic functions. From these
solutions we derive the functional relation between the surface charge density,
the plate separation, and the pressure between plates. For the one plate
problem, we obtain exact expressions for the electrostatic potential and for
the renormalized surface charge density, both in symmetric and in asymmetric
electrolytes. For the two plate problems, we obtain new exact asymptotic
results in various regimes.
","[{""version"":""v1"",""created"":""Sun, 24 Oct 2010 09:04:11 GMT""}]","2013-05-29"
"1010.4944","Xiangjun Xing","Xiangjun Xing","The Poisson-Boltzmann Theory for The Two-Plates Problem: Some Exact
  Results","4 pages, 5 eps figures",,,,"physics.class-ph cond-mat.mtrl-sci cond-mat.stat-mech","http://arxiv.org/licenses/nonexclusive-distrib/1.0/","  The general solution to the nonlinear Poisson-Boltzmann equation for two
parallel charged plates, either inside a symmetric elecrolyte, or inside a
2q:-q asymmetric electrolyte, is found in terms of Weierstrass elliptic
functions. From this we derive some exact asymptotic results for the
interaction between charged plates, as well as the exact form of the
renormalized surface charge density.
","[{""version"":""v1"",""created"":""Sun, 24 Oct 2010 09:04:53 GMT""}]","2010-10-26"
"1010.4945","Takafumi Kanamori Dr.","Takafumi Kanamori and Taiji Suzuki and Masashi Sugiyama","f-divergence estimation and two-sample homogeneity test under
  semiparametric density-ratio models","28 pages, 3 tables",,,,"stat.ML","http://arxiv.org/licenses/nonexclusive-distrib/1.0/","  A density ratio is defined by the ratio of two probability densities. We
study the inference problem of density ratios and apply a semi-parametric
density-ratio estimator to the two-sample homogeneity test. In the proposed
test procedure, the f-divergence between two probability densities is estimated
using a density-ratio estimator. The f-divergence estimator is then exploited
for the two-sample homogeneity test. We derive the optimal estimator of
f-divergence in the sense of the asymptotic variance, and then investigate the
relation between the proposed test procedure and the existing score test based
on empirical likelihood estimator. Through numerical studies, we illustrate the
adequacy of the asymptotic theory for finite-sample inference.
","[{""version"":""v1"",""created"":""Sun, 24 Oct 2010 09:11:40 GMT""}]","2010-10-26"
"1010.4946","Pietro Menotti","Pietro Menotti","Riemann-Hilbert treatment of Liouville theory on the torus","26 pages, LaTeX, references added, typos corrected","J.Phys.A44:115403,2011","10.1088/1751-8113/44/11/115403","IFUP-TH/2010-38-r","hep-th","http://arxiv.org/licenses/nonexclusive-distrib/1.0/","  We apply a perturbative technique to study classical Liouville theory on the
torus. After mapping the problem on the cut-plane we give the perturbative
treatment for a weak source. When the torus reduces to the square the problem
is exactly soluble by means of a quadratic transformation in terms of
hypergeometric functions. We give general formulas for the deformation of a
torus and apply them to the case of the deformation of the square. One can
compute the Heun parameter to first order and express the solution in terms of
quadratures. In addition we give in terms of quadratures of hypergeometric
functions the exact symmetric Green function on the square on the background
generated by a one point source of arbitrary strength.
","[{""version"":""v1"",""created"":""Sun, 24 Oct 2010 09:19:19 GMT""},{""version"":""v2"",""created"":""Sun, 5 Dec 2010 14:57:21 GMT""}]","2011-03-04"
"1010.4947","James Chappell","James M. Chappell, Azhar Iqbal and Derek Abbott","A simplified approach to electromagnetism using geometric algebra","30 pages total, 1 figure",,,,"physics.ed-ph physics.class-ph","http://arxiv.org/licenses/nonexclusive-distrib/1.0/","  A new simplified approach for teaching electromagnetism is presented using
the formalism of geometric algebra (GA) which does not require vector calculus
or tensor index notation, thus producing a much more accessible presentation
for students. The four-dimensional spacetime proposed is completely symmetrical
between the space and time dimensions, thus fulfilling Minkowski's original
vision. In order to improve student reception we also focus on forces and the
conservation of energy and momentum, which take a very simple form in GA, so
that students can easily build on established intuitions in using these laws
developed from studying Newtonian mechanics. The potential formulation is also
integrated into the presentation that allows an alternate solution path, as
well as an introduction to the Lagrangian approach. Several problems are solved
throughout the text to make the implementation clear. We extend previous
treatment of this area, through including the potential formulation, the
conservation of energy and momentum, the generalization for magnetic monopoles,
as well as simplifying previously reported results through eliminating the need
for the spacetime metric.
","[{""version"":""v1"",""created"":""Sun, 24 Oct 2010 09:46:20 GMT""},{""version"":""v2"",""created"":""Wed, 10 Nov 2010 04:10:34 GMT""}]","2010-11-11"
"1010.4948","Stefano Mattiello","Stefano Mattiello and Stefan Strauss","Three-Fermion Bound States on the Light Front","23 pages, 6 figures","Nucl.Phys.A852:92-108,2011","10.1016/j.nuclphysa.2011.01.010",,"nucl-th","http://arxiv.org/licenses/nonexclusive-distrib/1.0/","  We investigate the stability of the relativistic three-fermion system with a
zero-range force in the light front form. In particular, introducing an
invariant cut-off, we study the dependence of the bound state on the coupling
strength also for cases where the two-fermion system is unbound. The
relativistic Thomas collapse is discussed by solving the fully coupled integral
equation system. Furthermore, we explicitly investigate the ground state mass
of the three-fermion system and compare to previous simplified calculations.
","[{""version"":""v1"",""created"":""Sun, 24 Oct 2010 10:08:09 GMT""}]","2011-03-04"
"1010.4949","Andrey Zhilkin","A.G. Zhilkin, D.V. Bisikalo","Formation of Accretion Disks in Close-Binary Systems with Magnetic
  Fields","20 pages, 12 figures, Submitted in Astronomy Reports, 2010, 54, No.
  12",,"10.1134/S1063772910120012",,"astro-ph.SR","http://arxiv.org/licenses/nonexclusive-distrib/1.0/","  We have developed a three-dimensional numerical model and applied it to
simulate plasma flows in semi-detached binary systems whose accretor possesses
a strong intrinsic magnetic field. The model is based on the assumption that
the plasma dynamics are determined by the slow mean flow, which forms a
backdrop for the rapid propagation of MHD waves. The equations describing the
slow motion of matter were obtained by averaging over rapidly propagating
pulsations. The numerical model includes the diffusion of magnetic field by
current dissipation in turbulent vortices, magnetic buoyancy, and wave MHD
turbulence. A modified three-dimensional, parallel, numerical code was used to
simulate the flow structure in close binary systems with various accretor
magnetic fields, from $10^5$ to $10^8$ G. The conditions for the formation of
the accretion disk and the criteria distinguishing the two types of flow
corresponding to intermediate polars and polars are discussed.
","[{""version"":""v1"",""created"":""Sun, 24 Oct 2010 10:31:10 GMT""}]","2010-10-26"
"1010.4950","Mohammad R. Garousi","Mohammad R. Garousi","Disk level S-matrix elements at eikonal Regge limit","17 pages, Latex file, no figure","Phys.Lett.B696:291-299,2011","10.1016/j.physletb.2010.12.042",,"hep-th","http://arxiv.org/licenses/nonexclusive-distrib/1.0/","  We examine the calculation of the color-ordered disk level S-matrix element
of massless scalar vertex operators for the special case that some of the
Mandelstam variables for which there are no open string channel in the
amplitude, are set to zero. By explicit calculation we show that the string
form factors in the 2n-point functions reduce to one at the eikonal Regge
limit.
","[{""version"":""v1"",""created"":""Sun, 24 Oct 2010 11:25:13 GMT""}]","2011-01-27"
"1010.4951","Mahmoud Khademi","Mahmoud Khademi, Mohammad T. Manzuri-Shalmani, and Meharn safayani","Local Component Analysis for Nonparametric Bayes Classifier","This paper has been withdrawn by the author due to an error in
  experimental results",,,,"cs.CV cs.LG","http://arxiv.org/licenses/nonexclusive-distrib/1.0/","  The decision boundaries of Bayes classifier are optimal because they lead to
maximum probability of correct decision. It means if we knew the prior
probabilities and the class-conditional densities, we could design a classifier
which gives the lowest probability of error. However, in classification based
on nonparametric density estimation methods such as Parzen windows, the
decision regions depend on the choice of parameters such as window width.
Moreover, these methods suffer from curse of dimensionality of the feature
space and small sample size problem which severely restricts their practical
applications. In this paper, we address these problems by introducing a novel
dimension reduction and classification method based on local component
analysis. In this method, by adopting an iterative cross-validation algorithm,
we simultaneously estimate the optimal transformation matrices (for dimension
reduction) and classifier parameters based on local information. The proposed
method can classify the data with complicated boundary and also alleviate the
course of dimensionality dilemma. Experiments on real data show the superiority
of the proposed algorithm in term of classification accuracies for pattern
classification applications like age, facial expression and character
recognition. Keywords: Bayes classifier, curse of dimensionality dilemma,
Parzen window, pattern classification, subspace learning.
","[{""version"":""v1"",""created"":""Sun, 24 Oct 2010 11:28:11 GMT""},{""version"":""v2"",""created"":""Fri, 20 Jul 2012 01:17:25 GMT""}]","2012-07-23"
"1010.4952","Mikael Fernandus Simalango","Mikael Fernandus Simalango, Mun-Young Kang and Sangyoon Oh","Towards Constraint-based High Performance Cloud System in the Process of
  Cloud Computing Adoption in an Organization","11 pages, 5 figures; Proceedings of 1st KIITA Conference on Smart
  Enterprise, Seoul, South Korea, October 21st, 2010, pp. 45-55",,,,"cs.DC","http://creativecommons.org/licenses/by-nc-sa/3.0/","  Cloud computing is penetrating into various domains and environments, from
theoretical computer science to economy, from marketing hype to educational
curriculum and from R&D lab to enterprise IT infrastructure. Yet, the currently
developing state of cloud computing leaves several issues to address and also
affects cloud computing adoption by organizations. In this paper, we explain
how the transition into the cloud can occur in an organization and describe the
mechanism for transforming legacy infrastructure into a virtual
infrastructure-based cloud. We describe the state of the art of infrastructural
cloud, which is essential in the decision making on cloud adoption, and
highlight the challenges that can limit the scale and speed of the adoption. We
then suggest a strategic framework for designing a high performance cloud
system. This framework is applicable when transformation cloudbased deployment
model collides with some constraints. We give an example of the implementation
of the framework in a design of a budget-constrained high availability cloud
system.
","[{""version"":""v1"",""created"":""Sun, 24 Oct 2010 12:08:12 GMT""}]","2010-10-26"
"1010.4953","Soumyadip Bandyopadhyay","Soumyadip Bandyopadhyay","Equivalence Checking in Embedded Systems Design Verification using PRES+
  model","i want to replace the previous report, arXiv:1007.2131, by this
  report",,,,"cs.LO cs.FL","http://arxiv.org/licenses/nonexclusive-distrib/1.0/","  In this paper we focus on some aspects related to modeling and formal
verification of embedded systems. Many models have been proposed to represent
embedded systems. These models encompass a broad range of styles,
characteristics, and application domains and include the extensions of finite
state machines, data flow graphs, communication processes and Petri nets. In
this report, we have used a PRES+ model (Petri net based Representation for
Embedded Systems) as an extension of classical Petri net model that captures
concurrency, timing behaviour of embedded systems; it allows systems to be
representative in different levels of abstraction and improves expressiveness
by allowing the token to carry information. Modeling using PRES+, as discussed
above, may be convenient for specifying the input behaviour because it supports
concurrency. However, there is no equivalence checking method reported in the
literature for PRES+ models to the best of our knowledge. In contrast,
equivalence checking of FSMD models exist. As a first step, therefore, we seek
to devise an algorithm to translate PRES+ models to FSMD models and we seek to
hand execute our algorithm on a real life example and we have to translate two
versions of PRES+ models to FSMD models. Then using existing equivalence
checker we have checked the equivalence between two FSMD models.
","[{""version"":""v1"",""created"":""Sun, 24 Oct 2010 12:12:10 GMT""}]","2010-10-26"
"1010.4954","Swarnali Bandopadhyay","Swarnali Bandopadhyay, Arne Brataas, Gerrit E. W. Bauer","Feedback control of noise in spin valves by the spin-transfer torque","4pages, 2 figures","Appl. Phys. Lett. 98, 083110 (2011)","10.1063/1.3556270",,"cond-mat.mes-hall","http://arxiv.org/licenses/nonexclusive-distrib/1.0/","  The miniaturisation of magnetic read heads and random access memory elements
makes them vulnerable to thermal fluctuations. We demonstrate how
current-induced spin-transfer torques can be used to suppress the effects of
thermal fluctuations. This enhances the fidelity of perpendicular magnetic spin
valves. The simplest realization is a dc current to stabilize the free magnetic
layers. The power can be significantly reduced without losing fidelity by
simple control schemes, in which the stabilizing current-induced spin-transfer
torque is controlled by the instantaneous resistance.
","[{""version"":""v1"",""created"":""Sun, 24 Oct 2010 12:15:47 GMT""}]","2011-03-07"
"1010.4955","San-Huang Ke","Yuehua Xu, San-Huang Ke","The infrared spectra of ABC-stacking tri- and tetra-layer graphenes
  studied by first-principles calculations","7 pages, 5 figures","Phys. Rev. B 84, 245433 (2011)","10.1103/PhysRevB.84.245433",,"cond-mat.mes-hall","http://arxiv.org/licenses/nonexclusive-distrib/1.0/","  The infrared absorption spectra of ABC-stacking tri- and tetra-layer
graphenes are studied using the density functional theory. It is found that
they exhibit very different characteristic peaks compared with those of
AB-stacking ones, caused by the different stacking sequence and interlayer
coupling. The anisotropy of the spectra with respect to the direction of the
light electric field is significant. The spectra are more sensitive to the
stacking number when the electric field is perpendicular to the graphene plane
due to the interlayer polarization. The high sensitivities make it possible to
identify the stacking sequence and stacking number of samples by comparing
theory and experiment.
","[{""version"":""v1"",""created"":""Sun, 24 Oct 2010 12:21:33 GMT""}]","2015-05-20"
"1010.4956","Denis-Charles Cisinski","Denis-Charles Cisinski and Ieke Moerdijk","Dendroidal Segal spaces and infinity-operads","We replaced a wrong technical lemma by a correct proposition at the
  begining of Section 8. This does not affect the main results of this article
  (in particular, the end of Section 8 is unchanged). To appear in J. Topol",,,,"math.CT math.AT","http://arxiv.org/licenses/nonexclusive-distrib/1.0/","  We introduce the dendroidal analogs of the notions of complete Segal space
and of Segal category, and construct two appropriate model categories for which
each of these notions corresponds to the property of being fibrant. We prove
that these two model categories are Quillen equivalent to each other, and to
the monoidal model category for infinity-operads which we constructed in an
earlier paper. By slicing over the monoidal unit objects in these model
categories, we derive as immediate corollaries the known comparison results
between Joyal's quasi-categories, Rezk's complete Segal spaces, and Segal
categories.
","[{""version"":""v1"",""created"":""Sun, 24 Oct 2010 12:47:34 GMT""},{""version"":""v2"",""created"":""Fri, 22 Mar 2013 22:22:56 GMT""}]","2013-03-26"
"1010.4957","Ivan Cherednik","Ivan Cherednik, Keith Schneider","Non-gatherable triples for classical affine root systems","Latex, 46 pages",,,,"math.QA math.CO math.RT","http://arxiv.org/licenses/nonexclusive-distrib/1.0/","  This paper contains a complete description of minimal non-gatherable triangle
triples in the lambda-sequences for the affine classical root systems and some
claims for arbitrary (reduced) affine root systems. It continues our previous
paper devoted to the non-affine case; interestingly, the affine theory
clarifies the classification in the non-affine case. The lambda-sequences are
associated with reduced decompositions (words) in affine Weyl groups. The
existence of the non-gatherable triples is a combinatorial obstacle for using
the technique of intertwiners in the theory of irreducible representations of
the (double) affine Hecke algebras, complementary to their algebraic-geometric
theory.
","[{""version"":""v1"",""created"":""Sun, 24 Oct 2010 12:57:39 GMT""}]","2010-10-26"
"1010.4958","D. Kahl","D. Kahl, A. A. Chen, S. Kubono, D. N. Binh, J. Chen, T. Hashimoto, S.
  Hayakawa, D. Kaji, A. Kim, Y. Kurihara, N. H. Lee, S. Nishimura, Y. Ohshiro,
  K. Setoodeh nia, Y. Wakabayashi, H. Yamaguchi","30S(alpha,p) in X-Ray Bursts at CRIB","3 pages, 1 figure, Origin of Matter and Evolution of the Galaxies
  (OMEG10), March 2010, Osaka, Japan","AIP Conf.Proc.1269:424,2010","10.1063/1.3485188",,"nucl-ex","http://arxiv.org/licenses/nonexclusive-distrib/1.0/","  Over the past three years, we have worked on developing a well-characterized
30S radioactive beam to be used in a future experiment aiming to directly
measure the 30S(alpha,p) stellar reaction rate within the Gamow window of Type
I X-ray bursts.
","[{""version"":""v1"",""created"":""Sun, 24 Oct 2010 13:08:06 GMT""}]","2011-03-04"
"1010.4959","Laurent  Mahy","L.Mahy, E.Gosset, F.Baudin, G.Rauw, M.Godart, T.Morel, P.Degroote,
  C.Aerts, R.Blomme, J.Cuypers, A.Noels, E.Michel, A.Baglin, M.Auvergne,
  C.Catala and R.Samadi","Plaskett's Star: Analysis of the CoRoT photometric data","Accepted in A&A, 13 pages, 7 figures, 2 tables",,"10.1051/0004-6361/201014777",,"astro-ph.SR","http://arxiv.org/licenses/nonexclusive-distrib/1.0/","  The SRa02 of the CoRoT space mission for Asteroseismology was partly devoted
to stars belonging to the Mon OB2 association. An intense monitoring was
performed on Plaskett's Star (HD47129) and the unprecedented quality of the
light curve allows us to shed new light on this very massive, non-eclipsing
binary system. We particularly aimed at detecting periodic variability which
might be associated with pulsations or interactions between both components. We
also searched for variations related to the orbital cycle which could help to
constrain the inclination and the morphology of the binary system. A
Fourier-based prewhitening and a multiperiodic fitting procedure were applied
to analyse the time series and extract the frequencies of variations. We
describe the noise properties to tentatively define an appropriate significance
criterion, to only point out the peaks at a certain significance level. We also
detect the variations related to the orbital motion and study them by using the
NIGHTFALL program. The periodogram exhibits a majority of peaks at low
frequencies. Among these peaks, we highlight a list of about 43 values,
including notably two different sets of harmonic frequencies whose fundamental
peaks are located at about 0.07 and 0.82d-1. The former represents the orbital
frequency of the binary system whilst the latter could probably be associated
with non-radial pulsations. The study of the 0.07d-1 variations reveals the
presence of a hot spot most probably situated on the primary star and facing
the secondary. The investigation of this unique dataset constitutes a further
step in the understanding of Plaskett's Star. These results provide a first
basis for future seismic modelling. The existence of a hot region between both
components renders the determination of the inclination ambiguous.
","[{""version"":""v1"",""created"":""Sun, 24 Oct 2010 13:48:41 GMT""},{""version"":""v2"",""created"":""Tue, 26 Oct 2010 09:56:58 GMT""}]","2015-05-20"
"1010.4960","S Brendle","S. Brendle, F.C. Marques","Recent progress on the Yamabe problem",,,,,"math.DG","http://arxiv.org/licenses/nonexclusive-distrib/1.0/","  We give a survey of various compactness and non-compactness results for the
Yamabe equation. We also discuss a conjecture of Hamilton concerning the
asymptotic behavior of the parabolic Yamabe flow.
","[{""version"":""v1"",""created"":""Sun, 24 Oct 2010 13:50:31 GMT""}]","2010-10-26"
"1010.4961","Xian-Hui Ge","Xian-Hui Ge, Shao-Feng Wu, Yunping Wang, Guo-Hong Yang, You-Gen Shen","Acoustic black holes from supercurrent tunneling","15pages,1 figure, to appear in IJMPD","Int.J.Mod.Phys. D21 (2012) 1250038","10.1142/S0218271812500381",,"gr-qc cond-mat.supr-con hep-th","http://arxiv.org/licenses/nonexclusive-distrib/1.0/","  We present a version of acoustic black holes by using the principle of the
Josephson effect. We find that in the case two superconductors $A$ and $B$ are
separated by an insulating barrier, an acoustic black hole may be created in
the middle region between the two superconductors. We discuss in detail how to
describe an acoustic black hole in the Josephson junction and write the metric
in the langauge of the superconducting electronics. Our final results infer
that for big enough tunneling current and thickness of the junction,
experimental verification of the Hawking temperature could be possible.
","[{""version"":""v1"",""created"":""Sun, 24 Oct 2010 14:05:08 GMT""},{""version"":""v2"",""created"":""Mon, 9 Apr 2012 08:16:30 GMT""}]","2012-11-07"
"1010.4962","Stanley J. Brodsky","Stanley J. Brodsky and Guy de Teramond","QCD and Light-Front Dynamics","Invited talk presented by SJB at Light Cone 2010: Relativistic
  Hadronic and Particle Physics, 14-18 June 2010, Valencia, Spain","PoS LC2010:070,2010",,"SLAC-PUB-14275","hep-th hep-ph","http://arxiv.org/licenses/nonexclusive-distrib/1.0/","  AdS/QCD, the correspondence between theories in a dilaton-modified
five-dimensional anti-de Sitter space and confining field theories in physical
space-time, provides a remarkable semiclassical model for hadron physics.
Light-front holography allows hadronic amplitudes in the AdS fifth dimension to
be mapped to frame-independent light-front wavefunctions of hadrons in physical
space-time. The result is a single-variable light-front Schrodinger equation
which determines the eigenspectrum and the light-front wavefunctions of hadrons
for general spin and orbital angular momentum. The coordinate z in AdS space is
uniquely identified with a Lorentz-invariant coordinate zeta which measures the
separation of the constituents within a hadron at equal light-front time and
determines the off-shell dynamics of the bound state wavefunctions as a
function of the invariant mass of the constituents. The hadron eigenstates
generally have components with different orbital angular momentum; e.g., the
proton eigenstate in AdS/QCD with massless quarks has L=0 and L=1 light-front
Fock components with equal probability. Higher Fock states with extra
quark-anti quark pairs also arise. The soft-wall model also predicts the form
of the non-perturbative effective coupling and its beta-function. The AdS/QCD
model can be systematically improved by using its complete orthonormal
solutions to diagonalize the full QCD light-front Hamiltonian or by applying
the Lippmann-Schwinger method to systematically include QCD interaction terms.
Some novel features of QCD are discussed, including the consequences of
confinement for quark and gluon condensates. A method for computing the
hadronization of quark and gluon jets at the amplitude level is outlined.
","[{""version"":""v1"",""created"":""Sun, 24 Oct 2010 14:08:30 GMT""}]","2011-03-10"
