"1010.4907","Omar Tibolla","H.E.S.S. Collaboration, F. Acero, F. Aharonian, A.G. Akhperjanian, G.
  Anton, U. Barres de Almeida, A.R. Bazer-Bachi, Y. Becherini, B. Behera, K.
  Bernl\""ohr, A. Bochow, C. Boisson, J. Bolmont, V. Borrel, J. Brucker, F.
  Brun, P. Brun, R. B\""uhler, T. Bulik, I. B\""usching, T. Boutelier, P.M.
  Chadwick, A. Charbonnier, R.C.G. Chaves, A. Cheesebrough, L.-M. Chounet, A.C.
  Clapson, G. Coignet, M. Dalton, M.K. Daniel, I.D. Davids, B. Degrange, C.
  Deil, H.J. Dickinson, A. Djannati-Ata\""i, W. Domainko, L.O'C. Drury, F.
  Dubois, G. Dubus, J. Dyks, M. Dyrda, K. Egberts, D. Emmanoulopoulos, P.
  Espigat, C. Farnier, F. Feinstein, A. Fiasson, A. F\""orster, G. Fontaine, M.
  F\""ussling, S. Gabici, Y.A. Gallant, L. G\'erard, D. Gerbig, B. Giebels, J.F.
  Glicenstein, B. Gl\""uck16, P. Goret, D. G\""oring, D. Hauser, M. Hauser, S.
  Heinz, G. Heinzelmann, G. Henri, G. Hermann, J.A. Hinton, A. Hoffmann, W.
  Hofmann, M. Holleran, S. Hoppe, D. Horns, A. Jacholkowska, O.C. de Jager, C.
  Jahn, I. Jung, K. Katarzy\'nski, U. Katz, S. Kaufmann, M. Kerschhaggl, D.
  Khangulyan, B. Kh\'elifi, D. Keogh, D. Klochkov, W. Klu\'zniak, T. Kneiske,
  Nu. Komin, K. Kosack, R. Kossakowski, G. Lamanna, J.-P. Lenain, T. Lohse, V.
  Marandon, O. Martineau-Huynh, A. Marcowith, J. Masbou, D. Maurin, T.J.L.
  McComb, M.C. Medina, J. M\'ehault, R. Moderski, E. Moulin, M. Naumann-Godo,
  M. de Naurois, D. Nedbal, D. Nekrassov, B. Nicholas, J. Niemiec, S.J. Nolan,
  S. Ohm, J-F. Olive, E. de O\~na Wilhelmi, K.J. Orford, M. Ostrowski, M.
  Panter, M. Paz Arribas, G. Pedaletti, G. Pelletier, P.-O. Petrucci, S. Pita,
  G. P\""uhlhofer, M. Punch, A. Quirrenbach, B.C. Raubenheimer, M. Raue, S.M.
  Rayner, O. Reimer, M. Renaud, F. Rieger, J. Ripken, L. Rob, S. Rosier-Lees,
  G. Rowell, B. Rudak, C.B. Rulten, J. Ruppel, V. Sahakian, A. Santangelo, R.
  Schlickeiser, F.M. Sch\""ock, U. Schwanke, S. Schwarzburg, S. Schwemmer, A.
  Shalchi, M. Sikora, J.L. Skilton, H. Sol, {\L}. Stawarz, R. Steenkamp, C.
  Stegmann, F. Stinzing, G. Superina, A. Szostek, P.H. Tam, J.-P. Tavernet, R.
  Terrier, O. Tibolla, M. Tluczykont, C. van Eldik, G. Vasileiadis, C. Venter,
  L. Venter, J.P. Vialle, P. Vincent, M. Vivier, H.J. V\""olk, F. Volpe, S.J.
  Wagner, M. Ward, A.A. Zdziarski, A. Zech","Discovery and follow-up studies of the extended, off-plane, VHE
  gamma-ray source HESS J1507-622","Accepted for publication in A&A",,"10.1051/0004-6361/201015187",,"astro-ph.HE","http://arxiv.org/licenses/nonexclusive-distrib/1.0/","  Context: The detection of gamma-rays in the very-high-energy (VHE) range (100
GeV-100 TeV) offers the possibility of studying the parent population of
ultrarelativistic particles found in astrophysical sources, so it is useful for
understanding the underlying astrophysical processes in nonthermal sources.
Aim: The discovery of the VHE gamma-ray source HESS J1507-622 is reported and
possibilities regarding its nature are investigated. Methods: The H.E.S.S.
array of imaging atmospheric Cherenkov telescopes (IACTs) has a high
sensitivity compared with previous instruments (~1% of the Crab flux in 25
hours observation time for a 5 sigma point-source detection) and has a large
field of view (~5 deg in diameter). HESS J1507-622 was discovered within the
ongoing H.E.S.S. survey of the inner Galaxy, and the source was also studied by
means of dedicated multiwavelength observations. Results: A Galactic gamma-ray
source, HESS J1507-622, located ~3.5 deg from the Galactic plane was detected
with a statistical significance > 9 sigma. Its energy spectrum is well fitted
by a power law with spectral index \Gamma = 2.24 +/- 0.16_{stat} +/- 0.20_{sys}
and a flux above 1 TeV of (1.5 +/- 0.4_{stat} +/- 0.3_{sys}) X 10^{-12} cm^{-2}
s^{-1}. Possible interpretations (considering both hadronic and leptonic
models) of the VHE gamma-ray emission are discussed in the absence of an
obvious counterpart.
","[{""version"":""v1"",""created"":""Sat, 23 Oct 2010 20:00:00 GMT""}]","2015-05-20"
"1010.4908","Siddharth Parameswaran","S.A. Parameswaran, S.A. Kivelson, S.L. Sondhi and B.Z. Spivak","The Weakly Coupled Pfaffian as a Type I Quantum Hall Liquid","4 pages, 1 figure","Phys.Rev.Lett.106:236801,2011","10.1103/PhysRevLett.106.236801",,"cond-mat.str-el","http://arxiv.org/licenses/nonexclusive-distrib/1.0/","  The Pfaffian phase of electrons in the proximity of a half-filled Landau
level is understood to be a p+ip superconductor of composite fermions. We
consider the properties of this paired quantum Hall phase when the pairing
scale is small, i.e. in the weak-coupling, BCS, limit, where the coherence
length is much larger than the charge screening length. We find that, as in a
Type I superconductor, the vortices attract so that, upon varying the magnetic
field from its magic value at \nu=5/2, the system exhibits Coulomb frustrated
phase separation. We propose that the weakly and strongly coupled Pfaffian
states exemplify a general dichotomy between Type I and Type II quantum Hall
fluids.
","[{""version"":""v1"",""created"":""Sat, 23 Oct 2010 20:08:30 GMT""}]","2011-06-27"
"1010.4909","David Ellis","David Ellis, Yuval Filmus and Ehud Friedgut","Triangle-Intersecting Families of Graphs","43 pages",,,,"math.CO","http://arxiv.org/licenses/nonexclusive-distrib/1.0/","  A family of graphs F is said to be triangle-intersecting if for any two
graphs G,H in F, the intersection of G and H contains a triangle. A conjecture
of Simonovits and Sos from 1976 states that the largest triangle-intersecting
families of graphs on a fixed set of n vertices are those obtained by fixing a
specific triangle and taking all graphs containing it, resulting in a family of
size (1/8) 2^{n choose 2}. We prove this conjecture and some generalizations
(for example, we prove that the same is true of odd-cycle-intersecting
families, and we obtain best possible bounds on the size of the family under
different, not necessarily uniform, measures). We also obtain stability
results, showing that almost-largest triangle-intersecting families have
approximately the same structure.
","[{""version"":""v1"",""created"":""Sat, 23 Oct 2010 20:27:03 GMT""},{""version"":""v2"",""created"":""Sun, 31 Oct 2010 20:55:33 GMT""},{""version"":""v3"",""created"":""Sun, 7 Nov 2010 13:46:35 GMT""},{""version"":""v4"",""created"":""Mon, 8 Oct 2012 16:30:41 GMT""}]","2012-10-09"
"1010.4910","Nicholas Warner","Thomas Fischbacher, Krzysztof Pilch and Nicholas P. Warner","New Supersymmetric and Stable, Non-Supersymmetric Phases in Supergravity
  and Holographic Field Theory","36 pages, 2 figures",,,,"hep-th","http://arxiv.org/licenses/nonexclusive-distrib/1.0/","  We establish analytically that the potential of N=8 supergravity in four
dimensions has a new N=1 supersymmetric critical point with U(1) x U(1)
symmetry. We work within a consistent N=1 supersymmetric truncation and obtain
the holographic flow to this new point from the N=8 critical point. The
operators that drive the flow in the dual field theory are identified and it is
suggested the new critical point might represent a new conformal phase in the
holographic fermion droplet models with sixteen supersymmetries. The flow also
has c_{IR}/c_{UV}} = 1/2. We examine the stability of all twenty known critical
points and show that the SO(3) x SO(3) point is a perturbatively stable
non-supersymmetric fixed point. We also locate and describe a novel critical
point that also has SO(3)\times SO(3) symmetry and is related to the previously
known one by triality in a similar manner to the way that the SO(7)^\pm points
are related to one another.
","[{""version"":""v1"",""created"":""Sat, 23 Oct 2010 20:43:31 GMT""}]","2010-10-26"
"1010.4911","Anas Chaaban","Anas Chaaban and Aydin Sezgin","The Capacity Region of the 3-User Gaussian Interference Channel with
  Mixed Strong-Very Strong Interference","5 pages, 2 figures",,,,"cs.IT math.IT","http://arxiv.org/licenses/nonexclusive-distrib/1.0/","  We consider the 3-user Gaussian interference channel and provide an outer
bound on its capacity region. Under some conditions, which we call the mixed
strong-very strong interference conditions, this outer bound is achievable.
These conditions correspond to the case where at each receiver, one transmitter
is causing strong interference and the other is causing very strong
interference. Therefore, we characterize the capacity region of the 3-user
interference channel with mixed strong-very strong interference.
","[{""version"":""v1"",""created"":""Sat, 23 Oct 2010 20:51:53 GMT""}]","2010-10-26"
"1010.4912","Jianfeng Lu","Weinan E and Jianfeng Lu and Xu Yang","Effective Maxwell equations from time-dependent density functional
  theory","36 pages",,,,"math-ph cond-mat.mtrl-sci math.MP","http://arxiv.org/licenses/nonexclusive-distrib/1.0/","  The behavior of interacting electrons in a perfect crystal under macroscopic
external electric and magnetic fields is studied. Effective Maxwell equations
for the macroscopic electric and magnetic fields are derived starting from
time-dependent density functional theory. Effective permittivity and
permeability coefficients are obtained.
","[{""version"":""v1"",""created"":""Sat, 23 Oct 2010 21:17:07 GMT""}]","2010-10-26"
"1010.4913","Irina Yehorchenko Dr.","Irina Yehorchenko","Conditional Symmetry and Reductions for the Two-Dimensional Nonlinear
  Wave Equation. I. General Case","10 pages",,,,"math-ph math.AP math.MP","http://arxiv.org/licenses/nonexclusive-distrib/1.0/","  We present classification of Q-conditional symmetries for the two-dimensional
nonlinear wave equations and the reductions corresponding to these nonlinear
symmetries. Classification of inequivalent reductions is discussed.
","[{""version"":""v1"",""created"":""Sat, 23 Oct 2010 21:28:10 GMT""},{""version"":""v2"",""created"":""Mon, 1 Nov 2010 07:34:58 GMT""}]","2010-11-02"
"1010.4914","Frederique Watbled","Frederique Watbled","Concentration inequalities for disordered models","Revised version","ALEA, Lat. Am. J. Probab. Math. Stat. 9, 129--140 (2012)",,,"math.PR","http://arxiv.org/licenses/nonexclusive-distrib/1.0/","  We use a generalization of Hoeffding's inequality to show concentration
results for the free energy of disordered pinning models, assuming only that
the disorder has a finite exponential moment. We also prove some concentration
inequalities for directed polymers in random environment, which we use to
establish a large deviations results for the end position of the polymer under
the polymer measure.
","[{""version"":""v1"",""created"":""Sat, 23 Oct 2010 21:39:55 GMT""},{""version"":""v2"",""created"":""Fri, 17 Dec 2010 20:35:36 GMT""},{""version"":""v3"",""created"":""Tue, 28 Feb 2012 15:41:05 GMT""}]","2012-06-15"
"1010.4915","Martin White","Martin White, M. Blanton, A. Bolton, D. Schlegel, J. Tinker, A.
  Berlind, L. da Costa, E. Kazin, Y.-T. Lin, M. Maia, C. McBride, N.
  Padmanabhan, J. Parejko, W. Percival, F. Prada, B. Ramos, E. Sheldon, F. de
  Simoni, R. Skibba, D. Thomas, D. Wake, I. Zehavi, Z. Zheng, R. Nichol, D.
  Schneider, Michael A. Strauss, B.A. Weaver, David H. Weinberg","The clustering of massive galaxies at z~0.5 from the first semester of
  BOSS data","11 pages, 12 figures, matches version accepted by ApJ",,"10.1088/0004-637X/728/2/126",,"astro-ph.CO","http://arxiv.org/licenses/nonexclusive-distrib/1.0/","  We calculate the real- and redshift-space clustering of massive galaxies at
z~0.5 using the first semester of data by the Baryon Oscillation Spectroscopic
Survey (BOSS). We study the correlation functions of a sample of 44,000 massive
galaxies in the redshift range 0.4<z<0.7. We present a halo-occupation
distribution modeling of the clustering results and discuss the implications
for the manner in which massive galaxies at z~0.5 occupy dark matter halos. The
majority of our galaxies are central galaxies living in halos of mass
10^{13}Msun/h, but 10% are satellites living in halos 10 times more massive.
These results are broadly in agreement with earlier investigations of massive
galaxies at z~0.5. The inferred large-scale bias (b~2) and relatively high
number density (nbar=3e-4 h^3 Mpc^{-3}) imply that BOSS galaxies are excellent
tracers of large-scale structure, suggesting BOSS will enable a wide range of
investigations on the distance scale, the growth of large-scale structure,
massive galaxy evolution and other topics.
","[{""version"":""v1"",""created"":""Sat, 23 Oct 2010 22:28:38 GMT""},{""version"":""v2"",""created"":""Thu, 16 Dec 2010 22:08:25 GMT""}]","2015-05-20"
"1010.4916","Dallas Trinkle","Min Yu and Dallas R. Trinkle","Accurate and efficient algorithm for Bader charge integration","19 pages, 8 figures","J. Chem. Phys. 134, 064111 (2011)","10.1063/1.3553716",,"cond-mat.mtrl-sci physics.chem-ph","http://arxiv.org/licenses/nonexclusive-distrib/1.0/","  We propose an efficient, accurate method to integrate the basins of
attraction of a smooth function defined on a general discrete grid, and apply
it to the Bader charge partitioning for the electron charge density. Starting
with the evolution of trajectories in space following the gradient of charge
density, we derive an expression for the fraction of space neighboring each
grid point that flows to its neighbors. This serves as the basis to compute the
fraction of each grid volume that belongs to a basin (Bader volume), and as a
weight for the discrete integration of functions over the Bader volume.
Compared with other grid-based algorithms, our approach is robust, more
computationally efficient with linear computational effort, accurate, and has
quadratic convergence. Moreover, it is straightforward to extend to non-uniform
grids, such as from a mesh-refinement approach, and can be used to both
identify basins of attraction of fixed points and integrate functions over the
basins.
","[{""version"":""v1"",""created"":""Sat, 23 Oct 2010 22:32:26 GMT""}]","2011-02-15"
"1010.4917","Lisa Borland","Lisa Borland and Yoan Hassid","Market panic on different time-scales",,,,,"q-fin.ST","http://arxiv.org/licenses/nonexclusive-distrib/1.0/","  Cross-sectional signatures of market panic were recently discussed on daily
time scales in [1], extended here to a study of cross-sectional properties of
stocks on intra-day time scales. We confirm specific intra-day patterns of
dispersion and kurtosis, and find that the correlation across stocks increases
in times of panic yielding a bimodal distribution for the sum of signs of
returns. We also find that there is memory in correlations, decaying as a power
law with exponent 0.05. During the Flash-Crash of May 6 2010, we find a drastic
increase in dispersion in conjunction with increased correlations. However, the
kurtosis decreases only slightly in contrast to findings on daily time-scales
where kurtosis drops drastically in times of panic. Our study indicates that
this difference in behavior is result of the origin of the panic-inducing
volatility shock: the more correlated across stocks the shock is, the more the
kurtosis will decrease; the more idiosyncratic the shock, the lesser this
effect and kurtosis is positively correlated with dispersion. We also find that
there is a leverage effect for correlations: negative returns tend to precede
an increase in correlations. A stock price feed-back model with skew in
conjunction with a correlation dynamics that follows market volatility explains
our observations nicely.
","[{""version"":""v1"",""created"":""Sat, 23 Oct 2010 22:40:08 GMT""}]","2010-10-26"
"1010.4918","Yonathan Japha","Y. Japha, Y. B. Band","Coherence of an Interacting Bose Gas: from a Single to a Double Well",,,,,"cond-mat.quant-gas","http://arxiv.org/licenses/nonexclusive-distrib/1.0/","  The low energy properties of a trapped bose gas split by a potential barrier
are determined over the whole range of barrier heights. We derive a
self-consistent two-mode model which reduces, for large $N$, to a Bogoliubov
model for low barriers and to a Josephson model for any (asymmetric) double
well potential, with explicitly calculated tunneling and pair interaction
parameters. We compare the numerical results to analytical results that
precisely specify the role of number squeezing and finite temperatures in the
loss of coherence.
","[{""version"":""v1"",""created"":""Sat, 23 Oct 2010 23:03:55 GMT""}]","2010-10-26"
"1010.4919","Timothy Atherton","T. J. Atherton and J. Lesnefsky and G. A. Wiggers and R. G. Petschek","Maximizing the hyperpolarizability poorly determines the potential","18 pages, 3 figures",,,,"physics.chem-ph","http://arxiv.org/licenses/nonexclusive-distrib/1.0/","  We have optimized the zero frequency first hyperpolarizability \beta of a
one-dimensional piecewise linear potential well containing a single electron by
adjusting the shape of that potential. With increasing numbers of parameters in
the potential, the maximized hyperpolarizability converges quickly to 0.708951
of the proven upper bound. The Hessian of \beta at the maximum has in each case
only two large eigenvalues; the other eigenvalues diminish seemingly
exponentially quickly, demonstrating a very wide range of nearby nearly optimal
potentials, and that there are only two important parameters for optimizing
\beta. The shape of the optimized wavefunctions converges with more parameters
while the associated potentials remain substantially different, suggesting that
the ground state wavefunction provides a superior physical description to the
potential for the conditions that optimize the hyperpolarizability. Prospects
for characterizing the two important parameters for near-optimum potentials are
discussed.
","[{""version"":""v1"",""created"":""Sat, 23 Oct 2010 23:36:02 GMT""},{""version"":""v2"",""created"":""Sat, 23 Apr 2011 20:25:38 GMT""}]","2015-03-17"
"1010.4920","Min Dong","Mahdi Hajiaghayi, Min Dong, Ben Liang","Jointly Optimal Channel Pairing and Power Allocation for Multichannel
  Multihop Relaying","15 pages. IEEE Transactions on Signal Processing","IEEE Transactions on Signal Processing, vol. 59, pp.4998-5012,
  October 2011","10.1109/TSP.2011.2161475",,"cs.IT cs.NI cs.PF math.IT","http://arxiv.org/licenses/nonexclusive-distrib/1.0/","  We study the problem of channel pairing and power allocation in a
multichannel multihop relay network to enhance the end-to-end data rate. Both
amplify-and-forward (AF) and decode-and-forward (DF) relaying strategies are
considered. Given fixed power allocation to the channels, we show that channel
pairing over multiple hops can be decomposed into independent pairing problems
at each relay, and a sorted-SNR channel pairing strategy is sum-rate optimal,
where each relay pairs its incoming and outgoing channels by their SNR order.
For the joint optimization of channel pairing and power allocation under both
total and individual power constraints, we show that the problem can be
decoupled into two subproblems solved separately. This separation principle is
established by observing the equivalence between sorting SNRs and sorting
channel gains in the jointly optimal solution. It significantly reduces the
computational complexity in finding the jointly optimal solution. It follows
that the channel pairing problem in joint optimization can be again decomposed
into independent pairing problems at each relay based on sorted channel gains.
The solution for optimizing power allocation for DF relaying is also provided,
as well as an asymptotically optimal solution for AF relaying. Numerical
results are provided to demonstrate substantial performance gain of the jointly
optimal solution over some suboptimal alternatives. It is also observed that
more gain is obtained from optimal channel pairing than optimal power
allocation through judiciously exploiting the variation among multiple
channels. Impact of the variation of channel gain, the number of channels, and
the number of hops on the performance gain is also studied through numerical
examples.
","[{""version"":""v1"",""created"":""Sun, 24 Oct 2010 00:30:15 GMT""},{""version"":""v2"",""created"":""Tue, 26 Oct 2010 21:11:12 GMT""},{""version"":""v3"",""created"":""Sun, 19 Dec 2010 20:41:09 GMT""},{""version"":""v4"",""created"":""Fri, 11 Dec 2015 08:54:44 GMT""}]","2015-12-14"
"1010.4921","Eric Brown","Eric Brown and Heinrich M. Jaeger","The role of dilation and confining stresses in shear thickening of dense
  suspensions","38 pages, 19 figures. In review with the Journal of Rheology. 3
  figures and some discussion removed from previous version for brevity",,,,"cond-mat.soft","http://arxiv.org/licenses/nonexclusive-distrib/1.0/","  Many densely packed suspensions and colloids exhibit a behavior known as
Discontinuous Shear Thickening in which the shear stress jumps dramatically and
reversibly as the shear rate is increased. We performed rheometry and video
microscopy measurements on a variety of suspensions to determine the mechanism
for this behavior. Shear profiles and normal stress measurements indicate that,
in the shear thickening regime, stresses are transmitted through frictional
rather than viscous interactions, and come to the surprising conclusion that
the local constitutive relation between stress and shear rate is not
necessarily shear thickening. If the suspended particles are heavy enough to
settle we find the onset stress of shear thickening tau_min corresponds to a
hydrostatic pressure from the weight of the particle packing where neighboring
particles begin to shear relative to each other. Above tau_min, dilation is
seen to cause particles to penetrate the liquid-air interface of the sheared
sample. The upper stress boundary tau_max of the shear thickening regime is
shown to roughly match the ratio of surface tension divided by a radius of
curvature on the order of the particle size. These results suggest a new model
in which the increased dissipation in the shear thickening regime comes from
frictional stresses that emerge as dilation is frustrated by a confining stress
from surface tension at the liquid-air interface. When instead the suspensions
are confined by solid walls and have no liquid-air interface, we find tau_max
is set by the stiffness of the most compliant boundary which frustrates
dilation. This rheology can be described by a non-local constitutive relation
in which the local relation between stress and shear rate is shear thinning,
but where the stress increase comes from a normal stress term which depends on
the global dilation.
","[{""version"":""v1"",""created"":""Sun, 24 Oct 2010 00:59:49 GMT""},{""version"":""v2"",""created"":""Thu, 5 Jan 2012 07:47:08 GMT""}]","2015-03-17"
"1010.4922","Tepper L. Gill","Tepper L Gill, Francis Mensah and Woodford W. Zachary","Adjoint Operators on Banach Spaces",,,,,"math-ph math.FA math.MP","http://arxiv.org/licenses/nonexclusive-distrib/1.0/","  In this paper, we report on new results related to the existence of an
adjoint for operators on separable Banach spaces and discuss a few interesting
applications. (Some results are new even for Hilbert spaces.) Our first two
applications provide an extension of the Poincar\'{e} inequality and the
Stone-von Neumann version of the spectral theorem for a large class of
$C_0$-generators of contraction semigroups on separable Banach spaces. Our
third application provides a natural extension of the Schatten-class of
operators to all separable Banach spaces. As a part of this program, we
introduce a new class of separable Banach spaces. As a side benefit, these
spaces also provide a natural framework for the (rigorous) construction of the
path integral as envisioned by Feynman.
","[{""version"":""v1"",""created"":""Sun, 24 Oct 2010 02:00:22 GMT""}]","2010-10-26"
"1010.4923","Jingwei Guo","Jingwei Guo","Lattice points in large convex planar domains of finite type","26 pages. This second version gives a slightly better bound than the
  original version",,,,"math.NT math.CA","http://arxiv.org/licenses/nonexclusive-distrib/1.0/","  Let $\mathcal{B}$ be a compact convex planar domain with smooth boundary of
finite type and $\mathcal{B}_\theta$ its rotation by an angle $\theta$. We
prove that for almost every $\theta\in[0, 2\pi]$ the remainder
$P_{\mathcal{B}_\theta}(t)$ is of order $O_{\theta}(t^{2/3-\zeta})$ with a
positive number $\zeta$ independent of the domain.
","[{""version"":""v1"",""created"":""Sun, 24 Oct 2010 03:02:26 GMT""},{""version"":""v2"",""created"":""Wed, 1 Jun 2011 02:33:34 GMT""}]","2011-06-02"
