"1008.3606","Anjan K. Gupta","Shyam K. Choudhury and Anjan K. Gupta","Tip induced doping effects in local tunnel spectra of graphene","4 pages, 5 figures","Appl. Phys. Lett. 98, 102109 (2011)","10.1063/1.3555344",,"cond-mat.mes-hall","http://arxiv.org/licenses/nonexclusive-distrib/1.0/","  We report on tip induced doping in local tunnel spectra of single layer
graphene (SLG) with tunable back-gate using room temperature scanning tunneling
microscopy and spectroscopy (STM/S). The SLG samples, prepared on silicon
dioxide surface by exfoliation method and verified by Raman spectra, show
atomically resolved honeycomb lattice. Local tunnel spectra show two minima
with a clear evolution in the position of both with doping by the back gate. A
similar variation in spectra is also observed spatially due to charge
inhomogeneity. With doping the two minima move in opposite directions with one
showing nearly a square root dependence and the other a linear dependence on
gate voltage. We explain these features as arising from the STM tip induced and
bias voltage dependent doping in SLG.
","[{""version"":""v1"",""created"":""Sat, 21 Aug 2010 06:23:43 GMT""}]","2014-02-11"
"1008.3607","David Champion","D. J. Champion, G. B. Hobbs, R. N. Manchester, R. T. Edwards, D. C.
  Backer, M. Bailes, N. D. R. Bhat, S. Burke-Spolaor, W. Coles, P. B. Demorest,
  R. D. Ferdman, W. M. Folkner, A. W. Hotan, M. Kramer, A. N. Lommen, D. J.
  Nice, M. B. Purver, J. M. Sarkissian, I. H. Stairs, W. van Straten, J. P. W.
  Verbiest and D. R. B. Yardley","Measuring the mass of solar system planets using pulsar timing","Accepted for publication in ApJ",,"10.1088/2041-8205/720/2/L201",,"astro-ph.EP","http://arxiv.org/licenses/nonexclusive-distrib/1.0/","  High-precision pulsar timing relies on a solar-system ephemeris in order to
convert times of arrival (TOAs) of pulses measured at an observatory to the
solar system barycenter. Any error in the conversion to the barycentric TOAs
leads to a systematic variation in the observed timing residuals; specifically,
an incorrect planetary mass leads to a predominantly sinusoidal variation
having a period and phase associated with the planet's orbital motion about the
Sun. By using an array of pulsars (PSRs J0437-4715, J1744-1134, J1857+0943,
J1909-3744), the masses of the planetary systems from Mercury to Saturn have
been determined. These masses are consistent with the best-known masses
determined by spacecraft observations, with the mass of the Jovian system,
9.547921(2)E-4 Msun, being significantly more accurate than the mass determined
from the Pioneer and Voyager spacecraft, and consistent with but less accurate
than the value from the Galileo spacecraft. While spacecraft are likely to
produce the most accurate measurements for individual solar system bodies, the
pulsar technique is sensitive to planetary system masses and has the potential
to provide the most accurate values of these masses for some planets.
","[{""version"":""v1"",""created"":""Sat, 21 Aug 2010 06:43:11 GMT""}]","2015-05-19"
"1008.3608","Mohamad Charafeddine","Mohamad Charafeddine and Zhu Han and Arogyaswami Paulraj and John
  Cioffi","Crystallized Rates Region of the Interference Channel via Correlated
  Equilibrium with Interference as Noise","6 pages, 9 figures, Proc. IEEE International Conference on
  Communications (ICC) 2009",,,,"cs.IT math.IT","http://arxiv.org/licenses/nonexclusive-distrib/1.0/","  Treating the interference as noise in the n-user interference channel, the
paper describes a novel approach to the rates region, composed by the
time-sharing convex hull of 2^n-1 corner points achieved through On/Off binary
power control. The resulting rates region is denoted crystallized rates region.
By treating the interference as noise, the n-user rates region frontiers has
been found in the literature to be the convex hull of n hyper-surfaces. The
rates region bounded by these hyper-surfaces is not necessarily convex, and
thereby a convex hull operation is imposed through the strategy of
time-sharing. This paper simplifies this rates region in the n-dimensional
space by having only an On/Off binary power control. This consequently leads to
2^n-1 corner points situated within the rates region. A time-sharing convex
hull is imposed onto those corner points, forming the crystallized rates
region. The paper focuses on game theoretic concepts to achieve that
crystallized convex hull via correlated equilibrium. In game theory, the
correlated equilibrium set is convex, and it consists of the time-sharing mixed
strategies of the Nash equilibriums. In addition, the paper considers a
mechanism design approach to carefully design a utility function, particularly
the Vickrey-Clarke-Groves auction utility, where the solution point is situated
on the correlated equilibrium set. Finally, the paper proposes a self learning
algorithm, namely the regret-matching algorithm, that converges to the solution
point on the correlated equilibrium set in a distributed fashion.
","[{""version"":""v1"",""created"":""Sat, 21 Aug 2010 06:59:57 GMT""}]","2010-08-24"
"1008.3609","Yasuyuki Tanaka","Y. T. Tanaka, J. P. Raulin, F. C. P. Bertoni, P. R. Fagundes, J. Chau,
  N. J. Schuch, M. Hayakawa, Y. Hobara, T. Terasawa, and T. Takahashi","First Very Low Frequency detection of short repeated bursts from
  magnetar SGR J1550-5418","14 pages, 4 figures, accepted by ApJL",,"10.1088/2041-8205/721/1/L24",,"astro-ph.HE astro-ph.EP","http://arxiv.org/licenses/nonexclusive-distrib/1.0/","  We report on the first detection of ionospheric disturbances caused by short
repeated gamma-ray bursts from the magnetar SGR J1550-5418. Very low frequency
(VLF) radio wave data obtained in South America clearly show sudden amplitude
and phase changes at the corresponding times of eight SGR bursts. Maximum
amplitude and phase changes of the VLF signals appear to be correlated with the
gamma-ray fluence. On the other hand, VLF recovery timescales do not show any
significant correlation with the fluence, possibly suggesting that the bursts'
spectra are not similar to each other. In summary, the Earth's ionosphere can
be used as a very large gamma-ray detector and the VLF observations provide us
with a new method to monitor high energy astrophysical phenomena without
interruption such as Earth Occultation.
","[{""version"":""v1"",""created"":""Sat, 21 Aug 2010 07:03:19 GMT""}]","2015-05-19"
"1008.3610","Stefaan Vaes","Stefaan Vaes","Rigidity for von Neumann algebras and their invariants","ICM 2010 Proceedings text","Proceedings of the International Congress of Mathematicians
  (Hyderabad, India, 2010), Vol. III, Hindustan Book Agency, 2010, pp.
  1624-1650",,,"math.OA math.DS math.GR","http://arxiv.org/licenses/nonexclusive-distrib/1.0/","  We give a survey of recent classification results for crossed product von
Neumann algebras arising from measure preserving group actions on probability
spaces. This includes II_1 factors with uncountable fundamental groups and the
construction of W*-superrigid actions where the crossed product entirely
remembers the initial group action that it was constructed from.
","[{""version"":""v1"",""created"":""Sat, 21 Aug 2010 07:10:05 GMT""}]","2010-08-24"
"1008.3611","Alexander Eisfeld","Jan Roden, Walter T. Strunz, Alexander Eisfeld","Spectral properties of molecular oligomers. A non-Markovian quantum
  state diffusion approach",,"International Journal of Modern Physics B (IJMPB), 24, 5060 (2010)","10.1142/S0217979210057201",,"physics.chem-ph quant-ph","http://arxiv.org/licenses/nonexclusive-distrib/1.0/","  Absorption spectra of small molecular aggregates (oligomers) are considered.
The dipole-dipole interaction between the monomers leads to shifts of the
oligomer spectra with respect to the monomer absorption. The line-shapes of
monomer as well as oligomer absorption depend strongly on the coupling to
vibrational modes. Using a recently developed approach [Roden et. al, PRL 103,
058301] we investigate the length dependence of spectra of one-dimensional
aggregates for various values of the interaction strength between the monomers.
It is demonstrated, that the present approach is well suited to describe the
occurrence of the J- and H-bands.
","[{""version"":""v1"",""created"":""Sat, 21 Aug 2010 07:24:53 GMT""}]","2011-02-03"
"1008.3612","Jonathan Barrett","Jonathan Barrett and Nicolas Gisin","How much measurement independence is needed in order to demonstrate
  nonlocality?","5 pages, 1 figure. v2 Various improvements in presentation. Results
  unchanged","Physical Review Letters, 106, 100406, 2011","10.1103/PhysRevLett.106.100406",,"quant-ph","http://arxiv.org/licenses/nonexclusive-distrib/1.0/","  If nonlocality is to be inferred from a violation of Bell's inequality, an
important assumption is that the measurement settings are freely chosen by the
observers, or alternatively, that they are random and uncorrelated with the
hypothetical local variables. We study the case where this assumption is
weakened, so that measurement settings and local variables are at least
partially correlated. As we show, there is a connection between this type of
model and models which reproduce nonlocal correlations by allowing classical
communication between the distant parties, and a connection with models that
exploit the detection loophole. We show that even if Bob's choices are
completely independent, all correlations obtained from projective measurements
on a singlet can be reproduced, with the correlation (measured by mutual
information) between Alice's choice and local variables less than or equal to a
single bit.
","[{""version"":""v1"",""created"":""Sat, 21 Aug 2010 08:15:05 GMT""},{""version"":""v2"",""created"":""Thu, 27 Jan 2011 18:41:00 GMT""}]","2013-05-29"
"1008.3613","Doris Arzoumanian","Doris Arzoumanian, Moira Jardine, Jean-Fran\c{c}ois Donati, Julien
  Morin and Colin Johnstone","The contribution of starspots to coronal structure","10 pages, 10 figures",,"10.1111/j.1365-2966.2010.17623.x",,"astro-ph.SR","http://arxiv.org/licenses/nonexclusive-distrib/1.0/","  Significant progress has been made recently in our understanding of the
structure of stellar magnetic fields, thanks to advances in detection methods
such as Zeeman-Doppler Imaging. The extrapolation of this surface magnetic
field into the corona has provided 3D models of the coronal magnetic field and
plasma. This method is sensitive mainly to the magnetic field in the bright
regions of the stellar surface. The dark (spotted) regions are censored because
the Zeeman signature there is suppressed. By modelling the magnetic field that
might have been contained in these spots, we have studied the effect that this
loss of information might have on our understanding of the coronal structure.
As examples, we have chosen two stars (V374 peg and AB Dor) that have very
different magnetograms and patterns of spot coverage. We find that the effect
of the spot field depends not only on the relative amount of flux in the spots,
but also its distribution across the stellar surface. For a star such as AB Dor
with a high spot coverage and a large polar spot, at its greatest effect the
spot field may almost double the fraction of the flux that is open (hence
decreasing the spindown time) while at the same time increasing the X-ray
emission measure by two orders of magnitude and significantly affecting the
X-ray rotational modulation.
","[{""version"":""v1"",""created"":""Sat, 21 Aug 2010 08:20:37 GMT""}]","2015-05-19"
"1008.3614","Iordanis  Koutsopoulos","Iordanis Koutsopoulos and Leandros Tassiulas","Control and Optimization Meet the Smart Power Grid - Scheduling of Power
  Demands for Optimal Energy Management","submitted to INFOCOM 2011; 9 pages, 4 figures",,,,"cs.NI cs.SY","http://arxiv.org/licenses/nonexclusive-distrib/1.0/","  The smart power grid aims at harnessing information and communication
technologies to enhance reliability and enforce sensible use of energy. Its
realization is geared by the fundamental goal of effective management of demand
load. In this work, we envision a scenario with real-time communication between
the operator and consumers. The grid operator controller receives requests for
power demands from consumers, with different power requirement, duration, and a
deadline by which it is to be completed. The objective is to devise a power
demand task scheduling policy that minimizes the grid operational cost over a
time horizon. The operational cost is a convex function of instantaneous power
consumption and reflects the fact that each additional unit of power needed to
serve demands is more expensive as demand load increases.First, we study the
off-line demand scheduling problem, where parameters are fixed and known. Next,
we devise a stochastic model for the case when demands are generated
continually and scheduling decisions are taken online and focus on long-term
average cost. We present two instances of power consumption control based on
observing current consumption. First, the controller may choose to serve a new
demand request upon arrival or to postpone it to the end of its deadline.
Second, the additional option exists to activate one of the postponed demands
when an active demand terminates. For both instances, the optimal policies are
threshold based. We derive a lower performance bound over all policies, which
is asymptotically tight as deadlines increase. We propose the Controlled
Release threshold policy and prove it is asymptotically optimal. The policy
activates a new demand request if the current power consumption is less than a
threshold, otherwise it is queued. Queued demands are scheduled when their
deadline expires or when the consumption drops below the threshold.
","[{""version"":""v1"",""created"":""Sat, 21 Aug 2010 08:23:48 GMT""}]","2010-08-24"
"1008.3615","Gholam Hossein Bordbar","M. Bigdeli, G.H. Bordbar and A. Poostforush","Finite temperature calculations for the spin polarized asymmetric
  nuclear matter with the LOCV method","18 pages, 7 figures Phys. Rev. C (2010) in press","Phys.Rev.C82:034309,2010","10.1103/PhysRevC.82.034309",,"nucl-th astro-ph.SR","http://creativecommons.org/licenses/by-nc-sa/3.0/","  The lowest order constrained variational (LOCV) technique has been used to
investigate some of the thermodynamic properties of spin polarized hot
asymmetric nuclear matter, such as the free energy, symmetry energy,
susceptibility and equation of state. We have shown that the symmetry energy of
the nuclear matter is substantially sensitive to the value of spin
polarization.
  Our calculations show that the equation of state of the polarized hot
asymmetric nuclear matter is stiffer for the higher values of the polarization
as well as the isospin asymmetry parameter. Our results for the free energy and
susceptibility show that the spontaneous ferromagnetic phase transition cannot
occur for hot asymmetric matter.
","[{""version"":""v1"",""created"":""Sat, 21 Aug 2010 08:42:28 GMT""}]","2014-11-21"
"1008.3616","Ville Lehtola V","V. V. Lehtola, K. Kaski, R. P. Linna","Pore-polymer interaction reveals non-universality in forced polymer
  translocation",,,"10.1103/PhysRevE.82.031908",,"physics.bio-ph","http://arxiv.org/licenses/nonexclusive-distrib/1.0/","  We present a numerical study of forced polymer translocation by using two
separate pore models. Both of them have been extensively used in previous
forced translocation studies. We show that variations in the pore model affect
the forced translocation characteristics significantly in the biologically
relevant pore force, i.e. driving force, range. Details of the model are shown
to change even the obtained scaling relations, which is a strong indication of
strongly out-of-equilibrium dynamics in the computational studies which have
not yet succeeded in addressing the characteristics of the forced translocation
for biopolymers at realistic length scale.
","[{""version"":""v1"",""created"":""Sat, 21 Aug 2010 09:03:29 GMT""}]","2015-05-19"
"1008.3617","Elizabeth Wulcan","Elizabeth Wulcan","Some variants of Macaulay's and Max Noether's theorems","11 pages",,,,"math.CV","http://arxiv.org/licenses/nonexclusive-distrib/1.0/","  We use residue currents on toric varieties to obtain bounds on the support of
solutions to polynomial ideal membership problems. Our bounds depend on the
Newton polytopes of the polynomial systems and are therefore well adjusted to
sparse systems of polynomials. We present variants of classical results due to
Macaulay and Max Noether.
","[{""version"":""v1"",""created"":""Sat, 21 Aug 2010 09:05:31 GMT""}]","2010-08-24"
"1008.3618","Hadi  Zayyani","Hadi Zayyani, Massoud Babaie-Zadeh, Christian Jutten","Bayesian Hypothesis Testing for Sparse Representation",,,,,"cs.IT math.IT","http://arxiv.org/licenses/nonexclusive-distrib/1.0/","  In this paper, we propose a Bayesian Hypothesis Testing Algorithm (BHTA) for
sparse representation. It uses the Bayesian framework to determine active atoms
in sparse representation of a signal.
  The Bayesian hypothesis testing based on three assumptions, determines the
active atoms from the correlations and leads to the activity measure as
proposed in Iterative Detection Estimation (IDE) algorithm. In fact, IDE uses
an arbitrary decreasing sequence of thresholds while the proposed algorithm is
based on a sequence which derived from hypothesis testing. So, Bayesian
hypothesis testing framework leads to an improved version of the IDE algorithm.
  The simulations show that Hard-version of our suggested algorithm achieves
one of the best results in terms of estimation accuracy among the algorithms
which have been implemented in our simulations, while it has the greatest
complexity in terms of simulation time.
","[{""version"":""v1"",""created"":""Sat, 21 Aug 2010 09:10:13 GMT""}]","2010-08-26"
"1008.3619","Marco Mamone-Capria","Marco Mamone-Capria","Spatial Directions, Anisotropy and Special Relativity","24 pages, 2 figures. Final enlarged and slightly corrected version.
  Keywords: relativity, very special relativity, spatial isotropy, reciprocity,
  differential aging; Foundations of Physics, 2011","Found.Phys.41:1375-1397,2011","10.1007/s10701-011-9554-3",,"gr-qc math-ph math.DG math.MP","http://arxiv.org/licenses/nonexclusive-distrib/1.0/","  The concept of an objective spatial direction in special relativity is
investigated and theories assuming light-speed isotropy while accepting the
existence of a privileged spatial direction are classified. A natural
generalization of the proper time principle is introduced which makes it
possible to devise experimental tests of spatial isotropy. Several common
misunderstandings in the relativistic literature concerning the role of spatial
isotropy are clarified.
","[{""version"":""v1"",""created"":""Sat, 21 Aug 2010 09:40:25 GMT""},{""version"":""v2"",""created"":""Wed, 16 Feb 2011 18:04:57 GMT""},{""version"":""v3"",""created"":""Tue, 22 Feb 2011 17:58:22 GMT""},{""version"":""v4"",""created"":""Fri, 20 May 2011 09:36:05 GMT""}]","2011-06-30"
"1008.3620","Micha{\l} Silarski","M. Silarski","Study of the K+K- Interaction at COSY-11","Proceedings from the MESON2010 conference ,3 pages, 3 figures","Int.J.Mod.Phys.A26:539-541,2011","10.1142/S0217751X11051962",,"hep-ph","http://arxiv.org/licenses/nonexclusive-distrib/1.0/","  In this article we present studies of the near threshold pp-->ppK+K- reaction
in view of the K+K- final state interaction. The investigations include
analysis of both the low-energy K+K- invariant mass distributions measured by
COSY-11 collaboration at excess energies of Q = 10 MeV and Q = 28 MeV and the
near threshold excitation function for the pp-->ppK+K- reaction. As a result of
these studies we have estimated the K+K- scattering length more precise
compared to the previous analysis based only on the analysis of the
differential cross sections.
","[{""version"":""v1"",""created"":""Sat, 21 Aug 2010 09:46:18 GMT""}]","2011-03-02"
"1008.3621","Roberto Percacci","R. Percacci and G. P. Vacca","Asymptotic Safety, Emergence and Minimal Length","LaTEX, 20 pages, 2 figures; v.2: minor changes, reflecting published
  version","Class.Quant.Grav.27:245026,2010","10.1088/0264-9381/27/24/245026",,"hep-th gr-qc","http://arxiv.org/licenses/nonexclusive-distrib/1.0/","  There seems to be a common prejudice that asymptotic safety is either
incompatible with, or at best unrelated to, the other topics in the title. This
is not the case. In fact, we show that 1) the existence of a fixed point with
suitable properties is a promising way of deriving emergent properties of
gravity, and 2) there is a sense in which asymptotic safety implies a minimal
length. In so doing we also discuss possible signatures of asymptotic safety in
scattering experiments.
","[{""version"":""v1"",""created"":""Sat, 21 Aug 2010 09:54:43 GMT""},{""version"":""v2"",""created"":""Wed, 12 Jan 2011 08:57:24 GMT""}]","2011-01-13"
"1008.3622","Suk Kim","Suk Kim, Soo-Chang Rey, Thorsten Lisker, and Sangmo Tony Sohn","Color-Magnitude Relations of Early-type Dwarf Galaxies in the Virgo
  Cluster: An Ultraviolet Perspective","6 pages, 2 figures, 1 table, accepted for publication in the ApJL",,"10.1088/2041-8205/721/1/L72",,"astro-ph.CO","http://creativecommons.org/licenses/by/3.0/","  We present ultraviolet (UV) color-magnitude relations (CMRs) of early-type
dwarf galaxies in the Virgo cluster, based on Galaxy Evolution Explorer (GALEX)
UV and Sloan Digital Sky Survey (SDSS) optical imaging data. We find that dwarf
lenticular galaxies (dS0s), including peculiar dwarf elliptical galaxies (dEs)
with disk substructures and blue centers, show a surprisingly distinct and
tight locus separated from that of ordinary dEs, which is not clearly seen in
previous CMRs. The dS0s in UV CMRs follow a steeper sequence than dEs and show
bluer UV-optical color at a given magnitude. We also find that the UV CMRs of
dEs in the outer cluster region are slightly steeper than that of their
counterparts in the inner region, due to the existence of faint, blue dEs in
the outer region. We explore the observed CMRs with population models of a
luminosity-dependent delayed exponential star formation history. We confirm
that the feature of delayed star formation of early-type dwarf galaxies in
Virgo cluster is strongly correlated with their morphology and environment. The
observed CMR of dS0s is well matched by models with relatively long delayed
star formation. Our results suggest that dS0s are most likely transitional
objects at the stage of subsequent transformation of late-type progenitors to
ordinary red dEs in the cluster environment. In any case, UV photometry
provides a powerful tool to disentangle the diverse subpopulations of
early-type dwarf galaxies and uncover their evolutionary histories.
","[{""version"":""v1"",""created"":""Sat, 21 Aug 2010 10:00:46 GMT""}]","2015-05-19"
"1008.3623","Alexander Eisfeld","Jan Roden, Alexander Eisfeld, John S. Briggs","The J- and H-bands of dye aggregate spectra: Analysis of the coherent
  exciton scattering (CES) approximation",,"Chem. Phys. 352 (2008) 258","10.1016/j.chemphys.2008.07.001",,"physics.chem-ph cond-mat.mes-hall quant-ph","http://arxiv.org/licenses/nonexclusive-distrib/1.0/","  The validity of the CES approximation is investigated by comparison with
direct diagonalisation of a model vibronic Hamiltonian of $N$ identical
monomers interacting electronically. Even for quite short aggregates (N\gtrsim
6) the CES approximation is shown to give results in agreement with direct
diagonalisation, for all coupling strengths, except that of intermediate
positive coupling (the H-band region). However, previously excellent agreement
of CES calculations and measured spectra in the H-band region was obtained [A.
Eisfeld, J. S. Briggs, Chem. Phys. 324, 376]. This is shown to arise from use
of the measured monomer spectrum which includes implicitly dissipative effects
not present in the model calculation.
","[{""version"":""v1"",""created"":""Sat, 21 Aug 2010 10:38:02 GMT""}]","2010-08-24"
"1008.3624","Rossella Cassano","R. Cassano, S. Ettori, S. Giacintucci, G. Brunetti, M. Markevitch, T.
  Venturi, M. Gitti","On the connection between giant radio halos and cluster mergers","5 pages, 1 figure, ApJ Letter in press","The Astrophysical Journal Letters, Volume 721, Issue 2, pp.
  L82-L85 (2010)","10.1088/2041-8205/721/2/L82",,"astro-ph.CO","http://arxiv.org/licenses/nonexclusive-distrib/1.0/","  The frequently observed association between giant radio halos and merging
galaxy clusters has driven present theoretical models of non-thermal emission
from galaxy clusters, which are based on the idea that the energy dissipated
during cluster-cluster mergers could power the formation of radio halos. To
quantitatively test the merger-halo connection we present the first statistical
study based on deep radio data and X-ray observations of a complete X-ray
selected sample of galaxy clusters with X-ray luminosity > 5x 10^44 erg/s and
redshift 0.2<z< 0.32. Using several methods to characterize cluster
substructures, namely the power ratios, centroid shift and X-ray brightness
concentration parameter, we show that clusters with and without radio halo can
be quantitatively differentiated in terms of their dynamical properties. In
particular, we confirm that radio halos are associated to dynamically disturbed
clusters and cluster without radio halo are more ""relaxed"", with only a couple
of exceptions where a disturbed cluster does not exhibit a halo.
","[{""version"":""v1"",""created"":""Sat, 21 Aug 2010 10:41:59 GMT""}]","2010-11-09"
