"1008.3546","Ioannis Paparrizos","Ioannis Paparrizos","Homogeneous and Non Homogeneous Algorithms","This (full) paper was accepted for publication in the 13th
  Panhellenic Conference on Informatics (PCI 2009), 10-12 September 2009,
  Corfu, Greece (8 pages)",,,,"cs.DS cs.CC","http://arxiv.org/licenses/nonexclusive-distrib/1.0/","  Motivated by recent best case analyses for some sorting algorithms and based
on the type of complexity we partition the algorithms into two classes:
homogeneous and non homogeneous algorithms. Although both classes contain
algorithms with worst and best cases, homogeneous algorithms behave uniformly
on all instances. This partition clarifies in a completely mathematical way the
previously mentioned terms and reveals that in classifying an algorithm as
homogeneous or not best case analysis is equally important with worst case
analysis.
","[{""version"":""v1"",""created"":""Fri, 20 Aug 2010 17:58:00 GMT""}]","2010-08-23"
"1008.3547","Oleksiy Atramentov","D0 Collaboration, V. Abazov, et al.","Search for new fermions (""quirks"") at the Fermilab Tevatron Collider","submitted to Phys. Rev. Letters","Phys.Rev.Lett.105:211803,2010","10.1103/PhysRevLett.105.211803","FERMILAB-PUB-10-324-E","hep-ex","http://arxiv.org/licenses/nonexclusive-distrib/1.0/","  We report results of a search for particles with anomalously high ionization
in events with a high transverse energy jet and large missing transverse energy
in $2.4$ fb$^{-1}$ of integrated luminosity collected by the D0 experiment at
the Fermilab Tevatron $p\bar{p}$ collider. Production of such particles
(quirks) is expected in scenarios with extra QCD-like {\it SU(N)} sectors, and
this study is the first dedicated search for such signatures. We find no
evidence of a signal and set a lower mass limit of 107 ~GeV for the mass of a
charged quirk with strong dynamics scale $\Lambda$ in the range from 10 keV to
1 MeV.
","[{""version"":""v1"",""created"":""Fri, 20 Aug 2010 18:00:21 GMT""},{""version"":""v2"",""created"":""Thu, 21 Oct 2010 20:41:43 GMT""}]","2010-12-03"
"1008.3548","Michael Hochman","Michael Hochman","Geometric rigidity of times-m invariant measures","26 pages","Journal of the EMS, Volume 14, Issue 5, 2012, pp. 1539--1563","10.4171/JEMS/340",,"math.DS math.CA","http://arxiv.org/licenses/nonexclusive-distrib/1.0/","  Let b be an integer and mu a probability measure on [0,1] which is invariant
and ergodic multiplication by b mod 1, and 0<dim(mu)<1. Let f be a
diffeomorphism between open subsets of the line. We show that if the measures
mu and f(mu) are equivalent on f(E), then f'(x) is a rational power of b at
mu-a.e. point x in E. In particular, if g is a piecewise-analytic map
preserving mu then there is an open g-invariant set U supporting mu such that g
is piecewise-linear on U and has slopes which are rational powers of a. In a
similar vein, for mu as above, if c is another integer and b,c are not powers
of a common integer, and if nu is in variant for multiplication by c mod 1,
then f(mu) and f(nu) are mutually singular for all diffeomorphisms f of class
C^2. This generalizes the Rudolph-Johnson Theorem and shows that measure
rigidity of times-b and times-c is a result not of the structure of the abelian
action, but rather of their smooth conjugacy classes: if U,V are maps of the
1-torus which are C^2-conjugate to times-b and times-c, respectively, then they
have no common ergodic measures of positive dimension.
","[{""version"":""v1"",""created"":""Fri, 20 Aug 2010 18:14:20 GMT""},{""version"":""v2"",""created"":""Wed, 25 Aug 2010 17:04:43 GMT""}]","2014-09-23"
"1008.3549","Michael Hochman","Michael Hochman","Isomorphism and embedding of Borel systems on full sets","17 pages, v2: correction to bibliography","Acta Applicandae Mathematicae, Volume 126 (2013), Issue 1, pp
  187-201","10.1007/s10440-013-9846-z",,"math.DS","http://arxiv.org/licenses/nonexclusive-distrib/1.0/","  A Borel system consists of a measurable automorphism of a standard Borel
space. We consider Borel embeddings and isomorphisms between such systems
modulo null sets, i.e. sets which have measure zero for every invariant
probability measure. For every t>0 we show that in this category there exists a
unique free Borel system (Y,S) which is strictly t-universal in the sense that
all invariant measures on Y have entropy <t, and if (X,T) is another free
system obeying the same entropy condition then X embeds into Y off a null set.
One gets a strictly t-universal system from mixing shifts of finite type of
entropy at least t by removing the periodic points and ""restricting"" to the
part of the system of entropy <t. As a consequence, after removing their
periodic points the systems in the following classes are completely classified
by entropy up to Borel isomorphism off null sets: mixing shifts of finite type,
mixing positive-recurrent countable state Markov chains, mixing sofic shifts,
beta shifts, synchronized subshifts, and axiom-A diffeomorphisms. In particular
any two equal-entropy systems from these classes are entropy conjugate in the
sense of Buzzi, answering a question of Boyle, Buzzi and Gomez.
","[{""version"":""v1"",""created"":""Fri, 20 Aug 2010 18:21:53 GMT""},{""version"":""v2"",""created"":""Mon, 17 Dec 2012 13:21:07 GMT""}]","2014-09-23"
"1008.3550","Fernando Navarra","E.R. Cazaroto, F. Carvalho, V.P. Goncalves, M.S. Kugeratski and F.S.
  Navarra","Exclusive processes in electron - ion collisions","6 pages, 4 figures","Phys.Lett.B696:473-477,2011","10.1016/j.physletb.2010.12.071",,"hep-ph","http://arxiv.org/licenses/nonexclusive-distrib/1.0/","  The exclusive processes in electron-ion ($eA$) interactions are an important
tool to investigate the QCD dynamics at high energies as they are in general
driven by the gluon content of the target, which is strongly subject to parton
saturation effects. In this paper we compute the cross sections for the
exclusive vector meson production as well as the deeply virtual Compton
scattering (DVCS) relying on the color dipole approach and considering the
numerical solution of the Balitsky-Kovchegov equation including running
coupling corrections (rcBK). The production cross sections obtained with the
rcBK solution and bCGC parametrization are very similar, the former being
slightly larger.
","[{""version"":""v1"",""created"":""Fri, 20 Aug 2010 18:25:10 GMT""}]","2011-03-07"
"1008.3551","John Tomlin","Jian Yang, Erik Vee, Sergei Vassilvitskii, John Tomlin, Jayavel
  Shanmugasundaram, Tasos Anastasakos and Oliver Kennedy","Inventory Allocation for Online Graphical Display Advertising",,,,"YL-2010-004","cs.CE","http://arxiv.org/licenses/nonexclusive-distrib/1.0/","  We discuss a multi-objective/goal programming model for the allocation of
inventory of graphical advertisements. The model considers two types of
campaigns: guaranteed delivery (GD), which are sold months in advance, and
non-guaranteed delivery (NGD), which are sold using real-time auctions. We
investigate various advertiser and publisher objectives such as (a) revenue
from the sale of impressions, clicks and conversions, (b) future revenue from
the sale of NGD inventory, and (c) ""fairness"" of allocation. While the first
two objectives are monetary, the third is not. This combination of demand types
and objectives leads to potentially many variations of our model, which we
delineate and evaluate. Our experimental results, which are based on
optimization runs using real data sets, demonstrate the effectiveness and
flexibility of the proposed model.
","[{""version"":""v1"",""created"":""Fri, 20 Aug 2010 18:37:23 GMT""}]","2010-08-23"
"1008.3552","Pearl Sandick","Pearl Sandick, Juerg Diemand, Katherine Freese, and Douglas Spolyar","Black Holes in our Galactic Halo: Compatibility with FGST and PAMELA
  Data and Constraints on the First Stars","34 pages, 11 figures. v2: typos corrected, references added. v3:
  updated to match published version","JCAP 1101:018,2011","10.1088/1475-7516/2011/01/018","UTTG-09-10, TCC-016-10, MCTP-10-30, FERMILAB-PUB-10-319-A-PPD","astro-ph.CO astro-ph.HE","http://arxiv.org/licenses/nonexclusive-distrib/1.0/","  10 to 10^5 solar mass black holes with dark matter spikes that formed in
early minihalos and still exist in our Milky Way Galaxy today are examined in
light of recent data from the Fermi Gamma-Ray Space Telescope (FGST). The dark
matter spikes surrounding black holes in our Galaxy are sites of significant
dark matter annihilation. We examine the signatures of annihilations into
gamma-rays, electrons and positrons, and neutrinos. We find that some
significant fraction of the point sources detected by FGST might be due to dark
matter annihilation near black holes in our Galaxy. We obtain limits on the
properties of dark matter annihilations in the spikes using the information in
the FGST First Source Catalog as well as the diffuse gamma-ray flux measured by
FGST. We determine the maximum fraction of high redshift minihalos that could
have hosted the formation of the first generation of stars and, subsequently,
their black hole remnants. The strength of the limits depends on the choice of
annihilation channel and black hole mass; limits are strongest for the heaviest
black holes and annhilation to $b \bar{b}$ and $W^+W^-$ final states. The
larger black holes considered in this paper may arise as the remnants of Dark
Stars after the dark matter fuel is exhausted and thermonuclear burning runs
its course; thus FGST observations may be used to constrain the properties of
Dark Stars. Additionally, we comment on the excess positron flux found by
PAMELA and its possible interpretation in terms of dark matter annihilation
around these black hole spikes.
","[{""version"":""v1"",""created"":""Fri, 20 Aug 2010 18:42:12 GMT""},{""version"":""v2"",""created"":""Sat, 25 Sep 2010 19:59:46 GMT""},{""version"":""v3"",""created"":""Fri, 10 Jun 2011 21:08:04 GMT""}]","2011-06-14"
"1008.3553","Foek Hioe","F.T. Hioe and David Kuebel","Is a Circular Orbit Possible According to General Relativity?","12 pages, no figures, no tables. In this version we consider a
  broader parameter space for the orbits than in the original version",,,,"gr-qc","http://arxiv.org/licenses/nonexclusive-distrib/1.0/","  A new parameter space is used to classify circular orbits in the
Schwarzschild metric.
","[{""version"":""v1"",""created"":""Fri, 20 Aug 2010 18:44:18 GMT""},{""version"":""v2"",""created"":""Sun, 29 Aug 2010 20:39:05 GMT""}]","2010-08-31"
"1008.3554","Remigijus Mikulevicius","R. Mikulevicius and B.L. Rozovskii","On unbiased stochastic Navier-Stokes equation",,,"10.1007/s00440-011-0384-1",,"math.PR","http://arxiv.org/licenses/nonexclusive-distrib/1.0/","  A random perturbation of a deterministic Navier-Stokes equation is considered
in the form of an SPDE with Wick type nonlinearity. The nonlinear term of the
perturbation can be characterized as the highest stochastic order approximation
of the original nonlinear term u\nabla u. This perturbation is unbiased in that
the expectation of a solution of the perturbed equation solves the
deterministic Navier-Stokes equation. The perturbed equation is solved in the
space of generalized stochastic processes using the Cameron-Martin version of
the Wiener chaos expansion. It is shown that the generalized solution is a
Markov process and scales effectively by Catalan numbers.
","[{""version"":""v1"",""created"":""Fri, 20 Aug 2010 18:50:57 GMT""},{""version"":""v2"",""created"":""Sat, 4 Jun 2011 19:56:55 GMT""}]","2011-08-22"
"1008.3555","Daniel Jafferis","Evgeny Andriyash, Frederik Denef, Daniel L. Jafferis, Gregory W. Moore","Bound state transformation walls","65 pages, 16 figures",,"10.1007/JHEP03(2012)007","RUNHETC-2010-05","hep-th","http://arxiv.org/licenses/nonexclusive-distrib/1.0/","  In four dimensional N=2 supergravity theories, BPS bound states near marginal
stability are described by configurations of widely separated constituents with
nearly parallel central charges. When the vacuum moduli can be dialed
adiabatically until the central charges become anti -parallel, a paradox
arises. We show that this paradox is always resolved by the existence of ""bound
state transformation walls"" across which the nature of the bound state changes,
although the index does not jump. We find that there are two distinct phenomena
that can take place on these walls, which we call recombination and
conjugation. The latter is associated to the presence of singularities at
finite distance in moduli space. Consistency of conjugation and wall-crossing
rules near these singularities leads to new constraints on the BPS spectrum.
Singular loci supporting massless vector bosons are particularly subtle in this
respect. We argue that the spectrum at such loci necessarily contains massless
magnetic monopoles, and that bound states around them transform by intricate
hybrids of conjugation and recombination.
","[{""version"":""v1"",""created"":""Fri, 20 Aug 2010 18:52:52 GMT""}]","2015-05-19"
"1008.3556","Alexander Zharov","A. A. Zharov and I. S. Beloborodov","Frequency dependent polarizability of small metallic grains","8 pages, 3 figures","J. Phys.: Condens. Matter 23 (2011) 245302","10.1088/0953-8984/23/24/245302",,"cond-mat.mes-hall","http://creativecommons.org/licenses/publicdomain/","  We study the dynamic electronic polarizability of a single nano-scale
spherical metallic grain using quantum mechanical approach. We introduce the
model for interacting electrons bound in the grain allowing us numerically to
calculate the frequency dependence of the polarizability of grains of different
sizes. We show that within this model the main resonance peak corresponding to
the surface plasmon mode is blue-shifted and some minor secondary resonances
above and below the main peak exist. We study the behavior of blue shift as a
function of grain size and compare our findings with the classical
polarizability and with other results in the literature.
","[{""version"":""v1"",""created"":""Fri, 20 Aug 2010 19:13:51 GMT""},{""version"":""v2"",""created"":""Thu, 19 May 2011 21:58:53 GMT""}]","2011-05-30"
"1008.3557","M Zahid Hasan","Su-Yang Xu, L. A. Wray, Y. Xia, R. Shankar, S. Jia, A. Fedorov, J. H.
  Dil, F. Meier, B. Slomski, J. Osterwalder, R. J. Cava, and M. Z. Hasan","Observation of Topological Order in the TlBiSe2 class : Probing the
  ""spin"" and ""phase"" on topological insulator surfaces","4 pages, 2 Figures, Results are incorporated into the Supplementary
  Info (SOM) Section of Science 332, 560 (2011)",,,,"cond-mat.mes-hall cond-mat.quant-gas cond-mat.str-el","http://arxiv.org/licenses/nonexclusive-distrib/1.0/","  A topological insulator is characterized by spin-momentum locking on its
boundary. The spin momentum locking on the surface of a three dimensional
topological insulator leads to the existence of a non-trivial Berry's phase
which leads to exotic transport phenomena on topological surfaces. Using
spin-sensitive probes (Mott polarimetry), we observe the spin-momentum coupling
and uncover the chiral nature of surface electrons in TlBiSe2. We demonstrate
that the surface electrons in TlBiSe2 collectively carry a quantum Berry's
phase of $\pi$ and a definite chirality ($\eta$ = -1, left-handed) associated
with its spin-texture or vortex-structure on the Fermi surface on both the top
and the bottom surfaces. Our experimental results for the first time not only
prove the existence of Z2 topological-order in the bulk but also reveal the
existence of helical quasiparticle modes on the topological surface.
Spin-texture calculations would be reported elsewhere.
","[{""version"":""v1"",""created"":""Fri, 20 Aug 2010 19:26:04 GMT""},{""version"":""v2"",""created"":""Tue, 5 Jun 2012 18:23:10 GMT""}]","2012-06-06"
"1008.3558","Mykyta Chubynsky","Mykyta V. Chubynsky and Gary W. Slater","Optimizing the accuracy of Lattice Monte Carlo algorithms for simulating
  diffusion","59 pages, 10 figures",,,,"cond-mat.stat-mech physics.comp-ph","http://arxiv.org/licenses/nonexclusive-distrib/1.0/","  The behavior of a Lattice Monte Carlo algorithm (if it is designed correctly)
must approach that of the continuum system that it is designed to simulate as
the time step and the mesh step tend to zero. However, we show for an algorithm
for unbiased particle diffusion that if one of these two parameters remains
fixed, the accuracy of the algorithm is optimal for a certain finite value of
the other parameter. In one dimension, the optimal algorithm with moves to the
two nearest neighbor sites reproduces the correct second and fourth moments
(and minimizes the error for the higher moments at large times) of the particle
distribution and preserves the first two moments of the first-passage time
distributions. In two and three dimensions, the same level of accuracy requires
simultaneous moves along two axes (""diagonal"" moves). Such moves attempting to
cross an impenetrable boundary should be projected along the boundary, rather
than simply rejected. We also treat the case of absorbing boundaries.
","[{""version"":""v1"",""created"":""Fri, 20 Aug 2010 19:30:21 GMT""}]","2010-08-23"
"1008.3559","Alex Bernardini Dr.","Alex E. Bernardini","Equilibrium and stability of neutrino lumps as TOV solutions","20 pages, 5 figures","Gen. Rel. Grav.43: 245-260,2011","10.1007/s10714-010-1089-y",,"astro-ph.CO gr-qc","http://arxiv.org/licenses/nonexclusive-distrib/1.0/","  We report about stability conditions for static, spherically symmetric
objects that share the essential features of mass varying neutrinos in
cosmological scenarios. Compact structures of particles with variable mass are
held together preponderantly by an attractive force mediated by a background
scalar field. Their corresponding conditions for equilibrium and stability are
given in terms of the ratio between the total mass-energy and the spherical
lump radius, $M/R$. We show that the mass varying mechanism leading to lump
formation can modify the cosmological predictions for the cosmological neutrino
mass limits. Our study comprises Tolman-Oppenheimer-Volkoff solutions of
relativistic objects with non-uniform energy densities. The results leave open
some questions concerning stable regular solutions that, to an external
observer, very closely reproduce the preliminary conditions to form
Schwarzschild black holes.
","[{""version"":""v1"",""created"":""Fri, 20 Aug 2010 19:38:40 GMT""}]","2011-06-03"
"1008.3560","Igor Rumanov","Igor Rumanov","All the lowest order PDE for spectral gaps of Gaussian matrices","22 pages, references corrected, remark added",,,,"math-ph math.MP","http://arxiv.org/licenses/nonexclusive-distrib/1.0/","  Tracy-Widom (TW) equations for one-matrix unitary ensembles (UE) (equivalent
to a particular case of Schlesinger equations for isomonodromic deformations)
are rewritten in a general form which allows one to derive all the lowest order
equations (PDE) for spectral gap probabilities of UE without intermediate
higher-order PDE. This is demonstrated on the example of Gaussian ensemble
(GUE) for which all the third order PDE for gap probabilities are obtained
explicitly. Moreover, there is a {\it second order} PDE for GUE probabilities
in the case of more than one spectral endpoint.
  This approach allows to derive all PDE at once where possible, while in the
method based on Hirota bilinear identities and Virasoro constraints starting
with different bilinear identities leads to different subsets of the full set
of equations.
","[{""version"":""v1"",""created"":""Fri, 20 Aug 2010 19:41:06 GMT""},{""version"":""v2"",""created"":""Mon, 23 Aug 2010 01:54:24 GMT""}]","2010-08-24"
"1008.3561","Marinela Miladinova","Rana Naim, Mohammad Fahim Nizam, Sheetal Hanamasagar, Jalal
  Noureddine, Marinela Miladinova","Comparative Studies of 10 Programming Languages within 10 Diverse
  Criteria - a Team 10 COMP6411-S10 Term Report","126 pages",,,,"cs.PL","http://arxiv.org/licenses/nonexclusive-distrib/1.0/","  This is a survey on the programming languages: C++, JavaScript, AspectJ, C#,
Haskell, Java, PHP, Scala, Scheme, and BPEL. Our survey work involves a
comparative study of these ten programming languages with respect to the
following criteria: secure programming practices, web application development,
web service composition, OOP-based abstractions, reflection, aspect
orientation, functional programming, declarative programming, batch scripting,
and UI prototyping. We study these languages in the context of the above
mentioned criteria and the level of support they provide for each one of them.
","[{""version"":""v1"",""created"":""Fri, 20 Aug 2010 19:50:52 GMT""}]","2010-08-23"
"1008.3562","Juan Antonio Aguilar-Saavedra","J. A. Aguilar-Saavedra","Effective four-fermion operators in top physics: a roadmap","LaTeX 43 pages, 1 PS figure. Cross sections for uu,cc -> tt corrected","Nucl.Phys.B843:638-672,2011; Erratum-ibid.B851:443-444,2011","10.1016/j.nuclphysb.2010.10.015 10.1016/j.nuclphysb.2011.06.003",,"hep-ph hep-ex","http://arxiv.org/licenses/nonexclusive-distrib/1.0/","  We write down a minimal basis for dimension-six gauge-invariant four-fermion
operators, with some operator replacements with respect to previous ones which
make it simpler for calculations. Using this basis we classify all four-fermion
operator contributions involving one or two top quarks. Taking into account the
different fermion chiralities, possible colour contractions and independent
flavour combinations, a total number of 572 gauge-invariant operators are
involved. We apply this to calculate all three-body top decay widths t -> d_k
u_i dbar_j, t -> d_k e_i+ nu_j, t -> u_k u_i ubar_j, t -> u_k e_j+ e_i-, t ->
u_k nu_j nu_i (with i,j,k generation indices) mediated by dimension-six
four-fermion operators, including the interference with the Standard Model
amplitudes when present. All single top production cross sections in pp, p pbar
and e+ e- collisions are calculated as well, namely u_i d_k -> d_j t, dbar_j
d_k -> ubar_i t, u_i dbar_j -> dbar_k t, u_i u_k -> u_j t, u_i ubar_j -> ubar_k
t, e+ e- -> ubar_k t and the charge conjugate processes. We also compute all
top pair production cross sections, ubar_i u_j -> t tbar, dbar_i d_j -> t tbar,
u_i u_j -> t t and e+ e- -> t tbar. Our results are completely general, without
assuming any particular relation among effective operator coefficients.
","[{""version"":""v1"",""created"":""Fri, 20 Aug 2010 20:00:07 GMT""},{""version"":""v2"",""created"":""Tue, 2 Nov 2010 14:17:20 GMT""},{""version"":""v3"",""created"":""Mon, 6 Jun 2011 11:23:01 GMT""}]","2011-07-13"
"1008.3563","Daniel Stern","Daniel Stern, James G. Bartlett, Mark Brodwin, Asantha Cooray, Roc
  Cutri, Arjun Dey, Peter Eisenhardt, Anthony Gonzalez, Jason Kalirai, Amy
  Mainzer, Leonidas Moustakas, Jason Rhodes, S. Adam Stanford and Edward L.
  Wright","The Near-Infrared Sky Surveyor","A Response to the Astro2010 Request for Information by the
  Electromagnetic Observations from Space (EOS) Panel",,,,"astro-ph.IM","http://arxiv.org/licenses/nonexclusive-distrib/1.0/","  [NIRSS is one of three concepts that contributed to the Wide-Field Infrared
Survey Telescope (WFIRST) mission advocated by the Decadal Survey.] Operating
beyond the reaches of the Earth's atmosphere, free of its limiting absorption
and thermal background, the Near-Infrared Sky Surveyor (NIRSS) will deeply map
the entire sky at near-infrared wavelengths, thereby enabling new and
fundamental discoveries ranging from the identification of extrasolar planets
to probing the reionization epoch by identifying thousands of quasars at z>10.
NIRSS will directly address the NASA scientific objective of studying cosmic
origins by using a 1.5-meter telescope to reach full-sky 0.2 uJy (25.6 mag AB)
sensitivities in four passbands from 1 to 4 microns in a 4-yr mission. At the
three shorter passbands (1 - 2.5 microns), the proposed depth is comparable to
the deepest pencil-beam surveys done to date and is 3000 times more sensitive
than the only previous all-sky near-infrared survey, 2MASS. At the longest
passband (3.5 micron), which is not feasible from the ground, NIRSS will be 500
times more sensitive than WISE. NIRSS fills a pivotal gap in our knowledge of
the celestial sphere, is a natural complement to WISE, and is well matched to
the next generation of deep (0.1 uJy), wide-area (>2 pi ster), ground-based
optical surveys (LSST and Pan-Starrs). With the high thermal backgrounds of
ground-based infrared observations, a near-infrared full sky survey at sub-uJy
sensitivity is only feasible from space.
","[{""version"":""v1"",""created"":""Fri, 20 Aug 2010 20:00:13 GMT""}]","2010-08-24"
"1008.3564","Michael Mulhearn","D0 Collaboration, V. Abazov, et al","Search for ZH to llbb production in 4.2 fb^-1 of ppbar collisions at
  sqrt(s) = 1.96 TeV","submitted to Phys. Rev. Letters","Phys.Rev.Lett.105:251801,2010","10.1103/PhysRevLett.105.251801","FERMILAB-PUB-10-325-E","hep-ex","http://arxiv.org/licenses/nonexclusive-distrib/1.0/","  We present a search for the standard model Higgs boson produced in
association with a Z boson in 4.2 fb^-1 of p-pbar collisions, collected with
the D0 detector at the Fermilab Tevatron at sqrt(s) = 1.96 TeV. Selected events
contain one reconstructed Z to llbb candidate and at least two jets, including
at least one b-tagged jet. In the absence of an excess over the background
expected from other standard model processes, limits on the ZH cross section
multiplied by the branching ratios are set. The limit at M_H = 115 GeV is a
factor of 5.9 larger than the standard model prediction.
","[{""version"":""v1"",""created"":""Fri, 20 Aug 2010 20:01:33 GMT""}]","2010-12-28"
