"1008.3527","Grebert Benoit","Benoit Grebert, Carlos Villegas-Blas","On the energy exchange between resonant modes in nonlinear Schr\""odinger
  equations",,,,,"math.DS math-ph math.MP","http://arxiv.org/licenses/nonexclusive-distrib/1.0/","  We consider the nonlinear Schr\""odinger equation $$ i\psi_t= -\psi_{xx}\pm
2\cos 2x \ |\psi|^2\psi,\quad x\in S^1,\ t\in \R$$ and we prove that the
solution of this equation, with small initial datum $\psi_0=\e (\cos x+\sin
x)$, will periodically exchange energy between the Fourier modes $e^{ix}$ and
$e^{-ix}$. This beating effect is described up to time of order $\e^{-9/4}$
while the frequency is of order $\e^2$. We also discuss some generalizations.
","[{""version"":""v1"",""created"":""Fri, 20 Aug 2010 16:01:24 GMT""}]","2010-08-23"
"1008.3528","Rafael S\'anchez","Rafael S\'anchez and Markus Buttiker","Optimal energy quanta to current conversion","9 pages, 6 figures","Phys. Rev. B 83, 085428 (2011)","10.1103/PhysRevB.83.085428",,"cond-mat.mes-hall","http://arxiv.org/licenses/nonexclusive-distrib/1.0/","  We present a microscopic discussion of a nano-sized structure which uses the
quantization of energy levels and the physics of single charge Coulomb
interaction to achieve an optimal conversion of heat flow to directed current.
In our structure the quantization of energy levels and the Coulomb blockade
lead to the transfer of quantized packets of energy from a hot source into an
electric conductor to which it is capacitively coupled. The fluctuation
generated transfer of a single energy quantum translates into the directed
motion of a single electron. Thus in our structure the ratio of the charge
current to the heat current is determined by the ratio of the charge quantum to
the energy quantum. An important novel aspect of our approach is that the
direction of energy flow and the direction of electron motion are decoupled.
","[{""version"":""v1"",""created"":""Fri, 20 Aug 2010 16:02:07 GMT""},{""version"":""v2"",""created"":""Tue, 8 Mar 2011 10:51:52 GMT""}]","2011-03-09"
"1008.3529","Yanki Lekili","Yanki Lekili","Planar open books with four binding components","19 pages, 10 figures. Two cancelling sign errors removed","Algebr. Geom. Topol. 11 (2011) 909-928","10.2140/agt.2011.11.909",,"math.GT math.SG","http://arxiv.org/licenses/nonexclusive-distrib/1.0/","  We study an explicit construction of planar open books with four binding
components on any three-manifold which is given by integral surgery on three
component pure braid closures. This construction is general, indeed any planar
open book with four binding components is given this way. Using this
construction and results on exceptional surgeries on hyperbolic links, we show
that any contact structure of S^3 supports a planar open book with four binding
components, determining the minimal number of binding components needed for
planar open books supporting these contact structures. In addition, we study a
class of monodromies of a planar open book with four binding components in
detail. We characterize all the symplectically fillable contact structures in
this class and we determine when the Ozsvath-Szabo contact invariant vanishes.
As an application, we give an example of a right-veering diffeomorphism on the
four-holed sphere which is not destabilizable and yet supports an overtwisted
contact structure. This provides a counterexample to a conjecture of Honda,
Kazez, Matic from arXiv:0609734 .
","[{""version"":""v1"",""created"":""Fri, 20 Aug 2010 16:05:29 GMT""},{""version"":""v2"",""created"":""Mon, 30 Aug 2010 15:40:33 GMT""}]","2014-10-01"
"1008.3530","Roberto Francesco Pizzo","R. F. Pizzo, A. G. de Bruyn, G. Bernardi, M. A. Brentjens","Deep multi-frequency rotation measure tomography of the galaxy cluster
  A2255","24 pages, 19 figures",,"10.1051/0004-6361/201014158",,"astro-ph.CO","http://arxiv.org/licenses/nonexclusive-distrib/1.0/","  We aim to unveil their 3-dimensional geometry of Abell 2255 through WSRT
observations at 18, 21, 25, 85, and 200 cm. The polarization images of the
cluster were processed through rotation measure (RM) synthesis, producing three
final RM cubes. The radio galaxies and the filaments at the edges of the halo
are detected in the high-frequency RM cube, obtained by combining the data at
18, 21, and 25 cm. Their Faraday spectra show different levels of complexity.
The radio galaxies lying near by the cluster center have Faraday spectra with
multiple peaks, while those at large distances show only one peak, as do the
filaments. Similar RM distributions are observed for the external radio
galaxies and for the filaments, with much lower average RM values and RM
variance than those found in previous works for the central radio galaxies. The
85 cm RM cube is dominated by the Galactic foreground emission, but it also
shows features associated with the cluster. At 2 m, no polarized emission from
A2255 nor our Galaxy is detected. The radial trend observed in the RM
distributions of the radio galaxies and in the complexity of their Faraday
spectra favors the interpretation that the external Faraday screen for all the
sources in A2255 is the ICM. Its differential contribution depends on the
amount of medium that the radio signal crosses along the line of sight. The
filaments should therefore be located at the periphery of the cluster, and
their apparent central location comes from projection effects. Their high
fractional polarization and morphology suggest that they are relics rather than
part of a genuine radio halo. Their inferred large distance from the cluster
center and their geometry could argue for an association with large-scale
structure (LSS) shocks.
","[{""version"":""v1"",""created"":""Fri, 20 Aug 2010 16:09:14 GMT""}]","2015-05-19"
"1008.3531","Hugo Touchette","A. Baule, H. Touchette, E. G. D. Cohen","Stick-slip motion of solids with dry friction subject to random
  vibrations and an external field","v1: 23 pages, 9 figures; v2: Reference list corrected; v3: Published
  version, typos corrected, references added","Nonlinearity 24, 351-372, 2011","10.1088/0951-7715/24/2/001",,"cond-mat.stat-mech","http://arxiv.org/licenses/nonexclusive-distrib/1.0/","  We investigate a model for the dynamics of a solid object, which moves over a
randomly vibrating solid surface and is subject to a constant external force.
The dry friction between the two solids is modeled phenomenologically as being
proportional to the sign of the object's velocity relative to the surface, and
therefore shows a discontinuity at zero velocity. Using a path integral
approach, we derive analytical expressions for the transition probability of
the object's velocity and the stationary distribution of the work done on the
object due to the external force. From the latter distribution, we also derive
a fluctuation relation for the mechanical work fluctuations, which incorporates
the effect of the dry friction.
","[{""version"":""v1"",""created"":""Fri, 20 Aug 2010 16:21:52 GMT""},{""version"":""v2"",""created"":""Mon, 23 Aug 2010 21:06:10 GMT""},{""version"":""v3"",""created"":""Sun, 19 Dec 2010 14:04:53 GMT""}]","2010-12-21"
"1008.3532","Antony Carrington","A. Serafin, J.D. Fletcher, S. Adachi, N.E. Hussey, and A. Carrington","Destruction of chain-superconductivity in YBa_2Cu_4O_8 in a weak
  magnetic field","5 pages","Phys. Rev. B 82, 140506(R) (2010)","10.1103/PhysRevB.82.140506",,"cond-mat.supr-con cond-mat.str-el","http://arxiv.org/licenses/nonexclusive-distrib/1.0/","  We report measurements of the temperature dependent components of the
magnetic penetration depth {\lambda}(T) in single crystal samples of
YBa_2Cu_4O_8 using a radio frequency tunnel diode oscillator technique. We
observe a downturn in {\lambda}(T) at low temperatures for currents flowing
along the b and c axes but not along the a axis. The downturn in {\lambda}_b is
suppressed by a small dc field of ~0.25 T. This and the zero field anisotropy
of {\lambda}(T) likely result from proximity induced superconducting on the CuO
chains, however we also discuss the possibility that a significant part of the
anisotropy might originate from the CuO2 planes.
","[{""version"":""v1"",""created"":""Fri, 20 Aug 2010 16:22:23 GMT""}]","2010-10-22"
"1008.3533","Md. Saiful Islam","Md. Saiful Islam","A Novel Quantum Cost Efficient Reversible Full Adder Gate in
  Nanotechnology","7 pages, 12 figures, 1 table",,,,"cs.AR","http://arxiv.org/licenses/nonexclusive-distrib/1.0/","  Reversible logic has become one of the promising research directions in low
power dissipating circuit design in the past few years and has found its
applications in low power CMOS design, cryptography, optical information
processing and nanotechnology. This paper presents a novel and quantum cost
efficient reversible full adder gate in nanotechnology. This gate can work
singly as a reversible full adder unit and requires only one clock cycle. The
proposed gate is a universal gate in the sense that it can be used to
synthesize any arbitrary Boolean functions. It has been demonstrated that the
hardware complexity offered by the proposed gate is less than the existing
counterparts. The proposed reversible full adder gate also adheres to the
theoretical minimum established by the researchers.
","[{""version"":""v1"",""created"":""Fri, 20 Aug 2010 16:23:54 GMT""}]","2010-08-23"
"1008.3534","Jonas Kjall","Jonas A. Kj\""all, Frank Pollmann, Joel E. Moore","Bound states and E_8 symmetry effects in perturbed quantum Ising chains","4 pages, 3 figures","J. Kj\""all, F. Pollmann and J. E. Moore, Phys. Rev B 83, 020407
  (2011)","10.1103/PhysRevB.83.020407",,"cond-mat.str-el","http://arxiv.org/licenses/nonexclusive-distrib/1.0/","  In a recent experiment on CoNb_2O_6, Coldea et al. [Science 327, 177 (2010)]
found for the first time experimental evidence of the exceptional Lie algebra
E_8. The emergence of this symmetry was theoretically predicted long ago for
the transverse quantum Ising chain in the presence of a weak longitudinal
field. We consider an accurate microscopic model of CoNb_2O_6 incorporating
additional couplings and calculate numerically the dynamical structure function
using a recently developed matrix-product-state method. The excitation spectra
show bound states characteristic of the weakly broken E_8 symmetry. We compare
the observed bound state signatures in this model to those found in the
transverse Ising chain in a longitudinal field and to experimental data.
","[{""version"":""v1"",""created"":""Fri, 20 Aug 2010 16:26:05 GMT""},{""version"":""v2"",""created"":""Sun, 4 Sep 2011 06:04:43 GMT""}]","2011-09-06"
"1008.3535","Tatsuro Yuge","Tatsuro Yuge","Sum rule for response function in nonequilibrium Langevin systems","8 pages","Phys. Rev. E 82, 051130 (2010)","10.1103/PhysRevE.82.051130",,"cond-mat.stat-mech","http://arxiv.org/licenses/nonexclusive-distrib/1.0/","  We derive general properties of the linear response functions of
nonequilibrium steady states in Langevin systems. These correspond to extension
of the results which were recently found in Hamiltonian systems [A. Shimizu and
T. Yuge, J. Phys. Soc. Jpn. {\bf 79}, 013002 (2010)]. We discuss one of the
properties, the sum rule for the response function, in particular detail. We
show that the sum rule for the response function of the velocity holds in the
underdamped case, whereas it is violated in the overdamped case. This implies
that the overdamped Langevin models should be used with great care. We also
investigate the relation of the sum rule to an equality on the energy
dissipation in nonequilibrium Langevin systems, which was derived by Harada and
Sasa.
","[{""version"":""v1"",""created"":""Fri, 20 Aug 2010 16:26:47 GMT""},{""version"":""v2"",""created"":""Wed, 15 Dec 2010 03:41:53 GMT""}]","2015-05-19"
"1008.3536","Joerg Jaeckel","Joerg Jaeckel and Sabyasachi Roy","Spectroscopy as a test of Coulomb's law - A probe of the hidden sector","20 pages, 8 figures. Revised version: Corrected sign error in the
  discussion of the muonic hydrogen anomaly. The hidden photon explanation is
  now also ruled out by the Lamb shift in ordinary hydrogen","Phys.Rev.D82:125020,2010","10.1103/PhysRevD.82.125020","IPPP/10/67, DCPT/10/134","hep-ph hep-ex hep-th","http://arxiv.org/licenses/nonexclusive-distrib/1.0/","  High precision spectroscopy can provide a sensitive tool to test Coulomb's
law on atomic length scales. This can then be used to constrain particles such
as extra ""hidden"" photons or minicharged particles that are predicted in many
extensions of the standard model, and which cause small deviations from
Coulomb's law. In this paper we use a variety of transitions in atomic
hydrogen, hydrogenic ions, and exotic atoms to probe Coulomb's law. This
extends the region of pure Coulomb's law tests to larger masses. For hidden
photons and minicharged particles this region is already tested by other
astrophysical and laboratory probes. However, future tests of true muonium and
muonic atoms are likely to probe new parameter space and therefore have good
discovery potential for new physics. Finally, we investigate whether the
discrepancy between the theoretical calculation of the 2s_{1/2}^{F=1} -
2p_{3/2}^{F=2} transition in muonic hydrogen and its recent experimental
measurement at PSI can be explained by the existence of a hidden photon. This
explanation is ruled out by measurements of the Lamb shift in ordinary
hydrogen.
","[{""version"":""v1"",""created"":""Fri, 20 Aug 2010 16:28:24 GMT""},{""version"":""v2"",""created"":""Thu, 2 Sep 2010 17:55:27 GMT""}]","2010-12-24"
"1008.3537","Bruno Yabu-uti M.Sc.","Bruno F. C. Yabu-uti and Jos\'e A. Roversi","Perfect and flexible quantum state transfer in the hybrid system atom
  coupled-cavity","14 pages, 7 figures, IOP style",,,,"quant-ph","http://arxiv.org/licenses/nonexclusive-distrib/1.0/","  We investigate a system composed of $N$ coupled cavities and two-level atoms
interacting one at a time. Adjusting appropriately the atom-field detuning, and
make the hopping rate of photons between neighboring cavities, $A$, greater
than the atom-field coupling $g$ (i.e. $A>>g$), we can eliminate the
interaction of the atom with the nonresonant normal modes reducing the dynamics
to the interaction of the atom with only a single-mode. As an application of
this interaction, we analyze the transmission of an arbitrary atomic quantum
state between distant coupled cavities. In the ideal case, we obtain a flexible
and perfect quantum communication. Considering the influence of dissipation an
interesting parity effect emerge and we obtain $N$ maximum in which it is still
possible to achieve a quantum communication more efficient than a purely
classical channel between the ends. We also studied important sources of
imperfections in procedure execution.
","[{""version"":""v1"",""created"":""Fri, 20 Aug 2010 16:28:50 GMT""}]","2010-08-23"
"1008.3538","Alok Shukla","Kondayya Gundra and Alok Shukla","Theory of Electro-Optical Properties of Graphene Nanoribbons","6 pages, 4 figures (included), accepted in Phys. Rev. B","Phys. Rev. B 83, 075413 (2011)","10.1103/PhysRevB.83.075413",,"cond-mat.mtrl-sci","http://arxiv.org/licenses/nonexclusive-distrib/1.0/","  We present calculations of the optical absorption and electro-absorption
spectra of graphene nanoribbons (GNRs) using a $\pi-$electron approach,
incorporating long-range Coulomb interactions within the Pariser-Parr-Pople
(PPP) model Hamiltonian. The approach is carefully bench marked by computing
quantities such as the band structure, electric-field driven half metallicity,
and linear optical absorption spectra of GNRs of various types, and the results
are in good agreement with those obtained using\emph{ab initio} calculations.
Our predictions on the linear absorption spectra for the transversely polarized
photons provide a means to characterize GNRs by optical probes. We also compute
the electro-absorption spectra of the zigzag GNRs, and argue that it can be
used to determine, whether or not, they have a magnetic ground state, thereby
allowing the edge magnetism to be probed through non-magnetic experiments.
","[{""version"":""v1"",""created"":""Fri, 20 Aug 2010 16:46:18 GMT""},{""version"":""v2"",""created"":""Thu, 6 Jan 2011 01:10:46 GMT""}]","2011-02-14"
"1008.3539","Luan Ghezzi","L. Ghezzi, K. Cunha, S. C. Schuler, V. V. Smith","Metallicities of Planet Hosting Stars: A Sample of Giants and Subgiants","38 pages, 7 figures, 4 tables, accepted for publication in ApJ","Astrophysical Journal 725 (2010) 721-733","10.1088/0004-637X/725/1/721",,"astro-ph.SR","http://arxiv.org/licenses/nonexclusive-distrib/1.0/","  This work presents a homogeneous derivation of atmospheric parameters and
iron abundances for a sample of giant and subgiant stars which host giant
planets, as well as a control sample of subgiant stars not known to host giant
planets. The analysis is done using the same technique as for our previous
analysis of a large sample of planet-hosting and control sample dwarf stars. A
comparison between the distributions of [Fe/H] in planet-hosting main-sequence
stars, subgiants, and giants within these samples finds that the main-sequence
stars and subgiants have the same mean metallicity of <[Fe/H]> \simeq +0.11
dex, while the giant sample is typically more metal poor, having an average
metallicity of <[Fe/H]> = -0.06 dex. The fact that the subgiants have the same
average metallicities as the dwarfs indicates that significant accretion of
solid metal-rich material onto the planet-hosting stars has not taken place, as
such material would be diluted in the evolution from dwarf to subgiant. The
lower metallicity found for the planet-hosting giant stars in comparison with
the planet-hosting dwarfs and subgiants is interpreted as being related to the
underlying stellar mass, with giants having larger masses and thus, on average
larger-mass protoplanetary disks. In core accretion models of planet formation,
larger disk masses can contain the critical amount of metals necessary to form
giant planets even at lower metallicities.
","[{""version"":""v1"",""created"":""Fri, 20 Aug 2010 17:19:09 GMT""},{""version"":""v2"",""created"":""Mon, 4 Oct 2010 16:13:09 GMT""}]","2010-11-23"
"1008.3540","Ye Lu","Ye Lu, Brett R. Goldsmith, Nicholas J. Kybert, A.T. Charlie Johnson","DNA-decorated graphene chemical sensors","7 pages, To appear in Applied Physics Letters","Appl. Phys. Lett. 97, 083107 (2010)","10.1063/1.3483128",,"cond-mat.mes-hall cond-mat.mtrl-sci","http://creativecommons.org/licenses/by-nc-sa/3.0/","  Graphene is a true two dimensional material with exceptional electronic
properties and enormous potential for practical applications. Graphene's
promise as a chemical sensor material has been noted but there has been
relatively little work on practical chemical sensing using graphene, and in
particular how chemical functionalization may be used to sensitize graphene to
chemical vapors. Here we show one route towards improving the ability of
graphene to work as a chemical sensor by using single stranded DNA as a
sensitizing agent. The resulting broad response devices show fast response
times, complete and rapid recovery to baseline at room temperature, and
discrimination between several similar vapor analytes.
","[{""version"":""v1"",""created"":""Fri, 20 Aug 2010 17:27:30 GMT""}]","2015-05-19"
"1008.3541","Andy Gallagher","A. J. Gallagher and S. G. Ryan and A. E. Garc\'ia P\'erez and W. Aoki","The barium isotopic mixture for the metal-poor subgiant star HD140283","16 pages, 10 figures, 7 tables, 1 online appendix Accepted by A&A",,"10.1051/0004-6361/201014970",,"astro-ph.SR","http://arxiv.org/licenses/nonexclusive-distrib/1.0/","  Current theory regarding heavy element nucleosynthesis in metal-poor
environments states that the r-process would be dominant. The star HD140283 has
been the subject of debate after it appeared in some studies to be dominated by
the s-process. We provide an independent measure of the Ba isotope mixture in
HD140283 using an extremely high quality spectrum and an extensive chi^2
analysis. We exploit hyperfine splitting of the BaII 4554 \AA\ and 4934 \AA\
resonance lines in an effort to constrain the isotope ratio in 1D LTE. Using
the code ATLAS in conjunction with KURUCZ06 model atmospheres we analyse 93 Fe
lines to determine the star's macroturbulence. With this information we
construct a grid of Ba synthetic spectra and, using a \chi^2 code, fit these to
our observed data to determine the isotopic ratio, fodd, which represents the
ratio of odd to even isotopes. We also analyse the Eu lines. We set a new upper
limit of the rotation of HD140283 at vsin{i}\leq3.9\kms, a new upper limit on
[Eu/H] < -2.80 and abundances [Fe/H] = -2.59\pm0.09, [Ba/H] = -3.46\pm0.11.
This leads to a new lower limit on [Ba/Eu] > -0.66. We find that, in the
framework of a 1D LTE analysis, the isotopic ratios of Ba in HD140283 indicate
fodd=0.02\pm0.06, a purely s-process signature. This implies that observations
and analysis do not validate currently accepted theory. We speculate that a 1D
code, due to simplifying assumptions, is not adequate when dealing with
observations with high levels of resolution and S/N because of the turbulent
motions associated with a 3D stellar atmosphere. New approaches to analysing
isotopic ratios, in particular 3D hydrodynamics, need to be considered when
dealing with the levels of detail required to properly determine them. However
published 3D results exacerbate the disagreement between theory and
observation.
","[{""version"":""v1"",""created"":""Fri, 20 Aug 2010 17:33:50 GMT""}]","2016-08-14"
"1008.3542","Abhay Pasupathy","L. Zhao, K. T. Rim, H. Zhou, R. He, T. F. Heinz, A. Pinczuk, G. W.
  Flynn, A. N. Pasupathy","The Atomic-scale Growth of Large-Area Monolayer Graphene on
  Single-Crystal Copper Substrates",,,,,"cond-mat.mes-hall","http://arxiv.org/licenses/nonexclusive-distrib/1.0/","  We study the growth and microscopic structure of large-area graphene
monolayers, grown on copper single crystals by chemical vapor deposition (CVD)
in ultra-high vacuum (UHV). Using atomic-resolution scanning tunneling
microscopy (STM), we find that graphene grows primarily in registry with the
underlying copper lattice for both Cu(111) and Cu(100). The graphene has a
hexagonal superstructure on Cu(111) with a significant electronic component,
whereas it has a linear superstructure on Cu(100). The film quality is limited
by grain boundaries, and the best growth is obtained on the Cu(111) surface.
","[{""version"":""v1"",""created"":""Fri, 20 Aug 2010 17:36:15 GMT""}]","2010-08-23"
"1008.3543","Zhong-Bo Kang","Daniel Boer, Zhong-Bo Kang, Werner Vogelsang, Feng Yuan","Test of the Universality of Naive-time-reversal-odd Fragmentation
  Functions","4 pages, 3 figures","Phys.Rev.Lett.105:202001,2010","10.1103/PhysRevLett.105.202001",,"hep-ph","http://arxiv.org/licenses/nonexclusive-distrib/1.0/","  We investigate the ''spontaneous'' hyperon transverse polarization in
$e^+e^-$ annihilation and semi-inclusive deep inelastic scattering processes as
a test of the universality of the naive-time-reversal-odd transverse momentum
dependent fragmentation functions. We find that universality implies definite
sign relations among various observables. This provides a unique opportunity to
study initial/final state interaction effects in the fragmentation process and
test the associated factorization.
","[{""version"":""v1"",""created"":""Fri, 20 Aug 2010 17:37:39 GMT""}]","2010-12-02"
"1008.3544","Jasun Gong","Jasun Gong","A Schoenflies extension theorem for a class of locally bi-Lipschitz
  homeomorphisms","15 pages, 3 figures",,,,"math.AP math.GT","http://arxiv.org/licenses/nonexclusive-distrib/1.0/","  In this paper we prove a new version of the Schoenflies extension theorem for
collared domains in Euclidean n-space: for 1 < p < n, locally bi-Lipschitz
homeomorphisms between collared domains with locally p-integrable, second-order
weak derivatives admit homeomorphic extensions of the same regularity.
Moreover, the theorem is essentially sharp. The existence of exotic 7-spheres
shows that such extension theorems cannot hold for p > n = 7.
","[{""version"":""v1"",""created"":""Fri, 20 Aug 2010 17:44:37 GMT""}]","2010-08-23"
"1008.3545","Graham Smith","Graham Smith","The Plateau problem for convex curvature functions","Formerly, ""The Plateau problem for general curvature functions"".
  Significantly revised for the sake of improved clarity, incorporating
  notational changes made to arXiv:1002.2982, modifying emphasis on results so
  as to better reflect the main interests of experts in the field, and tidying
  up results and removing inelegant technical conditions which have proven
  themselves to be unnecessary",,,,"math.DG","http://arxiv.org/licenses/nonexclusive-distrib/1.0/","  We present a novel and comprehensive approach to the study of the parametric
Plateau problem for locally strictly convex (LSC) hypersurfaces of prescribed
curvature for general convex curvature functions inside general Riemannian
manifolds. We prove existence of solutions to the Plateau problem with outer
barrier for LSC hypersurfaces of constant or prescribed curvature for general
curvature functions inside general Hadamard manifolds modulo a single scalar
condition. In particular, convex curvature functions of bounded type are fully
treated.
","[{""version"":""v1"",""created"":""Fri, 20 Aug 2010 17:49:03 GMT""},{""version"":""v2"",""created"":""Wed, 13 Oct 2010 13:13:35 GMT""},{""version"":""v3"",""created"":""Mon, 10 Mar 2014 05:29:07 GMT""}]","2014-03-11"
