"1008.3565","Samuel Quinn","S. N. Quinn (1), G. \'A. Bakos (1,2), J. Hartman (1), G. Torres (1),
  G. Kov\'acs (3), D. W. Latham (1), R. W. Noyes (1), D. A. Fischer (4), J. A.
  Johnson (5), G. W. Marcy (6), A. W. Howard (6), A. Szentgyorgyi (1), G.
  F\""ur\'esz (1), L. A. Buchhave (1,7), B. B\'eky (1), D. D. Sasselov (1), R.
  P. Stefanik (1), G. Perumpilly (1,8), M. Everett (1), J. L\'az\'ar (9), I.
  Papp (9), P. S\'ari (9) ((1) Harvard-Smithsonian Center for Astrophysics,
  Cambridge, MA, (2) NSF Fellow, (3) Konkoly Observatory, Budapest, Hungary,
  (4) Yale University, New Haven, CT, (5) California Institute of Technology,
  Pasadena, CA, (6) Univ. of California, Berkeley, CA, (7) Niels Bohr
  Institute, Copenhagen University, Denmark, (8) University of South Dakota,
  Vermillion, SD, (9) Hungarian Astronomical Association, Budapest)","HAT-P-25b: a Hot-Jupiter Transiting a Moderately Faint G Star","11 pages, 8 figures, 5 tables, submitted to ApJ",,"10.1088/0004-637X/745/1/80",,"astro-ph.EP","http://arxiv.org/licenses/nonexclusive-distrib/1.0/","  We report the discovery of HAT-P-25b, a transiting extrasolar planet orbiting
the V = 13.19 G5 dwarf star GSC 1788-01237, with a period P = 3.652836 +/-
0.000019 days, transit epoch Tc = 2455176.85173 +/- 0.00047 (BJD), and transit
duration 0.1174 +/- 0.0017 days. The host star has mass of 1.01 +/- 0.03
M(Sun), radius of 0.96 +(0.05)-(0.04) R(Sun), effective temperature 5500 +/- 80
K, and metallicity [Fe/H] = +0.31 +/- 0.08. The planetary companion has a mass
of 0.567 +/- 0.022 M(Jup), and radius of 1.190 +(0.081)-(0.056) R(Jup) yielding
a mean density of 0.42 +/- 0.07 g cm-3. Comparing these observations with
recent theoretical models, we find that HAT-P-25b is consistent with a
hydrogen-helium dominated gas giant planet with negligible core mass and age
3.2 +/- 2.3 Gyr. The properties of HAT-P-25b support several previously
observed correlations for planets in the mass range 0.4 < M < 0.7 M(Jup),
including those of core mass vs. metallicity, planet radius vs. equilibrium
temperature, and orbital period vs. planet mass. We also note that HAT-P-25b
orbits the faintest star found by HATNet to have a transiting planet to date,
and is one of only a very few number of planets discovered from the ground
orbiting a star fainter than V = 13.0.
","[{""version"":""v1"",""created"":""Fri, 20 Aug 2010 20:05:13 GMT""}]","2015-05-19"
"1008.3566","Ignazio Pillitteri","I. Pillitteri, S. J. Wolk, O. Cohen, V. Kashyap, H. Knutson, C. M.
  Lisse, G. W. Henry","XMM-Newton observations of HD189733 during planetary transits","Accepted for publication on The Astrophysical Journal",,"10.1088/0004-637X/722/2/1216",,"astro-ph.SR","http://arxiv.org/licenses/nonexclusive-distrib/1.0/","  We report on two XMM-Newton observations of the planetary host star HD189733.
The system has a close in planet and it can potentially affect the coronal
structure via interactions with the magnetosphere. We have obtained X-ray
spectra and light curves from EPIC and RGS on board XMM-Newton which we have
analyzed and interpreted. We reduced X-ray data from primary transit and
secondary eclipse occurred in April 17th 2007 and May 18th 2009, respectively.
In the April 2007 observation only variability due to weak flares is
recognized. In 2009 HD189733 exhibited a X-ray flux always larger than in the
2007 observation. The average flux in 2009 was higher than in 2007 observation
by a factor of 45%. During the 2009 secondary eclipse we observed a softening
of the X-ray spectrum significant at level of ~3 sigma. Further, we observed
the most intense flare recorded at either epochs. This flare occurred 3 ks
after the end of the eclipse.The flare decay shows several minor ignitions
perhaps linked to the main event and hinting for secondary loops that emit
triggered by the main loop. Magneto-Hydro-Dynamical (MHD) simulations show that
the magnetic interaction between planet and star enhances the density and the
magnetic field in a region comprised between the planet and the star because of
their relative orbital/rotation motion. X-ray observations and model
predictions are globally found in agreement, despite the quite simple MHD model
and the lack of precise estimate of parameters including the alignment and the
intensity of stellar and planetary magnetic fields. Future observations should
confirm or disprove this hypothesis, by determining whether flares are
systematically recurring in the light curve at the same planetary phase.
","[{""version"":""v1"",""created"":""Fri, 20 Aug 2010 20:09:09 GMT""}]","2015-05-19"
"1008.3567","Alexander Eisfeld","Jan Roden, Walter T. Strunz, Alexander Eisfeld","Non-Markovian quantum state diffusion for absorption spectra of
  molecular aggregates",,"J. Chem. Phys. 134, 034902 (2011)","10.1063/1.3512979",,"quant-ph cond-mat.soft physics.chem-ph","http://arxiv.org/licenses/nonexclusive-distrib/1.0/","  In many molecular systems one encounters the situation where electronic
excitations couple to a quasi-continuum of phonon modes. That continuum may be
highly structured e.g. due to some weakly damped high frequency modes. To
handle such a situation, an approach combining the non-Markovian quantum state
diffusion (NMQSD) description of open quantum systems with an efficient but
abstract approximation was recently applied to calculate energy transfer and
absorption spectra of molecular aggregates [Roden, Eisfeld, Wolff, Strunz, PRL
103 (2009) 058301]. To explore the validity of the used approximation for such
complicated systems, in the present work we compare the calculated
(approximative) absorption spectra with exact results. These are obtained from
the method of pseudomodes, which we show to be capable of determining the exact
spectra for small aggregates and a few pseudomodes. It turns out that in the
cases considered, the results of the two approaches mostly agree quite well.
The advantages and disadvantages of the two approaches are discussed.
","[{""version"":""v1"",""created"":""Fri, 20 Aug 2010 20:20:29 GMT""}]","2011-06-14"
"1008.3568","Brian Lins","Charles R. Johnson, Brian Lins, Olivia Walch","The critical exponent for continuous conventional powers of doubly
  nonnegative matrices","9 pages",,,,"math.RA","http://arxiv.org/licenses/nonexclusive-distrib/1.0/","  We prove that there exists an exponent beyond which all continuous
conventional powers of n-by-n doubly nonnegative matrices are doubly
nonnegative. We show that this critical exponent cannot be less than $n-2$ and
we conjecture that it is always $n-2$ (as it is with Hadamard powering). We
prove this conjecture when $n<6$ and in certain other special cases. We
establish a quadratic bound for the critical exponent in general.
","[{""version"":""v1"",""created"":""Fri, 20 Aug 2010 20:29:28 GMT""}]","2010-08-24"
"1008.3569","Frederick A. Harris","Frederick A. Harris (for the BESIII Collaboration)","Charmonium in China: BEPCII/BESIII","Plenary talk at Meson2010, Krakow, Poland, June 10 - 15, 2010; 5
  pages, 4 figures","Int.J.Mod.Phys.A26:347-352,2011","10.1142/S0217751X11051640",,"hep-ex","http://arxiv.org/licenses/nonexclusive-distrib/1.0/","  Results based on 106 M $\psi'$ events and about 226 M $J/\psi$ events
acquired with the BESIII detector at BEPCII are reported, including a
confirmation of the BESII $p\bar{p}$ threshold enhancement in $J/\psi \to
\gamma p\bar{p}$, branching ratios for $\chi_{cJ} \to \pi^0 \pi^0$ and $\eta
\eta$, and first measurements of the branching ratios for $\psi' \to \pi^0 h_c$
and $h_c \to \gamma \eta_c$, as well as measurements of the mass and width of
the $h_c$. Also reported are first observations of the two photon process
$\psi' \to \gamma \gamma J/\psi$ and $f_0(980) - a_0(980)$ mixing.
","[{""version"":""v1"",""created"":""Fri, 20 Aug 2010 20:31:38 GMT""}]","2019-08-14"
"1008.3570","Elisabeth Agoritsas","Elisabeth Agoritsas, Vivien Lecomte, Thierry Giamarchi","Temperature-induced crossovers in the static roughness of a
  one-dimensional interface",,"Phys. Rev. B 82, 184207 (2010)","10.1103/PhysRevB.82.184207",,"cond-mat.dis-nn cond-mat.stat-mech math-ph math.MP nlin.PS","http://arxiv.org/licenses/nonexclusive-distrib/1.0/","  At finite temperature and in presence of disorder, a one-dimensional elastic
interface displays different scaling regimes at small and large lengthscales.
Using a replica approach and a Gaussian Variational Method (GVM), we explore
the consequences of a finite interface width $\xi$ on the small-lengthscale
fluctuations. We compute analytically the static roughness $B(r)$ of the
interface as a function of the distance $r$ between two points on the
interface. We focus on the case of short-range elasticity and random-bond
disorder. We show that for a finite width $\xi$ two temperature regimes exist.
At low temperature, the expected thermal and random-manifold regimes,
respectively for small and large scales, connect via an intermediate `modified'
Larkin regime, that we determine. This regime ends at a temperature-independent
characteristic `Larkin' length. Above a certain `critical' temperature that we
identify, this intermediate regime disappears. The thermal and random-manifold
regimes connect at a single crossover lengthscale, that we compute. This is
also the expected behavior for zero width. Using a directed polymer
description, we also study via a second GVM procedure and generic scaling
arguments, a modified toy model that provides further insights on this
crossover. We discuss the relevance of the two GVM procedures for the roughness
at large lengthscale in those regimes. In particular we analyze the scaling of
the temperature-dependent prefactor in the roughness $B(r)\sim T^{2
\text{\thorn}} r^{2 \zeta}$ and its corresponding exponent $\text{\thorn}$. We
briefly discuss the consequences of those results for the quasistatic creep law
of a driven interface, in connection with previous experimental and numerical
studies.
","[{""version"":""v1"",""created"":""Fri, 20 Aug 2010 20:43:04 GMT""}]","2010-11-30"
"1008.3571","Jeffrey Rauch","Jeffrey Rauch","Optimal Focusing for Monochromatic Scalar and Electromagnetic Waves","30 pages, 7 figures",,"10.1142/S0129055X11004448",,"math.AP","http://arxiv.org/licenses/nonexclusive-distrib/1.0/","  For monochromatic solutions of D'Alembert's wave equation and Maxwell's
equations, we obtain sharp bounds on the sup norm as a function of the far
field energy. The extremizer in the scalar case is radial. In the case of
Maxwell's equation, the electric field maximizing the value at the origin
follows longitude lines on the sphere at infinity. In dimension $d=3$ the
highest electric field for Maxwell's equation is smaller by a factor 2/3 than
the highest corresponding scalar waves.
  The highest electric field densities on the balls $B_R(0)$ occur as $R\to 0$.
The density dips to half max at $R$ approximately equal to one third the
wavelength. The extremizing fields are identical to those that attain the
maximum field intensity at the origin.
","[{""version"":""v1"",""created"":""Fri, 20 Aug 2010 20:46:25 GMT""}]","2015-05-19"
"1008.3572","Sayan Mukherjee","Paul Bendich and Sayan Mukherjee and Bei Wang","Towards Stratification Learning through Homology Inference","48 pages",,,,"math.GT stat.ML","http://arxiv.org/licenses/nonexclusive-distrib/1.0/","  A topological approach to stratification learning is developed for point
cloud data drawn from a stratified space. Given such data, our objective is to
infer which points belong to the same strata. First we define a multi-scale
notion of a stratified space, giving a stratification for each radius level. We
then use methods derived from kernel and cokernel persistent homology to
cluster the data points into different strata, and we prove a result which
guarantees the correctness of our clustering, given certain topological
conditions; some geometric intuition for these topological conditions is also
provided. Our correctness result is then given a probabilistic flavor: we give
bounds on the minimum number of sample points required to infer, with
probability, which points belong to the same strata. Finally, we give an
explicit algorithm for the clustering, prove its correctness, and apply it to
some simulated data.
","[{""version"":""v1"",""created"":""Fri, 20 Aug 2010 20:46:39 GMT""}]","2010-08-24"
"1008.3573","Alexey Zatelepin","Alexey Zatelepin and Lev Shchur","Duality of critical interfaces in Potts model: numerical check","5 pages, 3 figures, submitted to CCP 2010 special issue of Comput.
  Phys. Commun; references added",,,,"cond-mat.stat-mech","http://arxiv.org/licenses/nonexclusive-distrib/1.0/","  We report on numerical investigation of fractal properties of critical
interfaces in two-dimensional Potts models. Algorithms for finding percolating
interfaces of Fortuin-Kasteleyn clusters, their external perimeters and
interfaces of spin clusters are presented. Fractal dimensions are measured and
compared to exact theoretical predictions.
","[{""version"":""v1"",""created"":""Fri, 20 Aug 2010 20:47:57 GMT""},{""version"":""v2"",""created"":""Mon, 30 Aug 2010 07:44:02 GMT""}]","2010-08-31"
"1008.3574","Eric Cockayne","Eric Cockayne, Gregory M. Rutter, Nathan P. Guisinger, Jason N. Crain,
  Phillip N. First, and Joseph A. Stroscio","Grain Boundary Loops in Graphene","23 pages, 7 figures. Revised title; expanded; updated references","Phys. Rev. B 83, 195425 (2011)","10.1103/PhysRevB.83.195425",,"cond-mat.mtrl-sci","http://arxiv.org/licenses/nonexclusive-distrib/1.0/","  Topological defects can affect the physical properties of graphene in
unexpected ways. Harnessing their influence may lead to enhanced control of
both material strength and electrical properties. Here we present a new class
of topological defects in graphene composed of a rotating sequence of
dislocations that close on themselves, forming grain boundary loops that either
conserve the number of atoms in the hexagonal lattice or accommodate
vacancy/interstitial reconstruction, while leaving no unsatisfied bonds. One
grain boundary loop is observed as a ""flower"" pattern in scanning tunneling
microscopy (STM) studies of epitaxial graphene grown on SiC(0001). We show that
the flower defect has the lowest energy per dislocation core of any known
topological defect in graphene, providing a natural explanation for its growth
via the coalescence of mobile dislocations.
","[{""version"":""v1"",""created"":""Fri, 20 Aug 2010 20:49:36 GMT""},{""version"":""v2"",""created"":""Fri, 4 Mar 2011 16:19:14 GMT""}]","2011-05-16"
"1008.3575","Elena Mendez-Escobar PhD","Elena M\'endez-Escobar","Metric 3-Leibniz algebras and M2-branes","PhD thesis of Elena M\'endez-Escobar in the University of Edinburgh
  (supervised by Jos\'e Figueroa-O'Farrill and Joan Sim\'on)",,,,"hep-th math.RA math.RT","http://arxiv.org/licenses/nonexclusive-distrib/1.0/","  This thesis is concerned with superconformal Chern-Simons theories with
matter in 3 dimensions. The interest in these theories is two-fold. On the one
hand, it is a new family of theories in which to test the AdS/CFT
correspondence and on the other, they are important to study one of the main
objects of M-theory (M2-branes). All these theories have something in common:
they can be written in terms of 3-Leibniz algebras. Here we study the structure
theory of such algebras, paying special attention to a subclass of them that
gives rise to maximal supersymmetry and that was the first to appear in this
context: 3-Lie algebras.
  In chapter 2, we review the structure theory of metric Lie algebras and their
unitary representations. In chapter 3, we study metric 3-Leibniz algebras and
show, by specialising a construction originally due to Faulkner, that they are
in one to one correspondence with pairs of real metric Lie algebras and unitary
representations of them. We also show a third characterisation for six extreme
cases of 3-Leibniz algebras as graded Lie (super)algebras. In chapter 4, we
study metric 3-Lie algebras in detail. We prove a structural result and also
classify those with a maximally isotropic centre, which is the requirement that
ensures unitarity of the corresponding conformal field theory. Finally, in
chapter 5, we study the universal structure of superpotentials in this class of
superconformal Chern-Simons theories with matter in three dimensions. We
provide a uniform formulation for all these theories and establish the
connection between the amount of supersymmetry preserved and the gauge Lie
algebra and the appropriate unitary representation to be used to write down the
Lagrangian. The conditions for supersymmetry enhancement are then expressed
equivalently in the language of representation theory of Lie algebras or the
language of 3-Leibniz algebras.
","[{""version"":""v1"",""created"":""Fri, 20 Aug 2010 20:53:15 GMT""}]","2010-08-24"
"1008.3576","Satish  Karra","Satish Karra, K. R. Rajagopal","Modeling the Non-linear Viscoelastic Response of High Temperature
  Polyimides","16 pages, 4 figures, submitted to Mechanics of Materials",,"10.1016/j.mechmat.2010.09.006",,"cs.NA math-ph math.MP","http://arxiv.org/licenses/nonexclusive-distrib/1.0/","  A constitutive model is developed to predict the viscoelastic response of
polyimide resins that are used in high temperature applications. This model is
based on a thermodynamic framework that uses the notion that the `natural
configuration' of a body evolves as the body undergoes a process and the
evolution is determined by maximizing the rate of entropy production in general
and the rate of dissipation within purely mechanical considerations. We
constitutively prescribe forms for the specific Helmholtz potential and the
rate of dissipation (which is the product of density, temperature and the rate
of entropy production), and the model is derived by maximizing the rate of
dissipation with the constraint of incompressibility, and the reduced energy
dissipation equation is also regarded as a constraint in that it is required to
be met in every process that the body undergoes. The efficacy of the model is
ascertained by comparing the predictions of the model with the experimental
data for PMR-15 and HFPE-II-52 polyimide resins.
","[{""version"":""v1"",""created"":""Fri, 20 Aug 2010 20:55:20 GMT""}]","2010-10-25"
"1008.3577","Yanir A. Rubinstein","Yanir A. Rubinstein, Steve Zelditch","The Cauchy problem for the homogeneous Monge-Ampere equation, I.
  Toeplitz quantization","v2,3: minor changes and added references","J. Differential Geom. 90 (2012), 303-327",,,"math.DG math.AP math.CV","http://arxiv.org/licenses/nonexclusive-distrib/1.0/","  The Cauchy problem for the homogeneous (real and complex) Monge-Ampere
equation (HRMA/HCMA) arises from the initial value problem for geodesics in the
space of Kahler metrics. It is an ill-posed problem. We conjecture that, in its
lifespan, the solution can be obtained by Toeplitz quantizing the Hamiltonian
flow defined by the Cauchy data, analytically continuing the quantization, and
then taking a kind of logarithmic classical limit. In this article, we prove
that in the case of torus invariant metrics (where the HCMA reduces to the
HRMA) this ""quantum analytic continuation potential"" coincides with the
well-known Legendre transform potential, and hence solves the equation as long
as it is smooth. In the sequel we prove that the Legendre transform potential
ceases to solve the HRMA after that time.
","[{""version"":""v1"",""created"":""Fri, 20 Aug 2010 20:58:14 GMT""},{""version"":""v2"",""created"":""Tue, 12 Oct 2010 17:13:25 GMT""},{""version"":""v3"",""created"":""Wed, 27 Oct 2010 03:34:00 GMT""}]","2012-03-02"
"1008.3578","David Feder","Michael S. Underwood and David L. Feder","Universal quantum computation by discontinuous quantum walk","7 pages, revtex","Phys. Rev. A 82, 042304 (2010)","10.1103/PhysRevA.82.042304",,"quant-ph","http://arxiv.org/licenses/nonexclusive-distrib/1.0/","  Quantum walks are the quantum-mechanical analog of random walks, in which a
quantum `walker' evolves between initial and final states by traversing the
edges of a graph, either in discrete steps from node to node or via continuous
evolution under the Hamiltonian furnished by the adjacency matrix of the graph.
We present a hybrid scheme for universal quantum computation in which a quantum
walker takes discrete steps of continuous evolution. This `discontinuous'
quantum walk employs perfect quantum state transfer between two nodes of
specific subgraphs chosen to implement a universal gate set, thereby ensuring
unitary evolution without requiring the introduction of an ancillary coin
space. The run time is linear in the number of simulated qubits and gates. The
scheme allows multiple runs of the algorithm to be executed almost
simultaneously by starting walkers one timestep apart.
","[{""version"":""v1"",""created"":""Fri, 20 Aug 2010 21:04:35 GMT""}]","2015-05-19"
"1008.3579","Khalid Bou-Rabee","Khalid Bou-Rabee and Tasho Kaletha","Quantifying residual finiteness of arithmetic groups","18 pages","Compositio Math. 148 (2012) 907-920","10.1112/S0010437X11007469",,"math.GR","http://arxiv.org/licenses/nonexclusive-distrib/1.0/","  The normal Farb growth of a group quantifies how well-approximated the group
is by its finite quotients. We show that any S-arithmetic subgroup of a higher
rank Chevalley group G has normal Farb growth n^dim(G).
","[{""version"":""v1"",""created"":""Fri, 20 Aug 2010 21:15:10 GMT""}]","2019-02-20"
"1008.3580","Francesco Intravaia","P. S. Davids, F. Intravaia, F. S. S. Rosa, D.A.R. Dalvit","Modal Approach to Casimir Forces in Periodic Structures","13 pages, 7 figures","Phys. Rev. A 82, 062111 (2010)","10.1103/PhysRevA.82.062111",,"quant-ph","http://arxiv.org/licenses/nonexclusive-distrib/1.0/","  We present a modal approach to calculate finite temperature Casimir
interactions between two periodically modulated surfaces. The scattering
formula is used and the reflection matrices of the patterned surfaces are
calculated decomposing the electromagnetic field into the natural modes of the
structures. The Casimir force gradient from a deeply etched silicon grating is
evaluated using the modal approach and compared to experiment for validation.
The Casimir force from a two dimensional periodic structure is computed and
deviations from the proximity force approximation examined.
","[{""version"":""v1"",""created"":""Fri, 20 Aug 2010 21:41:23 GMT""}]","2011-02-10"
"1008.3581","Tai-Peng Tsai","Kenji Nakanishi, Tuoc Van Phan, Tai-Peng Tsai","Small solutions of nonlinear Schr\""odinger equations near first excited
  states",,,,,"math.AP math-ph math.MP","http://arxiv.org/licenses/nonexclusive-distrib/1.0/","  Consider a nonlinear Schr\""odinger equation in $R^3$ whose linear part has
three or more eigenvalues satisfying some resonance conditions. Solutions which
are initially small in $H^1 \cap L^1(R^3)$ and inside a neighborhood of the
first excited state family are shown to converge to either a first excited
state or a ground state at time infinity. An essential part of our analysis is
on the linear and nonlinear estimates near nonlinear excited states, around
which the linearized operators have eigenvalues with nonzero real parts and
their corresponding eigenfunctions are not uniformly localized in space.
","[{""version"":""v1"",""created"":""Fri, 20 Aug 2010 22:01:44 GMT""}]","2010-08-24"
"1008.3582","Jan Staff","Jan Staff, Brian Niebergal, Rachid Ouyed, Ralph Pudritz, and Kai Cai","Confronting 3 Dimensional Time-dependent Jet Simulations with HST
  Observations","Accepted for publication in ApJ",,"10.1088/0004-637X/722/2/1325",,"astro-ph.SR","http://arxiv.org/licenses/nonexclusive-distrib/1.0/","  We perform state-of-the-art, 3D, time-dependent simulations of magnetized
disk winds, carried out to simulation scales of 60 Astronomical Units, in order
to confront optical HST observations of protostellar jets. We ``observe'' the
optical forbidden line emission produced by shocks within our simulated jets
and compare these with actual observations. Our simulations reproduce the rich
structure of time varying jets, including jet rotation far from the source, an
inner (up to 400 km/s) and outer (less than 100 km/s) component of the jet, and
jet widths of up to 20 Astronomical Units in agreement with observed jets.
These simulations when compared with the data are able to constrain disk wind
models. In particular, models featuring a disk magnetic field with a modest
radial spatial variation across the disk are favored.
","[{""version"":""v1"",""created"":""Fri, 20 Aug 2010 22:12:23 GMT""}]","2015-05-19"
"1008.3583","Elias Gravanis","Elias Gravanis","Shock waves and Birkhoff's theorem in Lovelock gravity","9 pages, no figures, clarifying changes made in the text of section
  III and references added","Phys.Rev.D82:104024,2010","10.1103/PhysRevD.82.104024",,"gr-qc hep-th","http://arxiv.org/licenses/nonexclusive-distrib/1.0/","  Spherically symmetric shock waves are shown to exist in Lovelock gravity.
They amount to a change of branch of the spherically symmetric solutions across
a null hypersurface. The implications of their existence for the status of
Birkhoff's theorem in the theory is discussed.
","[{""version"":""v1"",""created"":""Fri, 20 Aug 2010 22:28:30 GMT""},{""version"":""v2"",""created"":""Thu, 9 Sep 2010 23:20:02 GMT""}]","2010-12-13"
