"1008.3702","Camille Duprat","Camille Duprat and Jeffrey M. Aristoff and Howard A. Stone","Dynamics of elastocapillary rise",,,"10.1017/jfm.2011.173",,"physics.flu-dyn","http://arxiv.org/licenses/nonexclusive-distrib/1.0/","  We present the results of a combined experimental and theoretical
investigation of the surface-tension-driven coalescence of flexible structures.
Specifically, we consider the dynamics of the rise of a wetting liquid between
flexible sheets that are clamped at their upper ends. As the elasticity of the
sheets is progressively increased, we observe a systematic deviation from the
classical diffusive-like behaviour: the time to reach equilibrium increases
dramatically and the departure from classical rise occurs sooner, trends that
we elucidate via scaling analyses. Three distinct temporal regimes are
identified and subsequently explored by developing a theoretical model based on
lubrication theory and the linear theory of plates. The resulting free-boundary
problem is solved numerically and good agreement is obtained with experiments.
","[{""version"":""v1"",""created"":""Sun, 22 Aug 2010 15:27:13 GMT""},{""version"":""v2"",""created"":""Mon, 17 Jan 2011 16:19:04 GMT""}]","2015-05-19"
"1008.3703","Johannes Knapp","The CTA Consortium","Design Concepts for the Cherenkov Telescope Array","115 pages, 54 figures, 5 tables","Experimental Astronomy (2011) 32:193-316","10.1007/s10686-011-9247-0",,"astro-ph.IM astro-ph.HE","http://arxiv.org/licenses/nonexclusive-distrib/1.0/","  Ground-based gamma-ray astronomy has had a major breakthrough with the
impressive results obtained using systems of imaging atmospheric Cherenkov
telescopes. Ground-based gamma-ray astronomy has a huge potential in
astrophysics, particle physics and cosmology. CTA is an international
initiative to build the next generation instrument, with a factor of 5-10
improvement in sensitivity in the 100 GeV to 10 TeV range and the extension to
energies well below 100 GeV and above 100 TeV. CTA will consist of two arrays
(one in the north, one in the south) for full sky coverage and will be operated
as open observatory. The design of CTA is based on currently available
technology. This document reports on the status and presents the major design
concepts of CTA.
","[{""version"":""v1"",""created"":""Sun, 22 Aug 2010 15:53:24 GMT""},{""version"":""v2"",""created"":""Thu, 21 Oct 2010 15:22:48 GMT""},{""version"":""v3"",""created"":""Wed, 11 Apr 2012 20:36:56 GMT""}]","2012-04-13"
"1008.4176","Daniel Kaslovsky","Daniel N. Kaslovsky and Francois G. Meyer","Noise Corruption of Empirical Mode Decomposition and Its Effect on
  Instantaneous Frequency","28 pages, 19 figures. High quality color figures available on Daniel
  Kaslovsky's website: http://amath.colorado.edu/student/kaslovsk/","Advances in Adaptive Data Analysis. Vol. 2, No. 3 (2010) 373-396","10.1142/S1793536910000537",,"physics.data-an physics.geo-ph","http://arxiv.org/licenses/nonexclusive-distrib/1.0/","  Huang's Empirical Mode Decomposition (EMD) is an algorithm for analyzing
nonstationary data that provides a localized time-frequency representation by
decomposing the data into adaptively defined modes. EMD can be used to estimate
a signal's instantaneous frequency (IF) but suffers from poor performance in
the presence of noise. To produce a meaningful IF, each mode of the
decomposition must be nearly monochromatic, a condition that is not guaranteed
by the algorithm and fails to be met when the signal is corrupted by noise. In
this work, the extraction of modes containing both signal and noise is
identified as the cause of poor IF estimation. The specific mechanism by which
such ""transition"" modes are extracted is detailed and builds on the observation
of Flandrin and Goncalves that EMD acts in a filter bank manner when analyzing
pure noise. The mechanism is shown to be dependent on spectral leak between
modes and the phase of the underlying signal. These ideas are developed through
the use of simple signals and are tested on a synthetic seismic waveform.
","[{""version"":""v1"",""created"":""Sun, 22 Aug 2010 00:41:12 GMT""}]","2010-08-26"
"1009.1114","Jose Fontanari","Jose F. Fontanari","Social interaction as a heuristic for combinatorial optimization
  problems",,"Phys. Rev. E 82, 056118 (2010)","10.1103/PhysRevE.82.056118",,"cs.DS physics.comp-ph","http://arxiv.org/licenses/nonexclusive-distrib/1.0/","  We investigate the performance of a variant of Axelrod's model for
dissemination of culture - the Adaptive Culture Heuristic (ACH) - on solving an
NP-Complete optimization problem, namely, the classification of binary input
patterns of size $F$ by a Boolean Binary Perceptron. In this heuristic, $N$
agents, characterized by binary strings of length $F$ which represent possible
solutions to the optimization problem, are fixed at the sites of a square
lattice and interact with their nearest neighbors only. The interactions are
such that the agents' strings (or cultures) become more similar to the low-cost
strings of their neighbors resulting in the dissemination of these strings
across the lattice. Eventually the dynamics freezes into a homogeneous
absorbing configuration in which all agents exhibit identical solutions to the
optimization problem. We find through extensive simulations that the
probability of finding the optimal solution is a function of the reduced
variable $F/N^{1/4}$ so that the number of agents must increase with the fourth
power of the problem size, $N \propto F^ 4$, to guarantee a fixed probability
of success. In this case, we find that the relaxation time to reach an
absorbing configuration scales with $F^ 6$ which can be interpreted as the
overall computational cost of the ACH to find an optimal set of weights for a
Boolean Binary Perceptron, given a fixed probability of success.
","[{""version"":""v1"",""created"":""Sun, 22 Aug 2010 13:05:52 GMT""},{""version"":""v2"",""created"":""Thu, 4 Nov 2010 19:46:12 GMT""}]","2010-12-01"
