"1008.3642","Andrey Vladimirov E","Andrey E. Vladimirov, Seth W. Digel, Gu{\eth}laugur J\'ohannesson,
  Peter F. Michelson, Igor V. Moskalenko, Patrick L. Nolan, Elena Orlando, Troy
  A. Porter, Andrew W. Strong","GALPROP WebRun: an internet-based service for calculating galactic
  cosmic ray propagation and associated photon emissions","Accepted for publication in Computer Physics Communications. Version
  2 includes improvements suggested by the referee. Metadata completed in
  version 3 (no changes to the manuscript)","Computer Physics Communications Volume 182, Issue 5, May 2011,
  Pages 1156-1161","10.1016/j.cpc.2011.01.017",,"astro-ph.HE astro-ph.GA physics.comp-ph","http://arxiv.org/licenses/nonexclusive-distrib/1.0/","  GALPROP is a numerical code for calculating the galactic propagation of
relativistic charged particles and the diffuse emissions produced during their
propagation. The code incorporates as much realistic astrophysical input as
possible together with latest theoretical developments and has become a de
facto standard in astrophysics of cosmic rays. We present GALPROP WebRun, a
service to the scientific community enabling easy use of the freely available
GALPROP code via web browsers. In addition, we introduce the latest GALPROP
version 54, available through this service.
","[{""version"":""v1"",""created"":""Sat, 21 Aug 2010 16:08:47 GMT""},{""version"":""v2"",""created"":""Wed, 26 Jan 2011 18:15:43 GMT""},{""version"":""v3"",""created"":""Mon, 8 Aug 2011 17:22:45 GMT""}]","2016-08-14"
"1008.3643","Jochen Rau","Jochen Rau","Inferring the Gibbs state of a small quantum system","13 pages; v2: modified title, improved flow of exposition, additional
  appendices","Phys. Rev. A 84, 012101 (2011)","10.1103/PhysRevA.84.012101",,"quant-ph cond-mat.stat-mech","http://arxiv.org/licenses/nonexclusive-distrib/1.0/","  Gibbs states are familiar from statistical mechanics, yet their use is not
limited to that domain. For instance, they also feature in the maximum entropy
reconstruction of quantum states from incomplete measurement data. Outside the
macroscopic realm, however, estimating a Gibbs state is a nontrivial inference
task, due to two complicating factors: the proper set of relevant observables
might not be evident a priori; and whenever data are gathered from a small
sample only, the best estimate for the Lagrange parameters is invariably
affected by the experimenter's prior bias. I show how the two issues can be
tackled with the help of Bayesian model selection and Bayesian interpolation,
respectively, and illustrate the use of these Bayesian techniques with a number
of simple examples.
","[{""version"":""v1"",""created"":""Sat, 21 Aug 2010 16:28:08 GMT""},{""version"":""v2"",""created"":""Thu, 3 Mar 2011 14:50:46 GMT""}]","2011-07-04"
"1008.3644","Charlotte Wahl","Charlotte Wahl","Higher rho-invariants and the surgery structure set","42 pages; exposition improved; version accepted by Journal of
  Topology",,"10.1112/jtopol/jts028",,"math.DG math.KT","http://arxiv.org/licenses/nonexclusive-distrib/1.0/","  We study noncommutative eta- and rho-forms for homotopy equivalences. We
prove a product formula for them and show that the rho-forms are well-defined
on the structure set. We also define an index theoretic map from L-theory to
C*-algebraic K-theory and show that it is compatible with the rho-forms. Our
approach, which is based on methods of Hilsum-Skandalis and Piazza-Schick, also
yields a unified analytic proof of the homotopy invariance of the higher
signature class and of the L^2-signature for manifolds with boundary.
","[{""version"":""v1"",""created"":""Sat, 21 Aug 2010 16:36:10 GMT""},{""version"":""v2"",""created"":""Sat, 19 Mar 2011 15:45:53 GMT""},{""version"":""v3"",""created"":""Sun, 27 Nov 2011 15:01:39 GMT""},{""version"":""v4"",""created"":""Sun, 5 Aug 2012 15:19:52 GMT""}]","2014-02-26"
"1008.3645","Waldemar Ulmer H","Waldemar Ulmer, Evangelos Matsinos","Theoretical methods for the calculation of Bragg curves and 3D
  distributions of proton beams","97 pages review paper","Eur.Phys.J.ST 190:1-81,2010","10.1140/epjst/e2010-01335-7",,"physics.med-ph nucl-th physics.comp-ph","http://creativecommons.org/licenses/by/3.0/","  The well-known Bragg-Kleeman rule RCSDA = A dot E0p has become a pioneer work
in radiation physics of charged particles and is still a useful tool to
estimate the range RCSDA of approximately monoenergetic protons with initial
energy E0 in a homogeneous medium. The rule is based on the
continuous-slowing-down-approximation (CSDA). It results from a generalized
(nonrelativistic) Langevin equation and a modification of the phenomenological
friction term. The complete integration of this equation provides information
about the residual energy E(z) and dE(z)/dz at each position z (0 <= z <=
RCSDA). A relativistic extension of the generalized Langevin equation yields
the formula RCSDA = A dot (E0 +E02/2M dot c2)p. The initial energy of
therapeutic protons satisfies E0 << 2M dot c2 (M dot c2 = 938.276 MeV), which
enables us to consider the relativistic contributions as correction terms.
Besides this phenomenological starting-point, a complete integration of the
Bethe-Bloch equation (BBE) is developed, which also provides the determination
of RCSDA, E(z) and dE(z)/dz and uses only those parameters given by the BBE
itself (i.e., without further empirical parameters like modification of
friction). The results obtained in the context of the aforementioned methods
are compared with Monte-Carlo calculations (GEANT4); this Monte-Carlo code is
also used with regard to further topics such as lateral scatter, nuclear
interactions, and buildup effects. In the framework of the CSDA, the energy
transfer from protons to environmental atomic electrons does not account for
local fluctuations.
","[{""version"":""v1"",""created"":""Sat, 21 Aug 2010 17:02:22 GMT""}]","2011-01-25"
"1008.3646","Steve Butler","Steve Butler and Jason Grout","A construction of cospectral graphs for the normalized Laplacian","21 pages; lots of figures; includes SAGE code","S. Butler and J. Grout, A construction of cospectral graphs for
  the normalized Laplacian, Electronic Journal of Combinatorics 18 (2011),
  #231, 20pp",,,"math.CO","http://arxiv.org/licenses/nonexclusive-distrib/1.0/","  We give a method to construct cospectral graphs for the normalized Laplacian
by a local modification in some graphs with special structure. Namely, under
some simple assumptions, we can replace a small bipartite graph with a
cospectral mate without changing the spectrum of the entire graph. We also
consider a related result for swapping out biregular bipartite graphs for the
matrix $A+tD$.
  We produce (exponentially) large families of non-bipartite, non-regular
graphs which are mutually cospectral, and also give an example of a graph which
is cospectral with its complement but is not self-complementary.
","[{""version"":""v1"",""created"":""Sat, 21 Aug 2010 17:04:00 GMT""},{""version"":""v2"",""created"":""Thu, 26 Jan 2012 20:15:33 GMT""}]","2012-01-27"
"1008.3647","Joaquin E. Drut","Timour Ten, Joaqu\'in E. Drut, Timo A. L\""ahde","Preconditioning the non-relativistic many-fermion problem","12 pages, 1 figure",,,,"hep-lat cond-mat.stat-mech nucl-th","http://arxiv.org/licenses/nonexclusive-distrib/1.0/","  Preconditioning is at the core of modern many-fermion Monte Carlo algorithms,
such as Hybrid Monte Carlo, where the repeated solution of a linear problem
involving an ill-conditioned matrix is needed. We report on a performance
comparison of three preconditioning strategies, namely Chebyshev polynomials,
strong-coupling approximation and weak-coupling expansion. We use conjugate
gradient (CG) on the normal equations as well as stabilized biconjugate
gradient (BiCGStab) as solvers and focus on the fermion matrix of the unitary
Fermi gas. Our results indicate that BiCGStab is by far the most efficient
strategy, both in terms of the number of iterations and matrix-vector
operations.
","[{""version"":""v1"",""created"":""Sat, 21 Aug 2010 17:18:38 GMT""}]","2010-08-24"
"1008.3648","Leticia Zarate","Leticia Zarate","On the ku-homology of certain classifying spaces II",,,,,"math.AT math.AC","http://arxiv.org/licenses/nonexclusive-distrib/1.0/","  We calculate the annihilator of the ku-toral class for the p-groups Z_{p^2} X
Z_{p^k}$ with k > 2. This allows us to give a description of the ku-homology of
these groups.
","[{""version"":""v1"",""created"":""Sat, 21 Aug 2010 17:20:34 GMT""}]","2010-08-24"
"1008.3649","Joseph H. Silverman","Joseph H. Silverman","On Lehmer's Conjecture for Polynomials and for Elliptic Curves","22 pages",,,,"math.NT","http://arxiv.org/licenses/nonexclusive-distrib/1.0/","  A number of authors have proven explicit versions of Lehmer's conjecture for
polynomials whose coefficients are all congruent to 1 modulo m. We prove a
similar result for polynomials f(X) that are divisible in (Z/mZ)[X] by a
polynomial of the form 1+X+...+X^n for some n > \epsilon*deg(f). We also
formulate and prove an analogous statement for elliptic curves.
","[{""version"":""v1"",""created"":""Sat, 21 Aug 2010 17:31:53 GMT""}]","2010-08-24"
"1008.3650","Mike Ludkovski","Tim Leung and Michael Ludkovski","Optimal Timing to Purchase Options","24 pages, 6 figures; http://dx.doi.org/10.1137/100809386","SIAM J. Finan. Math. 2(1): 768-793, 2011","10.1137/100809386",,"q-fin.PR math.OC","http://arxiv.org/licenses/nonexclusive-distrib/1.0/","  We study the optimal timing of derivative purchases in incomplete markets. In
our model, an investor attempts to maximize the spread between her model price
and the offered market price through optimally timing her purchase. Both the
investor and the market value the options by risk-neutral expectations but
under different equivalent martingale measures representing different market
views. The structure of the resulting optimal stopping problem depends on the
interaction between the respective market price of risk and the option payoff.
In particular, a crucial role is played by the delayed purchase premium that is
related to the stochastic bracket between the market price and the buyer's risk
premia. Explicit characterization of the purchase timing is given for two
representative classes of Markovian models: (i) defaultable equity models with
local intensity; (ii) diffusion stochastic volatility models. Several numerical
examples are presented to illustrate the results. Our model is also applicable
to the optimal rolling of long-dated options and sequential buying and selling
of options.
","[{""version"":""v1"",""created"":""Sat, 21 Aug 2010 18:11:03 GMT""},{""version"":""v2"",""created"":""Wed, 29 Sep 2010 05:52:59 GMT""},{""version"":""v3"",""created"":""Sun, 3 Apr 2011 06:17:45 GMT""}]","2011-10-12"
"1008.3651","Anatoli Iouditski","Anatoli Iouditski (LJK), Arkadii S. Nemirovski (ISyE)","Accuracy guarantees for L1-recovery",,"IEEE Transactions on Information Theory 57, 12 (2011) 7818 - 7839","10.1109/TIT.2011.2162569",,"math.ST cs.SY math.OC stat.TH","http://arxiv.org/licenses/nonexclusive-distrib/1.0/","  We discuss two new methods of recovery of sparse signals from noisy
observation based on $\ell_1$- minimization. They are closely related to the
well-known techniques such as Lasso and Dantzig Selector. However, these
estimators come with efficiently verifiable guaranties of performance. By
optimizing these bounds with respect to the method parameters we are able to
construct the estimators which possess better statistical properties than the
commonly used ones. We also show how these techniques allow to provide
efficiently computable accuracy bounds for Lasso and Dantzig Selector. We link
our performance estimations to the well known results of Compressive Sensing
and justify our proposed approach with an oracle inequality which links the
properties of the recovery algorithms and the best estimation performance when
the signal support is known. We demonstrate how the estimates can be computed
using the Non-Euclidean Basis Pursuit algorithm.
","[{""version"":""v1"",""created"":""Sat, 21 Aug 2010 18:32:03 GMT""},{""version"":""v2"",""created"":""Fri, 29 Oct 2010 15:03:42 GMT""},{""version"":""v3"",""created"":""Fri, 27 May 2011 13:43:50 GMT""}]","2014-04-11"
"1008.3652","Guyslain Naves","Guyslain Naves","On disjoint paths in acyclic planar graphs",,,,,"cs.DM","http://arxiv.org/licenses/nonexclusive-distrib/1.0/","  We give an algorithm with complexity $O(f(R)^{k^2} k^3 n)$ for the integer
multiflow problem on instances $(G,H,r,c)$ with $G$ an acyclic planar digraph
and $r+c$ Eulerian. Here, $f$ is a polynomial function, $n = |V(G)|$, $k =
|E(H)|$ and $R$ is the maximum request $\max_{h \in E(H)} r(h)$. When $k$ is
fixed, this gives a polynomial algorithm for the arc-disjoint paths problem
under the same hypothesis.
","[{""version"":""v1"",""created"":""Sat, 21 Aug 2010 18:33:15 GMT""}]","2010-08-24"
"1008.3653","Guyslain Naves","Guyslain Naves, Christophe Weibel","Congestion in planar graphs with demands on faces",,,,,"cs.DM","http://arxiv.org/licenses/nonexclusive-distrib/1.0/","  We give an algorithm to route a multicommodity flow in a planar graph $G$
with congestion $O(\log k)$, where $k$ is the maximum number of terminals on
the boundary of a face, when each demand edge lie on a face of $G$. We also
show that our specific method cannot achieve a substantially better congestion.
","[{""version"":""v1"",""created"":""Sat, 21 Aug 2010 18:33:43 GMT""}]","2010-08-24"
"1008.3654","Martin Wainwright","Garvesh Raskutti, Martin J. Wainwright, Bin Yu","Minimax-optimal rates for sparse additive models over kernel classes via
  convex programming","Lower bounds presented in part in Proceedings of the NIPS Conference,
  December 2009 Revised version December 2011: new Theorem 3, showing
  restrictiveness of global boundedness condition. Sharper version of Theorem
  1, with rates in both empirical and population norm",,,,"math.ST cs.IT math.IT stat.TH","http://arxiv.org/licenses/nonexclusive-distrib/1.0/","  Sparse additive models are families of $d$-variate functions that have the
additive decomposition $f^* = \sum_{j \in S} f^*_j$, where $S$ is an unknown
subset of cardinality $s \ll d$. In this paper, we consider the case where each
univariate component function $f^*_j$ lies in a reproducing kernel Hilbert
space (RKHS), and analyze a method for estimating the unknown function $f^*$
based on kernels combined with $\ell_1$-type convex regularization. Working
within a high-dimensional framework that allows both the dimension $d$ and
sparsity $s$ to increase with $n$, we derive convergence rates (upper bounds)
in the $L^2(\mathbb{P})$ and $L^2(\mathbb{P}_n)$ norms over the class
$\MyBigClass$ of sparse additive models with each univariate function $f^*_j$
in the unit ball of a univariate RKHS with bounded kernel function. We
complement our upper bounds by deriving minimax lower bounds on the
$L^2(\mathbb{P})$ error, thereby showing the optimality of our method. Thus, we
obtain optimal minimax rates for many interesting classes of sparse additive
models, including polynomials, splines, and Sobolev classes. We also show that
if, in contrast to our univariate conditions, the multivariate function class
is assumed to be globally bounded, then much faster estimation rates are
possible for any sparsity $s = \Omega(\sqrt{n})$, showing that global
boundedness is a significant restriction in the high-dimensional setting.
","[{""version"":""v1"",""created"":""Sat, 21 Aug 2010 18:40:10 GMT""},{""version"":""v2"",""created"":""Sun, 18 Dec 2011 09:28:49 GMT""}]","2011-12-20"
"1008.3655","Michael Finkelberg","Alexander Braverman, Boris Feigin, Leonid Rybnikov and Michael
  Finkelberg","A finite analog of the AGT relation I: finite W-algebras and quasimaps'
  spaces","minor changes","Communications in Mathematical Physics Volume 308, Number 2,
  457-478 (2011)","10.1007/s00220-011-1300-3",,"math.AG hep-th math.RT","http://arxiv.org/licenses/nonexclusive-distrib/1.0/","  Recently Alday, Gaiotto and Tachikawa proposed a conjecture relating
4-dimensional super-symmetric gauge theory for a gauge group G with certain
2-dimensional conformal field theory. This conjecture implies the existence of
certain structures on the (equivariant) intersection cohomology of the
Uhlenbeck partial compactification of the moduli space of framed G-bundles on
P^2. More precisely, it predicts the existence of an action of the
corresponding W-algebra on the above cohomology, satisfying certain properties.
  We propose a ""finite analog"" of the (above corollary of the) AGT conjecture.
Namely, we replace the Uhlenbeck space with the space of based quasi-maps from
P^1 to any partial flag variety G/P of G and conjecture that its equivariant
intersection cohomology carries an action of the finite W-algebra U(g,e)
associated with the principal nilpotent element in the Lie algebra of the Levi
subgroup of P; this action is expected to satisfy some list of natural
properties. This conjecture generalizes the main result of arXiv:math/0401409
when P is the Borel subgroup. We prove our conjecture for G=GL(N), using the
works of Brundan and Kleshchev interpreting the algebra U(g,e) in terms of
certain shifted Yangians.
","[{""version"":""v1"",""created"":""Sat, 21 Aug 2010 18:46:01 GMT""},{""version"":""v2"",""created"":""Sun, 4 Sep 2011 05:22:17 GMT""},{""version"":""v3"",""created"":""Mon, 16 Jan 2012 11:33:24 GMT""}]","2012-01-17"
"1008.3656","Ottavio Croze","O. A. Croze","Alternative derivation of the Feigel effect and call for its
  experimental verification","20 pages, 1 figures. revised and improved version","Proc. R. Soc. A 2012 vol. 468 pp. 429-447","10.1098/rspa.2011.0481",,"cond-mat.soft physics.flu-dyn quant-ph","http://arxiv.org/licenses/nonexclusive-distrib/1.0/","  A recent theory by Feigel [Phys. Rev. Lett. {\bf 92}, 020404 (2004)] predicts
the finite transfer of momentum from the quantum vacuum to a fluid placed in
strong perpendicular electric and magnetic fields. The momentum transfer arises
because of the optically anisotropic magnetoelectric response induced in the
fluid by the fields. After summarising Feigel's original assumptions and
derivation (corrected of trivial mistakes), we rederive the same result by a
simpler route, validating Feigel's semi-classical approach. We then derive the
stress exerted by the vacuum on the fluid which, if the Feigel hypothesis is
correct, should induce a Poiseuille flow in a tube with maximum speed $\approx
100\mu$m/s (2000 times larger than Feigel's original prediction). An experiment
is suggested to test this prediction for an organometallic fluid in a tube
passing through the bore of a high strength magnet. The predicted flow can be
measured directly by tracking microscopy or indirectly by measuring the flow
rate ($\approx 1$ml/min) corresponding to the Poiseuille flow. A second
experiment is also proposed whereby a `vacuum radiometer' is used to test a
recent prediction that the net force on a magnetoelectric slab in the vacuum
should be zero.
","[{""version"":""v1"",""created"":""Sat, 21 Aug 2010 18:53:12 GMT""},{""version"":""v2"",""created"":""Sat, 27 Nov 2010 14:13:40 GMT""},{""version"":""v3"",""created"":""Sat, 6 Aug 2011 16:22:25 GMT""}]","2012-01-10"
"1008.3657","Yuri Pavlov","A. A. Grib, Yu. V. Pavlov","Particles with negative energies in black holes","10 pages, 2 figures, typos correction to match published version","Int.J.Mod.Phys.D20:675-684,2011","10.1142/S0218271811019013",,"gr-qc","http://arxiv.org/licenses/nonexclusive-distrib/1.0/","  The problem of the existence of particles with negative energies inside and
outside of Schwarzschild, charged and rotating black holes is investigated.
Different definitions of the energy of the particle inside the Schwarzschild
black hole are analyzed and it is shown in what cases this energy can be
negative. A comparison is made for the cases of rotating black holes described
by the Kerr metric when the energy of the particle can be negative in the
ergosphere and the Reissner-Nordstrom metric.
","[{""version"":""v1"",""created"":""Sat, 21 Aug 2010 18:56:31 GMT""},{""version"":""v2"",""created"":""Sun, 22 May 2011 18:55:24 GMT""}]","2011-08-19"
"1008.3658","Michael Herrmann","Michael Herrmann and Barbara Niethammer","Kramers' formula for chemical reactions in the context of Wasserstein
  gradient flows","revised proofs, 12 pages, 1 figure","Commun. Math. Sci., vol. 9, no. 2, pp.623-635, 2011","10.4310/CMS.2011.v9.n2.a15",,"math.AP math-ph math.MP","http://arxiv.org/licenses/nonexclusive-distrib/1.0/","  We derive Kramers' formula as singular limit of the Fokker-Planck equation
with double-well potential. The convergence proof is based on the Rayleigh
principle of the underlying Wasserstein gradient structure and complements a
recent result by Peletier, Savar\'e and Veneroni.
","[{""version"":""v1"",""created"":""Sat, 21 Aug 2010 18:58:08 GMT""},{""version"":""v2"",""created"":""Fri, 5 Nov 2010 12:30:20 GMT""}]","2020-03-13"
"1008.3659","Patrick Reynolds","Patrick Reynolds","Dynamics of Irreducible Endomorphisms of $F_n$","v3, 46 pages, corrected gap in decomposition result",,,,"math.GR math.GT","http://arxiv.org/licenses/nonexclusive-distrib/1.0/","  We consider the class non-surjective irreducible endomorphisms of the free
group $F_n$. We show that such an endomorphism $\phi$ is topologically
represented by a simplicial immersion $f:G \rightarrow G$ of a marked graph
$G$; along the way we classify the dynamics of $\partial \phi$ acting on
$\partial F_n$: there are at most $2n$ fixed points, all of which are
attracting. After imposing a necessary additional hypothesis on $\phi$, we
consider the action of $\phi$ on the closure $\bar{CV}_n$ of the
Culler-Vogtmann Outer space. We show that $\phi$ acts on $\bar{CV}_n$ with
""sink"" dynamics: there is a unique fixed point $[T_{\phi}]$, which is
attracting; for any compact neighborhood $N$ of $[T_{\phi}]$, there is
$K=K(N)$, such that $\bar{CV}_n\phi^{K(N)} \subseteq N$. The proof uses certian
projections of trees coming from invariant length measures. These ideas are
extended to show how to decompose a tree $T$ in the boundary of Outer space by
considering the space of invariant length measures on $T$; this gives a
decomposition that generalizes the decomposition of geometric trees coming from
Imanishi's theorem.
","[{""version"":""v1"",""created"":""Sat, 21 Aug 2010 19:31:27 GMT""},{""version"":""v2"",""created"":""Tue, 21 Sep 2010 22:10:55 GMT""},{""version"":""v3"",""created"":""Sun, 6 Mar 2011 22:58:29 GMT""}]","2011-03-08"
"1008.3660","Alejandro Erickson","Alejandro Erickson","Sums of squares and negative correlation for spanning forests of series
  parallel graphs","12 pages, 1 figure. Accepted in The Australasian Journal of
  Combinatorics",,,,"math.CO","http://arxiv.org/licenses/nonexclusive-distrib/1.0/","  We provide new evidence that spanning forests of graphs satisfy the same
negative correlation properties as spanning trees, derived from Lord Rayleigh's
monotonicity property for electrical networks. The main result of this paper is
that the Rayleigh difference for the spanning forest generating polynomial of a
series parallel graph can be expressed as a certain positive sum of monomials
times squares of polynomials. We also show that every regular matroid is
independent-set-Rayleigh if and only if every basis-Rayleigh binary matroid is
also independent-set-Rayleigh.
","[{""version"":""v1"",""created"":""Sat, 21 Aug 2010 19:56:43 GMT""},{""version"":""v2"",""created"":""Fri, 4 Mar 2011 23:14:43 GMT""},{""version"":""v3"",""created"":""Mon, 24 Oct 2011 00:53:52 GMT""}]","2011-10-25"
"1008.3661","Iegor Reznikoff","Iegor Reznikoff","A Logical Proof of the Free Will Theorem","3 pages",,,,"quant-ph math-ph math.MP","http://arxiv.org/licenses/nonexclusive-distrib/1.0/","  We give a purely logical proof of the J. Conway and S. Kochen Free Will
theorem concerning undeterminacy in Quantum Mechanics (Notices of the AMS,
February 2009, Vol. 56/2, p. 226). The logical method seems to be very
powerful.
","[{""version"":""v1"",""created"":""Sat, 21 Aug 2010 20:13:46 GMT""}]","2010-08-24"
"1008.3662","Florent Jouve","F. Jouve, E. Kowalski, and D. Zywina","Splitting fields of characteristic polynomials of random elements in
  arithmetic groups","Revised version; the previous version contained a serious mistake in
  the most general case of the main result (namely the reductive case). This is
  now fixed. The most interesting case (the semisimple case) remains unchanged",,,,"math.NT","http://arxiv.org/licenses/nonexclusive-distrib/1.0/","  We discuss rather systematically the principle, implicit in earlier works,
that for a ""random"" element in an arithmetic subgroup of a (split, say)
reductive algebraic group over a number field, the splitting field of the
characteristic polynomial, computed using any faitfhful representation, has
Galois group isomorphic to the Weyl group of the underlying algebraic group.
Besides tools such as the large sieve, which we had already used, we introduce
some probabilistic ideas (large deviation estimates for finite Markov chains)
and the general case involves a more precise understanding of the way Frobenius
conjugacy classes are computed for such splitting fields (which is related to a
map between regular elements of a finite group of Lie type and conjugacy
classes in the Weyl group which had been considered earlier by Carter and
Fulman for other purposes; we show in particular that the values of this map
are equidistributed).
","[{""version"":""v1"",""created"":""Sat, 21 Aug 2010 20:15:36 GMT""},{""version"":""v2"",""created"":""Thu, 3 Feb 2011 08:36:56 GMT""},{""version"":""v3"",""created"":""Tue, 12 Apr 2011 14:49:52 GMT""},{""version"":""v4"",""created"":""Tue, 24 Jan 2012 12:40:16 GMT""}]","2012-01-25"
