"1008.3663","Cynthia Aku-Leh","Cynthia Aku-Leh, Florent Perez, Bernard Jusserand, David Richards, and
  Grzegorz Karczewski","Dynamical Corrections to Spin Wave Excitations in Quantum Wells due to
  Coulomb Interactions and Magnetic Ions","6 pages, 7 figures",,"10.1103/PhysRevB.83.035323",,"cond-mat.mes-hall","http://arxiv.org/licenses/nonexclusive-distrib/1.0/","  We have measured dispersions of spin-flip waves and spin-flip single-particle
excitations of a spin polarized two-dimensional electron gas in a CdMnTe
quantum well using resonant Raman scattering. We find the energy of the
spin-flip wave to be below the spin-flip single particle excitation continuum,
a contradiction to the theory of spin waves in diluted magnetic semiconductors
put forth in [Phys. Rev. B 70, 045205 (2004)]. We show that the inclusion of
terms accounting for the Coulomb interaction between carriers in the spin wave
propagator leads to an agreement with our experimental results. The dominant
Coulomb contribution leads to an overall red shift of the mixed electron-Mn
spin modes while the dynamical coupling between Mn ions results in a small blue
shift. We provide a simulated model system which shows the reverse situation
but at an extremely large magnetic field.
","[{""version"":""v1"",""created"":""Sat, 21 Aug 2010 20:27:29 GMT""}]","2015-05-19"
"1008.3664","Ralf Gramlich","Ralf K\""ohl","On the geometry of global function fields, the Riemann-Roch theorem, and
  finiteness properties of S-arithmetic groups",,"Buildings, finite geometries and groups, 49-80, Springer Proc.
  Math., 10, Springer, New York, 2012",,,"math.GR math.AG math.GT","http://arxiv.org/licenses/nonexclusive-distrib/1.0/","  Harder's reduction theory provides filtrations of euclidean buildings that
allow one to deduce cohomological and homological properties of S-arithmetic
groups over global function fields. In this survey I will sketch the main
points of Harder's reduction theory starting from Weil's geometry of numbers
and the Riemann-Roch theorem, describe a filtration that is particularly useful
for deriving finiteness properties of S-arithmetic groups, and state the rank
conjecture and its partial verifications that do not restrict the cardinality
of the underlying field of constants. As a motivation for further research I
also state a much more general conjecture on isoperimetric properties of
S-arithmetic groups over global fields (number fields or function fields).
","[{""version"":""v1"",""created"":""Sat, 21 Aug 2010 20:35:57 GMT""},{""version"":""v2"",""created"":""Sun, 30 Jan 2011 15:42:49 GMT""}]","2015-03-27"
"1008.3665","Luis Castro","L.B. Castro","Fermion localization on two-field thick branes","14 pages, 11 figures","Phys.Rev.D83:045002,2011","10.1103/PhysRevD.83.045002",,"hep-th math-ph math.MP quant-ph","http://arxiv.org/licenses/nonexclusive-distrib/1.0/","  In a recent paper published in this journal, Almeida and collaborators [Phys.
Rev. D \textbf{79}, 125022 (2009)] analyze the issue of fermion localization of
fermions on a brane constructed from two scalar fields coupled with gravity
(Bloch brane model). In this meritorious research the simplest Yukawa coupling
$\eta\bar{\Psi}\phi\chi\Psi$ was considered. In that work does not analyze the
zero mode in details. In this paper, the localization of fermions on two-field
thick branes is reinvestigated. It is found that the simplest Yukawa coupling
does not support the localization of fermions on the brane. In addition, the
problem of fermion localization for some other Yukawa couplings are analyzed.
It is shown that the zero mode for left-handed and right-handed fermions can be
localized on the brane depending on the values for the coupling constant $\eta$
and the Bloch brane's parameter $a$.
","[{""version"":""v1"",""created"":""Sat, 21 Aug 2010 21:02:03 GMT""},{""version"":""v2"",""created"":""Fri, 18 Feb 2011 14:06:58 GMT""}]","2011-05-12"
"1008.3666","Khaled Al-Hassanieh","K. A. Al-Hassanieh, Yi-feng Yang, Ivar Martin, C. D. Batista","Effective Low-Energy Model for f-Electron Delocalization",,"Phys. Rev. Lett. 105, 086402 (2010)","10.1103/PhysRevLett.105.086402",,"cond-mat.str-el","http://arxiv.org/licenses/nonexclusive-distrib/1.0/","  We consider a Periodic Anderson Model (PAM) with a momentum-dependent
inter-band hybridization that is strongly suppressed near the Fermi level.
Under these conditions, we reduce the PAM to an effective low-energy
Hamiltonian, $H_{\rm eff}$, by expanding in the small parameter $V_0/t$ ( $V_0$
is the maximum inter-band hybridization amplitude and $t$ is the hopping
integral of the broad band). The resulting model consists of a t-J f-band
coupled via the Kondo exchange to the electrons in the broad band. $H_{\rm
eff}$ allows for studying the f-electron delocalization transition. The result
is a doping-induced Mott transition for the f-electron delocalization, which we
demonstrate by density-matrix renormalization group (DMRG) calculations.
","[{""version"":""v1"",""created"":""Sat, 21 Aug 2010 21:19:14 GMT""}]","2015-05-19"
"1008.3667","Ishanu Chattopadhyay","Ishanu Chattopadhyay, Yicheng Wen and Asok Ray","Pattern Classification In Symbolic Streams via Semantic Annihilation of
  Information","15 pages, 7 figures (Under Review Elsewhere: Journal Reference Will
  Be Provided When Available )",,,,"cs.SC cs.CL cs.IT math.IT","http://arxiv.org/licenses/nonexclusive-distrib/1.0/","  We propose a technique for pattern classification in symbolic streams via
selective erasure of observed symbols, in cases where the patterns of interest
are represented as Probabilistic Finite State Automata (PFSA). We define an
additive abelian group for a slightly restricted subset of probabilistic finite
state automata (PFSA), and the group sum is used to formulate pattern-specific
semantic annihilators. The annihilators attempt to identify pre-specified
patterns via removal of essentially all inter-symbol correlations from observed
sequences, thereby turning them into symbolic white noise. Thus a perfect
annihilation corresponds to a perfect pattern match. This approach of
classification via information annihilation is shown to be strictly
advantageous, with theoretical guarantees, for a large class of PFSA models.
The results are supported by simulation experiments.
","[{""version"":""v1"",""created"":""Sat, 21 Aug 2010 21:24:42 GMT""}]","2010-08-24"
"1008.3668","Matthew Brunner","Matthew Brunner, J.M. Deutsch","Ideal Linear Chain Polymers with Fixed Angular Momentum","7 pages, 3 figures",,"10.1103/PhysRevE.84.011804",,"cond-mat.soft","http://arxiv.org/licenses/nonexclusive-distrib/1.0/","  The statistical mechanics of a linear non-interacting polymer chain with a
large number of monomers is considered with fixed angular momentum. The radius
of gyration for a linear polymer is derived exactly by functional integration.
This result is then compared to simulations done with a large number of
non-interacting rigid links at fixed angular momentum. The simulation agrees
with the theory up to finite size corrections. The simulations are also used to
investigate the anisotropic nature of a spinning polymer. We find universal
scaling of the polymer size along the direction of the angular momentum, as a
function of rescaled angular momentum.
","[{""version"":""v1"",""created"":""Sat, 21 Aug 2010 22:08:11 GMT""}]","2013-05-29"
"1008.3669","Puxun Wu","Puxun Wu and Hongwei Yu","$f(T)$ models with phantom divide line crossing","12 pages, 4 figures, equations corrected","Eur.Phys.J.C71:1552,2011","10.1140/epjc/s10052-011-1552-2",,"gr-qc astro-ph.CO hep-th","http://arxiv.org/licenses/nonexclusive-distrib/1.0/","  In this paper, we propose two new models in $f(T)$ gravity to realize the
crossing of the phantom divide line for the effective equation of state, and we
then study the observational constraints on the model parameters. The best fit
results suggest that the observations favor a crossing of the phantom divide
line.
","[{""version"":""v1"",""created"":""Sat, 21 Aug 2010 23:31:01 GMT""},{""version"":""v2"",""created"":""Sun, 10 Oct 2010 03:28:19 GMT""},{""version"":""v3"",""created"":""Sun, 20 Feb 2011 03:39:59 GMT""}]","2011-03-03"
"1008.3670","Joshua C. Long","D. Bennett, V. Skavysh, and J. Long","Search for Lorentz Violation in a Short-Range Gravity Experiment","Presented at the Fifth Meeting on CPT and Lorentz Symmetry,
  Bloomington, Indiana, June 28-July 2, 2010",,"10.1142/9789814327688_0051",,"gr-qc hep-ph","http://arxiv.org/licenses/nonexclusive-distrib/1.0/","  An experimental test of the Newtonian inverse square law at short range has
been used to set limits on Lorentz violation in the pure gravity sector of the
Standard-Model Extension. On account of the planar test mass geometry,
nominally null with respect to inverse square forces, the limits derived for
the SME coefficients of Lorentz violation are on the order s ~ 10000.
","[{""version"":""v1"",""created"":""Sun, 22 Aug 2010 00:01:52 GMT""}]","2017-08-23"
"1008.3671","Ryan Schwartz","Ryan Schwartz, J\'ozsef Solymosi and Frank de Zeeuw","Rational Distances with Rational Angles","12 pages; corrected typos, updated references; corrected results in
  Sections 3 and 4; added/updated statement of main results in Section 2; added
  new section containing lower bounds","Mathematika 58 (2012), 409-418","10.1112/S0025579311001847",,"math.CO","http://arxiv.org/licenses/nonexclusive-distrib/1.0/","  In 1946 Erd\H os asked for the maximum number of unit distances, $u(n)$,
among $n$ points in the plane. He showed that $u(n)> n^{1+c/\log\log n}$ and
conjectured that this was the true magnitude. The best known upper bound is
$u(n)<cn^{4/3}$, due to Spencer, Szemer\'edi and Trotter. We show that the
upper bound $n^{1+6/\sqrt{\log n}}$ holds if we only consider unit distances
with rational angle, by which we mean that the line through the pair of points
makes a rational angle in degrees with the x-axis. Using an algebraic theorem
of Mann we get a uniform bound on the number of paths between two fixed
vertices in the unit distance graph, giving a contradiction if there are too
many unit distances with rational angle. This bound holds if we consider
rational distances instead of unit distances as long as there are no three
points on a line. A superlinear lower bound is given, due to Erd\H os and
Purdy. If we have at most $n^{\alpha}$ points on a line then we get the bound
$O(n^{1+\alpha})$ or $n^{1+\alpha+6/\sqrt{\log n}}$ for the number of rational
distances with rational angle depending on whether $\alpha\ge 1/2$ or $\alpha <
1/2$ respectively.
","[{""version"":""v1"",""created"":""Sun, 22 Aug 2010 00:37:44 GMT""},{""version"":""v2"",""created"":""Mon, 9 May 2011 20:43:55 GMT""}]","2014-04-22"
"1008.3672","Michael Kapralov","Michael Kapralov and Rina Panigrahy","Prediction strategies without loss",,,,,"cs.DS","http://arxiv.org/licenses/nonexclusive-distrib/1.0/","  Consider a sequence of bits where we are trying to predict the next bit from
the previous bits. Assume we are allowed to say 'predict 0' or 'predict 1', and
our payoff is +1 if the prediction is correct and -1 otherwise. We will say
that at each point in time the loss of an algorithm is the number of wrong
predictions minus the number of right predictions so far. In this paper we are
interested in algorithms that have essentially zero (expected) loss over any
string at any point in time and yet have small regret with respect to always
predicting 0 or always predicting 1. For a sequence of length $T$ our algorithm
has regret $14\epsilon T $ and loss $2\sqrt{T}e^{-\epsilon^2 T} $ in
expectation for all strings. We show that the tradeoff between loss and regret
is optimal up to constant factors.
  Our techniques extend to the general setting of $N$ experts, where the
related problem of trading off regret to the best expert for regret to the
`special' expert has been studied by Even-Dar et al. (COLT'07). We obtain
essentially zero loss with respect to the special expert and optimal
loss/regret tradeoff, improving upon the results of Even-Dar et al and settling
the main question left open in their paper.
  The strong loss bounds of the algorithm have some surprising consequences. A
simple iterative application of our algorithm gives essentially optimal regret
bounds at multiple time scales, bounds with respect to $k$-shifting optima as
well as regret bounds with respect to higher norms of the input sequence.
","[{""version"":""v1"",""created"":""Sun, 22 Aug 2010 01:09:56 GMT""},{""version"":""v2"",""created"":""Tue, 24 Aug 2010 17:41:52 GMT""},{""version"":""v3"",""created"":""Tue, 16 Nov 2010 02:12:05 GMT""},{""version"":""v4"",""created"":""Sat, 6 Oct 2012 22:39:51 GMT""},{""version"":""v5"",""created"":""Wed, 10 Oct 2012 18:16:48 GMT""}]","2012-10-11"
"1008.3673","Jian Wu","Jian Wu, Yuqi Tong, Min Li, Haifeng Pan, and Heping Zeng","THz generation by dual-color pulse in prealigned molecules","This paper has been withdrawn by the authors. The paper has been
  accepted for publication by Physical Review A, where you can find more
  details",,"10.1103/PhysRevA.82.053416",,"physics.optics physics.plasm-ph","http://creativecommons.org/licenses/by-nc-sa/3.0/","  We demonstrate that the THz generation in air from a dual-color pulse,
composed of the fundamental and second-harmonic waves, can be coherently
controlled by field-free molecular alignment. By tuning its time delay to
properly match various molecular alignment revivals, the THz generation from
the dual-color pulse can be promoted or decreased due to the spatial
cross-(de)focusing effect and the alignment-dependent ionization probabilities
of the prealigned diatomic molecules of air. For the dual-color pulse of
orthogonally polarized fundamental and second-harmonic waves, the polarization
of the generated THz radiation can be controlled by the field-free molecular
alignment, which functions as a transient dynamic wave-plate for the dual-color
pulse with different phase velocities for the orthogonally polarized field
components. The plasma effect on the THz generation of the dual-color pulse is
also observed, leading to additional intensity and polarization control of the
THz radiation.
","[{""version"":""v1"",""created"":""Sun, 22 Aug 2010 01:32:45 GMT""},{""version"":""v2"",""created"":""Mon, 8 Nov 2010 13:24:19 GMT""}]","2015-05-19"
"1008.3674","Lhoussain El fadil","Lhoussain El Fadil","Explicit Factorization of Prime Integers in Quartic Number Fields
  defined by $X^4+aX+b$","submitted on 5.5.2010",,,,"math.NT","http://creativecommons.org/licenses/by/3.0/","  For every prime integer $p$, an explicit factorization of the principal ideal
$p\z_K$ into prime ideals of $\z_K$ is given, where $K$ is a quartic number
field defined by an irreducible polynomial $X^4+aX+b\in\z[X]$.
","[{""version"":""v1"",""created"":""Sun, 22 Aug 2010 01:34:41 GMT""}]","2010-08-24"
"1008.3675","Emmanuel Kowalski","Jordan Ellenberg, Chris Hall and Emmanuel Kowalski","Expander graphs, gonality and variation of Galois representations","32 pages; v4: changes mostly in exposition","Duke Math. J. 161, no. 7 (2012), 1233-1275","10.1215/00127094-1593272",,"math.NT","http://arxiv.org/licenses/nonexclusive-distrib/1.0/","  We show that families of coverings of an algebraic curve where the associated
Cayley-Schreier graphs form an expander family exhibit strong forms of
geometric (genus and gonality) growth. Combining this general result with
finiteness statements for rational points under such conditions, we derive
results concerning the variation of Galois representations in one-parameter
families of abelian varieties.
","[{""version"":""v1"",""created"":""Sun, 22 Aug 2010 05:55:57 GMT""},{""version"":""v2"",""created"":""Fri, 27 Aug 2010 16:49:22 GMT""},{""version"":""v3"",""created"":""Wed, 15 Sep 2010 18:14:00 GMT""},{""version"":""v4"",""created"":""Wed, 28 Sep 2011 20:01:07 GMT""}]","2019-12-19"
"1008.3676","Nassim Bozorgnia","Nassim Bozorgnia, Graciela B. Gelmini and Paolo Gondolo","Channeling in direct dark matter detection II: channeling fraction in Si
  and Ge crystals","28 pages, 45 figures, Accepted for publication in JCAP on 27 October
  2010, Minor revisions: added an appendix, updated references, corrected some
  typos, added some text before Section 2","JCAP 1011:028,2010","10.1088/1475-7516/2010/11/028",,"astro-ph.CO","http://arxiv.org/licenses/nonexclusive-distrib/1.0/","  The channeling of the ion recoiling after a collision with a WIMP changes the
ionization signal in direct detection experiments, producing a larger signal
than otherwise expected. We give estimates of the fraction of channeled
recoiling ions in Si and Ge crystals using analytic models produced since the
1960's and 70's to describe channeling and blocking effects. We used data
obtained to avoid channeling in the implantation of dopants in Si crystals to
test our models.
","[{""version"":""v1"",""created"":""Sun, 22 Aug 2010 06:05:05 GMT""},{""version"":""v2"",""created"":""Wed, 3 Nov 2010 22:39:32 GMT""}]","2010-12-09"
"1008.3677","Fu Liu","Rosena R. X. Du and Fu Liu","Factorizations of cycles and multi-noded rooted trees","23 pages, 5 figures. To appear in Graphs and Combinatorics",,,,"math.CO math.AG","http://arxiv.org/licenses/nonexclusive-distrib/1.0/","  In this paper, we study factorizations of cycles. The main result is that
under certain condition, the number of ways to factor a $d$-cycle into a
product of cycles of prescribed lengths is $d^{r-2}.$ To prove our result, we
first define a new class of combinatorial objects, multi-noded rooted trees,
which generalize rooted trees. We find the cardinality of this new class which
with proper parameters is exactly $d^{r-2}.$ The main part of this paper is the
proof that there is a bijection from factorizations of a $d$-cycle to
multi-noded rooted trees via factorization graphs. This implies the desired
formula.
  The factorization problem we consider has its origin in geometry, and is
related to the study of a special family of Hurwitz numbers: pure-cycle Hurwitz
numbers. Via the standard translation of Hurwitz numbers into group theory, our
main result is equivalent to the following: when the genus is $0$ and one of
the ramification indices is $d,$ the degree of the covers, the pure-cycle
Hurwitz number is $d^{r-3},$ where $r$ is the number of branch points.
","[{""version"":""v1"",""created"":""Sun, 22 Aug 2010 06:36:30 GMT""},{""version"":""v2"",""created"":""Tue, 7 Sep 2010 05:53:31 GMT""},{""version"":""v3"",""created"":""Mon, 2 Dec 2013 22:57:39 GMT""}]","2013-12-04"
"1008.3678","Paul Jung","Michael Aizenman, Sabine Jansen, and Paul Jung","Symmetry breaking in quasi-1D Coulomb systems","26 pages, 6 figures","Ann. Henri Poincare 11 (2010), 1453-1485","10.1007/s00023-010-0067-y",,"math-ph cond-mat.stat-mech math.MP math.PR","http://arxiv.org/licenses/nonexclusive-distrib/1.0/","  Quasi one-dimensional systems are systems of particles in domains which are
of infinite extent in one direction and of uniformly bounded size in all other
directions, e.g. on a cylinder of infinite length. The main result proven here
is that for such particle systems with Coulomb interactions and neutralizing
background, the so-called ""jellium"", at any temperature and at any finite-strip
width there is translation symmetry breaking. This extends the previous result
on Laughlin states in thin, two-dimensional strips by Jansen, Lieb and Seiler
(2009). The structural argument which is used here bypasses the question of
whether the translation symmetry breaking is manifest already at the level of
the one particle density function. It is akin to that employed by Aizenman and
Martin (1980) for a similar statement concerning symmetry breaking at all
temperatures in strictly one-dimensional Coulomb systems. The extension is
enabled through bounds which establish tightness of finite-volume charge
fluctuations.
","[{""version"":""v1"",""created"":""Sun, 22 Aug 2010 06:41:13 GMT""},{""version"":""v2"",""created"":""Tue, 21 Sep 2010 05:19:39 GMT""}]","2011-04-07"
"1008.3679","Felikson Anna","Anna Felikson, Sergey Natanzon","Labeled double pants decompositions","16 pages, many figures",,,,"math.GT","http://arxiv.org/licenses/nonexclusive-distrib/1.0/","  A double pants decomposition of a 2-dimensional surface is a collection of
two pants decomposition of this surface introduced in arXiv:1005.0073v2. There
are two natural operations acting on double pants decompositions: flips and
handle twists. It is shown in arXiv:1005.0073v2 that the groupoid generated by
flips and handle twists acts transitively on admissible double pants
decompositions where the class of admissible decompositions has a natural
topological and combinatorial description. In this paper, we label the curves
of double pants decompositions and show that for all but one surfaces the same
groupoid acts transitively on all labeled admissible double pants
decompositions. The only exclusion is a sphere with two handles, where the
groupoid has 15 orbits.
","[{""version"":""v1"",""created"":""Sun, 22 Aug 2010 07:26:39 GMT""}]","2010-08-24"
"1008.3680","Kei-ichiro Iima","Tokuji Araya, Kei-ichiro Iima, Ryo Takahashi","On the left perpendicular category of the modules of finite projective
  dimension","6 pages; minor changes; to appear in Comm. Algebra",,,,"math.AC math.RA","http://arxiv.org/licenses/nonexclusive-distrib/1.0/","  In this paper, we characterize several properties of commutative notherian
local rings in terms of the left perpendicular category of the category of
finitely generated modules of finite projective dimension. As an application we
prove that a local ring is regular if (and only if) there exists a strong test
module for projectivity having finite projective dimension. We also obtain
corresponding results with respect to a semidualizing module.
","[{""version"":""v1"",""created"":""Sun, 22 Aug 2010 07:36:16 GMT""},{""version"":""v2"",""created"":""Fri, 22 Apr 2011 08:16:21 GMT""}]","2011-04-25"
"1008.3681","Rajender Kumar","Rajender Kumar and Brahmjit Singh","EVM as generic QoS trigger for heterogeneous wieless overlay network","12 pages, 7 figures, IJWMN 2010 august issue vol. 2, no.3","International Journal on Wireless and Mobile Networks, August 2010
  Issue volume 2, number 3, AIRCCS","10.5121/ijwmn.2010.2315",,"cs.NI cs.PF","http://arxiv.org/licenses/nonexclusive-distrib/1.0/","  Fourth Generation (4G) Wireless System will integrate heterogeneous wireless
overlay systems i.e. interworking of WLAN/ GSM/ CDMA/ WiMAX/ LTE/ etc with
guaranteed Quality of Service (QoS) and Experience (QoE).QoS(E) vary from
network to network and is application sensitive. User needs an optimal mobility
solution while roaming in Overlaid wireless environment i.e. user could
seamlessly transfer his session/ call to a best available network bearing
guaranteed Quality of Experience. And If this Seamless transfer of session is
executed between two networks having different access standards then it is
called Vertical Handover (VHO). Contemporary VHO decision algorithms are based
on generic QoS metrics viz. SNR, bandwidth, jitter, BER and delay. In this
paper, Error Vector Magnitude (EVM) is proposed to be a generic QoS trigger for
VHO execution. EVM is defined as the deviation of inphase/ quadrature (I/Q)
values from ideal signal states and thus provides a measure of signal quality.
In 4G Interoperable environment, OFDM is the leading Modulation scheme (more
prone to multi-path fading). EVM (modulation error) properly characterises the
wireless link/ channel for accurate VHO decision. EVM depends on the inherent
transmission impairments viz. frequency offset, phase noise,
non-linear-impairment, skewness etc. for a given wireless link. Paper provides
an insight to the analytical aspect of EVM & measures EVM (%) for key
management subframes like association/re-association/disassociation/ probe
request/response frames. EVM relation is explored for different possible
NAV-Network Allocation Vectors (frame duration). Finally EVM is compared with
SNR, BER and investigation concludes EVM as a promising QoS trigger for OFDM
based emerging wireless standards.
","[{""version"":""v1"",""created"":""Sun, 22 Aug 2010 07:55:24 GMT""}]","2010-08-24"
"1008.3682","Jinchuan Hou","Xiaofei Qi and Jinchuan Hou","Positive finite rank elementary operators and characterizing
  entanglement of states","26 pages","J. Phys. A: Math. Theor. 44 (2011) 215305","10.1088/1751-8113/44/21/215305",,"quant-ph math.OA","http://arxiv.org/licenses/nonexclusive-distrib/1.0/","  In this paper, a class of indecomposable positive finite rank elementary
operators of order $(n,n)$ are constructed. This allows us to give a simple
necessary and sufficient criterion for separability of pure states in bipartite
systems of any dimension in terms of positive elementary operators of order
$(2,2)$ and get some new mixed entangled states that can not be detected by the
positive partial transpose (PPT) criterion and the realignment criterion.
","[{""version"":""v1"",""created"":""Sun, 22 Aug 2010 08:05:44 GMT""},{""version"":""v2"",""created"":""Wed, 1 Sep 2010 08:12:14 GMT""}]","2011-07-05"
