"1008.3683","Jianquan Ge","Jianquan Ge and Zizhou Tang","Chern conjecture and isoparametric hypersurfaces","to appear in ""Differential Geometry-under the influence of
  S.S.Chern"", edited by Y.B.Shen, Z.M.Shen, S.T.Yau, Higher Education Press and
  International Press, Beijing-Boston, 2012. arXiv admin note: text overlap
  with arXiv:0809.1433 by other author",,,,"math.HO math.DG","http://arxiv.org/licenses/nonexclusive-distrib/1.0/","  In this note we will review the most important results and questions related
to Chern conjecture and isoparametric hypersurfaces, as well as their
interactions and applications to various aspects in mathematics.
","[{""version"":""v1"",""created"":""Sun, 22 Aug 2010 08:40:01 GMT""},{""version"":""v2"",""created"":""Mon, 26 Sep 2011 03:31:25 GMT""},{""version"":""v3"",""created"":""Fri, 2 Mar 2012 04:58:40 GMT""}]","2012-03-05"
"1008.3684","Wei-jie Fu","Wei-jie Fu and Yue-liang Wu","Fluctuations and Correlations of Conserved Charges near the QCD Critical
  Point","22 pages, 12 figures, version accepted by Phys. Rev. D","Phys.Rev.D82:074013,2010","10.1103/PhysRevD.82.074013",,"hep-ph","http://arxiv.org/licenses/nonexclusive-distrib/1.0/","  We study the fluctuations and correlations of conserved charges, i.e. the
baryon number, electric charge and the strangeness at finite temperature and
nonzero baryon chemical potential with an effective model. The fluctuations are
calculated up to the fourth-order and the correlations to the third-order. We
find that the second-order fluctuations and correlations have a peak or valley
structure when the chiral phase transition takes place with the increase of the
baryon chemical potential; the third-order fluctuations and correlations change
their signs during the chiral phase transition and the fourth-order
fluctuations have two maximum and one minimum. we also depict contour plots of
various fluctuations and correlations of conserved charges in the plane of
temperature and baryon chemical potential. We find that higher order
fluctuations and correlations of conserved charges are superior to the
second-order ones to be used to search for the critical point in heavy ion
collision experiments.
","[{""version"":""v1"",""created"":""Sun, 22 Aug 2010 08:45:53 GMT""},{""version"":""v2"",""created"":""Tue, 5 Oct 2010 14:30:05 GMT""}]","2010-10-27"
"1008.3685","Mircea Voineagu","Jeremiah Heller, Mircea Voineagu","Equivariant Semi-topological Invariants, Atiyah's KR-theory, and Real
  Algebraic Cycles","39 pages",,,,"math.AG","http://arxiv.org/licenses/nonexclusive-distrib/1.0/","  We establish an Atiyah-Hirzebruch type spectral sequence relating real
morphic cohomology and real semi-topological K-theory and prove it to be
compatible with the Atiyah-Hirzebruch spectral sequence relating Bredon
cohomology and Atiyah's KR-theory constructed by Dugger. An equivariant and a
real version of Suslin's conjecture on morphic cohomology are formulated,
proved to come from the complex version of Suslin conjecture and verified for
certain real varieties. In conjunction with the spectral sequences constructed
here this allows the computation of the real semi-topological K-theory of some
real varieties. As another application of this spectral sequence we give an
alternate proof of the Lichtenbaum-Quillen conjecture over $\R$, extending an
earlier proof of Karoubi and Weibel.
","[{""version"":""v1"",""created"":""Sun, 22 Aug 2010 09:00:10 GMT""}]","2010-08-24"
"1008.3686","Yu-Xiao Liu","Heng Guo, Yu-Xiao Liu, Shao-Wen Wei, Chun-E Fu","Gravity Localization and Effective Newtonian Potential for Bent Thick
  Branes","6 pages, 2 figures","Europhys. Letters 97 (2012) 60003","10.1209/0295-5075/97/60003",,"hep-th gr-qc","http://arxiv.org/licenses/nonexclusive-distrib/1.0/","  In this letter, we first investigate the gravity localization and mass
spectrum of gravity KK modes on de Sitter and Anti-de Sitter thick branes.
Then, the effective Newtonian gravitational potentials for these bent branes
are discussed by the two typical examples. The corrections of the Newtonian
potential turns out to be $\Delta U(r)\sim 1/r^{2}$ at small $r$ for both
cases. These corrections are very different from that of the Randall-Sundrum
brane model $\Delta U(r)\sim 1/r^{3}$.
","[{""version"":""v1"",""created"":""Sun, 22 Aug 2010 09:21:24 GMT""},{""version"":""v2"",""created"":""Mon, 18 Apr 2011 03:11:54 GMT""},{""version"":""v3"",""created"":""Thu, 5 Apr 2012 02:06:50 GMT""}]","2012-04-06"
"1008.3687","Lei Hao Dr.","Lei Hao and T. K. Lee","Thermopower of multilayer graphene","11 pages, 10 figures; An inconsistency between the definitions of
  Eqs. (10) and (11) is found and corrected","Phys. Rev. B 82, 245415(2010)","10.1103/PhysRevB.82.245415",,"cond-mat.mtrl-sci","http://arxiv.org/licenses/nonexclusive-distrib/1.0/","  We systematically calculate thermopower of biased and unbiased multilayer
grphene systems. The effect of screening to a bias field perpendicular to the
graphene planes is taken into account self-consistently under the Hartree
approximation. The model including nearest neighbor hopping and the more
complete Slonczewski-Weiss-McClure (SWMcC) model are both considered for a
comparison. The effect of impurity scattering is studied for monolayer and
unbiased bilayer graphene and is treated in terms of the self-consistent Born
approximation. For a monolayer graphene, only when the effect of impurity
scattering is taken into account, could all the qualitative aspects of the
experimental results be correctly reproduced. A small energy gap opens for the
biased trilayer graphene. When the carrier density is high enough, a gap is
also found for unbiased trilayer and quad-layer graphene. The biased bilayer
graphene shows the largest thermopower among all the systems studied.
","[{""version"":""v1"",""created"":""Sun, 22 Aug 2010 09:21:25 GMT""},{""version"":""v2"",""created"":""Wed, 15 Dec 2010 13:02:39 GMT""},{""version"":""v3"",""created"":""Mon, 11 Jul 2011 07:12:06 GMT""}]","2015-05-19"
"1008.3688","Ziv Rotman","Ziv Rotman and Eli Eisenberg","Direct measurements of the dynamical correlation length indicate its
  divergence at an athermal glass transition","5 pages 5 figures","Phys. Rev. Lett., 105, 225503 (2010)","10.1103/PhysRevLett.105.225503",,"cond-mat.stat-mech cond-mat.soft","http://arxiv.org/licenses/nonexclusive-distrib/1.0/","  The super-cooled $N3$ model exhibits an increasingly slow dynamics as density
approaches the model's random closest packing density. Here, we present a
direct measurement of the dynamical correlation function $G_4(r,t)$, showing
the emergence of a growing length scale $\xi_4$ across which the dynamics is
correlated. The correlation length measured, up to 120 lattice sites, power-law
diverges as the density approaches $\rho_t$, the density at which the fluid
phase of the model is predicted to terminate. It is shown that the four-point
susceptibility, often used as an agent to estimate $\xi_4$, does not depend
simply on the latter. Rather, it depends strongly on the short-range behavior
of $G_4(r,t)$. Consequently, $\chi_4$ peaks before $\xi_4$ reaches its maximal
value. The two quantities should therefore be studied independently.
","[{""version"":""v1"",""created"":""Sun, 22 Aug 2010 09:52:11 GMT""},{""version"":""v2"",""created"":""Tue, 24 Aug 2010 06:32:06 GMT""}]","2010-12-21"
"1008.3689","Shenghao Sun","Shenghao Sun","L-series of Artin stacks over finite fields","58 pages","Algebra and Number Theory, 6:1 (2012), 47-122","10.2140/ant.2012.6.47",,"math.AG math.NT","http://arxiv.org/licenses/nonexclusive-distrib/1.0/","  We reprove the Lefschetz trace formula for stacks (in the context of derived
categories and the six operations for stacks developed by Laszlo and Olsson),
and give the meromorphic continuation of L-series (in particular, zeta
functions) of Artin stacks over a finite field. We also give an upper bound for
the weights of the cohomology groups of stacks, and an ""independence of l""
result for a certain class of quotient stacks.
","[{""version"":""v1"",""created"":""Sun, 22 Aug 2010 10:18:44 GMT""},{""version"":""v2"",""created"":""Mon, 28 Mar 2011 16:51:53 GMT""}]","2012-07-10"
"1008.3690","Jorge Vitorio Pereira","David Mar\'in and Jorge Pereira","Rigid Flat Webs on the Projective Plane","1 figure. Accepted for publication in The Asian Journal of
  Mathematics",,,,"math.DG math.AG math.CA math.DS","http://arxiv.org/licenses/nonexclusive-distrib/1.0/","  This paper studies global webs on the projective plane with vanishing
curvature. The study is based on an interplay of local and global arguments.
The main local ingredient is a criterium for the regularity of the curvature at
the neighborhood of a generic point of the discriminant. The main global
ingredient, the Legendre transform, is an avatar of classical projective
duality in the realm of differential equations. We show that the Legendre
transform of what we call reduced convex foliations are webs with zero
curvature, and we exhibit a countable infinity family of convex foliations
which give rise to a family of webs with zero curvature not admitting
non-trivial deformations with zero curvature.
","[{""version"":""v1"",""created"":""Sun, 22 Aug 2010 10:18:59 GMT""},{""version"":""v2"",""created"":""Thu, 8 Mar 2012 12:52:30 GMT""}]","2012-03-09"
"1008.3691","Hossein Hajiabolhassan","Hossein Hajiabolhassan and Farokhlagha Moazami","Some New Bounds For Cover-Free Families Through Biclique Cover",,,,,"math.CO cs.DM","http://arxiv.org/licenses/nonexclusive-distrib/1.0/","  An $(r,w;d)$ cover-free family $(CFF)$ is a family of subsets of a finite set
such that the intersection of any $r$ members of the family contains at least
$d$ elements that are not in the union of any other $w$ members. The minimum
number of elements for which there exists an $(r,w;d)-CFF$ with $t$ blocks is
denoted by $N((r,w;d),t)$.
  In this paper, we show that the value of $N((r,w;d),t)$ is equal to the
$d$-biclique covering number of the bipartite graph $I_t(r,w)$ whose vertices
are all $w$- and $r$-subsets of a $t$-element set, where a $w$-subset is
adjacent to an $r$-subset if their intersection is empty. Next, we introduce
some new bounds for $N((r,w;d),t)$. For instance, we show that for $r\geq w$
and $r\geq 2$
  $$ N((r,w;1),t) \geq c{{r+w\choose w+1}+{r+w-1 \choose w+1}+ 3 {r+w-4 \choose
w-2} \over \log r} \log (t-w+1),$$ where $c$ is a constant satisfies the
well-known bound $N((r,1;1),t)\geq c\frac{r^2}{\log r}\log t$. Also, we
determine the exact value of $N((r,w;d),t)$ for some values of $d$. Finally, we
show that $N((1,1;d),4d-1)=4d-1$ whenever there exists a Hadamard matrix of
order 4d.
","[{""version"":""v1"",""created"":""Sun, 22 Aug 2010 10:31:16 GMT""},{""version"":""v2"",""created"":""Sat, 6 Aug 2011 11:58:15 GMT""}]","2011-08-09"
"1008.3692","Elahe Zohoorian Azad","Elahe Zohoorian Azad","Asymptotic Analysis of a Drop-Push Model For Percolation",,,,,"math.PR math-ph math.MP","http://arxiv.org/licenses/nonexclusive-distrib/1.0/","  In this article, we study a type of a one dimensional percolation model whose
basic features include a sequential dropping of particles on a substrate
followed by their transport via a pushing mechanism (see [S. N. Majumdar and D.
S. Dean, Phys. Rev. Ltt. A 11, 89 (2002)]). Consider an empty one dimensional
lattice with n empty sites and periodic boundary conditions (as a necklace with
n rings). Imagine then the particles which drop sequentially on this lattice,
uniformly at random on one of the n sites. Letting a site can settles at most
one particle, if a particle drops on an empty site, it stick there and
otherwise the particle moves according to a symmetric random walk until it
takes place in the first empty site it meet. We study here, the asymptotic
behavior of the arrangement of empty sites and of the total displacement of all
particles as well as the partial displacement of some particles.
","[{""version"":""v1"",""created"":""Sun, 22 Aug 2010 10:40:24 GMT""}]","2010-08-24"
"1008.3693","Evan Keane","E. F. Keane","Transient Radio Neutron Stars","16 pages, 5 figures, to be published in the proceedings of High Time
  Resolution Astrophysics IV - The Era of Extremely Large Telescopes, held on
  May 5-7, 2010, Agios Nikolaos, Crete, Greece",,,,"astro-ph.SR astro-ph.HE","http://arxiv.org/licenses/nonexclusive-distrib/1.0/","  Here I will review the high time resolution radio sky, focusing on
millisecond scales. This is primarily occupied by neutron stars, the well-known
radio pulsars and the recently identified group of transient sources known as
Rotating RAdio Transients (RRATs). The RRATs appear to be abundant in the
Galaxy, which at first glance may be difficult to reconcile with the observed
supernova rate. However, as I will discuss, it seems that the RRATs can be
explained as pulsars which are either extreme nullers, highly variable or
weak/distant. I will re-cap some recent results including a re-analysis of the
Parkes Multi-beam Pulsar Survey, which has identified several new sources, as
well as the unusual timing behaviour of RRAT J1819-1458. This leads to an
examination of where RRATs fit within the evolution of neutron stars
post-supernova.
","[{""version"":""v1"",""created"":""Sun, 22 Aug 2010 10:55:46 GMT""}]","2010-08-24"
"1008.3694","Md. Saiful Islam","Md. Saiful Islam, Md. Rafiqul Islam, Abdullah Al Mahmud, Muhammad
  Rezaul karim","Sorting Network for Reversible Logic Synthesis","4 pages, 8 figures, 2 tables","International Conference for Upcoming Engineers, Windsor
  University, Ontario, Canada, May 20-21, 2005",,,"cs.AR","http://arxiv.org/licenses/nonexclusive-distrib/1.0/","  In this paper, we have introduced an algorithm to implement a sorting network
for reversible logic synthesis based on swapping bit strings. The algorithm
first constructs a network in terms of n*n Toffoli gates read from left to
right. The number of gates in the circuit produced by our algorithm is then
reduced by template matching and removing useless gates from the network. We
have also compared the efficiency of the proposed method with the existing
ones.
","[{""version"":""v1"",""created"":""Sun, 22 Aug 2010 11:13:34 GMT""}]","2010-08-24"
"1008.3695","Clive Neal-Sturgess","Clive Neal-Sturgess","The Entropy of Morbidity Trauma and Mortality","19 pages, 9 figures, 2 tables",,,,"physics.med-ph cond-mat.stat-mech q-bio.OT","http://arxiv.org/licenses/nonexclusive-distrib/1.0/","  In this paper it is shown that statistical mechanics in the form of
thermodynamic entropy can be used as a measure of the severity of individual
injuries (AIS), and that the correct way to account for multiple injuries is to
sum the entropies. It is further shown that summing entropies according to the
Planck-Boltzmann (P-B) definition of entropy is formally the same as ISS, which
is why ISS works. Approximate values of the probabilities of fatality are used
to calculate the Gibb's entropy, which is more accurate than the P-B entropy
far from equilibrium, and are shown to be again proportional to ISS. For the
categorisation of injury using entropies it is necessary to consider the
underlying entropy of the individuals morbidity to which is added the entropy
of trauma, which then may result in death. Adding in the underlying entropy and
summing entropies of all AIS3+ values gives a more extended scale than ISS, and
so entropy is considered the preferred measure. A small scale trial is
conducted of these concepts using the APROSYS In-Depth Pedestrian database, and
the differences between the measures are illustrated. It is shown that adopting
an entropy approach to categorising injury severity highlights the position of
the elderly, who have a reduced physiological reserve to resist further
traumatic onslaught. There are other informational entropy-like measures, here
called i-entropy, which can also be used to classify injury severity, which are
outlined. A large scale trial of these various entropy or i-entropy measures
needs to be conducted to assess the usefulness of the measures. In the
meantime, an age compensated ISS measure such as ASCOT or TRISS is recommended.
","[{""version"":""v1"",""created"":""Sun, 22 Aug 2010 11:39:37 GMT""}]","2010-08-24"
"1008.3696","Gang Li","Gang Li, Feng-lan Shao and Wei Wang","$B_s\to D_s(3040)$ form factors and $B_s$ decays into $D_s(3040)$","16 pages, 6 figures","Phys.Rev.D82:094031,2010","10.1103/PhysRevD.82.094031",,"hep-ph","http://arxiv.org/licenses/nonexclusive-distrib/1.0/","  Under the assignment of $D_s(3040)$ as a radially excited p-wave $\bar cs$
state with $J^P=1^+$, we compute the $B_s\to D_s (3040)$ form factors within
the covariant light-front quark model. Two classification schemes for the
p-wave $\bar cs$ meson are adopted. We also use our results to predict the
branching ratios (BRs), polarization fractions and angular asymmetries in
semileptonic $B_s\to D_s(3040)\ell\bar\nu(\ell=e,\mu,\tau)$. The BRs are found
to have the order of $10^{-3}$ for $\ell=e,\mu$ and $10^{-5}$ for $\ell=\tau$.
We find that the polarization fractions and the angular asymmetries could be
useful to pin down the ambiguities of the quantum numbers for $D_s(3040)$. In
addition, we investigate the nonleptonic $B_s\to D_s(3040)M$ decays under the
factorization method, where $M$ denotes a charged pseudoscalar or a vector
meson. The BRs of $B_s\to D_s(3040)\rho$ and $B_s\to D_s(3040)D_s^*$ reach the
order of $10^{-3}$, while the other channels are typically smaller by 1-2
orders.
","[{""version"":""v1"",""created"":""Sun, 22 Aug 2010 12:04:59 GMT""},{""version"":""v2"",""created"":""Tue, 7 Dec 2010 01:20:41 GMT""}]","2010-12-23"
"1008.3697","Jose Fontanari","Lucas R. Peres and Jose F. Fontanari","Statistics of opinion domains of the majority-vote model on a square
  lattice",,"Phys. Rev. E 82, 046103 (2010)","10.1103/PhysRevE.82.046103",,"physics.comp-ph cond-mat.stat-mech physics.soc-ph","http://arxiv.org/licenses/nonexclusive-distrib/1.0/","  The existence of juxtaposed regions of distinct cultures in spite of the fact
that people's beliefs have a tendency to become more similar to each other's as
the individuals interact repeatedly is a puzzling phenomenon in the social
sciences. Here we study an extreme version of the frequency-dependent bias
model of social influence in which an individual adopts the opinion shared by
the majority of the members of its extended neighborhood, which includes the
individual itself. This is a variant of the majority-vote model in which the
individual retains its opinion in case there is a tie among the neighbors'
opinions. We assume that the individuals are fixed in the sites of a square
lattice of linear size $L$ and that they interact with their nearest neighbors
only.
  Within a mean-field framework, we derive the equations of motion for the
density of individuals adopting a particular opinion in the single-site and
pair approximations. Although the single-site approximation predicts a single
opinion domain that takes over the entire lattice, the pair approximation
yields a qualitatively correct picture with the coexistence of different
opinion domains and a strong dependence on the initial conditions. Extensive
Monte Carlo simulations indicate the existence of a rich distribution of
opinion domains or clusters, the number of which grows with $L^2$ whereas the
size of the largest cluster grows with $\ln L^2$. The analysis of the sizes of
the opinion domains shows that they obey a power-law distribution for not too
large sizes but that they are exponentially distributed in the limit of very
large clusters. In addition, similarly to other well-known social influence
model -- Axelrod's model -- we found that these opinion domains are unstable to
the effect of a thermal-like noise.
","[{""version"":""v1"",""created"":""Sun, 22 Aug 2010 13:29:23 GMT""}]","2010-11-05"
"1008.3698","Gerald Teschl","Alice Mikikits-Leitner and Gerald Teschl","Long-Time Asymptotics of Perturbed Finite-Gap Korteweg-de Vries
  Solutions","45 pages. arXiv admin note: substantial text overlap with
  arXiv:0705.0346","J. d'Analyse Math. 116, 163-218 (2012)","10.1007/s11854-012-0005-7",,"nlin.SI math.AP","http://arxiv.org/licenses/nonexclusive-distrib/1.0/","  We apply the method of nonlinear steepest descent to compute the long-time
asymptotics of solutions of the Korteweg--de Vries equation which are decaying
perturbations of a quasi-periodic finite-gap background solution. We compute a
nonlinear dispersion relation and show that the $x/t$ plane splits into $g+1$
soliton regions which are interlaced by $g+1$ oscillatory regions, where $g+1$
is the number of spectral gaps.
  In the soliton regions the solution is asymptotically given by a number of
solitons travelling on top of finite-gap solutions which are in the same
isospectral class as the background solution. In the oscillatory region the
solution can be described by a modulated finite-gap solution plus a decaying
dispersive tail. The modulation is given by phase transition on the isospectral
torus and is, together with the dispersive tail, explicitly characterized in
terms of Abelian integrals on the underlying hyperelliptic curve.
","[{""version"":""v1"",""created"":""Sun, 22 Aug 2010 13:45:38 GMT""},{""version"":""v2"",""created"":""Sun, 1 Apr 2012 20:14:00 GMT""}]","2012-12-11"
"1008.3699","Ruhollah Tavakoli","Ruhollah Tavakoli","Parallelizing Sequential Sweeping on Structured Grids -- Fully Parallel
  SOR/ILU preconditioners for Structured n-Diagonal Matrices",,,,,"math.NA","http://arxiv.org/licenses/nonexclusive-distrib/1.0/","  There are variety of computational algorithms need sequential sweeping;
sweeping based on specific order; on a structured grid, e.g., preconditioning
(smoothing) by SOR or ILU methods and solution of eikonal equation by fast
sweeping algorithm. Due to sequential nature, parallel implementation of these
algorithms usually leads to miss of efficiency; e.g. a significant convergence
rate decay. Therefore, there is an interest to parallelize sequential sweeping
procedures, keeping the efficiency of the original method simultaneously. This
paper goals to parallelize sequential sweeping algorithms on structured grids,
with emphasis on SOR and ILU preconditioners. The presented method can be
accounted as an overlapping domain decomposition method combined to a
multi-frontal sweeping procedure. The implementation of method in one and two
dimensions are discussed in details. The extension to higher dimensions and
general structured n-diagonal matrices is outlined. Introducing notion of
alternatively block upper-lower triangular matrices, the convergence theory is
established in general cases. Numerical results on model problems show that,
unlike related alternative parallel methods, the convergence rate and
efficiency of the presented method is close to the original sequential method.
Numerical results also support successful use of the presented method as a
cache efficient solver in sequential computations as well.
","[{""version"":""v1"",""created"":""Sun, 22 Aug 2010 13:48:28 GMT""}]","2010-08-24"
"1008.3700","Shun Maeta","Shun Maeta","The second variational formula of the k-energy and k-harmonic curves","21pages",,,,"math.DG","http://arxiv.org/licenses/nonexclusive-distrib/1.0/","  J.Eells and L. Lemaire introduced $k$-harmonic maps, and Wang Shaobo showed
the first variation formula. In this paper, we give the second variation
formula of $k$-energy, and give a notion of index, nullity and weakly stable.
We also study $k$-harmonic maps into the product Riemannian manifold, and
$k$-harmonic curves into a Riemannian manifold with constant sectional
curvature, and show their non-trivial solutions.
","[{""version"":""v1"",""created"":""Sun, 22 Aug 2010 13:53:16 GMT""}]","2010-08-24"
"1008.3701","Srikanth Iyengar","Dave Benson, Srikanth B. Iyengar, Henning Krause","Colocalizing subcategories and cosupport","38 pages; minor changes; to appear in J. Reine. Angew. Math",,,,"math.RT math.AC","http://arxiv.org/licenses/nonexclusive-distrib/1.0/","  The Hom closed colocalizing subcategories of the stable module category of a
finite group are classified. Along the way, the colocalizing subcategories of
the homotopy category of injectives over an exterior algebra, and the derived
category of a formal commutative differential graded algebra, are classified.
To this end, and with an eye towards future applications, a notion of local
homology and cosupport for triangulated categories is developed, building on
earlier work of the authors on local cohomology and support.
","[{""version"":""v1"",""created"":""Sun, 22 Aug 2010 14:51:34 GMT""},{""version"":""v2"",""created"":""Sat, 12 Feb 2011 22:39:29 GMT""}]","2011-02-15"
